,number,value,datetime_start,datetime_complete,duration,params_algorithm,params_dropout_rate,params_lr_Adadelta,params_lr_Adam,params_lr_AdamW,params_lr_SGD,params_momentum_SGD,params_nesterov_SGD,params_suggested_freeze,params_weight_decay_Adadelta,params_weight_decay_Adam,params_weight_decay_AdamW,params_weight_decay_SGD,state
1599,1599,33.333333333333336,2025-05-25 20:33:24.968321,2025-05-25 20:33:36.176492,0 days 00:00:11.208171,AdamW,0.25641003961989367,,,0.005395132428804024,,,,3,,,0.002208977904910516,,PRUNED
1600,1600,35.416666666666664,2025-05-25 20:33:36.228798,2025-05-25 20:33:47.229080,0 days 00:00:11.000282,AdamW,0.22397113480255762,,,0.0002770150915280705,,,,3,,,0.00040104425273556444,,PRUNED
1601,1601,33.333333333333336,2025-05-25 20:33:47.276844,2025-05-25 20:33:58.348000,0 days 00:00:11.071156,AdamW,0.21739457038822055,,,0.00020984231314046157,,,,4,,,0.0024688464395084863,,PRUNED
1602,1602,52.083333333333336,2025-05-25 20:33:58.398557,2025-05-25 20:34:09.727991,0 days 00:00:11.329434,AdamW,0.24722619537615553,,,0.0003437425482331197,,,,2,,,0.00044767784446834676,,PRUNED
1603,1603,33.333333333333336,2025-05-25 20:34:09.778394,2025-05-25 20:34:20.912570,0 days 00:00:11.134176,AdamW,0.2729795372752742,,,0.0004112881875895817,,,,5,,,0.003067847914194534,,PRUNED
1604,1604,75.0,2025-05-25 20:34:20.963791,2025-05-25 20:34:42.057876,0 days 00:00:21.094085,AdamW,0.21878425435867507,,,0.0001802268835899481,,,,2,,,0.0005704887936143181,,COMPLETE
1605,1605,33.333333333333336,2025-05-25 20:34:42.114907,2025-05-25 20:34:54.150995,0 days 00:00:12.036088,AdamW,0.21311429596834733,,,0.00023853253784950832,,,,2,,,0.0006480048306775807,,PRUNED
1606,1606,47.916666666666664,2025-05-25 20:34:54.202669,2025-05-25 20:35:06.272541,0 days 00:00:12.069872,AdamW,0.21903784099622534,,,0.00019912608231239886,,,,2,,,0.0006003926786517399,,PRUNED
1607,1607,33.333333333333336,2025-05-25 20:35:06.324279,2025-05-25 20:35:18.289152,0 days 00:00:11.964873,AdamW,0.20728768426587924,,,0.00030271895104498414,,,,2,,,0.0005825917975599317,,PRUNED
1608,1608,,2025-05-25 20:35:18.340741,2025-05-25 20:35:29.058798,0 days 00:00:10.718057,SGD,0.21548266114760486,,,,9.741802102900819e-05,22.018482549077714,True,2,,,,34.99492061363685,PRUNED
1609,1609,35.416666666666664,2025-05-25 20:35:29.108731,2025-05-25 20:35:41.105043,0 days 00:00:11.996312,AdamW,0.20751701741772163,,,0.00024055723825387412,,,,2,,,0.0005717075341726943,,PRUNED
1610,1610,33.333333333333336,2025-05-25 20:35:41.157131,2025-05-25 20:35:53.188474,0 days 00:00:12.031343,AdamW,0.22278677165298827,,,0.00018576940014154204,,,,2,,,0.0006614160567781504,,PRUNED
1611,1611,50.0,2025-05-25 20:35:53.238625,2025-05-25 20:36:05.089925,0 days 00:00:11.851300,AdamW,0.19926682881217744,,,0.0002201281656088582,,,,2,,,0.0005221655358317519,,PRUNED
1612,1612,43.75,2025-05-25 20:36:05.140872,2025-05-25 20:36:17.021358,0 days 00:00:11.880486,AdamW,0.20251472780141835,,,0.00019113514661233736,,,,2,,,0.0005585715654503122,,PRUNED
1613,1613,33.333333333333336,2025-05-25 20:36:17.073152,2025-05-25 20:36:29.146318,0 days 00:00:12.073166,AdamW,0.22864918975361187,,,0.00030440238681819613,,,,2,,,0.0005304029508338096,,PRUNED
1614,1614,31.25,2025-05-25 20:36:29.198603,2025-05-25 20:36:41.001227,0 days 00:00:11.802624,Adam,0.21233050139705242,,0.0001117827076413338,,,,,2,,0.0973021813856242,,,PRUNED
1615,1615,33.333333333333336,2025-05-25 20:36:41.053094,2025-05-25 20:36:52.700730,0 days 00:00:11.647636,AdamW,0.21958559256333232,,,0.00024028655520859466,,,,2,,,0.0008229777103193293,,PRUNED
1616,1616,41.666666666666664,2025-05-25 20:36:52.751983,2025-05-25 20:37:04.325662,0 days 00:00:11.573679,AdamW,0.20212012138175656,,,0.00017026828794065136,,,,2,,,0.0006862357230348566,,PRUNED
1617,1617,37.5,2025-05-25 20:37:04.376753,2025-05-25 20:37:15.950051,0 days 00:00:11.573298,AdamW,0.18984184408819393,,,0.00018268185461668162,,,,2,,,0.000621871962011431,,PRUNED
1618,1618,33.333333333333336,2025-05-25 20:37:16.002646,2025-05-25 20:37:27.611027,0 days 00:00:11.608381,AdamW,0.22621172272025714,,,0.0003015153012768978,,,,2,,,0.0004919972544001679,,PRUNED
1619,1619,33.333333333333336,2025-05-25 20:37:27.661970,2025-05-25 20:37:39.210523,0 days 00:00:11.548553,Adadelta,0.19495007988823523,0.09562231858771529,,,,,,2,0.4582027321863173,,,,PRUNED
1620,1620,33.333333333333336,2025-05-25 20:37:39.261772,2025-05-25 20:37:50.998652,0 days 00:00:11.736880,AdamW,0.2170009172900613,,,0.00020828560833632365,,,,2,,,0.0007352283797077937,,PRUNED
1621,1621,33.333333333333336,2025-05-25 20:37:51.049860,2025-05-25 20:38:02.938544,0 days 00:00:11.888684,AdamW,0.20955018478346601,,,0.00039479542617919,,,,2,,,0.0005639979170655365,,PRUNED
1622,1622,33.333333333333336,2025-05-25 20:38:02.993725,2025-05-25 20:38:14.840330,0 days 00:00:11.846605,AdamW,0.43799504271524586,,,3.9265528526421255e-05,,,,2,,,0.0005066996904123924,,PRUNED
1623,1623,33.333333333333336,2025-05-25 20:38:14.897014,2025-05-25 20:38:26.653147,0 days 00:00:11.756133,AdamW,0.18464706620291282,,,0.0002639172010328413,,,,2,,,0.00046486078236998655,,PRUNED
1624,1624,52.083333333333336,2025-05-25 20:38:26.708167,2025-05-25 20:38:38.153088,0 days 00:00:11.444921,AdamW,0.3745081341577261,,,1.9798748748827512e-05,,,,2,,,0.0005742520155534807,,PRUNED
1625,1625,43.75,2025-05-25 20:38:38.207902,2025-05-25 20:38:49.749223,0 days 00:00:11.541321,AdamW,0.22549500669422898,,,0.00016980197597306996,,,,2,,,0.0004950500933677289,,PRUNED
1626,1626,33.333333333333336,2025-05-25 20:38:49.805032,2025-05-25 20:39:01.665776,0 days 00:00:11.860744,AdamW,0.19623057660424498,,,0.00021362739778664518,,,,2,,,0.0005499963953034043,,PRUNED
1627,1627,45.833333333333336,2025-05-25 20:39:01.721007,2025-05-25 20:39:13.546531,0 days 00:00:11.825524,AdamW,0.20871590468820145,,,0.0001676563545891437,,,,2,,,0.0006416846429776449,,PRUNED
1628,1628,33.333333333333336,2025-05-25 20:39:13.600697,2025-05-25 20:39:25.424856,0 days 00:00:11.824159,AdamW,0.2208725658707217,,,0.0003566793022330345,,,,3,,,0.0004760664016733474,,PRUNED
1629,1629,50.0,2025-05-25 20:39:25.480625,2025-05-25 20:39:37.370979,0 days 00:00:11.890354,AdamW,0.2005828730572811,,,5.926085242788923e-05,,,,2,,,0.0004249957572176068,,PRUNED
1630,1630,33.333333333333336,2025-05-25 20:39:37.425158,2025-05-25 20:39:49.301251,0 days 00:00:11.876093,AdamW,0.29460195994048877,,,0.000265630830423183,,,,3,,,0.0005275504140565448,,PRUNED
1631,1631,29.166666666666668,2025-05-25 20:39:49.342887,2025-05-25 20:40:01.248312,0 days 00:00:11.905425,AdamW,0.18281160585411335,,,0.00022777667045777153,,,,2,,,0.00036052736175068016,,PRUNED
1632,1632,45.833333333333336,2025-05-25 20:40:01.303843,2025-05-25 20:40:13.286431,0 days 00:00:11.982588,AdamW,0.22931190283435746,,,0.0001734215521791538,,,,2,,,0.0006013149244359019,,PRUNED
1633,1633,43.75,2025-05-25 20:40:13.341197,2025-05-25 20:40:25.101371,0 days 00:00:11.760174,AdamW,0.21055996923439335,,,7.451248174394642e-05,,,,3,,,0.0007530428283620466,,PRUNED
1634,1634,39.583333333333336,2025-05-25 20:40:25.155955,2025-05-25 20:40:36.846377,0 days 00:00:11.690422,AdamW,0.1902659312770583,,,0.00014751901365920079,,,,2,,,0.00046326481602903895,,PRUNED
1635,1635,33.333333333333336,2025-05-25 20:40:36.900722,2025-05-25 20:40:48.574342,0 days 00:00:11.673620,AdamW,0.3574139244840715,,,0.0007433460587477756,,,,3,,,0.0003923912621779034,,PRUNED
1636,1636,,2025-05-25 20:40:48.629039,2025-05-25 20:40:59.269396,0 days 00:00:10.640357,SGD,0.3396471250111957,,,,0.0022908632739509723,69.62541539017326,False,2,,,,1.4695770022590358,PRUNED
1637,1637,45.833333333333336,2025-05-25 20:40:59.322269,2025-05-25 20:41:10.594119,0 days 00:00:11.271850,AdamW,0.17594506416519645,,,0.0002182041985967222,,,,6,,,0.0005158384333102132,,PRUNED
1638,1638,33.333333333333336,2025-05-25 20:41:10.644694,2025-05-25 20:41:22.621264,0 days 00:00:11.976570,AdamW,0.2327703578702965,,,0.047811373718663785,,,,0,,,0.0004192236458421023,,PRUNED
1639,1639,33.333333333333336,2025-05-25 20:41:22.675761,2025-05-25 20:41:34.521383,0 days 00:00:11.845622,Adam,0.310271885170987,,0.0002497426761769613,,,,,3,,6.529202891337881,,,PRUNED
1640,1640,39.583333333333336,2025-05-25 20:41:34.761823,2025-05-25 20:41:46.542961,0 days 00:00:11.781138,AdamW,0.44667828717679503,,,5.4398499602870206e-05,,,,4,,,0.003633688302680273,,PRUNED
1641,1641,33.333333333333336,2025-05-25 20:41:46.597194,2025-05-25 20:41:58.553240,0 days 00:00:11.956046,AdamW,0.20237271826441922,,,0.0001881292067444139,,,,0,,,0.00028336541470231074,,PRUNED
1642,1642,43.75,2025-05-25 20:41:58.607286,2025-05-25 20:42:10.722499,0 days 00:00:12.115213,AdamW,0.2192204006249611,,,0.0003022278861697592,,,,2,,,0.00046020167503367743,,PRUNED
1643,1643,33.333333333333336,2025-05-25 20:42:10.777082,2025-05-25 20:42:22.517019,0 days 00:00:11.739937,Adadelta,0.19082973210329846,4.358627060989723,,,,,,2,0.01567440534283155,,,,PRUNED
1644,1644,33.333333333333336,2025-05-25 20:42:22.572180,2025-05-25 20:42:34.451436,0 days 00:00:11.879256,AdamW,0.2358845423050647,,,0.0004899753778268524,,,,0,,,0.0003404753431480971,,PRUNED
1645,1645,37.5,2025-05-25 20:42:34.505546,2025-05-25 20:42:46.060786,0 days 00:00:11.555240,AdamW,0.2155665974461832,,,0.0001557424663300804,,,,2,,,0.001159020134405508,,PRUNED
1646,1646,33.333333333333336,2025-05-25 20:42:46.115742,2025-05-25 20:42:57.719496,0 days 00:00:11.603754,AdamW,0.17877703300677067,,,6.530449735843628e-05,,,,3,,,0.0005965980527759124,,PRUNED
1647,1647,33.333333333333336,2025-05-25 20:42:57.775966,2025-05-25 20:43:09.222772,0 days 00:00:11.446806,AdamW,0.2056859693368401,,,0.0001456787140739898,,,,0,,,0.00037783985277795837,,PRUNED
1648,1648,33.333333333333336,2025-05-25 20:43:09.276912,2025-05-25 20:43:21.037255,0 days 00:00:11.760343,AdamW,0.4199325855157598,,,0.0022940974627944054,,,,2,,,0.0005480549727433684,,PRUNED
1649,1649,39.583333333333336,2025-05-25 20:43:21.091600,2025-05-25 20:43:32.740562,0 days 00:00:11.648962,AdamW,0.47066151262609185,,,8.269012796876159e-05,,,,2,,,0.00048991950219663,,PRUNED
1650,1650,33.333333333333336,2025-05-25 20:43:32.794536,2025-05-25 20:43:44.456610,0 days 00:00:11.662074,AdamW,0.19644108713394814,,,0.00023341120198593204,,,,3,,,0.0035232488007250888,,PRUNED
1651,1651,41.666666666666664,2025-05-25 20:43:44.519026,2025-05-25 20:43:56.064160,0 days 00:00:11.545134,AdamW,0.23315597472401586,,,0.00017152624833934442,,,,0,,,0.0004303446747447229,,PRUNED
1652,1652,33.333333333333336,2025-05-25 20:43:56.113220,2025-05-25 20:44:07.493126,0 days 00:00:11.379906,AdamW,0.3020904128465914,,,0.00012751231135593765,,,,2,,,0.0006927255131396527,,PRUNED
1653,1653,52.083333333333336,2025-05-25 20:44:07.540143,2025-05-25 20:44:19.162185,0 days 00:00:11.622042,AdamW,0.21387676884751006,,,0.00019516805239109042,,,,0,,,0.003178270110559648,,PRUNED
1654,1654,45.833333333333336,2025-05-25 20:44:19.214094,2025-05-25 20:44:31.052321,0 days 00:00:11.838227,AdamW,0.2820161693643364,,,0.00026352397170726125,,,,5,,,0.0003118675796241152,,PRUNED
1655,1655,37.5,2025-05-25 20:44:31.103245,2025-05-25 20:44:42.966411,0 days 00:00:11.863166,AdamW,0.1854526353948206,,,8.174507193276986e-05,,,,3,,,0.00045210352383936883,,PRUNED
1656,1656,,2025-05-25 20:44:43.017570,2025-05-25 20:44:53.823149,0 days 00:00:10.805579,SGD,0.4038287739036401,,,,0.0002740660322167067,26.703332546637597,True,2,,,,22.065962603294576,PRUNED
1657,1657,43.75,2025-05-25 20:44:53.873503,2025-05-25 20:45:05.622334,0 days 00:00:11.748831,AdamW,0.193069874463182,,,0.00010629781888073564,,,,4,,,0.0003995741426503396,,PRUNED
1658,1658,43.75,2025-05-25 20:45:05.674255,2025-05-25 20:45:17.471884,0 days 00:00:11.797629,AdamW,0.22402749069875197,,,4.668950899199359e-05,,,,0,,,0.000510894856125992,,PRUNED
1659,1659,33.333333333333336,2025-05-25 20:45:17.523341,2025-05-25 20:45:29.322027,0 days 00:00:11.798686,AdamW,0.20420101198278243,,,0.00014572595573006332,,,,2,,,0.004078549364031236,,PRUNED
1660,1660,33.333333333333336,2025-05-25 20:45:29.374426,2025-05-25 20:45:41.041675,0 days 00:00:11.667249,AdamW,0.16911500946675284,,,0.00036011286053634937,,,,2,,,0.00286399852754304,,PRUNED
1661,1661,22.916666666666668,2025-05-25 20:45:41.093105,2025-05-25 20:45:52.198676,0 days 00:00:11.105571,AdamW,0.23838713444892703,,,6.762824390307768e-05,,,,8,,,0.0006191304687526634,,PRUNED
1662,1662,33.333333333333336,2025-05-25 20:45:52.245886,2025-05-25 20:46:04.069671,0 days 00:00:11.823785,Adam,0.22135201341209504,,3.580122424557042e-05,,,,,3,,0.010023509565651375,,,PRUNED
1663,1663,33.333333333333336,2025-05-25 20:46:04.121367,2025-05-25 20:46:15.807987,0 days 00:00:11.686620,AdamW,0.32335547048650115,,,0.00019436447798202937,,,,0,,,0.0005421022155431099,,PRUNED
1664,1664,50.0,2025-05-25 20:46:15.860404,2025-05-25 20:46:27.654061,0 days 00:00:11.793657,AdamW,0.18253568737082423,,,9.076428157967749e-05,,,,2,,,0.0031595337166351275,,PRUNED
1665,1665,33.333333333333336,2025-05-25 20:46:27.708700,2025-05-25 20:46:39.606956,0 days 00:00:11.898256,AdamW,0.3841031222420808,,,0.00012217264473956497,,,,0,,,0.0003485787675534137,,PRUNED
1666,1666,33.333333333333336,2025-05-25 20:46:39.662772,2025-05-25 20:46:51.265089,0 days 00:00:11.602317,Adadelta,0.2132743940273342,5.607010365663885,,,,,,2,1.4971249512287017,,,,PRUNED
1667,1667,33.333333333333336,2025-05-25 20:46:51.318254,2025-05-25 20:47:02.785078,0 days 00:00:11.466824,AdamW,0.22845302261616393,,,0.00016122654586640114,,,,4,,,0.0027114556399354946,,PRUNED
1668,1668,33.333333333333336,2025-05-25 20:47:02.838370,2025-05-25 20:47:14.257949,0 days 00:00:11.419579,AdamW,0.45696505208574123,,,0.0002605475753271421,,,,3,,,0.00048030113157150394,,PRUNED
1669,1669,43.75,2025-05-25 20:47:14.312016,2025-05-25 20:47:25.822225,0 days 00:00:11.510209,AdamW,0.19716122020861543,,,7.99972337065597e-05,,,,0,,,0.0008648946620836761,,PRUNED
1670,1670,52.083333333333336,2025-05-25 20:47:25.876640,2025-05-25 20:47:37.247769,0 days 00:00:11.371129,AdamW,0.4842845448943059,,,9.584042413886387e-05,,,,2,,,0.0003785555977004341,,PRUNED
1671,1671,45.833333333333336,2025-05-25 20:47:37.301334,2025-05-25 20:47:48.715073,0 days 00:00:11.413739,AdamW,0.17347140391447977,,,0.0001370304243477819,,,,2,,,0.0034618526492106107,,PRUNED
1672,1672,35.416666666666664,2025-05-25 20:47:48.770397,2025-05-25 20:47:59.541460,0 days 00:00:10.771063,AdamW,0.2429309583688968,,,0.00021829513664530718,,,,0,,,0.00041511051072880127,,PRUNED
1673,1673,33.333333333333336,2025-05-25 20:47:59.595479,2025-05-25 20:48:11.162108,0 days 00:00:11.566629,AdamW,0.20619682709095735,,,0.00032494902616862244,,,,3,,,0.00291764371297711,,PRUNED
1674,1674,41.666666666666664,2025-05-25 20:48:11.216118,2025-05-25 20:48:22.533622,0 days 00:00:11.317504,AdamW,0.22385814020993366,,,0.00011110487883528784,,,,2,,,0.0005693036373088261,,PRUNED
1675,1675,52.083333333333336,2025-05-25 20:48:22.586416,2025-05-25 20:48:33.803502,0 days 00:00:11.217086,AdamW,0.289228545108516,,,0.0001850444009398848,,,,3,,,0.0003170934306184229,,PRUNED
1676,1676,35.416666666666664,2025-05-25 20:48:33.855340,2025-05-25 20:48:45.137939,0 days 00:00:11.282599,AdamW,0.18806706385572133,,,7.290217154835061e-05,,,,5,,,0.00043201176923329435,,PRUNED
1677,1677,33.333333333333336,2025-05-25 20:48:45.189934,2025-05-25 20:48:56.658259,0 days 00:00:11.468325,AdamW,0.240350797841779,,,0.00014002366551745633,,,,0,,,0.00019651801004879046,,PRUNED
1678,1678,31.25,2025-05-25 20:48:56.710347,2025-05-25 20:49:07.755223,0 days 00:00:11.044876,AdamW,0.43263712727884224,,,0.00010755167448725952,,,,2,,,0.0026345960850129983,,PRUNED
1679,1679,33.333333333333336,2025-05-25 20:49:07.802087,2025-05-25 20:49:19.006653,0 days 00:00:11.204566,AdamW,0.19808026359867237,,,0.0002891885340490392,,,,3,,,0.0005222518743819154,,PRUNED
1680,1680,,2025-05-25 20:49:19.054126,2025-05-25 20:49:29.444805,0 days 00:00:10.390679,SGD,0.3497292361168929,,,,0.005001739384278546,61.938273146291266,False,2,,,,0.9814589303520115,PRUNED
1681,1681,33.333333333333336,2025-05-25 20:49:29.494150,2025-05-25 20:49:41.067443,0 days 00:00:11.573293,AdamW,0.17764971476699423,,,8.522126216799704e-05,,,,0,,,0.000446862559870649,,PRUNED
1682,1682,39.583333333333336,2025-05-25 20:49:41.120321,2025-05-25 20:49:52.704343,0 days 00:00:11.584022,AdamW,0.21383475393849882,,,0.00016413908757352652,,,,4,,,0.004409584200697773,,PRUNED
1683,1683,37.5,2025-05-25 20:49:52.754815,2025-05-25 20:50:04.171029,0 days 00:00:11.416214,AdamW,0.23206624260458933,,,5.622193131028137e-05,,,,2,,,0.0031428104623906954,,PRUNED
1684,1684,41.666666666666664,2025-05-25 20:50:04.221624,2025-05-25 20:50:15.537267,0 days 00:00:11.315643,AdamW,0.33408269229290133,,,0.00021521842524197362,,,,2,,,0.0003543017890758718,,PRUNED
1685,1685,54.166666666666664,2025-05-25 20:50:15.591395,2025-05-25 20:50:26.424196,0 days 00:00:10.832801,AdamW,0.16777763081268188,,,0.00013388406754811954,,,,6,,,0.0006433762166982032,,PRUNED
1686,1686,35.416666666666664,2025-05-25 20:50:26.474011,2025-05-25 20:50:37.590443,0 days 00:00:11.116432,AdamW,0.205402426855372,,,9.530583323755275e-05,,,,0,,,0.0028418688025048247,,PRUNED
1687,1687,33.333333333333336,2025-05-25 20:50:37.646759,2025-05-25 20:50:48.937610,0 days 00:00:11.290851,AdamW,0.3979107461288039,,,0.019166769613276607,,,,3,,,0.0004812580087985953,,PRUNED
1688,1688,33.333333333333336,2025-05-25 20:50:48.988973,2025-05-25 20:51:00.163399,0 days 00:00:11.174426,Adam,0.3714631823987129,,0.09939044585478217,,,,,2,,1.4816680783624019,,,PRUNED
1689,1689,33.333333333333336,2025-05-25 20:51:00.214451,2025-05-25 20:51:11.238168,0 days 00:00:11.023717,AdamW,0.25037141132281193,,,0.00012059124514179197,,,,0,,,0.0012674257278337082,,PRUNED
1690,1690,41.666666666666664,2025-05-25 20:51:11.289629,2025-05-25 20:51:22.205424,0 days 00:00:10.915795,Adadelta,0.21861759727930852,0.4501774161810997,,,,,,3,29.689121955822692,,,,PRUNED
1691,1691,37.5,2025-05-25 20:51:22.252715,2025-05-25 20:51:32.788521,0 days 00:00:10.535806,AdamW,0.19014707833681813,,,0.00024257136663512836,,,,7,,,0.00038165622539014884,,PRUNED
1692,1692,33.333333333333336,2025-05-25 20:51:32.832123,2025-05-25 20:51:44.036796,0 days 00:00:11.204673,AdamW,0.23600882546736088,,,6.668042727905744e-05,,,,2,,,0.00011575155448847167,,PRUNED
1693,1693,33.333333333333336,2025-05-25 20:51:44.087152,2025-05-25 20:51:55.356086,0 days 00:00:11.268934,AdamW,0.2822627675569989,,,0.0004011644678997053,,,,0,,,0.0034992474132403916,,PRUNED
1694,1694,33.333333333333336,2025-05-25 20:51:55.408551,2025-05-25 20:52:06.535198,0 days 00:00:11.126647,AdamW,0.2662400930880535,,,0.00017182126159878856,,,,2,,,0.002539018083943924,,PRUNED
1695,1695,33.333333333333336,2025-05-25 20:52:06.591017,2025-05-25 20:52:17.617054,0 days 00:00:11.026037,AdamW,0.22566970263290806,,,0.00011249272062719662,,,,4,,,0.0005952827408204124,,PRUNED
1696,1696,33.333333333333336,2025-05-25 20:52:17.671514,2025-05-25 20:52:28.748313,0 days 00:00:11.076799,AdamW,0.18076975994249928,,,0.00014686796156843123,,,,2,,,0.0004081702256633558,,PRUNED
1697,1697,37.5,2025-05-25 20:52:28.800410,2025-05-25 20:52:39.821399,0 days 00:00:11.020989,AdamW,0.19895289493841287,,,8.328963887745685e-05,,,,0,,,0.0005533178874190749,,PRUNED
1698,1698,66.66666666666667,2025-05-25 20:52:39.873595,2025-05-25 20:52:54.717319,0 days 00:00:14.843724,AdamW,0.315458738987403,,,0.00020272828027255308,,,,3,,,0.0004925627158760506,,PRUNED
1699,1699,33.333333333333336,2025-05-25 20:52:54.770052,2025-05-25 20:53:06.131132,0 days 00:00:11.361080,AdamW,0.412439537733953,,,9.361004626056154e-05,,,,2,,,0.0028494490421262777,,PRUNED
1700,1700,33.333333333333336,2025-05-25 20:53:06.181823,2025-05-25 20:53:17.340865,0 days 00:00:11.159042,AdamW,0.20935560701032704,,,0.00026444896678198127,,,,0,,,0.00382998490705358,,PRUNED
1701,1701,39.583333333333336,2025-05-25 20:53:17.392590,2025-05-25 20:53:28.613930,0 days 00:00:11.221340,AdamW,0.3020593133853616,,,0.00012693893321089254,,,,2,,,0.0025024131179222546,,PRUNED
1702,1702,47.916666666666664,2025-05-25 20:53:28.668812,2025-05-25 20:53:39.787506,0 days 00:00:11.118694,AdamW,0.42728269841797,,,0.0001544206121065616,,,,3,,,0.00045348050777111593,,PRUNED
1703,1703,50.0,2025-05-25 20:53:39.839702,2025-05-25 20:53:50.891173,0 days 00:00:11.051471,AdamW,0.1628005454330912,,,7.132533835661638e-05,,,,0,,,0.0027302935297818373,,PRUNED
1704,1704,33.333333333333336,2025-05-25 20:53:50.943806,2025-05-25 20:54:01.941505,0 days 00:00:10.997699,SGD,0.24716022975253535,,,,0.009102849525658811,9.532496782972139,True,5,,,,0.033640901272419595,PRUNED
1705,1705,50.0,2025-05-25 20:54:01.992061,2025-05-25 20:54:13.080003,0 days 00:00:11.087942,AdamW,0.19108842370867662,,,0.0001870681277300921,,,,2,,,0.0003274815182622472,,PRUNED
1706,1706,37.5,2025-05-25 20:54:13.132933,2025-05-25 20:54:24.283579,0 days 00:00:11.150646,AdamW,0.2350666451353066,,,0.00010525703247832221,,,,2,,,0.0007207875332381298,,PRUNED
1707,1707,33.333333333333336,2025-05-25 20:54:24.330459,2025-05-25 20:54:35.446905,0 days 00:00:11.116446,AdamW,0.22132354566209436,,,0.0003227945518097175,,,,3,,,0.0032490081414055815,,PRUNED
1708,1708,35.416666666666664,2025-05-25 20:54:35.508257,2025-05-25 20:54:46.922194,0 days 00:00:11.413937,AdamW,0.4463193173088509,,,0.00013570881034501714,,,,0,,,0.00039183097792443053,,PRUNED
1709,1709,33.333333333333336,2025-05-25 20:54:46.975350,2025-05-25 20:54:58.163893,0 days 00:00:11.188543,AdamW,0.17133664221988523,,,0.00022402945758462548,,,,2,,,0.0002871637348367543,,PRUNED
1710,1710,33.333333333333336,2025-05-25 20:54:58.214370,2025-05-25 20:55:09.550022,0 days 00:00:11.335652,AdamW,0.20404199387538008,,,0.0005750913489240856,,,,0,,,0.0023805874649881903,,PRUNED
1711,1711,33.333333333333336,2025-05-25 20:55:09.604971,2025-05-25 20:55:20.813401,0 days 00:00:11.208430,AdamW,0.3610080706065197,,,9.944655854598431e-05,,,,2,,,0.0005056447144726956,,PRUNED
