,number,value,datetime_start,datetime_complete,duration,params_algorithm,params_dropout_rate,params_lr_Adadelta,params_lr_Adam,params_lr_AdamW,params_lr_SGD,params_momentum_SGD,params_nesterov_SGD,params_suggested_freeze,params_weight_decay_Adadelta,params_weight_decay_Adam,params_weight_decay_AdamW,params_weight_decay_SGD,state
228,228,,2025-05-25 13:11:46.367730,2025-05-25 13:12:04.748065,0 days 00:00:18.380335,SGD,0.36483993104717793,,,,8.112497105754181e-05,59.651354807447824,True,1,,,,0.04384794499101106,PRUNED
229,229,20.833333333333332,2025-05-25 13:12:04.792816,2025-05-25 13:12:24.599576,0 days 00:00:19.806760,Adam,0.18773464130112236,,1.035416318946299e-05,,,,,0,,0.026951471684866155,,,PRUNED
230,230,33.333333333333336,2025-05-25 13:12:24.636800,2025-05-25 13:12:44.924863,0 days 00:00:20.288063,AdamW,0.15416209609683956,,,0.000109433046715591,,,,2,,,0.0004929197529926263,,PRUNED
231,231,33.333333333333336,2025-05-25 13:12:44.963283,2025-05-25 13:13:04.591317,0 days 00:00:19.628034,Adam,0.25612043648160715,,0.00017555727653243718,,,,,1,,0.857761004806722,,,PRUNED
232,232,35.416666666666664,2025-05-25 13:13:04.628085,2025-05-25 13:13:24.284972,0 days 00:00:19.656887,Adam,0.001000103891330633,,0.00012610880379826524,,,,,1,,2.111654377038311,,,PRUNED
233,233,37.5,2025-05-25 13:13:24.324256,2025-05-25 13:13:43.876708,0 days 00:00:19.552452,Adam,0.24425048976418434,,2.6258439726809904e-05,,,,,2,,0.09765477181876751,,,PRUNED
234,234,37.5,2025-05-25 13:13:43.924030,2025-05-25 13:14:03.544279,0 days 00:00:19.620249,Adam,0.24486218670991103,,0.00031838934071501493,,,,,1,,0.6874656118960356,,,PRUNED
235,235,54.166666666666664,2025-05-25 13:14:03.581059,2025-05-25 13:14:25.355540,0 days 00:00:21.774481,AdamW,0.27074322324684175,,,0.000156066226197548,,,,5,,,0.00251158699367695,,PRUNED
236,236,37.5,2025-05-25 13:14:25.392390,2025-05-25 13:14:45.275762,0 days 00:00:19.883372,AdamW,0.17440512735388464,,,9.258886115938258e-05,,,,1,,,0.0017292138014454214,,PRUNED
237,237,37.5,2025-05-25 13:14:45.323938,2025-05-25 13:15:04.833164,0 days 00:00:19.509226,AdamW,0.2564192216925575,,,0.00012891806714434206,,,,6,,,0.0035910078184650186,,PRUNED
238,238,33.333333333333336,2025-05-25 13:15:04.875507,2025-05-25 13:15:24.600220,0 days 00:00:19.724713,AdamW,0.22190640639372083,,,0.00020323873956625045,,,,0,,,0.0019042104385789955,,PRUNED
239,239,37.5,2025-05-25 13:15:24.636382,2025-05-25 13:15:44.150056,0 days 00:00:19.513674,AdamW,0.40469354498113774,,,7.813728783060054e-05,,,,2,,,0.0004130964412746184,,PRUNED
240,240,43.75,2025-05-25 13:15:44.186013,2025-05-25 13:16:03.749926,0 days 00:00:19.563913,AdamW,0.09010049516565766,,,3.437290257739141e-05,,,,4,,,0.0030352911279308255,,PRUNED
241,241,33.333333333333336,2025-05-25 13:16:03.785713,2025-05-25 13:16:23.582653,0 days 00:00:19.796940,Adadelta,0.4946912074642884,0.010778689781522872,,,,,,3,21.630120336341943,,,,PRUNED
242,242,31.25,2025-05-25 13:16:23.629329,2025-05-25 13:16:43.323577,0 days 00:00:19.694248,Adadelta,0.33951435776764866,0.05167119219851104,,,,,,1,93.8416482336668,,,,PRUNED
243,243,33.333333333333336,2025-05-25 13:16:43.370765,2025-05-25 13:17:02.959763,0 days 00:00:19.588998,Adadelta,0.4528367498150141,0.05764956231027906,,,,,,3,3.6253052673452775,,,,PRUNED
244,244,35.416666666666664,2025-05-25 13:17:03.007178,2025-05-25 13:17:22.660163,0 days 00:00:19.652985,Adadelta,0.3849284087470588,0.022761966642358727,,,,,,2,23.692871459307064,,,,PRUNED
245,245,62.5,2025-05-25 13:17:22.707763,2025-05-25 13:17:47.752932,0 days 00:00:25.045169,AdamW,0.47871923283720735,,,5.144331182715771e-05,,,,1,,,0.002273869573131769,,PRUNED
246,246,33.333333333333336,2025-05-25 13:17:47.809897,2025-05-25 13:18:07.585810,0 days 00:00:19.775913,AdamW,0.04328957979877751,,,0.0005082622052574533,,,,5,,,0.0004447241265286124,,PRUNED
247,247,33.333333333333336,2025-05-25 13:18:07.622562,2025-05-25 13:18:27.448842,0 days 00:00:19.826280,Adam,0.11583782689214316,,0.001148648641885562,,,,,2,,4.8339420645680065,,,PRUNED
248,248,33.333333333333336,2025-05-25 13:18:27.495707,2025-05-25 13:18:47.098805,0 days 00:00:19.603098,AdamW,0.4686723542655232,,,0.0001101408540519937,,,,0,,,0.0027109972888774802,,PRUNED
249,249,33.333333333333336,2025-05-25 13:18:47.135444,2025-05-25 13:19:07.020569,0 days 00:00:19.885125,Adadelta,0.23566411703429846,0.4689312471028671,,,,,,1,0.4664053340139582,,,,PRUNED
250,250,45.833333333333336,2025-05-25 13:19:07.067128,2025-05-25 13:19:26.697819,0 days 00:00:19.630691,AdamW,0.2002952176896505,,,0.0002922922056982021,,,,5,,,0.0041160620265894635,,PRUNED
251,251,43.75,2025-05-25 13:19:26.734402,2025-05-25 13:19:46.402593,0 days 00:00:19.668191,AdamW,0.16806494156024315,,,6.51843763401644e-05,,,,4,,,0.0005358301659324677,,PRUNED
252,252,33.333333333333336,2025-05-25 13:19:46.438923,2025-05-25 13:20:06.055512,0 days 00:00:19.616589,AdamW,0.13552504048729383,,,0.00013552152542271127,,,,1,,,0.002008861984245986,,PRUNED
253,253,33.333333333333336,2025-05-25 13:20:06.091796,2025-05-25 13:20:25.835594,0 days 00:00:19.743798,AdamW,0.28663030641798415,,,0.00017835430246869,,,,0,,,0.002432095612415681,,PRUNED
254,254,39.583333333333336,2025-05-25 13:20:25.872334,2025-05-25 13:20:45.467492,0 days 00:00:19.595158,AdamW,0.24946670049242206,,,9.368107017401543e-05,,,,2,,,0.0033814149301844808,,PRUNED
255,255,39.583333333333336,2025-05-25 13:20:45.509603,2025-05-25 13:21:05.139703,0 days 00:00:19.630100,AdamW,0.10575724199312703,,,7.595629587190097e-05,,,,0,,,0.0003358909895777862,,PRUNED
256,256,33.333333333333336,2025-05-25 13:21:05.178366,2025-05-25 13:21:24.758318,0 days 00:00:19.579952,AdamW,0.14214395465046598,,,0.00015783656231658163,,,,1,,,0.0030615940262937818,,PRUNED
257,257,31.25,2025-05-25 13:21:24.794715,2025-05-25 13:21:38.752560,0 days 00:00:13.957845,Adam,0.06225084756350249,,8.391551755965931e-05,,,,,5,,0.4208312811149027,,,PRUNED
258,258,60.416666666666664,2025-05-25 13:21:38.791954,2025-05-25 13:22:03.090998,0 days 00:00:24.299044,AdamW,0.3556706957795406,,,0.0002216575605629391,,,,2,,,0.00026667999344307897,,PRUNED
259,259,,2025-05-25 13:22:03.127817,2025-05-25 13:22:21.477035,0 days 00:00:18.349218,SGD,0.1833688760206973,,,,0.0016973562385536485,36.78747408468365,False,1,,,,1.0035644145341192,PRUNED
260,260,45.833333333333336,2025-05-25 13:22:21.572410,2025-05-25 13:22:41.243970,0 days 00:00:19.671560,AdamW,0.26944784383130194,,,0.00011154132798855039,,,,0,,,0.002666641349699738,,PRUNED
261,261,33.333333333333336,2025-05-25 13:22:41.281292,2025-05-25 13:23:01.060748,0 days 00:00:19.779456,AdamW,0.32484566859994846,,,0.0020473772686133824,,,,2,,,0.0006065975428552532,,PRUNED
262,262,37.5,2025-05-25 13:23:01.109590,2025-05-25 13:23:20.853471,0 days 00:00:19.743881,AdamW,0.151573171311269,,,5.702708397412656e-05,,,,1,,,0.00019668669169696577,,PRUNED
263,263,33.333333333333336,2025-05-25 13:23:20.890674,2025-05-25 13:23:40.532637,0 days 00:00:19.641963,AdamW,0.02622707286863313,,,4.602117162278572e-05,,,,3,,,0.0016140660324010432,,PRUNED
264,264,29.166666666666668,2025-05-25 13:23:40.570416,2025-05-25 13:24:00.178136,0 days 00:00:19.607720,AdamW,0.16124887374251096,,,8.586796983358232e-05,,,,2,,,0.00011048461206754736,,PRUNED
265,265,43.75,2025-05-25 13:24:00.215557,2025-05-25 13:24:19.902557,0 days 00:00:19.687000,AdamW,0.46379472124121907,,,0.00013570250623867188,,,,0,,,0.00036552861675757107,,PRUNED
266,266,33.333333333333336,2025-05-25 13:24:19.939654,2025-05-25 13:24:39.394619,0 days 00:00:19.454965,Adadelta,0.4864065637061689,2.3482028340038807,,,,,,5,3.2115721038505516,,,,PRUNED
267,267,37.5,2025-05-25 13:24:39.440764,2025-05-25 13:24:59.109486,0 days 00:00:19.668722,Adam,0.26112387472887527,,2.4953431905246248e-05,,,,,1,,0.12775386079995435,,,PRUNED
268,268,35.416666666666664,2025-05-25 13:24:59.146859,2025-05-25 13:25:18.673179,0 days 00:00:19.526320,AdamW,0.23548545810996682,,,9.760300398834358e-05,,,,4,,,0.0009610859035552541,,PRUNED
269,269,33.333333333333336,2025-05-25 13:25:18.709599,2025-05-25 13:25:38.345851,0 days 00:00:19.636252,AdamW,0.07827603905668873,,,0.010705642455954187,,,,1,,,0.0013245045348028606,,PRUNED
270,270,62.5,2025-05-25 13:25:38.382927,2025-05-25 13:26:08.060948,0 days 00:00:29.678021,AdamW,0.4401498609231451,,,7.170453095120706e-05,,,,0,,,0.0037863358728317006,,PRUNED
271,271,33.333333333333336,2025-05-25 13:26:08.129081,2025-05-25 13:26:27.981086,0 days 00:00:19.852005,AdamW,0.3952122914637037,,,0.0001754729213875229,,,,2,,,0.00030883737539526095,,PRUNED
272,272,35.416666666666664,2025-05-25 13:26:28.017313,2025-05-25 13:26:48.174290,0 days 00:00:20.156977,AdamW,0.21772314113678948,,,2.6773593943023737e-05,,,,2,,,0.0004770973818434312,,PRUNED
273,273,43.75,2025-05-25 13:26:48.213410,2025-05-25 13:27:08.120171,0 days 00:00:19.906761,AdamW,0.24514156858148994,,,3.859706729422823e-05,,,,3,,,0.0003991899678980096,,PRUNED
274,274,39.583333333333336,2025-05-25 13:27:08.169185,2025-05-25 13:27:27.841381,0 days 00:00:19.672196,AdamW,0.17002463605363258,,,0.00012128655060345723,,,,5,,,0.0022523586226532192,,PRUNED
275,275,37.5,2025-05-25 13:27:27.880089,2025-05-25 13:27:47.518759,0 days 00:00:19.638670,Adam,0.1264887962666816,,0.00017867355818703575,,,,,1,,1.3191560475666566,,,PRUNED
276,276,41.666666666666664,2025-05-25 13:27:47.554576,2025-05-25 13:28:07.149623,0 days 00:00:19.595047,AdamW,0.20586118269576872,,,0.00023526497844133165,,,,0,,,0.000833295750285281,,PRUNED
277,277,33.333333333333336,2025-05-25 13:28:07.186757,2025-05-25 13:28:26.978021,0 days 00:00:19.791264,AdamW,0.3101597111510197,,,0.00015405160294396311,,,,1,,,0.0002260859029241507,,PRUNED
278,278,31.25,2025-05-25 13:28:27.015342,2025-05-25 13:28:46.597186,0 days 00:00:19.581844,AdamW,0.18782853214332737,,,6.360079244438919e-05,,,,0,,,0.0028583518290328388,,PRUNED
279,279,45.833333333333336,2025-05-25 13:28:46.639573,2025-05-25 13:29:06.313087,0 days 00:00:19.673514,AdamW,0.2542428898407428,,,0.00010296131601509481,,,,2,,,0.002492890740558892,,PRUNED
280,280,37.5,2025-05-25 13:29:06.354739,2025-05-25 13:29:28.524121,0 days 00:00:22.169382,AdamW,0.27630230585170557,,,7.854239470998732e-05,,,,1,,,0.0006709869305952033,,PRUNED
281,281,43.75,2025-05-25 13:29:28.561198,2025-05-25 13:29:48.020787,0 days 00:00:19.459589,AdamW,0.3696050482791238,,,0.00013168800056995774,,,,5,,,0.0021055535479569953,,PRUNED
282,282,33.333333333333336,2025-05-25 13:29:48.072142,2025-05-25 13:30:07.758344,0 days 00:00:19.686202,Adadelta,0.49986144585516407,27.780071397934314,,,,,,1,26.33098871034981,,,,PRUNED
283,283,45.833333333333336,2025-05-25 13:30:07.795868,2025-05-25 13:30:26.750915,0 days 00:00:18.955047,AdamW,0.295618855227562,,,0.00018888079724526025,,,,6,,,0.0032243350555693053,,PRUNED
284,284,,2025-05-25 13:30:26.788091,2025-05-25 13:30:45.506757,0 days 00:00:18.718666,SGD,0.156318372157457,,,,0.01316672214851645,10.510493663102153,False,2,,,,25.13251539096952,PRUNED
285,285,33.333333333333336,2025-05-25 13:30:45.551929,2025-05-25 13:31:05.546697,0 days 00:00:19.994768,Adam,0.17671323191638488,,0.0006725115210623633,,,,,0,,0.04930480005725649,,,PRUNED
286,286,33.333333333333336,2025-05-25 13:31:05.597101,2025-05-25 13:31:25.155773,0 days 00:00:19.558672,AdamW,0.2665083586482771,,,0.00032238252324594887,,,,4,,,0.0004447290147371672,,PRUNED
287,287,31.25,2025-05-25 13:31:25.194123,2025-05-25 13:31:44.901052,0 days 00:00:19.706929,AdamW,0.2309858438523546,,,1.4377999311598528e-05,,,,1,,,0.0029224325688020224,,PRUNED
288,288,31.25,2025-05-25 13:31:44.938521,2025-05-25 13:32:04.602451,0 days 00:00:19.663930,AdamW,0.14257160187082962,,,4.9947519095681913e-05,,,,3,,,0.0011829678074978974,,PRUNED
289,289,33.333333333333336,2025-05-25 13:32:04.638945,2025-05-25 13:32:23.448244,0 days 00:00:18.809299,AdamW,0.09617392818726542,,,9.102361668395045e-05,,,,7,,,0.0005244331705349655,,PRUNED
290,290,64.58333333333333,2025-05-25 13:32:23.485557,2025-05-25 13:32:52.587908,0 days 00:00:29.102351,AdamW,0.38044163538945586,,,0.00011208035610583355,,,,2,,,0.0019129931641682207,,PRUNED
291,291,33.333333333333336,2025-05-25 13:32:52.636809,2025-05-25 13:33:12.933038,0 days 00:00:20.296229,AdamW,0.2429092635880707,,,0.00014924618028583171,,,,0,,,0.0026225542880301315,,PRUNED
292,292,52.083333333333336,2025-05-25 13:33:12.971867,2025-05-25 13:33:37.976747,0 days 00:00:25.004880,AdamW,0.3352779814754937,,,6.245653521486921e-05,,,,1,,,0.0035682856943613965,,PRUNED
293,293,45.833333333333336,2025-05-25 13:33:38.015333,2025-05-25 13:33:57.636210,0 days 00:00:19.620877,Adadelta,0.4230971733535011,0.10395838042883007,,,,,,5,0.22673299713565304,,,,PRUNED
294,294,41.666666666666664,2025-05-25 13:33:57.682624,2025-05-25 13:34:17.311558,0 days 00:00:19.628934,AdamW,0.1947801485550252,,,7.900953628612769e-05,,,,1,,,0.0005709048199204702,,PRUNED
295,295,37.5,2025-05-25 13:34:17.348420,2025-05-25 13:34:36.944372,0 days 00:00:19.595952,Adam,0.2812243075804928,,2.393191171213035e-05,,,,,2,,0.012268104021778319,,,PRUNED
296,296,33.333333333333336,2025-05-25 13:34:36.980670,2025-05-25 13:34:57.259027,0 days 00:00:20.278357,AdamW,0.16389810191759352,,,0.00012161600625094661,,,,3,,,0.002352841536926751,,PRUNED
297,297,33.333333333333336,2025-05-25 13:34:57.307870,2025-05-25 13:35:17.004015,0 days 00:00:19.696145,AdamW,0.25862744249020875,,,0.0002453224450666104,,,,0,,,0.000376593087217608,,PRUNED
298,298,33.333333333333336,2025-05-25 13:35:17.054108,2025-05-25 13:35:36.815440,0 days 00:00:19.761332,AdamW,0.4105398891594978,,,0.0006254175528683714,,,,1,,,0.0032708832546750922,,PRUNED
299,299,43.75,2025-05-25 13:35:36.862932,2025-05-25 13:35:56.459878,0 days 00:00:19.596946,AdamW,0.11332084551317027,,,9.949126801126948e-05,,,,5,,,0.002191282701921202,,PRUNED
300,300,33.333333333333336,2025-05-25 13:35:56.497188,2025-05-25 13:36:16.143441,0 days 00:00:19.646253,AdamW,0.039894487742488875,,,0.0004372048632583947,,,,0,,,0.0007357322573476884,,PRUNED
301,301,35.416666666666664,2025-05-25 13:36:16.180247,2025-05-25 13:36:36.218156,0 days 00:00:20.037909,AdamW,0.21412928669523565,,,0.00018368411776279356,,,,2,,,0.00476050198220257,,PRUNED
302,302,33.333333333333336,2025-05-25 13:36:36.266233,2025-05-25 13:36:55.924978,0 days 00:00:19.658745,AdamW,0.18020821606137655,,,4.162204758168723e-05,,,,1,,,0.001776759607371401,,PRUNED
303,303,33.333333333333336,2025-05-25 13:36:55.965892,2025-05-25 13:37:15.521362,0 days 00:00:19.555470,Adam,0.22572854916830737,,0.0021856160198572942,,,,,2,,1.2697302257002592,,,PRUNED
304,304,33.333333333333336,2025-05-25 13:37:15.558005,2025-05-25 13:37:35.241476,0 days 00:00:19.683471,AdamW,0.24935783994047925,,,8.61520351214891e-05,,,,5,,,0.0026556073949009907,,PRUNED
305,305,33.333333333333336,2025-05-25 13:37:35.277753,2025-05-25 13:37:55.060881,0 days 00:00:19.783128,AdamW,0.3157483980781763,,,0.00015064335182107653,,,,0,,,0.0004144537353945482,,PRUNED
306,306,33.333333333333336,2025-05-25 13:37:55.098520,2025-05-25 13:38:14.744063,0 days 00:00:19.645543,Adadelta,0.052342774010129996,2.2339597109667038,,,,,,1,0.04396921179696024,,,,PRUNED
307,307,33.333333333333336,2025-05-25 13:38:14.792709,2025-05-25 13:38:34.565338,0 days 00:00:19.772629,AdamW,0.1502641134657835,,,6.971164438477812e-05,,,,2,,,0.0004968444674234146,,PRUNED
308,308,,2025-05-25 13:38:34.601765,2025-05-25 13:38:52.906872,0 days 00:00:18.305107,SGD,0.3473164467331207,,,,0.00030782584645859654,58.852138572564314,True,1,,,,0.07351049421104533,PRUNED
309,309,41.666666666666664,2025-05-25 13:38:52.954019,2025-05-25 13:39:12.513876,0 days 00:00:19.559857,AdamW,0.29049490201110545,,,5.4529033374746034e-05,,,,4,,,0.004077010063095043,,PRUNED
310,310,37.5,2025-05-25 13:39:12.550342,2025-05-25 13:39:34.663698,0 days 00:00:22.113356,AdamW,0.13374599403978268,,,0.00012023821049917415,,,,1,,,0.00033372855499871093,,PRUNED
311,311,41.666666666666664,2025-05-25 13:39:34.712563,2025-05-25 13:39:54.879428,0 days 00:00:20.166865,AdamW,0.26262370404706686,,,0.00010129253932510545,,,,0,,,0.0015017658157595484,,PRUNED
312,312,33.333333333333336,2025-05-25 13:39:54.926952,2025-05-25 13:40:14.635588,0 days 00:00:19.708636,AdamW,0.06937798053528062,,,0.00021090333668085802,,,,2,,,0.0030330123603964057,,PRUNED
313,313,33.333333333333336,2025-05-25 13:40:14.671946,2025-05-25 13:40:34.335839,0 days 00:00:19.663893,Adam,0.27416203636911446,,0.004717069851277277,,,,,2,,0.010771863886918228,,,PRUNED
314,314,33.333333333333336,2025-05-25 13:40:34.374207,2025-05-25 13:40:54.050708,0 days 00:00:19.676501,AdamW,0.16879980263507202,,,0.0002834323555656041,,,,0,,,0.0006490685922575419,,PRUNED
315,315,47.916666666666664,2025-05-25 13:40:54.089050,2025-05-25 13:41:22.722462,0 days 00:00:28.633412,AdamW,0.436963070696753,,,0.00013980164719284153,,,,5,,,0.0024162405353468706,,PRUNED
316,316,45.833333333333336,2025-05-25 13:41:22.760373,2025-05-25 13:41:42.837468,0 days 00:00:20.077095,AdamW,0.2371447660087736,,,7.436236662370784e-05,,,,1,,,0.00029961552370346637,,PRUNED
317,317,35.416666666666664,2025-05-25 13:41:42.874224,2025-05-25 13:42:02.508506,0 days 00:00:19.634282,AdamW,0.24920782572897887,,,0.00011270576772890149,,,,3,,,0.0019812029170769665,,PRUNED
318,318,52.083333333333336,2025-05-25 13:42:02.548168,2025-05-25 13:42:24.716374,0 days 00:00:22.168206,AdamW,0.17974045517040396,,,0.00015906051644720711,,,,1,,,0.0028775553508220155,,PRUNED
319,319,35.416666666666664,2025-05-25 13:42:24.754436,2025-05-25 13:42:44.354428,0 days 00:00:19.599992,AdamW,0.16174380338384992,,,8.768606663657755e-05,,,,0,,,0.003322971693253978,,PRUNED
320,320,43.75,2025-05-25 13:42:44.392023,2025-05-25 13:43:04.342644,0 days 00:00:19.950621,AdamW,0.389500983584166,,,3.3967787218062e-05,,,,1,,,0.000448058995469524,,PRUNED
321,321,33.333333333333336,2025-05-25 13:43:04.379096,2025-05-25 13:43:24.065933,0 days 00:00:19.686837,Adadelta,0.12192104004879681,0.025230294534021744,,,,,,2,9.784213127886858,,,,PRUNED
322,322,33.333333333333336,2025-05-25 13:43:24.113533,2025-05-25 13:43:43.948190,0 days 00:00:19.834657,Adam,0.2031752213683596,,0.018176087436525674,,,,,2,,17.671939883280842,,,PRUNED
323,323,43.75,2025-05-25 13:43:43.997146,2025-05-25 13:44:03.770835,0 days 00:00:19.773689,AdamW,0.4728244979727611,,,4.820031253700346e-05,,,,0,,,0.0010401433998769305,,PRUNED
324,324,37.5,2025-05-25 13:44:03.807619,2025-05-25 13:44:23.336913,0 days 00:00:19.529294,AdamW,0.15443681285872368,,,6.509467043664477e-05,,,,4,,,0.0005730577740957815,,PRUNED
325,325,41.666666666666664,2025-05-25 13:44:23.376508,2025-05-25 13:44:43.198363,0 days 00:00:19.821855,AdamW,0.35651064007704614,,,0.00020182843281795455,,,,1,,,0.00027462569400259576,,PRUNED
326,326,37.5,2025-05-25 13:44:43.234911,2025-05-25 13:45:02.733904,0 days 00:00:19.498993,AdamW,0.14183089218528339,,,0.00013198686792054704,,,,5,,,0.002662970089248952,,PRUNED
327,327,37.5,2025-05-25 13:45:02.825733,2025-05-25 13:45:22.450665,0 days 00:00:19.624932,AdamW,0.3011714396306849,,,0.0001001687017761896,,,,3,,,0.0037766866537697363,,PRUNED
328,328,33.333333333333336,2025-05-25 13:45:22.493460,2025-05-25 13:45:42.146820,0 days 00:00:19.653360,AdamW,0.19229456884340013,,,0.00017176355084238805,,,,1,,,0.0003553686854698055,,PRUNED
329,329,33.333333333333336,2025-05-25 13:45:42.194411,2025-05-25 13:46:01.829561,0 days 00:00:19.635150,AdamW,0.08386869234136989,,,5.7340771104911474e-05,,,,0,,,0.0021755540439273246,,PRUNED
330,330,33.333333333333336,2025-05-25 13:46:01.868389,2025-05-25 13:46:21.383134,0 days 00:00:19.514745,AdamW,0.2660537013116605,,,8.25110502954705e-05,,,,2,,,0.0005132239402347798,,PRUNED
331,331,33.333333333333336,2025-05-25 13:46:21.420187,2025-05-25 13:46:40.958024,0 days 00:00:19.537837,Adam,0.17371377174447136,,0.00029051945699826013,,,,,5,,68.73732775357108,,,PRUNED
332,332,58.333333333333336,2025-05-25 13:46:40.994637,2025-05-25 13:47:05.231567,0 days 00:00:24.236930,AdamW,0.2320311162504327,,,0.00013509394825739332,,,,2,,,0.002472767447877568,,PRUNED
333,333,31.25,2025-05-25 13:47:05.269235,2025-05-25 13:47:24.297852,0 days 00:00:19.028617,Adadelta,0.28395568748461175,0.09046022024123516,,,,,,8,1.9231975895589033,,,,PRUNED
334,334,,2025-05-25 13:47:24.339537,2025-05-25 13:47:42.533121,0 days 00:00:18.193584,SGD,0.25585297203090934,,,,3.8839995394278266e-05,82.79211807648188,True,1,,,,1.1125707363210482,PRUNED
335,335,35.416666666666664,2025-05-25 13:47:42.581756,2025-05-25 13:48:02.325611,0 days 00:00:19.743855,AdamW,0.3237323380732663,,,0.000111736273641424,,,,0,,,0.002902309510866261,,PRUNED
336,336,33.333333333333336,2025-05-25 13:48:02.373556,2025-05-25 13:48:22.544183,0 days 00:00:20.170627,AdamW,0.4538707812787779,,,0.0002348470086093165,,,,2,,,0.0003899770798938372,,PRUNED
337,337,39.583333333333336,2025-05-25 13:48:22.591537,2025-05-25 13:48:42.713355,0 days 00:00:20.121818,AdamW,0.156841215471503,,,8.782143953193022e-05,,,,1,,,0.0017173775308770018,,PRUNED
338,338,33.333333333333336,2025-05-25 13:48:42.759287,2025-05-25 13:49:02.884502,0 days 00:00:20.125215,AdamW,0.017460726399124955,,,0.0014977596178742348,,,,0,,,0.0034674633751075774,,PRUNED
339,339,41.666666666666664,2025-05-25 13:49:02.935163,2025-05-25 13:49:22.458841,0 days 00:00:19.523678,AdamW,0.24578653581151874,,,7.029583575011377e-05,,,,5,,,0.0031188824061897692,,PRUNED
340,340,33.333333333333336,2025-05-25 13:49:22.499231,2025-05-25 13:49:42.214583,0 days 00:00:19.715352,AdamW,0.27486689217018734,,,0.00015541913276668836,,,,1,,,0.00047336884222434636,,PRUNED
341,341,41.666666666666664,2025-05-25 13:49:42.251414,2025-05-25 13:50:02.038651,0 days 00:00:19.787237,Adam,0.22563131274542123,,6.237223505174234e-05,,,,,0,,0.25499813602655735,,,PRUNED
342,342,43.75,2025-05-25 13:50:02.076330,2025-05-25 13:50:21.861598,0 days 00:00:19.785268,AdamW,0.2402894470856796,,,0.00035534330145931274,,,,2,,,0.002017209238009465,,PRUNED
343,343,43.75,2025-05-25 13:50:21.900115,2025-05-25 13:50:41.708584,0 days 00:00:19.808469,AdamW,0.10989995086428035,,,0.00010425499499836667,,,,1,,,0.0006151113375798874,,PRUNED
