,number,value,datetime_start,datetime_complete,duration,params_algorithm,params_dropout_rate,params_lr_Adadelta,params_lr_Adam,params_lr_AdamW,params_lr_SGD,params_momentum_SGD,params_nesterov_SGD,params_suggested_freeze,params_weight_decay_Adadelta,params_weight_decay_Adam,params_weight_decay_AdamW,params_weight_decay_SGD,state
1259,1259,39.583333333333336,2025-05-25 19:03:07.290071,2025-05-25 19:03:13.110077,0 days 00:00:05.820006,AdamW,0.2087205367830908,,,0.00020926604754568505,,,,1,,,0.00034004348862832763,,PRUNED
1260,1260,33.333333333333336,2025-05-25 19:03:13.146260,2025-05-25 19:03:19.030643,0 days 00:00:05.884383,AdamW,0.2462844765748236,,,0.00035985169723972473,,,,1,,,0.00047147747238919583,,PRUNED
1261,1261,39.583333333333336,2025-05-25 19:03:19.066087,2025-05-25 19:03:24.853525,0 days 00:00:05.787438,AdamW,0.04035620267771154,,,0.00012410506614674748,,,,2,,,0.0026520154233941797,,PRUNED
1262,1262,45.833333333333336,2025-05-25 19:03:24.888778,2025-05-25 19:03:30.863740,0 days 00:00:05.974962,AdamW,0.19906501514563246,,,8.891950645443912e-05,,,,1,,,0.0032100472203535958,,PRUNED
1263,1263,39.583333333333336,2025-05-25 19:03:30.899377,2025-05-25 19:03:38.298075,0 days 00:00:07.398698,AdamW,0.22505027900230495,,,4.691613287283064e-05,,,,4,,,0.002271543983069479,,PRUNED
1264,1264,52.083333333333336,2025-05-25 19:03:38.335450,2025-05-25 19:03:49.163129,0 days 00:00:10.827679,AdamW,0.2175441067210365,,,0.0001663803416606731,,,,0,,,0.0005279196958872553,,PRUNED
1265,1265,43.75,2025-05-25 19:03:49.212196,2025-05-25 19:04:00.170149,0 days 00:00:10.957953,AdamW,0.15574353204835703,,,6.411989549860704e-05,,,,2,,,0.002510940349682543,,PRUNED
1266,1266,35.416666666666664,2025-05-25 19:04:00.217182,2025-05-25 19:04:11.070987,0 days 00:00:10.853805,AdamW,0.29861991295786267,,,0.00010326626691998265,,,,1,,,0.0003974868421962118,,PRUNED
1267,1267,41.666666666666664,2025-05-25 19:04:11.119927,2025-05-25 19:04:22.111355,0 days 00:00:10.991428,AdamW,0.2611013596309494,,,7.543702525563525e-05,,,,0,,,0.0021196479228271113,,PRUNED
1268,1268,33.333333333333336,2025-05-25 19:04:22.160658,2025-05-25 19:04:32.983908,0 days 00:00:10.823250,SGD,0.183843271018846,,,,1.662580638125941e-05,5.951136658570022,True,1,,,,0.01014557123960193,PRUNED
1269,1269,37.5,2025-05-25 19:04:33.031777,2025-05-25 19:04:43.946106,0 days 00:00:10.914329,AdamW,0.16997945838019524,,,0.00013141598922224247,,,,2,,,0.0006712672178605419,,PRUNED
1270,1270,33.333333333333336,2025-05-25 19:04:43.991752,2025-05-25 19:04:54.914174,0 days 00:00:10.922422,AdamW,0.3109359944605743,,,0.00026334807542376023,,,,2,,,0.00028741470878055773,,PRUNED
1271,1271,39.583333333333336,2025-05-25 19:04:54.962910,2025-05-25 19:05:06.106674,0 days 00:00:11.143764,AdamW,0.23097292503324332,,,0.00018657363506170487,,,,1,,,0.00282680207342652,,PRUNED
1272,1272,41.666666666666664,2025-05-25 19:05:06.156904,2025-05-25 19:05:22.630379,0 days 00:00:16.473475,AdamW,0.40918778737985917,,,0.00011016128850711752,,,,0,,,0.0003775382061258577,,PRUNED
1273,1273,33.333333333333336,2025-05-25 19:05:22.685050,2025-05-25 19:05:39.148037,0 days 00:00:16.462987,AdamW,0.28803061723168955,,,0.0001440183066744196,,,,1,,,0.0019224651761430476,,PRUNED
1274,1274,31.25,2025-05-25 19:05:39.201751,2025-05-25 19:05:57.222777,0 days 00:00:18.021026,Adam,0.2469950282878505,,1.4378007066303077e-05,,,,,2,,4.59034626879338,,,PRUNED
1275,1275,41.666666666666664,2025-05-25 19:05:57.280977,2025-05-25 19:06:16.513863,0 days 00:00:19.232886,AdamW,0.19689015986275818,,,8.693969990630231e-05,,,,0,,,0.0004846895650115686,,PRUNED
1276,1276,33.333333333333336,2025-05-25 19:06:16.571860,2025-05-25 19:06:35.934135,0 days 00:00:19.362275,AdamW,0.20752285152817998,,,0.000209713689101845,,,,1,,,0.00043511570158094603,,PRUNED
1277,1277,33.333333333333336,2025-05-25 19:06:35.992100,2025-05-25 19:06:55.062272,0 days 00:00:19.070172,Adadelta,0.21614195633344566,0.12921740531004047,,,,,,1,51.70638114066609,,,,PRUNED
1278,1278,47.916666666666664,2025-05-25 19:06:55.119777,2025-05-25 19:07:14.241857,0 days 00:00:19.122080,AdamW,0.27369677249586133,,,0.00015677856862234785,,,,2,,,0.003368748459141668,,PRUNED
1279,1279,39.583333333333336,2025-05-25 19:07:14.299557,2025-05-25 19:07:33.589069,0 days 00:00:19.289512,AdamW,0.17681085112270536,,,0.00011663387404124672,,,,4,,,0.00246414758106325,,PRUNED
1280,1280,33.333333333333336,2025-05-25 19:07:33.691388,2025-05-25 19:07:53.083369,0 days 00:00:19.391981,AdamW,0.23767740549529603,,,0.00041290460768040645,,,,2,,,0.0029027089931134417,,PRUNED
1281,1281,31.25,2025-05-25 19:07:53.142210,2025-05-25 19:08:11.714375,0 days 00:00:18.572165,AdamW,0.18774900001257747,,,5.846327694243453e-05,,,,7,,,0.00012008393761141956,,PRUNED
1282,1282,33.333333333333336,2025-05-25 19:08:11.766404,2025-05-25 19:08:24.245102,0 days 00:00:12.478698,AdamW,0.15050608240211052,,,9.168891245134482e-05,,,,1,,,0.003942906207684703,,PRUNED
1283,1283,33.333333333333336,2025-05-25 19:08:24.295108,2025-05-25 19:08:35.467478,0 days 00:00:11.172370,AdamW,0.07492188216439247,,,0.00030122332402349015,,,,0,,,0.0022358800019763383,,PRUNED
1284,1284,25.0,2025-05-25 19:08:35.520588,2025-05-25 19:08:46.486246,0 days 00:00:10.965658,AdamW,0.2548836538646141,,,7.329212637580769e-05,,,,1,,,0.0005430181255322491,,PRUNED
1285,1285,33.333333333333336,2025-05-25 19:08:46.532821,2025-05-25 19:08:57.384195,0 days 00:00:10.851374,AdamW,0.2014668357555643,,,0.0001348890624808532,,,,1,,,0.002068617347332496,,PRUNED
1286,1286,33.333333333333336,2025-05-25 19:08:57.433772,2025-05-25 19:09:09.178046,0 days 00:00:11.744274,AdamW,0.1624396136642751,,,0.0001709740570840422,,,,2,,,0.0006186982775403002,,PRUNED
1287,1287,54.166666666666664,2025-05-25 19:09:09.226475,2025-05-25 19:09:20.930157,0 days 00:00:11.703682,AdamW,0.22354524073269483,,,0.00010374439320404922,,,,0,,,0.005979581357532817,,PRUNED
1288,1288,33.333333333333336,2025-05-25 19:09:20.979669,2025-05-25 19:09:32.575804,0 days 00:00:11.596135,AdamW,0.19089627261154182,,,0.0002290180679816293,,,,1,,,0.00026049567254512784,,PRUNED
1289,1289,31.25,2025-05-25 19:09:32.624555,2025-05-25 19:09:44.216421,0 days 00:00:11.591866,AdamW,0.47325486108815557,,,0.00011874408230457619,,,,2,,,0.00031193047703578943,,PRUNED
1290,1290,33.333333333333336,2025-05-25 19:09:44.265118,2025-05-25 19:10:01.386637,0 days 00:00:17.121519,AdamW,0.4291205917146501,,,0.004522872630399551,,,,1,,,0.00260447962736557,,PRUNED
1291,1291,41.666666666666664,2025-05-25 19:10:01.443872,2025-05-25 19:10:20.371129,0 days 00:00:18.927257,AdamW,0.26265558447711673,,,0.00014996974575220848,,,,1,,,0.0003362979177024386,,PRUNED
1292,1292,,2025-05-25 19:10:20.429138,2025-05-25 19:10:38.731869,0 days 00:00:18.302731,SGD,0.21176395506090237,,,,0.015930744630387766,28.086858071193003,False,2,,,,14.421110805801288,PRUNED
1293,1293,31.25,2025-05-25 19:10:38.788067,2025-05-25 19:10:58.261200,0 days 00:00:19.473133,AdamW,0.23939750613027522,,,8.113944477904549e-05,,,,0,,,0.0003973859377013163,,PRUNED
1294,1294,45.833333333333336,2025-05-25 19:10:58.318868,2025-05-25 19:11:17.619759,0 days 00:00:19.300891,AdamW,0.17436971510455912,,,0.0001004764385329731,,,,0,,,0.0004487544565187856,,PRUNED
1295,1295,37.5,2025-05-25 19:11:17.678036,2025-05-25 19:11:37.109542,0 days 00:00:19.431506,AdamW,0.18225620861836467,,,0.00017565364273247727,,,,1,,,0.0023161470927510227,,PRUNED
1296,1296,41.666666666666664,2025-05-25 19:11:37.167333,2025-05-25 19:11:56.455562,0 days 00:00:19.288229,AdamW,0.1375884724780633,,,0.0001342236100546655,,,,2,,,0.0030779988468263813,,PRUNED
1297,1297,45.833333333333336,2025-05-25 19:11:56.513780,2025-05-25 19:12:15.760489,0 days 00:00:19.246709,AdamW,0.2503504407594054,,,7.004729240398819e-05,,,,3,,,0.000506171171402184,,PRUNED
1298,1298,35.416666666666664,2025-05-25 19:12:15.817125,2025-05-25 19:12:35.132247,0 days 00:00:19.315122,Adam,0.23408968173052278,,0.00020805418094820455,,,,,1,,0.7374780421084421,,,PRUNED
1299,1299,33.333333333333336,2025-05-25 19:12:35.190167,2025-05-25 19:12:51.591032,0 days 00:00:16.400865,AdamW,0.21845475686280866,,,0.000696986589241497,,,,4,,,0.0003599246871503718,,PRUNED
1300,1300,33.333333333333336,2025-05-25 19:12:51.639693,2025-05-25 19:13:02.566180,0 days 00:00:10.926487,AdamW,0.20076080460257326,,,0.00020538592975672494,,,,3,,,0.0017853457616666163,,PRUNED
1301,1301,33.333333333333336,2025-05-25 19:13:02.611951,2025-05-25 19:13:13.561750,0 days 00:00:10.949799,Adadelta,0.4151970498520458,0.6478723795992651,,,,,,2,0.014967037274004504,,,,PRUNED
1302,1302,33.333333333333336,2025-05-25 19:13:13.610523,2025-05-25 19:13:25.045142,0 days 00:00:11.434619,AdamW,0.16904595542505568,,,0.00011298283867666335,,,,0,,,0.0026693488847137734,,PRUNED
1303,1303,39.583333333333336,2025-05-25 19:13:25.094907,2025-05-25 19:13:36.158388,0 days 00:00:11.063481,AdamW,0.27933673832108985,,,0.00025570264074144234,,,,1,,,0.003529553796457475,,PRUNED
1304,1304,37.5,2025-05-25 19:13:36.210952,2025-05-25 19:13:47.341057,0 days 00:00:11.130105,AdamW,0.23113578666907594,,,9.114956926588847e-05,,,,1,,,0.002000331771538212,,PRUNED
1305,1305,33.333333333333336,2025-05-25 19:13:47.390288,2025-05-25 19:13:58.307501,0 days 00:00:10.917213,AdamW,0.2066699955884255,,,0.006729836877015924,,,,3,,,0.0004165516796738351,,PRUNED
1306,1306,33.333333333333336,2025-05-25 19:13:58.357526,2025-05-25 19:14:09.343987,0 days 00:00:10.986461,AdamW,0.19299643046493714,,,0.00014035548407149341,,,,2,,,0.002362574977891518,,PRUNED
1307,1307,33.333333333333336,2025-05-25 19:14:09.393015,2025-05-25 19:14:20.401165,0 days 00:00:11.008150,AdamW,0.2465861360234654,,,0.0001642069946311105,,,,1,,,0.000468384295434134,,PRUNED
1308,1308,37.5,2025-05-25 19:14:20.450225,2025-05-25 19:14:33.123081,0 days 00:00:12.672856,AdamW,0.44148801360274986,,,5.610227634944448e-05,,,,0,,,0.0005665645062464636,,PRUNED
1309,1309,33.333333333333336,2025-05-25 19:14:33.180895,2025-05-25 19:14:52.010206,0 days 00:00:18.829311,AdamW,0.15187177650302613,,,0.0010026750014901094,,,,2,,,0.0028969618967163726,,PRUNED
1310,1310,45.833333333333336,2025-05-25 19:14:52.067687,2025-05-25 19:15:08.011792,0 days 00:00:15.944105,AdamW,0.1834567892962606,,,0.00011939427491405586,,,,4,,,0.0025312425493533167,,PRUNED
1311,1311,33.333333333333336,2025-05-25 19:15:08.067906,2025-05-25 19:15:27.520705,0 days 00:00:19.452799,AdamW,0.26495604302221637,,,0.0003305112501321958,,,,1,,,0.0007426500278027205,,PRUNED
1312,1312,43.75,2025-05-25 19:15:27.579105,2025-05-25 19:15:47.480439,0 days 00:00:19.901334,AdamW,0.22064799861586853,,,8.097414628011933e-05,,,,0,,,0.0003763381524351333,,PRUNED
1313,1313,33.333333333333336,2025-05-25 19:15:47.538358,2025-05-25 19:16:07.062638,0 days 00:00:19.524280,AdamW,0.16131177360926952,,,0.00019249841743769982,,,,3,,,0.0021842738862023047,,PRUNED
1314,1314,33.333333333333336,2025-05-25 19:16:07.119964,2025-05-25 19:16:26.818511,0 days 00:00:19.698547,AdamW,0.049290576045523525,,,0.00010599386384353711,,,,1,,,0.0018571286497746033,,PRUNED
1315,1315,45.833333333333336,2025-05-25 19:16:26.876780,2025-05-25 19:16:46.372829,0 days 00:00:19.496049,AdamW,0.4012644753424211,,,0.00014531574607014428,,,,2,,,0.0032596372436270848,,PRUNED
1316,1316,33.333333333333336,2025-05-25 19:16:46.430494,2025-05-25 19:17:05.961165,0 days 00:00:19.530671,AdamW,0.4566518530249235,,,8.892223908181065e-05,,,,1,,,0.004982612484568824,,PRUNED
1317,1317,33.333333333333336,2025-05-25 19:17:06.019000,2025-05-25 19:17:25.559248,0 days 00:00:19.540248,AdamW,0.06471333178520809,,,6.611969843765356e-05,,,,3,,,0.0005042620397300183,,PRUNED
1318,1318,33.333333333333336,2025-05-25 19:17:25.616688,2025-05-25 19:17:45.236509,0 days 00:00:19.619821,AdamW,0.3175361090039553,,,0.000221795979590524,,,,1,,,0.0010320661032790662,,PRUNED
1319,1319,33.333333333333336,2025-05-25 19:17:45.296207,2025-05-25 19:18:04.931317,0 days 00:00:19.635110,AdamW,0.21161673971482203,,,0.00012129980531334499,,,,0,,,0.0027633229511425973,,PRUNED
1320,1320,,2025-05-25 19:18:04.989264,2025-05-25 19:18:23.161132,0 days 00:00:18.171868,SGD,0.19515748091786186,,,,0.00021752134829473955,78.02117890908045,True,2,,,,0.07910067050707692,PRUNED
1321,1321,45.833333333333336,2025-05-25 19:18:23.219772,2025-05-25 19:18:42.701222,0 days 00:00:19.481450,AdamW,0.22983442882253446,,,0.00016962253988095876,,,,2,,,0.00045185248143199316,,PRUNED
1322,1322,39.583333333333336,2025-05-25 19:18:42.758781,2025-05-25 19:19:01.784577,0 days 00:00:19.025796,AdamW,0.2528892888650684,,,0.00010226969139582489,,,,6,,,0.0024619695151364496,,PRUNED
1323,1323,50.0,2025-05-25 19:19:01.838942,2025-05-25 19:19:21.436932,0 days 00:00:19.597990,Adam,0.3387096434787323,,0.00013380527682142822,,,,,1,,0.07268551155638624,,,PRUNED
1324,1324,33.333333333333336,2025-05-25 19:19:21.495383,2025-05-25 19:19:41.038542,0 days 00:00:19.543159,AdamW,0.08288138755537025,,,0.00013602730727223672,,,,1,,,0.0005923386870141988,,PRUNED
1325,1325,35.416666666666664,2025-05-25 19:19:41.096795,2025-05-25 19:20:00.915755,0 days 00:00:19.818960,Adadelta,0.1740660463494963,0.06477480187201883,,,,,,0,11.188898409865194,,,,PRUNED
1326,1326,33.333333333333336,2025-05-25 19:20:00.973117,2025-05-25 19:20:21.100442,0 days 00:00:20.127325,AdamW,0.30160524178469034,,,7.626400376047322e-05,,,,2,,,0.002025684866306933,,PRUNED
1327,1327,31.25,2025-05-25 19:20:21.158722,2025-05-25 19:20:40.761044,0 days 00:00:19.602322,AdamW,0.24092847605202639,,,0.0002870357078208301,,,,1,,,0.00042787614651537085,,PRUNED
1328,1328,37.5,2025-05-25 19:20:40.819448,2025-05-25 19:21:00.596999,0 days 00:00:19.777551,AdamW,0.20501174606930103,,,9.767675024601544e-05,,,,1,,,0.00227310870773341,,PRUNED
1329,1329,33.333333333333336,2025-05-25 19:21:00.655474,2025-05-25 19:21:20.193683,0 days 00:00:19.538209,AdamW,0.2186784309204793,,,0.0001878449213636587,,,,3,,,0.0036767380197538202,,PRUNED
1330,1330,33.333333333333336,2025-05-25 19:21:20.251791,2025-05-25 19:21:39.824950,0 days 00:00:19.573159,AdamW,0.27225477015626787,,,0.00012485372442045683,,,,1,,,0.0003283708479233686,,PRUNED
1331,1331,39.583333333333336,2025-05-25 19:21:39.884038,2025-05-25 19:21:59.567987,0 days 00:00:19.683949,AdamW,0.18685584231161012,,,0.0002493037874938842,,,,0,,,0.00038359832497415335,,PRUNED
1332,1332,33.333333333333336,2025-05-25 19:21:59.628082,2025-05-25 19:22:19.420354,0 days 00:00:19.792272,AdamW,0.14486081300409867,,,0.00015954456631427238,,,,3,,,0.0030232469268346818,,PRUNED
1333,1333,27.083333333333332,2025-05-25 19:22:19.478636,2025-05-25 19:22:38.987074,0 days 00:00:19.508438,AdamW,0.0014717275030401988,,,4.933876103992886e-05,,,,2,,,0.0013848981354319804,,PRUNED
1334,1334,52.083333333333336,2025-05-25 19:22:39.052450,2025-05-25 19:22:58.711719,0 days 00:00:19.659269,AdamW,0.28898214129606287,,,0.00010828179875433512,,,,0,,,0.0005300695610343349,,PRUNED
1335,1335,35.416666666666664,2025-05-25 19:22:58.771206,2025-05-25 19:23:18.273966,0 days 00:00:19.502760,AdamW,0.16678265241001775,,,8.395073543357292e-05,,,,2,,,0.004121560736079337,,PRUNED
1336,1336,33.333333333333336,2025-05-25 19:23:18.333144,2025-05-25 19:23:37.940790,0 days 00:00:19.607646,AdamW,0.199044110558992,,,0.00014651642467273103,,,,1,,,0.0004704197829813952,,PRUNED
1337,1337,33.333333333333336,2025-05-25 19:23:37.999236,2025-05-25 19:23:57.612435,0 days 00:00:19.613199,AdamW,0.3615419586704763,,,0.0005043771851222867,,,,1,,,0.001642522745000518,,PRUNED
1338,1338,52.083333333333336,2025-05-25 19:23:57.671388,2025-05-25 19:24:19.526074,0 days 00:00:21.854686,AdamW,0.2563194996852309,,,0.00019272442580059145,,,,2,,,0.0026388056212802817,,PRUNED
1339,1339,35.416666666666664,2025-05-25 19:24:19.585086,2025-05-25 19:24:39.179195,0 days 00:00:19.594109,AdamW,0.23833185848050736,,,6.498595327567255e-05,,,,0,,,0.0008194168256207946,,PRUNED
1340,1340,,2025-05-25 19:24:39.237903,2025-05-25 19:24:58.198478,0 days 00:00:18.960575,SGD,0.22479228950274005,,,,2.6194672391251395e-05,36.093262717226224,False,3,,,,0.01594937252935151,PRUNED
1341,1341,39.583333333333336,2025-05-25 19:24:58.255190,2025-05-25 19:25:17.833883,0 days 00:00:19.578693,AdamW,0.17710014946963343,,,0.00012234736385466756,,,,1,,,0.0021067360248617495,,PRUNED
1342,1342,41.666666666666664,2025-05-25 19:25:17.892702,2025-05-25 19:25:37.569089,0 days 00:00:19.676387,AdamW,0.19158727441981557,,,9.592862973620075e-05,,,,4,,,0.0023436702959823913,,PRUNED
1343,1343,33.333333333333336,2025-05-25 19:25:37.626768,2025-05-25 19:25:57.268442,0 days 00:00:19.641674,AdamW,0.1585567183415933,,,0.00021494551390475105,,,,1,,,0.00041984506405049913,,PRUNED
1344,1344,43.75,2025-05-25 19:25:57.327356,2025-05-25 19:26:16.861846,0 days 00:00:19.534490,AdamW,0.4248913951168958,,,0.00015490756192844407,,,,2,,,0.0006552000009870133,,PRUNED
1345,1345,37.5,2025-05-25 19:26:16.920081,2025-05-25 19:26:36.561327,0 days 00:00:19.641246,AdamW,0.21634950983161136,,,7.564408909000002e-05,,,,1,,,0.003280121585296549,,PRUNED
1346,1346,33.333333333333336,2025-05-25 19:26:36.620706,2025-05-25 19:26:56.845008,0 days 00:00:20.224302,AdamW,0.24543349851650684,,,0.00011252955146538522,,,,2,,,0.0002976448410150806,,PRUNED
1347,1347,33.333333333333336,2025-05-25 19:26:56.903050,2025-05-25 19:27:16.466802,0 days 00:00:19.563752,Adam,0.20862140645334684,,0.005785005488213521,,,,,0,,1.0970942217418473,,,PRUNED
1348,1348,50.0,2025-05-25 19:27:16.525447,2025-05-25 19:27:36.228653,0 days 00:00:19.703206,AdamW,0.38006313537930636,,,9.258882506724575e-05,,,,3,,,0.00035230462514660517,,PRUNED
1349,1349,33.333333333333336,2025-05-25 19:27:36.287328,2025-05-25 19:27:55.992180,0 days 00:00:19.704852,Adadelta,0.13085899053061364,16.03206525161732,,,,,,1,4.693671742648835,,,,PRUNED
1350,1350,33.333333333333336,2025-05-25 19:27:56.050261,2025-05-25 19:28:15.723690,0 days 00:00:19.673429,AdamW,0.23120011086083161,,,0.00037494066023349476,,,,0,,,0.009779473788125234,,PRUNED
1351,1351,35.416666666666664,2025-05-25 19:28:15.794330,2025-05-25 19:28:35.385257,0 days 00:00:19.590927,AdamW,0.26392654129915016,,,0.00013749837011168937,,,,2,,,0.00250920647058694,,PRUNED
1352,1352,33.333333333333336,2025-05-25 19:28:35.443583,2025-05-25 19:28:55.341484,0 days 00:00:19.897901,AdamW,0.1830565965024295,,,0.00016212411222698506,,,,1,,,0.0021482729293691716,,PRUNED
1353,1353,33.333333333333336,2025-05-25 19:28:55.401267,2025-05-25 19:29:15.050031,0 days 00:00:19.648764,AdamW,0.2018385636150343,,,5.941131707672123e-05,,,,1,,,0.0018699260793630056,,PRUNED
1354,1354,72.91666666666667,2025-05-25 19:29:15.109522,2025-05-25 19:29:46.315489,0 days 00:00:31.205967,AdamW,0.48433075410885673,,,0.0002578990601754676,,,,2,,,0.0029274545543919715,,COMPLETE
1355,1355,33.333333333333336,2025-05-25 19:29:46.383441,2025-05-25 19:30:06.069368,0 days 00:00:19.685927,AdamW,0.4785034159909017,,,0.0003246167053270202,,,,2,,,0.003064267691171807,,PRUNED
1356,1356,33.333333333333336,2025-05-25 19:30:06.127742,2025-05-25 19:30:25.989512,0 days 00:00:19.861770,AdamW,0.49139064221620066,,,0.0004333807664568294,,,,2,,,0.003390976548303293,,PRUNED
1357,1357,33.333333333333336,2025-05-25 19:30:26.049280,2025-05-25 19:30:45.644446,0 days 00:00:19.595166,AdamW,0.4834732256306335,,,0.00028777520535016324,,,,2,,,0.003098222813148141,,PRUNED
1358,1358,33.333333333333336,2025-05-25 19:30:45.704756,2025-05-25 19:31:05.275136,0 days 00:00:19.570380,AdamW,0.47197666820438744,,,0.00033242653884246157,,,,2,,,0.002952832985622771,,PRUNED
1359,1359,33.333333333333336,2025-05-25 19:31:05.333453,2025-05-25 19:31:24.992279,0 days 00:00:19.658826,AdamW,0.4660991767558328,,,0.0002446512746775561,,,,2,,,0.003625141423896282,,PRUNED
1360,1360,50.0,2025-05-25 19:31:25.051290,2025-05-25 19:31:44.633249,0 days 00:00:19.581959,AdamW,0.4980166007621402,,,0.0002658195819352109,,,,2,,,0.002942191670084893,,PRUNED
1361,1361,43.75,2025-05-25 19:31:44.691263,2025-05-25 19:32:04.365010,0 days 00:00:19.673747,AdamW,0.47301274986801095,,,0.000304952462341961,,,,2,,,0.0027473157930350545,,PRUNED
1362,1362,33.333333333333336,2025-05-25 19:32:04.438113,2025-05-25 19:32:24.007749,0 days 00:00:19.569636,AdamW,0.44879401163360777,,,0.00037141695042350916,,,,2,,,0.0032202685170863114,,PRUNED
1363,1363,33.333333333333336,2025-05-25 19:32:24.264797,2025-05-25 19:32:43.828289,0 days 00:00:19.563492,AdamW,0.4626695378285201,,,0.0002645611504536669,,,,2,,,0.003686770953316375,,PRUNED
1364,1364,33.333333333333336,2025-05-25 19:32:43.886982,2025-05-25 19:33:03.546868,0 days 00:00:19.659886,AdamW,0.3728626245585414,,,0.00022768406858379234,,,,2,,,0.002891465992767144,,PRUNED
1365,1365,,2025-05-25 19:33:03.611964,2025-05-25 19:33:21.713281,0 days 00:00:18.101317,SGD,0.4631228463993163,,,,0.0038273198564297024,84.67544172242141,True,2,,,,3.7029237868030322,PRUNED
1366,1366,33.333333333333336,2025-05-25 19:33:21.769084,2025-05-25 19:33:41.398417,0 days 00:00:19.629333,AdamW,0.35414019500051486,,,0.0003078153035263388,,,,2,,,0.0033249839507564654,,PRUNED
1367,1367,33.333333333333336,2025-05-25 19:33:41.457454,2025-05-25 19:34:01.055757,0 days 00:00:19.598303,AdamW,0.4913711563382879,,,0.00023434419035897619,,,,2,,,0.002762932220940162,,PRUNED
1368,1368,33.333333333333336,2025-05-25 19:34:01.114863,2025-05-25 19:34:20.767412,0 days 00:00:19.652549,AdamW,0.36773973449191,,,0.00039589706928452834,,,,2,,,0.003416078874889611,,PRUNED
1369,1369,35.416666666666664,2025-05-25 19:34:20.825561,2025-05-25 19:34:40.381600,0 days 00:00:19.556039,AdamW,0.4593186568104814,,,0.00021289225055481383,,,,2,,,0.002762004857769679,,PRUNED
1370,1370,45.833333333333336,2025-05-25 19:34:40.440288,2025-05-25 19:35:00.117725,0 days 00:00:19.677437,AdamW,0.3457071409226563,,,7.36199870254268e-05,,,,2,,,0.0005032328007249491,,PRUNED
1371,1371,33.333333333333336,2025-05-25 19:35:00.181047,2025-05-25 19:35:19.912598,0 days 00:00:19.731551,AdamW,0.4923321826421427,,,0.0002731982526589626,,,,2,,,0.0003893615915769746,,PRUNED
