,number,value,datetime_start,datetime_complete,duration,params_algorithm,params_dropout_rate,params_lr_Adadelta,params_lr_Adam,params_lr_AdamW,params_lr_SGD,params_momentum_SGD,params_nesterov_SGD,params_suggested_freeze,params_weight_decay_Adadelta,params_weight_decay_Adam,params_weight_decay_AdamW,params_weight_decay_SGD,state
459,459,,2025-05-25 14:28:51.263426,2025-05-25 14:29:09.631699,0 days 00:00:18.368273,SGD,0.43258287707811854,,,,1.1681906711995095e-05,81.62776193820868,False,2,,,,0.5314499686117148,PRUNED
460,460,29.166666666666668,2025-05-25 14:29:09.680607,2025-05-25 14:29:29.652272,0 days 00:00:19.971665,AdamW,0.13601577572152657,,,3.95750945419422e-05,,,,1,,,0.0006465437938001932,,PRUNED
461,461,35.416666666666664,2025-05-25 14:29:29.700687,2025-05-25 14:29:49.388087,0 days 00:00:19.687400,AdamW,0.2170088819519868,,,8.79068516494941e-05,,,,0,,,0.0019663882981339324,,PRUNED
462,462,33.333333333333336,2025-05-25 14:29:49.436635,2025-05-25 14:30:09.198528,0 days 00:00:19.761893,AdamW,0.1612877436662419,,,0.00014948386945915756,,,,2,,,0.009895290481817757,,PRUNED
463,463,33.333333333333336,2025-05-25 14:30:09.247249,2025-05-25 14:30:29.192600,0 days 00:00:19.945351,AdamW,0.367949705301861,,,0.00024623301689984464,,,,0,,,0.0015992094606469142,,PRUNED
464,464,33.333333333333336,2025-05-25 14:30:29.232399,2025-05-25 14:30:48.693194,0 days 00:00:19.460795,AdamW,0.25752868158919406,,,0.00010390668739739177,,,,5,,,0.0005477046588943056,,PRUNED
465,465,39.583333333333336,2025-05-25 14:30:48.730542,2025-05-25 14:31:08.331412,0 days 00:00:19.600870,AdamW,0.24482089741141277,,,4.842518974464418e-05,,,,3,,,0.003127245284661032,,PRUNED
466,466,47.916666666666664,2025-05-25 14:31:08.368786,2025-05-25 14:31:28.005421,0 days 00:00:19.636635,Adam,0.23109999827263206,,8.7931817008629e-05,,,,,1,,0.017349379717865553,,,PRUNED
467,467,37.5,2025-05-25 14:31:28.042992,2025-05-25 14:31:47.590066,0 days 00:00:19.547074,AdamW,0.275768632793043,,,0.0003892866725266174,,,,2,,,0.0003522313012112584,,PRUNED
468,468,33.333333333333336,2025-05-25 14:31:47.629330,2025-05-25 14:32:07.423875,0 days 00:00:19.794545,AdamW,0.18200765224397347,,,7.863945383879347e-05,,,,1,,,0.0010263330906169676,,PRUNED
469,469,43.75,2025-05-25 14:32:07.461398,2025-05-25 14:32:24.855363,0 days 00:00:17.393965,AdamW,0.08508366150299757,,,2.9791166961562993e-05,,,,1,,,0.0002408141726926176,,PRUNED
470,470,33.333333333333336,2025-05-25 14:32:24.882173,2025-05-25 14:32:31.660057,0 days 00:00:06.777884,AdamW,0.4169301660745408,,,0.00018835130807860854,,,,5,,,0.004369132040027673,,PRUNED
471,471,33.333333333333336,2025-05-25 14:32:31.707331,2025-05-25 14:32:48.934061,0 days 00:00:17.226730,AdamW,0.2593474728241337,,,0.00013352957625846072,,,,0,,,0.00080269235175798,,PRUNED
472,472,37.5,2025-05-25 14:32:48.984225,2025-05-25 14:32:57.784031,0 days 00:00:08.799806,AdamW,0.29266050658367304,,,5.46620523479541e-05,,,,6,,,0.002567565493816249,,PRUNED
473,473,35.416666666666664,2025-05-25 14:32:57.813394,2025-05-25 14:33:07.094818,0 days 00:00:09.281424,AdamW,0.3126950932132765,,,6.610683901935751e-05,,,,2,,,0.0004558629940962328,,PRUNED
474,474,39.583333333333336,2025-05-25 14:33:07.132496,2025-05-25 14:33:26.789314,0 days 00:00:19.656818,Adam,0.20305965956445504,,0.0002187235351980619,,,,,2,,0.1383629046074125,,,PRUNED
475,475,33.333333333333336,2025-05-25 14:33:26.828070,2025-05-25 14:33:46.305052,0 days 00:00:19.476982,AdamW,0.15144235310674262,,,0.00011722899277745937,,,,5,,,0.0028951548669626575,,PRUNED
476,476,31.25,2025-05-25 14:33:46.343584,2025-05-25 14:34:05.962808,0 days 00:00:19.619224,AdamW,0.40916252495295474,,,0.0001661443952950167,,,,1,,,0.0007082215846302354,,PRUNED
477,477,45.833333333333336,2025-05-25 14:34:06.000144,2025-05-25 14:34:25.765740,0 days 00:00:19.765596,AdamW,0.24110529652445115,,,9.918606097126408e-05,,,,0,,,0.0022812349236777016,,PRUNED
478,478,33.333333333333336,2025-05-25 14:34:25.803221,2025-05-25 14:34:45.474544,0 days 00:00:19.671323,AdamW,0.2716827248244318,,,8.067330781590806e-05,,,,2,,,0.0003302565769282846,,PRUNED
479,479,33.333333333333336,2025-05-25 14:34:45.511878,2025-05-25 14:35:05.264317,0 days 00:00:19.752439,AdamW,0.13072108260076934,,,0.00012777988605768467,,,,1,,,0.0032962205027289703,,PRUNED
480,480,33.333333333333336,2025-05-25 14:35:05.344503,2025-05-25 14:35:24.606710,0 days 00:00:19.262207,AdamW,0.33192679470708814,,,0.00015274150822325598,,,,0,,,0.0005637052406992782,,PRUNED
481,481,41.666666666666664,2025-05-25 14:35:24.645094,2025-05-25 14:35:44.394206,0 days 00:00:19.749112,AdamW,0.02447779710750847,,,8.955620625677329e-05,,,,1,,,0.0017501614750202682,,PRUNED
482,482,39.583333333333336,2025-05-25 14:35:44.431488,2025-05-25 14:36:04.310361,0 days 00:00:19.878873,AdamW,0.17306038051163586,,,0.00021638839124491654,,,,0,,,0.0004122890563929407,,PRUNED
483,483,37.5,2025-05-25 14:36:04.359782,2025-05-25 14:36:23.839756,0 days 00:00:19.479974,Adam,0.22570272279144432,,0.00010075906195504646,,,,,3,,0.8744022178726473,,,PRUNED
484,484,,2025-05-25 14:36:23.889927,2025-05-25 14:36:42.467989,0 days 00:00:18.578062,SGD,0.2543342123249184,,,,3.444899880704022e-05,33.713720264985994,True,2,,,,1.808305237947443,PRUNED
485,485,41.666666666666664,2025-05-25 14:36:42.513962,2025-05-25 14:37:01.950849,0 days 00:00:19.436887,AdamW,0.1672664740434733,,,6.389155295665044e-05,,,,5,,,0.00038244015631994956,,PRUNED
486,486,39.583333333333336,2025-05-25 14:37:01.998619,2025-05-25 14:37:21.450891,0 days 00:00:19.452272,AdamW,0.09336280916556246,,,0.00011366591203185338,,,,5,,,0.0020485001744786017,,PRUNED
487,487,33.333333333333336,2025-05-25 14:37:21.504586,2025-05-25 14:37:41.103420,0 days 00:00:19.598834,AdamW,0.39830894424251456,,,0.0001872603064315839,,,,1,,,0.0006142576031378639,,PRUNED
488,488,47.916666666666664,2025-05-25 14:37:41.151920,2025-05-25 14:38:00.802427,0 days 00:00:19.650507,AdamW,0.11600372551868304,,,4.3798866357907326e-05,,,,2,,,0.0014845206328047637,,PRUNED
489,489,45.833333333333336,2025-05-25 14:38:00.850115,2025-05-25 14:38:17.871535,0 days 00:00:17.021420,AdamW,0.1856893897922693,,,0.0001381015880148251,,,,0,,,0.002782270258575689,,PRUNED
490,490,50.0,2025-05-25 14:38:17.920026,2025-05-25 14:38:38.733024,0 days 00:00:20.812998,AdamW,0.1462952323323107,,,9.972026033956359e-05,,,,4,,,0.0024453468944906293,,PRUNED
491,491,33.333333333333336,2025-05-25 14:38:38.768451,2025-05-25 14:38:53.033480,0 days 00:00:14.265029,AdamW,0.3540683063360471,,,0.000261660717519748,,,,4,,,0.000183500636614388,,PRUNED
492,492,31.25,2025-05-25 14:38:53.081859,2025-05-25 14:39:12.647702,0 days 00:00:19.565843,Adam,0.15951691076874105,,3.46777984472347e-05,,,,,1,,33.687279917686816,,,PRUNED
493,493,43.75,2025-05-25 14:39:12.696392,2025-05-25 14:39:32.373577,0 days 00:00:19.677185,AdamW,0.05354314369564332,,,2.320401430818089e-05,,,,0,,,0.003736104193365062,,PRUNED
494,494,41.666666666666664,2025-05-25 14:39:32.422728,2025-05-25 14:39:54.525962,0 days 00:00:22.103234,AdamW,0.2449329095741908,,,7.199740438898917e-05,,,,1,,,0.0005255241691538379,,PRUNED
495,495,56.25,2025-05-25 14:39:54.564519,2025-05-25 14:40:16.725659,0 days 00:00:22.161140,AdamW,0.3005660300564411,,,5.582319383252655e-05,,,,2,,,0.00047613339185114767,,PRUNED
496,496,39.583333333333336,2025-05-25 14:40:16.773852,2025-05-25 14:40:36.480120,0 days 00:00:19.706268,AdamW,0.26141468727374595,,,8.464732619364075e-05,,,,5,,,0.0030708830688071422,,PRUNED
497,497,33.333333333333336,2025-05-25 14:40:36.527037,2025-05-25 14:40:56.070239,0 days 00:00:19.543202,AdamW,0.28261325685355043,,,3.317373936828383e-05,,,,3,,,0.0018597946506498794,,PRUNED
498,498,33.333333333333336,2025-05-25 14:40:56.120737,2025-05-25 14:41:15.731423,0 days 00:00:19.610686,AdamW,0.23734652962047392,,,0.000681859651353239,,,,1,,,0.0003032481494115468,,PRUNED
499,499,33.333333333333336,2025-05-25 14:41:15.780406,2025-05-25 14:41:35.446393,0 days 00:00:19.665987,AdamW,0.37475053798530716,,,0.0015196791368822674,,,,0,,,0.002266001752731606,,PRUNED
500,500,33.333333333333336,2025-05-25 14:41:35.494765,2025-05-25 14:41:55.092497,0 days 00:00:19.597732,AdamW,0.24965903611249332,,,0.0001112198920384557,,,,2,,,0.00012437575738015157,,PRUNED
501,501,41.666666666666664,2025-05-25 14:41:55.130528,2025-05-25 14:42:14.729855,0 days 00:00:19.599327,Adam,0.15612502135371423,,6.099454429961831e-05,,,,,5,,0.08543628931182687,,,PRUNED
502,502,33.333333333333336,2025-05-25 14:42:14.779097,2025-05-25 14:42:34.556559,0 days 00:00:19.777462,AdamW,0.21125569554796314,,,0.0001706091550271986,,,,1,,,0.0026887325623370585,,PRUNED
503,503,35.416666666666664,2025-05-25 14:42:34.604727,2025-05-25 14:42:54.287770,0 days 00:00:19.683043,AdamW,0.19625588279382744,,,0.00013265555290086723,,,,0,,,0.003282900210743209,,PRUNED
504,504,33.333333333333336,2025-05-25 14:42:54.336362,2025-05-25 14:43:14.170572,0 days 00:00:19.834210,AdamW,0.13683540573181782,,,0.0002177194067066262,,,,2,,,0.00027175276677851503,,PRUNED
505,505,,2025-05-25 14:43:14.218502,2025-05-25 14:43:33.204823,0 days 00:00:18.986321,SGD,0.2674760313648814,,,,0.00025997714303253297,11.182160522818556,False,1,,,,11.559108863933695,PRUNED
506,506,54.166666666666664,2025-05-25 14:43:33.251725,2025-05-25 14:43:55.440494,0 days 00:00:22.188769,AdamW,0.17443372851616804,,,9.193756732354018e-05,,,,1,,,0.0004371795697442235,,PRUNED
507,507,33.333333333333336,2025-05-25 14:43:55.478784,2025-05-25 14:44:15.589332,0 days 00:00:20.110548,AdamW,0.2221172949700864,,,0.006932641761672661,,,,2,,,0.003973997792560328,,PRUNED
508,508,33.333333333333336,2025-05-25 14:44:15.639829,2025-05-25 14:44:35.238166,0 days 00:00:19.598337,AdamW,0.0010361335523068234,,,0.00015210932320852132,,,,5,,,0.002171836590780587,,PRUNED
509,509,33.333333333333336,2025-05-25 14:44:35.290898,2025-05-25 14:44:55.515162,0 days 00:00:20.224264,AdamW,0.10499793135739344,,,7.246507967411075e-05,,,,0,,,0.00036729252080161675,,PRUNED
510,510,43.75,2025-05-25 14:44:55.570691,2025-05-25 14:45:15.384097,0 days 00:00:19.813406,Adam,0.015503663102844789,,1.0070530827822606e-05,,,,,1,,95.64965154721841,,,PRUNED
511,511,33.333333333333336,2025-05-25 14:45:15.434204,2025-05-25 14:45:35.541631,0 days 00:00:20.107427,AdamW,0.23297597721134106,,,0.05723263694143197,,,,1,,,0.002461540432942267,,PRUNED
512,512,33.333333333333336,2025-05-25 14:45:35.584105,2025-05-25 14:45:55.435415,0 days 00:00:19.851310,AdamW,0.2567125026615868,,,0.00032749946584806973,,,,0,,,0.0006833928477428381,,PRUNED
513,513,33.333333333333336,2025-05-25 14:45:55.485025,2025-05-25 14:46:15.069963,0 days 00:00:19.584938,AdamW,0.32362182031894754,,,0.0004694373438459976,,,,5,,,0.0029101840041766587,,PRUNED
514,514,35.416666666666664,2025-05-25 14:46:15.118835,2025-05-25 14:46:34.827327,0 days 00:00:19.708492,AdamW,0.18313138557337383,,,0.0001115378483700703,,,,2,,,0.0035684973741083154,,PRUNED
515,515,37.5,2025-05-25 14:46:34.881572,2025-05-25 14:46:54.805494,0 days 00:00:19.923922,AdamW,0.27079529674122216,,,1.743819166358556e-05,,,,1,,,0.0006034697580188945,,PRUNED
516,516,62.5,2025-05-25 14:46:54.855452,2025-05-25 14:47:24.252825,0 days 00:00:29.397373,AdamW,0.1477447955024722,,,5.9144918910360335e-05,,,,2,,,0.0004830958916130193,,PRUNED
517,517,35.416666666666664,2025-05-25 14:47:24.294576,2025-05-25 14:47:44.140119,0 days 00:00:19.845543,AdamW,0.12620718609748138,,,4.70377078355433e-05,,,,0,,,0.001965645593453048,,PRUNED
518,518,52.083333333333336,2025-05-25 14:47:44.195013,2025-05-25 14:48:15.866639,0 days 00:00:31.671626,AdamW,0.42748951364433946,,,0.00013101844129589387,,,,3,,,0.0026199432792542027,,COMPLETE
519,519,33.333333333333336,2025-05-25 14:48:15.923199,2025-05-25 14:48:35.579168,0 days 00:00:19.655969,Adam,0.1670250084624438,,0.023790864027020315,,,,,5,,0.4127170030152834,,,PRUNED
520,520,52.083333333333336,2025-05-25 14:48:35.627004,2025-05-25 14:48:57.955195,0 days 00:00:22.328191,AdamW,0.27998645273669315,,,8.712583786751912e-05,,,,0,,,0.0029705338030693094,,PRUNED
521,521,35.416666666666664,2025-05-25 14:48:57.993625,2025-05-25 14:49:18.011363,0 days 00:00:20.017738,AdamW,0.2643256662733284,,,0.000171242792485207,,,,1,,,0.0008892851657638117,,PRUNED
522,522,33.333333333333336,2025-05-25 14:49:18.060883,2025-05-25 14:49:37.782967,0 days 00:00:19.722084,AdamW,0.24800717544649697,,,0.0001020648084672869,,,,2,,,0.0007649365692442118,,PRUNED
523,523,33.333333333333336,2025-05-25 14:49:37.832341,2025-05-25 14:49:57.553616,0 days 00:00:19.721275,AdamW,0.07267722219772642,,,7.4270782272971e-05,,,,2,,,0.0005517301550442561,,PRUNED
524,524,33.333333333333336,2025-05-25 14:49:57.604181,2025-05-25 14:50:17.330289,0 days 00:00:19.726108,AdamW,0.24040495994882205,,,0.00012381373692616057,,,,5,,,0.0004055455544808079,,PRUNED
525,525,56.25,2025-05-25 14:50:17.383050,2025-05-25 14:50:41.937040,0 days 00:00:24.553990,AdamW,0.16195067825137294,,,0.0002048539598306319,,,,1,,,0.00031582803033288777,,PRUNED
526,526,37.5,2025-05-25 14:50:41.978368,2025-05-25 14:51:01.184290,0 days 00:00:19.205922,AdamW,0.18926816307394878,,,4.060791585744626e-05,,,,6,,,0.002189887988001332,,PRUNED
527,527,33.333333333333336,2025-05-25 14:51:01.229416,2025-05-25 14:51:20.898328,0 days 00:00:19.668912,Adam,0.25163603960705305,,0.004259744032660462,,,,,4,,0.2342969601534899,,,PRUNED
528,528,39.583333333333336,2025-05-25 14:51:20.947963,2025-05-25 14:51:40.730169,0 days 00:00:19.782206,AdamW,0.1764217685613496,,,0.00015014376345681504,,,,1,,,0.0016975452571736935,,PRUNED
529,529,,2025-05-25 14:51:40.780245,2025-05-25 14:51:58.919287,0 days 00:00:18.139042,SGD,0.3420299775272905,,,,0.03068234580493138,53.746106373812395,True,0,,,,47.91317233496462,PRUNED
530,530,37.5,2025-05-25 14:51:58.968121,2025-05-25 14:52:18.869853,0 days 00:00:19.901732,AdamW,0.30836477146701696,,,5.9571945093127804e-05,,,,2,,,0.002412406524344333,,PRUNED
531,531,33.333333333333336,2025-05-25 14:52:18.922751,2025-05-25 14:52:39.087043,0 days 00:00:20.164292,AdamW,0.445385269708536,,,0.0002796330047986356,,,,1,,,0.003387569041816191,,PRUNED
532,532,33.333333333333336,2025-05-25 14:52:39.137052,2025-05-25 14:52:59.189883,0 days 00:00:20.052831,AdamW,0.14422179721740844,,,0.0001008977590023914,,,,0,,,0.0013211698216106075,,PRUNED
533,533,39.583333333333336,2025-05-25 14:52:59.242265,2025-05-25 14:53:19.201859,0 days 00:00:19.959594,AdamW,0.11812077956852138,,,8.810411422026025e-05,,,,1,,,0.0027742637611025993,,PRUNED
534,534,43.75,2025-05-25 14:53:19.251816,2025-05-25 14:53:41.423164,0 days 00:00:22.171348,AdamW,0.2940292479501526,,,7.070406853700321e-05,,,,5,,,0.0003470478238901257,,PRUNED
535,535,33.333333333333336,2025-05-25 14:53:41.462584,2025-05-25 14:54:01.698063,0 days 00:00:20.235479,AdamW,0.04405326432895146,,,0.0001792079402552659,,,,2,,,0.004136923364027075,,PRUNED
536,536,33.333333333333336,2025-05-25 14:54:01.746453,2025-05-25 14:54:21.726742,0 days 00:00:19.980289,Adadelta,0.3859414327269568,43.730900672650506,,,,,,1,0.0404216055266851,,,,PRUNED
537,537,56.25,2025-05-25 14:54:21.778756,2025-05-25 14:54:43.959160,0 days 00:00:22.180404,AdamW,0.4184144276528638,,,0.00011720179040218196,,,,0,,,0.004940359075523971,,PRUNED
538,538,33.333333333333336,2025-05-25 14:54:43.998636,2025-05-25 14:55:03.877012,0 days 00:00:19.878376,Adam,0.23349412155093077,,0.0005634936410460236,,,,,2,,59.58539644940629,,,PRUNED
539,539,35.416666666666664,2025-05-25 14:55:03.929411,2025-05-25 14:55:23.566901,0 days 00:00:19.637490,AdamW,0.25875982170350886,,,0.00014763175756976623,,,,5,,,0.003068841392344168,,PRUNED
540,540,79.16666666666667,2025-05-25 14:55:23.619169,2025-05-25 14:55:55.041039,0 days 00:00:31.421870,AdamW,0.2186497913653813,,,0.00023258317064876733,,,,3,,,0.0005073306215026805,,COMPLETE
541,541,33.333333333333336,2025-05-25 14:55:55.098619,2025-05-25 14:56:14.860639,0 days 00:00:19.762020,AdamW,0.19173881065694706,,,0.0002989164757970171,,,,3,,,0.00047396555746886883,,PRUNED
542,542,33.333333333333336,2025-05-25 14:56:14.910096,2025-05-25 14:56:34.674105,0 days 00:00:19.764009,AdamW,0.20147796060815035,,,0.00020822087375436,,,,3,,,0.0005391114214758836,,PRUNED
543,543,33.333333333333336,2025-05-25 14:56:34.724689,2025-05-25 14:56:54.398009,0 days 00:00:19.673320,AdamW,0.21095970903064953,,,0.00023909006083694653,,,,4,,,0.0005972950125645537,,PRUNED
544,544,47.916666666666664,2025-05-25 14:56:54.452870,2025-05-25 14:57:14.045380,0 days 00:00:19.592510,AdamW,0.22930601804639558,,,0.00023270680112283672,,,,4,,,0.0005030433945109271,,PRUNED
545,545,33.333333333333336,2025-05-25 14:57:14.094928,2025-05-25 14:57:33.929934,0 days 00:00:19.835006,AdamW,0.2201422695113496,,,0.0001815603028870571,,,,3,,,0.0006522548085724373,,PRUNED
546,546,79.16666666666667,2025-05-25 14:57:33.981738,2025-05-25 14:58:05.662796,0 days 00:00:31.681058,AdamW,0.17953561781539057,,,0.00041096197764986693,,,,3,,,0.0004367979608963668,,COMPLETE
547,547,33.333333333333336,2025-05-25 14:58:05.720377,2025-05-25 14:58:25.808360,0 days 00:00:20.087983,AdamW,0.2005508319209159,,,0.0003051799199284953,,,,3,,,0.0004498245325062256,,PRUNED
548,548,33.333333333333336,2025-05-25 14:58:25.858022,2025-05-25 14:58:45.510910,0 days 00:00:19.652888,AdamW,0.18323801689407138,,,0.00026508657579133696,,,,3,,,0.00043648568629246027,,PRUNED
549,549,33.333333333333336,2025-05-25 14:58:45.560572,2025-05-25 14:59:05.286764,0 days 00:00:19.726192,AdamW,0.1756240007532982,,,0.0003217466732382007,,,,3,,,0.00038265149334419874,,PRUNED
550,550,33.333333333333336,2025-05-25 14:59:05.338496,2025-05-25 14:59:25.121511,0 days 00:00:19.783015,AdamW,0.2143761678044815,,,0.00039122744579913856,,,,3,,,0.00048593038797945274,,PRUNED
551,551,33.333333333333336,2025-05-25 14:59:25.176806,2025-05-25 14:59:44.819029,0 days 00:00:19.642223,AdamW,0.19029316416407413,,,0.00037570476524867495,,,,3,,,0.000433901818145859,,PRUNED
552,552,33.333333333333336,2025-05-25 14:59:44.868379,2025-05-25 15:00:04.519066,0 days 00:00:19.650687,AdamW,0.16858416926891545,,,0.0004896160011741087,,,,3,,,0.00039582224962660866,,PRUNED
553,553,33.333333333333336,2025-05-25 15:00:04.569910,2025-05-25 15:00:24.434635,0 days 00:00:19.864725,AdamW,0.15610482789525815,,,0.00038016993165078037,,,,3,,,0.0005128912895405296,,PRUNED
554,554,33.333333333333336,2025-05-25 15:00:24.489312,2025-05-25 15:00:44.248716,0 days 00:00:19.759404,AdamW,0.20586935462927095,,,0.00021927589695384364,,,,3,,,0.0005675108615107393,,PRUNED
555,555,33.333333333333336,2025-05-25 15:00:44.305368,2025-05-25 15:01:04.166720,0 days 00:00:19.861352,AdamW,0.2216800693155629,,,0.0001345326423423353,,,,3,,,0.00047434211023081915,,PRUNED
556,556,33.333333333333336,2025-05-25 15:01:04.215731,2025-05-25 15:01:24.259080,0 days 00:00:20.043349,AdamW,0.1714853944047484,,,0.0008453720954103732,,,,2,,,0.0004159007480477461,,PRUNED
557,557,37.5,2025-05-25 15:01:24.307775,2025-05-25 15:01:43.907254,0 days 00:00:19.599479,AdamW,0.1907707615947592,,,0.0001103267755928627,,,,3,,,0.0005497072079067807,,PRUNED
558,558,33.333333333333336,2025-05-25 15:01:43.945982,2025-05-25 15:02:03.840129,0 days 00:00:19.894147,AdamW,0.17754118529167734,,,0.0002804696710783515,,,,2,,,0.00037630226676509587,,PRUNED
559,559,33.333333333333336,2025-05-25 15:02:03.889065,2025-05-25 15:02:23.627731,0 days 00:00:19.738666,AdamW,0.16376309008391698,,,0.0001603217348700947,,,,2,,,0.0005048938454047949,,PRUNED
560,560,33.333333333333336,2025-05-25 15:02:23.665957,2025-05-25 15:02:43.375961,0 days 00:00:19.710004,AdamW,0.20214771338958615,,,8.393929917467518e-05,,,,4,,,0.00045338471943417747,,PRUNED
561,561,68.75,2025-05-25 15:02:43.424401,2025-05-25 15:03:14.823070,0 days 00:00:31.398669,AdamW,0.09520780748591351,,,0.00010494606036878036,,,,3,,,0.0025910473309616136,,COMPLETE
562,562,33.333333333333336,2025-05-25 15:03:14.879932,2025-05-25 15:03:34.792923,0 days 00:00:19.912991,AdamW,0.0928227371969794,,,9.947067988465699e-05,,,,3,,,0.002552542956426217,,PRUNED
563,563,33.333333333333336,2025-05-25 15:03:34.841883,2025-05-25 15:03:54.545933,0 days 00:00:19.704050,AdamW,0.07993633993021242,,,0.0001252545228766474,,,,3,,,0.0024359458899321927,,PRUNED
564,564,33.333333333333336,2025-05-25 15:03:54.599993,2025-05-25 15:04:14.320421,0 days 00:00:19.720428,AdamW,0.1815795371673131,,,0.0001178265674632896,,,,3,,,0.0067641262678857506,,PRUNED
565,565,43.75,2025-05-25 15:04:14.372590,2025-05-25 15:04:34.137932,0 days 00:00:19.765342,AdamW,0.0916686907396799,,,9.445693154855317e-05,,,,3,,,0.0026743214604356496,,PRUNED
566,566,33.333333333333336,2025-05-25 15:04:34.188242,2025-05-25 15:04:54.027750,0 days 00:00:19.839508,AdamW,0.07982980480363316,,,0.0001482914434515176,,,,3,,,0.002139399100216187,,PRUNED
567,567,33.333333333333336,2025-05-25 15:04:54.076921,2025-05-25 15:05:13.660654,0 days 00:00:19.583733,AdamW,0.09867965864981129,,,8.05705469430459e-05,,,,3,,,0.0029201728259858613,,PRUNED
568,568,39.583333333333336,2025-05-25 15:05:13.711215,2025-05-25 15:05:33.399457,0 days 00:00:19.688242,AdamW,0.10392724329023928,,,0.00017721245964067895,,,,3,,,0.002315568237106666,,PRUNED
569,569,56.25,2025-05-25 15:05:33.451783,2025-05-25 15:06:02.543190,0 days 00:00:29.091407,AdamW,0.07243796142645512,,,0.00010527098760895194,,,,3,,,0.0032108821097498927,,PRUNED
570,570,66.66666666666667,2025-05-25 15:06:02.593365,2025-05-25 15:06:31.872556,0 days 00:00:29.279191,AdamW,0.09930485520533601,,,0.00024296266468386057,,,,3,,,0.0026838853395293855,,PRUNED
571,571,33.333333333333336,2025-05-25 15:06:31.924365,2025-05-25 15:06:51.724260,0 days 00:00:19.799895,AdamW,0.09330449481428878,,,0.00013020968475886924,,,,0,,,0.00021540791010665752,,PRUNED
572,572,33.333333333333336,2025-05-25 15:06:51.775395,2025-05-25 15:07:11.507367,0 days 00:00:19.731972,AdamW,0.0841044029750059,,,0.0004238283709197128,,,,3,,,0.0020619959007558007,,PRUNED
573,573,33.333333333333336,2025-05-25 15:07:11.548075,2025-05-25 15:07:31.291219,0 days 00:00:19.743144,AdamW,0.11152597922716989,,,0.00019461296952517706,,,,4,,,0.0018923016269081748,,PRUNED
