,number,value,datetime_start,datetime_complete,duration,params_algorithm,params_dropout_rate,params_lr_Adadelta,params_lr_Adam,params_lr_AdamW,params_lr_SGD,params_momentum_SGD,params_nesterov_SGD,params_suggested_freeze,params_weight_decay_Adadelta,params_weight_decay_Adam,params_weight_decay_AdamW,params_weight_decay_SGD,state
1486,1486,41.666666666666664,2025-05-25 20:11:28.699018,2025-05-25 20:11:40.254272,0 days 00:00:11.555254,AdamW,0.30813222490524816,,,0.00016388174217503882,,,,0,,,0.0021573163968029224,,PRUNED
1487,1487,,2025-05-25 20:11:40.307744,2025-05-25 20:11:50.329174,0 days 00:00:10.021430,SGD,0.36960938191192105,,,,0.04945080870738197,87.67245547910505,False,3,,,,1.9033756864160198,PRUNED
1488,1488,50.0,2025-05-25 20:11:50.380242,2025-05-25 20:12:01.979105,0 days 00:00:11.598863,AdamW,0.16529607153848597,,,0.00034888569615932724,,,,2,,,0.000395437033754266,,PRUNED
1489,1489,33.333333333333336,2025-05-25 20:12:02.033226,2025-05-25 20:12:13.261272,0 days 00:00:11.228046,AdamW,0.3572758121276559,,,8.195991191308306e-05,,,,3,,,0.00048056601701094125,,PRUNED
1490,1490,50.0,2025-05-25 20:12:13.313644,2025-05-25 20:12:24.520946,0 days 00:00:11.207302,AdamW,0.21326661256244372,,,0.00013880027556282412,,,,4,,,0.0027803611830955447,,PRUNED
1491,1491,33.333333333333336,2025-05-25 20:12:24.574271,2025-05-25 20:12:35.914202,0 days 00:00:11.339931,AdamW,0.23334101559994622,,,0.000209503447966517,,,,0,,,0.0007832089898649689,,PRUNED
1492,1492,31.25,2025-05-25 20:12:35.967573,2025-05-25 20:12:47.497458,0 days 00:00:11.529885,AdamW,0.18103337621017673,,,7.222865242649442e-05,,,,2,,,0.00023941100779582947,,PRUNED
1493,1493,33.333333333333336,2025-05-25 20:12:47.552551,2025-05-25 20:12:59.147591,0 days 00:00:11.595040,Adam,0.22260352334353034,,1.9298178637387462e-05,,,,,2,,0.04235381699326099,,,PRUNED
1494,1494,33.333333333333336,2025-05-25 20:12:59.200348,2025-05-25 20:13:10.647643,0 days 00:00:11.447295,AdamW,0.1272440061757995,,,0.0006591420563703338,,,,0,,,0.0003165741720115578,,PRUNED
1495,1495,33.333333333333336,2025-05-25 20:13:10.700175,2025-05-25 20:13:22.144762,0 days 00:00:11.444587,AdamW,0.20359127535000696,,,0.00010039194693435947,,,,2,,,0.001772737659670875,,PRUNED
1496,1496,33.333333333333336,2025-05-25 20:13:22.207151,2025-05-25 20:13:33.529807,0 days 00:00:11.322656,Adadelta,0.24753844750236212,1.1893058750774361,,,,,,3,0.05623686995653247,,,,PRUNED
1497,1497,33.333333333333336,2025-05-25 20:13:33.575903,2025-05-25 20:13:44.900571,0 days 00:00:11.324668,AdamW,0.4863702827466213,,,0.00017012519630828072,,,,0,,,0.002418237133308436,,PRUNED
1498,1498,39.583333333333336,2025-05-25 20:13:44.947768,2025-05-25 20:13:56.487623,0 days 00:00:11.539855,AdamW,0.1428638235805583,,,0.00011852190334601274,,,,2,,,0.003056395596330964,,PRUNED
1499,1499,41.666666666666664,2025-05-25 20:13:56.542845,2025-05-25 20:14:08.291348,0 days 00:00:11.748503,AdamW,0.15771401357026402,,,9.228847474560483e-05,,,,0,,,0.00815881441989462,,PRUNED
1500,1500,50.0,2025-05-25 20:14:08.341732,2025-05-25 20:14:20.013202,0 days 00:00:11.671470,AdamW,0.19657854806258937,,,0.0002753133394943242,,,,2,,,0.000652436248807845,,PRUNED
1501,1501,33.333333333333336,2025-05-25 20:14:20.069890,2025-05-25 20:14:31.747182,0 days 00:00:11.677292,AdamW,0.26735545785845083,,,0.00014130678205596448,,,,3,,,0.0003363076432500896,,PRUNED
1502,1502,41.666666666666664,2025-05-25 20:14:31.800772,2025-05-25 20:14:43.574647,0 days 00:00:11.773875,AdamW,0.17525293698093328,,,5.976860050128781e-05,,,,2,,,0.0022055264684946287,,PRUNED
1503,1503,33.333333333333336,2025-05-25 20:14:43.628658,2025-05-25 20:14:55.162111,0 days 00:00:11.533453,AdamW,0.21760250412886528,,,0.00018393702369931295,,,,0,,,0.0005909733866744376,,PRUNED
1504,1504,35.416666666666664,2025-05-25 20:14:55.215680,2025-05-25 20:15:06.595598,0 days 00:00:11.379918,AdamW,0.18648372663405133,,,0.00011245474049166146,,,,2,,,0.002698534493187878,,PRUNED
1505,1505,35.416666666666664,2025-05-25 20:15:06.647323,2025-05-25 20:15:17.900988,0 days 00:00:11.253665,AdamW,0.23099911486272381,,,8.728647614922586e-05,,,,3,,,0.0003975419909186353,,PRUNED
1506,1506,33.333333333333336,2025-05-25 20:15:17.953695,2025-05-25 20:15:29.273360,0 days 00:00:11.319665,AdamW,0.25175405515935045,,,0.0003880902756396096,,,,0,,,0.0004541746381461435,,PRUNED
1507,1507,33.333333333333336,2025-05-25 20:15:29.325993,2025-05-25 20:15:40.579735,0 days 00:00:11.253742,AdamW,0.2047929083303246,,,0.0013887342890335512,,,,3,,,0.003617203273684416,,PRUNED
1508,1508,33.333333333333336,2025-05-25 20:15:40.632180,2025-05-25 20:15:51.971520,0 days 00:00:11.339340,AdamW,0.43629326800965973,,,0.00021712655358155732,,,,2,,,0.002030959541955384,,PRUNED
1509,1509,33.333333333333336,2025-05-25 20:15:52.025085,2025-05-25 20:16:03.401167,0 days 00:00:11.376082,AdamW,0.24114414538165105,,,0.00014589636266855666,,,,0,,,0.0032619394216152424,,PRUNED
1510,1510,,2025-05-25 20:16:03.455025,2025-05-25 20:16:13.723258,0 days 00:00:10.268233,SGD,0.4746963543482715,,,,1.340995018199525e-05,57.44994933685505,True,2,,,,16.504615869566088,PRUNED
1511,1511,52.083333333333336,2025-05-25 20:16:13.773618,2025-05-25 20:16:24.735279,0 days 00:00:10.961661,AdamW,0.4544238967318953,,,7.086418598186412e-05,,,,4,,,0.0005174108418694863,,PRUNED
1512,1512,35.416666666666664,2025-05-25 20:16:24.783095,2025-05-25 20:16:35.522597,0 days 00:00:10.739502,AdamW,0.29652419310778194,,,0.0001209248488701364,,,,3,,,0.0023225834433974134,,PRUNED
1513,1513,64.58333333333333,2025-05-25 20:16:35.571132,2025-05-25 20:16:54.772608,0 days 00:00:19.201476,AdamW,0.16366473760811917,,,9.812209320944924e-05,,,,0,,,0.0003612516731908041,,PRUNED
1514,1514,37.5,2025-05-25 20:16:54.824093,2025-05-25 20:17:05.738516,0 days 00:00:10.914423,AdamW,0.2138312195946223,,,0.0003136651876611107,,,,2,,,0.0025587930205198035,,PRUNED
1515,1515,33.333333333333336,2025-05-25 20:17:05.785891,2025-05-25 20:17:16.593786,0 days 00:00:10.807895,AdamW,0.19191076870990956,,,0.00016733130653300113,,,,2,,,0.002884834152395658,,PRUNED
1516,1516,39.583333333333336,2025-05-25 20:17:16.649709,2025-05-25 20:17:27.777747,0 days 00:00:11.128038,AdamW,0.3350900756023999,,,8.038291711320129e-05,,,,1,,,0.0004225618882743719,,PRUNED
1517,1517,33.333333333333336,2025-05-25 20:17:27.828753,2025-05-25 20:17:38.870688,0 days 00:00:11.041935,AdamW,0.13694231987668845,,,0.00024235956453270844,,,,0,,,0.000482629401876385,,PRUNED
1518,1518,41.666666666666664,2025-05-25 20:17:38.922320,2025-05-25 20:17:50.174637,0 days 00:00:11.252317,AdamW,0.26034561758958086,,,0.00013821773252049648,,,,2,,,0.00245096841709955,,PRUNED
1519,1519,33.333333333333336,2025-05-25 20:17:50.231794,2025-05-25 20:18:01.026824,0 days 00:00:10.795030,Adadelta,0.22675128875518533,1.849053040744414,,,,,,3,0.09012417289604634,,,,PRUNED
1520,1520,35.416666666666664,2025-05-25 20:18:01.063261,2025-05-25 20:18:11.958005,0 days 00:00:10.894744,Adam,0.2766184725653331,,0.0003172726110600463,,,,,1,,14.555203309632848,,,PRUNED
1521,1521,39.583333333333336,2025-05-25 20:18:12.008495,2025-05-25 20:18:23.043553,0 days 00:00:11.035058,AdamW,0.3965845410757085,,,0.00011141091986516167,,,,0,,,0.0029773415622252777,,PRUNED
1522,1522,41.666666666666664,2025-05-25 20:18:23.095130,2025-05-25 20:18:33.255342,0 days 00:00:10.160212,AdamW,0.15401013042542316,,,0.00019797229883034896,,,,6,,,0.0018544058257656806,,PRUNED
1523,1523,29.166666666666668,2025-05-25 20:18:33.304021,2025-05-25 20:18:44.365687,0 days 00:00:11.061666,AdamW,0.18150685195634222,,,6.503952160792093e-05,,,,1,,,0.0005508823096407827,,PRUNED
1524,1524,43.75,2025-05-25 20:18:44.414006,2025-05-25 20:18:55.329961,0 days 00:00:10.915955,AdamW,0.20167444496009415,,,9.305619319004657e-05,,,,2,,,0.00017733136192031034,,PRUNED
1525,1525,35.416666666666664,2025-05-25 20:18:55.378000,2025-05-25 20:19:06.532107,0 days 00:00:11.154107,AdamW,0.381596718710798,,,0.0001529603580546391,,,,2,,,0.00038664290152895005,,PRUNED
1526,1526,33.333333333333336,2025-05-25 20:19:06.594103,2025-05-25 20:19:17.539692,0 days 00:00:10.945589,AdamW,0.2411087925665024,,,0.00013092289041852974,,,,4,,,0.0014737862185707459,,PRUNED
1527,1527,35.416666666666664,2025-05-25 20:19:17.590212,2025-05-25 20:19:28.921692,0 days 00:00:11.331480,AdamW,0.11591961901851186,,,0.00011126305462254583,,,,0,,,0.0002954553371148116,,PRUNED
1528,1528,33.333333333333336,2025-05-25 20:19:28.977328,2025-05-25 20:19:39.897026,0 days 00:00:10.919698,AdamW,0.1727799573121033,,,0.0001780980003683755,,,,3,,,0.00448826746064038,,PRUNED
1529,1529,33.333333333333336,2025-05-25 20:19:39.948049,2025-05-25 20:19:50.882449,0 days 00:00:10.934400,AdamW,0.31758099368848186,,,0.00970169638463349,,,,1,,,0.00394413642493416,,PRUNED
1530,1530,37.5,2025-05-25 20:19:50.934873,2025-05-25 20:20:02.010048,0 days 00:00:11.075175,AdamW,0.21971871575079122,,,5.363069037583378e-05,,,,2,,,0.002104289515628135,,PRUNED
1531,1531,33.333333333333336,2025-05-25 20:20:02.062268,2025-05-25 20:20:13.242148,0 days 00:00:11.179880,AdamW,0.1957663570720264,,,0.0002441238685867135,,,,1,,,0.002694868758140937,,PRUNED
1532,1532,37.5,2025-05-25 20:20:13.293258,2025-05-25 20:20:24.329661,0 days 00:00:11.036403,AdamW,0.21022125789725302,,,8.169681861246853e-05,,,,1,,,0.0004394840821619615,,PRUNED
1533,1533,37.5,2025-05-25 20:20:24.378387,2025-05-25 20:20:35.284496,0 days 00:00:10.906109,AdamW,0.14473668669514433,,,0.00012579362839120097,,,,0,,,0.002289734784799545,,PRUNED
1534,1534,33.333333333333336,2025-05-25 20:20:35.336779,2025-05-25 20:20:46.427987,0 days 00:00:11.091208,SGD,0.256155019260507,,,,0.0748498821221425,4.275634178407557,False,2,,,,0.10395190949131257,PRUNED
1535,1535,33.333333333333336,2025-05-25 20:20:46.485859,2025-05-25 20:20:57.608710,0 days 00:00:11.122851,AdamW,0.16838220661239073,,,9.646731553818739e-05,,,,3,,,0.0033253321344343203,,PRUNED
1536,1536,33.333333333333336,2025-05-25 20:20:57.658863,2025-05-25 20:21:09.768015,0 days 00:00:12.109152,AdamW,0.1842441493071004,,,0.00028938054470536826,,,,0,,,0.0003427585410315645,,PRUNED
1537,1537,35.416666666666664,2025-05-25 20:21:09.817826,2025-05-25 20:21:21.567278,0 days 00:00:11.749452,AdamW,0.28489981206966675,,,0.00015548521570825396,,,,1,,,0.0004924161061276473,,PRUNED
1538,1538,33.333333333333336,2025-05-25 20:21:21.622242,2025-05-25 20:21:33.367822,0 days 00:00:11.745580,AdamW,0.22890328490900078,,,0.0002085744067806843,,,,2,,,0.0016343779428085676,,PRUNED
1539,1539,33.333333333333336,2025-05-25 20:21:33.407213,2025-05-25 20:21:45.006042,0 days 00:00:11.598829,AdamW,0.24204267297900767,,,7.415578140262248e-05,,,,1,,,0.0007036305320569319,,PRUNED
1540,1540,33.333333333333336,2025-05-25 20:21:45.042750,2025-05-25 20:21:56.627549,0 days 00:00:11.584799,Adam,0.267285523314331,,0.003405279879379463,,,,,2,,2.2940627088278327,,,PRUNED
1541,1541,33.333333333333336,2025-05-25 20:21:56.682717,2025-05-25 20:22:08.322268,0 days 00:00:11.639551,AdamW,0.2100078287078469,,,0.00010871105397449886,,,,0,,,0.0025777991886329122,,PRUNED
1542,1542,41.666666666666664,2025-05-25 20:22:08.375343,2025-05-25 20:22:20.160109,0 days 00:00:11.784766,AdamW,0.1936124106600819,,,0.00013756475468859077,,,,1,,,0.003105015309246035,,PRUNED
1543,1543,33.333333333333336,2025-05-25 20:22:20.215330,2025-05-25 20:22:31.858841,0 days 00:00:11.643511,Adadelta,0.16123893117515192,75.08003348052755,,,,,,3,2.0735915165677863,,,,PRUNED
1544,1544,39.583333333333336,2025-05-25 20:22:31.912900,2025-05-25 20:22:43.748152,0 days 00:00:11.835252,AdamW,0.23120034985144766,,,8.781539821724222e-05,,,,2,,,0.0020145993572984523,,PRUNED
1545,1545,33.333333333333336,2025-05-25 20:22:43.801330,2025-05-25 20:22:55.658281,0 days 00:00:11.856951,AdamW,0.30798100183608396,,,0.0001798942940367234,,,,0,,,0.00040523176626802677,,PRUNED
1546,1546,43.75,2025-05-25 20:22:55.712524,2025-05-25 20:23:07.188353,0 days 00:00:11.475829,AdamW,0.1801917371881199,,,0.00012388631333590515,,,,3,,,0.0023037524645128345,,PRUNED
1547,1547,35.416666666666664,2025-05-25 20:23:07.240289,2025-05-25 20:23:18.769958,0 days 00:00:11.529669,AdamW,0.22100033179805603,,,6.460168530218952e-05,,,,1,,,0.0006187559605738376,,PRUNED
1548,1548,41.666666666666664,2025-05-25 20:23:18.849360,2025-05-25 20:23:29.730363,0 days 00:00:10.881003,AdamW,0.25105348494404706,,,0.0005523984112674722,,,,7,,,0.0004578357451902992,,PRUNED
1549,1549,33.333333333333336,2025-05-25 20:23:29.778804,2025-05-25 20:23:41.039896,0 days 00:00:11.261092,AdamW,0.1530594990479483,,,0.0010233070162265106,,,,2,,,0.0005300241755982393,,PRUNED
1550,1550,33.333333333333336,2025-05-25 20:23:41.092533,2025-05-25 20:23:52.398139,0 days 00:00:11.305606,AdamW,0.36553435416088365,,,0.00034503122165238594,,,,0,,,0.0028173475372861093,,PRUNED
1551,1551,66.66666666666667,2025-05-25 20:23:52.450771,2025-05-25 20:24:07.231602,0 days 00:00:14.780831,AdamW,0.2014090675141537,,,0.00010134230979099457,,,,4,,,0.003455869070489006,,PRUNED
1552,1552,39.583333333333336,2025-05-25 20:24:07.278399,2025-05-25 20:24:18.896724,0 days 00:00:11.618325,AdamW,0.17473097171160418,,,0.00017891954591750937,,,,1,,,0.0005805949145862066,,PRUNED
1553,1553,45.833333333333336,2025-05-25 20:24:18.948562,2025-05-25 20:24:30.519446,0 days 00:00:11.570884,AdamW,0.1328131590485107,,,4.7641891746012224e-05,,,,2,,,0.00037189971680599306,,PRUNED
1554,1554,33.333333333333336,2025-05-25 20:24:30.758708,2025-05-25 20:24:42.411712,0 days 00:00:11.653004,AdamW,0.23812725746236174,,,0.00025418499632131594,,,,1,,,0.00260947073526224,,PRUNED
1555,1555,45.833333333333336,2025-05-25 20:24:42.462955,2025-05-25 20:24:53.970476,0 days 00:00:11.507521,AdamW,0.18683895619730817,,,0.0001482123530996573,,,,0,,,0.001859095231284377,,PRUNED
1556,1556,33.333333333333336,2025-05-25 20:24:54.019939,2025-05-25 20:25:05.486284,0 days 00:00:11.466345,AdamW,0.2739458743327275,,,7.3979219564947e-05,,,,2,,,0.002180770755989263,,PRUNED
1557,1557,33.333333333333336,2025-05-25 20:25:05.541140,2025-05-25 20:25:17.041938,0 days 00:00:11.500798,AdamW,0.20911256138472264,,,0.00011030885536761127,,,,3,,,0.0004247323542780552,,PRUNED
1558,1558,43.75,2025-05-25 20:25:17.097868,2025-05-25 20:25:28.668731,0 days 00:00:11.570863,AdamW,0.46256256714372956,,,8.723983222738935e-05,,,,1,,,0.0024439471368902788,,PRUNED
1559,1559,45.833333333333336,2025-05-25 20:25:28.721634,2025-05-25 20:25:40.072537,0 days 00:00:11.350903,AdamW,0.34564159968744035,,,0.000128156435272408,,,,2,,,0.00290518012491061,,PRUNED
1560,1560,,2025-05-25 20:25:40.126045,2025-05-25 20:25:50.638885,0 days 00:00:10.512840,SGD,0.2599622148218245,,,,6.803688376781552e-05,49.3629275508826,True,0,,,,0.18043161156412435,PRUNED
1561,1561,37.5,2025-05-25 20:25:50.692751,2025-05-25 20:26:01.606817,0 days 00:00:10.914066,AdamW,0.22030630520093972,,,0.00021906101663515622,,,,6,,,0.00026536963673146844,,PRUNED
1562,1562,33.333333333333336,2025-05-25 20:26:01.656528,2025-05-25 20:26:13.403590,0 days 00:00:11.747062,AdamW,0.2480918239538571,,,0.00014519863642596556,,,,2,,,0.0003407199555884366,,PRUNED
1563,1563,39.583333333333336,2025-05-25 20:26:13.456529,2025-05-25 20:26:25.116315,0 days 00:00:11.659786,AdamW,0.48222862772367237,,,0.00010507563672767253,,,,0,,,0.0038511288262346815,,PRUNED
1564,1564,33.333333333333336,2025-05-25 20:26:25.170457,2025-05-25 20:26:36.734801,0 days 00:00:11.564344,Adam,0.28884685096494767,,0.0021845726867257115,,,,,1,,0.05567893405434778,,,PRUNED
1565,1565,33.333333333333336,2025-05-25 20:26:36.789521,2025-05-25 20:26:48.307731,0 days 00:00:11.518210,AdamW,0.14622426023739957,,,0.0004193524398898691,,,,3,,,0.0004881417717178974,,PRUNED
1566,1566,33.333333333333336,2025-05-25 20:26:48.361194,2025-05-25 20:27:00.053429,0 days 00:00:11.692235,AdamW,0.19533440779521893,,,0.00016460985526059612,,,,1,,,0.0020572749625332562,,PRUNED
1567,1567,31.25,2025-05-25 20:27:00.108061,2025-05-25 20:27:11.705092,0 days 00:00:11.597031,Adadelta,0.23207402353870138,0.021349078905010796,,,,,,1,8.105839457017403,,,,PRUNED
1568,1568,33.333333333333336,2025-05-25 20:27:11.758448,2025-05-25 20:27:23.280477,0 days 00:00:11.522029,AdamW,0.3896265845322908,,,0.00020611463918330654,,,,2,,,0.0023002562343926655,,PRUNED
1569,1569,33.333333333333336,2025-05-25 20:27:23.334197,2025-05-25 20:27:34.870956,0 days 00:00:11.536759,AdamW,0.16469394086346367,,,8.446585772492433e-05,,,,0,,,0.003244670895761931,,PRUNED
1570,1570,33.333333333333336,2025-05-25 20:27:34.924978,2025-05-25 20:27:46.658528,0 days 00:00:11.733550,AdamW,0.20364833792444187,,,0.0002857796278375347,,,,1,,,0.00039112857499425097,,PRUNED
1571,1571,33.333333333333336,2025-05-25 20:27:46.712914,2025-05-25 20:27:58.586511,0 days 00:00:11.873597,AdamW,0.40783081994979503,,,0.00012166087098340534,,,,3,,,0.0027858408446404456,,PRUNED
1572,1572,37.5,2025-05-25 20:27:58.639345,2025-05-25 20:28:10.159541,0 days 00:00:11.520196,AdamW,0.17371997304304396,,,6.109413000006911e-05,,,,2,,,0.0009972650131496554,,PRUNED
1573,1573,33.333333333333336,2025-05-25 20:28:10.213061,2025-05-25 20:28:21.773531,0 days 00:00:11.560470,AdamW,0.18833972382867803,,,9.720084569901722e-05,,,,1,,,0.00044678609605073194,,PRUNED
1574,1574,43.75,2025-05-25 20:28:21.827548,2025-05-25 20:28:33.363509,0 days 00:00:11.535961,AdamW,0.3256930829492421,,,0.00015709221491488258,,,,0,,,0.0005341390108226146,,PRUNED
1575,1575,45.833333333333336,2025-05-25 20:28:33.418111,2025-05-25 20:28:44.873361,0 days 00:00:11.455250,AdamW,0.13868600162779188,,,7.222757364472947e-05,,,,2,,,0.0025097034220817427,,PRUNED
1576,1576,33.333333333333336,2025-05-25 20:28:44.927384,2025-05-25 20:28:56.450238,0 days 00:00:11.522854,AdamW,0.21357796095247542,,,0.00019123414789225934,,,,3,,,0.00108544107813098,,PRUNED
1577,1577,43.75,2025-05-25 20:28:56.503587,2025-05-25 20:29:07.940438,0 days 00:00:11.436851,AdamW,0.22604267570969164,,,0.00012198091376131156,,,,1,,,0.0030661055113143116,,PRUNED
1578,1578,33.333333333333336,2025-05-25 20:29:07.993487,2025-05-25 20:29:19.568436,0 days 00:00:11.574949,AdamW,0.1260693567643855,,,9.618438846798769e-05,,,,2,,,0.00031216403092962684,,PRUNED
1579,1579,83.33333333333333,2025-05-25 20:29:19.622238,2025-05-25 20:29:40.648401,0 days 00:00:21.026163,AdamW,0.24451104139712576,,,0.00024053763635479723,,,,4,,,0.0018812441332372641,,COMPLETE
1580,1580,33.333333333333336,2025-05-25 20:29:40.710489,2025-05-25 20:29:52.114223,0 days 00:00:11.403734,AdamW,0.2520809262795339,,,0.000327652048894615,,,,4,,,0.001366834101079813,,PRUNED
1581,1581,33.333333333333336,2025-05-25 20:29:52.167452,2025-05-25 20:30:03.627347,0 days 00:00:11.459895,AdamW,0.24583532488242846,,,0.00027368794868038105,,,,3,,,0.0018840299237310658,,PRUNED
1582,1582,33.333333333333336,2025-05-25 20:30:03.679985,2025-05-25 20:30:15.132506,0 days 00:00:11.452521,AdamW,0.26049171820433753,,,0.00025068007290560953,,,,3,,,0.0017174486228043523,,PRUNED
1583,1583,,2025-05-25 20:30:15.184734,2025-05-25 20:30:25.972850,0 days 00:00:10.788116,SGD,0.24272304353471386,,,,2.667707476551737e-05,15.100526253367136,False,3,,,,8.126779839314437,PRUNED
1584,1584,33.333333333333336,2025-05-25 20:30:26.024220,2025-05-25 20:30:37.438735,0 days 00:00:11.414515,AdamW,0.23748556089647072,,,0.000293565325252269,,,,3,,,0.00036021453258826757,,PRUNED
1585,1585,33.333333333333336,2025-05-25 20:30:37.491176,2025-05-25 20:30:48.756757,0 days 00:00:11.265581,AdamW,0.25496267227300756,,,0.0003141607514130418,,,,4,,,0.0023792781780457442,,PRUNED
1586,1586,33.333333333333336,2025-05-25 20:30:48.823883,2025-05-25 20:31:00.058285,0 days 00:00:11.234402,AdamW,0.24561542454409424,,,0.00037359189095057725,,,,4,,,0.002124308656011338,,PRUNED
1587,1587,33.333333333333336,2025-05-25 20:31:00.109000,2025-05-25 20:31:11.086515,0 days 00:00:10.977515,AdamW,0.23427022405729225,,,0.0002346254862758365,,,,4,,,0.0004775588960731335,,PRUNED
1588,1588,33.333333333333336,2025-05-25 20:31:11.137003,2025-05-25 20:31:22.347120,0 days 00:00:11.210117,AdamW,0.26803453814979294,,,0.0002609235271178755,,,,4,,,0.0005969262924867883,,PRUNED
1589,1589,33.333333333333336,2025-05-25 20:31:22.396015,2025-05-25 20:31:33.432573,0 days 00:00:11.036558,Adam,0.25904054352226347,,0.017294914385762854,,,,,4,,2.965603646681218,,,PRUNED
1590,1590,33.333333333333336,2025-05-25 20:31:33.482969,2025-05-25 20:31:44.635225,0 days 00:00:11.152256,AdamW,0.23994686867886833,,,0.00034459110633988297,,,,4,,,0.0004224437199884556,,PRUNED
1591,1591,33.333333333333336,2025-05-25 20:31:44.686569,2025-05-25 20:31:55.853456,0 days 00:00:11.166887,AdamW,0.24642420169142318,,,0.00021666026560590657,,,,4,,,0.0026550178461418102,,PRUNED
1592,1592,33.333333333333336,2025-05-25 20:31:55.904612,2025-05-25 20:32:06.874113,0 days 00:00:10.969501,Adadelta,0.2293234543654464,2.6900732773886924,,,,,,4,0.2635680468204153,,,,PRUNED
1593,1593,64.58333333333333,2025-05-25 20:32:06.927376,2025-05-25 20:32:25.508037,0 days 00:00:18.580661,AdamW,0.2527035032611776,,,0.00025709225699483773,,,,4,,,0.002886616967520075,,PRUNED
1594,1594,33.333333333333336,2025-05-25 20:32:25.559566,2025-05-25 20:32:36.795922,0 days 00:00:11.236356,AdamW,0.23185555202379654,,,0.00047049553599910136,,,,4,,,0.0006604190446306788,,PRUNED
1595,1595,37.5,2025-05-25 20:32:36.847467,2025-05-25 20:32:47.002358,0 days 00:00:10.154891,AdamW,0.27174799281254514,,,1.0124328579597382e-05,,,,6,,,0.0005214466397875724,,PRUNED
1596,1596,37.5,2025-05-25 20:32:47.049430,2025-05-25 20:32:58.373748,0 days 00:00:11.324318,AdamW,0.26144492753840753,,,0.00022286371068362017,,,,3,,,0.003337524478338989,,PRUNED
1597,1597,47.916666666666664,2025-05-25 20:32:58.613641,2025-05-25 20:33:09.778362,0 days 00:00:11.164721,AdamW,0.24232998880100526,,,0.00026021399024910426,,,,4,,,0.0037664622099721225,,PRUNED
1598,1598,62.5,2025-05-25 20:33:09.832252,2025-05-25 20:33:24.916778,0 days 00:00:15.084526,AdamW,0.2340605139549525,,,0.00020394034353431973,,,,3,,,0.0019590611474702016,,PRUNED
