,number,value,datetime_start,datetime_complete,duration,params_algorithm,params_dropout_rate,params_lr_Adadelta,params_lr_Adam,params_lr_AdamW,params_lr_SGD,params_momentum_SGD,params_nesterov_SGD,params_suggested_freeze,params_weight_decay_Adadelta,params_weight_decay_Adam,params_weight_decay_AdamW,params_weight_decay_SGD,state
1372,1372,33.333333333333336,2025-05-25 19:35:19.971730,2025-05-25 19:35:39.976635,0 days 00:00:20.004905,AdamW,0.31453367025208123,,,8.264748681845218e-05,,,,2,,,0.0004727605291331539,,PRUNED
1373,1373,33.333333333333336,2025-05-25 19:35:40.037467,2025-05-25 19:35:59.618337,0 days 00:00:19.580870,Adadelta,0.4693483326230746,9.560700150390863,,,,,,3,0.20114766955435462,,,,PRUNED
1374,1374,35.416666666666664,2025-05-25 19:35:59.676903,2025-05-25 19:36:19.414046,0 days 00:00:19.737143,AdamW,0.4509944510603419,,,0.00019513612090270172,,,,2,,,0.003090487624555927,,PRUNED
1375,1375,33.333333333333336,2025-05-25 19:36:19.472796,2025-05-25 19:36:39.086493,0 days 00:00:19.613697,AdamW,0.390538141786273,,,0.00046857880940484955,,,,3,,,0.0006000856631251232,,PRUNED
1376,1376,33.333333333333336,2025-05-25 19:36:39.145567,2025-05-25 19:36:58.806415,0 days 00:00:19.660848,Adam,0.48547318340626194,,0.009574950431833795,,,,,2,,44.71577877527247,,,PRUNED
1377,1377,33.333333333333336,2025-05-25 19:36:58.863662,2025-05-25 19:37:18.472676,0 days 00:00:19.609014,AdamW,0.4831281087895681,,,9.109889962968935e-05,,,,2,,,0.004250662623511161,,PRUNED
1378,1378,33.333333333333336,2025-05-25 19:37:18.531780,2025-05-25 19:37:38.183723,0 days 00:00:19.651943,AdamW,0.27446261395114113,,,6.734863021942541e-05,,,,2,,,0.002577640024820624,,PRUNED
1379,1379,33.333333333333336,2025-05-25 19:37:38.243230,2025-05-25 19:37:57.942197,0 days 00:00:19.698967,AdamW,0.38785925692922485,,,0.013288102011521486,,,,3,,,0.0004205951159592611,,PRUNED
1380,1380,41.666666666666664,2025-05-25 19:37:58.001625,2025-05-25 19:38:17.636726,0 days 00:00:19.635101,AdamW,0.4538903388923931,,,0.00010203869056036916,,,,2,,,0.0005583311900913409,,PRUNED
1381,1381,39.583333333333336,2025-05-25 19:38:17.696503,2025-05-25 19:38:37.183091,0 days 00:00:19.486588,AdamW,0.37763448655974186,,,0.00025754538580524845,,,,3,,,0.00034836981163083953,,PRUNED
1382,1382,45.833333333333336,2025-05-25 19:38:37.242747,2025-05-25 19:38:57.216493,0 days 00:00:19.973746,AdamW,0.49703717916056106,,,0.000340325458509027,,,,0,,,0.002759109917281192,,PRUNED
1383,1383,37.5,2025-05-25 19:38:57.276604,2025-05-25 19:39:16.993189,0 days 00:00:19.716585,AdamW,0.32876508326168113,,,0.00019461296952517706,,,,2,,,0.003125375169677646,,PRUNED
1384,1384,33.333333333333336,2025-05-25 19:39:17.052124,2025-05-25 19:39:36.749141,0 days 00:00:19.697017,AdamW,0.4423281575245102,,,0.00011492919433826997,,,,2,,,0.0004633107247972243,,PRUNED
1385,1385,37.5,2025-05-25 19:39:36.808742,2025-05-25 19:39:56.455026,0 days 00:00:19.646284,AdamW,0.28507782157256,,,5.2471651700987086e-05,,,,4,,,0.00037179078171121967,,PRUNED
1386,1386,35.416666666666664,2025-05-25 19:39:56.513981,2025-05-25 19:40:16.206025,0 days 00:00:19.692044,AdamW,0.25445644299161174,,,7.651370072957594e-05,,,,0,,,0.0037252206865481616,,PRUNED
1387,1387,33.333333333333336,2025-05-25 19:40:16.266129,2025-05-25 19:40:35.991424,0 days 00:00:19.725295,AdamW,0.3622339412625616,,,0.00022271988565114654,,,,3,,,0.0005410135712294722,,PRUNED
1388,1388,41.666666666666664,2025-05-25 19:40:36.050490,2025-05-25 19:40:55.704672,0 days 00:00:19.654182,AdamW,0.17102129991940132,,,9.426170451073043e-05,,,,2,,,0.002600060735898681,,PRUNED
1389,1389,45.833333333333336,2025-05-25 19:40:55.763593,2025-05-25 19:41:14.706893,0 days 00:00:18.943300,AdamW,0.35219789163535076,,,0.00017357504700273976,,,,6,,,0.003924925886318069,,PRUNED
1390,1390,,2025-05-25 19:41:14.760840,2025-05-25 19:41:32.717166,0 days 00:00:17.956326,SGD,0.19111605948424495,,,,0.030552255319497578,92.74541944181846,False,0,,,,66.49923705976852,PRUNED
1391,1391,35.416666666666664,2025-05-25 19:41:32.774733,2025-05-25 19:41:52.463470,0 days 00:00:19.688737,AdamW,0.33641284619271206,,,0.00012307655218934754,,,,2,,,0.00042858662615412275,,PRUNED
1392,1392,41.666666666666664,2025-05-25 19:41:52.522562,2025-05-25 19:42:12.041567,0 days 00:00:19.519005,AdamW,0.22706102859255317,,,0.00011097022698829118,,,,3,,,0.0029907093989626717,,PRUNED
1393,1393,33.333333333333336,2025-05-25 19:42:12.099567,2025-05-25 19:42:32.093175,0 days 00:00:19.993608,AdamW,0.3053515755602165,,,0.0005769167199635431,,,,2,,,0.007104056500588919,,PRUNED
1394,1394,43.75,2025-05-25 19:42:32.153246,2025-05-25 19:42:51.804507,0 days 00:00:19.651261,AdamW,0.15781627799236717,,,8.485107836748318e-05,,,,0,,,0.0004968986083200815,,PRUNED
1395,1395,33.333333333333336,2025-05-25 19:42:51.863865,2025-05-25 19:43:11.439747,0 days 00:00:19.575882,AdamW,0.47590074698859397,,,0.00013686587552882396,,,,3,,,0.0024204622707722167,,PRUNED
1396,1396,35.416666666666664,2025-05-25 19:43:11.498379,2025-05-25 19:43:31.137146,0 days 00:00:19.638767,Adam,0.2108700013874345,,0.0012706314248368575,,,,,2,,9.502965148334754,,,PRUNED
1397,1397,39.583333333333336,2025-05-25 19:43:31.196573,2025-05-25 19:43:50.846967,0 days 00:00:19.650394,AdamW,0.24524466341510157,,,6.453218187721518e-05,,,,0,,,0.003369835239223321,,PRUNED
1398,1398,33.333333333333336,2025-05-25 19:43:50.907775,2025-05-25 19:44:10.569577,0 days 00:00:19.661802,Adadelta,0.19788062436397438,31.97079385910149,,,,,,2,0.7217539473024351,,,,PRUNED
1399,1399,33.333333333333336,2025-05-25 19:44:10.627490,2025-05-25 19:44:30.296421,0 days 00:00:19.668931,AdamW,0.18204680688805255,,,0.00027886335169592506,,,,2,,,0.0003266556264348151,,PRUNED
1400,1400,45.833333333333336,2025-05-25 19:44:30.356071,2025-05-25 19:44:50.124093,0 days 00:00:19.768022,AdamW,0.23511441089833862,,,0.0001906345185743407,,,,4,,,0.00040035313485369987,,PRUNED
1401,1401,37.5,2025-05-25 19:44:50.184058,2025-05-25 19:45:09.796061,0 days 00:00:19.612003,AdamW,0.293225225803212,,,9.376129580724139e-05,,,,3,,,0.0026618427664392725,,PRUNED
1402,1402,37.5,2025-05-25 19:45:09.856216,2025-05-25 19:45:29.076001,0 days 00:00:19.219785,AdamW,0.14870829936075464,,,0.00013145441962349283,,,,8,,,0.0006182978372465237,,PRUNED
1403,1403,35.416666666666664,2025-05-25 19:45:29.130464,2025-05-25 19:45:48.788207,0 days 00:00:19.657743,AdamW,0.2207394262964769,,,0.00010405095029422774,,,,2,,,0.0007218994107348757,,PRUNED
1404,1404,47.916666666666664,2025-05-25 19:45:48.899043,2025-05-25 19:46:07.839752,0 days 00:00:18.940709,AdamW,0.2668895604211521,,,0.00023226491858512714,,,,7,,,0.0028720189892113383,,PRUNED
1405,1405,52.083333333333336,2025-05-25 19:46:07.894833,2025-05-25 19:46:27.599445,0 days 00:00:19.704612,AdamW,0.20774742131457669,,,0.00016494434982789033,,,,0,,,0.0004534527162526423,,PRUNED
1406,1406,33.333333333333336,2025-05-25 19:46:27.659186,2025-05-25 19:46:47.334846,0 days 00:00:19.675660,AdamW,0.1651735171765949,,,8.328154873761693e-05,,,,0,,,0.0005317982166974605,,PRUNED
1407,1407,33.333333333333336,2025-05-25 19:46:47.396738,2025-05-25 19:47:07.055181,0 days 00:00:19.658443,AdamW,0.24930615317455243,,,0.000348872293157868,,,,2,,,0.0002683995925171031,,PRUNED
1408,1408,37.5,2025-05-25 19:47:07.114496,2025-05-25 19:47:26.754486,0 days 00:00:19.639990,AdamW,0.18830726426315333,,,0.00012349207595382396,,,,2,,,0.002455248054468523,,PRUNED
1409,1409,33.333333333333336,2025-05-25 19:47:26.814133,2025-05-25 19:47:46.515356,0 days 00:00:19.701223,AdamW,0.17515116945221762,,,0.02972120547245141,,,,0,,,0.0003575939524333469,,PRUNED
1410,1410,43.75,2025-05-25 19:47:46.575214,2025-05-25 19:48:06.258016,0 days 00:00:19.682802,AdamW,0.2276444147422381,,,7.20243373539616e-05,,,,3,,,0.00040308751593008484,,PRUNED
1411,1411,33.333333333333336,2025-05-25 19:48:06.316977,2025-05-25 19:48:25.920339,0 days 00:00:19.603362,AdamW,0.2569338722275961,,,0.003215479069984302,,,,2,,,0.0033701234501176593,,PRUNED
1412,1412,31.25,2025-05-25 19:48:25.980585,2025-05-25 19:48:45.801756,0 days 00:00:19.821171,AdamW,0.1960958783910627,,,0.0001458801907230784,,,,3,,,0.002882558245488808,,PRUNED
1413,1413,35.416666666666664,2025-05-25 19:48:45.861757,2025-05-25 19:49:05.464194,0 days 00:00:19.602437,AdamW,0.23949007376887532,,,0.00010901399688102286,,,,2,,,0.0003082713606945107,,PRUNED
1414,1414,33.333333333333336,2025-05-25 19:49:05.523516,2025-05-25 19:49:25.067704,0 days 00:00:19.544188,AdamW,0.2183290716755924,,,0.00017448968609225216,,,,4,,,0.004667926538092421,,PRUNED
1415,1415,,2025-05-25 19:49:25.126721,2025-05-25 19:49:43.162526,0 days 00:00:18.035805,SGD,0.1791842919401427,,,,0.0006614198069526165,99.87686937309951,True,0,,,,6.636015660744708,PRUNED
1416,1416,33.333333333333336,2025-05-25 19:49:43.220279,2025-05-25 19:50:02.889874,0 days 00:00:19.669595,AdamW,0.14198818651792083,,,0.00021997290817244185,,,,2,,,0.0004890765007717995,,PRUNED
1417,1417,33.333333333333336,2025-05-25 19:50:02.949231,2025-05-25 19:50:22.479233,0 days 00:00:19.530002,AdamW,0.21066021861017806,,,0.0003059697365817989,,,,0,,,0.0024032795057373547,,PRUNED
1418,1418,50.0,2025-05-25 19:50:22.539506,2025-05-25 19:50:42.222857,0 days 00:00:19.683351,AdamW,0.38238500295610145,,,5.730308076162094e-05,,,,1,,,0.0031571417208253343,,PRUNED
1419,1419,43.75,2025-05-25 19:50:42.283674,2025-05-25 19:51:01.997139,0 days 00:00:19.713465,AdamW,0.3209896086938504,,,9.582187175978334e-05,,,,3,,,0.0005607562941563779,,PRUNED
1420,1420,33.333333333333336,2025-05-25 19:51:02.056448,2025-05-25 19:51:21.753313,0 days 00:00:19.696865,Adam,0.23425241756168472,,0.00040552854012731223,,,,,1,,76.83091562428439,,,PRUNED
1421,1421,66.66666666666667,2025-05-25 19:51:21.812943,2025-05-25 19:51:53.187988,0 days 00:00:31.375045,AdamW,0.19772845258367325,,,0.00013004843220978225,,,,2,,,0.00044620661859753836,,COMPLETE
1422,1422,33.333333333333336,2025-05-25 19:51:53.256910,2025-05-25 19:52:12.929052,0 days 00:00:19.672142,AdamW,0.27990217668231626,,,0.00018581191055462945,,,,3,,,0.0003751195532611169,,PRUNED
1423,1423,33.333333333333336,2025-05-25 19:52:12.988385,2025-05-25 19:52:32.684412,0 days 00:00:19.696027,AdamW,0.1706844466841271,,,0.00010592115538829241,,,,0,,,0.0025991559495038624,,PRUNED
1424,1424,33.333333333333336,2025-05-25 19:52:32.745429,2025-05-25 19:52:52.459942,0 days 00:00:19.714513,AdamW,0.26309143148497943,,,7.802331921689568e-05,,,,2,,,0.0035987939461656683,,PRUNED
1425,1425,39.583333333333336,2025-05-25 19:52:52.519023,2025-05-25 19:53:12.124098,0 days 00:00:19.605075,Adadelta,0.18932124139881737,0.21001339735708507,,,,,,1,2.9191420139549535,,,,PRUNED
1426,1426,41.666666666666664,2025-05-25 19:53:12.182890,2025-05-25 19:53:31.882692,0 days 00:00:19.699802,AdamW,0.15580334022417203,,,0.00015230421030183283,,,,1,,,0.0027164800646055053,,PRUNED
1427,1427,39.583333333333336,2025-05-25 19:53:31.943187,2025-05-25 19:53:51.619809,0 days 00:00:19.676622,AdamW,0.20414368517007367,,,0.00023804935737047165,,,,2,,,0.002343623958365535,,PRUNED
1428,1428,33.333333333333336,2025-05-25 19:53:51.679488,2025-05-25 19:54:11.366541,0 days 00:00:19.687053,AdamW,0.39762064781094775,,,0.07815432536419994,,,,0,,,0.0004898034780841892,,PRUNED
1429,1429,37.5,2025-05-25 19:54:11.427382,2025-05-25 19:54:31.379626,0 days 00:00:19.952244,AdamW,0.24835127498317533,,,0.00011958230032666655,,,,3,,,0.0004258438758102271,,PRUNED
1430,1430,33.333333333333336,2025-05-25 19:54:31.439648,2025-05-25 19:54:51.134931,0 days 00:00:19.695283,AdamW,0.22676649124332102,,,8.445188719727766e-05,,,,1,,,0.0006751680328311073,,PRUNED
1431,1431,33.333333333333336,2025-05-25 19:54:51.195905,2025-05-25 19:55:10.809767,0 days 00:00:19.613862,AdamW,0.21678207826661977,,,0.0008857117269266953,,,,2,,,0.0005969183691744112,,PRUNED
1432,1432,33.333333333333336,2025-05-25 19:55:10.869120,2025-05-25 19:55:30.767667,0 days 00:00:19.898547,AdamW,0.2391043884825219,,,0.00014979531702071958,,,,1,,,0.003935759727893285,,PRUNED
1433,1433,33.333333333333336,2025-05-25 19:55:30.828118,2025-05-25 19:55:50.493388,0 days 00:00:19.665270,AdamW,0.1812101977117444,,,0.000397766603997279,,,,1,,,0.003142335117865198,,PRUNED
1434,1434,35.416666666666664,2025-05-25 19:55:50.553114,2025-05-25 19:56:10.022784,0 days 00:00:19.469670,AdamW,0.2098733071123154,,,4.364046382570598e-05,,,,4,,,0.0025838674256786374,,PRUNED
1435,1435,33.333333333333336,2025-05-25 19:56:10.082395,2025-05-25 19:56:29.880669,0 days 00:00:19.798274,AdamW,0.46375299036708867,,,6.871915241198645e-05,,,,0,,,0.00038291356855010296,,PRUNED
1436,1436,33.333333333333336,2025-05-25 19:56:29.946999,2025-05-25 19:56:49.661216,0 days 00:00:19.714217,AdamW,0.29752104098347787,,,0.00019164559309376483,,,,2,,,0.00034146788971026106,,PRUNED
1437,1437,,2025-05-25 19:56:49.720253,2025-05-25 19:57:08.282586,0 days 00:00:18.562333,SGD,0.27413042968340584,,,,0.0012924282700626328,40.187215067042615,False,0,,,,0.7415053325187011,PRUNED
1438,1438,33.333333333333336,2025-05-25 19:57:08.341546,2025-05-25 19:57:27.973812,0 days 00:00:19.632266,AdamW,0.1646950909876976,,,0.00010040670517830434,,,,3,,,0.0005220766141833384,,PRUNED
1439,1439,47.916666666666664,2025-05-25 19:57:28.033393,2025-05-25 19:57:47.892385,0 days 00:00:19.858992,AdamW,0.18966215097635197,,,0.0002602202024943797,,,,2,,,0.0022886131573748233,,PRUNED
1440,1440,47.916666666666664,2025-05-25 19:57:47.952975,2025-05-25 19:58:07.643173,0 days 00:00:19.690198,AdamW,0.25360451290335145,,,0.00013012743977602537,,,,1,,,0.0028534151451232582,,PRUNED
1441,1441,35.416666666666664,2025-05-25 19:58:07.703987,2025-05-25 19:58:27.405925,0 days 00:00:19.701938,AdamW,0.20008464281969043,,,9.113982404190682e-05,,,,1,,,0.000430212773934862,,PRUNED
1442,1442,33.333333333333336,2025-05-25 19:58:27.466158,2025-05-25 19:58:47.037622,0 days 00:00:19.571464,AdamW,0.4995318260362528,,,0.00016988697110441583,,,,3,,,0.0001525326521867745,,PRUNED
1443,1443,39.583333333333336,2025-05-25 19:58:47.097066,2025-05-25 19:59:06.785196,0 days 00:00:19.688130,AdamW,0.2239367339108215,,,0.00011461570478215416,,,,2,,,0.0002909966039859452,,PRUNED
1444,1444,35.416666666666664,2025-05-25 19:59:06.847719,2025-05-25 19:59:26.525235,0 days 00:00:19.677516,Adam,0.34672922785994886,,7.593363610865735e-05,,,,,2,,0.3086229615759568,,,PRUNED
1445,1445,33.333333333333336,2025-05-25 19:59:26.585018,2025-05-25 19:59:46.250248,0 days 00:00:19.665230,AdamW,0.12510263521337744,,,0.00021197115591373627,,,,1,,,0.0012367309921094533,,PRUNED
1446,1446,35.416666666666664,2025-05-25 19:59:46.310854,2025-05-25 20:00:05.359948,0 days 00:00:19.049094,AdamW,0.2443092024417033,,,5.677283469210562e-05,,,,6,,,0.0015224184115178786,,PRUNED
1447,1447,85.41666666666667,2025-05-25 20:00:05.415982,2025-05-25 20:00:37.023986,0 days 00:00:31.608004,AdamW,0.13489675270223705,,,0.0001426812358237795,,,,0,,,0.0020032019942583966,,COMPLETE
1448,1448,33.333333333333336,2025-05-25 20:00:37.092363,2025-05-25 20:00:56.967434,0 days 00:00:19.875071,Adadelta,0.15295231284936855,0.04122253807692656,,,,,,0,0.032675173625317626,,,,PRUNED
1449,1449,60.416666666666664,2025-05-25 20:00:57.028134,2025-05-25 20:01:21.468819,0 days 00:00:24.440685,AdamW,0.1368038398310014,,,7.610780565480908e-05,,,,0,,,0.003020284931915783,,PRUNED
1450,1450,37.5,2025-05-25 20:01:21.529450,2025-05-25 20:01:41.217530,0 days 00:00:19.688080,AdamW,0.13031366265523064,,,0.00011119009187149443,,,,0,,,0.00040456456119608114,,PRUNED
1451,1451,50.0,2025-05-25 20:01:41.279035,2025-05-25 20:02:01.101413,0 days 00:00:19.822378,AdamW,0.13585824892893614,,,0.00013610375702183982,,,,0,,,0.0004663503211084651,,PRUNED
1452,1452,31.25,2025-05-25 20:02:01.161957,2025-05-25 20:02:20.875746,0 days 00:00:19.713789,AdamW,0.14255997947340124,,,9.293786752067859e-05,,,,0,,,0.0022275365319716052,,PRUNED
1453,1453,33.333333333333336,2025-05-25 20:02:20.936269,2025-05-25 20:02:40.565166,0 days 00:00:19.628897,AdamW,0.1269545709482367,,,0.0003072868703445553,,,,0,,,0.003411683296205162,,PRUNED
1454,1454,35.416666666666664,2025-05-25 20:02:40.626003,2025-05-25 20:03:00.305810,0 days 00:00:19.679807,AdamW,0.14614763996061428,,,6.509435796550375e-05,,,,0,,,0.002516591291499812,,PRUNED
1455,1455,33.333333333333336,2025-05-25 20:03:00.366599,2025-05-25 20:03:20.112492,0 days 00:00:19.745893,AdamW,0.12126397433387438,,,0.00015594332690263947,,,,0,,,0.0005561087438474613,,PRUNED
1456,1456,37.5,2025-05-25 20:03:20.173475,2025-05-25 20:03:39.859254,0 days 00:00:19.685779,AdamW,0.13293122980735925,,,0.0001081603281071556,,,,0,,,0.002765601616905028,,PRUNED
1457,1457,35.416666666666664,2025-05-25 20:03:39.920228,2025-05-25 20:03:59.643744,0 days 00:00:19.723516,AdamW,0.13865273786058244,,,8.15286278197305e-05,,,,0,,,0.0003267144823303485,,PRUNED
1458,1458,33.333333333333336,2025-05-25 20:03:59.907765,2025-05-25 20:04:19.615789,0 days 00:00:19.708024,AdamW,0.16097602449713383,,,0.00012151094158184935,,,,0,,,0.001963255355482958,,PRUNED
1459,1459,62.5,2025-05-25 20:04:19.677521,2025-05-25 20:04:51.434886,0 days 00:00:31.757365,AdamW,0.1342764317854292,,,0.00018744290592784518,,,,0,,,0.0003726512119166608,,COMPLETE
1460,1460,33.333333333333336,2025-05-25 20:04:51.502647,2025-05-25 20:05:11.312323,0 days 00:00:19.809676,AdamW,0.15334266565979293,,,0.000254418890956185,,,,0,,,0.0017042513475496262,,PRUNED
1461,1461,33.333333333333336,2025-05-25 20:05:11.373508,2025-05-25 20:05:31.049890,0 days 00:00:19.676382,AdamW,0.13414662479087097,,,0.0016734719422441704,,,,0,,,0.0005054158450677402,,PRUNED
1462,1462,,2025-05-25 20:05:31.109991,2025-05-25 20:05:49.605581,0 days 00:00:18.495590,SGD,0.13098345602797454,,,,0.00038613063046770283,44.0835163948756,True,0,,,,0.060349947875215894,PRUNED
1463,1463,33.333333333333336,2025-05-25 20:05:49.664554,2025-05-25 20:06:09.329390,0 days 00:00:19.664836,AdamW,0.12364289068010761,,,0.000134402870812726,,,,0,,,0.00238791131856512,,PRUNED
1464,1464,33.333333333333336,2025-05-25 20:06:09.390691,2025-05-25 20:06:29.127168,0 days 00:00:19.736477,AdamW,0.15852904307047627,,,0.00010247432940280921,,,,0,,,0.00043709991787914155,,PRUNED
1465,1465,50.0,2025-05-25 20:06:29.191833,2025-05-25 20:06:48.973868,0 days 00:00:19.782035,AdamW,0.12385999423189524,,,8.263729905019539e-05,,,,0,,,0.00310671663198281,,PRUNED
1466,1466,33.333333333333336,2025-05-25 20:06:49.232750,2025-05-25 20:07:08.882067,0 days 00:00:19.649317,AdamW,0.14136851235354345,,,0.00015724578500073434,,,,0,,,0.000623197965687314,,PRUNED
1467,1467,33.333333333333336,2025-05-25 20:07:08.943657,2025-05-25 20:07:28.690082,0 days 00:00:19.746425,AdamW,0.14729113704793628,,,0.00021667751291955278,,,,0,,,0.002107544337284272,,PRUNED
1468,1468,35.416666666666664,2025-05-25 20:07:28.750159,2025-05-25 20:07:48.554032,0 days 00:00:19.803873,Adam,0.14714408541343169,,4.480012554788226e-05,,,,,0,,0.16699554176346457,,,PRUNED
1469,1469,47.916666666666664,2025-05-25 20:07:48.614646,2025-05-25 20:08:08.336983,0 days 00:00:19.722337,AdamW,0.1423850361093144,,,0.00012272845645769373,,,,0,,,0.0026066480536742096,,PRUNED
1470,1470,33.333333333333336,2025-05-25 20:08:08.399261,2025-05-25 20:08:25.426391,0 days 00:00:17.027130,AdamW,0.15068429948530085,,,9.565873580730443e-05,,,,0,,,0.0036232524950605325,,PRUNED
1471,1471,33.333333333333336,2025-05-25 20:08:25.473701,2025-05-25 20:08:37.269682,0 days 00:00:11.795981,AdamW,0.15411788585235223,,,0.0001747492979206577,,,,0,,,0.002307925339764858,,PRUNED
1472,1472,33.333333333333336,2025-05-25 20:08:37.317522,2025-05-25 20:08:49.202651,0 days 00:00:11.885129,Adadelta,0.15584517893754918,0.8996945737938464,,,,,,0,99.10974406898315,,,,PRUNED
1473,1473,41.666666666666664,2025-05-25 20:08:49.249011,2025-05-25 20:09:01.052425,0 days 00:00:11.803414,AdamW,0.11904656685290016,,,7.376939455111044e-05,,,,3,,,0.00046294973868506856,,PRUNED
1474,1474,37.5,2025-05-25 20:09:01.102707,2025-05-25 20:09:13.150057,0 days 00:00:12.047350,AdamW,0.14691942390959792,,,5.0364497758799945e-05,,,,0,,,0.0028719337255089113,,PRUNED
1475,1475,33.333333333333336,2025-05-25 20:09:13.399863,2025-05-25 20:09:25.418407,0 days 00:00:12.018544,AdamW,0.1389032632531992,,,0.0004530991712916784,,,,4,,,0.00036312476555201836,,PRUNED
1476,1476,60.416666666666664,2025-05-25 20:09:25.469312,2025-05-25 20:09:41.177346,0 days 00:00:15.708034,AdamW,0.1350166563807744,,,0.0001334546680749279,,,,2,,,0.000556730101817006,,PRUNED
1477,1477,33.333333333333336,2025-05-25 20:09:41.230184,2025-05-25 20:09:52.799641,0 days 00:00:11.569457,AdamW,0.16706600895096946,,,0.00010444299531291855,,,,3,,,0.0009188119309556403,,PRUNED
1478,1478,33.333333333333336,2025-05-25 20:09:52.851082,2025-05-25 20:10:04.336669,0 days 00:00:11.485587,AdamW,0.17126384295243743,,,0.0002894430536780183,,,,0,,,0.0002177762146046964,,PRUNED
1479,1479,35.416666666666664,2025-05-25 20:10:04.390114,2025-05-25 20:10:15.818706,0 days 00:00:11.428592,AdamW,0.32787560866643223,,,6.311519153071783e-05,,,,2,,,0.0004195920877143348,,PRUNED
1480,1480,33.333333333333336,2025-05-25 20:10:15.873270,2025-05-25 20:10:27.389006,0 days 00:00:11.515736,AdamW,0.2661125836703282,,,0.00015086119647484013,,,,3,,,0.0019433833281752345,,PRUNED
1481,1481,60.416666666666664,2025-05-25 20:10:27.441757,2025-05-25 20:10:43.081513,0 days 00:00:15.639756,AdamW,0.4457998283477817,,,0.0001938928679537146,,,,0,,,0.0055699593297596686,,PRUNED
1482,1482,43.75,2025-05-25 20:10:43.134968,2025-05-25 20:10:54.432746,0 days 00:00:11.297778,AdamW,0.1477074300688576,,,9.106501400735694e-05,,,,2,,,0.0033285717347845342,,PRUNED
1483,1483,54.166666666666664,2025-05-25 20:10:54.485686,2025-05-25 20:11:05.935827,0 days 00:00:11.450141,AdamW,0.2564765357152839,,,0.0001245325331709327,,,,2,,,0.0005182947411987073,,PRUNED
1484,1484,47.916666666666664,2025-05-25 20:11:05.988957,2025-05-25 20:11:17.287561,0 days 00:00:11.298604,AdamW,0.2373188264849701,,,0.00024230358005366962,,,,0,,,0.004122749968763207,,PRUNED
1485,1485,50.0,2025-05-25 20:11:17.342108,2025-05-25 20:11:28.645966,0 days 00:00:11.303858,AdamW,0.28417718877604486,,,0.00010852389172697726,,,,2,,,0.0025365616536316554,,PRUNED
