,number,value,datetime_start,datetime_complete,duration,params_algorithm,params_dropout_rate,params_lr_Adadelta,params_lr_Adam,params_lr_AdamW,params_lr_SGD,params_momentum_SGD,params_nesterov_SGD,params_suggested_freeze,params_weight_decay_Adadelta,params_weight_decay_Adam,params_weight_decay_AdamW,params_weight_decay_SGD,state
344,344,35.416666666666664,2025-05-25 13:50:41.747005,2025-05-25 13:51:00.712517,0 days 00:00:18.965512,AdamW,0.131904053174567,,,3.86144832526553e-05,,,,6,,,0.0022521383984771422,,PRUNED
345,345,33.333333333333336,2025-05-25 13:51:00.750563,2025-05-25 13:51:20.441839,0 days 00:00:19.691276,AdamW,0.2114337032169466,,,0.00019097258660661352,,,,3,,,0.002670267994167573,,PRUNED
346,346,45.833333333333336,2025-05-25 13:51:20.479461,2025-05-25 13:51:40.204947,0 days 00:00:19.725486,AdamW,0.18852630876188403,,,5.7113188849523944e-05,,,,5,,,0.00016703697434594864,,PRUNED
347,347,33.333333333333336,2025-05-25 13:51:40.251690,2025-05-25 13:51:59.833430,0 days 00:00:19.581740,Adadelta,0.2575357621423052,7.270768966090999,,,,,,2,0.41889812082895816,,,,PRUNED
348,348,41.666666666666664,2025-05-25 13:51:59.884341,2025-05-25 13:52:19.647059,0 days 00:00:19.762718,AdamW,0.26862995180396193,,,0.00012195116354136487,,,,1,,,0.00023346064771317317,,PRUNED
349,349,37.5,2025-05-25 13:52:19.696007,2025-05-25 13:52:39.295465,0 days 00:00:19.599458,AdamW,0.3993135970058322,,,2.369631625738394e-05,,,,1,,,0.0023481935748314053,,PRUNED
350,350,29.166666666666668,2025-05-25 13:52:39.346554,2025-05-25 13:52:59.011790,0 days 00:00:19.665236,Adam,0.09504471915347383,,1.932939863937749e-05,,,,,0,,3.5240053399137827,,,PRUNED
351,351,45.833333333333336,2025-05-25 13:52:59.050081,2025-05-25 13:53:18.730314,0 days 00:00:19.680233,AdamW,0.4213551528804249,,,7.852583952137559e-05,,,,0,,,0.0014198050549366114,,PRUNED
352,352,43.75,2025-05-25 13:53:18.767562,2025-05-25 13:53:38.712339,0 days 00:00:19.944777,AdamW,0.48720074472222386,,,9.615111992221746e-05,,,,3,,,0.0007539610068364355,,PRUNED
353,353,33.333333333333336,2025-05-25 13:53:38.749451,2025-05-25 13:53:58.357489,0 days 00:00:19.608038,AdamW,0.17046850707636166,,,0.0002858035973710496,,,,2,,,0.0003171913399109149,,PRUNED
354,354,33.333333333333336,2025-05-25 13:53:58.395208,2025-05-25 13:54:18.035421,0 days 00:00:19.640213,AdamW,0.3385956875907661,,,0.0001353066807991294,,,,1,,,0.00044222966858106945,,PRUNED
355,355,33.333333333333336,2025-05-25 13:54:18.081030,2025-05-25 13:54:37.730351,0 days 00:00:19.649321,AdamW,0.14023612190554063,,,0.00016239142089323705,,,,4,,,0.0030974230514115865,,PRUNED
356,356,,2025-05-25 13:54:37.768967,2025-05-25 13:54:56.069524,0 days 00:00:18.300557,SGD,0.15051317615964702,,,,0.03669695709741195,59.18679357234217,False,1,,,,5.7658296804925975,PRUNED
357,357,41.666666666666664,2025-05-25 13:54:56.116274,2025-05-25 13:55:16.010677,0 days 00:00:19.894403,AdamW,0.17581757249941887,,,6.997520446508917e-05,,,,2,,,0.005245457928856618,,PRUNED
358,358,35.416666666666664,2025-05-25 13:55:16.059935,2025-05-25 13:55:35.628896,0 days 00:00:19.568961,AdamW,0.25089782097927305,,,4.727861348938002e-05,,,,5,,,0.0035498820068851334,,PRUNED
359,359,33.333333333333336,2025-05-25 13:55:35.675833,2025-05-25 13:55:55.388496,0 days 00:00:19.712663,Adam,0.1978603944549493,,0.04531413986788403,,,,,1,,0.02139350489731333,,,PRUNED
360,360,41.666666666666664,2025-05-25 13:55:55.436169,2025-05-25 13:56:17.912437,0 days 00:00:22.476268,AdamW,0.16282027637589874,,,0.00011383366173059335,,,,0,,,0.0019056680684769439,,PRUNED
361,361,29.166666666666668,2025-05-25 13:56:17.960427,2025-05-25 13:56:38.078017,0 days 00:00:20.117590,Adadelta,0.3718484449313879,0.025985306472006857,,,,,,2,42.98191486205399,,,,PRUNED
362,362,41.666666666666664,2025-05-25 13:56:38.116068,2025-05-25 13:56:57.866650,0 days 00:00:19.750582,AdamW,0.1829088452012284,,,0.0002032806259537463,,,,0,,,0.00040992174733394114,,PRUNED
363,363,33.333333333333336,2025-05-25 13:56:57.904874,2025-05-25 13:57:17.630523,0 days 00:00:19.725649,AdamW,0.30965263303385965,,,8.580904124885206e-05,,,,1,,,0.0005391877270585236,,PRUNED
364,364,33.333333333333336,2025-05-25 13:57:17.667918,2025-05-25 13:57:37.517712,0 days 00:00:19.849794,AdamW,0.4117685884806878,,,0.09053553940442012,,,,1,,,0.0015942007241354801,,PRUNED
365,365,37.5,2025-05-25 13:57:37.558065,2025-05-25 13:57:57.194024,0 days 00:00:19.635959,AdamW,0.2882551980790334,,,6.319217009370004e-05,,,,3,,,0.002548627103612403,,PRUNED
366,366,33.333333333333336,2025-05-25 13:57:57.231833,2025-05-25 13:58:16.813912,0 days 00:00:19.582079,AdamW,0.2627726090371844,,,0.003014754369031971,,,,2,,,0.0028019354135384047,,PRUNED
367,367,33.333333333333336,2025-05-25 13:58:16.861183,2025-05-25 13:58:36.643709,0 days 00:00:19.782526,AdamW,0.4602961981521925,,,9.969427584847386e-05,,,,0,,,0.0038628101363934104,,PRUNED
368,368,37.5,2025-05-25 13:58:36.683118,2025-05-25 13:58:56.216704,0 days 00:00:19.533586,Adam,0.05886085787525185,,0.00014678413638717064,,,,,5,,0.3485353874771802,,,PRUNED
369,369,33.333333333333336,2025-05-25 13:58:56.325640,2025-05-25 13:59:15.854496,0 days 00:00:19.528856,AdamW,0.12497572690011732,,,0.00014083533480912678,,,,2,,,0.004343824028293044,,PRUNED
370,370,45.833333333333336,2025-05-25 13:59:15.892335,2025-05-25 13:59:35.098157,0 days 00:00:19.205822,AdamW,0.2340285363027289,,,0.00016592487562003405,,,,6,,,0.00036757341745748145,,PRUNED
371,371,47.916666666666664,2025-05-25 13:59:35.136214,2025-05-25 13:59:55.053418,0 days 00:00:19.917204,AdamW,0.2163113999444509,,,0.0002518351696431028,,,,0,,,0.0021118906707830775,,PRUNED
372,372,47.916666666666664,2025-05-25 13:59:55.102514,2025-05-25 14:00:14.567680,0 days 00:00:19.465166,AdamW,0.030401856022424678,,,0.00011831220432687843,,,,5,,,0.0024638307082246813,,PRUNED
373,373,35.416666666666664,2025-05-25 14:00:14.619355,2025-05-25 14:00:34.393690,0 days 00:00:19.774335,AdamW,0.2777924549549687,,,4.972435402433086e-05,,,,1,,,0.0029019878881258432,,PRUNED
374,374,33.333333333333336,2025-05-25 14:00:34.441328,2025-05-25 14:00:54.022715,0 days 00:00:19.581387,Adadelta,0.431368087581577,0.4698373951857478,,,,,,1,6.947095474690532,,,,PRUNED
375,375,41.666666666666664,2025-05-25 14:00:54.070242,2025-05-25 14:01:13.674809,0 days 00:00:19.604567,AdamW,0.10469939696976834,,,8.301586683606086e-05,,,,0,,,0.0032342792675327703,,PRUNED
376,376,52.083333333333336,2025-05-25 14:01:13.713332,2025-05-25 14:01:35.956929,0 days 00:00:22.243597,AdamW,0.24804657079743644,,,2.991834773950264e-05,,,,2,,,0.0004705472433339441,,PRUNED
377,377,33.333333333333336,2025-05-25 14:01:35.995566,2025-05-25 14:01:56.377544,0 days 00:00:20.381978,AdamW,0.1437731586643799,,,0.00010000618935859771,,,,4,,,0.0008454079777705157,,PRUNED
378,378,45.833333333333336,2025-05-25 14:01:56.418698,2025-05-25 14:02:16.168054,0 days 00:00:19.749356,Adam,0.16364790389662645,,0.0007861035675565432,,,,,1,,8.287116606141874,,,PRUNED
379,379,33.333333333333336,2025-05-25 14:02:16.205633,2025-05-25 14:02:35.864669,0 days 00:00:19.659036,AdamW,0.22404126920033815,,,0.012683947452078494,,,,5,,,0.0006945186298709915,,PRUNED
380,380,33.333333333333336,2025-05-25 14:02:35.902441,2025-05-25 14:02:55.598167,0 days 00:00:19.695726,AdamW,0.2942359055781511,,,5.841317073016481e-05,,,,2,,,0.0005706311232823142,,PRUNED
381,381,,2025-05-25 14:02:55.636432,2025-05-25 14:03:13.500432,0 days 00:00:17.864000,SGD,0.25942717243007224,,,,0.0009821552845636586,99.04829497118503,True,1,,,,26.729657994667026,PRUNED
382,382,37.5,2025-05-25 14:03:13.548758,2025-05-25 14:03:33.275022,0 days 00:00:19.726264,AdamW,0.24449804057721616,,,0.0001307129080272844,,,,0,,,0.00024982646861778854,,PRUNED
383,383,41.666666666666664,2025-05-25 14:03:33.312659,2025-05-25 14:03:53.422217,0 days 00:00:20.109558,AdamW,0.3280836926897319,,,0.00018932875278711558,,,,1,,,0.0023125908846959725,,PRUNED
384,384,33.333333333333336,2025-05-25 14:03:53.469981,2025-05-25 14:04:13.152928,0 days 00:00:19.682947,AdamW,0.44372349588315413,,,0.040740030938181584,,,,2,,,0.00021009261040444674,,PRUNED
385,385,33.333333333333336,2025-05-25 14:04:13.203361,2025-05-25 14:04:32.116344,0 days 00:00:18.912983,AdamW,0.15369679994972585,,,0.0004674278065510128,,,,5,,,0.0002911766785626766,,PRUNED
386,386,47.916666666666664,2025-05-25 14:04:32.153377,2025-05-25 14:04:51.986529,0 days 00:00:19.833152,AdamW,0.2686601378547478,,,7.517193356318618e-05,,,,0,,,0.001841912983767483,,PRUNED
387,387,33.333333333333336,2025-05-25 14:04:52.034587,2025-05-25 14:05:11.640640,0 days 00:00:19.606053,Adam,0.07219657179821443,,0.00038184671812443934,,,,,1,,30.929248082487042,,,PRUNED
388,388,33.333333333333336,2025-05-25 14:05:11.692431,2025-05-25 14:05:31.534934,0 days 00:00:19.842503,Adadelta,0.17618712765677297,4.025269622460757,,,,,,3,0.7551308013227677,,,,PRUNED
389,389,33.333333333333336,2025-05-25 14:05:31.572445,2025-05-25 14:05:51.187186,0 days 00:00:19.614741,AdamW,0.19040831198366123,,,0.0009580903255764336,,,,2,,,0.0003332872096107047,,PRUNED
390,390,33.333333333333336,2025-05-25 14:05:51.227313,2025-05-25 14:06:11.138038,0 days 00:00:19.910725,AdamW,0.2354558580089064,,,0.00036375180597119077,,,,1,,,0.002669578002865544,,PRUNED
391,391,39.583333333333336,2025-05-25 14:06:11.176027,2025-05-25 14:06:30.914713,0 days 00:00:19.738686,AdamW,0.38186518665816416,,,0.00015980010662254286,,,,0,,,0.0004007073607160829,,PRUNED
392,392,33.333333333333336,2025-05-25 14:06:30.951623,2025-05-25 14:06:50.715983,0 days 00:00:19.764360,AdamW,0.35967976835270044,,,9.54013426956575e-05,,,,2,,,0.0004985385315396337,,PRUNED
393,393,33.333333333333336,2025-05-25 14:06:50.755667,2025-05-25 14:07:10.605196,0 days 00:00:19.849529,AdamW,0.1668115238436459,,,4.0337501458856376e-05,,,,1,,,0.0021030955387114584,,PRUNED
394,394,68.75,2025-05-25 14:07:10.642655,2025-05-25 14:07:42.717614,0 days 00:00:32.074959,AdamW,0.25609614350632637,,,0.00011884556033714252,,,,5,,,0.0006235114824713602,,COMPLETE
395,395,37.5,2025-05-25 14:07:42.771427,2025-05-25 14:08:02.449618,0 days 00:00:19.678191,AdamW,0.25329699940190054,,,0.00010993183786980769,,,,5,,,0.0006514822840700952,,PRUNED
396,396,33.333333333333336,2025-05-25 14:08:02.496739,2025-05-25 14:08:22.206319,0 days 00:00:19.709580,AdamW,0.26975653428945523,,,0.0001326788069196432,,,,5,,,0.0005557470313724168,,PRUNED
397,397,41.666666666666664,2025-05-25 14:08:22.253820,2025-05-25 14:08:42.238024,0 days 00:00:19.984204,AdamW,0.2428937015911335,,,0.00011379805056837525,,,,5,,,0.0006359540893322644,,PRUNED
398,398,35.416666666666664,2025-05-25 14:08:42.286003,2025-05-25 14:09:01.816286,0 days 00:00:19.530283,AdamW,0.2573507726357209,,,8.428357697247737e-05,,,,5,,,0.0006009573688710037,,PRUNED
399,399,41.666666666666664,2025-05-25 14:09:01.854138,2025-05-25 14:09:21.395042,0 days 00:00:19.540904,AdamW,0.27391082215561324,,,0.00014593457644964335,,,,5,,,0.0007773893589503061,,PRUNED
400,400,37.5,2025-05-25 14:09:21.433614,2025-05-25 14:09:41.002217,0 days 00:00:19.568603,AdamW,0.41602944099557837,,,6.948027454987907e-05,,,,5,,,0.003416964219803218,,PRUNED
401,401,35.416666666666664,2025-05-25 14:09:41.040882,2025-05-25 14:10:00.147768,0 days 00:00:19.106886,AdamW,0.08815951080522305,,,0.0002136868425627954,,,,5,,,0.0005106880821063431,,PRUNED
402,402,41.666666666666664,2025-05-25 14:10:00.185018,2025-05-25 14:10:19.924880,0 days 00:00:19.739862,AdamW,0.20602568380031902,,,0.00012099502278189738,,,,0,,,0.0030286008220209095,,PRUNED
403,403,33.333333333333336,2025-05-25 14:10:19.962431,2025-05-25 14:10:39.662325,0 days 00:00:19.699894,Adam,0.25117977054187074,,0.0019444335395591963,,,,,1,,0.18428165840500968,,,PRUNED
404,404,37.5,2025-05-25 14:10:39.699612,2025-05-25 14:10:59.239824,0 days 00:00:19.540212,AdamW,0.26339977537310816,,,0.00017828834829530462,,,,5,,,0.0027591730972513205,,PRUNED
405,405,35.416666666666664,2025-05-25 14:10:59.278912,2025-05-25 14:11:19.054593,0 days 00:00:19.775681,AdamW,0.13673631890085008,,,9.24858047760484e-05,,,,1,,,0.00044401229039567504,,PRUNED
406,406,35.416666666666664,2025-05-25 14:11:19.092289,2025-05-25 14:11:38.828810,0 days 00:00:19.736521,AdamW,0.00803460241686041,,,6.42426003503155e-05,,,,0,,,0.002486772995051042,,PRUNED
407,407,41.666666666666664,2025-05-25 14:11:38.866482,2025-05-25 14:11:58.619546,0 days 00:00:19.753064,AdamW,0.2803420257245931,,,0.0001509207468723098,,,,1,,,0.00036688695114677996,,PRUNED
408,408,43.75,2025-05-25 14:11:58.656711,2025-05-25 14:12:18.657726,0 days 00:00:20.001015,AdamW,0.23829188574142074,,,0.00010273840967826155,,,,2,,,0.0022967844801527423,,PRUNED
409,409,33.333333333333336,2025-05-25 14:12:18.708724,2025-05-25 14:12:38.730470,0 days 00:00:20.021746,AdamW,0.22614991243214333,,,0.00024179689831322907,,,,0,,,0.0037960615040048954,,PRUNED
410,410,35.416666666666664,2025-05-25 14:12:38.770267,2025-05-25 14:12:57.853293,0 days 00:00:19.083026,AdamW,0.3049194174059967,,,8.02756892776567e-05,,,,6,,,0.00318738166223422,,PRUNED
411,411,43.75,2025-05-25 14:12:57.896839,2025-05-25 14:13:17.402010,0 days 00:00:19.505171,AdamW,0.11860956276131744,,,5.384570465534737e-05,,,,5,,,0.0006734625513557104,,PRUNED
412,412,33.333333333333336,2025-05-25 14:13:17.449593,2025-05-25 14:13:37.175706,0 days 00:00:19.726113,Adam,0.16056096502588801,,0.0013150731724109576,,,,,1,,1.754797812559399,,,PRUNED
413,413,47.916666666666664,2025-05-25 14:13:37.225525,2025-05-25 14:13:57.083794,0 days 00:00:19.858269,AdamW,0.047810391477911066,,,0.00012443971208215738,,,,2,,,0.0006025716111101088,,PRUNED
414,414,35.416666666666664,2025-05-25 14:13:57.121209,2025-05-25 14:14:16.954428,0 days 00:00:19.833219,AdamW,0.18496716784163164,,,0.00016653759362667749,,,,0,,,0.0016906155837039152,,PRUNED
415,415,,2025-05-25 14:14:16.992905,2025-05-25 14:14:35.543751,0 days 00:00:18.550846,SGD,0.2511081094033464,,,,0.005422713161220935,38.3709712436768,False,1,,,,0.033338633578926656,PRUNED
416,416,39.583333333333336,2025-05-25 14:14:35.591202,2025-05-25 14:14:55.072747,0 days 00:00:19.481545,AdamW,0.14588691745403626,,,4.406210942074517e-05,,,,5,,,0.0005381280610066544,,PRUNED
417,417,37.5,2025-05-25 14:14:55.110542,2025-05-25 14:15:14.826098,0 days 00:00:19.715556,AdamW,0.19818570799970522,,,9.554456358413512e-05,,,,1,,,0.0004232663346653733,,PRUNED
418,418,41.666666666666664,2025-05-25 14:15:14.864361,2025-05-25 14:15:34.624718,0 days 00:00:19.760357,AdamW,0.12957204361435765,,,0.00012790050409152633,,,,0,,,0.00290047892631138,,PRUNED
419,419,37.5,2025-05-25 14:15:34.662164,2025-05-25 14:15:54.241082,0 days 00:00:19.578918,AdamW,0.4036379148396942,,,6.512638811711436e-05,,,,2,,,0.0020819468868845887,,PRUNED
420,420,35.416666666666664,2025-05-25 14:15:54.278863,2025-05-25 14:16:14.360456,0 days 00:00:20.081593,AdamW,0.2861572386185121,,,7.911279166997308e-05,,,,2,,,0.000268631513080307,,PRUNED
421,421,33.333333333333336,2025-05-25 14:16:14.408583,2025-05-25 14:16:33.365519,0 days 00:00:18.956936,Adam,0.26243169060371435,,0.007668070324824389,,,,,6,,3.475259636978752,,,PRUNED
422,422,64.58333333333333,2025-05-25 14:16:33.403647,2025-05-25 14:17:04.145517,0 days 00:00:30.741870,AdamW,0.17469045224216476,,,0.00020814649501112002,,,,1,,,0.003397740233453135,,PRUNED
423,423,33.333333333333336,2025-05-25 14:17:04.202658,2025-05-25 14:17:23.966271,0 days 00:00:19.763613,AdamW,0.24049966092446276,,,0.0003002325646474924,,,,0,,,0.000925911911848945,,PRUNED
424,424,35.416666666666664,2025-05-25 14:17:24.015069,2025-05-25 14:17:43.552079,0 days 00:00:19.537010,AdamW,0.1538881633107274,,,0.0001020099773550803,,,,5,,,0.0025057619105894103,,PRUNED
425,425,33.333333333333336,2025-05-25 14:17:43.601292,2025-05-25 14:18:03.637741,0 days 00:00:20.036449,AdamW,0.21908122435351163,,,0.00013984738468305529,,,,1,,,0.00048224028627303137,,PRUNED
426,426,41.666666666666664,2025-05-25 14:18:03.677447,2025-05-25 14:18:23.571689,0 days 00:00:19.894242,AdamW,0.31915106189527287,,,3.558056192569842e-05,,,,2,,,0.001159607243442313,,PRUNED
427,427,33.333333333333336,2025-05-25 14:18:23.610957,2025-05-25 14:18:43.542836,0 days 00:00:19.931879,AdamW,0.1002424543562791,,,0.00018334860320744304,,,,4,,,0.0019659382310312076,,PRUNED
428,428,68.75,2025-05-25 14:18:43.582630,2025-05-25 14:19:13.271536,0 days 00:00:29.688906,AdamW,0.3479506438672067,,,0.00010832808367765336,,,,0,,,0.0007287769070429082,,PRUNED
429,429,43.75,2025-05-25 14:19:13.314676,2025-05-25 14:19:33.387060,0 days 00:00:20.072384,AdamW,0.0770203378754368,,,8.338905017660919e-05,,,,1,,,0.0003199002905486215,,PRUNED
430,430,41.666666666666664,2025-05-25 14:19:33.425629,2025-05-25 14:19:53.066070,0 days 00:00:19.640441,Adam,0.2705180772668257,,0.00046914265613943193,,,,,5,,0.06428463503811012,,,PRUNED
431,431,35.416666666666664,2025-05-25 14:19:53.104873,2025-05-25 14:20:12.800760,0 days 00:00:19.695887,AdamW,0.1697100405698061,,,5.574142900066764e-05,,,,1,,,0.002782861488730695,,PRUNED
432,432,33.333333333333336,2025-05-25 14:20:12.838641,2025-05-25 14:20:32.484016,0 days 00:00:19.645375,AdamW,0.23353782298974038,,,0.00014190614241977724,,,,2,,,0.0013498824618118264,,PRUNED
433,433,33.333333333333336,2025-05-25 14:20:32.524817,2025-05-25 14:20:52.317196,0 days 00:00:19.792379,AdamW,0.25716241310842197,,,0.0005979285766448965,,,,0,,,0.0022261388079072323,,PRUNED
434,434,47.916666666666664,2025-05-25 14:20:52.357073,2025-05-25 14:21:14.623226,0 days 00:00:22.266153,AdamW,0.1818633381191396,,,7.042083603643762e-05,,,,2,,,0.0030675857705075617,,PRUNED
435,435,,2025-05-25 14:21:14.672569,2025-05-25 14:21:33.344209,0 days 00:00:18.671640,SGD,0.14962393076839314,,,,0.0007259377064969101,18.10265678976274,True,1,,,,0.24638579135571406,PRUNED
436,436,33.333333333333336,2025-05-25 14:21:33.380731,2025-05-25 14:21:53.538423,0 days 00:00:20.157692,AdamW,0.4252937470942887,,,0.00011703526493125016,,,,0,,,0.0003918109098182503,,PRUNED
437,437,33.333333333333336,2025-05-25 14:21:53.587707,2025-05-25 14:22:13.052393,0 days 00:00:19.464686,AdamW,0.2523202413073502,,,9.170800431212574e-05,,,,5,,,0.0003512561451129353,,PRUNED
438,438,33.333333333333336,2025-05-25 14:22:13.099549,2025-05-25 14:22:32.697963,0 days 00:00:19.598414,AdamW,0.27945542574293114,,,0.00016047524087856236,,,,2,,,0.001818866289940598,,PRUNED
439,439,33.333333333333336,2025-05-25 14:22:32.735514,2025-05-25 14:22:52.405069,0 days 00:00:19.669555,Adam,0.2976071859959866,,0.09343663084963437,,,,,4,,11.033319728549822,,,PRUNED
440,440,33.333333333333336,2025-05-25 14:22:52.443199,2025-05-25 14:23:12.094463,0 days 00:00:19.651264,AdamW,0.1586754949931206,,,0.0002570481667339974,,,,1,,,0.0025974292669426824,,PRUNED
441,441,45.833333333333336,2025-05-25 14:23:12.132546,2025-05-25 14:23:31.911173,0 days 00:00:19.778627,AdamW,0.2413655393098041,,,0.00012037070704995266,,,,1,,,0.0005896919164545847,,PRUNED
442,442,35.416666666666664,2025-05-25 14:23:31.948917,2025-05-25 14:23:51.681666,0 days 00:00:19.732749,AdamW,0.208432757094107,,,7.706297828428275e-05,,,,2,,,0.0005281268108726544,,PRUNED
443,443,39.583333333333336,2025-05-25 14:23:51.719366,2025-05-25 14:24:11.370453,0 days 00:00:19.651087,AdamW,0.188366495231107,,,4.82923935403583e-05,,,,0,,,0.0036075752586765186,,PRUNED
444,444,33.333333333333336,2025-05-25 14:24:11.408450,2025-05-25 14:24:30.929735,0 days 00:00:19.521285,AdamW,0.2690131582463918,,,0.00018810104205808147,,,,5,,,0.00044520037441329814,,PRUNED
445,445,33.333333333333336,2025-05-25 14:24:30.968209,2025-05-25 14:24:50.817677,0 days 00:00:19.849468,AdamW,0.10878832207908136,,,9.400918774783535e-05,,,,0,,,0.0023650303724173445,,PRUNED
446,446,50.0,2025-05-25 14:24:50.855070,2025-05-25 14:25:13.631570,0 days 00:00:22.776500,AdamW,0.1681427960778108,,,5.833818476846635e-05,,,,1,,,0.003950211238352545,,PRUNED
447,447,39.583333333333336,2025-05-25 14:25:13.669478,2025-05-25 14:25:33.040880,0 days 00:00:19.371402,AdamW,0.14182698042001587,,,0.00014491318165212112,,,,2,,,0.0029664944475880127,,PRUNED
448,448,35.416666666666664,2025-05-25 14:25:33.087819,2025-05-25 14:25:41.391853,0 days 00:00:08.304034,Adam,0.24768278158114881,,3.5869553400269184e-05,,,,,2,,0.6003450872142225,,,PRUNED
449,449,45.833333333333336,2025-05-25 14:25:41.439809,2025-05-25 14:26:00.858661,0 days 00:00:19.418852,AdamW,0.22937964455460874,,,0.00010959830249303472,,,,5,,,0.0026233330404243126,,PRUNED
450,450,56.25,2025-05-25 14:26:00.905378,2025-05-25 14:26:13.039105,0 days 00:00:12.133727,AdamW,0.06457178467578137,,,7.372112113296395e-05,,,,0,,,0.0032671095530853868,,PRUNED
451,451,33.333333333333336,2025-05-25 14:26:13.077198,2025-05-25 14:26:32.899446,0 days 00:00:19.822248,AdamW,0.26346193620734926,,,0.0001297023015094591,,,,1,,,0.0021451322183746466,,PRUNED
452,452,33.333333333333336,2025-05-25 14:26:32.960000,2025-05-25 14:26:52.847095,0 days 00:00:19.887095,AdamW,0.12266618203248955,,,0.0002129258305742718,,,,1,,,0.000491896706291147,,PRUNED
453,453,33.333333333333336,2025-05-25 14:26:52.884935,2025-05-25 14:27:12.515830,0 days 00:00:19.630895,AdamW,0.33888221996144735,,,0.00031856766758319506,,,,3,,,0.0002913331472728063,,PRUNED
454,454,37.5,2025-05-25 14:27:12.554478,2025-05-25 14:27:32.500312,0 days 00:00:19.945834,AdamW,0.19543040609268547,,,0.00016568307190415675,,,,1,,,0.0023882798913969806,,PRUNED
455,455,33.333333333333336,2025-05-25 14:27:32.538411,2025-05-25 14:27:52.295659,0 days 00:00:19.757248,AdamW,0.2864445472017453,,,9.473898959082839e-05,,,,0,,,0.00040892664805485744,,PRUNED
456,456,27.083333333333332,2025-05-25 14:27:52.335719,2025-05-25 14:28:11.791969,0 days 00:00:19.456250,Adam,0.1757991927645664,,1.549517147214877e-05,,,,,5,,0.03480953108234298,,,PRUNED
457,457,41.666666666666664,2025-05-25 14:28:11.829961,2025-05-25 14:28:32.115914,0 days 00:00:20.285953,AdamW,0.035498806566236475,,,6.58516521999704e-05,,,,1,,,0.0027603618840394495,,PRUNED
458,458,31.25,2025-05-25 14:28:32.154129,2025-05-25 14:28:51.217404,0 days 00:00:19.063275,AdamW,0.39020175491082554,,,0.00011574422004480656,,,,7,,,0.003528746244119447,,PRUNED
