,number,value,datetime_start,datetime_complete,duration,params_algorithm,params_dropout_rate,params_lr_Adadelta,params_lr_Adam,params_lr_AdamW,params_lr_SGD,params_momentum_SGD,params_nesterov_SGD,params_suggested_freeze,params_weight_decay_Adadelta,params_weight_decay_Adam,params_weight_decay_AdamW,params_weight_decay_SGD,state
803,803,39.583333333333336,2025-05-25 16:21:49.720406,2025-05-25 16:22:11.004269,0 days 00:00:21.283863,AdamW,0.24212645050680792,,,9.586527228902365e-05,,,,2,,,0.0003265408546288578,,PRUNED
804,804,33.333333333333336,2025-05-25 16:22:11.056169,2025-05-25 16:22:29.938006,0 days 00:00:18.881837,AdamW,0.16109380721774794,,,0.00018959493158809704,,,,0,,,0.00044904619339335036,,PRUNED
805,805,43.75,2025-05-25 16:22:29.988988,2025-05-25 16:22:48.538764,0 days 00:00:18.549776,AdamW,0.23112817425705312,,,0.00011555783892002154,,,,1,,,0.00035848916962274746,,PRUNED
806,806,33.333333333333336,2025-05-25 16:22:48.591504,2025-05-25 16:23:08.422473,0 days 00:00:19.830969,AdamW,0.07776943572533106,,,0.00015132925886106067,,,,1,,,0.00013437598713921504,,PRUNED
807,807,33.333333333333336,2025-05-25 16:23:08.477423,2025-05-25 16:23:28.514867,0 days 00:00:20.037444,AdamW,0.2623292269246006,,,8.329613947401431e-05,,,,0,,,0.0004125921842917278,,PRUNED
808,808,39.583333333333336,2025-05-25 16:23:28.568533,2025-05-25 16:23:48.249822,0 days 00:00:19.681289,AdamW,0.20465559648134887,,,4.901626500142594e-05,,,,1,,,0.0005063177414752739,,PRUNED
809,809,,2025-05-25 16:23:48.301487,2025-05-25 16:24:06.408567,0 days 00:00:18.107080,SGD,0.2499726269578432,,,,0.0005166117531655675,66.4334152718992,True,3,,,,1.6629120471572094,PRUNED
810,810,33.333333333333336,2025-05-25 16:24:06.458981,2025-05-25 16:24:26.040363,0 days 00:00:19.581382,AdamW,0.10730363671425862,,,0.0002326042580480516,,,,5,,,0.0019519150538652966,,PRUNED
811,811,52.083333333333336,2025-05-25 16:24:26.093814,2025-05-25 16:24:45.801771,0 days 00:00:19.707957,AdamW,0.2181612271940921,,,0.0001246374323374047,,,,1,,,0.00237815261131225,,PRUNED
812,812,45.833333333333336,2025-05-25 16:24:45.854139,2025-05-25 16:25:05.724689,0 days 00:00:19.870550,AdamW,0.37859612601452036,,,0.00036891710006489665,,,,3,,,0.003729837811803977,,PRUNED
813,813,43.75,2025-05-25 16:25:05.776663,2025-05-25 16:25:25.671435,0 days 00:00:19.894772,AdamW,0.421226840109548,,,0.0001017263941124987,,,,1,,,0.0005727141028300768,,PRUNED
814,814,45.833333333333336,2025-05-25 16:25:25.724707,2025-05-25 16:25:45.398119,0 days 00:00:19.673412,AdamW,0.1802457701065246,,,6.28434970977334e-05,,,,2,,,0.0030593563301543523,,PRUNED
815,815,35.416666666666664,2025-05-25 16:25:45.449966,2025-05-25 16:26:05.230199,0 days 00:00:19.780233,AdamW,0.12713813138303648,,,0.0001404956956154152,,,,0,,,0.0026125506958920718,,PRUNED
816,816,31.25,2025-05-25 16:26:05.282593,2025-05-25 16:26:24.190928,0 days 00:00:18.908335,AdamW,0.3611779492254307,,,0.0001685784808603468,,,,8,,,0.0004963639726209651,,PRUNED
817,817,35.416666666666664,2025-05-25 16:26:24.237444,2025-05-25 16:26:43.920049,0 days 00:00:19.682605,AdamW,0.2903595404588116,,,8.733639180181336e-05,,,,1,,,0.000653995170927869,,PRUNED
818,818,39.583333333333336,2025-05-25 16:26:43.972731,2025-05-25 16:27:03.905429,0 days 00:00:19.932698,AdamW,0.3388194859870977,,,3.690741727928416e-05,,,,2,,,0.0021947568683285358,,PRUNED
819,819,,2025-05-25 16:27:03.957208,,,,0.16807142471864375,,,,,,,4,,,,,RUNNING
820,820,33.333333333333336,2025-05-25 16:59:40.649660,2025-05-25 16:59:53.148344,0 days 00:00:12.498684,Adadelta,0.1515314371457255,0.36666653942627947,,,,,,1,0.14190158642402417,,,,PRUNED
821,821,41.666666666666664,2025-05-25 16:59:53.180330,2025-05-25 16:59:59.181987,0 days 00:00:06.001657,AdamW,0.1881474834403971,,,0.00011178752595462065,,,,2,,,0.0029118770205808294,,PRUNED
822,822,33.333333333333336,2025-05-25 16:59:59.216475,2025-05-25 17:00:05.211674,0 days 00:00:05.995199,AdamW,0.1700189608666674,,,0.0003250307383879176,,,,0,,,0.0004470924860837784,,PRUNED
823,823,68.75,2025-05-25 17:00:05.247067,2025-05-25 17:00:21.960521,0 days 00:00:16.713454,AdamW,0.22872021157739264,,,7.76887450125135e-05,,,,3,,,0.00037572630531922205,,COMPLETE
824,824,39.583333333333336,2025-05-25 17:00:22.016713,2025-05-25 17:00:31.323941,0 days 00:00:09.307228,AdamW,0.062440795206759755,,,0.0001335151899336528,,,,4,,,0.0020070777407693707,,PRUNED
825,825,37.5,2025-05-25 17:00:31.368137,2025-05-25 17:00:40.323109,0 days 00:00:08.954972,AdamW,0.09430260159214914,,,0.00019140523791598809,,,,1,,,0.002588718580250309,,PRUNED
826,826,35.416666666666664,2025-05-25 17:00:40.360411,2025-05-25 17:00:48.286123,0 days 00:00:07.925712,AdamW,0.19706442208509398,,,0.0001002169339505248,,,,6,,,0.0017881195945521435,,PRUNED
827,827,35.416666666666664,2025-05-25 17:00:48.327959,2025-05-25 17:00:59.297586,0 days 00:00:10.969627,AdamW,0.2790325342838229,,,6.756230553827047e-05,,,,5,,,0.0034131855605021404,,PRUNED
828,828,77.08333333333333,2025-05-25 17:00:59.345605,2025-05-25 17:01:18.632034,0 days 00:00:19.286429,AdamW,0.2400098112025174,,,0.00015209703540579854,,,,2,,,0.002321934930916858,,COMPLETE
829,829,33.333333333333336,2025-05-25 17:01:18.694202,2025-05-25 17:01:38.728248,0 days 00:00:20.034046,AdamW,0.2400399813270453,,,0.00023455748195460037,,,,2,,,0.0021188907484292157,,PRUNED
830,830,33.333333333333336,2025-05-25 17:01:38.782257,2025-05-25 17:01:58.637535,0 days 00:00:19.855278,AdamW,0.2466413536278033,,,0.0001731144391248203,,,,2,,,0.002293062238852712,,PRUNED
831,831,33.333333333333336,2025-05-25 17:01:58.691463,2025-05-25 17:02:18.367342,0 days 00:00:19.675879,AdamW,0.23293662942316348,,,0.0002183570799346738,,,,2,,,0.0019142610680665806,,PRUNED
832,832,33.333333333333336,2025-05-25 17:02:18.421912,2025-05-25 17:02:38.294116,0 days 00:00:19.872204,AdamW,0.25160813020847494,,,0.00027178471582895813,,,,2,,,0.0005272811384699748,,PRUNED
833,833,43.75,2025-05-25 17:02:38.352106,2025-05-25 17:02:58.164937,0 days 00:00:19.812831,AdamW,0.24000821243264145,,,0.00015319738826335993,,,,2,,,0.0003936389410746672,,PRUNED
834,834,,2025-05-25 17:02:58.224120,2025-05-25 17:03:17.906651,0 days 00:00:19.682531,SGD,0.2573819373489348,,,,1.852957919035083e-05,16.212323418077077,False,2,,,,0.6657195687709554,PRUNED
835,835,33.333333333333336,2025-05-25 17:03:17.957667,2025-05-25 17:03:38.107640,0 days 00:00:20.149973,AdamW,0.22496011469010943,,,0.0001935974505799618,,,,2,,,0.0005839021252559934,,PRUNED
836,836,39.583333333333336,2025-05-25 17:03:38.163912,2025-05-25 17:03:57.957499,0 days 00:00:19.793587,AdamW,0.21215064861131416,,,0.00015275249871727327,,,,2,,,0.0016067561644257477,,PRUNED
837,837,37.5,2025-05-25 17:03:58.012467,2025-05-25 17:04:17.618821,0 days 00:00:19.606354,AdamW,0.26371869860872266,,,0.0001328827348174811,,,,2,,,0.0004621934938350758,,PRUNED
838,838,33.333333333333336,2025-05-25 17:04:17.672908,2025-05-25 17:04:37.568808,0 days 00:00:19.895900,AdamW,0.23572318101036366,,,0.00018383458758975443,,,,2,,,0.002361353536762463,,PRUNED
839,839,31.25,2025-05-25 17:04:37.623538,2025-05-25 17:04:57.490224,0 days 00:00:19.866686,AdamW,0.21926357763693755,,,0.0001239121828839299,,,,2,,,0.002182996760668106,,PRUNED
840,840,33.333333333333336,2025-05-25 17:04:57.544080,2025-05-25 17:05:17.137365,0 days 00:00:19.593285,AdamW,0.24090263961030192,,,0.00015562511194120866,,,,2,,,0.0003155494808444424,,PRUNED
841,841,31.25,2025-05-25 17:05:17.190944,2025-05-25 17:05:36.908185,0 days 00:00:19.717241,Adadelta,0.252059238641387,0.01720949144410447,,,,,,2,2.4948918702241394,,,,PRUNED
842,842,33.333333333333336,2025-05-25 17:05:36.962573,2025-05-25 17:05:56.087500,0 days 00:00:19.124927,AdamW,0.2281519175925303,,,0.0001276893085977542,,,,7,,,0.0004277261009652623,,PRUNED
843,843,33.333333333333336,2025-05-25 17:05:56.139930,2025-05-25 17:06:14.859057,0 days 00:00:18.719127,AdamW,0.20514242255321152,,,0.0004606733866936167,,,,1,,,0.0004864452372182268,,PRUNED
844,844,37.5,2025-05-25 17:06:14.911076,2025-05-25 17:06:33.042627,0 days 00:00:18.131551,AdamW,0.24267619673480015,,,2.6869726947028493e-05,,,,1,,,0.000757276183033605,,PRUNED
845,845,33.333333333333336,2025-05-25 17:06:33.097508,2025-05-25 17:06:50.841744,0 days 00:00:17.744236,AdamW,0.25815666860338465,,,0.00021664114781757204,,,,0,,,0.0019736395033644397,,PRUNED
846,846,37.5,2025-05-25 17:06:50.898063,2025-05-25 17:07:10.573630,0 days 00:00:19.675567,AdamW,0.2749877338737726,,,0.00011220980207999565,,,,1,,,0.005896486543732883,,PRUNED
847,847,35.416666666666664,2025-05-25 17:07:10.627272,2025-05-25 17:07:30.294659,0 days 00:00:19.667387,AdamW,0.26496156116650144,,,0.0001754626407635274,,,,2,,,0.0041183855737206175,,PRUNED
848,848,52.083333333333336,2025-05-25 17:07:30.349993,2025-05-25 17:07:50.118960,0 days 00:00:19.768967,AdamW,0.16138365514840097,,,9.003033584146144e-05,,,,0,,,0.0005522557800215969,,PRUNED
849,849,35.416666666666664,2025-05-25 17:07:50.172425,2025-05-25 17:08:09.893058,0 days 00:00:19.720633,AdamW,0.2160549122672741,,,5.747305669344126e-05,,,,1,,,0.0006576370875609618,,PRUNED
850,850,33.333333333333336,2025-05-25 17:08:09.946214,2025-05-25 17:08:29.948409,0 days 00:00:20.002195,AdamW,0.4099575532513531,,,0.00014364477401796868,,,,1,,,0.0024482692238205726,,PRUNED
851,851,33.333333333333336,2025-05-25 17:08:30.002774,2025-05-25 17:08:49.814430,0 days 00:00:19.811656,AdamW,0.23186361957339816,,,0.0002626044184967149,,,,0,,,0.0017339022071162587,,PRUNED
852,852,41.666666666666664,2025-05-25 17:08:49.871588,2025-05-25 17:09:09.542871,0 days 00:00:19.671283,AdamW,0.2984640816127656,,,0.00011404683108507005,,,,2,,,0.00034956685050918196,,PRUNED
853,853,33.333333333333336,2025-05-25 17:09:09.596348,2025-05-25 17:09:29.448153,0 days 00:00:19.851805,AdamW,0.18496761213537447,,,8.326736730678758e-05,,,,1,,,0.002848249519501424,,PRUNED
854,854,41.666666666666664,2025-05-25 17:09:29.501422,2025-05-25 17:09:49.151760,0 days 00:00:19.650338,AdamW,0.17343711342505383,,,0.00016217621039720087,,,,5,,,0.0021187871761609986,,PRUNED
855,855,41.666666666666664,2025-05-25 17:09:49.211540,2025-05-25 17:10:09.066196,0 days 00:00:19.854656,AdamW,0.24829936255699536,,,4.760429770688983e-05,,,,1,,,0.00114810191366642,,PRUNED
856,856,33.333333333333336,2025-05-25 17:10:09.119566,2025-05-25 17:10:29.291156,0 days 00:00:20.171590,AdamW,0.20115920061707793,,,0.0003016167493539146,,,,0,,,0.0004049823869459565,,PRUNED
857,857,,2025-05-25 17:10:29.344451,2025-05-25 17:10:47.410183,0 days 00:00:18.065732,SGD,0.22708036685393942,,,,0.06727272525483742,76.69835946375281,True,2,,,,0.01884779140812326,PRUNED
858,858,35.416666666666664,2025-05-25 17:10:47.464404,2025-05-25 17:11:07.288169,0 days 00:00:19.823765,AdamW,0.1906073008591808,,,9.957459150458096e-05,,,,1,,,0.0005088465970198438,,PRUNED
859,859,33.333333333333336,2025-05-25 17:11:07.342698,2025-05-25 17:11:27.164851,0 days 00:00:19.822153,AdamW,0.42987277709439375,,,7.074779267794494e-05,,,,2,,,0.003397374642852724,,PRUNED
860,860,31.25,2025-05-25 17:11:27.216931,2025-05-25 17:11:45.128637,0 days 00:00:17.911706,AdamW,0.14332520522130326,,,0.00020425957956599555,,,,5,,,0.0023031418031846007,,PRUNED
861,861,33.333333333333336,2025-05-25 17:11:45.181279,2025-05-25 17:12:04.984132,0 days 00:00:19.802853,AdamW,0.20820741764492584,,,0.0006994737649998964,,,,0,,,0.0032335713179362157,,PRUNED
862,862,33.333333333333336,2025-05-25 17:12:05.039414,2025-05-25 17:12:21.637138,0 days 00:00:16.597724,AdamW,0.26610965118946267,,,0.000136030258952078,,,,1,,,0.0004634776203582518,,PRUNED
863,863,33.333333333333336,2025-05-25 17:12:21.736137,2025-05-25 17:12:41.323690,0 days 00:00:19.587553,AdamW,0.24895410466596382,,,0.00010987867217550522,,,,2,,,0.0005886821192482974,,PRUNED
864,864,37.5,2025-05-25 17:12:41.377415,2025-05-25 17:13:01.078607,0 days 00:00:19.701192,Adadelta,0.1812089065971923,0.3202248170833005,,,,,,1,54.015382857412035,,,,PRUNED
865,865,39.583333333333336,2025-05-25 17:13:01.132352,2025-05-25 17:13:20.888749,0 days 00:00:19.756397,AdamW,0.1544316211417698,,,8.605446860766599e-05,,,,1,,,0.0026535130739431694,,PRUNED
866,866,33.333333333333336,2025-05-25 17:13:20.941541,2025-05-25 17:13:40.618849,0 days 00:00:19.677308,AdamW,0.28590318464933295,,,0.0001618118959732682,,,,1,,,0.0038611102164718613,,PRUNED
867,867,33.333333333333336,2025-05-25 17:13:40.678081,2025-05-25 17:14:00.529517,0 days 00:00:19.851436,AdamW,0.23585056027274998,,,0.00014218240000158085,,,,0,,,0.0008869301090443411,,PRUNED
868,868,39.583333333333336,2025-05-25 17:14:00.953788,2025-05-25 17:14:20.763029,0 days 00:00:19.809241,AdamW,0.1633672918960722,,,1.7043797657705992e-05,,,,2,,,0.0003869502959491121,,PRUNED
869,869,52.083333333333336,2025-05-25 17:14:20.817644,2025-05-25 17:14:40.633793,0 days 00:00:19.816149,AdamW,0.4909270315731906,,,0.00011706814623592502,,,,1,,,0.001888924495095329,,PRUNED
870,870,45.833333333333336,2025-05-25 17:14:40.688288,2025-05-25 17:15:00.233140,0 days 00:00:19.544852,AdamW,0.3225074880836725,,,7.316489813327459e-05,,,,5,,,0.002870740554189579,,PRUNED
871,871,33.333333333333336,2025-05-25 17:15:00.288283,2025-05-25 17:15:20.432000,0 days 00:00:20.143717,AdamW,0.1956487393586129,,,9.650090078333779e-05,,,,2,,,0.002487863325034133,,PRUNED
872,872,50.0,2025-05-25 17:15:20.485472,2025-05-25 17:15:40.299745,0 days 00:00:19.814273,AdamW,0.13632040143960847,,,0.00019489750700470772,,,,1,,,0.0005267486353775335,,PRUNED
873,873,43.75,2025-05-25 17:15:40.355697,2025-05-25 17:16:00.336504,0 days 00:00:19.980807,AdamW,0.21950455537418323,,,5.702716841361632e-05,,,,0,,,0.002206060322762186,,PRUNED
874,874,33.333333333333336,2025-05-25 17:16:00.390682,2025-05-25 17:16:20.106623,0 days 00:00:19.715941,AdamW,0.2588395996220753,,,0.005018232011438364,,,,4,,,0.0004270795089905399,,PRUNED
875,875,33.333333333333336,2025-05-25 17:16:20.161128,2025-05-25 17:16:39.964535,0 days 00:00:19.803407,AdamW,0.2740689742966254,,,0.00024664990291698325,,,,0,,,0.0003027075082682621,,PRUNED
876,876,35.416666666666664,2025-05-25 17:16:40.021912,2025-05-25 17:16:59.604569,0 days 00:00:19.582657,AdamW,0.17332002453913495,,,4.147625196583916e-05,,,,5,,,0.00046986775788595544,,PRUNED
877,877,31.25,2025-05-25 17:16:59.658175,2025-05-25 17:17:17.576066,0 days 00:00:17.917891,AdamW,0.24418256755348558,,,0.00013336278707553665,,,,1,,,0.0020747429678105466,,PRUNED
878,878,39.583333333333336,2025-05-25 17:17:17.632271,2025-05-25 17:17:37.686891,0 days 00:00:20.054620,AdamW,0.22842129554467344,,,9.719619748941562e-05,,,,1,,,0.0031477834978644406,,PRUNED
879,879,,2025-05-25 17:17:37.741065,2025-05-25 17:17:53.450148,0 days 00:00:15.709083,SGD,0.3928764710775064,,,,0.0026855659464132668,41.258798898315774,False,2,,,,0.2762181044836571,PRUNED
880,880,33.333333333333336,2025-05-25 17:17:53.501571,2025-05-25 17:18:13.175834,0 days 00:00:19.674263,AdamW,0.4504290066799733,,,0.00011482488109758566,,,,1,,,0.00035752495585189353,,PRUNED
881,881,37.5,2025-05-25 17:18:13.229600,2025-05-25 17:18:33.021844,0 days 00:00:19.792244,AdamW,0.25451142208032573,,,0.00017346559234178728,,,,0,,,0.0024188713160550185,,PRUNED
882,882,33.333333333333336,2025-05-25 17:18:33.075524,2025-05-25 17:18:52.888558,0 days 00:00:19.813034,AdamW,0.2135728999367482,,,0.0009731021600460529,,,,2,,,0.0028018092019328686,,PRUNED
883,883,47.916666666666664,2025-05-25 17:18:52.941756,2025-05-25 17:19:12.709897,0 days 00:00:19.768141,AdamW,0.35554560385688416,,,8.165312381777443e-05,,,,1,,,0.0005979898753285082,,PRUNED
884,884,35.416666666666664,2025-05-25 17:19:12.763124,2025-05-25 17:19:32.483184,0 days 00:00:19.720060,AdamW,0.3113065947044288,,,0.00012937874364551873,,,,1,,,0.001820480294183587,,PRUNED
885,885,33.333333333333336,2025-05-25 17:19:32.537544,2025-05-25 17:19:52.347986,0 days 00:00:19.810442,Adam,0.1870462064606316,,0.07043373049022145,,,,,0,,19.473312607437446,,,PRUNED
886,886,37.5,2025-05-25 17:19:52.402198,2025-05-25 17:20:11.914963,0 days 00:00:19.512765,AdamW,0.332123345163318,,,0.0003335013882262502,,,,5,,,0.004696843351530411,,PRUNED
887,887,33.333333333333336,2025-05-25 17:20:11.969717,2025-05-25 17:20:31.878171,0 days 00:00:19.908454,AdamW,0.2369009218902846,,,6.557432020183989e-05,,,,2,,,0.0036574505732647183,,PRUNED
888,888,33.333333333333336,2025-05-25 17:20:31.938769,2025-05-25 17:20:51.765183,0 days 00:00:19.826414,Adadelta,0.16812414667433678,38.416143902428885,,,,,,1,0.021753848911070316,,,,PRUNED
889,889,41.666666666666664,2025-05-25 17:20:51.817656,2025-05-25 17:21:11.405589,0 days 00:00:19.587933,AdamW,0.20670674979012468,,,0.00015770641236492034,,,,2,,,0.0005453469643957692,,PRUNED
890,890,41.666666666666664,2025-05-25 17:21:11.458571,2025-05-25 17:21:31.555336,0 days 00:00:20.096765,AdamW,0.19906072925280618,,,9.749239275563483e-05,,,,1,,,0.0014340046410220803,,PRUNED
891,891,33.333333333333336,2025-05-25 17:21:31.612388,2025-05-25 17:21:51.480255,0 days 00:00:19.867867,AdamW,0.15308122447519634,,,0.0002336879317073683,,,,0,,,0.0004883714802940856,,PRUNED
892,892,37.5,2025-05-25 17:21:51.533568,2025-05-25 17:22:11.126200,0 days 00:00:19.592632,AdamW,0.2510261682174378,,,0.0001283274284490525,,,,5,,,0.00042464328906546096,,PRUNED
893,893,50.0,2025-05-25 17:22:11.178391,2025-05-25 17:22:30.878709,0 days 00:00:19.700318,AdamW,0.22370283616613693,,,7.633327351992462e-05,,,,1,,,0.0026362122189025083,,PRUNED
894,894,33.333333333333336,2025-05-25 17:22:30.932710,2025-05-25 17:22:47.971873,0 days 00:00:17.039163,AdamW,0.26869668539684777,,,0.00019329425696048685,,,,1,,,0.0023088481266336494,,PRUNED
895,895,33.333333333333336,2025-05-25 17:22:48.025130,2025-05-25 17:23:07.611572,0 days 00:00:19.586442,AdamW,0.17977232785653166,,,0.00011398408123287456,,,,2,,,0.002026583865376455,,PRUNED
896,896,33.333333333333336,2025-05-25 17:23:07.664692,2025-05-25 17:23:24.576882,0 days 00:00:16.912190,AdamW,0.29459343088177115,,,0.0001509993116370883,,,,0,,,0.0001019838251480943,,PRUNED
897,897,43.75,2025-05-25 17:23:24.630778,2025-05-25 17:23:44.319034,0 days 00:00:19.688256,AdamW,0.1437732852110681,,,8.608841672359327e-05,,,,1,,,0.0006756801930354053,,PRUNED
898,898,33.333333333333336,2025-05-25 17:23:44.373037,2025-05-25 17:24:04.123404,0 days 00:00:19.750367,AdamW,0.24104616499044265,,,0.0004101307994264979,,,,2,,,0.003123593288925287,,PRUNED
899,899,43.75,2025-05-25 17:24:04.176234,2025-05-25 17:24:24.035843,0 days 00:00:19.859609,AdamW,0.41932098616998514,,,0.00010599471441245721,,,,1,,,0.0003353204180157186,,PRUNED
900,900,33.333333333333336,2025-05-25 17:24:24.089893,2025-05-25 17:24:43.584172,0 days 00:00:19.494279,AdamW,0.4064724478877038,,,5.5170557083579606e-05,,,,4,,,0.00038758535461133603,,PRUNED
901,901,33.333333333333336,2025-05-25 17:24:43.640154,2025-05-25 17:25:03.722732,0 days 00:00:20.082578,AdamW,0.43442793994710754,,,0.00017859706236681593,,,,1,,,0.0027897266579299993,,PRUNED
902,902,41.666666666666664,2025-05-25 17:25:03.776381,2025-05-25 17:25:23.490854,0 days 00:00:19.714473,AdamW,0.3721684550910175,,,0.00014331755734042716,,,,2,,,0.002481993706266988,,PRUNED
903,903,33.333333333333336,2025-05-25 17:25:23.544841,2025-05-25 17:25:42.661009,0 days 00:00:19.116168,AdamW,0.19224956313184774,,,9.220379914338382e-05,,,,6,,,0.002147095562736437,,PRUNED
904,904,37.5,2025-05-25 17:25:42.714866,2025-05-25 17:26:02.622602,0 days 00:00:19.907736,AdamW,0.2184657279855621,,,6.78964905842808e-05,,,,0,,,0.001682245653210969,,PRUNED
905,905,,2025-05-25 17:26:02.678747,2025-05-25 17:26:20.774494,0 days 00:00:18.095747,SGD,0.25855412950098877,,,,0.005347114601146766,94.20099307344111,True,1,,,,0.011813512736224701,PRUNED
906,906,35.416666666666664,2025-05-25 17:26:20.826678,2025-05-25 17:26:40.588106,0 days 00:00:19.761428,AdamW,0.23288525354027173,,,0.00011206037458126559,,,,0,,,0.00045811721535569944,,PRUNED
907,907,41.666666666666664,2025-05-25 17:26:40.642054,2025-05-25 17:27:00.420025,0 days 00:00:19.777971,AdamW,0.2773944116882983,,,0.00012963696654488837,,,,1,,,0.0005305583968069043,,PRUNED
908,908,33.333333333333336,2025-05-25 17:27:00.476424,2025-05-25 17:27:20.179124,0 days 00:00:19.702700,AdamW,0.1615251343108297,,,0.0002846980220860163,,,,5,,,0.0030126526631303347,,PRUNED
909,909,33.333333333333336,2025-05-25 17:27:20.233796,2025-05-25 17:27:39.976441,0 days 00:00:19.742645,AdamW,0.13151398368180542,,,0.00022924557414654063,,,,1,,,0.0005862169490416821,,PRUNED
910,910,33.333333333333336,2025-05-25 17:27:40.031590,2025-05-25 17:27:59.658704,0 days 00:00:19.627114,Adam,0.24552699953365423,,0.012168335508346673,,,,,2,,57.60990170169758,,,PRUNED
911,911,33.333333333333336,2025-05-25 17:27:59.712479,2025-05-25 17:28:16.964433,0 days 00:00:17.251954,AdamW,0.20456706725025597,,,0.0016054977416745475,,,,0,,,0.001966029238683073,,PRUNED
912,912,31.25,2025-05-25 17:28:17.018630,2025-05-25 17:28:36.613007,0 days 00:00:19.594377,Adadelta,0.17751839481429646,0.03671929090581313,,,,,,4,38.15607080036527,,,,PRUNED
913,913,33.333333333333336,2025-05-25 17:28:36.664888,2025-05-25 17:28:53.172705,0 days 00:00:16.507817,AdamW,0.18791502931570805,,,0.00016468164390677574,,,,2,,,0.0034500349409007625,,PRUNED
914,914,37.5,2025-05-25 17:28:53.228111,2025-05-25 17:29:12.830157,0 days 00:00:19.602046,AdamW,0.2654425402557638,,,8.316111422815581e-05,,,,1,,,0.0023933111992921756,,PRUNED
915,915,33.333333333333336,2025-05-25 17:29:12.884893,2025-05-25 17:29:32.664669,0 days 00:00:19.779776,AdamW,0.3064141701495433,,,0.00010195373319486213,,,,1,,,0.0004958747605831181,,PRUNED
916,916,33.333333333333336,2025-05-25 17:29:32.723695,2025-05-25 17:29:52.499449,0 days 00:00:19.775754,AdamW,0.22548701698986043,,,0.0002020400135858797,,,,5,,,0.0006277421269062643,,PRUNED
917,917,37.5,2025-05-25 17:29:52.553965,2025-05-25 17:30:12.268900,0 days 00:00:19.714935,AdamW,0.21432197825512203,,,0.00012415165874010624,,,,0,,,0.0004280110677990735,,PRUNED
918,918,35.416666666666664,2025-05-25 17:30:12.324489,2025-05-25 17:30:32.068444,0 days 00:00:19.743955,AdamW,0.24021103445751352,,,7.48219276112477e-05,,,,1,,,0.002229755772279112,,PRUNED
