,number,value,datetime_start,datetime_complete,duration,params_algorithm,params_dropout_rate,params_lr_Adadelta,params_lr_Adam,params_lr_AdamW,params_lr_SGD,params_momentum_SGD,params_nesterov_SGD,params_suggested_freeze,params_weight_decay_Adadelta,params_weight_decay_Adam,params_weight_decay_AdamW,params_weight_decay_SGD,state
0,0,43.75,2025-05-25 11:50:21.236003,2025-05-25 11:50:53.171497,0 days 00:00:31.935494,Adadelta,0.4753571532049581,0.017073967431528128,,,,,,3,29.154431891537552,,,,COMPLETE
1,1,60.416666666666664,2025-05-25 11:50:53.229242,2025-05-25 11:51:23.809802,0 days 00:00:30.580560,Adam,0.35403628889802274,,5.3370327626039544e-05,,,,,5,,0.05415244119402541,,,COMPLETE
2,2,77.08333333333333,2025-05-25 11:51:23.860714,2025-05-25 11:51:55.072548,0 days 00:00:31.211834,AdamW,0.2623782158161189,,,0.00014742753159914678,,,,2,,,0.0005404103854647331,,COMPLETE
3,3,33.333333333333336,2025-05-25 11:51:55.123727,2025-05-25 11:52:25.801360,0 days 00:00:30.677633,AdamW,0.3925879806965068,,,0.0026926469100861782,,,,4,,,0.00021930485556643703,,COMPLETE
4,4,33.333333333333336,2025-05-25 11:52:25.851743,2025-05-25 11:52:57.224471,0 days 00:00:31.372728,Adadelta,0.4744427686266666,5.456725485601478,,,,,,0,0.5762487216478605,,,,COMPLETE
5,5,56.25,2025-05-25 11:52:57.274714,2025-05-25 11:53:28.598116,0 days 00:00:31.323402,Adam,0.2475884550556351,,0.00017654048052495074,,,,,1,,1.2030178871154673,,,COMPLETE
6,6,33.333333333333336,2025-05-25 11:53:28.647814,2025-05-25 11:53:48.129512,0 days 00:00:19.481698,Adadelta,0.09242722776276352,2.463768595899747,,,,,,4,48.696409415209004,,,,PRUNED
7,7,33.333333333333336,2025-05-25 11:53:48.165222,2025-05-25 11:54:08.166936,0 days 00:00:20.001714,AdamW,0.0979914312095726,,,0.02065142557895925,,,,0,,,0.0005170191786366995,,PRUNED
8,8,33.333333333333336,2025-05-25 11:54:08.202289,2025-05-25 11:54:27.530881,0 days 00:00:19.328592,SGD,0.27134804157912423,,,,0.012273800987852962,0.5621564911890039,True,2,,,,0.06235377135673159,PRUNED
9,9,33.333333333333336,2025-05-25 11:54:27.565347,2025-05-25 11:54:46.378889,0 days 00:00:18.813542,SGD,0.38563517334297287,,,,0.0031130959561221226,6.365199445099503,False,6,,,,0.2106648601704221,PRUNED
10,10,33.333333333333336,2025-05-25 11:54:46.414364,2025-05-25 11:55:05.228224,0 days 00:00:18.813860,AdamW,0.0029985914779085965,,,1.1799062523159256e-05,,,,8,,,0.006630907782559361,,PRUNED
11,11,35.416666666666664,2025-05-25 11:55:05.262631,2025-05-25 11:55:24.199051,0 days 00:00:18.936420,Adam,0.2687772072034616,,1.4185357673699857e-05,,,,,6,,0.011200687440843897,,,PRUNED
12,12,33.333333333333336,2025-05-25 11:55:24.239975,2025-05-25 11:55:43.043813,0 days 00:00:18.803838,Adam,0.33917540003066937,,0.03717124466023609,,,,,6,,0.01867587984082639,,,PRUNED
13,13,33.333333333333336,2025-05-25 11:55:43.077465,2025-05-25 11:56:02.838802,0 days 00:00:19.761337,Adam,0.21355615281666585,,0.00026931176066398395,,,,,2,,37.639965874722925,,,PRUNED
14,14,62.5,2025-05-25 11:56:02.873342,2025-05-25 11:56:33.572860,0 days 00:00:30.699518,AdamW,0.17284687262413326,,,5.107684925222934e-05,,,,5,,,0.0025253710106474536,,COMPLETE
15,15,31.25,2025-05-25 11:56:33.623858,2025-05-25 11:56:52.379164,0 days 00:00:18.755306,AdamW,0.15569821977327744,,,4.839668264505077e-05,,,,8,,,0.0021601863672613586,,PRUNED
16,16,33.333333333333336,2025-05-25 11:56:52.419692,2025-05-25 11:57:11.861184,0 days 00:00:19.441492,AdamW,0.18118115308959054,,,0.00021004805863831112,,,,3,,,0.001427451819550663,,PRUNED
17,17,33.333333333333336,2025-05-25 11:57:11.894538,2025-05-25 11:57:31.329016,0 days 00:00:19.434478,AdamW,0.1170767905017081,,,0.00033538805175156836,,,,4,,,0.0038041435990486426,,PRUNED
18,18,62.5,2025-05-25 11:57:31.363788,2025-05-25 11:58:02.581589,0 days 00:00:31.217801,AdamW,0.01811884405994857,,,4.594361093453365e-05,,,,2,,,0.0006816831838566351,,COMPLETE
19,19,33.333333333333336,2025-05-25 11:58:02.633690,2025-05-25 11:58:21.370506,0 days 00:00:18.736816,AdamW,0.3125574388659874,,,0.002291327504585287,,,,7,,,0.00019945533231692083,,PRUNED
20,20,,2025-05-25 11:58:21.405619,2025-05-25 11:58:39.829113,0 days 00:00:18.423494,SGD,0.21116601120719558,,,,2.025934909325147e-05,88.37749112170019,True,5,,,,71.38393633927497,PRUNED
21,21,33.333333333333336,2025-05-25 11:58:39.871330,2025-05-25 11:58:59.656265,0 days 00:00:19.784935,AdamW,0.005458325413567833,,,5.05121279493647e-05,,,,2,,,0.0005991538986340598,,PRUNED
22,22,31.25,2025-05-25 11:58:59.691449,2025-05-25 11:59:19.550416,0 days 00:00:19.858967,AdamW,0.05344558317761529,,,5.991268816129703e-05,,,,1,,,0.0007846387178562482,,PRUNED
23,23,33.333333333333336,2025-05-25 11:59:19.584480,2025-05-25 11:59:39.217507,0 days 00:00:19.633027,AdamW,0.15199654592985787,,,1.3970734935405238e-05,,,,3,,,0.00043759706526999006,,PRUNED
24,24,33.333333333333336,2025-05-25 11:59:39.252142,2025-05-25 11:59:58.878148,0 days 00:00:19.626006,AdamW,0.04392782560380387,,,0.0002305273307888063,,,,1,,,0.0016155377070117766,,PRUNED
25,25,75.0,2025-05-25 11:59:58.912063,2025-05-25 12:00:29.662485,0 days 00:00:30.750422,AdamW,0.23669019901518049,,,8.193412907174033e-05,,,,5,,,0.0028111878934305727,,COMPLETE
26,26,33.333333333333336,2025-05-25 12:00:29.714269,2025-05-25 12:00:49.362901,0 days 00:00:19.648632,AdamW,0.22803800584202452,,,0.0008050608617937319,,,,5,,,0.0037314953246968216,,PRUNED
27,27,43.75,2025-05-25 12:00:49.397644,2025-05-25 12:01:16.316221,0 days 00:00:26.918577,AdamW,0.2779233138665978,,,0.00012213010345884555,,,,7,,,0.002864413454234535,,PRUNED
28,28,33.333333333333336,2025-05-25 12:01:16.357576,2025-05-25 12:01:35.846007,0 days 00:00:19.488431,Adadelta,0.18133801351664136,71.09750733359516,,,,,,4,0.016987592312017272,,,,PRUNED
29,29,,2025-05-25 12:01:35.891841,2025-05-25 12:01:54.251255,0 days 00:00:18.359414,SGD,0.29444056054312073,,,,1.4839113238339737e-05,95.86041307333699,False,5,,,,18.395730677410548,PRUNED
30,30,35.416666666666664,2025-05-25 12:01:54.294139,2025-05-25 12:02:13.316152,0 days 00:00:19.022013,Adadelta,0.44238672867298934,0.012327990271406086,,,,,,3,0.017620822291138413,,,,PRUNED
31,31,29.166666666666668,2025-05-25 12:02:13.362894,2025-05-25 12:02:33.024598,0 days 00:00:19.661704,AdamW,0.1483792317776419,,,3.371884970780157e-05,,,,3,,,0.000979482933922933,,PRUNED
32,32,70.83333333333333,2025-05-25 12:02:33.059643,2025-05-25 12:03:04.212509,0 days 00:00:31.152866,AdamW,0.3106452018417596,,,9.26406644214561e-05,,,,2,,,0.0003319648454390779,,COMPLETE
33,33,33.333333333333336,2025-05-25 12:03:04.265965,2025-05-25 12:03:26.268673,0 days 00:00:22.002708,AdamW,0.3250020665327686,,,0.00012459199853948416,,,,5,,,0.00010426501217035525,,PRUNED
34,34,33.333333333333336,2025-05-25 12:03:26.303042,2025-05-25 12:03:45.834513,0 days 00:00:19.531471,AdamW,0.3749478859083253,,,0.0005850752122197353,,,,4,,,0.0002901501600371516,,PRUNED
35,35,33.333333333333336,2025-05-25 12:03:45.870399,2025-05-25 12:04:05.511903,0 days 00:00:19.641504,AdamW,0.23346129014573355,,,0.00010747112425365595,,,,1,,,0.009260134460386106,,PRUNED
36,36,37.5,2025-05-25 12:04:05.545477,2025-05-25 12:04:25.240577,0 days 00:00:19.695100,AdamW,0.19574852676751642,,,1.9921685438118503e-05,,,,0,,,0.001376812563046459,,PRUNED
37,37,33.333333333333336,2025-05-25 12:04:25.276092,2025-05-25 12:04:44.842541,0 days 00:00:19.566449,Adadelta,0.4145942595193252,0.21514314769815227,,,,,,3,1.0922883910149894,,,,PRUNED
38,38,43.75,2025-05-25 12:04:44.888012,2025-05-25 12:05:05.477681,0 days 00:00:20.589669,AdamW,0.25104834876501236,,,0.0004346601367214029,,,,6,,,0.00035551158059977597,,PRUNED
39,39,33.333333333333336,2025-05-25 12:05:05.519705,2025-05-25 12:05:25.185721,0 days 00:00:19.666016,Adam,0.29843202639355965,,0.008365047330010568,,,,,5,,87.91674502346537,,,PRUNED
40,40,,2025-05-25 12:05:25.220520,2025-05-25 12:05:43.326034,0 days 00:00:18.105514,SGD,0.3435321582567897,,,,0.04553662854131712,47.79660930546636,False,4,,,,2.4943757639053636,PRUNED
41,41,33.333333333333336,2025-05-25 12:05:43.368637,2025-05-25 12:06:02.585827,0 days 00:00:19.217190,AdamW,0.4926038737851367,,,6.82691750761378e-05,,,,2,,,0.0007639216373313518,,PRUNED
42,42,25.0,2025-05-25 12:06:02.619893,2025-05-25 12:06:22.160544,0 days 00:00:19.540651,AdamW,0.3618848675574383,,,2.7382683167750777e-05,,,,2,,,0.000605524654531708,,PRUNED
43,43,70.83333333333333,2025-05-25 12:06:22.195715,2025-05-25 12:06:53.971036,0 days 00:00:31.775321,AdamW,0.24757069596583098,,,0.0001213334899407926,,,,1,,,0.0021826673855517087,,COMPLETE
44,44,33.333333333333336,2025-05-25 12:06:54.022293,2025-05-25 12:07:14.012404,0 days 00:00:19.990111,AdamW,0.25643955890955883,,,0.00014762222890638173,,,,0,,,0.002360686016486687,,PRUNED
45,45,33.333333333333336,2025-05-25 12:07:14.047016,2025-05-25 12:07:34.095249,0 days 00:00:20.048233,AdamW,0.29198708568066195,,,0.0017859440651664137,,,,1,,,0.004971291499876732,,PRUNED
46,46,68.75,2025-05-25 12:07:34.133368,2025-05-25 12:08:05.898468,0 days 00:00:31.765100,AdamW,0.1267288323635326,,,8.830377939688953e-05,,,,1,,,0.002952744890309621,,COMPLETE
47,47,33.333333333333336,2025-05-25 12:08:05.948957,2025-05-25 12:08:25.752103,0 days 00:00:19.803146,Adadelta,0.12498281154166724,98.43155468624178,,,,,,1,1.3611799129714945,,,,PRUNED
48,48,33.333333333333336,2025-05-25 12:08:25.786351,2025-05-25 12:08:45.474126,0 days 00:00:19.687775,Adam,0.07297442850633454,,0.0015235798237262308,,,,,0,,2.3260636558383525,,,PRUNED
49,49,33.333333333333336,2025-05-25 12:08:45.508898,2025-05-25 12:09:05.140258,0 days 00:00:19.631360,AdamW,0.23746431224641396,,,0.00027565197366236885,,,,1,,,0.0016620908004937494,,PRUNED
50,50,33.333333333333336,2025-05-25 12:09:05.174435,2025-05-25 12:09:24.799908,0 days 00:00:19.625473,AdamW,0.3261146263845212,,,0.011726370286662423,,,,2,,,0.0001597559232984908,,PRUNED
51,51,72.91666666666667,2025-05-25 12:09:24.833522,2025-05-25 12:09:56.345852,0 days 00:00:31.512330,AdamW,0.1750833131294243,,,8.0889478943382e-05,,,,0,,,0.0031133264216027592,,COMPLETE
52,52,35.416666666666664,2025-05-25 12:09:56.396891,2025-05-25 12:10:16.209861,0 days 00:00:19.812970,AdamW,0.19776534200231113,,,8.742362139607555e-05,,,,0,,,0.004109950414746521,,PRUNED
53,53,33.333333333333336,2025-05-25 12:10:16.244071,2025-05-25 12:10:35.972624,0 days 00:00:19.728553,AdamW,0.11965398632830489,,,0.00017002339934964205,,,,0,,,0.0030928865805080123,,PRUNED
54,54,50.0,2025-05-25 12:10:36.007414,2025-05-25 12:11:00.482604,0 days 00:00:24.475190,AdamW,0.27363475354507655,,,8.827449627341799e-05,,,,1,,,0.006280913800669198,,PRUNED
55,55,,2025-05-25 12:11:00.517335,2025-05-25 12:11:18.813972,0 days 00:00:18.296637,SGD,0.2068285919097559,,,,0.00033574947289722354,45.2163249362127,True,0,,,,0.012586730209395615,PRUNED
56,56,54.166666666666664,2025-05-25 12:11:18.857120,2025-05-25 12:11:50.543384,0 days 00:00:31.686264,AdamW,0.09803580298352874,,,2.8625423836948964e-05,,,,1,,,0.00027991758729645205,,PRUNED
57,57,33.333333333333336,2025-05-25 12:11:50.578426,2025-05-25 12:12:10.529162,0 days 00:00:19.950736,Adam,0.1477101278231422,,0.08360603301436347,,,,,2,,0.16558942952015726,,,PRUNED
58,58,33.333333333333336,2025-05-25 12:12:10.566626,2025-05-25 12:12:30.204683,0 days 00:00:19.638057,AdamW,0.17025700945900973,,,0.0001784617040585983,,,,1,,,0.002231676720615575,,PRUNED
59,59,33.333333333333336,2025-05-25 12:12:30.239737,2025-05-25 12:12:49.843051,0 days 00:00:19.603314,AdamW,0.22431509434134325,,,0.0866438695660128,,,,2,,,0.0010877158507897223,,PRUNED
60,60,33.333333333333336,2025-05-25 12:12:49.878231,2025-05-25 12:13:09.538873,0 days 00:00:19.660642,AdamW,0.2704368989563073,,,0.0004207458494218077,,,,0,,,0.0019627920483623533,,PRUNED
61,61,39.583333333333336,2025-05-25 12:13:09.575145,2025-05-25 12:13:28.471756,0 days 00:00:18.896611,AdamW,0.1672067440050428,,,6.842393517117068e-05,,,,6,,,0.0026875934085434368,,PRUNED
62,62,35.416666666666664,2025-05-25 12:13:28.511841,2025-05-25 12:13:48.088125,0 days 00:00:19.576284,AdamW,0.13676731584998514,,,4.379243757574461e-05,,,,5,,,0.003409819425973793,,PRUNED
63,63,35.416666666666664,2025-05-25 12:13:48.122030,2025-05-25 12:14:07.799525,0 days 00:00:19.677495,AdamW,0.255772240049401,,,1.9893480266406906e-05,,,,1,,,0.004757934872164586,,PRUNED
64,64,52.083333333333336,2025-05-25 12:14:07.834921,2025-05-25 12:14:32.056380,0 days 00:00:24.221459,AdamW,0.1784355658672316,,,8.547470506398291e-05,,,,3,,,0.0004188841251707584,,PRUNED
65,65,68.75,2025-05-25 12:14:32.091366,2025-05-25 12:15:02.690157,0 days 00:00:30.598791,AdamW,0.09672722040910112,,,5.034225650090624e-05,,,,5,,,0.0019686774986163087,,COMPLETE
66,66,39.583333333333336,2025-05-25 12:15:02.741766,2025-05-25 12:15:23.178353,0 days 00:00:20.436587,AdamW,0.09154738534528883,,,4.0332235355429454e-05,,,,6,,,0.0017954025497305215,,PRUNED
67,67,,2025-05-25 12:15:23.218658,2025-05-25 12:15:42.443948,0 days 00:00:19.225290,SGD,0.045209412021133086,,,,0.0005166105489683339,24.837288159781853,False,4,,,,3.3555143899358795,PRUNED
68,68,33.333333333333336,2025-05-25 12:15:42.488903,2025-05-25 12:16:01.980507,0 days 00:00:19.491604,Adadelta,0.1088435881640018,0.23171167184435645,,,,,,2,0.1367324250220455,,,,PRUNED
69,69,41.666666666666664,2025-05-25 12:16:02.025430,2025-05-25 12:16:23.953932,0 days 00:00:21.928502,AdamW,0.28785466146394734,,,1.0270619744078713e-05,,,,5,,,0.0011154695091205441,,PRUNED
70,70,81.25,2025-05-25 12:16:23.988491,2025-05-25 12:16:55.692707,0 days 00:00:31.704216,AdamW,0.1949558424430406,,,0.0002966011379987292,,,,1,,,0.002471950103593902,,COMPLETE
71,71,33.333333333333336,2025-05-25 12:16:55.760439,2025-05-25 12:17:16.033072,0 days 00:00:20.272633,AdamW,0.21884621597240567,,,0.00023393931793991044,,,,1,,,0.002617472354183524,,PRUNED
72,72,27.083333333333332,2025-05-25 12:17:16.068079,2025-05-25 12:17:35.832572,0 days 00:00:19.764493,AdamW,0.3107494504129922,,,0.00012853144720601325,,,,1,,,0.0021143606863815736,,PRUNED
73,73,31.25,2025-05-25 12:17:35.869590,2025-05-25 12:17:54.944854,0 days 00:00:19.075264,AdamW,0.1931829302596283,,,6.081926416503274e-05,,,,7,,,0.0013982004612441655,,PRUNED
74,74,64.58333333333333,2025-05-25 12:17:54.980513,2025-05-25 12:18:26.418292,0 days 00:00:31.437779,AdamW,0.1588362666067253,,,0.00033020361644607615,,,,3,,,0.0030498502157571125,,COMPLETE
75,75,33.333333333333336,2025-05-25 12:18:26.470614,2025-05-25 12:18:46.357349,0 days 00:00:19.886735,AdamW,0.23859253826370364,,,0.000167182148592751,,,,0,,,0.0034338762205137234,,PRUNED
76,76,33.333333333333336,2025-05-25 12:18:46.392996,2025-05-25 12:19:06.169241,0 days 00:00:19.776245,AdamW,0.0853136851563038,,,9.178976397363542e-05,,,,1,,,0.004427373714290258,,PRUNED
77,77,33.333333333333336,2025-05-25 12:19:06.203437,2025-05-25 12:19:25.879720,0 days 00:00:19.676283,Adam,0.06295339030475113,,0.0026967970033281645,,,,,2,,6.246000718224719,,,PRUNED
78,78,35.416666666666664,2025-05-25 12:19:25.916138,2025-05-25 12:19:45.428238,0 days 00:00:19.512100,AdamW,0.13200388512168038,,,5.920617835711601e-05,,,,4,,,0.0004891680720644111,,PRUNED
79,79,41.666666666666664,2025-05-25 12:19:45.464000,2025-05-25 12:20:05.115589,0 days 00:00:19.651589,AdamW,0.2583791227807435,,,0.00022689744935243202,,,,0,,,0.0025372131340662195,,PRUNED
80,80,33.333333333333336,2025-05-25 12:20:05.150390,2025-05-25 12:20:25.048533,0 days 00:00:19.898143,Adadelta,0.20753778439642573,12.096072085336496,,,,,,2,8.455573569444077,,,,PRUNED
81,81,33.333333333333336,2025-05-25 12:20:25.084222,2025-05-25 12:20:44.758719,0 days 00:00:19.674497,AdamW,0.15899050205203658,,,0.00036717277378218343,,,,3,,,0.0029537485550269155,,PRUNED
82,82,33.333333333333336,2025-05-25 12:20:44.793495,2025-05-25 12:21:04.456578,0 days 00:00:19.663083,AdamW,0.18464768391070524,,,0.0007416022077649177,,,,3,,,0.003376447377661801,,PRUNED
83,83,33.333333333333336,2025-05-25 12:21:04.494255,2025-05-25 12:21:24.191509,0 days 00:00:19.697254,AdamW,0.13945856843817334,,,0.00031033734788999946,,,,2,,,0.0020300061001586834,,PRUNED
84,84,33.333333333333336,2025-05-25 12:21:24.226370,2025-05-25 12:21:43.694316,0 days 00:00:19.467946,AdamW,0.11110411290938627,,,0.0011753525028531345,,,,3,,,0.004056214230319665,,PRUNED
85,85,33.333333333333336,2025-05-25 12:21:43.728378,2025-05-25 12:22:03.191147,0 days 00:00:19.462769,AdamW,0.24366826388857327,,,0.00011461853453087443,,,,4,,,0.006031341443205719,,PRUNED
86,86,43.75,2025-05-25 12:22:03.225529,2025-05-25 12:22:25.259206,0 days 00:00:22.033677,AdamW,0.16519928386135949,,,0.00014162389961930937,,,,2,,,0.0027916596264071897,,PRUNED
87,87,,2025-05-25 12:22:25.293950,2025-05-25 12:22:43.571525,0 days 00:00:18.277575,SGD,0.21717395495687594,,,,9.825921541597883e-05,71.91471893329434,True,1,,,,0.21320605984942156,PRUNED
88,88,33.333333333333336,2025-05-25 12:22:43.616105,2025-05-25 12:23:03.501892,0 days 00:00:19.885787,AdamW,0.3062514671691412,,,3.7898905751628385e-05,,,,2,,,0.0015635589709499537,,PRUNED
89,89,81.25,2025-05-25 12:23:03.537361,2025-05-25 12:23:35.471451,0 days 00:00:31.934090,AdamW,0.28534011356908584,,,7.976684074853224e-05,,,,1,,,0.002412362681270577,,COMPLETE
90,90,33.333333333333336,2025-05-25 12:23:35.523992,2025-05-25 12:23:55.299509,0 days 00:00:19.775517,AdamW,0.3245163596718602,,,7.544906820982256e-05,,,,1,,,0.0002164770308317848,,PRUNED
91,91,37.5,2025-05-25 12:23:55.334334,2025-05-25 12:24:15.377429,0 days 00:00:20.043095,AdamW,0.27866587284315364,,,5.092234215769957e-05,,,,1,,,0.0023063830089234474,,PRUNED
92,92,33.333333333333336,2025-05-25 12:24:15.425076,2025-05-25 12:24:34.898118,0 days 00:00:19.473042,AdamW,0.28283915030219975,,,0.0005491693007044072,,,,5,,,0.0018511305248247133,,PRUNED
93,93,77.08333333333333,2025-05-25 12:24:34.933272,2025-05-25 12:25:06.732944,0 days 00:00:31.799672,AdamW,0.23167484634051705,,,0.00011176607238087763,,,,1,,,0.0032069755097429834,,COMPLETE
94,94,33.333333333333336,2025-05-25 12:25:06.827644,2025-05-25 12:25:26.558156,0 days 00:00:19.730512,AdamW,0.2259310184581434,,,0.00010962092549980541,,,,1,,,0.0003351404814950385,,PRUNED
95,95,33.333333333333336,2025-05-25 12:25:26.593389,2025-05-25 12:25:46.419631,0 days 00:00:19.826242,Adam,0.260897431670815,,0.011588391952708449,,,,,0,,9.979950610879278,,,PRUNED
96,96,33.333333333333336,2025-05-25 12:25:46.457380,2025-05-25 12:26:06.170247,0 days 00:00:19.712867,AdamW,0.194438683675414,,,0.00019038365013303781,,,,1,,,0.005132002961535009,,PRUNED
97,97,64.58333333333333,2025-05-25 12:26:06.205125,2025-05-25 12:26:35.467547,0 days 00:00:29.262422,AdamW,0.24132074743608875,,,2.3919755152691808e-05,,,,0,,,0.0038264014438610912,,PRUNED
98,98,33.333333333333336,2025-05-25 12:26:35.505692,2025-05-25 12:26:55.237790,0 days 00:00:19.732098,AdamW,0.34339220782341373,,,0.00010536319374127739,,,,1,,,0.0009212293547883279,,PRUNED
99,99,58.333333333333336,2025-05-25 12:26:55.273576,2025-05-25 12:27:19.325476,0 days 00:00:24.051900,AdamW,0.2648636086220464,,,7.262839840171765e-05,,,,0,,,0.0024455210792426437,,PRUNED
100,100,33.333333333333336,2025-05-25 12:27:19.359145,2025-05-25 12:27:31.303947,0 days 00:00:11.944802,Adadelta,0.29616459669661005,0.2270902997806887,,,,,,1,0.10268092529040569,,,,PRUNED
101,101,33.333333333333336,2025-05-25 12:27:31.338491,2025-05-25 12:27:50.877475,0 days 00:00:19.538984,AdamW,0.2301533293477944,,,0.00025651243072065324,,,,2,,,0.0030950234653312463,,PRUNED
102,102,39.583333333333336,2025-05-25 12:27:50.912111,2025-05-25 12:28:10.869278,0 days 00:00:19.957167,AdamW,0.14892490352538593,,,0.00016191706179851645,,,,4,,,0.0031545692364661005,,PRUNED
103,103,35.416666666666664,2025-05-25 12:28:10.904644,2025-05-25 12:28:30.881225,0 days 00:00:19.976581,AdamW,0.20265594307889417,,,5.6856086049349374e-05,,,,1,,,0.003669870929687778,,PRUNED
104,104,33.333333333333336,2025-05-25 12:28:30.931465,2025-05-25 12:28:50.478758,0 days 00:00:19.547293,AdamW,0.18113991467107382,,,0.004141848112633102,,,,5,,,0.002188709971961477,,PRUNED
105,105,35.416666666666664,2025-05-25 12:28:50.514526,2025-05-25 12:29:10.087923,0 days 00:00:19.573397,AdamW,0.1042965242524524,,,9.450064839165411e-05,,,,2,,,0.0027919634889846017,,PRUNED
106,106,33.333333333333336,2025-05-25 12:29:10.123213,2025-05-25 12:29:29.964330,0 days 00:00:19.841117,AdamW,0.18813730273831902,,,0.0001335149697814412,,,,1,,,0.00015102021535036767,,PRUNED
107,107,,2025-05-25 12:29:29.999945,2025-05-25 12:29:47.900207,0 days 00:00:17.900262,SGD,0.12895928367544818,,,,0.09797502650996648,72.50289903128427,False,6,,,,0.0141879715122381,PRUNED
108,108,33.333333333333336,2025-05-25 12:29:47.940936,2025-05-25 12:30:07.473356,0 days 00:00:19.532420,AdamW,0.2448826169238359,,,3.522834165377264e-05,,,,3,,,0.0016649307427630338,,PRUNED
109,109,37.5,2025-05-25 12:30:07.509591,2025-05-25 12:30:27.239963,0 days 00:00:19.730372,AdamW,0.21364282633041481,,,8.169805840885546e-05,,,,1,,,0.0006496299242259709,,PRUNED
110,110,66.66666666666667,2025-05-25 12:30:27.276131,2025-05-25 12:30:58.615645,0 days 00:00:31.339514,AdamW,0.08170636750341775,,,0.00019501984003699797,,,,2,,,0.00026364958512616114,,COMPLETE
111,111,37.5,2025-05-25 12:30:58.668698,2025-05-25 12:31:18.310069,0 days 00:00:19.641371,AdamW,0.07268841169690426,,,0.00020589186802795603,,,,2,,,0.00026462056282314765,,PRUNED
112,112,33.333333333333336,2025-05-25 12:31:18.345517,2025-05-25 12:31:38.198567,0 days 00:00:19.853050,AdamW,0.0888241672303857,,,0.00030746998187394255,,,,2,,,0.00024588192081638764,,PRUNED
113,113,62.5,2025-05-25 12:31:38.234923,2025-05-25 12:32:07.327554,0 days 00:00:29.092631,AdamW,0.0358520094075276,,,4.705634712003143e-05,,,,2,,,0.00033033918729266697,,PRUNED
