,number,value,datetime_start,datetime_complete,duration,params_algorithm,params_dropout_rate,params_lr_Adadelta,params_lr_Adam,params_lr_AdamW,params_lr_SGD,params_momentum_SGD,params_nesterov_SGD,params_suggested_freeze,params_weight_decay_Adadelta,params_weight_decay_Adam,params_weight_decay_AdamW,params_weight_decay_SGD,state
1146,1146,33.333333333333336,2025-05-25 18:45:23.681011,2025-05-25 18:45:43.281569,0 days 00:00:19.600558,AdamW,0.0108027688480965,,,0.00019573389196846045,,,,3,,,0.003054918941395351,,PRUNED
1147,1147,,2025-05-25 18:45:43.338412,2025-05-25 18:46:01.739112,0 days 00:00:18.400700,SGD,0.25199258126929824,,,,0.0003578273476486441,46.685808102158326,False,2,,,,2.7056496434860113,PRUNED
1148,1148,50.0,2025-05-25 18:46:01.794485,2025-05-25 18:46:21.599884,0 days 00:00:19.805399,AdamW,0.234899520596858,,,8.965382283483643e-05,,,,1,,,0.0020550728791431435,,PRUNED
1149,1149,33.333333333333336,2025-05-25 18:46:21.657920,2025-05-25 18:46:41.671364,0 days 00:00:20.013444,AdamW,0.2937697957935972,,,0.00013129110820192286,,,,0,,,0.0006662111297145865,,PRUNED
1150,1150,37.5,2025-05-25 18:46:41.729061,2025-05-25 18:47:01.428964,0 days 00:00:19.699903,AdamW,0.18955184543395695,,,0.0001722089219426743,,,,2,,,0.003969201904740711,,PRUNED
1151,1151,35.416666666666664,2025-05-25 18:47:01.485209,2025-05-25 18:47:21.113233,0 days 00:00:19.628024,AdamW,0.16879513183009573,,,0.00010470540761820394,,,,3,,,0.0004966947333877764,,PRUNED
1152,1152,43.75,2025-05-25 18:47:21.170102,2025-05-25 18:47:40.743939,0 days 00:00:19.573837,AdamW,0.3576761073388,,,8.045111884587247e-05,,,,1,,,0.002272358781063102,,PRUNED
1153,1153,33.333333333333336,2025-05-25 18:47:40.801069,2025-05-25 18:48:00.849158,0 days 00:00:20.048089,AdamW,0.15420901471926993,,,0.00015357624092273485,,,,1,,,0.00027860942422702973,,PRUNED
1154,1154,33.333333333333336,2025-05-25 18:48:00.906982,2025-05-25 18:48:20.659558,0 days 00:00:19.752576,Adam,0.336640730487037,,0.0017107841267440947,,,,,0,,0.0315893322998206,,,PRUNED
1155,1155,66.66666666666667,2025-05-25 18:48:20.716276,2025-05-25 18:48:45.009553,0 days 00:00:24.293277,AdamW,0.21043454034710285,,,0.00012151759412774858,,,,2,,,0.001712783355861544,,PRUNED
1156,1156,33.333333333333336,2025-05-25 18:48:45.070019,2025-05-25 18:49:04.870954,0 days 00:00:19.800935,AdamW,0.43510911104835304,,,0.0020829363618904075,,,,1,,,0.0028092523680528277,,PRUNED
1157,1157,33.333333333333336,2025-05-25 18:49:04.930011,2025-05-25 18:49:24.562816,0 days 00:00:19.632805,Adadelta,0.2400030091739328,1.6483060987040745,,,,,,2,0.06473118115476087,,,,PRUNED
1158,1158,41.666666666666664,2025-05-25 18:49:24.618435,2025-05-25 18:49:44.583861,0 days 00:00:19.965426,AdamW,0.1771463441203971,,,6.206419690476877e-05,,,,3,,,0.0018947011320421337,,PRUNED
1159,1159,33.333333333333336,2025-05-25 18:49:44.639677,2025-05-25 18:50:04.908832,0 days 00:00:20.269155,AdamW,0.22107625568980974,,,0.00030260100354698936,,,,1,,,0.000599679630876916,,PRUNED
1160,1160,33.333333333333336,2025-05-25 18:50:04.966627,2025-05-25 18:50:21.824893,0 days 00:00:16.858266,AdamW,0.2623665181223594,,,0.00022464225234050574,,,,0,,,0.0034143835280723823,,PRUNED
1161,1161,33.333333333333336,2025-05-25 18:50:21.882899,2025-05-25 18:50:41.259269,0 days 00:00:19.376370,AdamW,0.06501650190891292,,,9.972340799912008e-05,,,,2,,,0.002485762132465136,,PRUNED
1162,1162,81.25,2025-05-25 18:50:41.318094,2025-05-25 18:50:57.769514,0 days 00:00:16.451420,AdamW,0.20216465779899345,,,0.00017186090565120434,,,,1,,,0.0003834004250071062,,COMPLETE
1163,1163,33.333333333333336,2025-05-25 18:50:57.814374,2025-05-25 18:51:07.845907,0 days 00:00:10.031533,AdamW,0.20749784424707168,,,0.00024929240221312405,,,,1,,,0.00036999852858559805,,PRUNED
1164,1164,33.333333333333336,2025-05-25 18:51:07.883607,2025-05-25 18:51:15.347667,0 days 00:00:07.464060,AdamW,0.22637374784990974,,,0.0002138036784817079,,,,1,,,0.00036088190530156864,,PRUNED
1165,1165,33.333333333333336,2025-05-25 18:51:15.385404,2025-05-25 18:51:22.607506,0 days 00:00:07.222102,AdamW,0.2118566580065671,,,0.00017273200616666742,,,,1,,,0.0003732572859509992,,PRUNED
1166,1166,33.333333333333336,2025-05-25 18:51:22.648694,2025-05-25 18:51:30.046395,0 days 00:00:07.397701,AdamW,0.22073508161085412,,,0.0001999193532666663,,,,1,,,0.000403155801035487,,PRUNED
1167,1167,33.333333333333336,2025-05-25 18:51:30.091192,2025-05-25 18:51:37.640753,0 days 00:00:07.549561,AdamW,0.2061065361407049,,,0.00024989019387602104,,,,1,,,0.00032057307340012826,,PRUNED
1168,1168,33.333333333333336,2025-05-25 18:51:37.677367,2025-05-25 18:51:45.765009,0 days 00:00:08.087642,AdamW,0.24712921559854795,,,0.0001747850601600592,,,,1,,,0.0003255274612251203,,PRUNED
1169,1169,33.333333333333336,2025-05-25 18:51:45.814593,2025-05-25 18:52:00.511568,0 days 00:00:14.696975,AdamW,0.23251937972074943,,,0.00030225908959370255,,,,1,,,0.00040119762118246257,,PRUNED
1170,1170,43.75,2025-05-25 18:52:00.795493,2025-05-25 18:52:20.545548,0 days 00:00:19.750055,AdamW,0.2007484490836835,,,0.0001951827245382612,,,,1,,,0.00042088085775405436,,PRUNED
1171,1171,33.333333333333336,2025-05-25 18:52:20.603069,2025-05-25 18:52:34.192956,0 days 00:00:13.589887,AdamW,0.2181267363460215,,,0.00015610503376659084,,,,1,,,0.00037944429738699886,,PRUNED
1172,1172,,2025-05-25 18:52:34.227761,2025-05-25 18:52:39.306414,0 days 00:00:05.078653,SGD,0.27724209218426576,,,,0.0009054766608495547,22.448219792183394,True,1,,,,30.756216647903152,PRUNED
1173,1173,37.5,2025-05-25 18:52:39.340575,2025-05-25 18:52:45.173286,0 days 00:00:05.832711,AdamW,0.25317100346057164,,,0.00014601894981865074,,,,1,,,0.000348492146518205,,PRUNED
1174,1174,37.5,2025-05-25 18:52:45.208126,2025-05-25 18:52:51.061471,0 days 00:00:05.853345,AdamW,0.2379552096300656,,,0.0003757404315991159,,,,1,,,0.000441202059302221,,PRUNED
1175,1175,33.333333333333336,2025-05-25 18:52:51.096916,2025-05-25 18:52:56.933285,0 days 00:00:05.836369,AdamW,0.41243566990189967,,,0.00023828314400939644,,,,1,,,0.00029819048780123993,,PRUNED
1176,1176,37.5,2025-05-25 18:52:56.968155,2025-05-25 18:53:02.809904,0 days 00:00:05.841749,AdamW,0.22813561265532978,,,0.00019062934844553064,,,,1,,,0.0004508405409921402,,PRUNED
1177,1177,33.333333333333336,2025-05-25 18:53:02.846106,2025-05-25 18:53:08.648190,0 days 00:00:05.802084,Adam,0.20389054216735136,,0.01753561341384394,,,,,1,,0.11788457231047167,,,PRUNED
1178,1178,35.416666666666664,2025-05-25 18:53:08.683583,2025-05-25 18:53:14.543274,0 days 00:00:05.859691,AdamW,0.21486353228008012,,,0.0001330840460198577,,,,1,,,0.00033430583752563334,,PRUNED
1179,1179,33.333333333333336,2025-05-25 18:53:14.578096,2025-05-25 18:53:20.608845,0 days 00:00:06.030749,AdamW,0.2606088016148244,,,0.00016092065565621758,,,,1,,,0.0004023753701199251,,PRUNED
1180,1180,37.5,2025-05-25 18:53:20.644246,2025-05-25 18:53:26.459598,0 days 00:00:05.815352,AdamW,0.24501421634241113,,,0.00026820253957720967,,,,1,,,0.0004898478889846836,,PRUNED
1181,1181,33.333333333333336,2025-05-25 18:53:26.494644,2025-05-25 18:53:32.321555,0 days 00:00:05.826911,Adadelta,0.4529296113118039,6.3786412252826565,,,,,,0,0.026601272400473868,,,,PRUNED
1182,1182,45.833333333333336,2025-05-25 18:53:32.356738,2025-05-25 18:53:38.219460,0 days 00:00:05.862722,AdamW,0.1445025108583168,,,1.3474582839900119e-05,,,,1,,,0.0003825637291969014,,PRUNED
1183,1183,33.333333333333336,2025-05-25 18:53:38.255932,2025-05-25 18:53:44.089669,0 days 00:00:05.833737,AdamW,0.3199413204635924,,,7.591963244360811e-05,,,,1,,,0.0004370167429362571,,PRUNED
1184,1184,45.833333333333336,2025-05-25 18:53:44.124821,2025-05-25 18:53:50.002686,0 days 00:00:05.877865,AdamW,0.053716458834261765,,,0.00021047577364215696,,,,0,,,0.0005226908175876535,,PRUNED
1185,1185,50.0,2025-05-25 18:53:50.038401,2025-05-25 18:53:55.988217,0 days 00:00:05.949816,AdamW,0.19619686138003142,,,0.00014107186473995926,,,,1,,,0.00034219249704222504,,PRUNED
1186,1186,37.5,2025-05-25 18:53:56.024099,2025-05-25 18:54:01.852783,0 days 00:00:05.828684,AdamW,0.4237399709905244,,,0.00011031712042025249,,,,2,,,0.00046812941466578653,,PRUNED
1187,1187,33.333333333333336,2025-05-25 18:54:01.892154,2025-05-25 18:54:07.349075,0 days 00:00:05.456921,AdamW,0.22370173689589115,,,5.595178457285335e-05,,,,6,,,0.0004086626143355157,,PRUNED
1188,1188,41.666666666666664,2025-05-25 18:54:07.381747,2025-05-25 18:54:13.277882,0 days 00:00:05.896135,AdamW,0.2710056457457152,,,8.801495148673718e-05,,,,0,,,0.0005566633995105032,,PRUNED
1189,1189,33.333333333333336,2025-05-25 18:54:13.313352,2025-05-25 18:54:19.370978,0 days 00:00:06.057626,AdamW,0.2113776370265732,,,0.00018210780034806152,,,,1,,,0.003227741778353692,,PRUNED
1190,1190,35.416666666666664,2025-05-25 18:54:19.406655,2025-05-25 18:54:25.238617,0 days 00:00:05.831962,AdamW,0.23739649677698302,,,6.93463504527035e-05,,,,1,,,0.00046635331393620545,,PRUNED
1191,1191,33.333333333333336,2025-05-25 18:54:25.306780,2025-05-25 18:54:31.102223,0 days 00:00:05.795443,AdamW,0.1517942413441485,,,0.0001350923368042647,,,,2,,,0.000356475814024187,,PRUNED
1192,1192,31.25,2025-05-25 18:54:31.137231,2025-05-25 18:54:36.967736,0 days 00:00:05.830505,AdamW,0.3454013221797334,,,0.00016537773009238783,,,,0,,,0.00300470245008311,,PRUNED
1193,1193,33.333333333333336,2025-05-25 18:54:37.003698,2025-05-25 18:54:42.817963,0 days 00:00:05.814265,AdamW,0.2969755378499979,,,0.0005059346054428502,,,,1,,,0.000385686204991878,,PRUNED
1194,1194,41.666666666666664,2025-05-25 18:54:42.853633,2025-05-25 18:54:48.644963,0 days 00:00:05.791330,AdamW,0.19322690284377556,,,0.00010166321500290923,,,,2,,,0.004271994240599349,,PRUNED
1195,1195,33.333333333333336,2025-05-25 18:54:48.679860,2025-05-25 18:54:54.900196,0 days 00:00:06.220336,AdamW,0.2835471442031628,,,0.00012094635219681233,,,,1,,,0.0005259267982483807,,PRUNED
1196,1196,,2025-05-25 18:54:54.944750,2025-05-25 18:55:03.881187,0 days 00:00:08.936437,SGD,0.25402496229339555,,,,0.008823274599436963,12.784017731573144,False,2,,,,0.026902652139320866,PRUNED
1197,1197,33.333333333333336,2025-05-25 18:55:03.933012,2025-05-25 18:55:11.994046,0 days 00:00:08.061034,AdamW,0.1629370730034317,,,0.0002789127468772689,,,,0,,,0.00028896728524817545,,PRUNED
1198,1198,50.0,2025-05-25 18:55:12.045866,2025-05-25 18:55:20.131447,0 days 00:00:08.085581,AdamW,0.2053764970199637,,,8.485008169054699e-05,,,,1,,,0.003508514885468094,,PRUNED
1199,1199,37.5,2025-05-25 18:55:20.169811,2025-05-25 18:55:27.358218,0 days 00:00:07.188407,AdamW,0.18296752483702983,,,0.0002087923411252403,,,,2,,,0.0027094144859220177,,PRUNED
1200,1200,33.333333333333336,2025-05-25 18:55:27.397163,2025-05-25 18:55:34.594513,0 days 00:00:07.197350,AdamW,0.3851714722054731,,,0.0001503433779620106,,,,0,,,0.0004447725699575964,,PRUNED
1201,1201,33.333333333333336,2025-05-25 18:55:34.632000,2025-05-25 18:55:41.743343,0 days 00:00:07.111343,AdamW,0.22974888544824237,,,0.09839584267823795,,,,1,,,0.0029016354949993727,,PRUNED
1202,1202,33.333333333333336,2025-05-25 18:55:41.790922,2025-05-25 18:55:49.096513,0 days 00:00:07.305591,Adam,0.4438581303615847,,0.05348827070932387,,,,,1,,0.5237271755502353,,,PRUNED
1203,1203,33.333333333333336,2025-05-25 18:55:49.133461,2025-05-25 18:55:59.108099,0 days 00:00:09.974638,AdamW,0.22151939137601676,,,0.00010332491799098953,,,,2,,,0.003657279567936121,,PRUNED
1204,1204,47.916666666666664,2025-05-25 18:55:59.158991,2025-05-25 18:56:12.698598,0 days 00:00:13.539607,AdamW,0.20125829248290295,,,7.192549440257823e-05,,,,2,,,0.00042931601429914244,,PRUNED
1205,1205,31.25,2025-05-25 18:56:12.747255,2025-05-25 18:56:26.268635,0 days 00:00:13.521380,Adadelta,0.24231586210340894,0.010203135079454924,,,,,,0,0.3445103473184528,,,,PRUNED
1206,1206,33.333333333333336,2025-05-25 18:56:26.317774,2025-05-25 18:56:39.702423,0 days 00:00:13.384649,AdamW,0.26432672874849233,,,0.00012400861037325495,,,,1,,,0.0006228953127465684,,PRUNED
1207,1207,33.333333333333336,2025-05-25 18:56:39.751787,2025-05-25 18:56:53.031635,0 days 00:00:13.279848,AdamW,0.19059815218251736,,,0.0003325070314051149,,,,1,,,0.0005057235769756435,,PRUNED
1208,1208,33.333333333333336,2025-05-25 18:56:53.083533,2025-05-25 18:57:06.478564,0 days 00:00:13.395031,AdamW,0.16960630018409045,,,0.0001484730584910867,,,,0,,,0.0025574973756940594,,PRUNED
1209,1209,39.583333333333336,2025-05-25 18:57:06.530388,2025-05-25 18:57:19.851704,0 days 00:00:13.321316,AdamW,0.21657661025527686,,,9.22530999113134e-05,,,,2,,,0.0003564674526337207,,PRUNED
1210,1210,33.333333333333336,2025-05-25 18:57:19.901929,2025-05-25 18:57:33.972706,0 days 00:00:14.070777,AdamW,0.2482627160728639,,,0.00043185589788607704,,,,1,,,0.0005441801568296731,,PRUNED
1211,1211,33.333333333333336,2025-05-25 18:57:34.029497,2025-05-25 18:57:46.633974,0 days 00:00:12.604477,AdamW,0.174317374011306,,,0.00023669809284250588,,,,1,,,0.00031919832569008566,,PRUNED
1212,1212,33.333333333333336,2025-05-25 18:57:46.684211,2025-05-25 18:57:55.935871,0 days 00:00:09.251660,AdamW,0.22828590108575197,,,0.00018660820041492337,,,,4,,,0.0032238545335710684,,PRUNED
1213,1213,35.416666666666664,2025-05-25 18:57:55.970204,2025-05-25 18:58:01.830996,0 days 00:00:05.860792,AdamW,0.15601741609689262,,,0.00011671934655376358,,,,1,,,0.0004796942399452239,,PRUNED
1214,1214,54.166666666666664,2025-05-25 18:58:01.867134,2025-05-25 18:58:08.940197,0 days 00:00:07.073063,AdamW,0.3064093126847524,,,5.1999633647484724e-05,,,,2,,,0.0003923942679890152,,PRUNED
1215,1215,33.333333333333336,2025-05-25 18:58:08.975169,2025-05-25 18:58:14.793511,0 days 00:00:05.818342,AdamW,0.403107607615678,,,8.229575150639852e-05,,,,0,,,0.0009028948491927472,,PRUNED
1216,1216,33.333333333333336,2025-05-25 18:58:14.828427,2025-05-25 18:58:20.693340,0 days 00:00:05.864913,AdamW,0.33176041272106144,,,0.0001676657790674451,,,,2,,,0.0027216728521301517,,PRUNED
1217,1217,33.333333333333336,2025-05-25 18:58:20.728963,2025-05-25 18:58:26.550917,0 days 00:00:05.821954,AdamW,0.19953447165645027,,,0.00013186498806613033,,,,1,,,0.002400875668379709,,PRUNED
1218,1218,33.333333333333336,2025-05-25 18:58:26.586709,2025-05-25 18:58:34.400064,0 days 00:00:07.813355,AdamW,0.2881975604705873,,,0.00010393837000847672,,,,1,,,0.0005748645578209512,,PRUNED
1219,1219,37.5,2025-05-25 18:58:34.440558,2025-05-25 18:58:44.744482,0 days 00:00:10.303924,AdamW,0.2109767711940183,,,6.568844814943988e-05,,,,0,,,0.0006919137132902264,,PRUNED
1220,1220,,2025-05-25 18:58:44.799212,2025-05-25 18:58:55.415757,0 days 00:00:10.616545,SGD,0.18447166101234308,,,,4.957870068450219e-05,61.83555493021935,True,1,,,,0.182704223782991,PRUNED
1221,1221,35.416666666666664,2025-05-25 18:58:55.463782,2025-05-25 18:59:03.561179,0 days 00:00:08.097397,AdamW,0.23527482751970666,,,0.00020401674651188785,,,,2,,,0.0030088693834786563,,PRUNED
1222,1222,33.333333333333336,2025-05-25 18:59:03.596626,2025-05-25 18:59:09.449674,0 days 00:00:05.853048,AdamW,0.2562553775710221,,,0.00014852199363758149,,,,1,,,0.00043442110056818236,,PRUNED
1223,1223,58.333333333333336,2025-05-25 18:59:09.485896,2025-05-25 18:59:17.778799,0 days 00:00:08.292903,AdamW,0.19696209198503994,,,8.663473957543473e-05,,,,2,,,0.0023165957605132607,,PRUNED
1224,1224,39.583333333333336,2025-05-25 18:59:17.814513,2025-05-25 18:59:23.669717,0 days 00:00:05.855204,AdamW,0.21514118695301676,,,0.00011313559914863051,,,,0,,,0.003854917140831433,,PRUNED
1225,1225,33.333333333333336,2025-05-25 18:59:23.705211,2025-05-25 18:59:29.514322,0 days 00:00:05.809111,AdamW,0.3660017150309522,,,0.00027549029874546406,,,,1,,,0.0026870022382111387,,PRUNED
1226,1226,47.916666666666664,2025-05-25 18:59:29.550109,2025-05-25 18:59:35.296984,0 days 00:00:05.746875,AdamW,0.1469748996113265,,,0.00012919195421919283,,,,4,,,0.0004173126891858425,,PRUNED
1227,1227,35.416666666666664,2025-05-25 18:59:35.331999,2025-05-25 18:59:41.112864,0 days 00:00:05.780865,AdamW,0.17781554224506435,,,0.00016710303012819848,,,,2,,,0.0004918480284629404,,PRUNED
1228,1228,33.333333333333336,2025-05-25 18:59:41.147732,2025-05-25 18:59:46.959267,0 days 00:00:05.811535,Adadelta,0.07225294681610336,0.29656888869792664,,,,,,1,0.15040150926175805,,,,PRUNED
1229,1229,33.333333333333336,2025-05-25 18:59:46.993747,2025-05-25 18:59:52.949335,0 days 00:00:05.955588,AdamW,0.1659664241875996,,,9.786262316192064e-05,,,,1,,,0.0011784557676588852,,PRUNED
1230,1230,35.416666666666664,2025-05-25 18:59:52.984878,2025-05-25 18:59:58.789623,0 days 00:00:05.804745,Adam,0.2723234427663336,,0.0008622715227096819,,,,,0,,23.28139546510181,,,PRUNED
1231,1231,50.0,2025-05-25 18:59:58.825577,2025-05-25 19:00:04.761809,0 days 00:00:05.936232,AdamW,0.2387443108271872,,,6.819467106472013e-05,,,,2,,,0.00034797266434388854,,PRUNED
1232,1232,33.333333333333336,2025-05-25 19:00:04.797901,2025-05-25 19:00:10.616552,0 days 00:00:05.818651,AdamW,0.029590910130777984,,,0.00021024809322021931,,,,1,,,0.00038361905601537314,,PRUNED
1233,1233,33.333333333333336,2025-05-25 19:00:10.652600,2025-05-25 19:00:16.486613,0 days 00:00:05.834013,AdamW,0.22525846392568147,,,0.00013988086884760462,,,,0,,,0.002200870919862388,,PRUNED
1234,1234,39.583333333333336,2025-05-25 19:00:16.522285,2025-05-25 19:00:22.372890,0 days 00:00:05.850605,AdamW,0.18898363646213326,,,8.326642820907051e-05,,,,2,,,0.002537796325507543,,PRUNED
1235,1235,33.333333333333336,2025-05-25 19:00:22.408110,2025-05-25 19:00:28.387811,0 days 00:00:05.979701,AdamW,0.2045522408260023,,,0.0001113951893927666,,,,1,,,0.003084936689768564,,PRUNED
1236,1236,33.333333333333336,2025-05-25 19:00:28.424123,2025-05-25 19:00:34.210086,0 days 00:00:05.785963,AdamW,0.2154450774959253,,,0.001273966786701715,,,,2,,,0.002411597265259528,,PRUNED
1237,1237,35.416666666666664,2025-05-25 19:00:34.245082,2025-05-25 19:00:40.345840,0 days 00:00:06.100758,AdamW,0.24920796353760888,,,0.00016777372639721668,,,,1,,,0.000546355000046475,,PRUNED
1238,1238,39.583333333333336,2025-05-25 19:00:40.381963,2025-05-25 19:00:46.295816,0 days 00:00:05.913853,AdamW,0.4192183082614801,,,0.0002401975719278764,,,,0,,,0.0033746000842980253,,PRUNED
1239,1239,39.583333333333336,2025-05-25 19:00:46.333452,2025-05-25 19:00:52.188870,0 days 00:00:05.855418,AdamW,0.18034481618775722,,,9.895926365779748e-05,,,,1,,,0.00031184769841222836,,PRUNED
1240,1240,39.583333333333336,2025-05-25 19:00:52.223758,2025-05-25 19:00:58.021975,0 days 00:00:05.798217,AdamW,0.19287582788015623,,,0.00013197616693939114,,,,2,,,0.0028329660156091565,,PRUNED
1241,1241,33.333333333333336,2025-05-25 19:00:58.057387,2025-05-25 19:01:04.031915,0 days 00:00:05.974528,AdamW,0.15908165047357367,,,0.040129467206024054,,,,1,,,0.0021806461250942523,,PRUNED
1242,1242,47.916666666666664,2025-05-25 19:01:04.067871,2025-05-25 19:01:12.099918,0 days 00:00:08.032047,AdamW,0.26626404638335166,,,7.867527394902654e-05,,,,4,,,0.00045935990036648764,,PRUNED
1243,1243,33.333333333333336,2025-05-25 19:01:12.190062,2025-05-25 19:01:22.475346,0 days 00:00:10.285284,AdamW,0.22573557837986952,,,0.0003119238941288392,,,,0,,,0.0006164363281913777,,PRUNED
1244,1244,35.416666666666664,2025-05-25 19:01:22.510581,2025-05-25 19:01:28.415286,0 days 00:00:05.904705,AdamW,0.24158162180215179,,,0.0001869251065073087,,,,8,,,0.004423293504519684,,PRUNED
1245,1245,,2025-05-25 19:01:28.466413,2025-05-25 19:01:46.524814,0 days 00:00:18.058401,SGD,0.2575259689220304,,,,0.0001147294155341383,73.65646003601228,False,6,,,,0.047315086483895215,PRUNED
1246,1246,37.5,2025-05-25 19:01:46.574685,2025-05-25 19:01:53.484704,0 days 00:00:06.910019,AdamW,0.43387266837351174,,,6.0099631824210865e-05,,,,2,,,0.00040606307032241707,,PRUNED
1247,1247,33.333333333333336,2025-05-25 19:01:53.519186,2025-05-25 19:02:00.344058,0 days 00:00:06.824872,AdamW,0.2047433956287716,,,0.058844030620251266,,,,0,,,0.0024771141388105853,,PRUNED
1248,1248,35.416666666666664,2025-05-25 19:02:00.379504,2025-05-25 19:02:06.159106,0 days 00:00:05.779602,AdamW,0.3762598759238357,,,0.00011615786756282688,,,,2,,,0.00036195571563166446,,PRUNED
1249,1249,41.666666666666664,2025-05-25 19:02:06.194129,2025-05-25 19:02:12.001382,0 days 00:00:05.807253,AdamW,0.2795823739822905,,,0.00014976137795440282,,,,1,,,0.0004988397485210034,,PRUNED
1250,1250,33.333333333333336,2025-05-25 19:02:12.036929,2025-05-25 19:02:17.836091,0 days 00:00:05.799162,Adam,0.23460647971612605,,0.027957379298337724,,,,,1,,0.023111394821204233,,,PRUNED
1251,1251,33.333333333333336,2025-05-25 19:02:17.871139,2025-05-25 19:02:23.744848,0 days 00:00:05.873709,AdamW,0.35107024238402357,,,9.287500386480757e-05,,,,1,,,0.00269790110907859,,PRUNED
1252,1252,33.333333333333336,2025-05-25 19:02:23.779282,2025-05-25 19:02:29.745179,0 days 00:00:05.965897,AdamW,0.3254453818298889,,,0.000118651220436723,,,,1,,,0.0021151814582058078,,PRUNED
1253,1253,29.166666666666668,2025-05-25 19:02:29.780846,2025-05-25 19:02:35.599435,0 days 00:00:05.818589,Adadelta,0.17641102646297996,0.033299379424657535,,,,,,0,33.82285893603293,,,,PRUNED
1254,1254,43.75,2025-05-25 19:02:35.634161,2025-05-25 19:02:41.441223,0 days 00:00:05.807062,AdamW,0.19024922191740715,,,7.530102163571652e-05,,,,1,,,0.002964955597098934,,PRUNED
1255,1255,45.833333333333336,2025-05-25 19:02:41.476388,2025-05-25 19:02:47.282395,0 days 00:00:05.806007,AdamW,0.1658771012083222,,,0.0001743366289317957,,,,1,,,0.003653856776177967,,PRUNED
1256,1256,66.66666666666667,2025-05-25 19:02:47.317385,2025-05-25 19:02:55.592677,0 days 00:00:08.275292,AdamW,0.39244903210170706,,,0.000243842361242536,,,,2,,,0.0023057306239654923,,PRUNED
1257,1257,33.333333333333336,2025-05-25 19:02:55.627413,2025-05-25 19:03:01.406608,0 days 00:00:05.779195,AdamW,0.06144165818374621,,,9.900499427789273e-05,,,,2,,,0.00042945961007635666,,PRUNED
1258,1258,33.333333333333336,2025-05-25 19:03:01.441491,2025-05-25 19:03:07.253584,0 days 00:00:05.812093,AdamW,0.14307210308292845,,,0.00014070985724418242,,,,0,,,0.0005709518463806472,,PRUNED
