,number,value,datetime_start,datetime_complete,duration,params_algorithm,params_dropout_rate,params_lr_Adadelta,params_lr_Adam,params_lr_AdamW,params_lr_SGD,params_momentum_SGD,params_nesterov_SGD,params_suggested_freeze,params_weight_decay_Adadelta,params_weight_decay_Adam,params_weight_decay_AdamW,params_weight_decay_SGD,state
1712,1712,33.333333333333336,2025-05-25 20:55:20.866211,2025-05-25 20:55:31.875656,0 days 00:00:11.009445,Adam,0.498595432199428,,0.034722605162528085,,,,,3,,4.219734011663597,,,PRUNED
1713,1713,47.916666666666664,2025-05-25 20:55:31.928008,2025-05-25 20:55:43.203749,0 days 00:00:11.275741,AdamW,0.18218053455799305,,,0.0001718016000659087,,,,0,,,0.002957781240171575,,PRUNED
1714,1714,33.333333333333336,2025-05-25 20:55:43.256657,2025-05-25 20:55:54.273458,0 days 00:00:11.016801,AdamW,0.26111493142007586,,,8.315305754663538e-05,,,,4,,,0.00036209907551403893,,PRUNED
1715,1715,35.416666666666664,2025-05-25 20:55:54.325820,2025-05-25 20:56:05.340453,0 days 00:00:11.014633,Adadelta,0.2413407897406215,0.05046164762103194,,,,,,2,71.56304584717915,,,,PRUNED
1716,1716,33.333333333333336,2025-05-25 20:56:05.387292,2025-05-25 20:56:16.307578,0 days 00:00:10.920286,AdamW,0.21036709737024345,,,0.00011719441139742973,,,,2,,,0.0004508863444084543,,PRUNED
1717,1717,45.833333333333336,2025-05-25 20:56:16.359840,2025-05-25 20:56:27.445877,0 days 00:00:11.086037,AdamW,0.22580532071836906,,,6.300345437177479e-05,,,,2,,,0.0005532754691056158,,PRUNED
1718,1718,52.083333333333336,2025-05-25 20:56:27.497853,2025-05-25 20:56:38.284492,0 days 00:00:10.786639,AdamW,0.2753417151597199,,,0.00024902440376313976,,,,3,,,0.0026346663280232096,,PRUNED
1719,1719,33.333333333333336,2025-05-25 20:56:38.324006,2025-05-25 20:56:49.316530,0 days 00:00:10.992524,AdamW,0.19356328480142934,,,0.000149373705178092,,,,0,,,0.002360917300466931,,PRUNED
1720,1720,39.583333333333336,2025-05-25 20:56:49.368420,2025-05-25 20:57:00.217428,0 days 00:00:10.849008,AdamW,0.24954193751730874,,,0.00018198851863966532,,,,3,,,0.0031561144846288885,,PRUNED
1721,1721,45.833333333333336,2025-05-25 20:57:00.268144,2025-05-25 20:57:10.986939,0 days 00:00:10.718795,AdamW,0.17993464780165963,,,0.0002953972843630312,,,,4,,,0.00041311905458157986,,PRUNED
1722,1722,33.333333333333336,2025-05-25 20:57:11.036855,2025-05-25 20:57:21.705265,0 days 00:00:10.668410,AdamW,0.21373466845582242,,,7.660038489366748e-05,,,,5,,,0.0022218042734013024,,PRUNED
1723,1723,35.416666666666664,2025-05-25 20:57:21.753083,2025-05-25 20:57:32.205717,0 days 00:00:10.452634,AdamW,0.23169872783605436,,,0.00011342859979148004,,,,6,,,0.0006508598266266847,,PRUNED
1724,1724,33.333333333333336,2025-05-25 20:57:32.255254,2025-05-25 20:57:43.167652,0 days 00:00:10.912398,AdamW,0.15926789843371575,,,0.0004685054991877982,,,,2,,,0.0015439456804274775,,PRUNED
1725,1725,33.333333333333336,2025-05-25 20:57:43.219757,2025-05-25 20:57:54.426066,0 days 00:00:11.206309,AdamW,0.2012304345068515,,,5.2509987369446974e-05,,,,0,,,0.0004994213876477067,,PRUNED
1726,1726,39.583333333333336,2025-05-25 20:57:54.464745,2025-05-25 20:58:05.275606,0 days 00:00:10.810861,AdamW,0.17097736863505797,,,0.000100784087472177,,,,2,,,0.0004369660174647019,,PRUNED
1727,1727,41.666666666666664,2025-05-25 20:58:05.331193,2025-05-25 20:58:16.958711,0 days 00:00:11.627518,AdamW,0.18714447131604636,,,0.00013525103353255477,,,,0,,,0.0026315475163961525,,PRUNED
1728,1728,33.333333333333336,2025-05-25 20:58:17.012747,2025-05-25 20:58:28.535982,0 days 00:00:11.523235,AdamW,0.4661059722026931,,,0.00021304304883175735,,,,2,,,0.0036095216581133655,,PRUNED
1729,1729,43.75,2025-05-25 20:58:28.589941,2025-05-25 20:58:40.142884,0 days 00:00:11.552943,AdamW,0.3887367235227943,,,0.00017594316016872826,,,,2,,,0.00037340912386785933,,PRUNED
1730,1730,,2025-05-25 20:58:40.197936,2025-05-25 20:58:50.551000,0 days 00:00:10.353064,SGD,0.2966353777964454,,,,0.02413717217601804,34.33300498631841,False,3,,,,0.4745930687693959,PRUNED
1731,1731,33.333333333333336,2025-05-25 20:58:50.602902,2025-05-25 20:59:02.328419,0 days 00:00:11.725517,AdamW,0.25750059793363894,,,0.00036221965010307553,,,,0,,,0.0006134276150399791,,PRUNED
1732,1732,33.333333333333336,2025-05-25 20:59:02.383534,2025-05-25 20:59:14.090899,0 days 00:00:11.707365,AdamW,0.237041981186186,,,8.952463601922053e-05,,,,2,,,0.00034054636681950636,,PRUNED
1733,1733,39.583333333333336,2025-05-25 20:59:14.139193,2025-05-25 20:59:25.809015,0 days 00:00:11.669822,AdamW,0.22246675281418926,,,0.0001226614272325888,,,,3,,,0.0029224965553423564,,PRUNED
1734,1734,41.666666666666664,2025-05-25 20:59:25.864462,2025-05-25 20:59:37.744721,0 days 00:00:11.880259,AdamW,0.2074018024520252,,,7.443466697628793e-05,,,,0,,,0.002391704080538031,,PRUNED
1735,1735,33.333333333333336,2025-05-25 20:59:37.799478,2025-05-25 20:59:49.560843,0 days 00:00:11.761365,Adam,0.19478943490077139,,0.000514206094244662,,,,,2,,0.028290722222798957,,,PRUNED
1736,1736,33.333333333333336,2025-05-25 20:59:49.615566,2025-05-25 21:00:01.323914,0 days 00:00:11.708348,AdamW,0.21936180493644933,,,0.0001526448525811097,,,,2,,,0.0005369581916806871,,PRUNED
1737,1737,39.583333333333336,2025-05-25 21:00:01.378988,2025-05-25 21:00:13.032460,0 days 00:00:11.653472,AdamW,0.24786118924303582,,,0.00023917245624714627,,,,4,,,0.0004157001371029671,,PRUNED
1738,1738,41.666666666666664,2025-05-25 21:00:13.085788,2025-05-25 21:00:24.770059,0 days 00:00:11.684271,Adadelta,0.2703765093066348,0.029523937084544212,,,,,,0,4.00285426977656,,,,PRUNED
1739,1739,29.166666666666668,2025-05-25 21:00:24.824029,2025-05-25 21:00:36.313991,0 days 00:00:11.489962,AdamW,0.17844495613849967,,,9.659585668781316e-05,,,,2,,,0.004149548396976353,,PRUNED
1740,1740,31.25,2025-05-25 21:00:36.370321,2025-05-25 21:00:47.824421,0 days 00:00:11.454100,AdamW,0.22837580450034003,,,0.00019689613038142338,,,,3,,,0.0004726430100816847,,PRUNED
1741,1741,33.333333333333336,2025-05-25 21:00:47.878360,2025-05-25 21:00:59.679994,0 days 00:00:11.801634,AdamW,0.4762893232610457,,,0.00029021414114110234,,,,0,,,0.0021205636351507317,,PRUNED
1742,1742,35.416666666666664,2025-05-25 21:00:59.734463,2025-05-25 21:01:11.339257,0 days 00:00:11.604794,AdamW,0.21334190400504108,,,0.00011951348188717397,,,,2,,,0.004993686127568,,PRUNED
1743,1743,52.083333333333336,2025-05-25 21:01:11.597011,2025-05-25 21:01:23.180693,0 days 00:00:11.583682,AdamW,0.34408586300884597,,,6.265123573371612e-05,,,,2,,,0.0033976956423575244,,PRUNED
1744,1744,54.166666666666664,2025-05-25 21:01:23.234401,2025-05-25 21:01:34.682445,0 days 00:00:11.448044,AdamW,0.16533907667131645,,,0.00015241534831173764,,,,3,,,0.0003131455095193683,,PRUNED
1745,1745,39.583333333333336,2025-05-25 21:01:34.736138,2025-05-25 21:01:46.338015,0 days 00:00:11.601877,AdamW,0.19871389431811803,,,8.78185206079875e-05,,,,0,,,0.0031147339636466032,,PRUNED
1746,1746,54.166666666666664,2025-05-25 21:01:46.394259,2025-05-25 21:01:59.659443,0 days 00:00:13.265184,AdamW,0.2410661683738983,,,0.00010801590224943933,,,,5,,,0.00058607730528016,,PRUNED
1747,1747,43.75,2025-05-25 21:01:59.707328,2025-05-25 21:02:11.164854,0 days 00:00:11.457526,AdamW,0.2573334569897659,,,0.0001310791395667338,,,,3,,,0.002559675243693084,,PRUNED
1748,1748,33.333333333333336,2025-05-25 21:02:11.213486,2025-05-25 21:02:22.896576,0 days 00:00:11.683090,AdamW,0.2827502159911014,,,0.00020142133601637856,,,,3,,,0.002780371581999727,,PRUNED
1749,1749,41.666666666666664,2025-05-25 21:02:22.959152,2025-05-25 21:02:34.860414,0 days 00:00:11.901262,AdamW,0.45349397919388756,,,0.00016426379393298277,,,,0,,,0.0005122045274686543,,PRUNED
1750,1750,41.666666666666664,2025-05-25 21:02:34.912708,2025-05-25 21:02:47.069161,0 days 00:00:12.156453,AdamW,0.32732067695860306,,,7.792214471483806e-05,,,,2,,,0.0019684257063808824,,PRUNED
1751,1751,43.75,2025-05-25 21:02:47.127668,2025-05-25 21:02:59.145210,0 days 00:00:12.017542,AdamW,0.18987523211323207,,,4.689721422789941e-05,,,,2,,,0.0004565094487884062,,PRUNED
1752,1752,33.333333333333336,2025-05-25 21:02:59.196509,2025-05-25 21:03:11.134314,0 days 00:00:11.937805,AdamW,0.17392149786461594,,,0.00024566258366136073,,,,4,,,0.00039482343828006164,,PRUNED
1753,1753,,2025-05-25 21:03:11.214671,2025-05-25 21:03:22.173510,0 days 00:00:10.958839,SGD,0.20226230661591157,,,,0.0016951475093255149,52.331207296148946,True,0,,,,0.32928323664619696,PRUNED
1754,1754,37.5,2025-05-25 21:03:22.234154,2025-05-25 21:03:34.320682,0 days 00:00:12.086528,AdamW,0.2299833843829955,,,9.778045898933286e-05,,,,2,,,0.002328845111171733,,PRUNED
1755,1755,33.333333333333336,2025-05-25 21:03:34.374061,2025-05-25 21:03:45.837110,0 days 00:00:11.463049,AdamW,0.31149384744105374,,,0.00013463856025257648,,,,6,,,0.003002010339362673,,PRUNED
1756,1756,37.5,2025-05-25 21:03:45.885415,2025-05-25 21:03:57.994921,0 days 00:00:12.109506,AdamW,0.21809714314748022,,,0.00030622720251233986,,,,2,,,0.0009328326029476607,,PRUNED
1757,1757,43.75,2025-05-25 21:03:58.047540,2025-05-25 21:04:10.028444,0 days 00:00:11.980904,AdamW,0.16262677124392635,,,0.00011310967757417428,,,,3,,,0.00024312237988282202,,PRUNED
1758,1758,33.333333333333336,2025-05-25 21:04:10.080936,2025-05-25 21:04:22.444582,0 days 00:00:12.363646,AdamW,0.18741685081591047,,,0.0001738307478070376,,,,0,,,0.0034603980689593404,,PRUNED
1759,1759,33.333333333333336,2025-05-25 21:04:22.497659,2025-05-25 21:04:34.426347,0 days 00:00:11.928688,Adam,0.4370690563902346,,0.0006612013358351355,,,,,2,,0.015911470740666536,,,PRUNED
1760,1760,33.333333333333336,2025-05-25 21:04:34.479960,2025-05-25 21:04:46.477610,0 days 00:00:11.997650,AdamW,0.2441487174897999,,,7.384269438524538e-05,,,,4,,,0.0026226498345610703,,PRUNED
1761,1761,33.333333333333336,2025-05-25 21:04:46.536086,2025-05-25 21:04:58.546233,0 days 00:00:12.010147,AdamW,0.37898934456755484,,,0.00021433807135926966,,,,0,,,0.0017979962930413432,,PRUNED
1762,1762,35.416666666666664,2025-05-25 21:04:58.599413,2025-05-25 21:05:10.353906,0 days 00:00:11.754493,Adadelta,0.2652246189919744,0.014879880308869154,,,,,,3,0.12277583379642446,,,,PRUNED
1763,1763,37.5,2025-05-25 21:05:10.406218,2025-05-25 21:05:22.199812,0 days 00:00:11.793594,AdamW,0.21351795676406723,,,5.783614727433887e-05,,,,2,,,0.0003624246677072252,,PRUNED
1764,1764,33.333333333333336,2025-05-25 21:05:22.241685,2025-05-25 21:05:34.003110,0 days 00:00:11.761425,AdamW,0.2536495038073469,,,0.0003883517007844793,,,,2,,,0.002182248874181963,,PRUNED
1765,1765,41.666666666666664,2025-05-25 21:05:34.059690,2025-05-25 21:05:45.983917,0 days 00:00:11.924227,AdamW,0.19868552025361408,,,0.0001362813820664462,,,,0,,,0.000698880995918836,,PRUNED
1766,1766,29.166666666666668,2025-05-25 21:05:46.041755,2025-05-25 21:05:57.700737,0 days 00:00:11.658982,AdamW,0.29088538438257167,,,8.470820872174993e-05,,,,2,,,0.0005541489675718547,,PRUNED
1767,1767,33.333333333333336,2025-05-25 21:05:57.757546,2025-05-25 21:06:09.670347,0 days 00:00:11.912801,AdamW,0.23546111441229192,,,0.00010788117308380481,,,,0,,,0.003833725903219509,,PRUNED
1768,1768,33.333333333333336,2025-05-25 21:06:09.726150,2025-05-25 21:06:21.322790,0 days 00:00:11.596640,AdamW,0.15658899514767594,,,0.0001601715640369995,,,,5,,,0.0004780663348356046,,PRUNED
1769,1769,33.333333333333336,2025-05-25 21:06:21.378316,2025-05-25 21:06:33.073068,0 days 00:00:11.694752,AdamW,0.20863643621045574,,,0.00023975967788718712,,,,3,,,0.0004276167190644693,,PRUNED
1770,1770,33.333333333333336,2025-05-25 21:06:33.127044,2025-05-25 21:06:44.620240,0 days 00:00:11.493196,AdamW,0.41227445224463494,,,0.00019333012644955435,,,,2,,,0.0007883344564173286,,PRUNED
1771,1771,35.416666666666664,2025-05-25 21:06:44.675820,2025-05-25 21:06:56.251910,0 days 00:00:11.576090,AdamW,0.18282874952602396,,,9.328180512051028e-05,,,,3,,,0.0024554690979765354,,PRUNED
1772,1772,37.5,2025-05-25 21:06:56.306324,2025-05-25 21:07:07.828359,0 days 00:00:11.522035,AdamW,0.22588841022716713,,,0.00012761825447483776,,,,2,,,0.0003349531696937498,,PRUNED
1773,1773,35.416666666666664,2025-05-25 21:07:07.882924,2025-05-25 21:07:19.538841,0 days 00:00:11.655917,AdamW,0.4243501987532744,,,6.69385472041781e-05,,,,0,,,0.002738735998286103,,PRUNED
1774,1774,33.333333333333336,2025-05-25 21:07:19.593931,2025-05-25 21:07:30.994965,0 days 00:00:11.401034,AdamW,0.17247701483039485,,,0.00028070214900249196,,,,2,,,0.0032907492855817864,,PRUNED
1775,1775,33.333333333333336,2025-05-25 21:07:31.050447,2025-05-25 21:07:42.806466,0 days 00:00:11.756019,AdamW,0.48885007209517795,,,0.00010859844234945267,,,,3,,,0.0005215935073102247,,PRUNED
1776,1776,33.333333333333336,2025-05-25 21:07:42.860739,2025-05-25 21:07:54.495435,0 days 00:00:11.634696,AdamW,0.39738395143113037,,,0.0001592916640752976,,,,0,,,0.0003855264235591173,,PRUNED
1777,1777,,2025-05-25 21:07:54.549957,2025-05-25 21:08:04.819547,0 days 00:00:10.269590,SGD,0.36738238189292804,,,,3.986194186576453e-05,74.35905200695551,False,2,,,,95.50540458923145,PRUNED
1778,1778,31.25,2025-05-25 21:08:04.872812,2025-05-25 21:08:16.498942,0 days 00:00:11.626130,AdamW,0.278388521394946,,,8.732670754759774e-05,,,,1,,,0.0006284544163456782,,PRUNED
1779,1779,33.333333333333336,2025-05-25 21:08:16.556133,2025-05-25 21:08:28.244659,0 days 00:00:11.688526,AdamW,0.19611330205503283,,,0.0003481433311757257,,,,1,,,0.0021960124808974055,,PRUNED
1780,1780,54.166666666666664,2025-05-25 21:08:28.300091,2025-05-25 21:08:39.679017,0 days 00:00:11.378926,AdamW,0.24379044082892135,,,0.00013851002398712698,,,,2,,,0.00026794082901339015,,PRUNED
1781,1781,33.333333333333336,2025-05-25 21:08:39.734565,2025-05-25 21:08:51.498038,0 days 00:00:11.763473,AdamW,0.21758342646788328,,,0.0002052143513291547,,,,0,,,0.0016828849464284785,,PRUNED
1782,1782,43.75,2025-05-25 21:08:51.554988,2025-05-25 21:09:03.479213,0 days 00:00:11.924225,AdamW,0.18348512481494472,,,0.00010277572830561742,,,,1,,,0.002903735024634857,,PRUNED
1783,1783,33.333333333333336,2025-05-25 21:09:03.535582,2025-05-25 21:09:15.106749,0 days 00:00:11.571167,Adam,0.22735112068795083,,3.069522351181756e-05,,,,,3,,0.444127192726355,,,PRUNED
1784,1784,33.333333333333336,2025-05-25 21:09:15.160967,2025-05-25 21:09:26.757835,0 days 00:00:11.596868,AdamW,0.2532536337906726,,,0.00012109885358556288,,,,4,,,0.0024163301496903686,,PRUNED
1785,1785,37.5,2025-05-25 21:09:26.813619,2025-05-25 21:09:38.325805,0 days 00:00:11.512186,AdamW,0.3537240335914609,,,7.39544042240405e-05,,,,1,,,0.00045928035639920817,,PRUNED
1786,1786,37.5,2025-05-25 21:09:38.380612,2025-05-25 21:09:49.795389,0 days 00:00:11.414777,Adadelta,0.26603287345939697,0.2394842043535146,,,,,,2,13.574048880350558,,,,PRUNED
1787,1787,33.333333333333336,2025-05-25 21:09:49.849498,2025-05-25 21:10:01.576279,0 days 00:00:11.726781,AdamW,0.20171039927186174,,,0.00017501975038931777,,,,0,,,0.002000581143137855,,PRUNED
1788,1788,41.666666666666664,2025-05-25 21:10:01.633433,2025-05-25 21:10:13.011947,0 days 00:00:11.378514,AdamW,0.23912063274116913,,,0.00025739617513413583,,,,2,,,0.0005901545041799796,,PRUNED
1789,1789,33.333333333333336,2025-05-25 21:10:13.066318,2025-05-25 21:10:24.524327,0 days 00:00:11.458009,AdamW,0.2110976698834145,,,0.00014201804035503734,,,,3,,,0.00042282724859883875,,PRUNED
1790,1790,33.333333333333336,2025-05-25 21:10:24.577809,2025-05-25 21:10:35.986250,0 days 00:00:11.408441,AdamW,0.1739608608215922,,,0.00044718578063869855,,,,0,,,0.003178953005348127,,PRUNED
1791,1791,47.916666666666664,2025-05-25 21:10:36.043865,2025-05-25 21:10:47.756518,0 days 00:00:11.712653,AdamW,0.19145204148886527,,,9.20830454682406e-05,,,,2,,,0.0005027654519417287,,PRUNED
1792,1792,33.333333333333336,2025-05-25 21:10:47.811921,2025-05-25 21:10:59.676397,0 days 00:00:11.864476,AdamW,0.15844596918197973,,,0.00022770689241577828,,,,5,,,0.0026673762028264895,,PRUNED
1793,1793,33.333333333333336,2025-05-25 21:10:59.731259,2025-05-25 21:11:11.394624,0 days 00:00:11.663365,AdamW,0.23163308962530071,,,0.00015846000423393576,,,,1,,,0.00029273266411180274,,PRUNED
1794,1794,52.083333333333336,2025-05-25 21:11:11.450254,2025-05-25 21:11:23.190281,0 days 00:00:11.740027,AdamW,0.33219084072501875,,,5.772234509037194e-05,,,,1,,,0.006395233042932346,,PRUNED
1795,1795,37.5,2025-05-25 21:11:23.246159,2025-05-25 21:11:34.859599,0 days 00:00:11.613440,AdamW,0.2202718472377964,,,0.00010423191024203715,,,,2,,,0.00037475450869053055,,PRUNED
1796,1796,33.333333333333336,2025-05-25 21:11:34.913866,2025-05-25 21:11:46.566217,0 days 00:00:11.652351,AdamW,0.2051626933945303,,,0.00018685662228292162,,,,0,,,0.003688976151131453,,PRUNED
1797,1797,35.416666666666664,2025-05-25 21:11:46.620635,2025-05-25 21:11:58.187112,0 days 00:00:11.566477,AdamW,0.24968871114578625,,,0.00012191546429172746,,,,4,,,0.0022792040135941093,,PRUNED
1798,1798,39.583333333333336,2025-05-25 21:11:58.245860,2025-05-25 21:12:09.869247,0 days 00:00:11.623387,AdamW,0.16820620768834213,,,7.960141598034092e-05,,,,2,,,0.0005471210900969849,,PRUNED
1799,1799,33.333333333333336,2025-05-25 21:12:09.924176,2025-05-25 21:12:21.573788,0 days 00:00:11.649612,AdamW,0.18641942292031488,,,0.0003022978983757911,,,,1,,,0.0030532331589783294,,PRUNED
1800,1800,33.333333333333336,2025-05-25 21:12:21.628654,2025-05-25 21:12:33.543709,0 days 00:00:11.915055,AdamW,0.3196517800000747,,,0.0001464263762475452,,,,0,,,0.00045601241757865297,,PRUNED
1801,1801,,2025-05-25 21:12:33.600211,2025-05-25 21:12:43.891039,0 days 00:00:10.290828,SGD,0.3042451177881499,,,,0.03401877386860382,19.653381600975006,True,2,,,,4.212612459277283,PRUNED
1802,1802,33.333333333333336,2025-05-25 21:12:43.945281,2025-05-25 21:12:55.590447,0 days 00:00:11.645166,AdamW,0.23737722698796127,,,0.00018892338903375225,,,,3,,,0.0003388895621889486,,PRUNED
1803,1803,41.666666666666664,2025-05-25 21:12:55.644818,2025-05-25 21:13:07.191651,0 days 00:00:11.546833,AdamW,0.21081531780304186,,,6.68230430281544e-05,,,,3,,,0.002483882183098821,,PRUNED
1804,1804,37.5,2025-05-25 21:13:07.248960,2025-05-25 21:13:18.733767,0 days 00:00:11.484807,AdamW,0.27612245164562105,,,0.00011794575589279494,,,,2,,,0.0027610508280517736,,PRUNED
1805,1805,47.916666666666664,2025-05-25 21:13:18.789785,2025-05-25 21:13:30.301773,0 days 00:00:11.511988,AdamW,0.19209536731593757,,,8.7627259962971e-05,,,,1,,,0.00040206729167814495,,PRUNED
1806,1806,29.166666666666668,2025-05-25 21:13:30.356438,2025-05-25 21:13:40.666504,0 days 00:00:10.310066,AdamW,0.2647081656609912,,,4.122331265829481e-05,,,,7,,,0.0020614683838746694,,PRUNED
1807,1807,33.333333333333336,2025-05-25 21:13:40.715921,2025-05-25 21:13:52.177695,0 days 00:00:11.461774,Adam,0.17843440946487887,,0.015009104503848568,,,,,0,,0.2159659439855574,,,PRUNED
1808,1808,37.5,2025-05-25 21:13:52.238347,2025-05-25 21:14:03.603878,0 days 00:00:11.365531,AdamW,0.4581912355943382,,,0.0002450096510714243,,,,2,,,0.0005029227184586491,,PRUNED
1809,1809,33.333333333333336,2025-05-25 21:14:03.853936,2025-05-25 21:14:15.389339,0 days 00:00:11.535403,AdamW,0.2242026333169709,,,0.00010615283679774658,,,,1,,,0.0018649095982925165,,PRUNED
1810,1810,33.333333333333336,2025-05-25 21:14:15.450723,2025-05-25 21:14:26.822450,0 days 00:00:11.371727,AdamW,0.15174780536726193,,,0.00015146151432116268,,,,4,,,0.0034309064239586816,,PRUNED
1811,1811,33.333333333333336,2025-05-25 21:14:26.876591,2025-05-25 21:14:38.362599,0 days 00:00:11.486008,AdamW,0.20451562229910997,,,0.00021937297741292242,,,,0,,,0.0005900308853818791,,PRUNED
1812,1812,35.416666666666664,2025-05-25 21:14:38.418416,2025-05-25 21:14:49.738264,0 days 00:00:11.319848,Adadelta,0.25792649174861626,3.2727160456530644,,,,,,5,22.293618312723044,,,,PRUNED
1813,1813,33.333333333333336,2025-05-25 21:14:49.792112,2025-05-25 21:15:01.214109,0 days 00:00:11.421997,AdamW,0.24449584013134257,,,0.00012819160365565397,,,,2,,,0.002265305183247435,,PRUNED
1814,1814,33.333333333333336,2025-05-25 21:15:01.268864,2025-05-25 21:15:12.686394,0 days 00:00:11.417530,AdamW,0.21612769081393746,,,8.576727271481401e-05,,,,3,,,0.004416526692916431,,PRUNED
1815,1815,47.916666666666664,2025-05-25 21:15:12.741203,2025-05-25 21:15:24.236553,0 days 00:00:11.495350,AdamW,0.19511484543734942,,,0.00034971639774719366,,,,2,,,0.0004332300449036415,,PRUNED
1816,1816,33.333333333333336,2025-05-25 21:15:24.291154,2025-05-25 21:15:35.955670,0 days 00:00:11.664516,AdamW,0.16669689354122147,,,0.00018575371799713712,,,,1,,,0.0025768612148964827,,PRUNED
1817,1817,33.333333333333336,2025-05-25 21:15:36.012162,2025-05-25 21:15:47.088309,0 days 00:00:11.076147,AdamW,0.2936109290627566,,,6.933070933926478e-05,,,,0,,,0.0029486460033815803,,PRUNED
1818,1818,39.583333333333336,2025-05-25 21:15:47.139011,2025-05-25 21:15:58.338596,0 days 00:00:11.199585,AdamW,0.22929300171117695,,,0.00010045611600634128,,,,2,,,0.0004703371206680733,,PRUNED
1819,1819,33.333333333333336,2025-05-25 21:15:58.391149,2025-05-25 21:16:09.585800,0 days 00:00:11.194651,AdamW,0.17972415750290852,,,0.00016404180190577675,,,,3,,,0.0003735689247555656,,PRUNED
