,number,value,datetime_start,datetime_complete,duration,params_algorithm,params_dropout_rate,params_lr_Adadelta,params_lr_Adam,params_lr_AdamW,params_lr_SGD,params_momentum_SGD,params_nesterov_SGD,params_suggested_freeze,params_weight_decay_Adadelta,params_weight_decay_Adam,params_weight_decay_AdamW,params_weight_decay_SGD,state
924,924,33.333333333333336,2025-05-26 03:15:33.424809,2025-05-26 03:15:41.636931,0 days 00:00:08.212122,Adadelta,0.1411103889271902,0.3181689580729155,,,,,,1,0.012040660785928614,,,,PRUNED
925,925,,2025-05-26 03:15:41.684850,2025-05-26 03:15:48.257479,0 days 00:00:06.572629,SGD,0.15591872198502785,,,,4.947763471382803e-05,62.936022850031634,True,2,,,,0.15029471839804273,PRUNED
926,926,33.333333333333336,2025-05-26 03:15:48.299823,2025-05-26 03:15:54.956057,0 days 00:00:06.656234,Adam,0.14596344077940474,,0.0001257153795096043,,,,,2,,0.017386134695247583,,,PRUNED
927,927,33.333333333333336,2025-05-26 03:15:55.004797,2025-05-26 03:16:01.276180,0 days 00:00:06.271383,Adam,0.16225275558406957,,7.428387423788829e-05,,,,,9,,0.010049061022879766,,,PRUNED
928,928,43.75,2025-05-26 03:16:01.322106,2025-05-26 03:16:11.286976,0 days 00:00:09.964870,Adam,0.12123434566061937,,0.00014654233508378176,,,,,0,,0.013846676914355273,,,PRUNED
929,929,31.25,2025-05-26 03:16:11.335687,2025-05-26 03:16:17.992758,0 days 00:00:06.657071,Adam,0.1405120419053288,,0.00011074816607041013,,,,,2,,0.026926613976848812,,,PRUNED
930,930,33.333333333333336,2025-05-26 03:16:18.041624,2025-05-26 03:16:24.720570,0 days 00:00:06.678946,Adam,0.3079963858004112,,8.593360208089043e-05,,,,,3,,0.0334577124607446,,,PRUNED
931,931,45.833333333333336,2025-05-26 03:16:24.769188,2025-05-26 03:16:39.764953,0 days 00:00:14.995765,Adam,0.16956840384764835,,0.00016730256145224438,,,,,1,,0.0194407606272434,,,COMPLETE
932,932,37.5,2025-05-26 03:16:39.825846,2025-05-26 03:16:48.120012,0 days 00:00:08.294166,Adam,0.1514573846710873,,0.00012457641121620404,,,,,2,,0.023209932204694462,,,PRUNED
933,933,33.333333333333336,2025-05-26 03:16:48.170192,2025-05-26 03:16:54.841194,0 days 00:00:06.671002,Adam,0.10700591993534062,,6.796040654624295e-05,,,,,3,,0.4720949657700581,,,PRUNED
934,934,35.416666666666664,2025-05-26 03:16:54.889380,2025-05-26 03:17:01.535440,0 days 00:00:06.646060,Adam,0.13086403614257414,,9.49867177675994e-05,,,,,0,,0.012512268853672967,,,PRUNED
935,935,33.333333333333336,2025-05-26 03:17:01.583490,2025-05-26 03:17:08.206435,0 days 00:00:06.622945,Adam,0.1503766415341116,,0.003870157927757061,,,,,1,,0.015302694558259038,,,PRUNED
936,936,31.25,2025-05-26 03:17:08.254771,2025-05-26 03:17:14.818456,0 days 00:00:06.563685,Adam,0.1750953627026092,,0.00022742077434086193,,,,,2,,0.026471436211088026,,,PRUNED
937,937,33.333333333333336,2025-05-26 03:17:14.866748,2025-05-26 03:17:21.556269,0 days 00:00:06.689521,Adam,0.14020942551099116,,0.00018048309149597608,,,,,1,,0.043334142558409706,,,PRUNED
938,938,50.0,2025-05-26 03:17:21.604627,2025-05-26 03:17:36.732822,0 days 00:00:15.128195,Adam,0.12293452313739095,,5.6195720119114695e-05,,,,,3,,0.018981500101665487,,,COMPLETE
939,939,33.333333333333336,2025-05-26 03:17:36.794507,2025-05-26 03:17:43.366854,0 days 00:00:06.572347,Adam,0.16076031126612295,,0.0001400661318226522,,,,,0,,0.03256560858628298,,,PRUNED
940,940,37.5,2025-05-26 03:17:43.414707,2025-05-26 03:17:50.107749,0 days 00:00:06.693042,Adam,0.09506139428805224,,0.000108196417980699,,,,,1,,0.023174020939378898,,,PRUNED
941,941,33.333333333333336,2025-05-26 03:17:50.156075,2025-05-26 03:17:56.760478,0 days 00:00:06.604403,Adam,0.19139412907418585,,8.047006631625683e-05,,,,,2,,0.01811482607063101,,,PRUNED
942,942,33.333333333333336,2025-05-26 03:17:56.809218,2025-05-26 03:18:03.470573,0 days 00:00:06.661355,Adam,0.1326684009819968,,9.845712808676039e-05,,,,,3,,0.01497131349593738,,,PRUNED
943,943,33.333333333333336,2025-05-26 03:18:03.519133,2025-05-26 03:18:09.775060,0 days 00:00:06.255927,Adam,0.15410654765178605,,0.00012402308901228557,,,,,25,,0.029427372736605246,,,PRUNED
944,944,33.333333333333336,2025-05-26 03:18:09.820726,2025-05-26 03:18:16.456260,0 days 00:00:06.635534,Adam,0.11371609754987995,,3.342654675845118e-05,,,,,2,,0.01247126689533065,,,PRUNED
945,945,37.5,2025-05-26 03:18:16.507942,2025-05-26 03:18:23.184390,0 days 00:00:06.676448,Adam,0.14199776930084607,,0.00015529455343713764,,,,,1,,0.021334372217341042,,,PRUNED
946,946,33.333333333333336,2025-05-26 03:18:23.233151,2025-05-26 03:18:29.504887,0 days 00:00:06.271736,SGD,0.16592308026093427,,,,2.3136635624675073e-05,53.78606486982824,False,11,,,,0.6970493085405751,PRUNED
947,947,37.5,2025-05-26 03:18:29.552100,2025-05-26 03:18:36.199202,0 days 00:00:06.647102,Adam,0.17749112381012255,,6.820710783421136e-05,,,,,0,,0.038380407695870374,,,PRUNED
948,948,37.5,2025-05-26 03:18:36.248371,2025-05-26 03:18:42.821835,0 days 00:00:06.573464,Adam,0.13016524083734526,,0.00019867098612237754,,,,,4,,0.026802684566280488,,,PRUNED
949,949,33.333333333333336,2025-05-26 03:18:42.870327,2025-05-26 03:18:49.544728,0 days 00:00:06.674401,Adadelta,0.15531382319975542,2.6954774660069254,,,,,,2,0.0874781733717417,,,,PRUNED
950,950,52.083333333333336,2025-05-26 03:18:49.593074,2025-05-26 03:19:04.547028,0 days 00:00:14.953954,Adam,0.14235364431516098,,0.0002703169358637208,,,,,3,,0.057240379424389,,,COMPLETE
951,951,37.5,2025-05-26 03:19:04.608245,2025-05-26 03:19:12.908036,0 days 00:00:08.299791,Adam,0.12343953551826259,,8.720932380706476e-05,,,,,1,,0.016145506616128492,,,PRUNED
952,952,35.416666666666664,2025-05-26 03:19:12.957780,2025-05-26 03:19:19.666439,0 days 00:00:06.708659,Adam,0.4565113141987803,,0.00012521386847054688,,,,,3,,0.02132886260652872,,,PRUNED
953,953,35.416666666666664,2025-05-26 03:19:19.715627,2025-05-26 03:19:26.338821,0 days 00:00:06.623194,Adam,0.2187618595644905,,0.00011030734833227703,,,,,2,,0.0344235310300369,,,PRUNED
954,954,33.333333333333336,2025-05-26 03:19:26.387749,2025-05-26 03:19:33.005781,0 days 00:00:06.618032,Adam,0.14828094986478452,,5.4958560402902704e-05,,,,,2,,0.026440994434461164,,,PRUNED
955,955,33.333333333333336,2025-05-26 03:19:33.054286,2025-05-26 03:19:39.700881,0 days 00:00:06.646595,Adam,0.16636385476299273,,0.00015164048602366265,,,,,0,,0.012661202689924385,,,PRUNED
956,956,33.333333333333336,2025-05-26 03:19:39.749577,2025-05-26 03:19:46.297742,0 days 00:00:06.548165,Adam,0.1058551631194932,,8.920837592217161e-05,,,,,4,,0.01709885690938521,,,PRUNED
957,957,33.333333333333336,2025-05-26 03:19:46.346719,2025-05-26 03:19:53.075195,0 days 00:00:06.728476,Adam,0.1335149141714903,,7.374013537372527e-05,,,,,1,,0.04754734866526336,,,PRUNED
958,958,33.333333333333336,2025-05-26 03:19:53.126920,2025-05-26 03:19:59.763571,0 days 00:00:06.636651,Adam,0.08627378474433496,,0.00010504113095736435,,,,,1,,0.02107622009094177,,,PRUNED
959,959,60.416666666666664,2025-05-26 03:19:59.812696,2025-05-26 03:20:14.798865,0 days 00:00:14.986169,Adam,0.18303863413891844,,0.0001810081458514328,,,,,2,,0.08900287536595433,,,COMPLETE
960,960,37.5,2025-05-26 03:20:14.861429,2025-05-26 03:20:21.505214,0 days 00:00:06.643785,Adam,0.15246979456869333,,0.00012400400254156476,,,,,0,,0.029733377684613392,,,PRUNED
961,961,35.416666666666664,2025-05-26 03:20:21.555151,2025-05-26 03:20:29.870069,0 days 00:00:08.314918,Adam,0.11822088125006967,,6.334609270742023e-05,,,,,3,,0.01149251534820562,,,PRUNED
962,962,33.333333333333336,2025-05-26 03:20:29.919839,2025-05-26 03:20:36.528698,0 days 00:00:06.608859,Adam,0.1422487372022526,,4.6712520217699047e-05,,,,,3,,0.024076182327727444,,,PRUNED
963,963,33.333333333333336,2025-05-26 03:20:36.578508,2025-05-26 03:20:43.255770,0 days 00:00:06.677262,Adam,0.16299092381699892,,0.00014206275203025953,,,,,1,,0.01731724501596151,,,PRUNED
964,964,31.25,2025-05-26 03:20:43.305780,2025-05-26 03:20:49.982184,0 days 00:00:06.676404,Adam,0.13457363932699914,,9.073914647136175e-05,,,,,2,,0.03914147719119089,,,PRUNED
965,965,33.333333333333336,2025-05-26 03:20:50.032430,2025-05-26 03:20:56.680815,0 days 00:00:06.648385,Adam,0.1564178377501383,,0.00021355117003797383,,,,,0,,6.318237856027464,,,PRUNED
966,966,52.083333333333336,2025-05-26 03:20:56.730393,2025-05-26 03:21:11.692701,0 days 00:00:14.962308,Adam,0.12373114400305671,,0.00010381826772398269,,,,,4,,0.014210217544821374,,,COMPLETE
967,967,35.416666666666664,2025-05-26 03:21:11.754538,2025-05-26 03:21:18.399113,0 days 00:00:06.644575,Adam,0.1462869192102646,,7.643709515440294e-05,,,,,2,,0.031725381281485075,,,PRUNED
968,968,33.333333333333336,2025-05-26 03:21:18.448458,2025-05-26 03:21:25.116773,0 days 00:00:06.668315,Adam,0.17202013017832193,,0.00016441121319880848,,,,,1,,0.021067774016176644,,,PRUNED
969,969,33.333333333333336,2025-05-26 03:21:25.166706,2025-05-26 03:21:32.081547,0 days 00:00:06.914841,Adam,0.11289827211401676,,0.0001330560081935837,,,,,3,,0.025861683481524816,,,PRUNED
970,970,,2025-05-26 03:21:32.130712,2025-05-26 03:21:37.939292,0 days 00:00:05.808580,SGD,0.13515249658789896,,,,0.00037464973788976677,84.66164659819938,True,2,,,,13.44476082107359,PRUNED
971,971,33.333333333333336,2025-05-26 03:21:37.988186,2025-05-26 03:21:44.524824,0 days 00:00:06.536638,Adam,0.16153013046998002,,0.00011147181750823545,,,,,1,,0.01824322654629092,,,PRUNED
972,972,33.333333333333336,2025-05-26 03:21:44.574404,2025-05-26 03:21:51.265907,0 days 00:00:06.691503,Adadelta,0.1477937699208708,0.06817856168693208,,,,,,2,55.473634504418136,,,,PRUNED
973,973,58.333333333333336,2025-05-26 03:21:51.315012,2025-05-26 03:22:06.307585,0 days 00:00:14.992573,Adam,0.12618540149821064,,8.642340759464342e-05,,,,,0,,0.014484828521071108,,,COMPLETE
974,974,33.333333333333336,2025-05-26 03:22:06.370203,2025-05-26 03:22:13.008828,0 days 00:00:06.638625,Adam,0.36007812794002586,,6.156837317727689e-05,,,,,3,,0.010250876555367036,,,PRUNED
975,975,35.416666666666664,2025-05-26 03:22:13.057922,2025-05-26 03:22:19.712080,0 days 00:00:06.654158,Adam,0.19994082033601926,,0.00017509725622459008,,,,,1,,0.03336413188363835,,,PRUNED
976,976,33.333333333333336,2025-05-26 03:22:19.761569,2025-05-26 03:22:26.398877,0 days 00:00:06.637308,Adam,0.1376537351491781,,0.0001366181302588404,,,,,2,,0.02339512368172907,,,PRUNED
977,977,33.333333333333336,2025-05-26 03:22:26.447387,2025-05-26 03:22:32.941025,0 days 00:00:06.493638,Adam,0.1791896083800345,,9.958452200010342e-05,,,,,4,,0.019140556970981146,,,PRUNED
978,978,29.166666666666668,2025-05-26 03:22:32.990013,2025-05-26 03:22:39.268051,0 days 00:00:06.278038,Adam,0.10131359108438046,,0.00023986602082318173,,,,,14,,0.041438837704935345,,,PRUNED
979,979,31.25,2025-05-26 03:22:39.314438,2025-05-26 03:22:49.332059,0 days 00:00:10.017621,Adam,0.1536888706049577,,0.00011554141753598991,,,,,3,,0.39431435469076753,,,PRUNED
980,980,54.166666666666664,2025-05-26 03:22:49.381844,2025-05-26 03:23:04.403164,0 days 00:00:15.021320,Adam,0.16576704109226387,,7.253956817062996e-05,,,,,0,,0.014873104341896532,,,COMPLETE
981,981,22.916666666666668,2025-05-26 03:23:04.465016,2025-05-26 03:23:11.124059,0 days 00:00:06.659043,Adam,0.14421844069805015,,0.0001430406612380282,,,,,1,,56.788189619324704,,,PRUNED
982,982,35.416666666666664,2025-05-26 03:23:11.172844,2025-05-26 03:23:17.797503,0 days 00:00:06.624659,Adam,0.07182855764124096,,8.676432085683486e-05,,,,,2,,0.03008103650696024,,,PRUNED
983,983,33.333333333333336,2025-05-26 03:23:17.847866,2025-05-26 03:23:24.186310,0 days 00:00:06.338444,Adam,0.12911082382737046,,0.00012208654366911516,,,,,7,,0.025387712712262967,,,PRUNED
984,984,45.833333333333336,2025-05-26 03:23:24.234488,2025-05-26 03:23:39.221322,0 days 00:00:14.986834,Adam,0.15757522303374238,,0.00019944255120001942,,,,,1,,0.018022659487892594,,,COMPLETE
985,985,33.333333333333336,2025-05-26 03:23:39.282623,2025-05-26 03:23:45.953636,0 days 00:00:06.671013,Adam,0.11681304966202634,,9.802827448009717e-05,,,,,3,,0.012986297967683906,,,PRUNED
986,986,27.083333333333332,2025-05-26 03:23:46.004404,2025-05-26 03:23:52.691647,0 days 00:00:06.687243,Adam,0.13932935377187303,,5.14430161906566e-05,,,,,4,,0.06624035777356944,,,PRUNED
987,987,33.333333333333336,2025-05-26 03:23:52.742036,2025-05-26 03:23:59.019921,0 days 00:00:06.277885,Adam,0.17089508202113485,,0.00016024181830621368,,,,,19,,0.03571176067717031,,,PRUNED
988,988,33.333333333333336,2025-05-26 03:23:59.066319,2025-05-26 03:24:05.711895,0 days 00:00:06.645576,Adam,0.1500815414908718,,7.495048169572625e-05,,,,,2,,0.051059099541320166,,,PRUNED
989,989,33.333333333333336,2025-05-26 03:24:05.760377,2025-05-26 03:24:12.349917,0 days 00:00:06.589540,Adam,0.12227659075077722,,0.00011292552348579302,,,,,1,,0.02091765205378846,,,PRUNED
990,990,33.333333333333336,2025-05-26 03:24:12.399036,2025-05-26 03:24:19.109565,0 days 00:00:06.710529,Adam,0.13454779843812215,,0.06588569665648893,,,,,0,,0.02569687181044559,,,PRUNED
991,991,33.333333333333336,2025-05-26 03:24:19.158525,2025-05-26 03:24:25.721173,0 days 00:00:06.562648,Adam,0.10819889682958331,,6.539269462277252e-05,,,,,3,,0.029538088752029647,,,PRUNED
992,992,29.166666666666668,2025-05-26 03:24:25.770320,2025-05-26 03:24:32.639268,0 days 00:00:06.868948,AdamW,0.1857953923636433,,,4.962802102507297e-05,,,,2,,,0.004015916828184064,,PRUNED
993,993,,2025-05-26 03:24:32.688493,2025-05-26 03:24:39.252909,0 days 00:00:06.564416,SGD,0.1612836252484702,,,,0.007485003290233643,7.355346147945411,False,1,,,,0.010482808317869848,PRUNED
994,994,33.333333333333336,2025-05-26 03:24:39.299729,2025-05-26 03:24:45.893174,0 days 00:00:06.593445,Adam,0.14577544489335084,,0.00014079674010316237,,,,,0,,0.016427623576874554,,,PRUNED
995,995,33.333333333333336,2025-05-26 03:24:45.941922,2025-05-26 03:24:52.270711,0 days 00:00:06.328789,Adam,0.1294350540301608,,9.162150106849709e-05,,,,,22,,0.011827682120956867,,,PRUNED
996,996,37.5,2025-05-26 03:24:52.316486,2025-05-26 03:24:58.524123,0 days 00:00:06.207637,Adadelta,0.15486020929673766,0.13294712959352945,,,,,,15,32.22056575150371,,,,PRUNED
997,997,33.333333333333336,2025-05-26 03:24:58.570139,2025-05-26 03:25:05.234076,0 days 00:00:06.663937,Adam,0.14094713903844566,,8.055391842224108e-05,,,,,1,,0.02143744451556575,,,PRUNED
998,998,45.833333333333336,2025-05-26 03:25:05.282625,2025-05-26 03:25:20.257856,0 days 00:00:14.975231,Adam,0.09843826094309664,,0.000353043162409175,,,,,3,,0.014824066815619054,,,COMPLETE
999,999,47.916666666666664,2025-05-26 03:25:20.319812,2025-05-26 03:25:35.274437,0 days 00:00:14.954625,Adam,0.17469835881850188,,0.00011675929643335406,,,,,2,,0.03974243668983262,,,COMPLETE
