,number,value,datetime_start,datetime_complete,duration,params_algorithm,params_dropout_rate,params_lr_Adadelta,params_lr_Adam,params_lr_AdamW,params_lr_SGD,params_momentum_SGD,params_nesterov_SGD,params_suggested_freeze,params_weight_decay_Adadelta,params_weight_decay_Adam,params_weight_decay_AdamW,params_weight_decay_SGD,state
573,573,35.416666666666664,2025-05-25 06:29:43.607516,2025-05-25 06:29:50.180795,0 days 00:00:06.573279,AdamW,0.48630832426862697,,,0.00022992869048308584,,,,3,,,0.0008338828016823576,,PRUNED
574,574,54.166666666666664,2025-05-25 06:29:50.225166,2025-05-25 06:30:00.335389,0 days 00:00:10.110223,AdamW,0.3478064313164527,,,0.00013658880326291662,,,,5,,,0.0019289196977224203,,COMPLETE
575,575,,2025-05-25 06:30:00.375155,2025-05-25 06:30:03.184038,0 days 00:00:02.808883,SGD,0.3824373571693481,,,,5.976073878136609e-05,30.788157300302725,True,6,,,,0.4257776428756822,PRUNED
576,576,33.333333333333336,2025-05-25 06:30:03.213492,2025-05-25 06:30:06.116503,0 days 00:00:02.903011,AdamW,0.4122160355698564,,,0.00010501168712374594,,,,4,,,0.0014678104141131307,,PRUNED
577,577,33.333333333333336,2025-05-25 06:30:06.148747,2025-05-25 06:30:10.173979,0 days 00:00:04.025232,Adam,0.430082588505813,,0.09358504428941891,,,,,3,,0.14030783708949424,,,PRUNED
578,578,41.666666666666664,2025-05-25 06:30:10.205338,2025-05-25 06:30:17.955205,0 days 00:00:07.749867,AdamW,0.39771130528557036,,,0.00018866866233922797,,,,7,,,0.0020960831153504973,,PRUNED
579,579,37.5,2025-05-25 06:30:17.994675,2025-05-25 06:30:24.594360,0 days 00:00:06.599685,AdamW,0.37591992663304197,,,6.656835661029467e-05,,,,5,,,0.0013222301376422452,,PRUNED
580,580,33.333333333333336,2025-05-25 06:30:24.633178,2025-05-25 06:30:31.111465,0 days 00:00:06.478287,AdamW,0.3291846281070318,,,0.0003201522655675031,,,,6,,,0.0011416790877309328,,PRUNED
581,581,33.333333333333336,2025-05-25 06:30:31.158665,2025-05-25 06:30:37.725156,0 days 00:00:06.566491,AdamW,0.36391635190545857,,,0.00015936626913085387,,,,2,,,0.0007262087064129025,,PRUNED
582,582,33.333333333333336,2025-05-25 06:30:37.770094,2025-05-25 06:30:44.372736,0 days 00:00:06.602642,AdamW,0.4451171843970197,,,9.718598426856863e-05,,,,4,,,0.002375403054507398,,PRUNED
583,583,39.583333333333336,2025-05-25 06:30:44.418934,2025-05-25 06:30:52.796501,0 days 00:00:08.377567,AdamW,0.384937484785853,,,0.00012369668968003925,,,,3,,,0.0008909438938964383,,PRUNED
584,584,33.333333333333336,2025-05-25 06:30:52.835105,2025-05-25 06:30:59.443077,0 days 00:00:06.607972,AdamW,0.42051793045232494,,,7.929447445970085e-05,,,,1,,,0.0005657125693916882,,PRUNED
585,585,33.333333333333336,2025-05-25 06:30:59.485052,2025-05-25 06:31:06.022591,0 days 00:00:06.537539,AdamW,0.39666676051707833,,,1.3270620128969114e-05,,,,5,,,0.001755621389017989,,PRUNED
586,586,33.333333333333336,2025-05-25 06:31:06.066762,2025-05-25 06:31:12.517786,0 days 00:00:06.451024,Adadelta,0.3549433957852586,0.017663078086514895,,,,,,6,0.7868220170683607,,,,PRUNED
587,587,33.333333333333336,2025-05-25 06:31:12.560881,2025-05-25 06:31:19.141745,0 days 00:00:06.580864,AdamW,0.4070424789737577,,,3.421824545815253e-05,,,,4,,,0.0012502209564802576,,PRUNED
588,588,31.25,2025-05-25 06:31:19.186374,2025-05-25 06:31:25.549082,0 days 00:00:06.362708,AdamW,0.39020773300226197,,,0.0002275298542957475,,,,7,,,0.001563274653244962,,PRUNED
589,589,35.416666666666664,2025-05-25 06:31:25.591484,2025-05-25 06:31:32.427729,0 days 00:00:06.836245,AdamW,0.37147632834347916,,,4.22813662700245e-05,,,,2,,,0.003024829599717412,,PRUNED
590,590,37.5,2025-05-25 06:31:32.472339,2025-05-25 06:31:40.684956,0 days 00:00:08.212617,AdamW,0.37944372527151143,,,5.9771573166363656e-05,,,,4,,,0.0010177628827803137,,PRUNED
591,591,47.916666666666664,2025-05-25 06:31:40.724049,2025-05-25 06:31:54.243562,0 days 00:00:13.519513,AdamW,0.34193936251259294,,,0.00016281743999916004,,,,6,,,0.0013680503475024602,,COMPLETE
592,592,31.25,2025-05-25 06:31:54.300402,2025-05-25 06:32:00.869563,0 days 00:00:06.569161,AdamW,0.4270685919109691,,,0.00012112788093892988,,,,3,,,0.0011364100502772895,,PRUNED
593,593,33.333333333333336,2025-05-25 06:32:00.914255,2025-05-25 06:32:07.236034,0 days 00:00:06.321779,AdamW,0.4140716167296191,,,1.7002648821892376e-05,,,,7,,,0.0026425091583504776,,PRUNED
594,594,33.333333333333336,2025-05-25 06:32:07.279136,2025-05-25 06:32:13.782379,0 days 00:00:06.503243,AdamW,0.3904606870840474,,,0.00020116884606427004,,,,5,,,0.002151915217868058,,PRUNED
595,595,33.333333333333336,2025-05-25 06:32:13.826540,2025-05-25 06:32:20.406503,0 days 00:00:06.579963,AdamW,0.362566339125896,,,7.064469541857504e-05,,,,2,,,0.0018917717590888968,,PRUNED
596,596,33.333333333333336,2025-05-25 06:32:20.451256,2025-05-25 06:32:27.045374,0 days 00:00:06.594118,AdamW,0.40184824865587854,,,9.391773417060692e-05,,,,5,,,0.0009481045965972339,,PRUNED
597,597,64.58333333333333,2025-05-25 06:32:27.089967,2025-05-25 06:32:41.902848,0 days 00:00:14.812881,AdamW,0.37388803638635504,,,0.00013718972551403662,,,,4,,,0.0016933917791086234,,COMPLETE
598,598,35.416666666666664,2025-05-25 06:32:41.959566,2025-05-25 06:32:48.521639,0 days 00:00:06.562073,AdamW,0.3699636680904463,,,0.00013972405947551108,,,,4,,,0.001843209018603224,,PRUNED
599,599,31.25,2025-05-25 06:32:48.566525,2025-05-25 06:32:55.251824,0 days 00:00:06.685299,Adadelta,0.3505913035515396,0.07877642571761037,,,,,,4,0.49133044937672016,,,,PRUNED
600,600,52.083333333333336,2025-05-25 06:32:55.296077,2025-05-25 06:33:10.149088,0 days 00:00:14.853011,AdamW,0.3608010650827773,,,8.638542125531022e-05,,,,3,,,0.0015712153759717383,,COMPLETE
601,601,35.416666666666664,2025-05-25 06:33:10.224817,2025-05-25 06:33:16.288914,0 days 00:00:06.064097,Adam,0.34732959868595514,,3.802430436762175e-05,,,,,3,,0.04398603627680036,,,PRUNED
602,602,33.333333333333336,2025-05-25 06:33:16.330848,2025-05-25 06:33:22.368989,0 days 00:00:06.038141,SGD,0.38222014959275047,,,,1.0192771632582076e-05,2.1694572128887373,True,4,,,,0.1361905869731148,PRUNED
603,603,31.25,2025-05-25 06:33:22.413254,2025-05-25 06:33:28.941607,0 days 00:00:06.528353,AdamW,0.37245919931564786,,,0.00011992321760381458,,,,5,,,0.0017466452635482238,,PRUNED
604,604,33.333333333333336,2025-05-25 06:33:28.987578,2025-05-25 06:33:32.188916,0 days 00:00:03.201338,AdamW,0.40394194554039153,,,0.00010876982297561919,,,,2,,,0.0020033210757177903,,PRUNED
605,605,52.083333333333336,2025-05-25 06:33:32.216532,2025-05-25 06:33:44.511587,0 days 00:00:12.295055,AdamW,0.3939545612788575,,,0.00014353043849647045,,,,4,,,0.00226460117801386,,COMPLETE
606,606,33.333333333333336,2025-05-25 06:33:44.568433,2025-05-25 06:33:50.979868,0 days 00:00:06.411435,AdamW,0.33329769786999836,,,5.919532000705495e-05,,,,3,,,0.0015649279229193415,,PRUNED
607,607,54.166666666666664,2025-05-25 06:33:51.021544,2025-05-25 06:34:03.244933,0 days 00:00:12.223389,AdamW,0.41327054799388024,,,7.650495506936269e-05,,,,5,,,0.0016897570373327953,,COMPLETE
608,608,41.666666666666664,2025-05-25 06:34:03.302429,2025-05-25 06:34:15.480536,0 days 00:00:12.178107,AdamW,0.4267548915493661,,,0.00025529957736921744,,,,4,,,0.001988409362018205,,COMPLETE
609,609,33.333333333333336,2025-05-25 06:34:15.537114,2025-05-25 06:34:22.203471,0 days 00:00:06.666357,AdamW,0.35769558883608993,,,0.0306596614348069,,,,3,,,0.002518607890639442,,PRUNED
610,610,47.916666666666664,2025-05-25 06:34:22.252004,2025-05-25 06:34:32.460211,0 days 00:00:10.208207,AdamW,0.3817450889044605,,,9.973762154566918e-05,,,,1,,,0.00022785297932009714,,PRUNED
611,611,39.583333333333336,2025-05-25 06:34:32.491180,2025-05-25 06:34:38.697541,0 days 00:00:06.206361,AdamW,0.37172594209010806,,,5.3243874089303194e-05,,,,4,,,0.0014772114468212865,,PRUNED
612,612,33.333333333333336,2025-05-25 06:34:38.744720,2025-05-25 06:34:45.258116,0 days 00:00:06.513396,AdamW,0.392026121744776,,,0.08577929359423592,,,,5,,,0.0016906317215403784,,PRUNED
613,613,33.333333333333336,2025-05-25 06:34:45.303038,2025-05-25 06:34:51.036638,0 days 00:00:05.733600,Adadelta,0.4422684305342779,3.557838576969118,,,,,,2,0.031900005822479094,,,,PRUNED
614,614,50.0,2025-05-25 06:34:51.067428,2025-05-25 06:35:04.570465,0 days 00:00:13.503037,AdamW,0.40438879738427547,,,0.00016007453550781852,,,,0,,,0.00347817961420045,,COMPLETE
615,615,31.25,2025-05-25 06:35:04.627383,2025-05-25 06:35:10.571341,0 days 00:00:05.943958,AdamW,0.3652484882323219,,,0.0004620654305489334,,,,3,,,0.002252517984941296,,PRUNED
616,616,37.5,2025-05-25 06:35:10.614899,2025-05-25 06:35:15.015056,0 days 00:00:04.400157,AdamW,0.4205175079565482,,,0.00018476685410466509,,,,6,,,0.0018308927480640315,,PRUNED
617,617,33.333333333333336,2025-05-25 06:35:15.055644,2025-05-25 06:35:19.997785,0 days 00:00:04.942141,AdamW,0.3164499922590888,,,0.00012624117937050608,,,,4,,,0.0014335973909956493,,PRUNED
618,618,37.5,2025-05-25 06:35:20.039087,2025-05-25 06:35:24.551226,0 days 00:00:04.512139,AdamW,0.3439098987401788,,,6.984628626427529e-05,,,,30,,,0.0020327090017280497,,PRUNED
619,619,35.416666666666664,2025-05-25 06:35:24.580367,2025-05-25 06:35:27.516203,0 days 00:00:02.935836,AdamW,0.3841247704163026,,,0.0014950574359928746,,,,5,,,0.0007910693209395132,,PRUNED
620,620,35.416666666666664,2025-05-25 06:35:27.559950,2025-05-25 06:35:31.479835,0 days 00:00:03.919885,AdamW,0.35430740852370973,,,9.140759937814465e-05,,,,5,,,0.002430965431668598,,PRUNED
621,621,37.5,2025-05-25 06:35:31.510500,2025-05-25 06:35:34.421618,0 days 00:00:02.911118,AdamW,0.3979244008547418,,,0.00014563938759342841,,,,3,,,0.0016391383568142195,,PRUNED
622,622,35.416666666666664,2025-05-25 06:35:34.452373,2025-05-25 06:35:39.046326,0 days 00:00:04.593953,AdamW,0.3758005213552397,,,0.0002938964025413757,,,,1,,,0.0013264470290052647,,PRUNED
623,623,33.333333333333336,2025-05-25 06:35:39.077261,2025-05-25 06:35:42.144619,0 days 00:00:03.067358,AdamW,0.4152899125850938,,,0.0002121402365578829,,,,4,,,0.0027790726161397664,,PRUNED
624,624,,2025-05-25 06:35:42.175475,2025-05-25 06:35:45.482035,0 days 00:00:03.306560,SGD,0.3884704504785199,,,,0.00692240160308303,57.45868782727264,False,2,,,,0.032227239086775446,PRUNED
625,625,33.333333333333336,2025-05-25 06:35:45.511370,2025-05-25 06:35:49.340882,0 days 00:00:03.829512,Adam,0.36478664868354027,,0.037197538775758016,,,,,6,,5.1708186706832056,,,PRUNED
626,626,37.5,2025-05-25 06:35:49.384122,2025-05-25 06:35:55.652607,0 days 00:00:06.268485,AdamW,0.4052655118409252,,,4.033394075493989e-05,,,,20,,,0.0009052741307394838,,PRUNED
627,627,35.416666666666664,2025-05-25 06:35:55.694541,2025-05-25 06:36:02.225415,0 days 00:00:06.530874,AdamW,0.37870877382577195,,,4.864615287457586e-05,,,,5,,,0.0010347996048551608,,PRUNED
628,628,33.333333333333336,2025-05-25 06:36:02.270796,2025-05-25 06:36:08.547455,0 days 00:00:06.276659,Adadelta,0.43043189077808014,8.615422546359158,,,,,,4,5.644172419494716,,,,PRUNED
629,629,25.0,2025-05-25 06:36:08.588755,2025-05-25 06:36:13.108722,0 days 00:00:04.519967,AdamW,0.3918462488924503,,,8.052659821104965e-05,,,,13,,,0.00034762859105623027,,PRUNED
630,630,33.333333333333336,2025-05-25 06:36:13.147516,2025-05-25 06:36:17.555063,0 days 00:00:04.407547,AdamW,0.35488633301994493,,,0.00010982001047518213,,,,3,,,0.002155083251712652,,PRUNED
631,631,41.666666666666664,2025-05-25 06:36:17.585949,2025-05-25 06:36:25.618326,0 days 00:00:08.032377,AdamW,0.4115430932555246,,,0.0001645494018495924,,,,5,,,0.0014604391244961855,,PRUNED
632,632,37.5,2025-05-25 06:36:25.665286,2025-05-25 06:36:33.584194,0 days 00:00:07.918908,AdamW,0.3686498043355139,,,0.0003551269334021021,,,,6,,,0.001209567214541022,,PRUNED
633,633,33.333333333333336,2025-05-25 06:36:33.628108,2025-05-25 06:36:40.232317,0 days 00:00:06.604209,AdamW,0.02578659037219222,,,0.010118722177973787,,,,2,,,0.001852391470280983,,PRUNED
634,634,56.25,2025-05-25 06:36:40.277360,2025-05-25 06:36:55.198751,0 days 00:00:14.921391,AdamW,0.4002560165467241,,,0.0002456387791678412,,,,3,,,0.0010859381357867291,,COMPLETE
635,635,45.833333333333336,2025-05-25 06:36:55.256650,2025-05-25 06:37:06.789904,0 days 00:00:11.533254,AdamW,0.33488465914158894,,,6.653760935317645e-05,,,,4,,,0.001567426009041732,,PRUNED
636,636,43.75,2025-05-25 06:37:06.835905,2025-05-25 06:37:21.220368,0 days 00:00:14.384463,AdamW,0.37810261796991784,,,0.00018656467042689302,,,,1,,,0.0013672197400182338,,COMPLETE
637,637,31.25,2025-05-25 06:37:21.278662,2025-05-25 06:37:27.809677,0 days 00:00:06.531015,AdamW,0.38777486187763577,,,0.0001303859061041713,,,,6,,,0.001720056556287736,,PRUNED
638,638,37.5,2025-05-25 06:37:27.853481,2025-05-25 06:37:34.432761,0 days 00:00:06.579280,AdamW,0.3487691978965474,,,9.241956552580907e-05,,,,4,,,0.002486800087833066,,PRUNED
639,639,37.5,2025-05-25 06:37:34.479923,2025-05-25 06:37:40.888951,0 days 00:00:06.409028,AdamW,0.4234815302353603,,,5.350834255399025e-05,,,,5,,,0.002046061108294298,,PRUNED
640,640,33.333333333333336,2025-05-25 06:37:40.930119,2025-05-25 06:37:45.028619,0 days 00:00:04.098500,Adadelta,0.30598553535201606,0.5963812310142731,,,,,,3,0.1366548655950533,,,,PRUNED
641,641,35.416666666666664,2025-05-25 06:37:45.073248,2025-05-25 06:37:51.620488,0 days 00:00:06.547240,AdamW,0.36417464927200416,,,0.00011016905225508758,,,,5,,,0.0009645547751661588,,PRUNED
642,642,35.416666666666664,2025-05-25 06:37:51.665794,2025-05-25 06:37:57.868757,0 days 00:00:06.202963,AdamW,0.4095103611450537,,,0.00020692738474239583,,,,22,,,0.0011665428340786603,,PRUNED
643,643,37.5,2025-05-25 06:37:57.911044,2025-05-25 06:38:03.676751,0 days 00:00:05.765707,AdamW,0.20637483449316213,,,7.673682629063679e-05,,,,4,,,0.002227100132994283,,PRUNED
644,644,37.5,2025-05-25 06:38:03.721785,2025-05-25 06:38:10.139716,0 days 00:00:06.417931,AdamW,0.3967546757258609,,,0.00014832276711415876,,,,6,,,0.0014196498148275794,,PRUNED
645,645,50.0,2025-05-25 06:38:10.183738,2025-05-25 06:38:23.721346,0 days 00:00:13.537608,AdamW,0.3726863133881845,,,0.0001700540056488855,,,,1,,,0.0012499583314178326,,COMPLETE
646,646,31.25,2025-05-25 06:38:23.779442,2025-05-25 06:38:30.541788,0 days 00:00:06.762346,AdamW,0.3835545289259519,,,6.207344951030932e-05,,,,2,,,0.0018502087024804615,,PRUNED
647,647,33.333333333333336,2025-05-25 06:38:30.589917,2025-05-25 06:38:37.151556,0 days 00:00:06.561639,AdamW,0.43657502393730124,,,0.00025488034355994864,,,,4,,,0.0008859515484105658,,PRUNED
648,648,,2025-05-25 06:38:37.197611,2025-05-25 06:38:42.027742,0 days 00:00:04.830131,SGD,0.26021705716331484,,,,0.0001863454308790785,91.43460741626899,True,6,,,,7.742760974029206,PRUNED
649,649,47.916666666666664,2025-05-25 06:38:42.067400,2025-05-25 06:38:53.437873,0 days 00:00:11.370473,AdamW,0.35775068145358524,,,0.00012233707338560267,,,,3,,,0.001041504013412417,,COMPLETE
650,650,29.166666666666668,2025-05-25 06:38:53.495329,2025-05-25 06:39:00.082534,0 days 00:00:06.587205,Adam,0.4180407225248085,,0.000803644580420055,,,,,3,,50.12976204198712,,,PRUNED
651,651,47.916666666666664,2025-05-25 06:39:00.127643,2025-05-25 06:39:14.425937,0 days 00:00:14.298294,AdamW,0.4014095818675588,,,9.753811031099431e-05,,,,5,,,0.0016519232095835625,,COMPLETE
652,652,33.333333333333336,2025-05-25 06:39:14.483958,2025-05-25 06:39:20.525181,0 days 00:00:06.041223,AdamW,0.3888556666064513,,,0.00022534831442276828,,,,5,,,0.0012720967838372218,,PRUNED
653,653,58.333333333333336,2025-05-25 06:39:20.567762,2025-05-25 06:39:32.403044,0 days 00:00:11.835282,AdamW,0.49182846373286276,,,8.023140702255223e-05,,,,6,,,0.002984804581601578,,COMPLETE
654,654,33.333333333333336,2025-05-25 06:39:32.461670,2025-05-25 06:39:38.953492,0 days 00:00:06.491822,Adadelta,0.239691169616216,33.77274086001071,,,,,,2,0.01558398597623401,,,,PRUNED
655,655,33.333333333333336,2025-05-25 06:39:38.995524,2025-05-25 06:39:44.052505,0 days 00:00:05.056981,AdamW,0.3419642323286235,,,4.6377177232049146e-05,,,,4,,,0.0015352236684698342,,PRUNED
656,656,52.083333333333336,2025-05-25 06:39:44.098480,2025-05-25 06:39:58.097161,0 days 00:00:13.998681,AdamW,0.37551315313023037,,,0.0003182692991774361,,,,5,,,0.0026490757960665454,,COMPLETE
657,657,54.166666666666664,2025-05-25 06:39:58.151780,2025-05-25 06:40:11.222366,0 days 00:00:13.070586,AdamW,0.3636924679843405,,,0.00018142217598847882,,,,0,,,0.002356574679697091,,COMPLETE
658,658,41.666666666666664,2025-05-25 06:40:11.280589,2025-05-25 06:40:21.247141,0 days 00:00:09.966552,AdamW,0.40922615363450554,,,0.00014123535326429447,,,,2,,,0.0011112374474033188,,PRUNED
659,659,58.333333333333336,2025-05-25 06:40:21.293774,2025-05-25 06:40:36.264647,0 days 00:00:14.970873,AdamW,0.39500506317003686,,,0.00011214423385339054,,,,4,,,0.0020071318504450305,,COMPLETE
660,660,35.416666666666664,2025-05-25 06:40:36.323224,2025-05-25 06:40:42.906398,0 days 00:00:06.583174,AdamW,0.1068622432016636,,,7.047764517118801e-05,,,,3,,,0.000827859066880543,,PRUNED
661,661,31.25,2025-05-25 06:40:42.952619,2025-05-25 06:40:49.268870,0 days 00:00:06.316251,AdamW,0.45189156147482334,,,0.00028448199455333173,,,,7,,,0.0013806806138292472,,PRUNED
662,662,33.333333333333336,2025-05-25 06:40:49.312756,2025-05-25 06:40:56.013764,0 days 00:00:06.701008,AdamW,0.3507410384883898,,,3.337878163989677e-05,,,,6,,,0.0016965946530177471,,PRUNED
663,663,33.333333333333336,2025-05-25 06:40:56.059352,2025-05-25 06:41:02.624630,0 days 00:00:06.565278,AdamW,0.3805011486233613,,,0.00016417408758115801,,,,4,,,0.0011715712200417033,,PRUNED
664,664,33.333333333333336,2025-05-25 06:41:02.670388,2025-05-25 06:41:09.136682,0 days 00:00:06.466294,AdamW,0.36618552419246986,,,5.6963553060876776e-05,,,,5,,,0.0009787616582874906,,PRUNED
665,665,33.333333333333336,2025-05-25 06:41:09.177019,2025-05-25 06:41:14.993765,0 days 00:00:05.816746,AdamW,0.41793032464566593,,,9.129729975120304e-05,,,,3,,,0.0022139190865325758,,PRUNED
666,666,31.25,2025-05-25 06:41:15.039445,2025-05-25 06:41:21.693215,0 days 00:00:06.653770,AdamW,0.4017700651848749,,,0.0008686018901720079,,,,1,,,0.0019224117195737252,,PRUNED
667,667,33.333333333333336,2025-05-25 06:41:21.738774,2025-05-25 06:41:28.051978,0 days 00:00:06.313204,Adadelta,0.3869464775106953,0.03867446304326178,,,,,,7,0.010218066498833497,,,,PRUNED
668,668,41.666666666666664,2025-05-25 06:41:28.100041,2025-05-25 06:41:40.006664,0 days 00:00:11.906623,AdamW,0.36961086801918674,,,0.0002113339554247691,,,,5,,,0.0015212989946791738,,COMPLETE
669,669,31.25,2025-05-25 06:41:40.048269,2025-05-25 06:41:42.898413,0 days 00:00:02.850144,AdamW,0.4261406278268844,,,0.00014162950100508203,,,,6,,,0.0012679215768087856,,PRUNED
670,670,43.75,2025-05-25 06:41:42.929046,2025-05-25 06:41:47.737360,0 days 00:00:04.808314,AdamW,0.35840452953855695,,,0.00039620156949703866,,,,4,,,0.0013515761260473192,,PRUNED
671,671,33.333333333333336,2025-05-25 06:41:47.782219,2025-05-25 06:41:52.967657,0 days 00:00:05.185438,AdamW,0.32338236403650206,,,0.00011625138889064573,,,,2,,,0.001772915773719763,,PRUNED
672,672,37.5,2025-05-25 06:41:53.013476,2025-05-25 06:41:59.392864,0 days 00:00:06.379388,AdamW,0.37436548861026314,,,8.135329804991723e-05,,,,3,,,0.001034890595080416,,PRUNED
673,673,,2025-05-25 06:41:59.438953,2025-05-25 06:42:06.051578,0 days 00:00:06.612625,SGD,0.4081866569636427,,,,3.6882549225456235e-05,8.32979718664587,False,3,,,,41.00001131221489,PRUNED
674,674,33.333333333333336,2025-05-25 06:42:06.097664,2025-05-25 06:42:12.429616,0 days 00:00:06.331952,Adam,0.3882560027503116,,0.001580958095287577,,,,,4,,0.554595517567617,,,PRUNED
675,675,33.333333333333336,2025-05-25 06:42:12.473077,2025-05-25 06:42:16.799674,0 days 00:00:04.326597,AdamW,0.3989153244562492,,,0.00019323087041598518,,,,5,,,0.002429251968639638,,PRUNED
676,676,33.333333333333336,2025-05-25 06:42:16.843544,2025-05-25 06:42:21.528756,0 days 00:00:04.685212,AdamW,0.28172059733380517,,,6.748643050290618e-05,,,,7,,,0.000755625060301449,,PRUNED
677,677,33.333333333333336,2025-05-25 06:42:21.598271,2025-05-25 06:42:28.122399,0 days 00:00:06.524128,AdamW,0.43541267168905357,,,0.00010264513416800726,,,,5,,,0.0014819298200793535,,PRUNED
678,678,47.916666666666664,2025-05-25 06:42:28.168746,2025-05-25 06:42:43.070075,0 days 00:00:14.901329,AdamW,0.3426111457995863,,,0.0002547642218454771,,,,4,,,0.0028016269021804837,,COMPLETE
679,679,31.25,2025-05-25 06:42:43.128951,2025-05-25 06:42:49.566678,0 days 00:00:06.437727,AdamW,0.38349524738073776,,,0.00013175033065509326,,,,6,,,0.0011266740739635278,,PRUNED
680,680,33.333333333333336,2025-05-25 06:42:49.611664,2025-05-25 06:42:56.294532,0 days 00:00:06.682868,AdamW,0.2238394527623542,,,4.478211141068112e-05,,,,2,,,0.0009472767141167787,,PRUNED
681,681,33.333333333333336,2025-05-25 06:42:56.340751,2025-05-25 06:43:06.253085,0 days 00:00:09.912334,Adadelta,0.3548413502660883,0.021360592039549698,,,,,,2,23.758343311059367,,,,PRUNED
682,682,29.166666666666668,2025-05-25 06:43:06.299271,2025-05-25 06:43:12.889257,0 days 00:00:06.589986,AdamW,0.41528766042985615,,,5.574521163591624e-05,,,,0,,,0.0020801306425803447,,PRUNED
683,683,45.833333333333336,2025-05-25 06:43:12.935560,2025-05-25 06:43:27.886154,0 days 00:00:14.950594,AdamW,0.3758826193324339,,,0.00017351905016416638,,,,3,,,0.0015842965458385018,,COMPLETE
684,684,56.25,2025-05-25 06:43:27.945166,2025-05-25 06:43:42.112554,0 days 00:00:14.167388,AdamW,0.39244189845644584,,,0.0002183743256840504,,,,6,,,0.001857371262224386,,COMPLETE
685,685,33.333333333333336,2025-05-25 06:43:42.171387,2025-05-25 06:43:48.763213,0 days 00:00:06.591826,AdamW,0.3656478290134382,,,8.627580160286264e-05,,,,4,,,0.0012142972567667262,,PRUNED
686,686,60.416666666666664,2025-05-25 06:43:48.808639,2025-05-25 06:44:03.056832,0 days 00:00:14.248193,AdamW,0.4063817138038279,,,0.00015805528538029206,,,,5,,,0.001378253157229236,,COMPLETE
687,687,47.916666666666664,2025-05-25 06:44:03.115309,2025-05-25 06:44:17.472044,0 days 00:00:14.356735,AdamW,0.44553914968601316,,,0.0001478053626056011,,,,5,,,0.0013775521425291482,,COMPLETE
