,number,value,datetime_start,datetime_complete,duration,params_algorithm,params_dropout_rate,params_lr_Adadelta,params_lr_Adam,params_lr_AdamW,params_lr_SGD,params_momentum_SGD,params_nesterov_SGD,params_suggested_freeze,params_weight_decay_Adadelta,params_weight_decay_Adam,params_weight_decay_AdamW,params_weight_decay_SGD,state
808,808,33.333333333333336,2025-05-26 02:59:33.154702,2025-05-26 02:59:39.774169,0 days 00:00:06.619467,Adam,0.17567183247439463,,0.00013212003107608488,,,,,0,,0.020191384927269802,,,PRUNED
809,809,33.333333333333336,2025-05-26 02:59:39.821455,2025-05-26 02:59:46.331915,0 days 00:00:06.510460,Adadelta,0.1627133883477822,0.16063460732914314,,,,,,3,0.5683161809557212,,,,PRUNED
810,810,37.5,2025-05-26 02:59:46.378549,2025-05-26 02:59:53.041496,0 days 00:00:06.662947,Adam,0.12162970409891649,,7.181034354220851e-05,,,,,4,,0.03478031018956498,,,PRUNED
811,811,35.416666666666664,2025-05-26 02:59:53.088746,2025-05-26 02:59:59.651039,0 days 00:00:06.562293,Adam,0.1379490428691518,,8.719037854869472e-05,,,,,1,,0.016468113253182787,,,PRUNED
812,812,33.333333333333336,2025-05-26 02:59:59.698160,2025-05-26 03:00:06.329608,0 days 00:00:06.631448,Adam,0.15357051131539776,,0.00016727391725663624,,,,,2,,0.01150456166378666,,,PRUNED
813,813,33.333333333333336,2025-05-26 03:00:06.376654,2025-05-26 03:00:13.001772,0 days 00:00:06.625118,Adam,0.12988516130712646,,0.0001060182056420127,,,,,2,,0.027289993479072995,,,PRUNED
814,814,33.333333333333336,2025-05-26 03:00:13.048841,2025-05-26 03:00:19.689442,0 days 00:00:06.640601,Adam,0.1467687154044985,,6.775912913860862e-05,,,,,3,,0.021871649793053897,,,PRUNED
815,815,43.75,2025-05-26 03:00:19.737075,2025-05-26 03:00:29.658751,0 days 00:00:09.921676,Adam,0.16499038428126184,,0.00012806078201619368,,,,,1,,0.01471765340414667,,,PRUNED
816,816,33.333333333333336,2025-05-26 03:00:29.707476,2025-05-26 03:00:38.585573,0 days 00:00:08.878097,Adam,0.11368833498722422,,9.265296350804705e-05,,,,,10,,0.018503761149828046,,,PRUNED
817,817,35.416666666666664,2025-05-26 03:00:38.630336,2025-05-26 03:00:45.188891,0 days 00:00:06.558555,Adam,0.1858730678546487,,0.00014891074414809003,,,,,0,,0.034802879826145314,,,PRUNED
818,818,33.333333333333336,2025-05-26 03:00:45.236048,2025-05-26 03:00:51.926719,0 days 00:00:06.690671,Adam,0.14034264599477442,,7.777273571816139e-05,,,,,2,,0.02391479837281221,,,PRUNED
819,819,33.333333333333336,2025-05-26 03:00:51.977012,2025-05-26 03:00:58.578563,0 days 00:00:06.601551,Adam,0.09796518408237043,,0.005696827316447177,,,,,3,,0.05109501035696501,,,PRUNED
820,820,33.333333333333336,2025-05-26 03:00:58.625397,2025-05-26 03:01:04.832343,0 days 00:00:06.206946,Adam,0.15249562511098427,,0.0001136315068152903,,,,,14,,0.01409940599855446,,,PRUNED
821,821,37.5,2025-05-26 03:01:04.877331,2025-05-26 03:01:11.474880,0 days 00:00:06.597549,Adam,0.1257857078591825,,0.00018937625162450313,,,,,4,,0.030458630197915042,,,PRUNED
822,822,33.333333333333336,2025-05-26 03:01:11.522312,2025-05-26 03:01:18.115997,0 days 00:00:06.593685,Adam,0.16755562285095701,,6.161451165509812e-05,,,,,1,,0.017454260654221468,,,PRUNED
823,823,56.25,2025-05-26 03:01:18.163119,2025-05-26 03:01:33.126190,0 days 00:00:14.963071,Adam,0.13519587094704957,,0.00010079705845424239,,,,,2,,0.021270883042558166,,,COMPLETE
824,824,33.333333333333336,2025-05-26 03:01:33.186042,2025-05-26 03:01:39.805498,0 days 00:00:06.619456,Adam,0.15712703034588568,,0.01198842225105707,,,,,1,,0.04000713244646635,,,PRUNED
825,825,37.5,2025-05-26 03:01:39.853392,2025-05-26 03:01:46.426730,0 days 00:00:06.573338,Adam,0.1458717752568149,,4.5911860678933384e-05,,,,,3,,0.011719084415532956,,,PRUNED
826,826,37.5,2025-05-26 03:01:46.473860,2025-05-26 03:01:52.998280,0 days 00:00:06.524420,Adam,0.11876397815766107,,0.0007570137829985869,,,,,6,,0.02901549515695379,,,PRUNED
827,827,54.166666666666664,2025-05-26 03:01:53.044678,2025-05-26 03:02:07.985189,0 days 00:00:14.940511,Adam,0.33646408344087575,,0.00013772851019041847,,,,,2,,0.02452958305624668,,,COMPLETE
828,828,33.333333333333336,2025-05-26 03:02:08.047467,2025-05-26 03:02:14.663928,0 days 00:00:06.616461,Adam,0.23990832818651736,,8.065045922454569e-05,,,,,0,,0.01636120182744691,,,PRUNED
829,829,33.333333333333336,2025-05-26 03:02:14.711396,2025-05-26 03:02:21.048175,0 days 00:00:06.336779,SGD,0.06591181666873275,,,,0.000553875166290056,38.5531607428093,True,13,,,,2.871511640660046,PRUNED
830,830,56.25,2025-05-26 03:02:21.094244,2025-05-26 03:02:36.035912,0 days 00:00:14.941668,Adam,0.17625209508059875,,0.00028487131702816546,,,,,3,,0.010048211742666922,,,COMPLETE
831,831,33.333333333333336,2025-05-26 03:02:36.095507,2025-05-26 03:02:42.676010,0 days 00:00:06.580503,Adadelta,0.13326260568539539,0.029017979983411546,,,,,,2,10.372287411249868,,,,PRUNED
832,832,33.333333333333336,2025-05-26 03:02:42.722717,2025-05-26 03:02:49.281696,0 days 00:00:06.558979,Adam,0.14969223213026578,,0.00012104483023992557,,,,,1,,0.013201761710739062,,,PRUNED
833,833,33.333333333333336,2025-05-26 03:02:49.330950,2025-05-26 03:02:55.944438,0 days 00:00:06.613488,Adam,0.11135293012498065,,0.00016198507388687344,,,,,4,,0.02109488569077008,,,PRUNED
834,834,33.333333333333336,2025-05-26 03:02:55.991867,2025-05-26 03:03:02.664481,0 days 00:00:06.672614,Adam,0.1602494208367111,,9.732815431130242e-05,,,,,5,,0.03198496119033478,,,PRUNED
835,835,37.5,2025-05-26 03:03:02.711862,2025-05-26 03:03:09.328663,0 days 00:00:06.616801,Adam,0.14106541425105823,,0.00021845525553485773,,,,,0,,0.017036150395467776,,,PRUNED
836,836,37.5,2025-05-26 03:03:09.375864,2025-05-26 03:03:15.924953,0 days 00:00:06.549089,Adam,0.12880061218983752,,0.00011406034692527706,,,,,1,,0.026479297729888232,,,PRUNED
837,837,37.5,2025-05-26 03:03:15.972551,2025-05-26 03:03:22.651582,0 days 00:00:06.679031,Adam,0.172658375634753,,6.663868373452362e-05,,,,,3,,0.042034683834370125,,,PRUNED
838,838,52.083333333333336,2025-05-26 03:03:22.699215,2025-05-26 03:03:37.629340,0 days 00:00:14.930125,Adam,0.14642948444918805,,8.452973191120753e-05,,,,,2,,0.019490056347128654,,,COMPLETE
839,839,35.416666666666664,2025-05-26 03:03:37.689616,2025-05-26 03:03:45.941923,0 days 00:00:08.252307,Adam,0.10525242389659639,,0.00014089705080187352,,,,,4,,0.014529106017818049,,,PRUNED
840,840,37.5,2025-05-26 03:03:45.990017,2025-05-26 03:03:52.298763,0 days 00:00:06.308746,Adam,0.16117988674937275,,5.6856627120314336e-05,,,,,24,,0.024556067463144027,,,PRUNED
841,841,33.333333333333336,2025-05-26 03:03:52.343289,2025-05-26 03:03:58.940918,0 days 00:00:06.597629,Adam,0.12386304877283588,,0.0016843199185364824,,,,,2,,0.036854817782226046,,,PRUNED
842,842,33.333333333333336,2025-05-26 03:03:58.988542,2025-05-26 03:04:05.582673,0 days 00:00:06.594131,Adam,0.13853801460551698,,0.00018173383059809118,,,,,1,,0.01932646014508322,,,PRUNED
843,843,45.833333333333336,2025-05-26 03:04:05.633091,2025-05-26 03:04:15.567079,0 days 00:00:09.933988,Adam,0.09045835762043278,,0.00010826898019489324,,,,,3,,0.02889443765039903,,,PRUNED
844,844,35.416666666666664,2025-05-26 03:04:15.614856,2025-05-26 03:04:22.302197,0 days 00:00:06.687341,Adam,0.15233258729815316,,7.491945644124005e-05,,,,,0,,0.013051466583261477,,,PRUNED
845,845,37.5,2025-05-26 03:04:22.355116,2025-05-26 03:04:29.020814,0 days 00:00:06.665698,Adam,0.18567786737025616,,9.331219924269763e-05,,,,,2,,0.022758147876815904,,,PRUNED
846,846,33.333333333333336,2025-05-26 03:04:29.068672,2025-05-26 03:04:37.830969,0 days 00:00:08.762297,Adam,0.13293703929618325,,0.00012611168741838655,,,,,20,,0.07472774798187129,,,PRUNED
847,847,64.58333333333333,2025-05-26 03:04:37.875743,2025-05-26 03:04:52.874425,0 days 00:00:14.998682,Adam,0.1567482882163071,,0.00014466916942512345,,,,,1,,0.016097922017597584,,,COMPLETE
848,848,33.333333333333336,2025-05-26 03:04:52.935153,2025-05-26 03:04:59.550701,0 days 00:00:06.615548,Adam,0.17745169376284822,,0.00020090867585521597,,,,,1,,0.019159188132961486,,,PRUNED
849,849,64.58333333333333,2025-05-26 03:04:59.598201,2025-05-26 03:05:14.519217,0 days 00:00:14.921016,Adam,0.16909432525547294,,0.0001617231596218685,,,,,0,,0.0325135202706438,,,COMPLETE
850,850,35.416666666666664,2025-05-26 03:05:14.579616,2025-05-26 03:05:21.195520,0 days 00:00:06.615904,Adam,0.19730120143202345,,0.00023445195499042582,,,,,0,,0.05092530530709726,,,PRUNED
851,851,33.333333333333336,2025-05-26 03:05:21.243370,2025-05-26 03:05:27.889935,0 days 00:00:06.646565,Adam,0.18660917009665867,,0.00016892088320453273,,,,,0,,0.034036841362231736,,,PRUNED
852,852,37.5,2025-05-26 03:05:27.939529,2025-05-26 03:05:36.259596,0 days 00:00:08.320067,Adam,0.16984202452180497,,0.00015139554347863874,,,,,0,,0.04188744271815839,,,PRUNED
853,853,33.333333333333336,2025-05-26 03:05:36.306986,2025-05-26 03:05:42.919494,0 days 00:00:06.612508,SGD,0.17707676805253209,,,,0.00017722507938608718,0.39292842592653443,False,0,,,,22.822226766674987,PRUNED
854,854,45.833333333333336,2025-05-26 03:05:42.967655,2025-05-26 03:05:52.976028,0 days 00:00:10.008373,Adam,0.192467012365643,,0.00014958791466875647,,,,,0,,0.03288412104528712,,,PRUNED
855,855,37.5,2025-05-26 03:05:53.024187,2025-05-26 03:05:59.705514,0 days 00:00:06.681327,Adam,0.1678041958132181,,0.0001301852775969573,,,,,0,,0.04477448191448674,,,PRUNED
856,856,54.166666666666664,2025-05-26 03:05:59.753239,2025-05-26 03:06:14.731934,0 days 00:00:14.978695,Adam,0.16138448639633135,,0.00026194661536517883,,,,,1,,0.02921269575079961,,,COMPLETE
857,857,37.5,2025-05-26 03:06:14.792311,2025-05-26 03:06:23.076864,0 days 00:00:08.284553,Adadelta,0.27190725605194493,0.010339150719392466,,,,,,1,0.01967160167264776,,,,PRUNED
858,858,33.333333333333336,2025-05-26 03:06:23.126229,2025-05-26 03:06:29.769706,0 days 00:00:06.643477,Adam,0.17103832427458765,,0.0001854163639066675,,,,,1,,0.03840510242464252,,,PRUNED
859,859,33.333333333333336,2025-05-26 03:06:29.818562,2025-05-26 03:06:36.446775,0 days 00:00:06.628213,Adam,0.18165634027126987,,0.00011062809188711487,,,,,0,,0.027781294921404753,,,PRUNED
860,860,41.666666666666664,2025-05-26 03:06:36.494288,2025-05-26 03:06:51.462000,0 days 00:00:14.967712,Adam,0.15553085948209028,,0.0004182033344691722,,,,,0,,0.024229110989510354,,,PRUNED
861,861,33.333333333333336,2025-05-26 03:06:51.510267,2025-05-26 03:06:58.047675,0 days 00:00:06.537408,Adam,0.16479565991956693,,7.48438390370757e-05,,,,,1,,0.057309237928396116,,,PRUNED
862,862,33.333333333333336,2025-05-26 03:06:58.095396,2025-05-26 03:07:04.916870,0 days 00:00:06.821474,Adam,0.11865467737027353,,0.0001567224373715244,,,,,1,,0.03421020051082154,,,PRUNED
863,863,33.333333333333336,2025-05-26 03:07:04.965738,2025-05-26 03:07:11.515702,0 days 00:00:06.549964,Adam,0.15257203936616606,,0.009272049360586277,,,,,0,,0.02519009749383169,,,PRUNED
864,864,56.25,2025-05-26 03:07:11.563523,2025-05-26 03:07:26.681064,0 days 00:00:15.117541,Adam,0.098804488405247,,9.281444961445538e-05,,,,,1,,0.01645497954091833,,,COMPLETE
865,865,27.083333333333332,2025-05-26 03:07:26.741559,2025-05-26 03:07:33.375213,0 days 00:00:06.633654,Adam,0.14511795462929475,,4.91824233486433e-05,,,,,1,,1.2038775335250955,,,PRUNED
866,866,33.333333333333336,2025-05-26 03:07:33.423114,2025-05-26 03:07:40.096858,0 days 00:00:06.673744,Adam,0.15882407527722003,,0.00012417903150100518,,,,,0,,0.031379458084420525,,,PRUNED
867,867,31.25,2025-05-26 03:07:40.145142,2025-05-26 03:07:46.277801,0 days 00:00:06.132659,Adam,0.11018835403571173,,0.0002068520390255953,,,,,12,,0.021378916052649716,,,PRUNED
868,868,33.333333333333336,2025-05-26 03:07:46.322413,2025-05-26 03:07:53.021054,0 days 00:00:06.698641,Adam,0.17139861399706469,,6.09807884841052e-05,,,,,1,,0.04631668998909495,,,PRUNED
869,869,35.416666666666664,2025-05-26 03:07:53.069513,2025-05-26 03:07:59.622795,0 days 00:00:06.553282,Adam,0.12629376464084519,,0.00010149427153359952,,,,,0,,0.03599630961494485,,,PRUNED
870,870,33.333333333333336,2025-05-26 03:07:59.671287,2025-05-26 03:08:06.304056,0 days 00:00:06.632769,Adam,0.13403368648329755,,1.4928107371918553e-05,,,,,2,,0.02790358820767242,,,PRUNED
871,871,33.333333333333336,2025-05-26 03:08:06.351802,2025-05-26 03:08:12.972106,0 days 00:00:06.620304,Adam,0.13967601159822587,,0.00113855172622796,,,,,1,,0.01642202610484789,,,PRUNED
872,872,41.666666666666664,2025-05-26 03:08:13.021623,2025-05-26 03:08:28.041119,0 days 00:00:15.019496,Adam,0.07841783828918913,,8.531414885438427e-05,,,,,1,,0.022831211200385098,,,COMPLETE
873,873,54.166666666666664,2025-05-26 03:08:28.101549,2025-05-26 03:08:42.999715,0 days 00:00:14.898166,Adam,0.15208741794103295,,0.00013735240664048643,,,,,2,,0.019301046215325593,,,COMPLETE
874,874,33.333333333333336,2025-05-26 03:08:43.060687,2025-05-26 03:08:49.672778,0 days 00:00:06.612091,Adam,0.16636636523383264,,0.00017382720971536862,,,,,0,,0.014600536497530861,,,PRUNED
875,875,37.5,2025-05-26 03:08:49.720736,2025-05-26 03:08:56.355013,0 days 00:00:06.634277,Adam,0.18328085081613604,,0.00011370008650660967,,,,,1,,0.11619250161090681,,,PRUNED
876,876,35.416666666666664,2025-05-26 03:08:56.405206,2025-05-26 03:09:04.659628,0 days 00:00:08.254422,Adam,0.12049659373079671,,6.944488094178047e-05,,,,,2,,0.025663035204838997,,,PRUNED
877,877,,2025-05-26 03:09:04.708000,2025-05-26 03:09:10.607917,0 days 00:00:05.899917,SGD,0.14813900167275715,,,,1.0837563516749346e-05,92.73664640872116,True,1,,,,1.1728669149794377,PRUNED
878,878,47.916666666666664,2025-05-26 03:09:10.654940,2025-05-26 03:09:25.605078,0 days 00:00:14.950138,Adam,0.1605400309073085,,0.00014788943437981142,,,,,2,,0.03750880365780535,,,COMPLETE
879,879,33.333333333333336,2025-05-26 03:09:25.665886,2025-05-26 03:09:32.248794,0 days 00:00:06.582908,Adadelta,0.14089920625410465,50.72094615044408,,,,,,1,3.3156801104828997,,,,PRUNED
880,880,33.333333333333336,2025-05-26 03:09:32.296595,2025-05-26 03:09:38.936749,0 days 00:00:06.640154,Adam,0.12634627865052067,,0.00010444523213643079,,,,,0,,0.011487883784208537,,,PRUNED
881,881,33.333333333333336,2025-05-26 03:09:38.984458,2025-05-26 03:09:45.620257,0 days 00:00:06.635799,Adam,0.15764751478967087,,7.893407853870783e-05,,,,,2,,0.031012315202734193,,,PRUNED
882,882,37.5,2025-05-26 03:09:45.668574,2025-05-26 03:09:52.252589,0 days 00:00:06.584015,Adam,0.11000307863613194,,0.00012369674188380996,,,,,2,,0.017712971266013927,,,PRUNED
883,883,33.333333333333336,2025-05-26 03:09:52.301066,2025-05-26 03:09:58.547671,0 days 00:00:06.246605,Adam,0.17437866125978188,,5.5196464811286884e-05,,,,,17,,0.021634602439060867,,,PRUNED
884,884,33.333333333333336,2025-05-26 03:09:58.592766,2025-05-26 03:10:05.205720,0 days 00:00:06.612954,Adam,0.14040339861080117,,9.489038491729925e-05,,,,,0,,0.015446981857674702,,,PRUNED
885,885,58.333333333333336,2025-05-26 03:10:05.253713,2025-05-26 03:10:20.234114,0 days 00:00:14.980401,Adam,0.13276586902162463,,0.00017900339515094637,,,,,1,,0.024439145094822624,,,COMPLETE
886,886,31.25,2025-05-26 03:10:20.296131,2025-05-26 03:10:26.886095,0 days 00:00:06.589964,Adam,0.14928589421149074,,4.062293171363049e-05,,,,,1,,0.012799115418423254,,,PRUNED
887,887,33.333333333333336,2025-05-26 03:10:26.933813,2025-05-26 03:10:33.493080,0 days 00:00:06.559267,Adam,0.16398826820132134,,0.00022145106857586578,,,,,2,,0.029548814590049766,,,PRUNED
888,888,37.5,2025-05-26 03:10:33.540760,2025-05-26 03:10:41.737607,0 days 00:00:08.196847,Adam,0.19195977332783923,,0.00013565392403669916,,,,,2,,0.03974638966365286,,,PRUNED
889,889,56.25,2025-05-26 03:10:41.785767,2025-05-26 03:10:56.673872,0 days 00:00:14.888105,Adam,0.12193638151133503,,8.668159543182705e-05,,,,,1,,0.020088338987123297,,,COMPLETE
890,890,54.166666666666664,2025-05-26 03:10:56.733884,2025-05-26 03:11:11.858235,0 days 00:00:15.124351,Adam,0.09898494544984446,,6.664787513386278e-05,,,,,0,,0.017683828263914438,,,COMPLETE
891,891,37.5,2025-05-26 03:11:11.919499,2025-05-26 03:11:18.498269,0 days 00:00:06.578770,Adam,0.14133151894697477,,0.00011409448269239152,,,,,2,,0.026335086678647403,,,PRUNED
892,892,33.333333333333336,2025-05-26 03:11:18.548040,2025-05-26 03:11:25.070322,0 days 00:00:06.522282,Adam,0.15325739576313674,,0.0001593824374024609,,,,,1,,9.751741463572877,,,PRUNED
893,893,37.5,2025-05-26 03:11:25.118395,2025-05-26 03:11:31.704496,0 days 00:00:06.586101,Adam,0.13037125332201657,,9.82099391728829e-05,,,,,0,,0.0660368531343691,,,PRUNED
894,894,31.25,2025-05-26 03:11:31.752766,2025-05-26 03:11:38.177032,0 days 00:00:06.424266,Adam,0.4291661485405169,,0.00012920191958225172,,,,,2,,1.8127343018266422,,,PRUNED
895,895,33.333333333333336,2025-05-26 03:11:38.224667,2025-05-26 03:11:44.823067,0 days 00:00:06.598400,Adam,0.11652895448344121,,8.728894288735363e-05,,,,,1,,0.010127785473433876,,,PRUNED
896,896,35.416666666666664,2025-05-26 03:11:44.871378,2025-05-26 03:11:51.513720,0 days 00:00:06.642342,Adam,0.17928189688894072,,7.312675761939137e-05,,,,,2,,0.290343591483832,,,PRUNED
897,897,33.333333333333336,2025-05-26 03:11:51.561619,2025-05-26 03:11:58.147438,0 days 00:00:06.585819,Adam,0.147018949851735,,0.0002512580823927521,,,,,2,,0.047296981056139845,,,PRUNED
898,898,43.75,2025-05-26 03:11:58.195456,2025-05-26 03:12:13.015350,0 days 00:00:14.819894,Adam,0.16769076534098232,,0.00019168697558943085,,,,,3,,0.15357019544215425,,,COMPLETE
899,899,33.333333333333336,2025-05-26 03:12:13.076326,2025-05-26 03:12:19.723354,0 days 00:00:06.647028,Adam,0.08772069444500444,,0.00015345343192128886,,,,,0,,0.033014252965950744,,,PRUNED
900,900,37.5,2025-05-26 03:12:19.771517,2025-05-26 03:12:27.917957,0 days 00:00:08.146440,Adam,0.13491100236405873,,0.0001098498599802088,,,,,1,,0.014695047321170534,,,PRUNED
901,901,,2025-05-26 03:12:27.967917,2025-05-26 03:12:33.727457,0 days 00:00:05.759540,SGD,0.15429992465652634,,,,0.055593246747523285,99.25820194335441,False,2,,,,0.05343511927708451,PRUNED
902,902,33.333333333333336,2025-05-26 03:12:33.774275,2025-05-26 03:12:40.163076,0 days 00:00:06.388801,Adadelta,0.14179458198128903,17.23159413127825,,,,,,1,0.16472068235647172,,,,PRUNED
903,903,37.5,2025-05-26 03:12:40.210641,2025-05-26 03:12:46.800733,0 days 00:00:06.590092,Adam,0.10857522498315895,,5.170872273681316e-05,,,,,3,,0.021483922284368975,,,PRUNED
904,904,31.25,2025-05-26 03:12:46.848855,2025-05-26 03:12:53.046989,0 days 00:00:06.198134,Adam,0.15935489194299465,,0.0001299624646375122,,,,,8,,0.027874836105377627,,,PRUNED
905,905,39.583333333333336,2025-05-26 03:12:53.092838,2025-05-26 03:13:01.352526,0 days 00:00:08.259688,Adam,0.12650771352050189,,8.002550034197776e-05,,,,,0,,0.018158781656335613,,,PRUNED
906,906,33.333333333333336,2025-05-26 03:13:01.401385,2025-05-26 03:13:07.918340,0 days 00:00:06.516955,Adam,0.20382536042893232,,6.050867092609251e-05,,,,,2,,0.012994450820482128,,,PRUNED
907,907,35.416666666666664,2025-05-26 03:13:07.967008,2025-05-26 03:13:14.560827,0 days 00:00:06.593819,Adam,0.17139272516604628,,0.00010239572283246089,,,,,1,,0.02355118549999708,,,PRUNED
908,908,33.333333333333336,2025-05-26 03:13:14.608426,2025-05-26 03:13:21.286145,0 days 00:00:06.677719,Adam,0.14718585475309404,,0.00016103037064552617,,,,,3,,0.03800317912918954,,,PRUNED
909,909,35.416666666666664,2025-05-26 03:13:21.324944,2025-05-26 03:13:27.865340,0 days 00:00:06.540396,Adam,0.1376361738012373,,0.0001199754367826891,,,,,2,,0.0154006120981673,,,PRUNED
910,910,35.416666666666664,2025-05-26 03:13:27.913578,2025-05-26 03:13:34.526962,0 days 00:00:06.613384,Adam,0.11750258724629276,,9.324373364935214e-05,,,,,0,,0.20910789818999725,,,PRUNED
911,911,35.416666666666664,2025-05-26 03:13:34.574943,2025-05-26 03:13:41.117657,0 days 00:00:06.542714,Adam,0.15957195619331188,,7.485556078834454e-05,,,,,3,,0.02043943872168599,,,PRUNED
912,912,52.083333333333336,2025-05-26 03:13:41.165942,2025-05-26 03:13:56.185221,0 days 00:00:15.019279,Adam,0.1328994820027944,,0.00031478619400457104,,,,,1,,0.031106117128261848,,,COMPLETE
913,913,35.416666666666664,2025-05-26 03:13:56.246647,2025-05-26 03:14:06.204531,0 days 00:00:09.957884,Adam,0.14956083045870155,,0.0002114337002579524,,,,,2,,0.011932095336147173,,,PRUNED
914,914,33.333333333333336,2025-05-26 03:14:06.253094,2025-05-26 03:14:12.831877,0 days 00:00:06.578783,Adam,0.16469019589470557,,0.00013522014787802964,,,,,3,,0.026380484957672756,,,PRUNED
915,915,35.416666666666664,2025-05-26 03:14:12.882708,2025-05-26 03:14:19.571748,0 days 00:00:06.689040,Adam,0.12425393386097876,,0.00010909637251842248,,,,,1,,0.052945797068166274,,,PRUNED
916,916,45.833333333333336,2025-05-26 03:14:19.620359,2025-05-26 03:14:29.559696,0 days 00:00:09.939337,Adam,0.10182816925896732,,0.0005975026195726838,,,,,2,,0.018881293784125213,,,PRUNED
917,917,35.416666666666664,2025-05-26 03:14:29.608417,2025-05-26 03:14:39.842749,0 days 00:00:10.234332,Adam,0.1838655852124431,,0.00018438585452097998,,,,,0,,0.023272429778016746,,,PRUNED
918,918,33.333333333333336,2025-05-26 03:14:39.891751,2025-05-26 03:14:46.563218,0 days 00:00:06.671467,Adam,0.14620424908398844,,2.4783567084458225e-05,,,,,1,,0.015818563270672277,,,PRUNED
919,919,35.416666666666664,2025-05-26 03:14:46.611212,2025-05-26 03:14:53.273987,0 days 00:00:06.662775,Adam,0.15688851504557114,,6.247236677170122e-05,,,,,2,,3.776792491830435,,,PRUNED
920,920,52.083333333333336,2025-05-26 03:14:53.321964,2025-05-26 03:15:08.284471,0 days 00:00:14.962507,Adam,0.13476044771670956,,8.493173817621463e-05,,,,,3,,0.03635695211386831,,,COMPLETE
921,921,33.333333333333336,2025-05-26 03:15:08.346059,2025-05-26 03:15:14.988021,0 days 00:00:06.641962,Adam,0.11363428086105948,,0.00015185286888990906,,,,,1,,0.029813889683680737,,,PRUNED
922,922,39.583333333333336,2025-05-26 03:15:15.036488,2025-05-26 03:15:23.389592,0 days 00:00:08.353104,Adam,0.1292096947176778,,9.960649713992429e-05,,,,,0,,0.022153403676160418,,,PRUNED
923,923,41.666666666666664,2025-05-26 03:15:23.437843,2025-05-26 03:15:33.374464,0 days 00:00:09.936621,Adam,0.17296227565724864,,4.549939874512606e-05,,,,,3,,0.04266900350869847,,,PRUNED
