,number,value,datetime_start,datetime_complete,duration,params_algorithm,params_dropout_rate,params_lr_Adadelta,params_lr_Adam,params_lr_AdamW,params_lr_SGD,params_momentum_SGD,params_nesterov_SGD,params_suggested_freeze,params_weight_decay_Adadelta,params_weight_decay_Adam,params_weight_decay_AdamW,params_weight_decay_SGD,state
688,688,45.833333333333336,2025-05-25 06:44:17.528580,2025-05-25 06:44:32.040436,0 days 00:00:14.511856,AdamW,0.40359372995073856,,,0.00010095783744439527,,,,5,,,0.0013136543833974204,,COMPLETE
689,689,35.416666666666664,2025-05-25 06:44:32.099190,2025-05-25 06:44:36.560755,0 days 00:00:04.461565,AdamW,0.47899135683762545,,,6.703645434027519e-05,,,,14,,,0.0014933988573704704,,PRUNED
690,690,62.5,2025-05-25 06:44:36.603721,2025-05-25 06:44:48.411802,0 days 00:00:11.808081,AdamW,0.420648940556991,,,0.00012462854602940902,,,,6,,,0.0012168460187263065,,COMPLETE
691,691,33.333333333333336,2025-05-25 06:44:48.470102,2025-05-25 06:44:54.973741,0 days 00:00:06.503639,AdamW,0.43211765813908054,,,3.775466988503711e-05,,,,6,,,0.0010833097636667353,,PRUNED
692,692,37.5,2025-05-25 06:44:55.018214,2025-05-25 06:45:01.268651,0 days 00:00:06.250437,AdamW,0.42726336018896144,,,0.00012605475206429396,,,,8,,,0.0012205504512568276,,PRUNED
693,693,39.583333333333336,2025-05-25 06:45:01.311457,2025-05-25 06:45:07.618721,0 days 00:00:06.307264,AdamW,0.4223165354650026,,,0.0002769253552020646,,,,7,,,0.0011471590863236878,,PRUNED
694,694,33.333333333333336,2025-05-25 06:45:07.662809,2025-05-25 06:45:14.026797,0 days 00:00:06.363988,AdamW,0.4182401667683072,,,0.00017832533723352072,,,,7,,,0.0010143042363058503,,PRUNED
695,695,39.583333333333336,2025-05-25 06:45:14.071374,2025-05-25 06:45:20.545675,0 days 00:00:06.474301,AdamW,0.4365015659496219,,,8.452909795255109e-05,,,,6,,,0.001231544396567047,,PRUNED
696,696,33.333333333333336,2025-05-25 06:45:20.590620,2025-05-25 06:45:26.949880,0 days 00:00:06.359260,Adadelta,0.4149336566332627,1.483455712665459,,,,,,7,0.07259517517673302,,,,PRUNED
697,697,47.916666666666664,2025-05-25 06:45:26.993688,2025-05-25 06:45:38.186039,0 days 00:00:11.192351,AdamW,0.4133869923810559,,,0.000222168372577345,,,,6,,,0.0010920241792736173,,PRUNED
698,698,33.333333333333336,2025-05-25 06:45:38.231267,2025-05-25 06:45:44.724082,0 days 00:00:06.492815,AdamW,0.4061701200191178,,,5.365828320431795e-05,,,,6,,,0.0008904308943365317,,PRUNED
699,699,33.333333333333336,2025-05-25 06:45:44.771001,2025-05-25 06:45:51.308871,0 days 00:00:06.537870,Adam,0.42678516782714826,,9.466931268789825e-05,,,,,5,,1.5343845845588509,,,PRUNED
700,700,,2025-05-25 06:45:51.354477,2025-05-25 06:45:57.177506,0 days 00:00:05.823029,SGD,0.39410796402870474,,,,0.0005705264126641491,75.41066064772444,True,6,,,,0.019020350669534645,PRUNED
701,701,29.166666666666668,2025-05-25 06:45:57.221530,2025-05-25 06:46:03.491980,0 days 00:00:06.270450,AdamW,0.43973484336318147,,,0.00010834567367024895,,,,8,,,0.0013588221783582914,,PRUNED
702,702,39.583333333333336,2025-05-25 06:46:03.537994,2025-05-25 06:46:09.983848,0 days 00:00:06.445854,AdamW,0.44752663210225857,,,0.00031820363759918344,,,,6,,,0.00114518006685314,,PRUNED
703,703,35.416666666666664,2025-05-25 06:46:10.028625,2025-05-25 06:46:16.568955,0 days 00:00:06.540330,AdamW,0.46646168204951444,,,2.4751878455346714e-05,,,,5,,,0.0013009458718966052,,PRUNED
704,704,33.333333333333336,2025-05-25 06:46:16.614824,2025-05-25 06:46:23.004323,0 days 00:00:06.389499,AdamW,0.40809683598739793,,,0.00015463498977063802,,,,7,,,0.000988187938203667,,PRUNED
705,705,33.333333333333336,2025-05-25 06:46:23.047747,2025-05-25 06:46:29.489697,0 days 00:00:06.441950,AdamW,0.4201922784190045,,,0.002700633018118134,,,,6,,,0.0014182523503940925,,PRUNED
706,706,35.416666666666664,2025-05-25 06:46:29.535191,2025-05-25 06:46:36.078318,0 days 00:00:06.543127,AdamW,0.3941091739429456,,,7.185139189454035e-05,,,,5,,,0.0012503932745060256,,PRUNED
707,707,35.416666666666664,2025-05-25 06:46:36.123904,2025-05-25 06:46:42.723111,0 days 00:00:06.599207,AdamW,0.3997161692644596,,,0.0001912509454739898,,,,4,,,0.0008606760162403093,,PRUNED
708,708,33.333333333333336,2025-05-25 06:46:42.769550,2025-05-25 06:46:49.382949,0 days 00:00:06.613399,AdamW,0.3818568410822792,,,0.00012904555607477783,,,,1,,,0.0010957675789149634,,PRUNED
709,709,33.333333333333336,2025-05-25 06:46:49.429126,2025-05-25 06:46:56.072292,0 days 00:00:06.643166,Adadelta,0.4094751828694143,0.8966831380833541,,,,,,5,1.04069410496774,,,,PRUNED
710,710,39.583333333333336,2025-05-25 06:46:56.118666,2025-05-25 06:47:02.666962,0 days 00:00:06.548296,AdamW,0.42646258902608974,,,6.305084423765376e-05,,,,5,,,0.0009319387846312915,,PRUNED
711,711,33.333333333333336,2025-05-25 06:47:02.712468,2025-05-25 06:47:09.037128,0 days 00:00:06.324660,AdamW,0.3748623364288496,,,0.00023769164457236092,,,,7,,,0.0016022358504395886,,PRUNED
712,712,31.25,2025-05-25 06:47:09.081174,2025-05-25 06:47:14.674854,0 days 00:00:05.593680,AdamW,0.3860016393708006,,,9.791105823250383e-05,,,,6,,,0.0012006760582420636,,PRUNED
713,713,45.833333333333336,2025-05-25 06:47:14.718625,2025-05-25 06:47:25.700553,0 days 00:00:10.981928,AdamW,0.49983124147046876,,,0.00015555042220206247,,,,4,,,0.0010472847081945008,,COMPLETE
714,714,35.416666666666664,2025-05-25 06:47:25.759259,2025-05-25 06:47:32.395688,0 days 00:00:06.636429,AdamW,0.3983584087580714,,,0.00019722218053573904,,,,4,,,0.0031530355224003784,,PRUNED
715,715,56.25,2025-05-25 06:47:32.442347,2025-05-25 06:47:44.616042,0 days 00:00:12.173695,AdamW,0.36972113120757416,,,0.0006482745468014819,,,,7,,,0.001449821423111651,,COMPLETE
716,716,39.583333333333336,2025-05-25 06:47:44.657603,2025-05-25 06:47:47.927552,0 days 00:00:03.269949,AdamW,0.41724926646115024,,,7.77609976159481e-05,,,,5,,,0.0013018539364849993,,PRUNED
717,717,35.416666666666664,2025-05-25 06:47:47.968176,2025-05-25 06:47:51.369945,0 days 00:00:03.401769,AdamW,0.40503403695197127,,,4.7390283686222976e-05,,,,8,,,0.001654599327206601,,PRUNED
718,718,33.333333333333336,2025-05-25 06:47:51.404139,2025-05-25 06:47:55.651195,0 days 00:00:04.247056,AdamW,0.3913764927441479,,,0.0001206784443264128,,,,6,,,0.001039529366546065,,PRUNED
719,719,33.333333333333336,2025-05-25 06:47:55.696573,2025-05-25 06:48:02.067004,0 days 00:00:06.370431,AdamW,0.3822716547449383,,,5.9344258430681036e-05,,,,4,,,0.0011818844712466366,,PRUNED
720,720,37.5,2025-05-25 06:48:02.115745,2025-05-25 06:48:06.845852,0 days 00:00:04.730107,AdamW,0.45534522979572767,,,0.00026637493967174487,,,,3,,,0.001331776490932026,,PRUNED
721,721,33.333333333333336,2025-05-25 06:48:06.892447,2025-05-25 06:48:13.479381,0 days 00:00:06.586934,Adadelta,0.4316121538275655,17.121335606953373,,,,,,5,40.09439010858465,,,,PRUNED
722,722,52.083333333333336,2025-05-25 06:48:13.524844,2025-05-25 06:48:28.515607,0 days 00:00:14.990763,AdamW,0.3603575011849063,,,0.00016410301261692275,,,,0,,,0.0015119960652194742,,COMPLETE
723,723,37.5,2025-05-25 06:48:28.575410,2025-05-25 06:48:35.187618,0 days 00:00:06.612208,SGD,0.4115408338002827,,,,0.001668492684455437,1.657985456120599,False,11,,,,5.859192164603447,PRUNED
724,724,39.583333333333336,2025-05-25 06:48:35.231506,2025-05-25 06:48:41.863535,0 days 00:00:06.632029,Adam,0.3751742545980976,,0.00021842922557262036,,,,,1,,0.20358029718055679,,,PRUNED
725,725,39.583333333333336,2025-05-25 06:48:41.909713,2025-05-25 06:48:48.391136,0 days 00:00:06.481423,AdamW,0.3999732647117539,,,9.483328649926923e-05,,,,6,,,0.0009684362564950923,,PRUNED
726,726,35.416666666666664,2025-05-25 06:48:48.435821,2025-05-25 06:48:55.242017,0 days 00:00:06.806196,AdamW,0.38974674585582364,,,0.00014614254480427918,,,,5,,,0.0008162655723232572,,PRUNED
727,727,39.583333333333336,2025-05-25 06:48:55.289129,2025-05-25 06:49:01.638216,0 days 00:00:06.349087,AdamW,0.36824274274033464,,,0.00011296912497403233,,,,7,,,0.0025718281412515035,,PRUNED
728,728,60.416666666666664,2025-05-25 06:49:01.682578,2025-05-25 06:49:16.521492,0 days 00:00:14.838914,AdamW,0.42546093213640607,,,0.00035473057250238484,,,,3,,,0.0011286007853247891,,COMPLETE
729,729,33.333333333333336,2025-05-25 06:49:16.580330,2025-05-25 06:49:23.318660,0 days 00:00:06.738330,AdamW,0.44138820696380754,,,0.0004906221063855933,,,,3,,,0.0011169829441796987,,PRUNED
730,730,33.333333333333336,2025-05-25 06:49:23.365430,2025-05-25 06:49:29.971328,0 days 00:00:06.605898,AdamW,0.4311495253799914,,,0.00030936890425259703,,,,2,,,0.0009594195535203634,,PRUNED
731,731,37.5,2025-05-25 06:49:30.017807,2025-05-25 06:49:36.625011,0 days 00:00:06.607204,AdamW,0.4209830352356712,,,0.00029959539473092383,,,,3,,,0.0010624964725197048,,PRUNED
732,732,52.083333333333336,2025-05-25 06:49:36.671571,2025-05-25 06:49:51.639323,0 days 00:00:14.967752,AdamW,0.43742766184476295,,,0.0004394749549165148,,,,2,,,0.0008869745326519462,,COMPLETE
733,733,37.5,2025-05-25 06:49:51.698541,2025-05-25 06:49:58.318463,0 days 00:00:06.619922,AdamW,0.4265913803179648,,,0.00035553787245258095,,,,3,,,0.0011899877585283714,,PRUNED
734,734,41.666666666666664,2025-05-25 06:49:58.364897,2025-05-25 06:50:13.341781,0 days 00:00:14.976884,AdamW,0.4615767915628337,,,0.0003888924322253335,,,,1,,,0.0010748153074059993,,COMPLETE
735,735,43.75,2025-05-25 06:50:13.400324,2025-05-25 06:50:24.998444,0 days 00:00:11.598120,AdamW,0.41009550631433095,,,0.0003620443996544004,,,,4,,,0.0009783687510715822,,PRUNED
736,736,35.416666666666664,2025-05-25 06:50:25.045928,2025-05-25 06:50:31.437151,0 days 00:00:06.391223,AdamW,0.4199355724447041,,,0.00024375050045082045,,,,3,,,0.0022488007358556325,,PRUNED
737,737,33.333333333333336,2025-05-25 06:50:31.484919,2025-05-25 06:50:38.119202,0 days 00:00:06.634283,Adadelta,0.43372411287625046,0.07715594632356522,,,,,,2,2.1768297708525672,,,,PRUNED
738,738,43.75,2025-05-25 06:50:38.166158,2025-05-25 06:50:49.699561,0 days 00:00:11.533403,AdamW,0.41839337224255174,,,0.0005523984112674722,,,,4,,,0.0011701861905362289,,PRUNED
739,739,33.333333333333336,2025-05-25 06:50:49.742681,2025-05-25 06:50:54.975101,0 days 00:00:05.232420,AdamW,0.40867690633143605,,,0.0002710964641653323,,,,10,,,0.0007552841490555894,,PRUNED
740,740,33.333333333333336,2025-05-25 06:50:55.019511,2025-05-25 06:51:00.955350,0 days 00:00:05.935839,AdamW,0.4502602533053106,,,7.385868208596804e-05,,,,3,,,0.00711241111660597,,PRUNED
741,741,33.333333333333336,2025-05-25 06:51:01.004583,2025-05-25 06:51:07.608938,0 days 00:00:06.604355,AdamW,0.444325414033721,,,4.1824206360622964e-05,,,,3,,,0.0017654277451166975,,PRUNED
742,742,35.416666666666664,2025-05-25 06:51:07.655798,2025-05-25 06:51:20.245993,0 days 00:00:12.590195,AdamW,0.40399827043527514,,,0.00034215591592060647,,,,4,,,0.0013184757642170312,,COMPLETE
743,743,33.333333333333336,2025-05-25 06:51:20.305335,2025-05-25 06:51:26.964163,0 days 00:00:06.658828,AdamW,0.42465668968697606,,,5.6486288249584914e-05,,,,2,,,0.002708528417484825,,PRUNED
744,744,43.75,2025-05-25 06:51:27.010991,2025-05-25 06:51:41.923033,0 days 00:00:14.912042,AdamW,0.39691079345444014,,,0.00022569118854975941,,,,4,,,0.000867443901637834,,COMPLETE
745,745,39.583333333333336,2025-05-25 06:51:41.982408,2025-05-25 06:51:48.602413,0 days 00:00:06.620005,AdamW,0.41316506679261106,,,3.20267938625658e-05,,,,3,,,0.0010196939471603607,,PRUNED
746,746,33.333333333333336,2025-05-25 06:51:48.650335,2025-05-25 06:51:55.387958,0 days 00:00:06.737623,AdamW,0.48464313076431825,,,7.906500304030022e-05,,,,2,,,0.0020499967160488284,,PRUNED
747,747,,2025-05-25 06:51:55.434815,2025-05-25 06:52:01.339525,0 days 00:00:05.904710,SGD,0.40070800902481696,,,,2.0435461305208998e-05,65.17803128383969,True,1,,,,1.857667078857429,PRUNED
748,748,33.333333333333336,2025-05-25 06:52:01.385775,2025-05-25 06:52:08.007581,0 days 00:00:06.621806,AdamW,0.43132461670285094,,,0.00021108768893114406,,,,4,,,0.001441546865993179,,PRUNED
749,749,33.333333333333336,2025-05-25 06:52:08.055633,2025-05-25 06:52:14.664808,0 days 00:00:06.609175,Adam,0.3881496973562058,,0.006500757202774495,,,,,4,,19.53435162249819,,,PRUNED
750,750,33.333333333333336,2025-05-25 06:52:14.711464,2025-05-25 06:52:21.182606,0 days 00:00:06.471142,Adadelta,0.4162888951786594,0.3207269510887805,,,,,,12,0.04400499843872715,,,,PRUNED
751,751,50.0,2025-05-25 06:52:21.230187,2025-05-25 06:52:36.215733,0 days 00:00:14.985546,AdamW,0.16292656306406128,,,0.00043238060793093704,,,,3,,,0.001235366760859055,,COMPLETE
752,752,33.333333333333336,2025-05-25 06:52:36.275753,2025-05-25 06:52:42.917135,0 days 00:00:06.641382,AdamW,0.3933131313477495,,,6.34448898957511e-05,,,,4,,,0.0023632094617105238,,PRUNED
753,753,29.166666666666668,2025-05-25 06:52:42.965666,2025-05-25 06:52:49.205416,0 days 00:00:06.239750,AdamW,0.4092395396578898,,,9.27458562372636e-05,,,,25,,,0.0011341043821989259,,PRUNED
754,754,43.75,2025-05-25 06:52:49.249311,2025-05-25 06:53:01.058981,0 days 00:00:11.809670,AdamW,0.3814251230841197,,,0.00026814042827723745,,,,5,,,0.001645220663423753,,COMPLETE
755,755,33.333333333333336,2025-05-25 06:53:01.100323,2025-05-25 06:53:03.866334,0 days 00:00:02.766011,AdamW,0.4237994782922426,,,1.1803180448863017e-05,,,,19,,,0.0019230855059335016,,PRUNED
756,756,33.333333333333336,2025-05-25 06:53:03.897597,2025-05-25 06:53:07.906771,0 days 00:00:04.009174,AdamW,0.4745000135102253,,,4.846696857124497e-05,,,,2,,,0.0029835905507282667,,PRUNED
757,757,35.416666666666664,2025-05-25 06:53:07.953543,2025-05-25 06:53:16.077943,0 days 00:00:08.124400,AdamW,0.40169931095915223,,,0.00017936801560821335,,,,5,,,0.0033578660279174246,,PRUNED
758,758,33.333333333333336,2025-05-25 06:53:16.124344,2025-05-25 06:53:22.814799,0 days 00:00:06.690455,AdamW,0.441013468887495,,,8.383375293954709e-05,,,,3,,,0.0009588842227607397,,PRUNED
759,759,37.5,2025-05-25 06:53:22.867755,2025-05-25 06:53:26.520690,0 days 00:00:03.652935,AdamW,0.4142834509777947,,,0.00019972387559038152,,,,0,,,0.001269237905720237,,PRUNED
760,760,37.5,2025-05-25 06:53:26.552380,2025-05-25 06:53:29.824788,0 days 00:00:03.272408,AdamW,0.3950965336211916,,,1.572990074486038e-05,,,,3,,,0.0014136309732452107,,PRUNED
761,761,31.25,2025-05-25 06:53:29.856705,2025-05-25 06:53:33.136702,0 days 00:00:03.279997,AdamW,0.3816447713979354,,,6.722754427101152e-05,,,,4,,,0.0010751810172027177,,PRUNED
762,762,33.333333333333336,2025-05-25 06:53:33.170093,2025-05-25 06:53:37.213739,0 days 00:00:04.043646,AdamW,0.426037321140686,,,0.00013280846478730626,,,,1,,,0.0025446136881530617,,PRUNED
763,763,33.333333333333336,2025-05-25 06:53:37.261564,2025-05-25 06:53:43.804962,0 days 00:00:06.543398,Adadelta,0.40543939194712164,0.14834736462028483,,,,,,5,50.57457421390074,,,,PRUNED
764,764,29.166666666666668,2025-05-25 06:53:43.851654,2025-05-25 06:53:50.187264,0 days 00:00:06.335610,AdamW,0.3884947182292731,,,0.00010622884880525463,,,,21,,,0.0017286925088875163,,PRUNED
765,765,52.083333333333336,2025-05-25 06:53:50.235597,2025-05-25 06:54:05.217025,0 days 00:00:14.981428,AdamW,0.38039423716673476,,,0.0003241306918252988,,,,2,,,0.002192043744128976,,COMPLETE
766,766,47.916666666666664,2025-05-25 06:54:05.277670,2025-05-25 06:54:19.335718,0 days 00:00:14.058048,AdamW,0.3724193283093286,,,0.00024335394086741056,,,,6,,,0.0015388060546809273,,COMPLETE
767,767,33.333333333333336,2025-05-25 06:54:19.396009,2025-05-25 06:54:26.105553,0 days 00:00:06.709544,AdamW,0.355477627729556,,,5.38490973353811e-05,,,,5,,,0.0008110245453620217,,PRUNED
768,768,33.333333333333336,2025-05-25 06:54:26.152427,2025-05-25 06:54:32.771654,0 days 00:00:06.619227,AdamW,0.41663306709072845,,,2.8441315441526897e-05,,,,2,,,0.0011764184726869758,,PRUNED
769,769,39.583333333333336,2025-05-25 06:54:32.818747,2025-05-25 06:54:39.506906,0 days 00:00:06.688159,AdamW,0.39919495975042313,,,8.411001591723538e-05,,,,4,,,0.0009252784716548745,,PRUNED
770,770,35.416666666666664,2025-05-25 06:54:39.554995,2025-05-25 06:54:46.161621,0 days 00:00:06.606626,AdamW,0.4358227627461314,,,2.1949241575847813e-05,,,,3,,,0.001292676421641259,,PRUNED
771,771,,2025-05-25 06:54:46.210086,2025-05-25 06:54:52.044543,0 days 00:00:05.834457,SGD,0.3647469379331248,,,,0.07125233165414263,99.3712432818253,False,5,,,,0.05627711021681616,PRUNED
772,772,39.583333333333336,2025-05-25 06:54:52.085415,2025-05-25 06:54:58.719831,0 days 00:00:06.634416,AdamW,0.3918696615530584,,,0.0001753802504978671,,,,4,,,0.001879951725844706,,PRUNED
773,773,33.333333333333336,2025-05-25 06:54:58.767146,2025-05-25 06:55:05.214227,0 days 00:00:06.447081,Adam,0.452123256215324,,0.015115859350589315,,,,,6,,2.828445645221025,,,PRUNED
774,774,58.333333333333336,2025-05-25 06:55:05.260604,2025-05-25 06:55:20.389431,0 days 00:00:15.128827,AdamW,0.40779367364055824,,,0.00011486179821774023,,,,4,,,0.0010784185485372899,,COMPLETE
775,775,47.916666666666664,2025-05-25 06:55:20.452065,2025-05-25 06:55:35.060457,0 days 00:00:14.608392,AdamW,0.4210075281938688,,,0.00014082636616528964,,,,5,,,0.0013737292511196819,,COMPLETE
776,776,45.833333333333336,2025-05-25 06:55:35.120498,2025-05-25 06:55:45.938883,0 days 00:00:10.818385,AdamW,0.3761370965167252,,,0.00022123551272711003,,,,6,,,0.0010189425374989669,,PRUNED
777,777,33.333333333333336,2025-05-25 06:55:45.980039,2025-05-25 06:55:52.642996,0 days 00:00:06.662957,Adadelta,0.3856396047462054,9.774426592690991,,,,,,1,0.023959688267933828,,,,PRUNED
778,778,47.916666666666664,2025-05-25 06:55:52.689919,2025-05-25 06:56:03.907018,0 days 00:00:11.217099,AdamW,0.35172445631261484,,,7.421322626291895e-05,,,,3,,,0.0015743056289257542,,PRUNED
779,779,45.833333333333336,2025-05-25 06:56:03.940745,2025-05-25 06:56:16.102146,0 days 00:00:12.161401,AdamW,0.40096564214953895,,,3.889927699138827e-05,,,,4,,,0.00029106230445900805,,COMPLETE
780,780,33.333333333333336,2025-05-25 06:56:16.162207,2025-05-25 06:56:22.744392,0 days 00:00:06.582185,AdamW,0.3632948369552577,,,0.020221008458396587,,,,5,,,0.002370052375860607,,PRUNED
781,781,33.333333333333336,2025-05-25 06:56:22.788548,2025-05-25 06:56:28.086139,0 days 00:00:05.297591,AdamW,0.43123155489469406,,,6.187356104348486e-05,,,,15,,,0.0011394874401493616,,PRUNED
782,782,33.333333333333336,2025-05-25 06:56:28.130514,2025-05-25 06:56:34.378748,0 days 00:00:06.248234,AdamW,0.4106310149920008,,,9.602207057449633e-05,,,,17,,,0.00016834809866273247,,PRUNED
783,783,33.333333333333336,2025-05-25 06:56:34.423622,2025-05-25 06:56:40.959250,0 days 00:00:06.535628,AdamW,0.39337766008098973,,,0.00027720594755382375,,,,3,,,0.0021173435959275415,,PRUNED
784,784,33.333333333333336,2025-05-25 06:56:41.005917,2025-05-25 06:56:45.674491,0 days 00:00:04.668574,AdamW,0.46250032777281835,,,0.00016623585960941933,,,,7,,,0.001770747169948703,,PRUNED
785,785,37.5,2025-05-25 06:56:45.718728,2025-05-25 06:56:52.374312,0 days 00:00:06.655584,AdamW,0.06454004414566517,,,0.0001964291266300636,,,,2,,,0.0012455536290379135,,PRUNED
786,786,39.583333333333336,2025-05-25 06:56:52.421499,2025-05-25 06:56:58.958350,0 days 00:00:06.536851,AdamW,0.37605586781584804,,,4.818588011735899e-05,,,,1,,,0.0014009053709427013,,PRUNED
787,787,35.416666666666664,2025-05-25 06:56:59.002759,2025-05-25 06:57:02.604872,0 days 00:00:03.602113,AdamW,0.4214172861797084,,,0.00012736540721030798,,,,4,,,0.0027595169278198358,,PRUNED
788,788,39.583333333333336,2025-05-25 06:57:02.647059,2025-05-25 06:57:08.553345,0 days 00:00:05.906286,AdamW,0.3859639253126462,,,0.0008020678887038701,,,,6,,,0.0008797710530153807,,PRUNED
789,789,39.583333333333336,2025-05-25 06:57:08.599466,2025-05-25 06:57:18.958909,0 days 00:00:10.359443,AdamW,0.40327122850481106,,,0.0003970066215768317,,,,5,,,0.001961602140667833,,PRUNED
790,790,33.333333333333336,2025-05-25 06:57:18.990174,2025-05-25 06:57:22.928236,0 days 00:00:03.938062,Adadelta,0.34866290558392143,0.4656101424357469,,,,,,4,13.175331027026038,,,,PRUNED
791,791,47.916666666666664,2025-05-25 06:57:22.970798,2025-05-25 06:57:34.107689,0 days 00:00:11.136891,AdamW,0.36884374313598284,,,7.029388124333162e-05,,,,2,,,0.0014813535484367816,,PRUNED
792,792,43.75,2025-05-25 06:57:34.156471,2025-05-25 06:57:41.570713,0 days 00:00:07.414242,AdamW,0.44390969456808327,,,0.00022996743413712377,,,,5,,,0.000979999710722792,,PRUNED
793,793,31.25,2025-05-25 06:57:41.603137,2025-05-25 06:57:45.421175,0 days 00:00:03.818038,AdamW,0.4141756634299342,,,8.911446540879356e-05,,,,3,,,0.0016688631317151059,,PRUNED
794,794,35.416666666666664,2025-05-25 06:57:45.469017,2025-05-25 06:57:51.853947,0 days 00:00:06.384930,AdamW,0.379584452839761,,,0.00015098841138896457,,,,7,,,0.0011501117930871425,,PRUNED
795,795,31.25,2025-05-25 06:57:51.898989,2025-05-25 06:57:58.531172,0 days 00:00:06.632183,AdamW,0.39661849380587844,,,0.0001172402491401349,,,,0,,,0.0006891964596386212,,PRUNED
796,796,41.666666666666664,2025-05-25 06:57:58.580619,2025-05-25 06:58:12.218441,0 days 00:00:13.637822,AdamW,0.1829538002607102,,,0.000303795783097597,,,,6,,,0.001292224523771586,,COMPLETE
797,797,33.333333333333336,2025-05-25 06:58:12.278210,2025-05-25 06:58:17.802082,0 days 00:00:05.523872,AdamW,0.3598665687577669,,,5.927281830613781e-05,,,,8,,,0.002476612504425357,,PRUNED
798,798,,2025-05-25 06:58:17.832671,2025-05-25 06:58:20.580908,0 days 00:00:02.748237,SGD,0.40765481934269193,,,,0.005038948249589638,41.5977133909267,True,2,,,,0.47896436559244115,PRUNED
799,799,33.333333333333336,2025-05-25 06:58:20.622802,2025-05-25 06:58:27.077602,0 days 00:00:06.454800,Adam,0.4265354473550911,,1.6089554689740477e-05,,,,,4,,9.768855965564244,,,PRUNED
800,800,37.5,2025-05-25 06:58:27.124748,2025-05-25 06:58:33.584266,0 days 00:00:06.459518,AdamW,0.38886540742099746,,,0.00018035565573172124,,,,6,,,0.0010696675002313046,,PRUNED
801,801,31.25,2025-05-25 06:58:33.632172,2025-05-25 06:58:39.469842,0 days 00:00:05.837670,AdamW,0.3704864197437846,,,0.0011903993141312186,,,,3,,,0.0011963586757265372,,PRUNED
802,802,33.333333333333336,2025-05-25 06:58:39.501029,2025-05-25 06:58:42.424326,0 days 00:00:02.923297,AdamW,0.39445852250523883,,,1.85778375464327e-05,,,,4,,,0.002201286521734055,,PRUNED
