,number,value,datetime_start,datetime_complete,duration,params_algorithm,params_dropout_rate,params_lr_Adadelta,params_lr_Adam,params_lr_AdamW,params_lr_SGD,params_momentum_SGD,params_nesterov_SGD,params_suggested_freeze,params_weight_decay_Adadelta,params_weight_decay_Adam,params_weight_decay_AdamW,params_weight_decay_SGD,state
692,692,33.333333333333336,2025-05-26 02:42:50.551268,2025-05-26 02:42:57.314084,0 days 00:00:06.762816,Adam,0.1466786048492774,,0.00017313532578117056,,,,,3,,0.02758035357566628,,,PRUNED
693,693,33.333333333333336,2025-05-26 02:42:57.360276,2025-05-26 02:43:03.943035,0 days 00:00:06.582759,Adadelta,0.16255692093664553,10.58697751346238,,,,,,2,0.8896697317856354,,,,PRUNED
694,694,33.333333333333336,2025-05-26 02:43:03.988656,2025-05-26 02:43:10.543592,0 days 00:00:06.554936,Adam,0.24731964505603157,,0.00014355126574840333,,,,,4,,0.010009941543338535,,,PRUNED
695,695,31.25,2025-05-26 02:43:10.590005,2025-05-26 02:43:17.176683,0 days 00:00:06.586678,Adam,0.1252827885354493,,8.869483551681321e-05,,,,,2,,0.04244358502491236,,,PRUNED
696,696,52.083333333333336,2025-05-26 02:43:17.224335,2025-05-26 02:43:32.177434,0 days 00:00:14.953099,Adam,0.13943225615167498,,0.00011362290608758584,,,,,3,,0.01724122421727124,,,COMPLETE
697,697,35.416666666666664,2025-05-26 02:43:32.236764,2025-05-26 02:43:38.831655,0 days 00:00:06.594891,Adam,0.08395233866289514,,0.0002709768155936939,,,,,2,,0.03209750722288915,,,PRUNED
698,698,33.333333333333336,2025-05-26 02:43:38.880001,2025-05-26 02:43:45.419073,0 days 00:00:06.539072,Adam,0.1732945440573681,,7.750971095206292e-05,,,,,2,,0.01202304498778218,,,PRUNED
699,699,33.333333333333336,2025-05-26 02:43:45.465865,2025-05-26 02:43:52.112857,0 days 00:00:06.646992,Adam,0.16122584213609925,,0.00012970797925479366,,,,,4,,0.35121805738581585,,,PRUNED
700,700,33.333333333333336,2025-05-26 02:43:52.159715,2025-05-26 02:43:58.215828,0 days 00:00:06.056113,Adam,0.15235201721167882,,0.00010524967803636242,,,,,11,,4.311881043682243,,,PRUNED
701,701,37.5,2025-05-26 02:43:58.259710,2025-05-26 02:44:04.874134,0 days 00:00:06.614424,Adam,0.11554948826468087,,0.0001979350383748515,,,,,3,,0.022452842425194717,,,PRUNED
702,702,45.833333333333336,2025-05-26 02:44:04.921029,2025-05-26 02:44:14.853030,0 days 00:00:09.932001,Adam,0.13351252199948488,,7.198649092701739e-05,,,,,1,,0.014764362464313074,,,PRUNED
703,703,33.333333333333336,2025-05-26 02:44:14.900311,2025-05-26 02:44:21.546040,0 days 00:00:06.645729,Adam,0.1453416062916879,,0.00015816727257126256,,,,,2,,0.027083256229435568,,,PRUNED
704,704,33.333333333333336,2025-05-26 02:44:21.592999,2025-05-26 02:44:28.164145,0 days 00:00:06.571146,Adam,0.12289662809281322,,9.57800384430348e-05,,,,,3,,0.08178395128982777,,,PRUNED
705,705,31.25,2025-05-26 02:44:28.211012,2025-05-26 02:44:34.743645,0 days 00:00:06.532633,Adam,0.15338443744874708,,4.450435485005828e-05,,,,,5,,0.018952061101721745,,,PRUNED
706,706,33.333333333333336,2025-05-26 02:44:34.789967,2025-05-26 02:44:41.365214,0 days 00:00:06.575247,Adam,0.18263518459952277,,6.261428957637265e-05,,,,,2,,0.03791625691252783,,,PRUNED
707,707,37.5,2025-05-26 02:44:41.412243,2025-05-26 02:44:47.980253,0 days 00:00:06.568010,Adam,0.16905800162386317,,0.00013055066303789827,,,,,3,,11.96406211235418,,,PRUNED
708,708,52.083333333333336,2025-05-26 02:44:48.027571,2025-05-26 02:45:03.050702,0 days 00:00:15.023131,Adam,0.14140048225297908,,8.49372729356645e-05,,,,,1,,0.022089574573458812,,,COMPLETE
709,709,33.333333333333336,2025-05-26 02:45:03.120252,2025-05-26 02:45:09.755094,0 days 00:00:06.634842,Adam,0.10585553291748191,,0.0001123986086767437,,,,,4,,0.05107580218086559,,,PRUNED
710,710,37.5,2025-05-26 02:45:09.801800,2025-05-26 02:45:16.321870,0 days 00:00:06.520070,Adam,0.1310941750233648,,0.00016397988663260213,,,,,2,,0.1412695976608828,,,PRUNED
711,711,33.333333333333336,2025-05-26 02:45:16.368721,2025-05-26 02:45:23.039086,0 days 00:00:06.670365,Adam,0.1592509688287649,,9.58849093091454e-05,,,,,3,,0.01659159104978424,,,PRUNED
712,712,33.333333333333336,2025-05-26 02:45:23.107020,2025-05-26 02:45:29.695203,0 days 00:00:06.588183,Adam,0.1490400199353769,,0.000125400716235134,,,,,1,,0.030598343852863336,,,PRUNED
713,713,33.333333333333336,2025-05-26 02:45:29.744050,2025-05-26 02:45:36.303949,0 days 00:00:06.559899,SGD,0.12835267398411052,,,,0.00011867496073329939,0.5877898737998564,False,2,,,,42.023419408220704,PRUNED
714,714,33.333333333333336,2025-05-26 02:45:36.350519,2025-05-26 02:45:42.949989,0 days 00:00:06.599470,Adam,0.1395017391954124,,5.3398051616277725e-05,,,,,3,,0.025283745021059862,,,PRUNED
715,715,33.333333333333336,2025-05-26 02:45:42.997407,2025-05-26 02:45:49.525554,0 days 00:00:06.528147,Adadelta,0.09415960511337573,0.40073711603139867,,,,,,4,21.999188279711987,,,,PRUNED
716,716,33.333333333333336,2025-05-26 02:45:49.571944,2025-05-26 02:45:56.097814,0 days 00:00:06.525870,Adam,0.16481983390473856,,7.240803673261874e-05,,,,,5,,0.020138496240854523,,,PRUNED
717,717,58.333333333333336,2025-05-26 02:45:56.144066,2025-05-26 02:46:11.043982,0 days 00:00:14.899916,Adam,0.11650992712754797,,0.00019402878616900238,,,,,1,,0.013505483156439213,,,COMPLETE
718,718,56.25,2025-05-26 02:46:11.103691,2025-05-26 02:46:26.072805,0 days 00:00:14.969114,Adam,0.1530234764664033,,0.00014698605687438258,,,,,2,,0.032895244685136764,,,COMPLETE
719,719,54.166666666666664,2025-05-26 02:46:26.132228,2025-05-26 02:46:41.062861,0 days 00:00:14.930633,Adam,0.17280283986571177,,0.00046094352549433404,,,,,1,,0.026208420712367935,,,COMPLETE
720,720,37.5,2025-05-26 02:46:41.122213,2025-05-26 02:46:47.334900,0 days 00:00:06.212687,Adam,0.1410881105081767,,8.891099728296827e-05,,,,,23,,0.7160406205172269,,,PRUNED
721,721,31.25,2025-05-26 02:46:47.378093,2025-05-26 02:46:54.184924,0 days 00:00:06.806831,Adam,0.1255995016269623,,0.00010592010161762931,,,,,2,,0.017093976440093864,,,PRUNED
722,722,33.333333333333336,2025-05-26 02:46:54.232635,2025-05-26 02:47:00.828142,0 days 00:00:06.595507,Adam,0.1907041341911379,,0.0001304788726209963,,,,,3,,0.04197732628067423,,,PRUNED
723,723,52.083333333333336,2025-05-26 02:47:00.874873,2025-05-26 02:47:15.756171,0 days 00:00:14.881298,Adam,0.15757719947121063,,6.487870333159016e-05,,,,,4,,0.012596742647594923,,,COMPLETE
724,724,54.166666666666664,2025-05-26 02:47:15.815514,2025-05-26 02:47:30.833832,0 days 00:00:15.018318,Adam,0.14807366769767402,,7.816324267605327e-05,,,,,0,,0.02138864205202269,,,COMPLETE
725,725,31.25,2025-05-26 02:47:30.892741,2025-05-26 02:47:37.472744,0 days 00:00:06.580003,Adam,0.1329591758201384,,0.00010773047487060535,,,,,2,,0.015865941557307764,,,PRUNED
726,726,33.333333333333336,2025-05-26 02:47:37.519418,2025-05-26 02:47:44.130007,0 days 00:00:06.610589,Adam,0.1082439874052332,,0.00021774191716438486,,,,,1,,0.02909022385368688,,,PRUNED
727,727,37.5,2025-05-26 02:47:44.177279,2025-05-26 02:47:50.819617,0 days 00:00:06.642338,Adam,0.16225629468689728,,0.00016879480313550165,,,,,3,,0.06324304510804846,,,PRUNED
728,728,33.333333333333336,2025-05-26 02:47:50.867070,2025-05-26 02:47:57.185186,0 days 00:00:06.318116,Adam,0.13916666766063515,,9.288958392764796e-05,,,,,6,,0.023666435658647424,,,PRUNED
729,729,33.333333333333336,2025-05-26 02:47:57.231431,2025-05-26 02:48:03.838292,0 days 00:00:06.606861,Adam,0.11998535422420598,,0.00012812805735046718,,,,,1,,0.01846314153447593,,,PRUNED
730,730,41.666666666666664,2025-05-26 02:48:03.885515,2025-05-26 02:48:18.852856,0 days 00:00:14.967341,Adam,0.17861494741549663,,7.696501624600612e-05,,,,,2,,0.03537746472471528,,,PRUNED
731,731,35.416666666666664,2025-05-26 02:48:18.926325,2025-05-26 02:48:25.535382,0 days 00:00:06.609057,Adam,0.1522378458184882,,0.0001481967547130924,,,,,0,,0.010037121033435577,,,PRUNED
732,732,27.083333333333332,2025-05-26 02:48:25.582540,2025-05-26 02:48:32.203166,0 days 00:00:06.620626,Adam,0.13167814808123354,,5.3875663781383234e-05,,,,,3,,0.8764560556840055,,,PRUNED
733,733,33.333333333333336,2025-05-26 02:48:32.250211,2025-05-26 02:48:38.884697,0 days 00:00:06.634486,Adam,0.14493067668528312,,0.00011857119762484513,,,,,4,,0.014415463492288848,,,PRUNED
734,734,33.333333333333336,2025-05-26 02:48:38.932078,2025-05-26 02:48:45.569743,0 days 00:00:06.637665,Adam,0.16876918452272544,,9.382462208035343e-05,,,,,2,,0.027214590246325335,,,PRUNED
735,735,43.75,2025-05-26 02:48:45.617737,2025-05-26 02:48:55.597790,0 days 00:00:09.980053,Adam,0.11498426305354038,,6.272147490078303e-05,,,,,1,,0.020496596906502514,,,PRUNED
736,736,,2025-05-26 02:48:55.645806,2025-05-26 02:49:01.320466,0 days 00:00:05.674660,SGD,0.2265708853623164,,,,0.004580318073371018,91.10016994827532,True,2,,,,9.25353809662666,PRUNED
737,737,58.333333333333336,2025-05-26 02:49:01.371209,2025-05-26 02:49:15.858547,0 days 00:00:14.487338,Adam,0.1538070346722337,,0.00010890999044107263,,,,,5,,0.038315593796543625,,,COMPLETE
738,738,33.333333333333336,2025-05-26 02:49:15.918669,2025-05-26 02:49:22.553523,0 days 00:00:06.634854,Adadelta,0.13865592610842967,1.9347442568970858,,,,,,3,0.4091106849123617,,,,PRUNED
739,739,50.0,2025-05-26 02:49:22.600445,2025-05-26 02:49:37.454327,0 days 00:00:14.853882,Adam,0.1254874650688108,,0.00017438348050313388,,,,,3,,0.01176007441275136,,,COMPLETE
740,740,37.5,2025-05-26 02:49:37.514504,2025-05-26 02:49:44.092024,0 days 00:00:06.577520,Adam,0.16194832495776829,,8.209898687901452e-05,,,,,0,,0.023881239907628606,,,PRUNED
741,741,52.083333333333336,2025-05-26 02:49:44.144044,2025-05-26 02:49:59.210010,0 days 00:00:15.065966,Adam,0.37738539908204344,,0.00027306262235243865,,,,,1,,0.031815381953218855,,,COMPLETE
742,742,37.5,2025-05-26 02:49:59.269227,2025-05-26 02:50:05.935224,0 days 00:00:06.665997,Adam,0.09798610460290832,,0.0001444362456070935,,,,,2,,0.01816125715959919,,,PRUNED
743,743,33.333333333333336,2025-05-26 02:50:05.982400,2025-05-26 02:50:12.568208,0 days 00:00:06.585808,Adam,0.14243507054037088,,0.00010300335798962127,,,,,4,,0.014725442198625585,,,PRUNED
744,744,33.333333333333336,2025-05-26 02:50:12.615143,2025-05-26 02:50:19.494442,0 days 00:00:06.879299,Adam,0.29085960106519354,,6.764089258968008e-05,,,,,1,,0.04702928696113305,,,PRUNED
745,745,60.416666666666664,2025-05-26 02:50:19.542340,2025-05-26 02:50:34.449724,0 days 00:00:14.907384,Adam,0.17211063815496014,,0.0001178384300976876,,,,,2,,0.026721313103666523,,,COMPLETE
746,746,33.333333333333336,2025-05-26 02:50:34.508973,2025-05-26 02:50:41.098875,0 days 00:00:06.589902,Adam,0.1505603631848411,,0.00019131999486819988,,,,,2,,0.020805111114295675,,,PRUNED
747,747,33.333333333333336,2025-05-26 02:50:41.145878,2025-05-26 02:50:47.716880,0 days 00:00:06.571002,Adam,0.12897354171551817,,4.551863280038241e-05,,,,,3,,0.016479622985425546,,,PRUNED
748,748,60.416666666666664,2025-05-26 02:50:47.763815,2025-05-26 02:51:02.774973,0 days 00:00:15.011158,Adam,0.10930763630544142,,8.66698514724021e-05,,,,,4,,0.03131985115274278,,,COMPLETE
749,749,56.25,2025-05-26 02:51:02.834401,2025-05-26 02:51:17.849094,0 days 00:00:15.014693,Adam,0.1570130264590202,,0.0001427671377256753,,,,,0,,0.024587741691970415,,,COMPLETE
750,750,35.416666666666664,2025-05-26 02:51:17.908255,2025-05-26 02:51:24.576424,0 days 00:00:06.668169,Adam,0.19918009648194585,,0.00012344659550869033,,,,,3,,0.0128397097064811,,,PRUNED
751,751,33.333333333333336,2025-05-26 02:51:24.623327,2025-05-26 02:51:31.240566,0 days 00:00:06.617239,Adam,0.13630064166707967,,7.299557027746762e-05,,,,,1,,0.03986916381173971,,,PRUNED
752,752,58.333333333333336,2025-05-26 02:51:31.287566,2025-05-26 02:51:46.284607,0 days 00:00:14.997041,Adam,0.3930995803374258,,9.633844098183403e-05,,,,,3,,0.01836004164199893,,,COMPLETE
753,753,33.333333333333336,2025-05-26 02:51:46.349456,2025-05-26 02:51:53.033373,0 days 00:00:06.683917,Adam,0.1805590051460023,,0.0027372984862938784,,,,,1,,0.021037370575095936,,,PRUNED
754,754,33.333333333333336,2025-05-26 02:51:53.080682,2025-05-26 02:51:59.686626,0 days 00:00:06.605944,Adam,0.14745348053855065,,0.00016104008485742644,,,,,2,,0.029893749357762938,,,PRUNED
755,755,33.333333333333336,2025-05-26 02:51:59.733942,2025-05-26 02:52:05.990810,0 days 00:00:06.256868,Adam,0.12025018069992263,,0.00021396584538552226,,,,,18,,0.015397085396331684,,,PRUNED
756,756,37.5,2025-05-26 02:52:06.035391,2025-05-26 02:52:12.646258,0 days 00:00:06.610867,Adam,0.08713365932234675,,3.2573883733345754e-05,,,,,0,,0.05735906576971717,,,PRUNED
757,757,35.416666666666664,2025-05-26 02:52:12.693741,2025-05-26 02:52:19.310892,0 days 00:00:06.617151,Adam,0.16524606079537676,,5.585829588030023e-05,,,,,4,,0.03612351869569042,,,PRUNED
758,758,33.333333333333336,2025-05-26 02:52:19.358433,2025-05-26 02:52:25.971916,0 days 00:00:06.613483,Adam,0.13513909044162759,,8.363659079347736e-05,,,,,3,,0.02401266178207998,,,PRUNED
759,759,,2025-05-26 02:52:26.019513,2025-05-26 02:52:32.536182,0 days 00:00:06.516669,SGD,0.07637461156042927,,,,1.7963573178761206e-05,57.11095654089609,False,1,,,,88.95389926507951,PRUNED
760,760,62.5,2025-05-26 02:52:32.578169,2025-05-26 02:52:47.511199,0 days 00:00:14.933030,Adam,0.1459667545178626,,0.00011347346549626734,,,,,2,,0.01148980972919875,,,COMPLETE
761,761,33.333333333333336,2025-05-26 02:52:47.571278,2025-05-26 02:52:54.151727,0 days 00:00:06.580449,Adam,0.14278601174113484,,0.00014637083457185948,,,,,2,,0.010050908127952734,,,PRUNED
762,762,33.333333333333336,2025-05-26 02:52:54.199315,2025-05-26 02:53:00.807374,0 days 00:00:06.608059,Adadelta,0.12808656217069345,94.23481362816301,,,,,,1,61.792876439949545,,,,PRUNED
763,763,33.333333333333336,2025-05-26 02:53:00.854912,2025-05-26 02:53:07.462118,0 days 00:00:06.607206,Adam,0.11761378559149085,,0.00011955928303518037,,,,,0,,0.012953379942458713,,,PRUNED
764,764,33.333333333333336,2025-05-26 02:53:07.511575,2025-05-26 02:53:14.113332,0 days 00:00:06.601757,Adam,0.13647397192008373,,0.0001908535485329218,,,,,2,,0.011919288987232934,,,PRUNED
765,765,33.333333333333336,2025-05-26 02:53:14.161022,2025-05-26 02:53:20.818530,0 days 00:00:06.657508,Adam,0.15056843759334257,,0.00012913507606586024,,,,,2,,0.011277575894211567,,,PRUNED
766,766,33.333333333333336,2025-05-26 02:53:20.865949,2025-05-26 02:53:27.393868,0 days 00:00:06.527919,Adam,0.12614314559700562,,0.00010753379895482683,,,,,1,,0.014454503551658135,,,PRUNED
767,767,54.166666666666664,2025-05-26 02:53:27.441732,2025-05-26 02:53:42.425638,0 days 00:00:14.983906,Adam,0.25890156331861097,,0.00017341203806532757,,,,,1,,0.011806759801795342,,,COMPLETE
768,768,37.5,2025-05-26 02:53:42.485416,2025-05-26 02:53:49.157770,0 days 00:00:06.672354,Adam,0.10446919820529452,,0.000253543250820207,,,,,2,,0.017056260277861175,,,PRUNED
769,769,54.166666666666664,2025-05-26 02:53:49.205439,2025-05-26 02:54:04.178340,0 days 00:00:14.972901,Adam,0.14322521839896576,,0.00014019895138522647,,,,,0,,0.013521537567324184,,,COMPLETE
770,770,33.333333333333336,2025-05-26 02:54:04.237983,2025-05-26 02:54:10.840540,0 days 00:00:06.602557,Adam,0.4424736056305991,,0.0001008160261574114,,,,,2,,0.24378554671873734,,,PRUNED
771,771,31.25,2025-05-26 02:54:10.887732,2025-05-26 02:54:17.425394,0 days 00:00:06.537662,Adam,0.1335553127022742,,0.0009276268657845446,,,,,1,,0.0170123901662313,,,PRUNED
772,772,33.333333333333336,2025-05-26 02:54:17.472690,2025-05-26 02:54:24.355062,0 days 00:00:06.882372,Adam,0.15418025783908085,,0.00012116171321476676,,,,,2,,0.5633801507295236,,,PRUNED
773,773,33.333333333333336,2025-05-26 02:54:24.403052,2025-05-26 02:54:31.007160,0 days 00:00:06.604108,Adam,0.12212405009556684,,0.00015824981011053476,,,,,1,,0.019930276986008116,,,PRUNED
774,774,33.333333333333336,2025-05-26 02:54:31.054553,2025-05-26 02:54:37.637236,0 days 00:00:06.582683,Adam,0.1431475392365711,,9.716180918223729e-05,,,,,0,,0.015079951055102193,,,PRUNED
775,775,35.416666666666664,2025-05-26 02:54:37.684833,2025-05-26 02:54:44.287600,0 days 00:00:06.602767,Adam,0.11484709193083241,,0.00013084798087027535,,,,,3,,0.0194350750800805,,,PRUNED
776,776,56.25,2025-05-26 02:54:44.335051,2025-05-26 02:54:59.258858,0 days 00:00:14.923807,Adam,0.13451926866769442,,8.730341961060271e-05,,,,,2,,0.011180677403003247,,,COMPLETE
777,777,35.416666666666664,2025-05-26 02:54:59.318545,2025-05-26 02:55:05.892537,0 days 00:00:06.573992,Adam,0.14741376391932598,,0.00010888918382429753,,,,,3,,0.010035844542106157,,,PRUNED
778,778,37.5,2025-05-26 02:55:05.939898,2025-05-26 02:55:12.552586,0 days 00:00:06.612688,Adam,0.1580160244391474,,6.670800141888709e-05,,,,,1,,0.014448480088047512,,,PRUNED
779,779,37.5,2025-05-26 02:55:12.600080,2025-05-26 02:55:19.260672,0 days 00:00:06.660592,Adam,0.12728178933355647,,0.0002183674508127359,,,,,2,,0.022851755726039594,,,PRUNED
780,780,52.083333333333336,2025-05-26 02:55:19.310181,2025-05-26 02:55:34.197168,0 days 00:00:14.886987,Adam,0.14418778406623334,,0.00015655382921049725,,,,,3,,0.10147750479875567,,,COMPLETE
781,781,33.333333333333336,2025-05-26 02:55:34.257204,2025-05-26 02:55:40.751581,0 days 00:00:06.494377,Adam,0.15664166656927106,,7.671673205274308e-05,,,,,2,,0.01686164063519378,,,PRUNED
782,782,33.333333333333336,2025-05-26 02:55:40.801717,2025-05-26 02:55:47.121354,0 days 00:00:06.319637,Adam,0.13539821002369776,,0.00012257125091228937,,,,,7,,0.027480013687223893,,,PRUNED
783,783,,2025-05-26 02:55:47.168230,2025-05-26 02:55:53.698353,0 days 00:00:06.530123,SGD,0.10326682696157165,,,,0.03570212959422082,16.703480010444657,True,5,,,,0.27234155243662694,PRUNED
784,784,54.166666666666664,2025-05-26 02:55:53.745494,2025-05-26 02:56:08.727503,0 days 00:00:14.982009,Adam,0.16316525898616147,,9.8874328272037e-05,,,,,0,,0.021349663405483336,,,COMPLETE
785,785,33.333333333333336,2025-05-26 02:56:08.787010,2025-05-26 02:56:15.296652,0 days 00:00:06.509642,Adadelta,0.1481450162550271,7.030952016437203,,,,,,1,0.06456415465674492,,,,PRUNED
786,786,31.25,2025-05-26 02:56:15.344461,2025-05-26 02:56:22.007269,0 days 00:00:06.662808,Adam,0.11478539084767306,,0.00034108411161300965,,,,,4,,1.4561815942802756,,,PRUNED
787,787,33.333333333333336,2025-05-26 02:56:22.057326,2025-05-26 02:56:28.652892,0 days 00:00:06.595566,Adam,0.49648075974027017,,0.00018406543048841412,,,,,3,,0.013411009456409799,,,PRUNED
788,788,33.333333333333336,2025-05-26 02:56:28.700846,2025-05-26 02:56:35.332512,0 days 00:00:06.631666,Adam,0.1359626078446354,,0.00013950457062020084,,,,,1,,0.025110656182628987,,,PRUNED
789,789,33.333333333333336,2025-05-26 02:56:35.380255,2025-05-26 02:56:41.986697,0 days 00:00:06.606442,Adam,0.12264079211023295,,8.294272470496475e-05,,,,,2,,0.018985721671153553,,,PRUNED
790,790,33.333333333333336,2025-05-26 02:56:42.034128,2025-05-26 02:56:48.543124,0 days 00:00:06.508996,Adam,0.15290645350104148,,0.00011053674242053217,,,,,2,,2.46182328335279,,,PRUNED
791,791,33.333333333333336,2025-05-26 02:56:48.590239,2025-05-26 02:56:55.255466,0 days 00:00:06.665227,Adam,0.16665640556149638,,0.04060984137365466,,,,,4,,0.015896460380719575,,,PRUNED
792,792,35.416666666666664,2025-05-26 02:56:55.302314,2025-05-26 02:57:01.833576,0 days 00:00:06.531262,Adam,0.14202168698468776,,6.621879440274421e-05,,,,,3,,0.02951357930701404,,,PRUNED
793,793,33.333333333333336,2025-05-26 02:57:01.880769,2025-05-26 02:57:08.504995,0 days 00:00:06.624226,Adam,0.31928722825164607,,9.536925399317845e-05,,,,,1,,0.022514649739131375,,,PRUNED
794,794,54.166666666666664,2025-05-26 02:57:08.551756,2025-05-26 02:57:23.558801,0 days 00:00:15.007045,Adam,0.09235823423976652,,0.00016372491331726434,,,,,1,,0.01359847801757085,,,COMPLETE
795,795,39.583333333333336,2025-05-26 02:57:23.618251,2025-05-26 02:57:31.888571,0 days 00:00:08.270320,Adam,0.12769099462682804,,0.0001306351450887293,,,,,0,,0.01925944237986095,,,PRUNED
796,796,54.166666666666664,2025-05-26 02:57:31.936003,2025-05-26 02:57:46.825174,0 days 00:00:14.889171,Adam,0.15617157214366043,,0.00011254865730627514,,,,,3,,0.011579772695174937,,,COMPLETE
797,797,47.916666666666664,2025-05-26 02:57:46.884635,2025-05-26 02:58:01.829540,0 days 00:00:14.944905,Adam,0.17172867794917168,,5.105855356548517e-05,,,,,2,,0.02587865328618885,,,COMPLETE
798,798,33.333333333333336,2025-05-26 02:58:01.888597,2025-05-26 02:58:08.388061,0 days 00:00:06.499464,Adam,0.14594541714049278,,8.114190697299131e-05,,,,,3,,0.03353132617558284,,,PRUNED
799,799,33.333333333333336,2025-05-26 02:58:08.434798,2025-05-26 02:58:15.043387,0 days 00:00:06.608589,Adam,0.1335017779350811,,0.000231806865712706,,,,,4,,0.015874852074598857,,,PRUNED
800,800,35.416666666666664,2025-05-26 02:58:15.090473,2025-05-26 02:58:21.736228,0 days 00:00:06.645755,Adam,0.21320816139772408,,0.0001473979740421917,,,,,0,,0.02245168031627734,,,PRUNED
801,801,56.25,2025-05-26 02:58:21.784867,2025-05-26 02:58:36.761867,0 days 00:00:14.977000,Adam,0.11500642081953844,,9.245192506808134e-05,,,,,1,,0.018170452369337342,,,COMPLETE
802,802,35.416666666666664,2025-05-26 02:58:36.821368,2025-05-26 02:58:43.351590,0 days 00:00:06.530222,Adam,0.15024383256678073,,5.723088559838797e-05,,,,,2,,0.029288180469164586,,,PRUNED
803,803,33.333333333333336,2025-05-26 02:58:43.399521,2025-05-26 02:58:50.065420,0 days 00:00:06.665899,Adam,0.12664229214385497,,2.193473926695748e-05,,,,,2,,0.044146774007866124,,,PRUNED
804,804,58.333333333333336,2025-05-26 02:58:50.112380,2025-05-26 02:59:04.788156,0 days 00:00:14.675776,Adam,0.15944417716073037,,0.00018951022492127688,,,,,5,,0.012960482343995775,,,COMPLETE
805,805,45.833333333333336,2025-05-26 02:59:04.848240,2025-05-26 02:59:19.866178,0 days 00:00:15.017938,Adam,0.13731502891989686,,0.00010963369467181925,,,,,1,,0.02517231180415245,,,PRUNED
806,806,,2025-05-26 02:59:19.913851,2025-05-26 02:59:26.443884,0 days 00:00:06.530033,SGD,0.10622025059533736,,,,0.0017658329635073739,71.55361923627578,False,3,,,,0.020140119215346315,PRUNED
807,807,29.166666666666668,2025-05-26 02:59:26.489204,2025-05-26 02:59:33.104568,0 days 00:00:06.615364,Adam,0.14416377755493673,,3.8392310472371195e-05,,,,,2,,28.969173714637755,,,PRUNED
