,number,value,datetime_start,datetime_complete,duration,params_algorithm,params_dropout_rate,params_lr_Adadelta,params_lr_Adam,params_lr_AdamW,params_lr_SGD,params_momentum_SGD,params_nesterov_SGD,params_suggested_freeze,params_weight_decay_Adadelta,params_weight_decay_Adam,params_weight_decay_AdamW,params_weight_decay_SGD,state
0,0,33.333333333333336,2025-05-25 05:12:24.864512,2025-05-25 05:12:35.864595,0 days 00:00:11.000083,Adadelta,0.4753571532049581,0.017073967431528128,,,,,,11,29.154431891537552,,,,COMPLETE
1,1,37.5,2025-05-25 05:12:35.922395,2025-05-25 05:12:48.301062,0 days 00:00:12.378667,Adam,0.35403628889802274,,5.3370327626039544e-05,,,,,19,,0.05415244119402541,,,COMPLETE
2,2,29.166666666666668,2025-05-25 05:12:48.350623,2025-05-25 05:12:59.283070,0 days 00:00:10.932447,AdamW,0.2623782158161189,,,0.00014742753159914678,,,,9,,,0.0005404103854647331,,COMPLETE
3,3,33.333333333333336,2025-05-25 05:12:59.321840,2025-05-25 05:13:10.199233,0 days 00:00:10.877393,AdamW,0.3925879806965068,,,0.0026926469100861782,,,,14,,,0.00021930485556643703,,COMPLETE
4,4,33.333333333333336,2025-05-25 05:13:10.249914,2025-05-25 05:13:22.385767,0 days 00:00:12.135853,Adadelta,0.4744427686266666,5.456725485601478,,,,,,2,0.5762487216478605,,,,COMPLETE
5,5,52.083333333333336,2025-05-25 05:13:22.436785,2025-05-25 05:13:36.535369,0 days 00:00:14.098584,Adam,0.2475884550556351,,0.00017654048052495074,,,,,3,,1.2030178871154673,,,COMPLETE
6,6,33.333333333333336,2025-05-25 05:13:36.586584,2025-05-25 05:13:46.104245,0 days 00:00:09.517661,Adadelta,0.09242722776276352,2.463768595899747,,,,,,17,48.696409415209004,,,,COMPLETE
7,7,33.333333333333336,2025-05-25 05:13:46.154577,2025-05-25 05:14:00.825343,0 days 00:00:14.670766,AdamW,0.0979914312095726,,,0.02065142557895925,,,,2,,,0.0005170191786366995,,COMPLETE
8,8,37.5,2025-05-25 05:14:00.874718,2025-05-25 05:14:12.910765,0 days 00:00:12.036047,SGD,0.27134804157912423,,,,0.012273800987852962,0.5621564911890039,True,8,,,,0.06235377135673159,COMPLETE
9,9,33.333333333333336,2025-05-25 05:14:12.961164,2025-05-25 05:14:23.205577,0 days 00:00:10.244413,SGD,0.38563517334297287,,,,0.0031130959561221226,6.365199445099503,False,23,,,,0.2106648601704221,PRUNED
10,10,33.333333333333336,2025-05-25 05:14:23.232882,2025-05-25 05:14:33.222331,0 days 00:00:09.989449,Adam,0.0029985914779085965,,0.008677867436457916,,,,,30,,15.014564618033251,,,COMPLETE
11,11,29.166666666666668,2025-05-25 05:14:33.272238,2025-05-25 05:14:39.379489,0 days 00:00:06.107251,Adam,0.32347484927641995,,3.1260711108007855e-05,,,,,21,,0.031784244157476306,,,PRUNED
12,12,29.166666666666668,2025-05-25 05:14:39.413608,2025-05-25 05:14:44.222594,0 days 00:00:04.808986,Adam,0.1780456116674968,,7.687186129682777e-05,,,,,26,,0.263700662588761,,,PRUNED
13,13,39.583333333333336,2025-05-25 05:14:44.259359,2025-05-25 05:14:56.918718,0 days 00:00:12.659359,Adam,0.21355615281666585,,0.0003330093350773776,,,,,17,,1.6147487621964751,,,COMPLETE
14,14,35.416666666666664,2025-05-25 05:14:56.969059,2025-05-25 05:15:09.137660,0 days 00:00:12.168601,Adam,0.1738216710439381,,0.0009641958295232134,,,,,14,,4.361999801372571,,,COMPLETE
15,15,33.333333333333336,2025-05-25 05:15:09.184872,2025-05-25 05:15:22.803916,0 days 00:00:13.619044,Adam,0.1944592741769797,,0.0011399654597808386,,,,,5,,1.1615601662040336,,,COMPLETE
16,16,33.333333333333336,2025-05-25 05:15:22.843080,2025-05-25 05:15:35.893898,0 days 00:00:13.050818,Adam,0.2303454029449063,,0.0004768833467042744,,,,,0,,82.01599076242123,,,COMPLETE
17,17,35.416666666666664,2025-05-25 05:15:35.944066,2025-05-25 05:15:46.640403,0 days 00:00:10.696337,Adam,0.10592991582002781,,0.0003012247646880887,,,,,12,,0.8260710761458845,,,COMPLETE
18,18,,2025-05-25 05:15:46.685979,2025-05-25 05:15:52.252761,0 days 00:00:05.566782,SGD,0.30922478699919376,,,,3.908443370991221e-05,97.4924546650071,False,6,,,,25.319619734613873,PRUNED
19,19,33.333333333333336,2025-05-25 05:15:52.290249,2025-05-25 05:16:04.889234,0 days 00:00:12.598985,Adam,0.2235277002969614,,0.08525986234166626,,,,,25,,5.384071515998923,,,COMPLETE
20,20,27.083333333333332,2025-05-25 05:16:04.938924,2025-05-25 05:16:09.722955,0 days 00:00:04.784031,Adam,0.13788403882202435,,1.1706679618278217e-05,,,,,19,,0.23039739513107133,,,PRUNED
21,21,27.083333333333332,2025-05-25 05:16:09.756628,2025-05-25 05:16:22.414839,0 days 00:00:12.658211,Adam,0.36073499568272394,,9.732654303123127e-05,,,,,17,,0.04736319289981568,,,COMPLETE
22,22,41.666666666666664,2025-05-25 05:16:22.478992,2025-05-25 05:16:33.018718,0 days 00:00:10.539726,Adam,0.30132179090606526,,0.000141196640363914,,,,,20,,0.8013518705510608,,,COMPLETE
23,23,33.333333333333336,2025-05-25 05:16:33.068767,2025-05-25 05:16:45.630236,0 days 00:00:12.561469,Adam,0.2735611329610561,,0.00015735561829238414,,,,,21,,0.9181915511704529,,,COMPLETE
24,24,33.333333333333336,2025-05-25 05:16:45.680163,2025-05-25 05:16:55.374981,0 days 00:00:09.694818,Adam,0.3015145756374827,,0.002734972446722128,,,,,28,,3.15099878527756,,,COMPLETE
25,25,33.333333333333336,2025-05-25 05:16:55.424566,2025-05-25 05:17:05.369387,0 days 00:00:09.944821,Adam,0.4165880282790245,,0.00024007302963576348,,,,,16,,0.30178064038428276,,,PRUNED
26,26,33.333333333333336,2025-05-25 05:17:05.406080,2025-05-25 05:17:16.574767,0 days 00:00:11.168687,AdamW,0.20048311882612463,,,1.6462494656141686e-05,,,,12,,,0.00978075905358462,,COMPLETE
27,27,33.333333333333336,2025-05-25 05:17:16.625374,2025-05-25 05:17:24.412066,0 days 00:00:07.786692,SGD,0.14733218300974946,,,,1.8001158293361365e-05,68.54278835088991,True,23,,,,90.04727869618729,PRUNED
28,28,33.333333333333336,2025-05-25 05:17:24.447213,2025-05-25 05:17:34.066568,0 days 00:00:09.619355,Adadelta,0.2339528640710009,84.18841767904223,,,,,,20,0.014236305881279616,,,,PRUNED
29,29,27.083333333333332,2025-05-25 05:17:34.100065,2025-05-25 05:17:41.674718,0 days 00:00:07.574653,Adadelta,0.046525854755602225,0.0163326397242079,,,,,,10,0.010094931633979147,,,,PRUNED
30,30,33.333333333333336,2025-05-25 05:17:41.710030,2025-05-25 05:17:49.948665,0 days 00:00:08.238635,Adam,0.431437086360815,,2.339484639506941e-05,,,,,15,,14.964549037785341,,,PRUNED
31,31,33.333333333333336,2025-05-25 05:17:49.986717,2025-05-25 05:17:59.564942,0 days 00:00:09.578225,Adam,0.3452354285306122,,5.765222660366239e-05,,,,,18,,0.014805849264902488,,,COMPLETE
32,32,37.5,2025-05-25 05:17:59.604952,2025-05-25 05:18:12.192787,0 days 00:00:12.587835,Adam,0.29492911754624995,,0.00013372501428914556,,,,,22,,0.07194964246699825,,,COMPLETE
33,33,33.333333333333336,2025-05-25 05:18:12.243607,2025-05-25 05:18:23.354227,0 days 00:00:11.110620,Adam,0.25689266590150933,,0.0005410127070272793,,,,,25,,2.4578359559478544,,,COMPLETE
34,34,33.333333333333336,2025-05-25 05:18:23.391962,2025-05-25 05:18:28.677259,0 days 00:00:05.285297,AdamW,0.35109830050646784,,,0.09946126450457445,,,,14,,,0.0045448386073854916,,PRUNED
35,35,33.333333333333336,2025-05-25 05:18:28.706002,2025-05-25 05:18:36.265076,0 days 00:00:07.559074,Adam,0.32959845104178465,,4.8734984220654607e-05,,,,,19,,0.12552562288275543,,,COMPLETE
36,36,35.416666666666664,2025-05-25 05:18:36.315402,2025-05-25 05:18:48.935684,0 days 00:00:12.620282,Adadelta,0.4986801883039284,0.18196467231102068,,,,,,13,0.5979116257704502,,,,COMPLETE
37,37,41.666666666666664,2025-05-25 05:18:48.986269,2025-05-25 05:19:00.759998,0 days 00:00:11.773729,AdamW,0.3767869752235491,,,0.0006361226904953428,,,,17,,,0.00010184640884966879,,COMPLETE
38,38,33.333333333333336,2025-05-25 05:19:00.807725,2025-05-25 05:19:11.399005,0 days 00:00:10.591280,AdamW,0.4392854451333647,,,0.0005516789129968933,,,,16,,,0.00013322396156587648,,COMPLETE
39,39,47.916666666666664,2025-05-25 05:19:11.446477,2025-05-25 05:19:21.759335,0 days 00:00:10.312858,AdamW,0.37804229836266623,,,7.811352829507415e-05,,,,11,,,0.0015860512586638492,,COMPLETE
40,40,50.0,2025-05-25 05:19:21.809118,2025-05-25 05:19:34.848260,0 days 00:00:13.039142,AdamW,0.4000508766094699,,,4.1893596862210494e-05,,,,7,,,0.0019624477360769593,,COMPLETE
41,41,54.166666666666664,2025-05-25 05:19:34.898891,2025-05-25 05:19:44.477681,0 days 00:00:09.578790,AdamW,0.3833949466139803,,,4.014561978607267e-05,,,,7,,,0.001757554333451538,,COMPLETE
42,42,39.583333333333336,2025-05-25 05:19:44.515528,2025-05-25 05:19:54.155072,0 days 00:00:09.639544,AdamW,0.45679536157746486,,,2.6764015585258727e-05,,,,7,,,0.002017967186066283,,COMPLETE
43,43,54.166666666666664,2025-05-25 05:19:54.204581,2025-05-25 05:20:08.482420,0 days 00:00:14.277839,AdamW,0.4054210964349363,,,0.00012041490311410282,,,,4,,,0.0017276062279176514,,COMPLETE
44,44,62.5,2025-05-25 05:20:08.529917,2025-05-25 05:20:21.441651,0 days 00:00:12.911734,AdamW,0.4013289521192077,,,7.227237745894655e-05,,,,4,,,0.0017497746295945455,,COMPLETE
45,45,58.333333333333336,2025-05-25 05:20:21.506229,2025-05-25 05:20:36.208796,0 days 00:00:14.702567,AdamW,0.4027350596901491,,,7.088424862840444e-05,,,,4,,,0.0022746995002867485,,COMPLETE
46,46,43.75,2025-05-25 05:20:36.260393,2025-05-25 05:20:50.934022,0 days 00:00:14.673629,AdamW,0.4101320728802785,,,0.00015650562583064098,,,,4,,,0.003429096987927951,,COMPLETE
47,47,45.833333333333336,2025-05-25 05:20:50.983985,2025-05-25 05:21:05.268541,0 days 00:00:14.284556,AdamW,0.47033792604351743,,,0.00013945123149732778,,,,3,,,0.0009690634019643146,,COMPLETE
48,48,33.333333333333336,2025-05-25 05:21:05.318440,2025-05-25 05:21:16.862979,0 days 00:00:11.544539,AdamW,0.4994316460754328,,,1.0441252608442617e-05,,,,1,,,0.0012338714720202908,,PRUNED
49,49,31.25,2025-05-25 05:21:16.904509,2025-05-25 05:21:22.962585,0 days 00:00:06.058076,AdamW,0.4449154028095889,,,4.517663752843518e-05,,,,3,,,0.0031665039430069024,,PRUNED
50,50,39.583333333333336,2025-05-25 05:21:22.996534,2025-05-25 05:21:35.412135,0 days 00:00:12.415601,AdamW,0.4226075160012001,,,0.0003195647942689299,,,,9,,,0.0007811805358133069,,COMPLETE
51,51,50.0,2025-05-25 05:21:35.460123,2025-05-25 05:21:48.231677,0 days 00:00:12.771554,AdamW,0.40206278695794073,,,4.545811173442922e-05,,,,6,,,0.0020155396836601747,,COMPLETE
52,52,58.333333333333336,2025-05-25 05:21:48.281986,2025-05-25 05:22:02.755066,0 days 00:00:14.473080,AdamW,0.39390512652164184,,,5.183899822932672e-05,,,,5,,,0.0023594879199339974,,COMPLETE
53,53,47.916666666666664,2025-05-25 05:22:02.805121,2025-05-25 05:22:17.294458,0 days 00:00:14.489337,AdamW,0.3859127355239573,,,7.487409896260576e-05,,,,1,,,0.002834797829031971,,COMPLETE
54,54,27.083333333333332,2025-05-25 05:22:17.345247,2025-05-25 05:22:27.143555,0 days 00:00:09.798308,AdamW,0.3639500422757762,,,0.002204969618691615,,,,4,,,0.005321463016865182,,PRUNED
55,55,62.5,2025-05-25 05:22:27.177779,2025-05-25 05:22:39.802452,0 days 00:00:12.624673,AdamW,0.47080327632215885,,,2.5245419900424137e-05,,,,5,,,0.0014621812894350153,,COMPLETE
56,56,50.0,2025-05-25 05:22:39.849038,2025-05-25 05:22:53.063451,0 days 00:00:13.214413,AdamW,0.4749033652761307,,,2.4163164440931174e-05,,,,5,,,0.0014336481868594262,,COMPLETE
57,57,33.333333333333336,2025-05-25 05:22:53.113122,2025-05-25 05:22:58.493156,0 days 00:00:05.380034,AdamW,0.45373919973505344,,,8.995869771921078e-05,,,,8,,,0.0023341141276853523,,PRUNED
58,58,56.25,2025-05-25 05:22:58.529429,2025-05-25 05:23:09.945035,0 days 00:00:11.415606,AdamW,0.32538064885073287,,,2.8351137448144202e-05,,,,0,,,0.0011490392396117926,,COMPLETE
59,59,,2025-05-25 05:23:09.995711,2025-05-25 05:23:15.646248,0 days 00:00:05.650537,SGD,0.3366413604433703,,,,0.08966166158884115,47.422449209730935,True,0,,,,2.746232834476269,PRUNED
60,60,37.5,2025-05-25 05:23:15.679319,2025-05-25 05:23:29.109475,0 days 00:00:13.430156,AdamW,0.36506092586747907,,,1.7397626284616147e-05,,,,2,,,0.0009990289967455436,,COMPLETE
61,61,50.0,2025-05-25 05:23:29.159936,2025-05-25 05:23:43.467113,0 days 00:00:14.307177,AdamW,0.39218495908624906,,,4.6355421227384955e-05,,,,5,,,0.0014561932016835504,,COMPLETE
62,62,52.083333333333336,2025-05-25 05:23:43.517373,2025-05-25 05:23:55.595110,0 days 00:00:12.077737,AdamW,0.4167440133699792,,,4.145711679125455e-05,,,,4,,,0.0016780925879041847,,COMPLETE
63,63,31.25,2025-05-25 05:23:55.642901,2025-05-25 05:24:01.062170,0 days 00:00:05.419269,AdamW,0.32141584283547353,,,2.0561608774276034e-05,,,,2,,,0.001197384543961218,,PRUNED
64,64,60.416666666666664,2025-05-25 05:24:01.096104,2025-05-25 05:24:14.911688,0 days 00:00:13.815584,AdamW,0.43414892281808354,,,0.00024825728707941015,,,,6,,,0.00266668140613554,,COMPLETE
65,65,39.583333333333336,2025-05-25 05:24:14.957648,2025-05-25 05:24:26.608123,0 days 00:00:11.650475,AdamW,0.4383560601631973,,,1.0947357574967845e-05,,,,6,,,0.0026736413357428793,,COMPLETE
66,66,29.166666666666668,2025-05-25 05:24:26.658202,2025-05-25 05:24:32.784712,0 days 00:00:06.126510,AdamW,0.45636188607470485,,,0.00023077720632584128,,,,8,,,0.0006477942869311065,,PRUNED
67,67,33.333333333333336,2025-05-25 05:24:32.822338,2025-05-25 05:24:38.221128,0 days 00:00:05.398790,AdamW,0.479735801090465,,,7.241546807476957e-05,,,,7,,,0.0039814861584243025,,PRUNED
68,68,33.333333333333336,2025-05-25 05:24:38.246927,2025-05-25 05:24:41.673387,0 days 00:00:03.426460,SGD,0.42702533820897676,,,,0.0003048968591961953,39.47777954482088,False,9,,,,0.012336726198866431,PRUNED
69,69,33.333333333333336,2025-05-25 05:24:41.699245,2025-05-25 05:24:45.467212,0 days 00:00:03.767967,Adadelta,0.2792786383681448,73.7299211254299,,,,,,0,8.396148259479292,,,,PRUNED
70,70,56.25,2025-05-25 05:24:45.496100,2025-05-25 05:24:56.800242,0 days 00:00:11.304142,AdamW,0.3658487037293443,,,2.844558576546198e-05,,,,1,,,0.0024571460386901872,,COMPLETE
71,71,33.333333333333336,2025-05-25 05:24:56.850214,2025-05-25 05:25:05.070006,0 days 00:00:08.219792,AdamW,0.37853496999898406,,,3.2541820279516416e-05,,,,1,,,0.0024050717692522664,,PRUNED
72,72,60.416666666666664,2025-05-25 05:25:05.110271,2025-05-25 05:25:16.668260,0 days 00:00:11.557989,AdamW,0.35210683580113106,,,6.562148761650005e-05,,,,3,,,0.0022955626480305356,,COMPLETE
73,73,56.25,2025-05-25 05:25:16.706682,2025-05-25 05:25:24.659019,0 days 00:00:07.952337,AdamW,0.3544374330404029,,,6.576600378865699e-05,,,,3,,,0.0025136046918524707,,COMPLETE
74,74,47.916666666666664,2025-05-25 05:25:24.697182,2025-05-25 05:25:36.034082,0 days 00:00:11.336900,AdamW,0.3365104138124555,,,0.0002196114391677589,,,,2,,,0.0033020390809312718,,COMPLETE
75,75,45.833333333333336,2025-05-25 05:25:36.084202,2025-05-25 05:25:50.858908,0 days 00:00:14.774706,AdamW,0.32007954198791283,,,2.037738560234762e-05,,,,1,,,0.005598987486349543,,COMPLETE
76,76,56.25,2025-05-25 05:25:50.909024,2025-05-25 05:26:05.336015,0 days 00:00:14.426991,AdamW,0.36565240139705696,,,8.719089707634195e-05,,,,5,,,0.0012148792480743656,,COMPLETE
77,77,54.166666666666664,2025-05-25 05:26:05.386474,2025-05-25 05:26:20.083726,0 days 00:00:14.697252,AdamW,0.4004895928261692,,,0.0004127678194493361,,,,3,,,0.0004425547975044844,,COMPLETE
78,78,33.333333333333336,2025-05-25 05:26:20.135261,2025-05-25 05:26:28.332247,0 days 00:00:08.196986,AdamW,0.3458112244898179,,,0.0012040409060669714,,,,0,,,0.0022401319393692016,,PRUNED
79,79,,2025-05-25 05:26:28.366643,2025-05-25 05:26:33.985772,0 days 00:00:05.619129,SGD,0.2893112816556556,,,,0.0004065594461285843,96.93992695377634,True,5,,,,3.281328900824506,PRUNED
80,80,33.333333333333336,2025-05-25 05:26:34.019553,2025-05-25 05:26:47.938865,0 days 00:00:13.919312,Adadelta,0.30985168031741595,0.21253531748853383,,,,,,6,0.09847742976508565,,,,COMPLETE
81,81,52.083333333333336,2025-05-25 05:26:47.989478,2025-05-25 05:27:02.764851,0 days 00:00:14.775373,AdamW,0.3528769558457036,,,5.8895417884884077e-05,,,,3,,,0.0025322448534830237,,COMPLETE
82,82,37.5,2025-05-25 05:27:02.815473,2025-05-25 05:27:12.071406,0 days 00:00:09.255933,AdamW,0.36916349893941053,,,2.6063501318541178e-05,,,,2,,,0.0027973119135948975,,PRUNED
83,83,56.25,2025-05-25 05:27:12.105949,2025-05-25 05:27:25.636260,0 days 00:00:13.530311,AdamW,0.41601620482042906,,,0.00011810579052064551,,,,3,,,0.003672109530995934,,COMPLETE
84,84,58.333333333333336,2025-05-25 05:27:25.674391,2025-05-25 05:27:35.713599,0 days 00:00:10.039208,AdamW,0.391838935516397,,,6.728904686374283e-05,,,,4,,,0.0020037728359128012,,COMPLETE
85,85,33.333333333333336,2025-05-25 05:27:35.763961,2025-05-25 05:27:43.874199,0 days 00:00:08.110238,AdamW,0.430618244795614,,,0.013076917398920904,,,,4,,,0.0018126917871639947,,PRUNED
86,86,50.0,2025-05-25 05:27:43.914495,2025-05-25 05:27:58.723857,0 days 00:00:14.809362,AdamW,0.3947098360657533,,,3.437691357213039e-05,,,,1,,,0.0014630079325973018,,COMPLETE
87,87,29.166666666666668,2025-05-25 05:27:58.774606,2025-05-25 05:28:05.214927,0 days 00:00:06.440321,AdamW,0.46422555255795755,,,0.00017470547121737308,,,,6,,,0.0018274061423445775,,PRUNED
88,88,27.083333333333332,2025-05-25 05:28:05.248757,2025-05-25 05:28:11.369853,0 days 00:00:06.121096,AdamW,0.44362911584042486,,,1.2846116444408964e-05,,,,31,,,0.0021622005689271103,,PRUNED
89,89,56.25,2025-05-25 05:28:11.407767,2025-05-25 05:28:26.255550,0 days 00:00:14.847783,AdamW,0.4125312893499044,,,0.00011510557598430157,,,,2,,,0.0042103098693464045,,COMPLETE
90,90,56.25,2025-05-25 05:28:26.306329,2025-05-25 05:28:40.371264,0 days 00:00:14.064935,AdamW,0.37481750934217706,,,4.9587744342607304e-05,,,,5,,,0.0008682292159634504,,COMPLETE
91,91,45.833333333333336,2025-05-25 05:28:40.425055,2025-05-25 05:28:55.424775,0 days 00:00:14.999720,AdamW,0.35574850354310766,,,7.739612523791999e-05,,,,4,,,0.002062715023981142,,COMPLETE
92,92,54.166666666666664,2025-05-25 05:28:55.475593,2025-05-25 05:29:10.283335,0 days 00:00:14.807742,AdamW,0.4885854710207717,,,6.367027651110522e-05,,,,3,,,0.0028540830992597856,,COMPLETE
93,93,33.333333333333336,2025-05-25 05:29:10.334096,2025-05-25 05:29:18.368232,0 days 00:00:08.034136,AdamW,0.38852889986519956,,,3.070008612377223e-05,,,,0,,,0.0013699756300913208,,PRUNED
94,94,43.75,2025-05-25 05:29:18.408948,2025-05-25 05:29:33.189677,0 days 00:00:14.780729,AdamW,0.34047513690294207,,,6.213189501503252e-05,,,,2,,,0.003103318613825822,,COMPLETE
95,95,33.333333333333336,2025-05-25 05:29:33.240005,2025-05-25 05:29:41.097920,0 days 00:00:07.857915,AdamW,0.3940750263044653,,,1.520811512632174e-05,,,,3,,,0.0017195239630709974,,PRUNED
96,96,31.25,2025-05-25 05:29:41.128387,2025-05-25 05:29:44.896575,0 days 00:00:03.768188,AdamW,0.4240322859985609,,,0.00010533138602834357,,,,1,,,0.002401421109554761,,PRUNED
97,97,33.333333333333336,2025-05-25 05:29:44.936729,2025-05-25 05:29:53.122126,0 days 00:00:08.185397,Adadelta,0.31341082987156593,14.712655582467917,,,,,,4,3.9656030001495144,,,,PRUNED
98,98,47.916666666666664,2025-05-25 05:29:53.162121,2025-05-25 05:30:03.779514,0 days 00:00:10.617393,AdamW,0.33130253249144137,,,3.2065176707735953e-05,,,,7,,,0.0020002365094653816,,COMPLETE
99,99,31.25,2025-05-25 05:30:03.817023,2025-05-25 05:30:08.188157,0 days 00:00:04.371134,AdamW,0.35807733622412846,,,5.179449037883421e-05,,,,10,,,0.001555977200017561,,PRUNED
100,100,,2025-05-25 05:30:08.226210,2025-05-25 05:30:14.594682,0 days 00:00:06.368472,SGD,0.3826572131754404,,,,0.05532044248245823,26.84567938800118,False,5,,,,0.3496320949987715,PRUNED
101,101,33.333333333333336,2025-05-25 05:30:14.628146,2025-05-25 05:30:22.097574,0 days 00:00:07.469428,AdamW,0.40710299743968953,,,8.786888733464307e-05,,,,8,,,0.0011820305210604846,,PRUNED
102,102,58.333333333333336,2025-05-25 05:30:22.131924,2025-05-25 05:30:29.950545,0 days 00:00:07.818621,AdamW,0.36425228081546973,,,0.0001568016813237768,,,,6,,,0.0013507432869437526,,COMPLETE
103,103,56.25,2025-05-25 05:30:29.989781,2025-05-25 05:30:38.948316,0 days 00:00:08.958535,AdamW,0.37365809787942267,,,0.00016579782817959044,,,,6,,,0.0010533794359172696,,COMPLETE
104,104,43.75,2025-05-25 05:30:38.997573,2025-05-25 05:30:47.593903,0 days 00:00:08.596330,AdamW,0.35440411969062013,,,3.8983983345734805e-05,,,,4,,,0.0021730792196861764,,COMPLETE
105,105,41.666666666666664,2025-05-25 05:30:47.631496,2025-05-25 05:30:56.204271,0 days 00:00:08.572775,AdamW,0.4356162434111274,,,0.00026229829889525306,,,,2,,,0.0016782547450688722,,COMPLETE
106,106,31.25,2025-05-25 05:30:56.241400,2025-05-25 05:30:59.232934,0 days 00:00:02.991534,AdamW,0.4505325758708999,,,2.50017367701437e-05,,,,3,,,0.0026558012694188854,,PRUNED
107,107,33.333333333333336,2025-05-25 05:30:59.258624,2025-05-25 05:31:03.001453,0 days 00:00:03.742829,AdamW,0.34498866219657004,,,0.00015238434915912624,,,,6,,,0.0013244129584410401,,PRUNED
108,108,56.25,2025-05-25 05:31:03.030388,2025-05-25 05:31:15.516074,0 days 00:00:12.485686,AdamW,0.40290085538251297,,,6.16825806298943e-05,,,,5,,,0.0019183109666925941,,COMPLETE
109,109,41.666666666666664,2025-05-25 05:31:15.567090,2025-05-25 05:31:27.308382,0 days 00:00:11.741292,AdamW,0.4625532707072922,,,0.0005902054168796965,,,,1,,,0.00519407261920124,,COMPLETE
110,110,25.0,2025-05-25 05:31:27.346392,2025-05-25 05:31:30.422344,0 days 00:00:03.075952,AdamW,0.38804697644405617,,,1.9091523582413252e-05,,,,7,,,0.0034260987779578377,,PRUNED
111,111,56.25,2025-05-25 05:31:30.448831,2025-05-25 05:31:38.637493,0 days 00:00:08.188662,AdamW,0.3605987622557802,,,9.622045031251996e-05,,,,5,,,0.0010823379413771516,,COMPLETE
112,112,52.083333333333336,2025-05-25 05:31:38.688277,2025-05-25 05:31:53.466239,0 days 00:00:14.777962,AdamW,0.3684259900836606,,,8.202319318443866e-05,,,,4,,,0.0008770467700433567,,COMPLETE
113,113,33.333333333333336,2025-05-25 05:31:53.518805,2025-05-25 05:32:00.953142,0 days 00:00:07.434337,AdamW,0.36938114704434893,,,4.425290095480943e-05,,,,8,,,0.0012811526843605429,,PRUNED
