,number,value,datetime_start,datetime_complete,duration,params_algorithm,params_dropout_rate,params_lr_Adadelta,params_lr_Adam,params_lr_AdamW,params_lr_SGD,params_momentum_SGD,params_nesterov_SGD,params_suggested_freeze,params_weight_decay_Adadelta,params_weight_decay_Adam,params_weight_decay_AdamW,params_weight_decay_SGD,state
460,460,54.166666666666664,2025-05-26 02:08:57.016004,2025-05-26 02:09:11.901759,0 days 00:00:14.885755,Adam,0.1200417560502063,,0.00015435405688640666,,,,,3,,0.013643453595828008,,,COMPLETE
461,461,35.416666666666664,2025-05-26 02:09:11.956890,2025-05-26 02:09:18.516428,0 days 00:00:06.559538,Adam,0.1592249795772209,,0.00010189341680243598,,,,,1,,0.04610628961658449,,,PRUNED
462,462,39.583333333333336,2025-05-26 02:09:18.555385,2025-05-26 02:09:33.451131,0 days 00:00:14.895746,Adam,0.1330958428428899,,0.00037442561770458806,,,,,2,,0.02073319158075416,,,COMPLETE
463,463,58.333333333333336,2025-05-26 02:09:33.505965,2025-05-26 02:09:48.375064,0 days 00:00:14.869099,Adam,0.1679032776687527,,0.00011850848921072993,,,,,3,,0.032302819957240374,,,COMPLETE
464,464,41.666666666666664,2025-05-26 02:09:48.430897,2025-05-26 02:09:58.333144,0 days 00:00:09.902247,Adam,0.1506207428485494,,8.356718020699579e-05,,,,,2,,0.023568796214441655,,,PRUNED
465,465,56.25,2025-05-26 02:09:58.378140,2025-05-26 02:10:13.278174,0 days 00:00:14.900034,Adam,0.14136696820249448,,0.00023657765357576525,,,,,1,,0.01818675119419497,,,COMPLETE
466,466,33.333333333333336,2025-05-26 02:10:13.333403,2025-05-26 02:10:19.967807,0 days 00:00:06.634404,Adam,0.1749007714062182,,0.00014145788473389872,,,,,0,,0.01089416432059511,,,PRUNED
467,467,31.25,2025-05-26 02:10:20.007692,2025-05-26 02:10:26.586337,0 days 00:00:06.578645,Adam,0.1568439328721888,,7.03775220010352e-05,,,,,2,,0.02878953814835803,,,PRUNED
468,468,33.333333333333336,2025-05-26 02:10:26.625362,2025-05-26 02:10:33.385897,0 days 00:00:06.760535,Adam,0.12653947107943128,,0.00019475594936735883,,,,,4,,0.015489045065487924,,,PRUNED
469,469,33.333333333333336,2025-05-26 02:10:33.429601,2025-05-26 02:10:39.957781,0 days 00:00:06.528180,Adam,0.13805551010103914,,5.581485144395273e-05,,,,,3,,0.11403961677079974,,,PRUNED
470,470,33.333333333333336,2025-05-26 02:10:40.002457,2025-05-26 02:10:46.471217,0 days 00:00:06.468760,Adam,0.1609507114903789,,9.459170115372638e-05,,,,,1,,0.022916472566828473,,,PRUNED
471,471,33.333333333333336,2025-05-26 02:10:46.515008,2025-05-26 02:10:56.439471,0 days 00:00:09.924463,Adam,0.14663189086885897,,0.001305990793038364,,,,,2,,0.019085584175771095,,,PRUNED
472,472,35.416666666666664,2025-05-26 02:10:56.478680,2025-05-26 02:11:02.997498,0 days 00:00:06.518818,Adam,0.11366932632741303,,0.00011736202524731505,,,,,3,,0.035595359522404044,,,PRUNED
473,473,33.333333333333336,2025-05-26 02:11:03.036882,2025-05-26 02:11:09.608729,0 days 00:00:06.571847,Adam,0.15042265976743932,,0.00014908271238175356,,,,,0,,1.5591793203337727,,,PRUNED
474,474,58.333333333333336,2025-05-26 02:11:09.645638,2025-05-26 02:11:24.443817,0 days 00:00:14.798179,Adam,0.16723888221821082,,8.351644641930619e-05,,,,,2,,0.014298607366734049,,,COMPLETE
475,475,35.416666666666664,2025-05-26 02:11:24.498967,2025-05-26 02:11:30.927024,0 days 00:00:06.428057,Adam,0.13286227166887082,,0.0001039532300816906,,,,,1,,0.02636013586150854,,,PRUNED
476,476,50.0,2025-05-26 02:11:30.964853,2025-05-26 02:11:45.821130,0 days 00:00:14.856277,Adam,0.17936984094307692,,0.00016326114124524892,,,,,4,,0.05608669342563433,,,COMPLETE
477,477,33.333333333333336,2025-05-26 02:11:45.877191,2025-05-26 02:11:52.488517,0 days 00:00:06.611326,Adam,0.1563526163895326,,0.00012999885913428768,,,,,2,,0.019640922551879967,,,PRUNED
478,478,,2025-05-26 02:11:52.527663,2025-05-26 02:11:58.300843,0 days 00:00:05.773180,SGD,0.12177681586466256,,,,0.035755393211353875,91.28741029172923,False,1,,,,0.02097792403430133,PRUNED
479,479,31.25,2025-05-26 02:11:58.344541,2025-05-26 02:12:04.899527,0 days 00:00:06.554986,Adam,0.14026794680924756,,5.2034830693343075e-05,,,,,3,,0.04004686162988782,,,PRUNED
480,480,33.333333333333336,2025-05-26 02:12:04.938355,2025-05-26 02:12:11.103219,0 days 00:00:06.164864,Adam,0.1630967721649631,,8.154554754946587e-05,,,,,8,,0.023678277417535826,,,PRUNED
481,481,33.333333333333336,2025-05-26 02:12:11.145518,2025-05-26 02:12:17.623811,0 days 00:00:06.478293,Adadelta,0.14856440752797542,0.03781331506289775,,,,,,0,0.2749972056282367,,,,PRUNED
482,482,33.333333333333336,2025-05-26 02:12:17.662592,2025-05-26 02:12:24.211697,0 days 00:00:06.549105,Adam,0.10154378035165136,,6.439870430493266e-05,,,,,5,,0.031486827895849986,,,PRUNED
483,483,56.25,2025-05-26 02:12:24.256277,2025-05-26 02:12:39.073915,0 days 00:00:14.817638,Adam,0.13415715598906802,,0.00019302806013160638,,,,,2,,0.016756139230016995,,,COMPLETE
484,484,33.333333333333336,2025-05-26 02:12:39.129459,2025-05-26 02:12:45.614140,0 days 00:00:06.484681,Adam,0.1686114647464735,,2.073036844389803e-05,,,,,1,,0.012637539497132142,,,PRUNED
485,485,33.333333333333336,2025-05-26 02:12:45.652221,2025-05-26 02:12:52.263185,0 days 00:00:06.610964,Adam,0.1518595572120782,,9.962268437434137e-05,,,,,3,,0.026801381592041134,,,PRUNED
486,486,33.333333333333336,2025-05-26 02:12:52.302178,2025-05-26 02:12:58.810475,0 days 00:00:06.508297,Adam,0.12519359963055893,,0.00012146762951313739,,,,,2,,0.019103529300454163,,,PRUNED
487,487,33.333333333333336,2025-05-26 02:12:58.849928,2025-05-26 02:13:05.458043,0 days 00:00:06.608115,Adam,0.19088011707859798,,7.137614657597537e-05,,,,,4,,0.021440091005052272,,,PRUNED
488,488,35.416666666666664,2025-05-26 02:13:05.496714,2025-05-26 02:13:12.042993,0 days 00:00:06.546279,Adam,0.14114850409012672,,0.0001712798435052266,,,,,3,,0.016114633599669262,,,PRUNED
489,489,39.583333333333336,2025-05-26 02:13:12.082518,2025-05-26 02:13:22.045477,0 days 00:00:09.962959,Adam,0.15801389502054283,,0.0003044921427087656,,,,,1,,0.02986877488388042,,,PRUNED
490,490,31.25,2025-05-26 02:13:22.084283,2025-05-26 02:13:28.248329,0 days 00:00:06.164046,Adam,0.14689932911151107,,9.315481660676781e-05,,,,,11,,0.010031268139653887,,,PRUNED
491,491,60.416666666666664,2025-05-26 02:13:28.287984,2025-05-26 02:13:43.215006,0 days 00:00:14.927022,Adam,0.1331709861138807,,0.0001258432338947619,,,,,0,,0.02430341708325693,,,COMPLETE
492,492,62.5,2025-05-26 02:13:43.270438,2025-05-26 02:13:58.222803,0 days 00:00:14.952365,Adam,0.10858967184486293,,0.00011034591216714106,,,,,0,,0.042927980799783855,,,COMPLETE
493,493,35.416666666666664,2025-05-26 02:13:58.278578,2025-05-26 02:14:04.855275,0 days 00:00:06.576697,Adam,0.10295408922941698,,0.00010881728419876088,,,,,0,,0.04915003135124726,,,PRUNED
494,494,33.333333333333336,2025-05-26 02:14:04.894427,2025-05-26 02:14:11.451825,0 days 00:00:06.557398,Adam,0.12461340208122107,,8.281638179111409e-05,,,,,0,,0.04075100344291122,,,PRUNED
495,495,33.333333333333336,2025-05-26 02:14:11.489795,2025-05-26 02:14:18.004033,0 days 00:00:06.514238,Adam,0.10470362122801553,,0.00012605767206789347,,,,,0,,0.0349025192490108,,,PRUNED
496,496,37.5,2025-05-26 02:14:18.042629,2025-05-26 02:14:26.333690,0 days 00:00:08.291061,Adam,0.09418428785175713,,4.663392162549577e-05,,,,,0,,0.04219144391138767,,,PRUNED
497,497,31.25,2025-05-26 02:14:26.372408,2025-05-26 02:14:32.835491,0 days 00:00:06.463083,Adam,0.11218410836164229,,9.935332792288615e-05,,,,,0,,0.028611015859895537,,,PRUNED
498,498,35.416666666666664,2025-05-26 02:14:32.873659,2025-05-26 02:14:39.464425,0 days 00:00:06.590766,Adam,0.12441686826801401,,6.760763942190505e-05,,,,,0,,0.02494122633692933,,,PRUNED
499,499,33.333333333333336,2025-05-26 02:14:39.502523,2025-05-26 02:14:46.048514,0 days 00:00:06.545991,Adam,0.11470736938638469,,0.00014269716536445518,,,,,1,,0.013600513691513542,,,PRUNED
500,500,35.416666666666664,2025-05-26 02:14:46.086787,2025-05-26 02:14:52.712428,0 days 00:00:06.625641,Adam,0.11085527055761248,,8.610272497386112e-05,,,,,1,,0.033776342470972665,,,PRUNED
501,501,43.75,2025-05-26 02:14:52.751876,2025-05-26 02:15:07.671389,0 days 00:00:14.919513,Adam,0.13149282549608476,,0.00012026467736590131,,,,,0,,0.02215650183074569,,,COMPLETE
502,502,,2025-05-26 02:15:07.727264,2025-05-26 02:15:14.218656,0 days 00:00:06.491392,SGD,0.11842500402864639,,,,0.0002791319314359628,32.391471939579716,True,1,,,,0.11355447887572195,PRUNED
503,503,52.083333333333336,2025-05-26 02:15:14.260928,2025-05-26 02:15:29.123718,0 days 00:00:14.862790,Adam,0.13946369041862475,,7.315788125217021e-05,,,,,2,,0.028431713596912295,,,COMPLETE
504,504,31.25,2025-05-26 02:15:29.179870,2025-05-26 02:15:35.897915,0 days 00:00:06.718045,Adam,0.0878970041319801,,5.8229204579070136e-05,,,,,0,,0.017611939922613448,,,PRUNED
505,505,31.25,2025-05-26 02:15:35.942885,2025-05-26 02:15:43.831718,0 days 00:00:07.888833,Adadelta,0.1310068053006331,0.010622227040620824,,,,,,6,3.188048185125115,,,,PRUNED
506,506,33.333333333333336,2025-05-26 02:15:43.875063,2025-05-26 02:15:50.419259,0 days 00:00:06.544196,Adam,0.12252547057362063,,0.0001010760264477104,,,,,1,,0.057876444534286337,,,PRUNED
507,507,33.333333333333336,2025-05-26 02:15:50.464096,2025-05-26 02:15:57.023330,0 days 00:00:06.559234,Adam,0.1339179990387964,,0.0001413629325980906,,,,,2,,0.08977687384797879,,,PRUNED
508,508,33.333333333333336,2025-05-26 02:15:57.062238,2025-05-26 02:16:03.633264,0 days 00:00:06.571026,Adam,0.11078848934440122,,0.00011116151918483594,,,,,1,,0.03478162149460629,,,PRUNED
509,509,25.0,2025-05-26 02:16:03.671643,2025-05-26 02:16:09.722182,0 days 00:00:06.050539,Adam,0.13797749168274698,,8.658297923650265e-05,,,,,20,,0.023679259861715034,,,PRUNED
510,510,43.75,2025-05-26 02:16:09.761327,2025-05-26 02:16:19.725463,0 days 00:00:09.964136,Adam,0.1454408548881959,,0.00015877212593107793,,,,,0,,0.019531538065788154,,,PRUNED
511,511,47.916666666666664,2025-05-26 02:16:19.765387,2025-05-26 02:16:34.635964,0 days 00:00:14.870577,Adam,0.12047361434047897,,7.35826811294439e-05,,,,,2,,0.04588534758479665,,,COMPLETE
512,512,33.333333333333336,2025-05-26 02:16:34.691957,2025-05-26 02:16:41.176179,0 days 00:00:06.484222,Adam,0.13595218545354226,,0.00012953220147911794,,,,,1,,0.6570847891162016,,,PRUNED
513,513,33.333333333333336,2025-05-26 02:16:41.216147,2025-05-26 02:16:47.796275,0 days 00:00:06.580128,Adam,0.14605835658933228,,9.54050006838172e-05,,,,,2,,0.015181164287813478,,,PRUNED
514,514,62.5,2025-05-26 02:16:47.841184,2025-05-26 02:17:02.780453,0 days 00:00:14.939269,Adam,0.10119037902140268,,0.0001152104167128131,,,,,1,,0.025702949094121196,,,COMPLETE
515,515,33.333333333333336,2025-05-26 02:17:02.837432,2025-05-26 02:17:09.361695,0 days 00:00:06.524263,Adam,0.09968246252030144,,0.00010903465100167218,,,,,3,,0.029452028598438446,,,PRUNED
516,516,33.333333333333336,2025-05-26 02:17:09.406647,2025-05-26 02:17:15.959348,0 days 00:00:06.552701,Adam,0.08642837405296089,,0.00021107536402781694,,,,,0,,0.03841874114283462,,,PRUNED
517,517,33.333333333333336,2025-05-26 02:17:16.004389,2025-05-26 02:17:22.613738,0 days 00:00:06.609349,Adam,0.0878093753047944,,5.81465218266739e-05,,,,,2,,0.025329856053110226,,,PRUNED
518,518,35.416666666666664,2025-05-26 02:17:22.659229,2025-05-26 02:17:29.091345,0 days 00:00:06.432116,Adam,0.10997101972507503,,0.0001449330790141151,,,,,1,,0.011607724013077973,,,PRUNED
519,519,33.333333333333336,2025-05-26 02:17:29.136881,2025-05-26 02:17:35.717042,0 days 00:00:06.580161,Adam,0.10125955133243895,,3.499735446999262e-05,,,,,4,,0.020342223947411173,,,PRUNED
520,520,33.333333333333336,2025-05-26 02:17:35.762025,2025-05-26 02:17:42.303776,0 days 00:00:06.541751,Adam,0.12250448032761552,,7.861494314614592e-05,,,,,1,,3.247684764829747,,,PRUNED
521,521,54.166666666666664,2025-05-26 02:17:42.342528,2025-05-26 02:17:57.266328,0 days 00:00:14.923800,Adam,0.106592295029247,,4.404806346581281e-05,,,,,3,,0.016050087762197726,,,COMPLETE
522,522,33.333333333333336,2025-05-26 02:17:57.322571,2025-05-26 02:18:03.877615,0 days 00:00:06.555044,Adam,0.11762358777351782,,0.07465404313001128,,,,,2,,0.0323794239497344,,,PRUNED
523,523,35.416666666666664,2025-05-26 02:18:03.916261,2025-05-26 02:18:10.487510,0 days 00:00:06.571249,Adam,0.1298577887697679,,0.00017055438948317527,,,,,0,,0.025216328667612583,,,PRUNED
524,524,52.083333333333336,2025-05-26 02:18:10.527098,2025-05-26 02:18:25.383381,0 days 00:00:14.856283,Adam,0.12660309128183247,,0.0001188337545241204,,,,,2,,0.018387757275221756,,,COMPLETE
525,525,,2025-05-26 02:18:25.439172,2025-05-26 02:18:31.098763,0 days 00:00:05.659591,SGD,0.13687867891977218,,,,0.005870026561000627,63.76506620455284,False,1,,,,40.74117118545622,PRUNED
526,526,35.416666666666664,2025-05-26 02:18:31.142030,2025-05-26 02:18:37.729856,0 days 00:00:06.587826,Adam,0.14534085055211726,,9.696178182624752e-05,,,,,3,,1.0296524258336974,,,PRUNED
527,527,33.333333333333336,2025-05-26 02:18:37.768988,2025-05-26 02:18:44.295574,0 days 00:00:06.526586,Adadelta,0.10867032226224374,22.641290278670535,,,,,,4,0.03765727997133339,,,,PRUNED
528,528,56.25,2025-05-26 02:18:44.335701,2025-05-26 02:18:59.234902,0 days 00:00:14.899201,Adam,0.11919131879232227,,6.807325251759567e-05,,,,,2,,0.013723983634613074,,,COMPLETE
529,529,45.833333333333336,2025-05-26 02:18:59.291759,2025-05-26 02:19:13.728728,0 days 00:00:14.436969,Adam,0.09699184595281242,,0.00013380030737325012,,,,,5,,0.0214213830804339,,,COMPLETE
530,530,54.166666666666664,2025-05-26 02:19:13.786466,2025-05-26 02:19:28.708132,0 days 00:00:14.921666,Adam,0.15048936660884862,,9.047064040083248e-05,,,,,1,,0.028731483244716614,,,COMPLETE
531,531,33.333333333333336,2025-05-26 02:19:28.764526,2025-05-26 02:19:35.271492,0 days 00:00:06.506966,Adam,0.12908312470792765,,0.022637455143283112,,,,,3,,0.03643917404260287,,,PRUNED
532,532,47.916666666666664,2025-05-26 02:19:35.310202,2025-05-26 02:19:50.262424,0 days 00:00:14.952222,Adam,0.09637081064280781,,0.00011099015248535115,,,,,0,,0.02333064396863134,,,COMPLETE
533,533,35.416666666666664,2025-05-26 02:19:50.318603,2025-05-26 02:19:56.870691,0 days 00:00:06.552088,Adam,0.13824968455263578,,0.00017685574336308714,,,,,2,,0.017268960104705175,,,PRUNED
534,534,33.333333333333336,2025-05-26 02:19:56.909035,2025-05-26 02:20:03.478490,0 days 00:00:06.569455,Adam,0.1552384575873949,,8.806998056641551e-05,,,,,1,,0.05045448497157197,,,PRUNED
535,535,25.0,2025-05-26 02:20:03.517173,2025-05-26 02:20:10.113093,0 days 00:00:06.595920,Adam,0.17368875889561217,,5.412256757326136e-05,,,,,3,,0.027043117288873098,,,PRUNED
536,536,35.416666666666664,2025-05-26 02:20:10.151975,2025-05-26 02:20:16.711980,0 days 00:00:06.560005,Adam,0.1160761851719389,,0.00025366050821658563,,,,,0,,0.013730480511531307,,,PRUNED
537,537,43.75,2025-05-26 02:20:16.751875,2025-05-26 02:20:31.633430,0 days 00:00:14.881555,Adam,0.14302321714448143,,0.0001360862757335258,,,,,1,,0.020799882768066113,,,COMPLETE
538,538,33.333333333333336,2025-05-26 02:20:31.690438,2025-05-26 02:20:38.192585,0 days 00:00:06.502147,Adam,0.13172621289746209,,0.003539422641515207,,,,,2,,0.033010628830386315,,,PRUNED
539,539,29.166666666666668,2025-05-26 02:20:38.232106,2025-05-26 02:20:44.806481,0 days 00:00:06.574375,Adam,0.164786365565108,,6.910164152809492e-05,,,,,4,,0.011579878882171157,,,PRUNED
540,540,31.25,2025-05-26 02:20:44.845962,2025-05-26 02:20:51.616612,0 days 00:00:06.770650,Adam,0.1520197943768603,,0.00010795414808216403,,,,,2,,0.017276131480589707,,,PRUNED
541,541,50.0,2025-05-26 02:20:51.662048,2025-05-26 02:21:06.560911,0 days 00:00:14.898863,Adam,0.14119019779554992,,0.00015484812983091416,,,,,3,,0.0416484595944552,,,COMPLETE
542,542,58.333333333333336,2025-05-26 02:21:06.618125,2025-05-26 02:21:21.585721,0 days 00:00:14.967596,Adam,0.12698975429981416,,8.038621915302193e-05,,,,,1,,0.025327310032373127,,,COMPLETE
543,543,33.333333333333336,2025-05-26 02:21:21.642799,2025-05-26 02:21:28.230933,0 days 00:00:06.588134,Adam,0.16173676186176134,,0.0001236470481341485,,,,,0,,0.021458678761274635,,,PRUNED
544,544,31.25,2025-05-26 02:21:28.276173,2025-05-26 02:21:34.822619,0 days 00:00:06.546446,Adam,0.15107964943088806,,9.563057369161169e-05,,,,,2,,0.030576468574471688,,,PRUNED
545,545,54.166666666666664,2025-05-26 02:21:34.868724,2025-05-26 02:21:49.786490,0 days 00:00:14.917766,Adam,0.17745144032765822,,6.410885001446706e-05,,,,,3,,0.06322573596425912,,,COMPLETE
546,546,35.416666666666664,2025-05-26 02:21:49.843871,2025-05-26 02:21:58.599839,0 days 00:00:08.755968,Adam,0.1352739664834621,,0.00019825981667744616,,,,,12,,0.01507257785671393,,,PRUNED
547,547,33.333333333333336,2025-05-26 02:21:58.642780,2025-05-26 02:22:05.207422,0 days 00:00:06.564642,Adam,0.11633826717043462,,8.124731624839957e-05,,,,,1,,0.017471988884287713,,,PRUNED
548,548,,2025-05-26 02:22:05.247120,2025-05-26 02:22:11.071413,0 days 00:00:05.824293,SGD,0.14372589350324677,,,,0.026152401518621547,75.1457234424181,False,2,,,,0.9946230621742701,PRUNED
549,549,33.333333333333336,2025-05-26 02:22:11.110392,2025-05-26 02:22:17.694522,0 days 00:00:06.584130,Adam,0.168455686818027,,0.00014188238426844274,,,,,0,,0.023322183950262552,,,PRUNED
550,550,33.333333333333336,2025-05-26 02:22:17.743515,2025-05-26 02:22:24.374386,0 days 00:00:06.630871,Adadelta,0.1556843814559999,1.7517139665602974,,,,,,1,94.6987618127254,,,,PRUNED
551,551,62.5,2025-05-26 02:22:24.419682,2025-05-26 02:22:39.396010,0 days 00:00:14.976328,Adam,0.13305582577298228,,0.00011079128178235146,,,,,4,,0.028309619655241938,,,COMPLETE
552,552,47.916666666666664,2025-05-26 02:22:39.452901,2025-05-26 02:22:53.972381,0 days 00:00:14.519480,Adam,0.14371852529071916,,0.00011549302415831374,,,,,5,,0.03790447163579427,,,COMPLETE
553,553,35.416666666666664,2025-05-26 02:22:54.029858,2025-05-26 02:23:00.610706,0 days 00:00:06.580848,Adam,0.18594250084928143,,0.00016586516567520322,,,,,4,,0.031268934929462644,,,PRUNED
554,554,56.25,2025-05-26 02:23:00.656611,2025-05-26 02:23:15.106960,0 days 00:00:14.450349,Adam,0.12869516928575955,,0.00010543521308399273,,,,,5,,0.02728855907292115,,,COMPLETE
555,555,33.333333333333336,2025-05-26 02:23:15.164172,2025-05-26 02:23:21.787925,0 days 00:00:06.623753,Adam,0.10504650395673074,,0.0001311770151551915,,,,,4,,0.18981993288026566,,,PRUNED
556,556,58.333333333333336,2025-05-26 02:23:21.833807,2025-05-26 02:23:35.730122,0 days 00:00:13.896315,Adam,0.15457547555454465,,8.912176864999314e-05,,,,,6,,0.04675983917228489,,,COMPLETE
557,557,35.416666666666664,2025-05-26 02:23:35.786585,2025-05-26 02:23:42.272594,0 days 00:00:06.486009,Adam,0.16512432538581714,,0.00011089535939732814,,,,,4,,0.01995734852122716,,,PRUNED
558,558,33.333333333333336,2025-05-26 02:23:42.318254,2025-05-26 02:23:48.971035,0 days 00:00:06.652781,Adam,0.13733113292232252,,0.0001517646131920774,,,,,3,,22.69222679193582,,,PRUNED
559,559,33.333333333333336,2025-05-26 02:23:49.018728,2025-05-26 02:23:55.585804,0 days 00:00:06.567076,Adam,0.14613877340345602,,0.00022250715632422292,,,,,4,,0.033741997143922196,,,PRUNED
560,560,41.666666666666664,2025-05-26 02:23:55.632665,2025-05-26 02:24:07.165026,0 days 00:00:11.532361,Adam,0.079076374231345,,9.767023170767566e-05,,,,,3,,0.012928024924800725,,,PRUNED
561,561,33.333333333333336,2025-05-26 02:24:07.204909,2025-05-26 02:24:13.695829,0 days 00:00:06.490920,Adam,0.12003570624119028,,0.00012661995969629697,,,,,3,,0.024780233242145216,,,PRUNED
562,562,29.166666666666668,2025-05-26 02:24:13.741838,2025-05-26 02:24:20.304715,0 days 00:00:06.562877,Adam,0.20125103053393084,,8.075050487680201e-05,,,,,5,,0.010130669503266954,,,PRUNED
563,563,35.416666666666664,2025-05-26 02:24:20.350375,2025-05-26 02:24:28.504543,0 days 00:00:08.154168,Adam,0.15914616297539788,,0.00017011086635426094,,,,,3,,0.01870988055521475,,,PRUNED
564,564,35.416666666666664,2025-05-26 02:24:28.544734,2025-05-26 02:24:35.122286,0 days 00:00:06.577552,Adam,0.1337128396623422,,0.0001078152428117347,,,,,4,,0.015126751080444334,,,PRUNED
565,565,33.333333333333336,2025-05-26 02:24:35.169706,2025-05-26 02:24:41.695908,0 days 00:00:06.526202,Adam,0.14824954546196734,,7.234342619227213e-05,,,,,2,,0.04186523551145061,,,PRUNED
566,566,33.333333333333336,2025-05-26 02:24:41.741377,2025-05-26 02:24:47.960375,0 days 00:00:06.218998,Adam,0.173857383120245,,0.00012804851097560847,,,,,8,,0.02716552660603244,,,PRUNED
567,567,33.333333333333336,2025-05-26 02:24:48.003401,2025-05-26 02:24:54.693783,0 days 00:00:06.690382,Adam,0.12405869966298698,,9.211307473721981e-05,,,,,2,,0.021424078816614688,,,PRUNED
568,568,50.0,2025-05-26 02:24:54.740327,2025-05-26 02:25:09.815659,0 days 00:00:15.075332,Adam,0.11135259329069339,,0.00011853436925873396,,,,,3,,0.030921726113345815,,,COMPLETE
569,569,33.333333333333336,2025-05-26 02:25:09.873108,2025-05-26 02:25:16.442903,0 days 00:00:06.569795,Adam,0.13905969806302315,,0.00018829700110473233,,,,,3,,2.12812261884038,,,PRUNED
570,570,58.333333333333336,2025-05-26 02:25:16.488943,2025-05-26 02:25:31.411567,0 days 00:00:14.922624,Adam,0.15523067402526958,,0.00014873593514766486,,,,,2,,0.017313326666403953,,,COMPLETE
571,571,35.416666666666664,2025-05-26 02:25:31.468774,2025-05-26 02:25:38.031916,0 days 00:00:06.563142,Adam,0.09330262343334769,,7.951768453063708e-05,,,,,4,,0.02360936558019161,,,PRUNED
572,572,,2025-05-26 02:25:38.071802,2025-05-26 02:25:44.528766,0 days 00:00:06.456964,SGD,0.16658299527801929,,,,0.0012174057170104974,48.00077573572326,True,2,,,,0.03128940664125217,PRUNED
573,573,33.333333333333336,2025-05-26 02:25:44.572686,2025-05-26 02:25:50.838401,0 days 00:00:06.265715,Adam,0.1495355501086524,,0.00010099598801898873,,,,,19,,0.036446890213293885,,,PRUNED
574,574,31.25,2025-05-26 02:25:50.881221,2025-05-26 02:25:57.369142,0 days 00:00:06.487921,Adadelta,0.13593109105133494,0.11851472552825154,,,,,,0,11.146466497847873,,,,PRUNED
575,575,64.58333333333333,2025-05-26 02:25:57.408981,2025-05-26 02:26:12.324627,0 days 00:00:14.915646,Adam,0.12825177974768487,,5.969465051285056e-05,,,,,1,,0.012361629520666089,,,COMPLETE
