,number,value,datetime_start,datetime_complete,duration,params_algorithm,params_dropout_rate,params_lr_Adadelta,params_lr_Adam,params_lr_AdamW,params_lr_SGD,params_momentum_SGD,params_nesterov_SGD,params_suggested_freeze,params_weight_decay_Adadelta,params_weight_decay_Adam,params_weight_decay_AdamW,params_weight_decay_SGD,state
803,803,27.083333333333332,2025-05-25 06:58:42.455573,2025-05-25 06:58:45.189071,0 days 00:00:02.733498,AdamW,0.3391269333284198,,,0.0001078257801616495,,,,9,,,0.001483560813157594,,PRUNED
804,804,58.333333333333336,2025-05-25 06:58:45.218751,2025-05-25 06:58:52.357838,0 days 00:00:07.139087,AdamW,0.41280067494501693,,,0.0002578555035335547,,,,5,,,0.0018243507499591555,,COMPLETE
805,805,35.416666666666664,2025-05-25 06:58:52.399203,2025-05-25 06:58:55.724436,0 days 00:00:03.325233,Adadelta,0.379749681700851,0.015127055265761188,,,,,,3,4.1885997458872275,,,,PRUNED
806,806,56.25,2025-05-25 06:58:55.760812,2025-05-25 06:59:09.200844,0 days 00:00:13.440032,AdamW,0.35999032808415127,,,0.0001340823542793611,,,,6,,,0.0009125214572844254,,COMPLETE
807,807,33.333333333333336,2025-05-25 06:59:09.260498,2025-05-25 06:59:15.513957,0 days 00:00:06.253459,AdamW,0.43538738351044154,,,7.525730142411119e-05,,,,5,,,0.0020127556249313885,,PRUNED
808,808,39.583333333333336,2025-05-25 06:59:15.556249,2025-05-25 06:59:20.129767,0 days 00:00:04.573518,AdamW,0.402480315505356,,,0.00020041888115266744,,,,7,,,0.0013553354006273564,,PRUNED
809,809,35.416666666666664,2025-05-25 06:59:20.170863,2025-05-25 06:59:23.909108,0 days 00:00:03.738245,AdamW,0.4236352724743861,,,9.535909509172961e-05,,,,2,,,0.0016614355097671614,,PRUNED
810,810,58.333333333333336,2025-05-25 06:59:23.954183,2025-05-25 06:59:35.775418,0 days 00:00:11.821235,AdamW,0.3840131067862536,,,5.04588468992724e-05,,,,4,,,0.0010494255072499882,,COMPLETE
811,811,52.083333333333336,2025-05-25 06:59:35.835176,2025-05-25 06:59:50.751532,0 days 00:00:14.916356,AdamW,0.34753659940016535,,,0.0001596740243910932,,,,3,,,0.001256743905839218,,COMPLETE
812,812,33.333333333333336,2025-05-25 06:59:50.810844,2025-05-25 06:59:59.168432,0 days 00:00:08.357588,AdamW,0.37185951050558264,,,3.9265528526421255e-05,,,,1,,,0.0028586737827096167,,PRUNED
813,813,31.25,2025-05-25 06:59:59.216465,2025-05-25 07:00:05.016358,0 days 00:00:05.799893,AdamW,0.39463733444397087,,,0.0003323459139803986,,,,27,,,0.0015982690850781796,,PRUNED
814,814,33.333333333333336,2025-05-25 07:00:05.060320,2025-05-25 07:00:11.513878,0 days 00:00:06.453558,AdamW,0.4130367796118874,,,6.42696656211303e-05,,,,6,,,0.0008133838504296209,,PRUNED
815,815,50.0,2025-05-25 07:00:11.559589,2025-05-25 07:00:26.075240,0 days 00:00:14.515651,AdamW,0.40319028986749056,,,0.0004967788477829666,,,,5,,,0.0023107228933940266,,COMPLETE
816,816,35.416666666666664,2025-05-25 07:00:26.135238,2025-05-25 07:00:41.069894,0 days 00:00:14.934656,Adadelta,0.37153659559243285,0.08364725336656634,,,,,,3,0.20007339087649423,,,,COMPLETE
817,817,41.666666666666664,2025-05-25 07:00:41.129808,2025-05-25 07:00:49.199945,0 days 00:00:08.070137,AdamW,0.3594899352426969,,,0.00024281454349046297,,,,4,,,0.0009921452712794393,,PRUNED
818,818,33.333333333333336,2025-05-25 07:00:49.247279,2025-05-25 07:00:55.771014,0 days 00:00:06.523735,AdamW,0.3898765450872732,,,8.432290496315003e-05,,,,5,,,0.001136987009192693,,PRUNED
819,819,33.333333333333336,2025-05-25 07:00:55.817400,2025-05-25 07:01:02.138833,0 days 00:00:06.321433,AdamW,0.41676335442365614,,,0.003689677043425973,,,,7,,,0.001393219701763436,,PRUNED
820,820,,2025-05-25 07:01:02.183396,2025-05-25 07:01:07.635279,0 days 00:00:05.451883,SGD,0.3814317552980178,,,,0.01886449352240703,23.919864373059422,False,5,,,,95.17010641156139,PRUNED
821,821,35.416666666666664,2025-05-25 07:01:07.670636,2025-05-25 07:01:13.734630,0 days 00:00:06.063994,AdamW,0.42926724218870554,,,0.0001406583345664092,,,,1,,,0.001885375797703269,,PRUNED
822,822,58.333333333333336,2025-05-25 07:01:13.781885,2025-05-25 07:01:27.876720,0 days 00:00:14.094835,AdamW,0.4425494267992888,,,0.0001048154803784629,,,,6,,,0.0025579465640915592,,COMPLETE
823,823,56.25,2025-05-25 07:01:27.936777,2025-05-25 07:01:42.694455,0 days 00:00:14.757678,AdamW,0.40300309917320026,,,0.00018329413575408467,,,,2,,,0.0012241452640032486,,COMPLETE
824,824,33.333333333333336,2025-05-25 07:01:42.754377,2025-05-25 07:01:57.930102,0 days 00:00:15.175725,Adam,0.35332353242944164,,0.0003777255856668616,,,,,4,,0.6881790276945166,,,COMPLETE
825,825,45.833333333333336,2025-05-25 07:01:57.990128,2025-05-25 07:02:09.559592,0 days 00:00:11.569464,AdamW,0.36545595672993214,,,0.00022750255089721893,,,,3,,,0.0014484195111961946,,PRUNED
826,826,45.833333333333336,2025-05-25 07:02:09.607883,2025-05-25 07:02:19.601147,0 days 00:00:09.993264,AdamW,0.3344928612874479,,,7.728568417543449e-05,,,,4,,,0.0020826903016397708,,PRUNED
827,827,45.833333333333336,2025-05-25 07:02:19.649118,2025-05-25 07:02:34.214934,0 days 00:00:14.565816,AdamW,0.3924733497522809,,,0.00012310842291101673,,,,5,,,0.0011222998665655454,,COMPLETE
828,828,56.25,2025-05-25 07:02:34.275022,2025-05-25 07:02:47.732720,0 days 00:00:13.457698,AdamW,0.37511063572895326,,,0.00016109886622555115,,,,7,,,0.000982955398502171,,COMPLETE
829,829,33.333333333333336,2025-05-25 07:02:47.792585,2025-05-25 07:02:54.464841,0 days 00:00:06.672256,AdamW,0.45422391206179785,,,1.0057905206570815e-05,,,,4,,,0.0015729210043554118,,PRUNED
830,830,37.5,2025-05-25 07:02:54.511825,2025-05-25 07:03:00.759870,0 days 00:00:06.248045,Adadelta,0.4199693694627609,0.04594607159356708,,,,,,18,0.03943649936801522,,,,PRUNED
831,831,33.333333333333336,2025-05-25 07:03:00.803981,2025-05-25 07:03:05.152686,0 days 00:00:04.348705,AdamW,0.47133927451262725,,,5.370665417671354e-05,,,,2,,,0.0017922695718942871,,PRUNED
832,832,33.333333333333336,2025-05-25 07:03:05.192096,2025-05-25 07:03:11.432328,0 days 00:00:06.240232,AdamW,0.4083337462745963,,,0.0006164004136703908,,,,6,,,0.001328211449002876,,PRUNED
833,833,33.333333333333336,2025-05-25 07:03:11.477408,2025-05-25 07:03:18.090666,0 days 00:00:06.613258,AdamW,0.3862157658990385,,,0.00020824454633952945,,,,0,,,0.0009071161068760791,,PRUNED
834,834,41.666666666666664,2025-05-25 07:03:18.137949,2025-05-25 07:03:27.316186,0 days 00:00:09.178237,AdamW,0.3774912584930624,,,9.123334723400511e-05,,,,3,,,0.0023588515687021196,,PRUNED
835,835,41.666666666666664,2025-05-25 07:03:27.363754,2025-05-25 07:03:42.161600,0 days 00:00:14.797846,AdamW,0.39697731918121026,,,0.0002979481871949967,,,,4,,,0.0012354573020809422,,COMPLETE
836,836,33.333333333333336,2025-05-25 07:03:42.254595,2025-05-25 07:03:48.063729,0 days 00:00:05.809134,AdamW,0.43027024453828133,,,7.09649402595018e-05,,,,6,,,0.0010670169982687167,,PRUNED
837,837,33.333333333333336,2025-05-25 07:03:48.109444,2025-05-25 07:03:54.706642,0 days 00:00:06.597198,AdamW,0.36402139786242893,,,0.0001437416239530201,,,,5,,,0.0026057844438815885,,PRUNED
838,838,56.25,2025-05-25 07:03:54.753070,2025-05-25 07:04:08.317974,0 days 00:00:13.564904,AdamW,0.3481024583493617,,,0.00011077760812436579,,,,3,,,0.0015109128300673635,,COMPLETE
839,839,33.333333333333336,2025-05-25 07:04:08.377633,2025-05-25 07:04:14.912989,0 days 00:00:06.535356,AdamW,0.41548270839509494,,,4.314535964105749e-05,,,,5,,,0.0019721977278591633,,PRUNED
840,840,47.916666666666664,2025-05-25 07:04:14.959916,2025-05-25 07:04:26.030222,0 days 00:00:11.070306,AdamW,0.4041893096330248,,,0.00038573642908706993,,,,3,,,0.0021821593428798377,,COMPLETE
841,841,41.666666666666664,2025-05-25 07:04:26.071574,2025-05-25 07:04:30.817079,0 days 00:00:04.745505,AdamW,0.3861658771829031,,,0.00018568654257168575,,,,4,,,0.0016890839853884938,,PRUNED
842,842,33.333333333333336,2025-05-25 07:04:30.848674,2025-05-25 07:04:33.706540,0 days 00:00:02.857866,Adadelta,0.36913363206320016,0.24128788043752988,,,,,,6,0.5093145837482763,,,,PRUNED
843,843,31.25,2025-05-25 07:04:33.737599,2025-05-25 07:04:36.680957,0 days 00:00:02.943358,AdamW,0.3960408688658476,,,0.00028150336541049223,,,,1,,,0.0011525963690412128,,PRUNED
844,844,33.333333333333336,2025-05-25 07:04:36.712010,2025-05-25 07:04:39.626359,0 days 00:00:02.914349,AdamW,0.3589957532104509,,,5.66011078172903e-05,,,,2,,,0.003015804003998661,,PRUNED
845,845,33.333333333333336,2025-05-25 07:04:39.657868,2025-05-25 07:04:42.923092,0 days 00:00:03.265224,Adam,0.421139220564805,,0.0006280110898781444,,,,,7,,86.00665564261566,,,PRUNED
846,846,,2025-05-25 07:04:42.968147,2025-05-25 07:04:48.616649,0 days 00:00:05.648502,SGD,0.40756210774046675,,,,0.03753159397238318,91.94686599353696,True,5,,,,0.23116998283212253,PRUNED
847,847,33.333333333333336,2025-05-25 07:04:48.657517,2025-05-25 07:04:54.985562,0 days 00:00:06.328045,AdamW,0.4836837224084055,,,9.868505247702162e-05,,,,8,,,0.0013286585062224927,,PRUNED
848,848,39.583333333333336,2025-05-25 07:04:55.029751,2025-05-25 07:05:00.092988,0 days 00:00:05.063237,AdamW,0.38028296988956817,,,0.00015972533872289483,,,,4,,,0.0008748546582062685,,PRUNED
849,849,33.333333333333336,2025-05-25 07:05:00.124886,2025-05-25 07:05:03.053698,0 days 00:00:02.928812,AdamW,0.4332064364406682,,,0.00021531660601575714,,,,5,,,0.0010238611318056554,,PRUNED
850,850,54.166666666666664,2025-05-25 07:05:03.085281,2025-05-25 07:05:12.167027,0 days 00:00:09.081746,AdamW,0.3905462035488279,,,6.769228790836299e-05,,,,2,,,0.0001935592343948008,,COMPLETE
851,851,31.25,2025-05-25 07:05:12.227659,2025-05-25 07:05:18.706641,0 days 00:00:06.478982,AdamW,0.4443755238771049,,,0.00013130519885139235,,,,6,,,0.0014597575622733447,,PRUNED
852,852,27.083333333333332,2025-05-25 07:05:18.753324,2025-05-25 07:05:25.469273,0 days 00:00:06.715949,AdamW,0.3424819386523808,,,8.381850434982613e-05,,,,3,,,0.0005875518231147359,,PRUNED
853,853,39.583333333333336,2025-05-25 07:05:25.516869,2025-05-25 07:05:33.784172,0 days 00:00:08.267303,AdamW,0.37444953999882225,,,0.000244089937358043,,,,4,,,0.0017730941909432692,,PRUNED
854,854,64.58333333333333,2025-05-25 07:05:33.831754,2025-05-25 07:05:47.723915,0 days 00:00:13.892161,AdamW,0.4116040042969575,,,0.00011301136422770917,,,,6,,,0.001236397888857401,,COMPLETE
855,855,27.083333333333332,2025-05-25 07:05:47.784862,2025-05-25 07:05:53.161097,0 days 00:00:05.376235,AdamW,0.4210775815142601,,,0.00011661502750673804,,,,8,,,0.0011395493779919783,,PRUNED
856,856,33.333333333333336,2025-05-25 07:05:53.206059,2025-05-25 07:05:58.768692,0 days 00:00:05.562633,AdamW,0.4157810105288716,,,0.00013543010936523377,,,,7,,,0.0012235705746824362,,PRUNED
857,857,33.333333333333336,2025-05-25 07:05:58.814315,2025-05-25 07:06:05.137826,0 days 00:00:06.323511,Adadelta,0.4278076255547874,1.0660707068638982,,,,,,7,0.11817957454207717,,,,PRUNED
858,858,33.333333333333336,2025-05-25 07:06:05.395565,2025-05-25 07:06:11.894946,0 days 00:00:06.499381,AdamW,0.4107464345760043,,,0.00011989514854745803,,,,6,,,0.0013289014516198394,,PRUNED
859,859,33.333333333333336,2025-05-25 07:06:11.940897,2025-05-25 07:06:18.571046,0 days 00:00:06.630149,AdamW,0.4381914709435719,,,0.00017526009657859156,,,,6,,,0.003295601378695608,,PRUNED
860,860,35.416666666666664,2025-05-25 07:06:18.617541,2025-05-25 07:06:25.043679,0 days 00:00:06.426138,AdamW,0.4258717367882461,,,0.00014425591190880694,,,,7,,,0.0012563224194584949,,PRUNED
861,861,35.416666666666664,2025-05-25 07:06:25.089277,2025-05-25 07:06:31.063365,0 days 00:00:05.974088,AdamW,0.40915676081418795,,,0.00010303871338418277,,,,6,,,0.0010861299062095776,,PRUNED
862,862,33.333333333333336,2025-05-25 07:06:31.109783,2025-05-25 07:06:37.572554,0 days 00:00:06.462771,AdamW,0.4003631264026736,,,0.00016906637889797143,,,,6,,,0.0009702711612225976,,PRUNED
863,863,50.0,2025-05-25 07:06:37.619402,2025-05-25 07:06:51.745723,0 days 00:00:14.126321,AdamW,0.4177401242458247,,,0.00020092534111580386,,,,6,,,0.001366861461689251,,COMPLETE
864,864,35.416666666666664,2025-05-25 07:06:51.807065,2025-05-25 07:06:58.184016,0 days 00:00:06.376951,AdamW,0.46019967389801014,,,0.00010820724387475041,,,,7,,,0.00013179643947011036,,PRUNED
865,865,29.166666666666668,2025-05-25 07:06:58.225377,2025-05-25 07:07:03.649446,0 days 00:00:05.424069,AdamW,0.4064919395579024,,,0.00014683860925302462,,,,0,,,0.0011586613128532059,,PRUNED
866,866,33.333333333333336,2025-05-25 07:07:03.692309,2025-05-25 07:07:09.500556,0 days 00:00:05.808247,AdamW,0.4353587413588837,,,0.00027245584862104264,,,,23,,,0.001286488747925853,,PRUNED
867,867,31.25,2025-05-25 07:07:09.545782,2025-05-25 07:07:15.998761,0 days 00:00:06.452979,AdamW,0.42334227954589915,,,9.198274202210427e-05,,,,5,,,0.0010555467451506188,,PRUNED
868,868,41.666666666666664,2025-05-25 07:07:16.046076,2025-05-25 07:07:24.368663,0 days 00:00:08.322587,AdamW,0.3521699977903239,,,0.0001255353527430665,,,,1,,,0.0011884986816575837,,PRUNED
869,869,33.333333333333336,2025-05-25 07:07:24.419706,2025-05-25 07:07:30.659426,0 days 00:00:06.239720,SGD,0.39958496845336255,,,,0.0001911331884021361,35.26021433783856,False,8,,,,19.38321338671587,PRUNED
870,870,33.333333333333336,2025-05-25 07:07:30.707277,2025-05-25 07:07:35.740152,0 days 00:00:05.032875,AdamW,0.4504243535783715,,,0.00017207344243018251,,,,13,,,0.00045170228597466003,,PRUNED
871,871,33.333333333333336,2025-05-25 07:07:35.783838,2025-05-25 07:07:42.147789,0 days 00:00:06.363951,Adadelta,0.36204301593116645,54.77343996609374,,,,,,6,0.07050780759142139,,,,PRUNED
872,872,33.333333333333336,2025-05-25 07:07:42.193707,2025-05-25 07:07:48.726576,0 days 00:00:06.532869,Adam,0.41282989523765956,,6.86595411381035e-05,,,,,5,,0.08368110050343384,,,PRUNED
873,873,33.333333333333336,2025-05-25 07:07:48.775399,2025-05-25 07:07:54.615321,0 days 00:00:05.839922,AdamW,0.2959497027688832,,,0.05492589420507781,,,,7,,,0.0007507884270933509,,PRUNED
874,874,43.75,2025-05-25 07:07:54.657179,2025-05-25 07:08:02.310573,0 days 00:00:07.653394,AdamW,0.32857899696941,,,0.0002078169217411607,,,,6,,,0.0014568503942260602,,PRUNED
875,875,35.416666666666664,2025-05-25 07:08:02.357606,2025-05-25 07:08:08.924399,0 days 00:00:06.566793,AdamW,0.3697891457338831,,,0.00032618113911304377,,,,5,,,0.0035426613051666367,,PRUNED
876,876,29.166666666666668,2025-05-25 07:08:08.971462,2025-05-25 07:08:15.494543,0 days 00:00:06.523081,AdamW,0.24895127079009477,,,3.1093473724857704e-05,,,,5,,,0.0009252897575414638,,PRUNED
877,877,52.083333333333336,2025-05-25 07:08:15.526902,2025-05-25 07:08:26.446421,0 days 00:00:10.919519,AdamW,0.4936711529853723,,,0.00015506732205334035,,,,6,,,0.001355956522123498,,COMPLETE
878,878,35.416666666666664,2025-05-25 07:08:26.507394,2025-05-25 07:08:33.144160,0 days 00:00:06.636766,AdamW,0.39518762341399855,,,0.00010306015294285663,,,,1,,,0.0009936952346884637,,PRUNED
879,879,35.416666666666664,2025-05-25 07:08:33.191865,2025-05-25 07:08:39.832510,0 days 00:00:06.640645,AdamW,0.41454974191045263,,,0.0002410082859251738,,,,2,,,0.0011696993159141429,,PRUNED
880,880,35.416666666666664,2025-05-25 07:08:39.880276,2025-05-25 07:08:46.217378,0 days 00:00:06.337102,AdamW,0.3868797448681297,,,0.00012486503257824906,,,,7,,,0.00038377295791426483,,PRUNED
881,881,35.416666666666664,2025-05-25 07:08:46.262578,2025-05-25 07:08:52.916852,0 days 00:00:06.654274,AdamW,0.42818393357351525,,,8.288417113404633e-05,,,,5,,,0.0008137566552226069,,PRUNED
882,882,35.416666666666664,2025-05-25 07:08:52.965632,2025-05-25 07:09:07.898519,0 days 00:00:14.932887,AdamW,0.354677839596622,,,0.000405598290157818,,,,2,,,0.0012689621489636014,,COMPLETE
883,883,33.333333333333336,2025-05-25 07:09:07.963418,2025-05-25 07:09:11.832105,0 days 00:00:03.868687,AdamW,0.4036792571301499,,,0.0002101785002546627,,,,4,,,0.0010754272641289079,,PRUNED
884,884,33.333333333333336,2025-05-25 07:09:11.864621,2025-05-25 07:09:15.430056,0 days 00:00:03.565435,AdamW,0.13383624676981556,,,0.0009839923174541658,,,,7,,,0.001465880769483081,,PRUNED
885,885,33.333333333333336,2025-05-25 07:09:15.475390,2025-05-25 07:09:22.089837,0 days 00:00:06.614447,Adadelta,0.3792840292841331,0.7323483699488093,,,,,,5,0.2974598395617179,,,,PRUNED
886,886,33.333333333333336,2025-05-25 07:09:22.138506,2025-05-25 07:09:28.636558,0 days 00:00:06.498052,AdamW,0.39912908688934035,,,0.00018385068676788057,,,,6,,,0.0013886002464021218,,PRUNED
887,887,39.583333333333336,2025-05-25 07:09:28.684002,2025-05-25 07:09:34.028132,0 days 00:00:05.344130,AdamW,0.3433936167916814,,,0.00013792368824661332,,,,3,,,0.0015380566615472567,,PRUNED
888,888,33.333333333333336,2025-05-25 07:09:34.080877,2025-05-25 07:09:38.078208,0 days 00:00:03.997331,AdamW,0.43813822987620576,,,9.353439867927906e-05,,,,3,,,0.0012088943635156068,,PRUNED
889,889,33.333333333333336,2025-05-25 07:09:38.125767,2025-05-25 07:09:44.408816,0 days 00:00:06.283049,AdamW,0.3629113077453019,,,0.0002809722318409994,,,,30,,,0.001083185089949151,,PRUNED
890,890,52.083333333333336,2025-05-25 07:09:44.453563,2025-05-25 07:09:59.080404,0 days 00:00:14.626841,AdamW,0.4210823471026189,,,0.00011591410585732893,,,,5,,,0.0009229258829153605,,COMPLETE
891,891,31.25,2025-05-25 07:09:59.142280,2025-05-25 07:10:06.003138,0 days 00:00:06.860858,AdamW,0.38700190597802686,,,7.383840687975948e-05,,,,4,,,0.0010238537777842603,,PRUNED
892,892,37.5,2025-05-25 07:10:06.051455,2025-05-25 07:10:12.548581,0 days 00:00:06.497126,AdamW,0.41276947097123234,,,2.5269052211998788e-05,,,,6,,,0.0027942668738578803,,PRUNED
893,893,,2025-05-25 07:10:12.595588,2025-05-25 07:10:18.407925,0 days 00:00:05.812337,SGD,0.3692605234736064,,,,0.09625652129317105,53.1964858233702,False,0,,,,55.25766151986771,PRUNED
894,894,33.333333333333336,2025-05-25 07:10:18.455389,2025-05-25 07:10:24.875219,0 days 00:00:06.419830,AdamW,0.4052094391355575,,,0.00015582747298264883,,,,6,,,0.0013366020927622437,,PRUNED
895,895,33.333333333333336,2025-05-25 07:10:24.920361,2025-05-25 07:10:28.744843,0 days 00:00:03.824482,Adam,0.378071455769475,,0.003306005393939618,,,,,4,,3.879124273263149,,,PRUNED
896,896,45.833333333333336,2025-05-25 07:10:28.793092,2025-05-25 07:10:42.805729,0 days 00:00:14.012637,AdamW,0.39381740623495193,,,0.00035016955748078837,,,,2,,,0.0016079822458691568,,COMPLETE
897,897,43.75,2025-05-25 07:10:42.866542,2025-05-25 07:10:56.554274,0 days 00:00:13.687732,AdamW,0.3585858006382418,,,0.00024753223209213556,,,,3,,,0.0011821084642631191,,COMPLETE
898,898,33.333333333333336,2025-05-25 07:10:56.607106,2025-05-25 07:11:02.295174,0 days 00:00:05.688068,Adadelta,0.42966696608566507,3.6279091528122485,,,,,,1,2.9763464966278583,,,,PRUNED
899,899,33.333333333333336,2025-05-25 07:11:02.342649,2025-05-25 07:11:08.597917,0 days 00:00:06.255268,AdamW,0.4190496566073224,,,0.00018550136123364266,,,,8,,,0.0008482129645011065,,PRUNED
900,900,37.5,2025-05-25 07:11:08.643430,2025-05-25 07:11:15.217419,0 days 00:00:06.573989,AdamW,0.08168395869371803,,,0.00010212539762848457,,,,5,,,0.0012573143250599115,,PRUNED
901,901,33.333333333333336,2025-05-25 07:11:15.265470,2025-05-25 07:11:22.090982,0 days 00:00:06.825512,AdamW,0.38291070552950457,,,8.081472441110657e-05,,,,4,,,0.0014905149680302504,,PRUNED
902,902,33.333333333333336,2025-05-25 07:11:22.140660,2025-05-25 07:11:28.623609,0 days 00:00:06.482949,AdamW,0.4447929752127012,,,6.265922958007369e-05,,,,6,,,0.0010011621537451723,,PRUNED
903,903,27.083333333333332,2025-05-25 07:11:28.671120,2025-05-25 07:11:35.024563,0 days 00:00:06.353443,AdamW,0.3494534679112516,,,0.00013045150824798202,,,,7,,,0.0011167145848080206,,PRUNED
904,904,39.583333333333336,2025-05-25 07:11:35.070423,2025-05-25 07:11:41.656331,0 days 00:00:06.585908,AdamW,0.3687678437586812,,,0.0002009681136055379,,,,5,,,0.0013800554821113914,,PRUNED
905,905,33.333333333333336,2025-05-25 07:11:41.704071,2025-05-25 07:11:48.343841,0 days 00:00:06.639770,AdamW,0.40887241586407047,,,0.00016371312908778471,,,,3,,,0.0015938038864779518,,PRUNED
906,906,33.333333333333336,2025-05-25 07:11:48.392246,2025-05-25 07:11:54.732880,0 days 00:00:06.340634,AdamW,0.3954308575248833,,,0.0004897777668251907,,,,9,,,0.0012182734796721971,,PRUNED
907,907,39.583333333333336,2025-05-25 07:11:54.778153,2025-05-25 07:12:01.420598,0 days 00:00:06.642445,AdamW,0.3760579999694501,,,0.00024233259890027274,,,,4,,,0.0011044005738361,,PRUNED
908,908,33.333333333333336,2025-05-25 07:12:01.470914,2025-05-25 07:12:08.130260,0 days 00:00:06.659346,AdamW,0.46862866144014,,,0.0016583963285714,,,,1,,,0.003084680857174515,,PRUNED
909,909,33.333333333333336,2025-05-25 07:12:08.179873,2025-05-25 07:12:14.671024,0 days 00:00:06.491151,AdamW,0.10698851088229394,,,0.00011525785954993226,,,,6,,,0.00384215825285236,,PRUNED
910,910,37.5,2025-05-25 07:12:14.717958,2025-05-25 07:12:21.376459,0 days 00:00:06.658501,AdamW,0.40254437855290054,,,9.372604560555448e-05,,,,3,,,0.0009322253137872329,,PRUNED
911,911,33.333333333333336,2025-05-25 07:12:21.424719,2025-05-25 07:12:28.117400,0 days 00:00:06.692681,Adadelta,0.4239368964157161,21.11784498470899,,,,,,2,6.5767107678759835,,,,PRUNED
912,912,35.416666666666664,2025-05-25 07:12:28.165287,2025-05-25 07:12:34.732693,0 days 00:00:06.567406,AdamW,0.390470131881741,,,3.5291798160058816e-05,,,,5,,,0.0013779670926647575,,PRUNED
913,913,33.333333333333336,2025-05-25 07:12:34.780452,2025-05-25 07:12:41.194180,0 days 00:00:06.413728,AdamW,0.41123781050667363,,,1.4588433730506146e-05,,,,7,,,0.0012657227540753286,,PRUNED
914,914,33.333333333333336,2025-05-25 07:12:41.240521,2025-05-25 07:12:47.683219,0 days 00:00:06.442698,AdamW,0.36203465193916745,,,0.0002920554703643272,,,,4,,,0.0026262463053356505,,PRUNED
915,915,56.25,2025-05-25 07:12:47.731659,2025-05-25 07:13:02.335019,0 days 00:00:14.603360,AdamW,0.38538841447953065,,,0.00014440673006293402,,,,5,,,0.0010551183028244117,,COMPLETE
916,916,39.583333333333336,2025-05-25 07:13:02.397951,2025-05-25 07:13:08.885925,0 days 00:00:06.487974,AdamW,0.33934600295096373,,,6.832521309091638e-05,,,,6,,,0.0016532881277751528,,PRUNED
