,number,value,datetime_start,datetime_complete,duration,params_algorithm,params_dropout_rate,params_lr_Adadelta,params_lr_Adam,params_lr_AdamW,params_lr_SGD,params_momentum_SGD,params_nesterov_SGD,params_suggested_freeze,params_weight_decay_Adadelta,params_weight_decay_Adam,params_weight_decay_AdamW,params_weight_decay_SGD,state
917,917,33.333333333333336,2025-05-25 07:13:08.933680,2025-05-25 07:13:16.505839,0 days 00:00:07.572159,AdamW,0.43082496803943454,,,0.0002148834880296811,,,,20,,,0.000961263583122789,,PRUNED
918,918,33.333333333333336,2025-05-25 07:13:16.536686,2025-05-25 07:13:19.432218,0 days 00:00:02.895532,Adam,0.3715851516386836,,2.7411680899554708e-05,,,,,4,,1.2514048569897969,,,PRUNED
919,919,33.333333333333336,2025-05-25 07:13:19.463326,2025-05-25 07:13:22.377279,0 days 00:00:02.913953,AdamW,0.4004865707582997,,,5.234310166310123e-05,,,,3,,,0.0011838580901423373,,PRUNED
920,920,,2025-05-25 07:13:22.409902,2025-05-25 07:13:25.314400,0 days 00:00:02.904498,SGD,0.4177983901271241,,,,6.970233178983925e-05,71.41157853064449,True,2,,,,0.010634165264359716,PRUNED
921,921,33.333333333333336,2025-05-25 07:13:25.345038,2025-05-25 07:13:28.310529,0 days 00:00:02.965491,AdamW,0.35747481975255085,,,0.00017024408552108222,,,,7,,,0.0014219295265109888,,PRUNED
922,922,54.166666666666664,2025-05-25 07:13:28.341654,2025-05-25 07:13:35.400052,0 days 00:00:07.058398,AdamW,0.3811168129897416,,,8.17010658893001e-05,,,,5,,,0.0008461993492584914,,COMPLETE
923,923,33.333333333333336,2025-05-25 07:13:35.441083,2025-05-25 07:13:38.251376,0 days 00:00:02.810293,AdamW,0.40953850353032284,,,0.00011724126182079987,,,,6,,,0.0015239443967058068,,PRUNED
924,924,33.333333333333336,2025-05-25 07:13:38.282355,2025-05-25 07:13:41.192500,0 days 00:00:02.910145,AdamW,0.39390782107543487,,,2.000158817234257e-05,,,,2,,,0.0012936021993119775,,PRUNED
925,925,33.333333333333336,2025-05-25 07:13:41.224318,2025-05-25 07:13:44.088226,0 days 00:00:02.863908,Adadelta,0.4382981049640656,88.78597636163019,,,,,,5,84.05604816366825,,,,PRUNED
926,926,33.333333333333336,2025-05-25 07:13:44.119947,2025-05-25 07:13:46.853277,0 days 00:00:02.733330,AdamW,0.35056484263843785,,,0.00014716908095605097,,,,8,,,0.0024166373423351933,,PRUNED
927,927,33.333333333333336,2025-05-25 07:13:46.883662,2025-05-25 07:13:49.770375,0 days 00:00:02.886713,AdamW,0.3663052087461436,,,4.6829902245084486e-05,,,,3,,,0.0011403661801583542,,PRUNED
928,928,33.333333333333336,2025-05-25 07:13:49.803030,2025-05-25 07:13:52.799396,0 days 00:00:02.996366,AdamW,0.4017807375906734,,,0.0003447708965885593,,,,4,,,0.0010581646482994964,,PRUNED
929,929,33.333333333333336,2025-05-25 07:13:52.993332,2025-05-25 07:13:55.923364,0 days 00:00:02.930032,AdamW,0.2687175581631612,,,0.00018370398176587288,,,,1,,,0.0017127261505555079,,PRUNED
930,930,50.0,2025-05-25 07:13:55.955219,2025-05-25 07:14:03.241089,0 days 00:00:07.285870,AdamW,0.3858507406661352,,,9.358637328329527e-05,,,,3,,,0.002830277514863884,,COMPLETE
931,931,43.75,2025-05-25 07:14:03.282639,2025-05-25 07:14:10.060238,0 days 00:00:06.777599,AdamW,0.4191005620402885,,,0.00025356138689944984,,,,6,,,0.0013015643983643236,,COMPLETE
932,932,33.333333333333336,2025-05-25 07:14:10.102387,2025-05-25 07:14:12.969489,0 days 00:00:02.867102,AdamW,0.37352510550270984,,,6.067033406571557e-05,,,,5,,,0.0009737491143913717,,PRUNED
933,933,62.5,2025-05-25 07:14:13.000892,2025-05-25 07:14:20.298439,0 days 00:00:07.297547,AdamW,0.4579575917034403,,,0.00010419242987038321,,,,3,,,0.001501217161037407,,COMPLETE
934,934,37.5,2025-05-25 07:14:20.340498,2025-05-25 07:14:25.031704,0 days 00:00:04.691206,AdamW,0.46211284313218015,,,0.00011233706042827758,,,,2,,,0.0015274639514077468,,PRUNED
935,935,37.5,2025-05-25 07:14:25.118181,2025-05-25 07:14:28.247421,0 days 00:00:03.129240,AdamW,0.46981913590027363,,,0.00013177909653888008,,,,3,,,0.0015010968851909053,,PRUNED
936,936,35.416666666666664,2025-05-25 07:14:28.279629,2025-05-25 07:14:31.173602,0 days 00:00:02.893973,AdamW,0.4554000201377181,,,0.00010933159984586841,,,,2,,,0.0016234826200950468,,PRUNED
937,937,50.0,2025-05-25 07:14:31.205715,2025-05-25 07:14:38.451722,0 days 00:00:07.246007,AdamW,0.4847484769204336,,,0.00013383057140331958,,,,3,,,0.001399947126077777,,COMPLETE
938,938,29.166666666666668,2025-05-25 07:14:38.493017,2025-05-25 07:14:41.392789,0 days 00:00:02.899772,AdamW,0.46138952187582694,,,9.993365991401649e-05,,,,2,,,0.0014010710464775215,,PRUNED
939,939,39.583333333333336,2025-05-25 07:14:41.424752,2025-05-25 07:14:44.335600,0 days 00:00:02.910848,AdamW,0.4675987953219223,,,0.00014663563918669936,,,,3,,,0.0012444776711227682,,PRUNED
940,940,33.333333333333336,2025-05-25 07:14:44.368755,2025-05-25 07:14:47.302869,0 days 00:00:02.934114,Adadelta,0.4802225156020525,11.478003946495978,,,,,,2,0.014118832622350913,,,,PRUNED
941,941,33.333333333333336,2025-05-25 07:14:47.334847,2025-05-25 07:14:50.238670,0 days 00:00:02.903823,AdamW,0.4848616318886377,,,0.00016753944136010238,,,,1,,,0.0014582267775758975,,PRUNED
942,942,41.666666666666664,2025-05-25 07:14:50.271449,2025-05-25 07:14:55.838685,0 days 00:00:05.567236,AdamW,0.46845259503313325,,,0.00021370246030714239,,,,4,,,0.00010401843134162087,,PRUNED
943,943,33.333333333333336,2025-05-25 07:14:55.870681,2025-05-25 07:14:58.684816,0 days 00:00:02.814135,SGD,0.45515907703303643,,,,0.00888235333085448,28.175455902602092,False,11,,,,17.736483649178986,PRUNED
944,944,33.333333333333336,2025-05-25 07:14:58.714895,2025-05-25 07:15:01.622262,0 days 00:00:02.907367,Adam,0.4417283486503796,,0.0014467375550926032,,,,,3,,0.2976179130205507,,,PRUNED
945,945,33.333333333333336,2025-05-25 07:15:01.653985,2025-05-25 07:15:04.556378,0 days 00:00:02.902393,AdamW,0.4263393340428291,,,0.0001194709634586119,,,,0,,,0.0016438654237010966,,PRUNED
946,946,33.333333333333336,2025-05-25 07:15:04.588492,2025-05-25 07:15:07.513514,0 days 00:00:02.925022,AdamW,0.4781579319621909,,,9.361919751773304e-05,,,,2,,,0.0013163386608600336,,PRUNED
947,947,56.25,2025-05-25 07:15:07.546517,2025-05-25 07:15:14.781274,0 days 00:00:07.234757,AdamW,0.4542721247756232,,,0.00018839257396064402,,,,3,,,0.0011454960777124606,,COMPLETE
948,948,37.5,2025-05-25 07:15:14.822787,2025-05-25 07:15:17.738588,0 days 00:00:02.915801,AdamW,0.45586111752854497,,,0.00030293230245000374,,,,4,,,0.001734527360809531,,PRUNED
949,949,45.833333333333336,2025-05-25 07:15:17.771725,2025-05-25 07:15:23.341363,0 days 00:00:05.569638,AdamW,0.4703693065422867,,,0.00013357155529266273,,,,1,,,0.0012152067521357644,,PRUNED
950,950,33.333333333333336,2025-05-25 07:15:23.373664,2025-05-25 07:15:27.157263,0 days 00:00:03.783599,AdamW,0.441527172118741,,,8.203836428272335e-05,,,,3,,,0.0015698713621431686,,PRUNED
951,951,33.333333333333336,2025-05-25 07:15:27.189462,2025-05-25 07:15:30.480502,0 days 00:00:03.291040,AdamW,0.4393965329349814,,,0.00015975379882299218,,,,2,,,0.0007485878727270325,,PRUNED
952,952,33.333333333333336,2025-05-25 07:15:30.512758,2025-05-25 07:15:33.279345,0 days 00:00:02.766587,Adadelta,0.44926641991419014,0.1645769119919639,,,,,,7,1.840734303181332,,,,PRUNED
953,953,39.583333333333336,2025-05-25 07:15:33.310538,2025-05-25 07:15:37.148513,0 days 00:00:03.837975,AdamW,0.4501098086024291,,,0.00023256469033749972,,,,4,,,0.0013894848934824502,,PRUNED
954,954,33.333333333333336,2025-05-25 07:15:37.181442,2025-05-25 07:15:40.076335,0 days 00:00:02.894893,AdamW,0.43663190103855853,,,0.006908831010279254,,,,3,,,0.0010421593608019144,,PRUNED
955,955,37.5,2025-05-25 07:15:40.109340,2025-05-25 07:15:43.036020,0 days 00:00:02.926680,AdamW,0.4266784411742161,,,0.0001014485415020914,,,,4,,,0.0018154001670042071,,PRUNED
956,956,31.25,2025-05-25 07:15:43.067953,2025-05-25 07:15:45.991594,0 days 00:00:02.923641,AdamW,0.01834720719093358,,,0.00011234501593756095,,,,2,,,0.0008977392079699403,,PRUNED
957,957,45.833333333333336,2025-05-25 07:15:46.023471,2025-05-25 07:15:53.451634,0 days 00:00:07.428163,AdamW,0.33254368151626096,,,0.00018562938688006044,,,,4,,,0.0012939786154494732,,COMPLETE
958,958,33.333333333333336,2025-05-25 07:15:53.493141,2025-05-25 07:15:56.411384,0 days 00:00:02.918243,AdamW,0.4321903658959054,,,0.00014690640818979266,,,,1,,,0.0011246781086265592,,PRUNED
959,959,33.333333333333336,2025-05-25 07:15:56.442894,2025-05-25 07:15:59.379475,0 days 00:00:02.936581,AdamW,0.3457561834667282,,,0.0021679109401424724,,,,24,,,0.0014740555287199846,,PRUNED
960,960,45.833333333333336,2025-05-25 07:15:59.409980,2025-05-25 07:16:04.050673,0 days 00:00:04.640693,AdamW,0.4766217659151607,,,0.000267676034673009,,,,3,,,0.0009954061810858237,,PRUNED
961,961,35.416666666666664,2025-05-25 07:16:04.082777,2025-05-25 07:16:06.984569,0 days 00:00:02.901792,AdamW,0.4631006902863033,,,8.014649469778582e-05,,,,3,,,0.0012273120612144087,,PRUNED
962,962,33.333333333333336,2025-05-25 07:16:07.016252,2025-05-25 07:16:09.788598,0 days 00:00:02.772346,AdamW,0.3538532089507216,,,0.0004183714127461427,,,,7,,,0.0016112501185078568,,PRUNED
963,963,45.833333333333336,2025-05-25 07:16:09.819379,2025-05-25 07:16:14.477104,0 days 00:00:04.657725,AdamW,0.4481078043881016,,,0.00012339182483567975,,,,4,,,0.006008605402553114,,PRUNED
964,964,33.333333333333336,2025-05-25 07:16:14.509019,2025-05-25 07:16:17.378215,0 days 00:00:02.869196,Adadelta,0.4208300113097314,6.409871345196975,,,,,,5,0.4094615903818256,,,,PRUNED
965,965,33.333333333333336,2025-05-25 07:16:17.409536,2025-05-25 07:16:20.234051,0 days 00:00:02.824515,AdamW,0.21552100571181512,,,0.0135307716194547,,,,6,,,0.0011111268882789739,,PRUNED
966,966,50.0,2025-05-25 07:16:20.264562,2025-05-25 07:16:27.769692,0 days 00:00:07.505130,AdamW,0.3148052163949171,,,0.00021115468748360535,,,,2,,,0.0013510402057519183,,COMPLETE
967,967,,2025-05-25 07:16:27.831019,2025-05-25 07:16:30.737393,0 days 00:00:02.906374,SGD,0.36368025691256406,,,,1.8161725305217956e-05,17.529518327973555,True,3,,,,1.748151394216761,PRUNED
968,968,39.583333333333336,2025-05-25 07:16:30.769192,2025-05-25 07:16:33.636370,0 days 00:00:02.867178,AdamW,0.4151966775971385,,,0.00015969575580731583,,,,5,,,0.0009100630453657998,,PRUNED
969,969,33.333333333333336,2025-05-25 07:16:33.667488,2025-05-25 07:16:36.565869,0 days 00:00:02.898381,Adam,0.43171346900077157,,0.00012186731180599336,,,,,4,,21.154168258398695,,,PRUNED
970,970,39.583333333333336,2025-05-25 07:16:36.597750,2025-05-25 07:16:39.497103,0 days 00:00:02.899353,AdamW,0.35469617303132006,,,9.428213797466604e-05,,,,1,,,0.0014902499821831724,,PRUNED
971,971,33.333333333333336,2025-05-25 07:16:39.528601,2025-05-25 07:16:42.366371,0 days 00:00:02.837770,AdamW,0.37250442378417425,,,0.00033241672413169605,,,,6,,,0.0017409356456361334,,PRUNED
972,972,47.916666666666664,2025-05-25 07:16:42.397714,2025-05-25 07:16:49.634390,0 days 00:00:07.236676,AdamW,0.4173626452518268,,,0.00013432835865614622,,,,2,,,0.001186552484815908,,COMPLETE
973,973,31.25,2025-05-25 07:16:49.676187,2025-05-25 07:16:52.486467,0 days 00:00:02.810280,AdamW,0.4096727016076518,,,0.00023157834578481186,,,,7,,,0.0010199387283664667,,PRUNED
974,974,37.5,2025-05-25 07:16:52.517619,2025-05-25 07:16:55.385255,0 days 00:00:02.867636,AdamW,0.34035767243560516,,,7.152038891404479e-05,,,,5,,,0.0013672200183158937,,PRUNED
975,975,35.416666666666664,2025-05-25 07:16:55.416775,2025-05-25 07:16:58.569955,0 days 00:00:03.153180,AdamW,0.36202503414562476,,,0.000189403824143548,,,,0,,,0.0019108202940687513,,PRUNED
976,976,39.583333333333336,2025-05-25 07:16:58.603183,2025-05-25 07:17:01.515258,0 days 00:00:02.912075,AdamW,0.3765312952052423,,,0.00010469104464586207,,,,4,,,0.0008175139446659022,,PRUNED
977,977,39.583333333333336,2025-05-25 07:17:01.546730,2025-05-25 07:17:04.448256,0 days 00:00:02.901526,AdamW,0.05580548318469519,,,0.00016248924794390633,,,,3,,,0.0010982196571223065,,PRUNED
978,978,33.333333333333336,2025-05-25 07:17:04.479785,2025-05-25 07:17:07.312754,0 days 00:00:02.832969,AdamW,0.4465339076695641,,,8.530715535385524e-05,,,,6,,,0.0012763851416788764,,PRUNED
979,979,33.333333333333336,2025-05-25 07:17:07.343736,2025-05-25 07:17:10.075611,0 days 00:00:02.731875,Adadelta,0.47586431501311016,0.11476419512482243,,,,,,8,0.9013775762393446,,,,PRUNED
980,980,41.666666666666664,2025-05-25 07:17:10.105708,2025-05-25 07:17:14.747954,0 days 00:00:04.642246,AdamW,0.492765200012533,,,0.00027672480104966166,,,,3,,,0.001603263477977363,,PRUNED
981,981,35.416666666666664,2025-05-25 07:17:14.779535,2025-05-25 07:17:17.680931,0 days 00:00:02.901396,AdamW,0.4066062700229095,,,0.00012084658162247387,,,,4,,,0.0014705968113000003,,PRUNED
982,982,35.416666666666664,2025-05-25 07:17:17.712796,2025-05-25 07:17:20.478615,0 days 00:00:02.765819,AdamW,0.3924436233604171,,,0.0002241311539560752,,,,7,,,0.0011637618399166225,,PRUNED
983,983,35.416666666666664,2025-05-25 07:17:20.509958,2025-05-25 07:17:23.435192,0 days 00:00:02.925234,AdamW,0.42584549717240083,,,0.00014533001987165922,,,,5,,,0.0009802015817373408,,PRUNED
984,984,35.416666666666664,2025-05-25 07:17:23.465945,2025-05-25 07:17:26.365029,0 days 00:00:02.899084,AdamW,0.36887916843875973,,,8.03686620316092e-05,,,,2,,,0.001276353678627993,,PRUNED
985,985,33.333333333333336,2025-05-25 07:17:26.397105,2025-05-25 07:17:29.229203,0 days 00:00:02.832098,AdamW,0.4609044334183989,,,0.0001954933689251532,,,,16,,,0.0017252430147504379,,PRUNED
986,986,37.5,2025-05-25 07:17:29.260389,2025-05-25 07:17:32.082730,0 days 00:00:02.822341,AdamW,0.4011916599625409,,,0.00010457083119750565,,,,6,,,0.001388570295368181,,PRUNED
987,987,33.333333333333336,2025-05-25 07:17:32.115008,2025-05-25 07:17:34.981444,0 days 00:00:02.866436,AdamW,0.43652085875316077,,,0.0003642375245798613,,,,5,,,0.0010690874530366553,,PRUNED
988,988,35.416666666666664,2025-05-25 07:17:35.012928,2025-05-25 07:17:37.927732,0 days 00:00:02.914804,AdamW,0.3826678962806205,,,0.00012751039559312887,,,,3,,,0.0008857110344779636,,PRUNED
989,989,39.583333333333336,2025-05-25 07:17:37.959685,2025-05-25 07:17:40.877695,0 days 00:00:02.918010,AdamW,0.35503130130936883,,,0.00017280309808635403,,,,4,,,0.001562487456007024,,PRUNED
990,990,33.333333333333336,2025-05-25 07:17:40.910785,2025-05-25 07:17:43.992605,0 days 00:00:03.081820,AdamW,0.4122922904252077,,,0.0002766558242424203,,,,4,,,0.001171908983235604,,PRUNED
991,991,,2025-05-25 07:17:44.024995,2025-05-25 07:17:46.850151,0 days 00:00:02.825156,SGD,0.42404197611166283,,,,0.0004885126466031971,6.356069795963776,False,6,,,,4.212612459277283,PRUNED
992,992,33.333333333333336,2025-05-25 07:17:46.880465,2025-05-25 07:17:49.779979,0 days 00:00:02.899514,Adam,0.3921911243327545,,0.06177245499545761,,,,,1,,0.017670265539236448,,,PRUNED
993,993,33.333333333333336,2025-05-25 07:17:49.811525,2025-05-25 07:17:52.755199,0 days 00:00:02.943674,Adadelta,0.37864959621226996,1.7759750785848611,,,,,,3,0.022972179115700733,,,,PRUNED
994,994,33.333333333333336,2025-05-25 07:17:52.787215,2025-05-25 07:17:55.515625,0 days 00:00:02.728410,AdamW,0.3646929149248385,,,6.883895206926261e-05,,,,10,,,0.0019375199310471905,,PRUNED
995,995,25.0,2025-05-25 07:17:55.545776,2025-05-25 07:17:58.483140,0 days 00:00:02.937364,AdamW,0.4020695100449181,,,9.388397894824588e-05,,,,8,,,0.0013202904898965743,,PRUNED
996,996,58.333333333333336,2025-05-25 07:17:58.513189,2025-05-25 07:18:05.567458,0 days 00:00:07.054269,AdamW,0.3478493967697851,,,0.00015700908394293707,,,,5,,,0.0010290999743029525,,COMPLETE
997,997,56.25,2025-05-25 07:18:05.609231,2025-05-25 07:18:12.868814,0 days 00:00:07.259583,AdamW,0.41430090792654795,,,0.0002329339454097137,,,,2,,,0.001457943918446197,,COMPLETE
998,998,35.416666666666664,2025-05-25 07:18:12.911926,2025-05-25 07:18:15.753484,0 days 00:00:02.841558,AdamW,0.431681085373116,,,0.00012426236528928763,,,,6,,,0.0012084495624645124,,PRUNED
999,999,66.66666666666667,2025-05-25 07:18:15.784597,2025-05-25 07:18:22.245688,0 days 00:00:06.461091,AdamW,0.3879861144076923,,,0.00020393829301105704,,,,7,,,0.0009462450691106754,,COMPLETE
