,number,value,datetime_start,datetime_complete,duration,params_algorithm,params_dropout_rate,params_lr_Adadelta,params_lr_Adam,params_lr_AdamW,params_lr_SGD,params_momentum_SGD,params_nesterov_SGD,params_suggested_freeze,params_weight_decay_Adadelta,params_weight_decay_Adam,params_weight_decay_AdamW,params_weight_decay_SGD,state
458,458,60.416666666666664,2025-05-25 06:15:59.934778,2025-05-25 06:16:12.788711,0 days 00:00:12.853933,AdamW,0.40379329363722444,,,0.00012212517877371437,,,,4,,,0.001413633735192389,,COMPLETE
459,459,33.333333333333336,2025-05-25 06:16:12.840618,2025-05-25 06:16:17.759693,0 days 00:00:04.919075,AdamW,0.4024564159049051,,,0.0001077105970119726,,,,4,,,0.0011899000293542493,,PRUNED
460,460,33.333333333333336,2025-05-25 06:16:17.795110,2025-05-25 06:16:22.093173,0 days 00:00:04.298063,AdamW,0.412649102306035,,,0.003215603254669225,,,,3,,,0.0010770665147987215,,PRUNED
461,461,33.333333333333336,2025-05-25 06:16:22.119731,2025-05-25 06:16:25.411432,0 days 00:00:03.291701,AdamW,0.49970041297184664,,,0.00012342228468621044,,,,4,,,0.000921317185074741,,PRUNED
462,462,33.333333333333336,2025-05-25 06:16:25.438332,2025-05-25 06:16:28.966216,0 days 00:00:03.527884,AdamW,0.3972833403677301,,,9.109967286227221e-05,,,,3,,,0.0013188578102633092,,PRUNED
463,463,31.25,2025-05-25 06:16:29.003434,2025-05-25 06:16:32.867787,0 days 00:00:03.864353,AdamW,0.40484303400690586,,,0.0001517675994463205,,,,5,,,0.0018708892993994002,,PRUNED
464,464,58.333333333333336,2025-05-25 06:16:32.897728,2025-05-25 06:16:40.650001,0 days 00:00:07.752273,AdamW,0.38892257949209896,,,0.00012990073132707365,,,,4,,,0.0023544482476385072,,COMPLETE
465,465,33.333333333333336,2025-05-25 06:16:40.689368,2025-05-25 06:16:43.756092,0 days 00:00:03.066724,Adadelta,0.38163997046263565,0.4870284860211046,,,,,,5,1.2719193128941793,,,,PRUNED
466,466,29.166666666666668,2025-05-25 06:16:43.786008,2025-05-25 06:16:46.751633,0 days 00:00:02.965625,AdamW,0.42078584740996383,,,8.679490821268672e-05,,,,3,,,0.0013971506120774447,,PRUNED
467,467,43.75,2025-05-25 06:16:46.779277,2025-05-25 06:16:56.301482,0 days 00:00:09.522205,AdamW,0.36743467410883723,,,0.0001777668603572386,,,,5,,,0.001125331786102835,,PRUNED
468,468,31.25,2025-05-25 06:16:56.345011,2025-05-25 06:17:03.022185,0 days 00:00:06.677174,AdamW,0.3973308353209315,,,0.00010522164744963266,,,,2,,,0.001248633431551786,,PRUNED
469,469,31.25,2025-05-25 06:17:03.060498,2025-05-25 06:17:07.813273,0 days 00:00:04.752775,AdamW,0.40866897155814624,,,7.476520992358678e-05,,,,14,,,0.000989767480804246,,PRUNED
470,470,47.916666666666664,2025-05-25 06:17:07.840108,2025-05-25 06:17:15.085181,0 days 00:00:07.245073,AdamW,0.3625731491826618,,,0.00015267426032169115,,,,4,,,0.0021077078333233967,,COMPLETE
471,471,33.333333333333336,2025-05-25 06:17:15.124693,2025-05-25 06:17:18.116453,0 days 00:00:02.991760,AdamW,0.38937763444865503,,,0.00011540388072093106,,,,4,,,0.0017089043564079052,,PRUNED
472,472,37.5,2025-05-25 06:17:18.144049,2025-05-25 06:17:21.383646,0 days 00:00:03.239597,AdamW,0.37433724379530975,,,6.51689109083311e-05,,,,6,,,0.0014814072501821802,,PRUNED
473,473,33.333333333333336,2025-05-25 06:17:21.422122,2025-05-25 06:17:27.808911,0 days 00:00:06.386789,AdamW,0.38333109104943874,,,0.00016476180920294858,,,,17,,,0.0008505730528559262,,PRUNED
474,474,33.333333333333336,2025-05-25 06:17:27.847130,2025-05-25 06:17:34.335667,0 days 00:00:06.488537,AdamW,0.42092850981132834,,,5.252654771670571e-05,,,,5,,,0.00010544539931333079,,PRUNED
475,475,50.0,2025-05-25 06:17:34.373745,2025-05-25 06:17:49.137292,0 days 00:00:14.763547,AdamW,0.40007275091428657,,,9.386236231274565e-05,,,,3,,,0.0007535423623852563,,COMPLETE
476,476,54.166666666666664,2025-05-25 06:17:49.193629,2025-05-25 06:18:04.309384,0 days 00:00:15.115755,AdamW,0.3725420060213882,,,0.0001291159780301607,,,,3,,,0.002256315474818891,,COMPLETE
477,477,,2025-05-25 06:18:04.364754,2025-05-25 06:18:10.236510,0 days 00:00:05.871756,SGD,0.35947091681661175,,,,0.006664601466812642,84.56018837085294,False,2,,,,0.10988215694788546,PRUNED
478,478,39.583333333333336,2025-05-25 06:18:10.279421,2025-05-25 06:18:21.572447,0 days 00:00:11.293026,AdamW,0.4139626417225865,,,0.00020812700082255742,,,,5,,,0.000458233802679759,,PRUNED
479,479,35.416666666666664,2025-05-25 06:18:21.621175,2025-05-25 06:18:28.054678,0 days 00:00:06.433503,Adadelta,0.39505305754555575,0.029265848397495103,,,,,,6,0.39616036640159985,,,,PRUNED
480,480,37.5,2025-05-25 06:18:28.097047,2025-05-25 06:18:37.960240,0 days 00:00:09.863193,AdamW,0.34957291603277263,,,0.0001759002946213482,,,,2,,,0.0019124170034207958,,PRUNED
481,481,25.0,2025-05-25 06:18:37.999395,2025-05-25 06:18:44.607369,0 days 00:00:06.607974,Adam,0.1714754324529799,,2.307567554576222e-05,,,,,4,,9.413021780787005,,,PRUNED
482,482,35.416666666666664,2025-05-25 06:18:44.645503,2025-05-25 06:18:51.212396,0 days 00:00:06.566893,AdamW,0.4056795390091523,,,0.0007424457898430988,,,,4,,,0.0016023613358114137,,PRUNED
483,483,33.333333333333336,2025-05-25 06:18:51.250488,2025-05-25 06:18:57.827532,0 days 00:00:06.577044,AdamW,0.3823892622983632,,,8.882938889628812e-05,,,,5,,,0.0013853451135439853,,PRUNED
484,484,54.166666666666664,2025-05-25 06:18:57.871290,2025-05-25 06:19:12.424105,0 days 00:00:14.552815,AdamW,0.367216513088749,,,6.687504235269427e-05,,,,3,,,0.001077982515708558,,COMPLETE
485,485,33.333333333333336,2025-05-25 06:19:12.480390,2025-05-25 06:19:18.901988,0 days 00:00:06.421598,AdamW,0.42770558816479726,,,0.00013789188131835877,,,,6,,,0.0012420111584210572,,PRUNED
486,486,45.833333333333336,2025-05-25 06:19:18.945663,2025-05-25 06:19:33.825810,0 days 00:00:14.880147,AdamW,0.3904246461860406,,,0.00023643549151065052,,,,3,,,0.0017789367759563246,,COMPLETE
487,487,31.25,2025-05-25 06:19:33.881812,2025-05-25 06:19:40.365181,0 days 00:00:06.483369,AdamW,0.3585116160390879,,,7.693304913053618e-05,,,,5,,,0.0011627414133325567,,PRUNED
488,488,33.333333333333336,2025-05-25 06:19:40.409939,2025-05-25 06:19:46.968037,0 days 00:00:06.558098,AdamW,0.37874227693601914,,,0.00011133176230603342,,,,4,,,0.0020301781426726563,,PRUNED
489,489,37.5,2025-05-25 06:19:47.006557,2025-05-25 06:19:53.663347,0 days 00:00:06.656790,AdamW,0.4152296599496624,,,5.384029152522901e-05,,,,2,,,0.0009903968711504317,,PRUNED
490,490,33.333333333333336,2025-05-25 06:19:53.702041,2025-05-25 06:20:00.115433,0 days 00:00:06.413392,AdamW,0.4023894382041674,,,0.00019765082639599878,,,,6,,,0.0015405547828747765,,PRUNED
491,491,35.416666666666664,2025-05-25 06:20:00.153898,2025-05-25 06:20:06.595756,0 days 00:00:06.441858,AdamW,0.3442391799974137,,,0.00015714298998362628,,,,4,,,0.0013813382440498682,,PRUNED
492,492,29.166666666666668,2025-05-25 06:20:06.633953,2025-05-25 06:20:13.033975,0 days 00:00:06.400022,Adadelta,0.37275516522364205,0.13512831073247944,,,,,,6,0.011462590242208139,,,,PRUNED
493,493,43.75,2025-05-25 06:20:13.076227,2025-05-25 06:20:23.028472,0 days 00:00:09.952245,AdamW,0.3920899330692483,,,0.00010338987883479592,,,,3,,,0.0023593273900946675,,PRUNED
494,494,35.416666666666664,2025-05-25 06:20:23.068019,2025-05-25 06:20:29.550391,0 days 00:00:06.482372,AdamW,0.38315205679363484,,,0.0001393304601476311,,,,5,,,0.0012592129110837545,,PRUNED
495,495,52.083333333333336,2025-05-25 06:20:29.588386,2025-05-25 06:20:43.465860,0 days 00:00:13.877474,AdamW,0.06745082973452443,,,0.00022922950032241358,,,,6,,,0.002707756737908683,,COMPLETE
496,496,45.833333333333336,2025-05-25 06:20:43.521400,2025-05-25 06:20:52.899952,0 days 00:00:09.378552,AdamW,0.36145017080456304,,,7.78533126085293e-05,,,,4,,,0.001682604493702102,,PRUNED
497,497,39.583333333333336,2025-05-25 06:20:52.938516,2025-05-25 06:21:02.608367,0 days 00:00:09.669851,AdamW,0.40867498965438076,,,0.00017636331471937298,,,,2,,,0.0010723875455365957,,PRUNED
498,498,52.083333333333336,2025-05-25 06:21:02.644022,2025-05-25 06:21:14.332985,0 days 00:00:11.688963,AdamW,0.3714691853674143,,,5.588380012593476e-05,,,,5,,,0.002163884476386616,,COMPLETE
499,499,33.333333333333336,2025-05-25 06:21:14.388227,2025-05-25 06:21:20.939568,0 days 00:00:06.551341,AdamW,0.4345063091625583,,,0.007857884004659756,,,,4,,,0.0009072668968249587,,PRUNED
500,500,54.166666666666664,2025-05-25 06:21:20.977067,2025-05-25 06:21:34.215920,0 days 00:00:13.238853,AdamW,0.3959151741629908,,,0.00012399717572423623,,,,3,,,0.001899726915085826,,COMPLETE
501,501,33.333333333333336,2025-05-25 06:21:34.271190,2025-05-25 06:21:40.538581,0 days 00:00:06.267391,AdamW,0.4209064392810977,,,0.0002548893583145679,,,,7,,,0.0014210803584580247,,PRUNED
502,502,,2025-05-25 06:21:40.576699,2025-05-25 06:21:47.022869,0 days 00:00:06.446170,SGD,0.3841483555881087,,,,0.0007490678513732959,14.290432293078943,True,5,,,,36.56466382031994,PRUNED
503,503,37.5,2025-05-25 06:21:47.060082,2025-05-25 06:21:53.025666,0 days 00:00:05.965584,Adam,0.35310485550199006,,0.0008573689742163176,,,,,6,,1.7681077840439903,,,PRUNED
504,504,43.75,2025-05-25 06:21:53.052729,2025-05-25 06:22:00.551425,0 days 00:00:07.498696,AdamW,0.4023569877960558,,,9.356691406804569e-05,,,,3,,,0.0011496757146926338,,PRUNED
505,505,37.5,2025-05-25 06:22:00.590149,2025-05-25 06:22:06.809226,0 days 00:00:06.219077,AdamW,0.3664022327215343,,,7.088156294364294e-05,,,,10,,,0.0015672264258058512,,PRUNED
506,506,33.333333333333336,2025-05-25 06:22:06.847223,2025-05-25 06:22:13.035387,0 days 00:00:06.188164,Adadelta,0.14473950858460644,1.343411967679704,,,,,,11,0.1619608148151146,,,,PRUNED
507,507,33.333333333333336,2025-05-25 06:22:13.062612,2025-05-25 06:22:16.817056,0 days 00:00:03.754444,AdamW,0.3780449301518937,,,0.00020774544840956838,,,,2,,,0.0025162184854236763,,PRUNED
508,508,33.333333333333336,2025-05-25 06:22:16.853689,2025-05-25 06:22:19.720104,0 days 00:00:02.866415,AdamW,0.33907376477017176,,,0.00015690267424254984,,,,8,,,0.0013054732696658952,,PRUNED
509,509,37.5,2025-05-25 06:22:19.750073,2025-05-25 06:22:23.648398,0 days 00:00:03.898325,AdamW,0.39133883979126777,,,0.00011378690656574146,,,,5,,,0.000158401691690821,,PRUNED
510,510,37.5,2025-05-25 06:22:23.683998,2025-05-25 06:22:28.435322,0 days 00:00:04.751324,AdamW,0.4113155167133956,,,4.786265264056203e-05,,,,4,,,0.001897532578099165,,PRUNED
511,511,50.0,2025-05-25 06:22:28.462205,2025-05-25 06:22:36.698236,0 days 00:00:08.236031,AdamW,0.34937344274509297,,,0.0001804820461067718,,,,6,,,0.0022788302039442637,,COMPLETE
512,512,35.416666666666664,2025-05-25 06:22:36.746976,2025-05-25 06:22:39.849000,0 days 00:00:03.102024,AdamW,0.35911285902997014,,,6.668250454208999e-05,,,,7,,,0.0009794031928056846,,PRUNED
513,513,58.333333333333336,2025-05-25 06:22:39.875984,2025-05-25 06:22:47.377318,0 days 00:00:07.501334,AdamW,0.37544633059645127,,,8.759120301147132e-05,,,,3,,,0.0017140556349803946,,COMPLETE
514,514,35.416666666666664,2025-05-25 06:22:47.443436,2025-05-25 06:22:51.654241,0 days 00:00:04.210805,AdamW,0.3993900383417313,,,0.00027960667671828016,,,,2,,,0.0011871889943333809,,PRUNED
515,515,50.0,2025-05-25 06:22:51.692200,2025-05-25 06:23:06.484112,0 days 00:00:14.791912,AdamW,0.38812134537897525,,,0.00013641563867356228,,,,4,,,0.0013432489576081952,,COMPLETE
516,516,33.333333333333336,2025-05-25 06:23:06.551204,2025-05-25 06:23:10.751954,0 days 00:00:04.200750,AdamW,0.4256205024655648,,,0.0021016248533341393,,,,5,,,0.001501356654538046,,PRUNED
517,517,64.58333333333333,2025-05-25 06:23:10.779274,2025-05-25 06:23:17.822582,0 days 00:00:07.043308,AdamW,0.41465572644437976,,,0.000221554801749129,,,,6,,,0.0010428576407975865,,COMPLETE
518,518,37.5,2025-05-25 06:23:17.863243,2025-05-25 06:23:20.915831,0 days 00:00:03.052588,AdamW,0.4019391564578954,,,0.0011303279123409964,,,,5,,,0.0008491563728863385,,PRUNED
519,519,56.25,2025-05-25 06:23:20.946429,2025-05-25 06:23:30.712729,0 days 00:00:09.766300,AdamW,0.4134410483338715,,,0.00023226297360294114,,,,3,,,0.0010335777980178954,,COMPLETE
520,520,33.333333333333336,2025-05-25 06:23:30.768508,2025-05-25 06:23:37.324611,0 days 00:00:06.556103,Adadelta,0.370482261909259,2.918672534785843,,,,,,4,0.019493396355474743,,,,PRUNED
521,521,33.333333333333336,2025-05-25 06:23:37.368151,2025-05-25 06:23:43.684848,0 days 00:00:06.316697,AdamW,0.3938289191119429,,,0.00031725886919085477,,,,7,,,0.0010657289520229348,,PRUNED
522,522,52.083333333333336,2025-05-25 06:23:43.727281,2025-05-25 06:23:58.630198,0 days 00:00:14.902917,AdamW,0.3851240705292288,,,6.0675104894670204e-05,,,,2,,,0.0009151688933150085,,COMPLETE
523,523,31.25,2025-05-25 06:23:58.685796,2025-05-25 06:24:05.267884,0 days 00:00:06.582088,AdamW,0.0014717275030401988,,,9.925939379143778e-05,,,,1,,,0.0011899202022568913,,PRUNED
524,524,31.25,2025-05-25 06:24:05.312281,2025-05-25 06:24:11.861687,0 days 00:00:06.549406,AdamW,0.4086544314098761,,,7.801182851071309e-05,,,,4,,,0.0009770779805726004,,PRUNED
525,525,45.833333333333336,2025-05-25 06:24:11.905862,2025-05-25 06:24:25.850073,0 days 00:00:13.944211,AdamW,0.3629048897117967,,,0.00020775815723559675,,,,6,,,0.0011008027480407683,,COMPLETE
526,526,47.916666666666664,2025-05-25 06:24:25.906042,2025-05-25 06:24:38.835228,0 days 00:00:12.929186,AdamW,0.12486266795913603,,,0.000260064096700662,,,,5,,,0.001219232529558927,,COMPLETE
527,527,33.333333333333336,2025-05-25 06:24:38.890940,2025-05-25 06:24:45.150233,0 days 00:00:06.259293,Adam,0.37908085648623135,,0.009820376746953529,,,,,3,,0.3978349003599288,,,PRUNED
528,528,33.333333333333336,2025-05-25 06:24:45.194599,2025-05-25 06:24:51.327645,0 days 00:00:06.133046,SGD,0.348901326818378,,,,0.0018445070003034942,44.63982246587466,False,28,,,,9.01355692088704,PRUNED
529,529,33.333333333333336,2025-05-25 06:24:51.366358,2025-05-25 06:24:56.384368,0 days 00:00:05.018010,AdamW,0.39735032200566506,,,0.00015572057620663612,,,,6,,,0.0008600187285921632,,PRUNED
530,530,31.25,2025-05-25 06:24:56.424540,2025-05-25 06:25:02.109696,0 days 00:00:05.685156,AdamW,0.36838703743837553,,,0.00012216358446159116,,,,4,,,0.0010920833308120982,,PRUNED
531,531,33.333333333333336,2025-05-25 06:25:02.141958,2025-05-25 06:25:07.871820,0 days 00:00:05.729862,AdamW,0.4130961799954817,,,4.480227475922787e-05,,,,7,,,0.002671649727729031,,PRUNED
532,532,37.5,2025-05-25 06:25:07.910113,2025-05-25 06:25:14.388199,0 days 00:00:06.478086,AdamW,0.38562809586287994,,,8.393816931346781e-05,,,,5,,,0.0013077803444151743,,PRUNED
533,533,33.333333333333336,2025-05-25 06:25:14.426182,2025-05-25 06:25:20.478876,0 days 00:00:06.052694,Adadelta,0.3569541375147006,0.29209261644323803,,,,,,3,0.056032407590014426,,,,PRUNED
534,534,33.333333333333336,2025-05-25 06:25:20.516609,2025-05-25 06:25:23.700948,0 days 00:00:03.184339,AdamW,0.40362110918773003,,,0.0002115262111728823,,,,2,,,0.0007955903178810814,,PRUNED
535,535,33.333333333333336,2025-05-25 06:25:23.728317,2025-05-25 06:25:26.556789,0 days 00:00:02.828472,AdamW,0.3763655627357002,,,0.000393786767589394,,,,6,,,0.0010210262493392202,,PRUNED
536,536,33.333333333333336,2025-05-25 06:25:26.586488,2025-05-25 06:25:30.284638,0 days 00:00:03.698150,AdamW,0.3917790024584837,,,6.12067235275146e-05,,,,4,,,0.002383409957301119,,PRUNED
537,537,37.5,2025-05-25 06:25:30.324459,2025-05-25 06:25:38.510049,0 days 00:00:08.185590,AdamW,0.1910513728054316,,,0.0001079083005952714,,,,5,,,0.0009282126827655446,,PRUNED
538,538,35.416666666666664,2025-05-25 06:25:38.548998,2025-05-25 06:25:45.160314,0 days 00:00:06.611316,AdamW,0.4187806769015962,,,0.0001597014350130546,,,,4,,,0.0014132023459148464,,PRUNED
539,539,31.25,2025-05-25 06:25:45.203146,2025-05-25 06:25:48.536680,0 days 00:00:03.333534,AdamW,0.3670209772996138,,,0.00013959974320980817,,,,1,,,0.008741176938438117,,PRUNED
540,540,37.5,2025-05-25 06:25:48.568139,2025-05-25 06:25:51.697473,0 days 00:00:03.129334,AdamW,0.3406865440442928,,,0.00025058725673468725,,,,7,,,0.00320674073409566,,PRUNED
541,541,29.166666666666668,2025-05-25 06:25:51.736255,2025-05-25 06:25:57.635401,0 days 00:00:05.899146,AdamW,0.3833362207510163,,,5.24751814621059e-05,,,,8,,,0.0011710548681080164,,PRUNED
542,542,33.333333333333336,2025-05-25 06:25:57.676982,2025-05-25 06:26:04.235319,0 days 00:00:06.558337,AdamW,0.39674214132234303,,,7.231559181066253e-05,,,,3,,,0.002120393006345489,,PRUNED
543,543,35.416666666666664,2025-05-25 06:26:04.273579,2025-05-25 06:26:10.057950,0 days 00:00:05.784371,AdamW,0.3330110927138512,,,0.0001764369394005501,,,,12,,,0.002902674432527115,,PRUNED
544,544,35.416666666666664,2025-05-25 06:26:10.100151,2025-05-25 06:26:13.622233,0 days 00:00:03.522082,AdamW,0.3592453529974911,,,9.314067306809149e-05,,,,6,,,0.0012531212756437182,,PRUNED
545,545,33.333333333333336,2025-05-25 06:26:13.653287,2025-05-25 06:26:18.581482,0 days 00:00:04.928195,AdamW,0.4050497579444872,,,0.0005557949995390707,,,,24,,,0.0014520741524938776,,PRUNED
546,546,45.833333333333336,2025-05-25 06:26:18.619627,2025-05-25 06:26:33.208483,0 days 00:00:14.588856,AdamW,0.3767756279570503,,,0.000127243667661436,,,,5,,,0.001590655727588627,,COMPLETE
547,547,33.333333333333336,2025-05-25 06:26:33.265431,2025-05-25 06:26:39.966933,0 days 00:00:06.701502,Adadelta,0.4377946059051868,7.872476794686766,,,,,,2,11.408503745934798,,,,PRUNED
548,548,25.0,2025-05-25 06:26:40.005820,2025-05-25 06:26:45.948372,0 days 00:00:05.942552,AdamW,0.4221184915098072,,,0.0002923506980545775,,,,15,,,0.0006700165906455184,,PRUNED
549,549,41.666666666666664,2025-05-25 06:26:45.986697,2025-05-25 06:26:55.744071,0 days 00:00:09.757374,AdamW,0.3523124180141237,,,3.955146789453656e-05,,,,5,,,0.0009965124842711021,,PRUNED
550,550,54.166666666666664,2025-05-25 06:26:55.783644,2025-05-25 06:27:10.509635,0 days 00:00:14.725991,AdamW,0.39337245168954543,,,0.00020169456976673963,,,,4,,,0.0011384722473594807,,COMPLETE
551,551,,2025-05-25 06:27:10.565065,2025-05-25 06:27:16.128482,0 days 00:00:05.563417,SGD,0.3709126785547806,,,,0.03453616307294355,76.80161902472305,False,7,,,,1.781677048372603,PRUNED
552,552,27.083333333333332,2025-05-25 06:27:16.171112,2025-05-25 06:27:22.315343,0 days 00:00:06.144231,AdamW,0.40680241553923535,,,6.721655519779596e-05,,,,3,,,0.001292679998995187,,PRUNED
553,553,37.5,2025-05-25 06:27:22.345972,2025-05-25 06:27:26.368867,0 days 00:00:04.022895,Adam,0.38529906064658254,,0.00045608256530440763,,,,,2,,0.028683284267636427,,,PRUNED
554,554,33.333333333333336,2025-05-25 06:27:26.413823,2025-05-25 06:27:32.628221,0 days 00:00:06.214398,AdamW,0.3622490894823024,,,0.00011091240075560084,,,,16,,,0.0022447970135403847,,PRUNED
555,555,31.25,2025-05-25 06:27:32.670091,2025-05-25 06:27:38.991611,0 days 00:00:06.321520,AdamW,0.37582780370992114,,,0.00015735379989143173,,,,6,,,0.0025436650147894263,,PRUNED
556,556,39.583333333333336,2025-05-25 06:27:39.034896,2025-05-25 06:27:53.954371,0 days 00:00:14.919475,AdamW,0.38909144211681584,,,8.918958205129314e-05,,,,4,,,0.0019746093735368343,,COMPLETE
557,557,47.916666666666664,2025-05-25 06:27:54.011206,2025-05-25 06:28:08.469450,0 days 00:00:14.458244,AdamW,0.4081717389433308,,,0.00035617352240435333,,,,5,,,0.0013653827251503153,,COMPLETE
558,558,43.75,2025-05-25 06:28:08.525218,2025-05-25 06:28:21.863330,0 days 00:00:13.338112,AdamW,0.41895053534873766,,,0.0002452820085398091,,,,3,,,0.0010683532856437827,,COMPLETE
559,559,33.333333333333336,2025-05-25 06:28:21.919259,2025-05-25 06:28:28.338947,0 days 00:00:06.419688,AdamW,0.2722290246094604,,,5.326459932207408e-05,,,,6,,,0.0009290846424450108,,PRUNED
560,560,33.333333333333336,2025-05-25 06:28:28.381924,2025-05-25 06:28:34.608710,0 days 00:00:06.226786,Adadelta,0.341587443847766,0.20318757289624945,,,,,,7,2.259971286503934,,,,PRUNED
561,561,45.833333333333336,2025-05-25 06:28:34.649553,2025-05-25 06:28:43.273208,0 days 00:00:08.623655,AdamW,0.3993934741616411,,,0.00018620334670217873,,,,1,,,0.0015591833358772696,,COMPLETE
562,562,39.583333333333336,2025-05-25 06:28:43.325318,2025-05-25 06:28:50.745498,0 days 00:00:07.420180,AdamW,0.3545341445469097,,,0.00012830534416730297,,,,5,,,0.0018066329007911082,,PRUNED
563,563,35.416666666666664,2025-05-25 06:28:50.789582,2025-05-25 06:28:57.426129,0 days 00:00:06.636547,AdamW,0.3685852332408902,,,7.619196734803294e-05,,,,4,,,0.002096967541915671,,PRUNED
564,564,45.833333333333336,2025-05-25 06:28:57.471025,2025-05-25 06:29:09.428112,0 days 00:00:11.957087,AdamW,0.38188231408940676,,,0.00010642507549520529,,,,2,,,0.0011949643507637585,,COMPLETE
565,565,47.916666666666664,2025-05-25 06:29:09.468022,2025-05-25 06:29:16.747056,0 days 00:00:07.279034,AdamW,0.4158064272493863,,,0.00020855641746197372,,,,3,,,0.0014227974248783848,,COMPLETE
566,566,33.333333333333336,2025-05-25 06:29:16.787025,2025-05-25 06:29:19.569011,0 days 00:00:02.781986,AdamW,0.38925022383780344,,,0.00014649835477769884,,,,8,,,0.0023946738171851142,,PRUNED
567,567,33.333333333333336,2025-05-25 06:29:19.598713,2025-05-25 06:29:22.668702,0 days 00:00:03.069989,AdamW,0.3975894007282671,,,6.115802370482165e-05,,,,4,,,0.001266925047772629,,PRUNED
568,568,33.333333333333336,2025-05-25 06:29:22.695956,2025-05-25 06:29:25.696777,0 days 00:00:03.000821,AdamW,0.43440554816381566,,,0.00017471114485269107,,,,5,,,0.0016485214543942158,,PRUNED
569,569,29.166666666666668,2025-05-25 06:29:25.739420,2025-05-25 06:29:28.841733,0 days 00:00:03.102313,AdamW,0.37342644462653773,,,0.00028057481483534873,,,,18,,,0.002740906841461736,,PRUNED
570,570,43.75,2025-05-25 06:29:28.870792,2025-05-25 06:29:33.527259,0 days 00:00:04.656467,AdamW,0.3583419847459539,,,8.438770908157363e-05,,,,1,,,0.001101700865122088,,PRUNED
571,571,33.333333333333336,2025-05-25 06:29:33.564549,2025-05-25 06:29:37.120817,0 days 00:00:03.556268,AdamW,0.4061759351929585,,,4.792681900298237e-05,,,,9,,,0.0010065968705700974,,PRUNED
572,572,33.333333333333336,2025-05-25 06:29:37.162344,2025-05-25 06:29:43.564458,0 days 00:00:06.402114,Adadelta,0.3652135286268859,67.74339559117706,,,,,,6,0.09369311026189334,,,,PRUNED
