,number,value,datetime_start,datetime_complete,duration,params_algorithm,params_dropout_rate,params_lr_Adadelta,params_lr_Adam,params_lr_AdamW,params_lr_SGD,params_momentum_SGD,params_nesterov_SGD,params_suggested_freeze,params_weight_decay_Adadelta,params_weight_decay_Adam,params_weight_decay_AdamW,params_weight_decay_SGD,state
0,0,35.416666666666664,2025-05-26 00:54:02.262515,2025-05-26 00:54:12.730063,0 days 00:00:10.467548,Adadelta,0.4753571532049581,0.017073967431528128,,,,,,11,29.154431891537552,,,,COMPLETE
1,1,25.0,2025-05-26 00:54:12.788106,2025-05-26 00:54:22.013581,0 days 00:00:09.225475,Adam,0.35403628889802274,,5.3370327626039544e-05,,,,,19,,0.05415244119402541,,,COMPLETE
2,2,35.416666666666664,2025-05-26 00:54:22.059794,2025-05-26 00:54:31.673100,0 days 00:00:09.613306,AdamW,0.2623782158161189,,,0.00014742753159914678,,,,9,,,0.0005404103854647331,,COMPLETE
3,3,43.75,2025-05-26 00:54:31.720486,2025-05-26 00:54:41.407756,0 days 00:00:09.687270,AdamW,0.3925879806965068,,,0.0026926469100861782,,,,14,,,0.00021930485556643703,,COMPLETE
4,4,33.333333333333336,2025-05-26 00:54:41.453380,2025-05-26 00:54:53.587062,0 days 00:00:12.133682,Adadelta,0.4744427686266666,5.456725485601478,,,,,,2,0.5762487216478605,,,,COMPLETE
5,5,41.666666666666664,2025-05-26 00:54:53.631349,2025-05-26 00:55:05.057722,0 days 00:00:11.426373,Adam,0.2475884550556351,,0.00017654048052495074,,,,,3,,1.2030178871154673,,,COMPLETE
6,6,33.333333333333336,2025-05-26 00:55:05.101871,2025-05-26 00:55:12.132220,0 days 00:00:07.030349,Adadelta,0.09242722776276352,2.463768595899747,,,,,,17,48.696409415209004,,,,PRUNED
7,7,33.333333333333336,2025-05-26 00:55:12.164119,2025-05-26 00:55:20.895124,0 days 00:00:08.731005,AdamW,0.0979914312095726,,,0.02065142557895925,,,,2,,,0.0005170191786366995,,PRUNED
8,8,33.333333333333336,2025-05-26 00:55:20.932180,2025-05-26 00:55:28.255349,0 days 00:00:07.323169,SGD,0.27134804157912423,,,,0.012273800987852962,0.5621564911890039,True,8,,,,0.06235377135673159,PRUNED
9,9,33.333333333333336,2025-05-26 00:55:28.290888,2025-05-26 00:55:35.870050,0 days 00:00:07.579162,SGD,0.38563517334297287,,,,0.0031130959561221226,6.365199445099503,False,23,,,,0.2106648601704221,PRUNED
10,10,54.166666666666664,2025-05-26 00:55:35.897696,2025-05-26 00:55:45.674395,0 days 00:00:09.776699,AdamW,0.0029985914779085965,,,0.00484256500515941,,,,30,,,0.00010753331646251153,,COMPLETE
11,11,43.75,2025-05-26 00:55:45.720893,2025-05-26 00:55:55.366027,0 days 00:00:09.645134,AdamW,0.007797399829228002,,,0.0032176187174456305,,,,29,,,0.00010173813558692418,,COMPLETE
12,12,45.833333333333336,2025-05-26 00:55:55.413373,2025-05-26 00:56:05.156666,0 days 00:00:09.743293,AdamW,0.1780456116674968,,,0.0017716419278767377,,,,31,,,0.00010817512739388823,,COMPLETE
13,13,50.0,2025-05-26 00:56:05.203276,2025-05-26 00:56:14.906102,0 days 00:00:09.702826,AdamW,0.10536019105413505,,,0.0003555582197048753,,,,31,,,0.006135141878939968,,COMPLETE
14,14,27.083333333333332,2025-05-26 00:56:14.953715,2025-05-26 00:56:19.451254,0 days 00:00:04.497539,AdamW,0.007536595527873308,,,2.215520063345732e-05,,,,26,,,0.009287363566332066,,PRUNED
15,15,37.5,2025-05-26 00:56:19.485988,2025-05-26 00:56:29.154897,0 days 00:00:09.668909,AdamW,0.09767194227160059,,,0.07408766950364654,,,,22,,,0.0037244194805508986,,PRUNED
16,16,29.166666666666668,2025-05-26 00:56:29.189143,2025-05-26 00:56:33.609538,0 days 00:00:04.420395,AdamW,0.15910720289473168,,,0.00022701605786719516,,,,27,,,0.0023793537960598537,,PRUNED
17,17,33.333333333333336,2025-05-26 00:56:33.644225,2025-05-26 00:56:39.263985,0 days 00:00:05.619760,SGD,0.05154906740445499,,,,1.533653919754068e-05,99.82036515505162,False,31,,,,96.3979853269096,PRUNED
18,18,33.333333333333336,2025-05-26 00:56:39.298887,2025-05-26 00:56:46.835347,0 days 00:00:07.536460,Adam,0.170071342737794,,0.07937580731016337,,,,,25,,95.53772735801623,,,PRUNED
19,19,39.583333333333336,2025-05-26 00:56:46.866856,2025-05-26 00:56:56.411256,0 days 00:00:09.544400,AdamW,0.05966378732022452,,,0.00022324006155543144,,,,21,,,0.0017179649282736966,,PRUNED
20,20,33.333333333333336,2025-05-26 00:56:56.446419,2025-05-26 00:57:04.028791,0 days 00:00:07.582372,AdamW,0.13483353959191263,,,0.013328032174910125,,,,28,,,0.009305565097180703,,PRUNED
21,21,39.583333333333336,2025-05-26 00:57:04.063743,2025-05-26 00:57:13.661340,0 days 00:00:09.597597,AdamW,0.1849177748720445,,,0.001132366126135909,,,,31,,,0.00018397722834079074,,PRUNED
22,22,33.333333333333336,2025-05-26 00:57:13.698680,2025-05-26 00:57:20.821098,0 days 00:00:07.122418,AdamW,0.20970939633015903,,,0.0009242990604441937,,,,31,,,0.00011342203836261639,,PRUNED
23,23,37.5,2025-05-26 00:57:20.853559,2025-05-26 00:57:30.514503,0 days 00:00:09.660944,AdamW,0.04737140944586174,,,0.005733664728067877,,,,24,,,0.0003044125687103646,,PRUNED
24,24,43.75,2025-05-26 00:57:30.548759,2025-05-26 00:57:40.164071,0 days 00:00:09.615312,AdamW,0.13203518323118493,,,0.0007012166762919817,,,,28,,,0.001151145709663477,,COMPLETE
25,25,33.333333333333336,2025-05-26 00:57:40.208693,2025-05-26 00:57:47.218728,0 days 00:00:07.010035,AdamW,0.2218907063060444,,,4.4355878616951626e-05,,,,29,,,0.004766474356702155,,PRUNED
26,26,33.333333333333336,2025-05-26 00:57:47.253829,2025-05-26 00:57:53.098726,0 days 00:00:05.844897,SGD,0.0045526417892945885,,,,2.4117831263229108e-05,68.27530940323874,True,26,,,,23.703006937863524,PRUNED
27,27,33.333333333333336,2025-05-26 00:57:53.133166,2025-05-26 00:58:00.212015,0 days 00:00:07.078849,Adadelta,0.3132587457626827,96.58318826868305,,,,,,20,0.010667799013471044,,,,PRUNED
28,28,41.666666666666664,2025-05-26 00:58:00.246963,2025-05-26 00:58:09.879244,0 days 00:00:09.632281,Adam,0.12809303936696573,,0.01176021255248222,,,,,31,,0.014236305881279616,,,PRUNED
29,29,29.166666666666668,2025-05-26 00:58:09.911146,2025-05-26 00:58:14.216976,0 days 00:00:04.305830,Adadelta,0.07760557345916955,0.0163326397242079,,,,,,12,0.010094931633979147,,,,PRUNED
30,30,39.583333333333336,2025-05-26 00:58:14.248527,2025-05-26 00:58:23.921056,0 days 00:00:09.672529,AdamW,0.031425974509242734,,,0.0006426353227014298,,,,18,,,0.0004622033892985007,,COMPLETE
31,31,43.75,2025-05-26 00:58:23.968358,2025-05-26 00:58:33.522729,0 days 00:00:09.554371,AdamW,0.4995585211686969,,,0.0025668830270957842,,,,15,,,0.00018323249985097812,,COMPLETE
32,32,31.25,2025-05-26 00:58:33.569112,2025-05-26 00:58:43.168067,0 days 00:00:09.598955,AdamW,0.41083964159057235,,,0.00907712075277462,,,,14,,,0.00020086214933449077,,COMPLETE
33,33,33.333333333333336,2025-05-26 00:58:43.212429,2025-05-26 00:58:52.850502,0 days 00:00:09.638073,AdamW,0.3173139921664575,,,0.002939158805465926,,,,7,,,0.00010206063958466357,,COMPLETE
34,34,35.416666666666664,2025-05-26 00:58:52.951285,2025-05-26 00:59:04.038200,0 days 00:00:11.086915,AdamW,0.43392474200945563,,,0.0021112988006352306,,,,5,,,0.00027128939961511354,,COMPLETE
35,35,35.416666666666664,2025-05-26 00:59:04.085286,2025-05-26 00:59:13.706735,0 days 00:00:09.621449,Adam,0.3064773045952088,,1.3189728028275134e-05,,,,,11,,89.03542421807131,,,COMPLETE
36,36,37.5,2025-05-26 00:59:13.754678,2025-05-26 00:59:23.449788,0 days 00:00:09.695110,AdamW,0.20283177870205737,,,0.0004174350304573245,,,,17,,,0.00015447902190799745,,COMPLETE
37,37,33.333333333333336,2025-05-26 00:59:23.496461,2025-05-26 00:59:33.016002,0 days 00:00:09.519541,Adadelta,0.3686387619219607,0.21514314769815227,,,,,,14,0.7057070426433971,,,,COMPLETE
38,38,45.833333333333336,2025-05-26 00:59:33.147969,2025-05-26 00:59:42.287098,0 days 00:00:09.139129,AdamW,0.26266732882401733,,,0.023880185319473227,,,,29,,,0.00033200403654094177,,COMPLETE
39,39,45.833333333333336,2025-05-26 00:59:42.334445,2025-05-26 00:59:52.011576,0 days 00:00:09.677131,AdamW,0.24872267436782364,,,0.0320345990465264,,,,30,,,0.0007548438970222365,,COMPLETE
40,40,37.5,2025-05-26 00:59:52.056975,2025-05-26 01:00:01.692068,0 days 00:00:09.635093,Adam,0.2289186897273786,,0.0020441986862453788,,,,,27,,1.790785115912206,,,COMPLETE
41,41,33.333333333333336,2025-05-26 01:00:01.739694,2025-05-26 01:00:08.002842,0 days 00:00:06.263148,AdamW,0.2723630677447243,,,0.07193703988981481,,,,29,,,0.0007853283364027855,,PRUNED
42,42,43.75,2025-05-26 01:00:08.035960,2025-05-26 01:00:17.671096,0 days 00:00:09.635136,AdamW,0.2540651176754697,,,0.03895155035197212,,,,30,,,0.000374243106783033,,COMPLETE
43,43,33.333333333333336,2025-05-26 01:00:17.719962,2025-05-26 01:00:24.333950,0 days 00:00:06.613988,AdamW,0.2765391007125897,,,0.026434290730630236,,,,25,,,0.0008493829969189974,,PRUNED
44,44,33.333333333333336,2025-05-26 01:00:24.365038,2025-05-26 01:00:30.489541,0 days 00:00:06.124503,AdamW,0.15402182144291138,,,0.008161442424911087,,,,29,,,0.0013177402363521778,,PRUNED
45,45,33.333333333333336,2025-05-26 01:00:30.521901,2025-05-26 01:00:36.516901,0 days 00:00:05.995000,SGD,0.24172881986048106,,,,0.07697336416909212,42.12679479091756,True,27,,,,3.7937328454645245,PRUNED
46,46,33.333333333333336,2025-05-26 01:00:36.548753,2025-05-26 01:00:45.740511,0 days 00:00:09.191758,AdamW,0.18597517165631391,,,0.016375326782283525,,,,23,,,0.0006630506658035209,,COMPLETE
47,47,33.333333333333336,2025-05-26 01:00:45.788446,2025-05-26 01:00:53.451639,0 days 00:00:07.663193,AdamW,0.3443772759136307,,,0.03782548179480943,,,,0,,,0.00014904124308609253,,PRUNED
48,48,33.333333333333336,2025-05-26 01:00:53.483784,2025-05-26 01:00:59.994439,0 days 00:00:06.510655,Adadelta,0.2833561248040042,57.40714720233024,,,,,,30,5.681901127173502,,,,PRUNED
49,49,29.166666666666668,2025-05-26 01:01:00.027073,2025-05-26 01:01:04.300533,0 days 00:00:04.273460,AdamW,0.1182399117147504,,,6.689763607050553e-05,,,,28,,,0.00035499352400343283,,PRUNED
50,50,33.333333333333336,2025-05-26 01:01:04.335776,2025-05-26 01:01:10.066679,0 days 00:00:05.730903,SGD,0.08123165487855848,,,,0.00019617051137421125,42.03591090791143,False,25,,,,0.012267280752973314,PRUNED
51,51,45.833333333333336,2025-05-26 01:01:10.101059,2025-05-26 01:01:19.812779,0 days 00:00:09.711720,AdamW,0.44711356089886267,,,0.0017479630069901736,,,,30,,,0.00023178919784525077,,COMPLETE
52,52,35.416666666666664,2025-05-26 01:01:19.860602,2025-05-26 01:01:29.384136,0 days 00:00:09.523534,AdamW,0.43359611272513376,,,0.005680411459322927,,,,30,,,0.00013573921232576164,,COMPLETE
53,53,43.75,2025-05-26 01:01:29.436077,2025-05-26 01:01:38.981749,0 days 00:00:09.545672,AdamW,0.027628218935361673,,,0.0012566977284270153,,,,30,,,0.00025828086707001746,,COMPLETE
54,54,31.25,2025-05-26 01:01:39.026735,2025-05-26 01:01:42.946833,0 days 00:00:03.920098,AdamW,0.18081455741499133,,,0.0003869129292867156,,,,28,,,0.0004591674716218379,,PRUNED
55,55,45.833333333333336,2025-05-26 01:01:42.982583,2025-05-26 01:01:52.730004,0 days 00:00:09.747421,AdamW,0.10787967660005415,,,0.0017598530686402472,,,,31,,,0.0002297816113810795,,COMPLETE
56,56,37.5,2025-05-26 01:01:52.775162,2025-05-26 01:02:02.278267,0 days 00:00:09.503105,AdamW,0.1489155109882067,,,0.004456561149965348,,,,26,,,0.00013293482698961955,,COMPLETE
57,57,35.416666666666664,2025-05-26 01:02:02.325285,2025-05-26 01:02:11.772940,0 days 00:00:09.447655,AdamW,0.3337474870411157,,,0.035164597663148785,,,,29,,,0.00010004789127956346,,COMPLETE
58,58,37.5,2025-05-26 01:02:11.820425,2025-05-26 01:02:21.422737,0 days 00:00:09.602312,AdamW,0.29046299293322,,,0.010137015649673802,,,,27,,,0.004062552752667947,,COMPLETE
59,59,41.666666666666664,2025-05-26 01:02:21.471997,2025-05-26 01:02:31.024930,0 days 00:00:09.552933,Adam,0.1980380634148407,,0.0005465025604147474,,,,,31,,9.395580343696476,,,COMPLETE
60,60,45.833333333333336,2025-05-26 01:02:31.072951,2025-05-26 01:02:40.648575,0 days 00:00:09.575624,AdamW,0.07475459658633962,,,0.08846865507396424,,,,23,,,0.006415669085515474,,COMPLETE
61,61,43.75,2025-05-26 01:02:40.702349,2025-05-26 01:02:49.892604,0 days 00:00:09.190255,AdamW,0.11130575027751848,,,0.0015445901747215957,,,,31,,,0.0022471680747167227,,COMPLETE
62,62,39.583333333333336,2025-05-26 01:02:49.940808,2025-05-26 01:02:59.518589,0 days 00:00:09.577781,AdamW,0.027722608941914972,,,0.0019238149762450321,,,,30,,,0.00022844880663125877,,PRUNED
63,63,31.25,2025-05-26 01:02:59.553849,2025-05-26 01:03:03.921516,0 days 00:00:04.367667,AdamW,0.10722466178625747,,,0.0003940944774866045,,,,28,,,0.0005966709347648439,,PRUNED
64,64,33.333333333333336,2025-05-26 01:03:03.958832,2025-05-26 01:03:10.427962,0 days 00:00:06.469130,AdamW,0.14316774843641253,,,0.0035052872181327677,,,,31,,,0.00017307415764516795,,PRUNED
65,65,33.333333333333336,2025-05-26 01:03:10.463993,2025-05-26 01:03:16.907897,0 days 00:00:06.443904,AdamW,0.1637139486121268,,,0.00014395016191475943,,,,29,,,0.0003670609238879284,,PRUNED
66,66,33.333333333333336,2025-05-26 01:03:16.941245,2025-05-26 01:03:22.494977,0 days 00:00:05.553732,SGD,0.06479399686056769,,,,0.0003720249973089088,97.25718749684798,True,26,,,,2.192479304143811,PRUNED
67,67,43.75,2025-05-26 01:03:22.534528,2025-05-26 01:03:32.146771,0 days 00:00:09.612243,AdamW,0.23209357896338412,,,0.0008613539044471708,,,,30,,,0.00012455977436830464,,COMPLETE
68,68,33.333333333333336,2025-05-26 01:03:32.193499,2025-05-26 01:03:38.401248,0 days 00:00:06.207749,Adadelta,0.09766964695805519,0.23171167184435645,,,,,,28,0.10932296104921217,,,,PRUNED
69,69,50.0,2025-05-26 01:03:38.434981,2025-05-26 01:03:47.979398,0 days 00:00:09.544417,AdamW,0.21513222779149205,,,0.02214045574183044,,,,31,,,0.00022894284181403606,,COMPLETE
70,70,45.833333333333336,2025-05-26 01:03:48.028689,2025-05-26 01:03:57.651703,0 days 00:00:09.623014,AdamW,0.21558222373070654,,,0.01378105090866064,,,,27,,,0.00028822113809011667,,COMPLETE
71,71,33.333333333333336,2025-05-26 01:03:57.700402,2025-05-26 01:04:03.884935,0 days 00:00:06.184533,AdamW,0.2534563716732422,,,0.022446942211334565,,,,31,,,0.0001933186837769167,,PRUNED
72,72,33.333333333333336,2025-05-26 01:04:03.919251,2025-05-26 01:04:10.367873,0 days 00:00:06.448622,AdamW,0.17290253095688685,,,0.06395948478617626,,,,29,,,0.0002294136441575871,,PRUNED
73,73,47.916666666666664,2025-05-26 01:04:10.401768,2025-05-26 01:04:19.946341,0 days 00:00:09.544573,AdamW,0.19063007954317185,,,0.0015068693432158098,,,,30,,,0.0004237641411244138,,COMPLETE
74,74,33.333333333333336,2025-05-26 01:04:19.992421,2025-05-26 01:04:26.237315,0 days 00:00:06.244894,AdamW,0.20498344881023553,,,0.00059419144478383,,,,30,,,0.0004413111537104968,,PRUNED
75,75,37.5,2025-05-26 01:04:26.270575,2025-05-26 01:04:35.827887,0 days 00:00:09.557312,AdamW,0.2387852590434002,,,0.0011661219605693719,,,,29,,,0.00031197751515645613,,PRUNED
76,76,33.333333333333336,2025-05-26 01:04:35.862156,2025-05-26 01:04:42.362054,0 days 00:00:06.499898,Adam,0.19363720027868353,,0.0877217128023127,,,,,26,,0.23342163929061552,,,PRUNED
77,77,33.333333333333336,2025-05-26 01:04:42.395814,2025-05-26 01:04:48.493058,0 days 00:00:06.097244,AdamW,0.2607036880170893,,,0.05398444844756194,,,,24,,,0.0014790748230181464,,PRUNED
78,78,33.333333333333336,2025-05-26 01:04:48.526788,2025-05-26 01:04:55.022917,0 days 00:00:06.496129,AdamW,0.21763762518317276,,,0.0040008389710447755,,,,30,,,0.0005443611841545007,,PRUNED
79,79,33.333333333333336,2025-05-26 01:04:55.056738,2025-05-26 01:05:01.134858,0 days 00:00:06.078120,AdamW,0.4861789377797534,,,0.007335141578635637,,,,28,,,0.0009768745344393309,,PRUNED
80,80,33.333333333333336,2025-05-26 01:05:01.171519,2025-05-26 01:05:07.649596,0 days 00:00:06.478077,Adadelta,0.04667974410126597,12.096072085336496,,,,,,27,5.624805940180709,,,,PRUNED
81,81,41.666666666666664,2025-05-26 01:05:07.684193,2025-05-26 01:05:16.808579,0 days 00:00:09.124386,AdamW,0.29362719963698436,,,0.00236907828161004,,,,31,,,0.00023600530676585275,,PRUNED
82,82,39.583333333333336,2025-05-26 01:05:16.841958,2025-05-26 01:05:26.424740,0 days 00:00:09.582782,AdamW,0.128067463346669,,,0.001767075030027879,,,,31,,,0.00016388165308082209,,PRUNED
83,83,41.666666666666664,2025-05-26 01:05:26.454925,2025-05-26 01:05:36.022484,0 days 00:00:09.567559,AdamW,0.17040923296061497,,,0.018323951687504468,,,,29,,,0.0003458725076994632,,PRUNED
84,84,35.416666666666664,2025-05-26 01:05:36.055776,2025-05-26 01:05:42.313733,0 days 00:00:06.257957,AdamW,0.3884370219527591,,,0.0013958995996111985,,,,30,,,0.0006852495145340374,,PRUNED
85,85,35.416666666666664,2025-05-26 01:05:42.347191,2025-05-26 01:05:48.895788,0 days 00:00:06.548597,AdamW,0.36902628124391135,,,0.00023775538247997977,,,,31,,,0.00019745804269775846,,PRUNED
86,86,33.333333333333336,2025-05-26 01:05:48.929044,2025-05-26 01:05:54.508851,0 days 00:00:05.579807,SGD,0.2243935639368535,,,,0.05559241577020569,67.59032255777169,False,28,,,,0.3735817338624294,PRUNED
87,87,41.666666666666664,2025-05-26 01:05:54.603272,2025-05-26 01:06:03.976775,0 days 00:00:09.373503,AdamW,0.4418513507125934,,,0.011211480045231412,,,,30,,,0.00012424988099271576,,PRUNED
88,88,25.0,2025-05-26 01:06:04.008873,2025-05-26 01:06:08.102792,0 days 00:00:04.093919,AdamW,0.08908363419357647,,,0.0008170222350367907,,,,29,,,0.00026429260808173125,,PRUNED
89,89,33.333333333333336,2025-05-26 01:06:08.132921,2025-05-26 01:06:14.307139,0 days 00:00:06.174218,AdamW,0.18925377847342947,,,0.0005399591369524943,,,,25,,,0.002584637691731158,,PRUNED
90,90,33.333333333333336,2025-05-26 01:06:14.339258,2025-05-26 01:06:20.555698,0 days 00:00:06.216440,Adam,0.010823880861459042,,0.005389932161730133,,,,,31,,8.397028086341924,,,PRUNED
91,91,33.333333333333336,2025-05-26 01:06:20.588334,2025-05-26 01:06:26.802591,0 days 00:00:06.214257,AdamW,0.06874557313303394,,,0.027697754778694548,,,,19,,,0.006341788717342238,,PRUNED
92,92,33.333333333333336,2025-05-26 01:06:26.835429,2025-05-26 01:06:33.060607,0 days 00:00:06.225178,AdamW,0.14013366692692902,,,0.04555752940645067,,,,29,,,0.006612129222215295,,PRUNED
93,93,33.333333333333336,2025-05-26 01:06:33.092546,2025-05-26 01:06:39.344084,0 days 00:00:06.251538,AdamW,0.04516896444317499,,,0.07711621243669099,,,,22,,,0.007890066742758184,,PRUNED
94,94,39.583333333333336,2025-05-26 01:06:39.375936,2025-05-26 01:06:48.544624,0 days 00:00:09.168688,AdamW,0.08322699865649565,,,0.002913966943043272,,,,27,,,0.005955612124357635,,COMPLETE
95,95,31.25,2025-05-26 01:06:48.592391,2025-05-26 01:06:52.716943,0 days 00:00:04.124552,AdamW,0.1116936330333719,,,0.09955434607514596,,,,30,,,0.00041618224708639976,,PRUNED
96,96,33.333333333333336,2025-05-26 01:06:52.750524,2025-05-26 01:06:58.951942,0 days 00:00:06.201418,AdamW,0.4602465648719203,,,0.0010193629706499471,,,,28,,,0.004771559036191913,,PRUNED
97,97,43.75,2025-05-26 01:06:58.984687,2025-05-26 01:07:08.385823,0 days 00:00:09.401136,AdamW,0.12351050602744433,,,0.005053794217671727,,,,31,,,0.0003137561578330679,,COMPLETE
98,98,47.916666666666664,2025-05-26 01:07:08.433320,2025-05-26 01:07:17.635210,0 days 00:00:09.201890,AdamW,0.0011265386931029386,,,0.02839159179157446,,,,16,,,0.00010875735178986944,,COMPLETE
99,99,39.583333333333336,2025-05-26 01:07:17.683794,2025-05-26 01:07:27.014156,0 days 00:00:09.330362,AdamW,0.01272542941940518,,,0.024157923287956264,,,,9,,,0.00011363739047835662,,PRUNED
100,100,,2025-05-26 01:07:27.049814,2025-05-26 01:07:31.345673,0 days 00:00:04.295859,SGD,0.03497011953787263,,,,0.0021280674608232593,23.05609891291297,False,4,,,,0.010968820383936151,PRUNED
101,101,33.333333333333336,2025-05-26 01:07:31.380743,2025-05-26 01:07:37.417857,0 days 00:00:06.037114,AdamW,0.02131097601349713,,,0.034609576875229545,,,,20,,,0.00014622248735107253,,PRUNED
102,102,43.75,2025-05-26 01:07:37.450929,2025-05-26 01:07:46.684187,0 days 00:00:09.233258,AdamW,0.4049499499358994,,,0.0021330053822152173,,,,12,,,0.00021166246763766787,,COMPLETE
103,103,45.833333333333336,2025-05-26 01:07:46.729058,2025-05-26 01:07:56.139035,0 days 00:00:09.409977,AdamW,0.0030503786145191546,,,0.015427990642076304,,,,30,,,0.00011211281150861198,,COMPLETE
104,104,50.0,2025-05-26 01:07:56.185580,2025-05-26 01:08:05.468474,0 days 00:00:09.282894,AdamW,0.0529847181018131,,,0.006744352340879071,,,,17,,,0.00016736994517987602,,COMPLETE
105,105,45.833333333333336,2025-05-26 01:08:05.517411,2025-05-26 01:08:14.826567,0 days 00:00:09.309156,AdamW,0.05589774328114977,,,0.029176350149168844,,,,16,,,0.00017398711508986885,,COMPLETE
106,106,33.333333333333336,2025-05-26 01:08:14.875671,2025-05-26 01:08:21.011420,0 days 00:00:06.135749,Adadelta,0.24330482196353664,0.3332214729792698,,,,,,15,0.13491204053805983,,,,PRUNED
107,107,33.333333333333336,2025-05-26 01:08:21.044618,2025-05-26 01:08:27.226604,0 days 00:00:06.181986,AdamW,0.036837189486065715,,,0.0063860003887119205,,,,17,,,0.00014457250606720047,,PRUNED
108,108,35.416666666666664,2025-05-26 01:08:27.259606,2025-05-26 01:08:33.426128,0 days 00:00:06.166522,AdamW,0.15824503243140087,,,0.001631888596212461,,,,16,,,0.0001135059768400325,,PRUNED
109,109,37.5,2025-05-26 01:08:33.458843,2025-05-26 01:08:39.637348,0 days 00:00:06.178505,AdamW,0.1800639381448968,,,0.002843648457806366,,,,29,,,0.00015439129973775077,,PRUNED
110,110,43.75,2025-05-26 01:08:39.670899,2025-05-26 01:08:49.041518,0 days 00:00:09.370619,AdamW,0.2067387320205911,,,0.0115566081909818,,,,13,,,0.0002645099750088882,,COMPLETE
111,111,33.333333333333336,2025-05-26 01:08:49.088905,2025-05-26 01:08:55.200687,0 days 00:00:06.111782,AdamW,0.06939500178235103,,,0.021969043862464826,,,,18,,,0.00012738339840410193,,PRUNED
112,112,35.416666666666664,2025-05-26 01:08:55.234370,2025-05-26 01:09:01.429251,0 days 00:00:06.194881,AdamW,0.0985384939814779,,,0.053435958194806156,,,,21,,,0.00010156867332680233,,PRUNED
