,number,value,datetime_start,datetime_complete,duration,params_algorithm,params_dropout_rate,params_lr_Adadelta,params_lr_Adam,params_lr_AdamW,params_lr_SGD,params_momentum_SGD,params_nesterov_SGD,params_suggested_freeze,params_weight_decay_Adadelta,params_weight_decay_Adam,params_weight_decay_AdamW,params_weight_decay_SGD,state
576,576,35.416666666666664,2025-05-26 02:26:12.381771,2025-05-26 02:26:19.017240,0 days 00:00:06.635469,Adam,0.11633602534635368,,4.7792671823376226e-05,,,,,0,,0.01323239048022989,,,PRUNED
577,577,33.333333333333336,2025-05-26 02:26:19.066829,2025-05-26 02:26:25.586428,0 days 00:00:06.519599,Adam,0.10555997713881657,,0.00043905910693557335,,,,,1,,0.0124100299899388,,,PRUNED
578,578,33.333333333333336,2025-05-26 02:26:25.632563,2025-05-26 02:26:32.241739,0 days 00:00:06.609176,Adam,0.12342551193211952,,5.9855042439945596e-05,,,,,1,,0.010984488555875246,,,PRUNED
579,579,33.333333333333336,2025-05-26 02:26:32.287741,2025-05-26 02:26:38.860435,0 days 00:00:06.572694,Adam,0.12996945194174617,,6.272546788930984e-05,,,,,0,,0.014862901711613,,,PRUNED
580,580,50.0,2025-05-26 02:26:38.906145,2025-05-26 02:26:53.884020,0 days 00:00:14.977875,Adam,0.11750433594723458,,0.00013859119720043776,,,,,1,,0.015108632122844976,,,COMPLETE
581,581,33.333333333333336,2025-05-26 02:26:53.941192,2025-05-26 02:27:00.529053,0 days 00:00:06.587861,Adam,0.47318997908850896,,0.001291912812981728,,,,,1,,0.01165501955914355,,,PRUNED
582,582,31.25,2025-05-26 02:27:00.575151,2025-05-26 02:27:07.143147,0 days 00:00:06.567996,Adam,0.12708315480378476,,7.64711379382713e-05,,,,,0,,0.2727418208385669,,,PRUNED
583,583,56.25,2025-05-26 02:27:07.189753,2025-05-26 02:27:22.123529,0 days 00:00:14.933776,Adam,0.14217820519032182,,0.000212482512093678,,,,,2,,0.01805563400603765,,,COMPLETE
584,584,52.083333333333336,2025-05-26 02:27:22.180698,2025-05-26 02:27:36.669280,0 days 00:00:14.488582,Adam,0.10263285344406234,,9.26013207244972e-05,,,,,5,,0.01971835152220314,,,COMPLETE
585,585,33.333333333333336,2025-05-26 02:27:36.728771,2025-05-26 02:27:43.232261,0 days 00:00:06.503490,Adam,0.13360669067910375,,0.00016494271202097447,,,,,1,,0.01385080423435897,,,PRUNED
586,586,35.416666666666664,2025-05-26 02:27:43.278360,2025-05-26 02:27:49.536863,0 days 00:00:06.258503,Adam,0.11596234026842252,,0.0001137942697466971,,,,,10,,0.028361474105333028,,,PRUNED
587,587,35.416666666666664,2025-05-26 02:27:49.580003,2025-05-26 02:27:56.054683,0 days 00:00:06.474680,Adam,0.14373260009196712,,5.267716402618087e-05,,,,,4,,0.459133911054281,,,PRUNED
588,588,33.333333333333336,2025-05-26 02:27:56.100835,2025-05-26 02:28:02.371993,0 days 00:00:06.271158,Adam,0.1280532792677408,,7.170242956079511e-05,,,,,7,,0.07342148743874764,,,PRUNED
589,589,60.416666666666664,2025-05-26 02:28:02.415365,2025-05-26 02:28:17.288570,0 days 00:00:14.873205,Adam,0.16267435157864846,,0.000141236339496131,,,,,2,,0.022442883530426932,,,COMPLETE
590,590,33.333333333333336,2025-05-26 02:28:17.346167,2025-05-26 02:28:23.928131,0 days 00:00:06.581964,Adam,0.13703092071036144,,0.0002708661959295104,,,,,3,,0.021828997172226524,,,PRUNED
591,591,58.333333333333336,2025-05-26 02:28:23.974491,2025-05-26 02:28:38.898068,0 days 00:00:14.923577,Adam,0.1528066489875405,,0.00018962323130729535,,,,,3,,0.016400450045349218,,,COMPLETE
592,592,33.333333333333336,2025-05-26 02:28:38.955891,2025-05-26 02:28:47.288524,0 days 00:00:08.332633,Adam,0.11166748983236702,,0.00014899341246523085,,,,,2,,85.90375488401182,,,PRUNED
593,593,33.333333333333336,2025-05-26 02:28:47.328845,2025-05-26 02:28:53.921618,0 days 00:00:06.592773,Adam,0.1768655722615217,,0.0001348700472323977,,,,,3,,0.050268715335443956,,,PRUNED
594,594,35.416666666666664,2025-05-26 02:28:53.970103,2025-05-26 02:29:00.617492,0 days 00:00:06.647389,Adam,0.09078088113879174,,0.0001736601916953388,,,,,2,,0.12375306736819085,,,PRUNED
595,595,33.333333333333336,2025-05-26 02:29:00.664076,2025-05-26 02:29:07.234738,0 days 00:00:06.570662,Adam,0.1265867109762965,,0.00011837856250668938,,,,,4,,0.02466499276621698,,,PRUNED
596,596,,2025-05-26 02:29:07.281215,2025-05-26 02:29:13.796922,0 days 00:00:06.515707,SGD,0.1611169380538662,,,,0.005201991463732514,13.25046039598007,True,3,,,,5.259765615509005,PRUNED
597,597,33.333333333333336,2025-05-26 02:29:13.840979,2025-05-26 02:29:20.465906,0 days 00:00:06.624927,Adam,0.14738651396912217,,0.00010347620066015883,,,,,2,,0.01890740976016547,,,PRUNED
598,598,35.416666666666664,2025-05-26 02:29:20.511991,2025-05-26 02:29:27.056998,0 days 00:00:06.545007,Adam,0.13790038431025553,,0.00014766454021595475,,,,,2,,0.032211105521590976,,,PRUNED
599,599,35.416666666666664,2025-05-26 02:29:27.105058,2025-05-26 02:29:33.688412,0 days 00:00:06.583354,Adam,0.12148635655577875,,0.0001312023381661664,,,,,4,,0.012595914303549874,,,PRUNED
600,600,33.333333333333336,2025-05-26 02:29:33.734093,2025-05-26 02:29:40.241233,0 days 00:00:06.507140,Adam,0.1558135007598636,,9.038524371194446e-05,,,,,3,,0.010069926262217555,,,PRUNED
601,601,33.333333333333336,2025-05-26 02:29:40.287789,2025-05-26 02:29:47.042962,0 days 00:00:06.755173,Adadelta,0.18256078549861088,0.6895063488417816,,,,,,1,0.23224386191398091,,,,PRUNED
602,602,43.75,2025-05-26 02:29:47.088614,2025-05-26 02:30:01.968379,0 days 00:00:14.879765,Adam,0.1429242956134484,,0.00022878645423256018,,,,,2,,0.0381297461583493,,,COMPLETE
603,603,33.333333333333336,2025-05-26 02:30:02.027249,2025-05-26 02:30:08.537267,0 days 00:00:06.510018,Adam,0.1650135932836748,,0.00011486691980071602,,,,,1,,0.026471382187649887,,,PRUNED
604,604,58.333333333333336,2025-05-26 02:30:08.584625,2025-05-26 02:30:23.552148,0 days 00:00:14.967523,Adam,0.13036484697283643,,0.0001683923997600819,,,,,0,,0.01591570764966163,,,COMPLETE
605,605,37.5,2025-05-26 02:30:23.610313,2025-05-26 02:30:31.852109,0 days 00:00:08.241796,Adam,0.09803775808140906,,0.0001012005255967414,,,,,2,,0.021071478907989234,,,PRUNED
606,606,33.333333333333336,2025-05-26 02:30:31.897409,2025-05-26 02:30:38.193716,0 days 00:00:06.296307,Adam,0.15003685721444857,,0.00013154567436980403,,,,,6,,0.029254415133766826,,,PRUNED
607,607,37.5,2025-05-26 02:30:38.237779,2025-05-26 02:30:48.164229,0 days 00:00:09.926450,Adam,0.10937179817823137,,8.275014635032587e-05,,,,,3,,0.018576359040046165,,,PRUNED
608,608,45.833333333333336,2025-05-26 02:30:48.210767,2025-05-26 02:31:02.695788,0 days 00:00:14.485021,Adam,0.1705038810551777,,0.00019851771170748298,,,,,5,,0.04379703189117773,,,COMPLETE
609,609,27.083333333333332,2025-05-26 02:31:02.754141,2025-05-26 02:31:12.566270,0 days 00:00:09.812129,Adam,0.1424440852503449,,4.000938144331603e-05,,,,,1,,6.450844581054884,,,PRUNED
610,610,27.083333333333332,2025-05-26 02:31:12.614269,2025-05-26 02:31:19.236906,0 days 00:00:06.622637,Adam,0.1338651383105067,,6.022766299810813e-05,,,,,2,,0.023649034536268185,,,PRUNED
611,611,33.333333333333336,2025-05-26 02:31:19.283617,2025-05-26 02:31:25.823229,0 days 00:00:06.539612,Adam,0.1569935625071744,,0.00015207885526571618,,,,,0,,0.014756556478549865,,,PRUNED
612,612,33.333333333333336,2025-05-26 02:31:25.870478,2025-05-26 02:31:32.456906,0 days 00:00:06.586428,Adam,0.11980484015012104,,0.0001164859177266151,,,,,4,,0.03501493068689246,,,PRUNED
613,613,41.666666666666664,2025-05-26 02:31:32.503328,2025-05-26 02:31:42.374269,0 days 00:00:09.870941,Adam,0.14725194140349857,,0.000680291613830762,,,,,3,,0.02131297669385583,,,PRUNED
614,614,29.166666666666668,2025-05-26 02:31:42.421670,2025-05-26 02:31:49.063508,0 days 00:00:06.641838,Adam,0.13526578775142528,,7.25078218439054e-05,,,,,1,,0.09477264424999576,,,PRUNED
615,615,60.416666666666664,2025-05-26 02:31:49.110362,2025-05-26 02:32:03.913030,0 days 00:00:14.802668,Adam,0.16250940727877566,,8.922936307040422e-05,,,,,3,,0.012436510676368204,,,COMPLETE
616,616,33.333333333333336,2025-05-26 02:32:03.972194,2025-05-26 02:32:10.484155,0 days 00:00:06.511961,Adam,0.12748471344569418,,0.00010682015080002353,,,,,1,,0.027390193245047805,,,PRUNED
617,617,33.333333333333336,2025-05-26 02:32:10.530761,2025-05-26 02:32:17.117315,0 days 00:00:06.586554,Adam,0.17422218257016894,,0.00013947133731003307,,,,,0,,0.016932801582685855,,,PRUNED
618,618,66.66666666666667,2025-05-26 02:32:17.164974,2025-05-26 02:32:32.087993,0 days 00:00:14.923019,Adam,0.15193912761690534,,0.0001689264251841385,,,,,2,,0.03265224795903603,,,COMPLETE
619,619,,2025-05-26 02:32:32.146157,2025-05-26 02:32:38.624245,0 days 00:00:06.478088,SGD,0.1413294985930495,,,,3.930981644685938e-05,30.773077682941867,False,2,,,,0.1620507989121587,PRUNED
620,620,33.333333333333336,2025-05-26 02:32:38.669291,2025-05-26 02:32:45.261497,0 days 00:00:06.592206,Adam,0.1117140104923584,,0.0002990537147599979,,,,,3,,0.057444955613663785,,,PRUNED
621,621,33.333333333333336,2025-05-26 02:32:45.308621,2025-05-26 02:32:51.909004,0 days 00:00:06.600383,Adadelta,0.12357772107977993,0.02319923143780824,,,,,,2,35.51246838092917,,,,PRUNED
622,622,33.333333333333336,2025-05-26 02:32:51.955717,2025-05-26 02:32:58.099796,0 days 00:00:06.144079,Adam,0.15131976067138028,,0.0002445240710573829,,,,,13,,0.04250291406615296,,,PRUNED
623,623,33.333333333333336,2025-05-26 02:32:58.143215,2025-05-26 02:33:04.723771,0 days 00:00:06.580556,Adam,0.13708397423411597,,7.006212549436442e-05,,,,,4,,0.03385387520016972,,,PRUNED
624,624,33.333333333333336,2025-05-26 02:33:04.769979,2025-05-26 02:33:11.306507,0 days 00:00:06.536528,Adam,0.14994126914381983,,0.001828775491420281,,,,,0,,0.03136324226212332,,,PRUNED
625,625,52.083333333333336,2025-05-26 02:33:11.353678,2025-05-26 02:33:26.351837,0 days 00:00:14.998159,Adam,0.13106736671716968,,0.00018853423730612803,,,,,1,,0.039796591435366124,,,COMPLETE
626,626,52.083333333333336,2025-05-26 02:33:26.409923,2025-05-26 02:33:41.308676,0 days 00:00:14.898753,Adam,0.13907981604583683,,8.756991961257412e-05,,,,,2,,0.027089101212981748,,,COMPLETE
627,627,33.333333333333336,2025-05-26 02:33:41.367428,2025-05-26 02:33:47.976124,0 days 00:00:06.608696,Adam,0.08201261039459885,,1.4954931633940186e-05,,,,,3,,0.05039346589350997,,,PRUNED
628,628,33.333333333333336,2025-05-26 02:33:48.022695,2025-05-26 02:33:54.659417,0 days 00:00:06.636722,Adam,0.11864446821019214,,0.00010351174884699194,,,,,1,,0.014168090838458772,,,PRUNED
629,629,31.25,2025-05-26 02:33:54.706626,2025-05-26 02:34:01.219642,0 days 00:00:06.513016,Adam,0.15157411421504452,,4.8926567014949044e-05,,,,,5,,0.03334092058848181,,,PRUNED
630,630,43.75,2025-05-26 02:34:01.267385,2025-05-26 02:34:16.146521,0 days 00:00:14.879136,Adam,0.27938064036060484,,0.00016668377828029225,,,,,2,,0.018447852103057646,,,COMPLETE
631,631,43.75,2025-05-26 02:34:16.205580,2025-05-26 02:34:31.392828,0 days 00:00:15.187248,Adam,0.1293629314511807,,0.00021637898178330196,,,,,0,,0.011379101469965574,,,COMPLETE
632,632,33.333333333333336,2025-05-26 02:34:31.450554,2025-05-26 02:34:38.040031,0 days 00:00:06.589477,Adam,0.14433984302273808,,0.00012050531210917684,,,,,1,,0.024719491977945623,,,PRUNED
633,633,37.5,2025-05-26 02:34:38.086446,2025-05-26 02:34:46.939963,0 days 00:00:08.853517,Adam,0.1578229428423063,,5.9555210540141536e-05,,,,,22,,0.02953242319965739,,,PRUNED
634,634,35.416666666666664,2025-05-26 02:34:46.983636,2025-05-26 02:34:53.600660,0 days 00:00:06.617024,Adam,0.11120688772855054,,8.037595963378257e-05,,,,,3,,0.016121519437017135,,,PRUNED
635,635,33.333333333333336,2025-05-26 02:34:53.646437,2025-05-26 02:35:00.193910,0 days 00:00:06.547473,Adam,0.09941928018422107,,0.00010179400173431077,,,,,4,,0.03845924886402562,,,PRUNED
636,636,37.5,2025-05-26 02:35:00.241708,2025-05-26 02:35:06.819916,0 days 00:00:06.578208,Adam,0.14242262655792912,,0.00017758705560858072,,,,,2,,0.020816334285834636,,,PRUNED
637,637,33.333333333333336,2025-05-26 02:35:06.866725,2025-05-26 02:35:13.415478,0 days 00:00:06.548753,Adam,0.12360727765232132,,0.00012590735018256402,,,,,4,,0.02358511642621624,,,PRUNED
638,638,37.5,2025-05-26 02:35:13.461790,2025-05-26 02:35:20.106552,0 days 00:00:06.644762,Adam,0.16013119235821222,,9.29281620470768e-05,,,,,1,,0.028382106366962694,,,PRUNED
639,639,33.333333333333336,2025-05-26 02:35:20.153342,2025-05-26 02:35:26.325720,0 days 00:00:06.172378,Adam,0.13679185042535488,,7.019887744885135e-05,,,,,21,,0.01886893971067743,,,PRUNED
640,640,35.416666666666664,2025-05-26 02:35:26.369672,2025-05-26 02:35:36.295630,0 days 00:00:09.925958,Adam,0.14999438436493928,,0.0001499951055579869,,,,,3,,0.012801362035343686,,,PRUNED
641,641,33.333333333333336,2025-05-26 02:35:36.342056,2025-05-26 02:35:42.845507,0 days 00:00:06.503451,Adam,0.16895568215185405,,0.00011897906991664138,,,,,0,,0.015528503779020719,,,PRUNED
642,642,35.416666666666664,2025-05-26 02:35:42.892203,2025-05-26 02:35:49.553045,0 days 00:00:06.660842,Adam,0.13231869068193094,,8.373120262098133e-05,,,,,2,,0.03574294669654459,,,PRUNED
643,643,,2025-05-26 02:35:49.599109,2025-05-26 02:35:56.096441,0 days 00:00:06.497332,SGD,0.10619882542542033,,,,0.0947038202333977,6.1612604830452185,True,1,,,,2.1995937474506864,PRUNED
644,644,37.5,2025-05-26 02:35:56.136355,2025-05-26 02:36:02.713587,0 days 00:00:06.577232,Adam,0.11825683767978884,,0.00015341845245531315,,,,,2,,0.024362308336064255,,,PRUNED
645,645,33.333333333333336,2025-05-26 02:36:02.765020,2025-05-26 02:36:09.299934,0 days 00:00:06.534914,Adadelta,0.15531846807873972,50.73128547076815,,,,,,3,0.02043768283539826,,,,PRUNED
646,646,50.0,2025-05-26 02:36:09.345265,2025-05-26 02:36:24.305888,0 days 00:00:14.960623,Adam,0.14519638701656692,,9.873528142862823e-05,,,,,0,,0.018156634740673826,,,COMPLETE
647,647,35.416666666666664,2025-05-26 02:36:24.363733,2025-05-26 02:36:30.918258,0 days 00:00:06.554525,Adam,0.12729489190408655,,0.00012266656918031378,,,,,4,,0.046760789926008836,,,PRUNED
648,648,33.333333333333336,2025-05-26 02:36:30.969838,2025-05-26 02:36:37.554025,0 days 00:00:06.584187,Adam,0.1944741049839822,,6.177346944140913e-05,,,,,1,,0.010060070891744436,,,PRUNED
649,649,33.333333333333336,2025-05-26 02:36:37.599499,2025-05-26 02:36:44.135759,0 days 00:00:06.536260,Adam,0.1389109329073461,,0.00019987623160835452,,,,,2,,0.030302836053301824,,,PRUNED
650,650,62.5,2025-05-26 02:36:44.181794,2025-05-26 02:36:59.080042,0 days 00:00:14.898248,Adam,0.16949328216098072,,7.658182551053007e-05,,,,,3,,0.02129834481513878,,,COMPLETE
651,651,58.333333333333336,2025-05-26 02:36:59.137858,2025-05-26 02:37:14.001231,0 days 00:00:14.863373,Adam,0.18782269831072215,,4.337450829326855e-05,,,,,3,,0.013514475028266028,,,COMPLETE
652,652,33.333333333333336,2025-05-26 02:37:14.059740,2025-05-26 02:37:20.621245,0 days 00:00:06.561505,Adam,0.18188092941887035,,5.4481764642309176e-05,,,,,5,,0.019621729767592154,,,PRUNED
653,653,33.333333333333336,2025-05-26 02:37:20.666551,2025-05-26 02:37:27.221156,0 days 00:00:06.554605,Adam,0.1689473402276817,,7.07884819922122e-05,,,,,4,,0.016453113133157612,,,PRUNED
654,654,45.833333333333336,2025-05-26 02:37:27.267498,2025-05-26 02:37:37.188220,0 days 00:00:09.920722,Adam,0.17708305885534875,,8.224508209627095e-05,,,,,3,,0.02175253313983417,,,PRUNED
655,655,33.333333333333336,2025-05-26 02:37:37.235510,2025-05-26 02:37:43.756888,0 days 00:00:06.521378,Adam,0.16910601492834945,,6.71771958070235e-05,,,,,3,,0.06560703882516884,,,PRUNED
656,656,31.25,2025-05-26 02:37:43.805001,2025-05-26 02:37:50.443254,0 days 00:00:06.638253,Adam,0.15877928178974113,,5.141537638648173e-05,,,,,4,,0.014387768630028445,,,PRUNED
657,657,33.333333333333336,2025-05-26 02:37:50.489085,2025-05-26 02:37:57.049675,0 days 00:00:06.560590,Adam,0.16731386228935305,,9.241109824848062e-05,,,,,3,,0.02764332039231933,,,PRUNED
658,658,35.416666666666664,2025-05-26 02:37:57.096188,2025-05-26 02:38:03.691030,0 days 00:00:06.594842,Adam,0.1846811016718975,,2.8318337787870106e-05,,,,,2,,0.03740763547773404,,,PRUNED
659,659,31.25,2025-05-26 02:38:03.736893,2025-05-26 02:38:10.303562,0 days 00:00:06.566669,Adam,0.1582939161647284,,7.625450752544457e-05,,,,,3,,0.019003234352136515,,,PRUNED
660,660,37.5,2025-05-26 02:38:10.349758,2025-05-26 02:38:16.916134,0 days 00:00:06.566376,Adam,0.20586272664177646,,0.00011071875560424301,,,,,4,,0.011772795433240767,,,PRUNED
661,661,33.333333333333336,2025-05-26 02:38:16.962021,2025-05-26 02:38:23.593932,0 days 00:00:06.631911,Adam,0.1523373332768574,,6.355305537672106e-05,,,,,2,,0.02200892420528546,,,PRUNED
662,662,52.083333333333336,2025-05-26 02:38:23.641526,2025-05-26 02:38:38.691956,0 days 00:00:15.050430,Adam,0.17420449433133883,,9.579820804790496e-05,,,,,2,,0.03101350357628426,,,COMPLETE
663,663,35.416666666666664,2025-05-26 02:38:38.749913,2025-05-26 02:38:45.213680,0 days 00:00:06.463767,Adam,0.16326150090633476,,8.101291015296422e-05,,,,,5,,0.016249804742379192,,,PRUNED
664,664,50.0,2025-05-26 02:38:45.259665,2025-05-26 02:39:00.198231,0 days 00:00:14.938566,Adam,0.14831826953850893,,0.00010678122894654542,,,,,3,,0.026314739094082048,,,COMPLETE
665,665,52.083333333333336,2025-05-26 02:39:00.256613,2025-05-26 02:39:15.145620,0 days 00:00:14.889007,Adam,0.16199320634924222,,0.00016231978796648345,,,,,2,,0.05553297177215478,,,COMPLETE
666,666,,2025-05-26 02:39:15.203967,2025-05-26 02:39:21.117978,0 days 00:00:05.914011,SGD,0.17714473958807558,,,,0.0006336598349899336,78.5765986353349,False,4,,,,0.500903700149387,PRUNED
667,667,33.333333333333336,2025-05-26 02:39:21.163291,2025-05-26 02:39:27.718979,0 days 00:00:06.555688,Adam,0.1486015246437837,,0.00013850956478174097,,,,,3,,0.042491774802157385,,,PRUNED
668,668,33.333333333333336,2025-05-26 02:39:27.765518,2025-05-26 02:39:34.351389,0 days 00:00:06.585871,Adadelta,0.09453072331467888,3.3346569811155216,,,,,,2,1.632355525807804,,,,PRUNED
669,669,50.0,2025-05-26 02:39:34.396699,2025-05-26 02:39:49.360948,0 days 00:00:14.964249,Adam,0.3538363328295375,,0.000236877350715941,,,,,3,,0.02280628503360179,,,COMPLETE
670,670,33.333333333333336,2025-05-26 02:39:49.419828,2025-05-26 02:39:55.993501,0 days 00:00:06.573673,Adam,0.14236737621661805,,0.006036424616144816,,,,,2,,0.013748491643296619,,,PRUNED
671,671,52.083333333333336,2025-05-26 02:39:56.039845,2025-05-26 02:40:10.957183,0 days 00:00:14.917338,Adam,0.15516459374006233,,7.575499424009453e-05,,,,,1,,0.03304747891781293,,,COMPLETE
672,672,33.333333333333336,2025-05-26 02:40:11.016130,2025-05-26 02:40:17.578700,0 days 00:00:06.562570,Adam,0.16467399571571548,,9.610337443597955e-05,,,,,4,,0.17427446261542248,,,PRUNED
673,673,45.833333333333336,2025-05-26 02:40:17.624756,2025-05-26 02:40:32.574122,0 days 00:00:14.949366,Adam,0.1443799773036114,,0.0003357521286512867,,,,,3,,0.019089794041044966,,,COMPLETE
674,674,33.333333333333336,2025-05-26 02:40:32.633269,2025-05-26 02:40:39.231564,0 days 00:00:06.598295,Adam,0.12239975865591378,,6.085633714208875e-05,,,,,1,,0.02463655857311299,,,PRUNED
675,675,37.5,2025-05-26 02:40:39.278086,2025-05-26 02:40:45.820888,0 days 00:00:06.542802,Adam,0.17354689028014783,,0.00011793226223079664,,,,,2,,0.016330134197145272,,,PRUNED
676,676,33.333333333333336,2025-05-26 02:40:45.867267,2025-05-26 02:40:52.512502,0 days 00:00:06.645235,Adam,0.19311364126008818,,0.028599871165548522,,,,,4,,0.01203374566494013,,,PRUNED
677,677,31.25,2025-05-26 02:40:52.558656,2025-05-26 02:40:59.087976,0 days 00:00:06.529320,Adam,0.13524105305657974,,0.00016605025146800863,,,,,3,,49.59401021895263,,,PRUNED
678,678,35.416666666666664,2025-05-26 02:40:59.133882,2025-05-26 02:41:05.721956,0 days 00:00:06.588074,Adam,0.15432809006209663,,8.970859461983283e-05,,,,,1,,0.020667475706571983,,,PRUNED
679,679,33.333333333333336,2025-05-26 02:41:05.768559,2025-05-26 02:41:12.317840,0 days 00:00:06.549281,Adam,0.4149727422173597,,0.0001308655741927132,,,,,2,,0.028502505136842143,,,PRUNED
680,680,45.833333333333336,2025-05-26 02:41:12.364092,2025-05-26 02:41:22.191392,0 days 00:00:09.827300,Adam,0.11063465383576768,,5.022653810686309e-05,,,,,5,,0.03746044515577633,,,PRUNED
681,681,35.416666666666664,2025-05-26 02:41:22.237448,2025-05-26 02:41:28.418003,0 days 00:00:06.180555,Adam,0.14209998588292258,,0.00018935448201879202,,,,,9,,0.015643527553656923,,,PRUNED
682,682,37.5,2025-05-26 02:41:28.461128,2025-05-26 02:41:35.075698,0 days 00:00:06.614570,Adam,0.12953080584714013,,0.00010982804978232857,,,,,2,,0.02519341005394389,,,PRUNED
683,683,33.333333333333336,2025-05-26 02:41:35.121751,2025-05-26 02:41:41.706647,0 days 00:00:06.584896,Adam,0.15802824013836503,,8.152898775543637e-05,,,,,1,,0.018311483989440557,,,PRUNED
684,684,33.333333333333336,2025-05-26 02:41:41.755108,2025-05-26 02:41:48.314417,0 days 00:00:06.559309,Adam,0.14686979656915508,,3.755786926729493e-05,,,,,3,,0.03163518232303072,,,PRUNED
685,685,33.333333333333336,2025-05-26 02:41:48.360739,2025-05-26 02:41:54.989736,0 days 00:00:06.628997,Adam,0.16787053475285604,,7.055652571971993e-05,,,,,2,,0.02281694096529311,,,PRUNED
686,686,33.333333333333336,2025-05-26 02:41:55.036340,2025-05-26 02:42:01.573828,0 days 00:00:06.537488,Adam,0.11821661077114096,,0.0001432207906603175,,,,,1,,0.013762638130653924,,,PRUNED
687,687,45.833333333333336,2025-05-26 02:42:01.620257,2025-05-26 02:42:16.503724,0 days 00:00:14.883467,Adam,0.18235000486906472,,0.00010073650913523013,,,,,3,,0.04583293505498288,,,PRUNED
688,688,35.416666666666664,2025-05-26 02:42:16.551116,2025-05-26 02:42:23.030547,0 days 00:00:06.479431,Adam,0.10271401305392838,,5.861275975967131e-05,,,,,6,,0.02029035617502699,,,PRUNED
689,689,62.5,2025-05-26 02:42:23.075608,2025-05-26 02:42:37.949318,0 days 00:00:14.873710,Adam,0.13674932191816205,,0.0001254327032088137,,,,,2,,0.028027082555742103,,,COMPLETE
690,690,,2025-05-26 02:42:38.007976,2025-05-26 02:42:43.818409,0 days 00:00:05.810433,SGD,0.15403524734045382,,,,0.011948883897843491,42.15561937806698,True,3,,,,0.07970639494318735,PRUNED
691,691,33.333333333333336,2025-05-26 02:42:43.863626,2025-05-26 02:42:50.504535,0 days 00:00:06.640909,Adam,0.1343652804388855,,0.00023009100308638749,,,,,4,,0.035351526453186656,,,PRUNED
