,number,value,datetime_start,datetime_complete,duration,params_algorithm,params_dropout_rate,params_lr_Adadelta,params_lr_Adam,params_lr_AdamW,params_lr_SGD,params_momentum_SGD,params_nesterov_SGD,params_suggested_freeze,params_weight_decay_Adadelta,params_weight_decay_Adam,params_weight_decay_AdamW,params_weight_decay_SGD,state
699,699,60.416666666666664,2025-05-24 18:53:25.607613,2025-05-24 18:53:40.818560,0 days 00:00:15.210947,Adam,0.451822196399021,,0.00013497363319899168,,,,,25,,0.03942854219320053,,,COMPLETE
700,700,47.916666666666664,2025-05-24 18:53:40.876859,2025-05-24 18:53:46.909317,0 days 00:00:06.032458,Adam,0.311369646740526,,9.791625174990916e-05,,,,,21,,0.022534616559423556,,,PRUNED
701,701,41.666666666666664,2025-05-24 18:53:46.947754,2025-05-24 18:53:54.199993,0 days 00:00:07.252239,Adam,0.46712422621555005,,0.00016107582674956665,,,,,23,,0.06700319612016763,,,PRUNED
702,702,35.416666666666664,2025-05-24 18:53:54.237859,2025-05-24 18:54:00.346400,0 days 00:00:06.108541,AdamW,0.47898742673739625,,,0.0013638789891737891,,,,24,,,0.0016077082905350119,,PRUNED
703,703,54.166666666666664,2025-05-24 18:54:00.376217,2025-05-24 18:54:13.350623,0 days 00:00:12.974406,Adam,0.4715422428176376,,1.1657830343679044e-05,,,,,20,,0.044607327910484766,,,PRUNED
704,704,39.583333333333336,2025-05-24 18:54:13.393800,2025-05-24 18:54:25.702916,0 days 00:00:12.309116,Adam,0.2781255196585165,,0.00011443533644380988,,,,,25,,0.034016801690679506,,,PRUNED
705,705,33.333333333333336,2025-05-24 18:54:25.744957,2025-05-24 18:54:37.973534,0 days 00:00:12.228577,SGD,0.4218051257182245,,,,0.001985475868097146,0.906746083914058,True,22,,,,15.427127922782491,PRUNED
706,706,35.416666666666664,2025-05-24 18:54:38.016588,2025-05-24 18:54:50.185272,0 days 00:00:12.168684,Adam,0.4423559872364023,,0.00018353300671051975,,,,,19,,0.02070717177851002,,,PRUNED
707,707,45.833333333333336,2025-05-24 18:54:50.228748,2025-05-24 18:55:02.433061,0 days 00:00:12.204313,Adam,0.2583048319137018,,8.488856465139295e-05,,,,,25,,0.05539950885212515,,,PRUNED
708,708,66.66666666666667,2025-05-24 18:55:02.478440,2025-05-24 18:55:20.483891,0 days 00:00:18.005451,Adam,0.30570671944107397,,5.6941404605926795e-05,,,,,24,,0.010078135185856136,,,COMPLETE
709,709,33.333333333333336,2025-05-24 18:55:20.807148,2025-05-24 18:55:33.035287,0 days 00:00:12.228139,Adadelta,0.30807825784646037,63.762606999416136,,,,,,23,0.628943902267283,,,,PRUNED
710,710,47.916666666666664,2025-05-24 18:55:33.077718,2025-05-24 18:55:45.261389,0 days 00:00:12.183671,Adam,0.3062772131187801,,9.944590326297312e-05,,,,,23,,0.011252657934440588,,,PRUNED
711,711,39.583333333333336,2025-05-24 18:55:45.303286,2025-05-24 18:55:57.531000,0 days 00:00:12.227714,Adam,0.3215431627983428,,7.382402615069878e-05,,,,,22,,0.010117334086738958,,,PRUNED
712,712,43.75,2025-05-24 18:55:57.573201,2025-05-24 18:56:09.743705,0 days 00:00:12.170504,Adam,0.2898189322523223,,6.029668759949263e-05,,,,,24,,0.01203008042499586,,,PRUNED
713,713,64.58333333333333,2025-05-24 18:56:09.787362,2025-05-24 18:56:27.876052,0 days 00:00:18.088690,Adam,0.3025961685927835,,4.0715991046935935e-05,,,,,22,,0.011719641917025434,,,COMPLETE
714,714,50.0,2025-05-24 18:56:27.938577,2025-05-24 18:56:40.026633,0 days 00:00:12.088056,Adam,0.2971189520721827,,2.9806398599304915e-05,,,,,22,,0.011800722838767845,,,PRUNED
715,715,33.333333333333336,2025-05-24 18:56:40.068021,2025-05-24 18:56:52.127147,0 days 00:00:12.059126,Adam,0.3004218903715617,,2.490605354336606e-05,,,,,16,,0.012093279506716122,,,PRUNED
716,716,50.0,2025-05-24 18:56:52.164635,2025-05-24 18:56:59.073192,0 days 00:00:06.908557,Adam,0.3001718051558549,,3.660151079250098e-05,,,,,23,,0.013873891541667228,,,PRUNED
717,717,43.75,2025-05-24 18:56:59.110603,2025-05-24 18:57:03.262073,0 days 00:00:04.151470,Adam,0.3120149351829567,,4.1251037803323e-05,,,,,22,,0.010339489166379653,,,PRUNED
718,718,33.333333333333336,2025-05-24 18:57:03.291150,2025-05-24 18:57:07.275323,0 days 00:00:03.984173,AdamW,0.2856078799231956,,,0.07229691302477848,,,,21,,,0.0011506471318217981,,PRUNED
719,719,33.333333333333336,2025-05-24 18:57:07.315781,2025-05-24 18:57:16.165009,0 days 00:00:08.849228,Adam,0.2923369643211758,,3.6079914297249386e-05,,,,,20,,0.013227028457828903,,,PRUNED
720,720,60.416666666666664,2025-05-24 18:57:16.207090,2025-05-24 18:57:26.758333,0 days 00:00:10.551243,Adam,0.3045242458007922,,4.809416309162113e-05,,,,,21,,0.010254775543953798,,,COMPLETE
721,721,35.416666666666664,2025-05-24 18:57:26.813209,2025-05-24 18:57:38.613367,0 days 00:00:11.800158,Adam,0.27757682973445674,,4.244269744729645e-05,,,,,22,,0.014179680482915213,,,PRUNED
722,722,37.5,2025-05-24 18:57:38.655356,2025-05-24 18:57:50.830514,0 days 00:00:12.175158,Adam,0.3219197499605495,,0.00013837490326338886,,,,,22,,0.01226758634018379,,,PRUNED
723,723,39.583333333333336,2025-05-24 18:57:50.874119,2025-05-24 18:58:03.174543,0 days 00:00:12.300424,Adam,0.3128659569650316,,3.201534907192397e-05,,,,,2,,0.010194811898860316,,,PRUNED
724,724,45.833333333333336,2025-05-24 18:58:03.217133,2025-05-24 18:58:15.425388,0 days 00:00:12.208255,Adam,0.328561243533064,,5.183284481451792e-05,,,,,21,,0.01481041500267223,,,PRUNED
725,725,33.333333333333336,2025-05-24 18:58:15.467601,2025-05-24 18:58:27.685527,0 days 00:00:12.217926,Adam,0.2924169684129729,,0.00012199227148623496,,,,,23,,0.010105211843877476,,,PRUNED
726,726,39.583333333333336,2025-05-24 18:58:27.730233,2025-05-24 18:58:39.910557,0 days 00:00:12.180324,Adam,0.3158214881394106,,8.74203298484241e-05,,,,,12,,0.015737468491664665,,,PRUNED
727,727,45.833333333333336,2025-05-24 18:58:39.953747,2025-05-24 18:58:52.296962,0 days 00:00:12.343215,Adam,0.10775381205615447,,5.3974465193289944e-05,,,,,20,,0.012786972406797308,,,PRUNED
728,728,37.5,2025-05-24 18:58:52.340545,2025-05-24 18:59:04.454592,0 days 00:00:12.114047,Adam,0.3081102114870924,,4.307377019274595e-05,,,,,18,,0.14566272904229643,,,PRUNED
729,729,45.833333333333336,2025-05-24 18:59:04.497368,2025-05-24 18:59:16.725623,0 days 00:00:12.228255,Adam,0.33688241639146327,,3.369141686398645e-05,,,,,10,,0.01189047030004792,,,PRUNED
730,730,,2025-05-24 18:59:16.769444,2025-05-24 18:59:28.346159,0 days 00:00:11.576715,SGD,0.31620766030639963,,,,3.8954432196381955e-05,16.17701965544724,True,22,,,,0.07777022918144874,PRUNED
731,731,39.583333333333336,2025-05-24 18:59:28.388552,2025-05-24 18:59:40.510970,0 days 00:00:12.122418,AdamW,0.29555683722315057,,,0.00014403053608957436,,,,21,,,0.00028501765352245874,,PRUNED
732,732,33.333333333333336,2025-05-24 18:59:40.555341,2025-05-24 18:59:52.757162,0 days 00:00:12.201821,Adam,0.2781931571216911,,0.0012501529266704622,,,,,30,,0.01606552609524861,,,PRUNED
733,733,43.75,2025-05-24 18:59:52.801468,2025-05-24 19:00:04.824393,0 days 00:00:12.022925,Adam,0.45542888065501885,,6.372204440392548e-05,,,,,19,,0.010043977911541666,,,PRUNED
734,734,31.25,2025-05-24 19:00:04.867791,2025-05-24 19:00:16.597953,0 days 00:00:11.730162,Adadelta,0.3032168991918017,0.023454089469249123,,,,,,23,39.01029748323306,,,,PRUNED
735,735,35.416666666666664,2025-05-24 19:00:16.639858,2025-05-24 19:00:24.201165,0 days 00:00:07.561307,Adam,0.33345180412609043,,2.254146672191597e-05,,,,,29,,0.012627481026702839,,,PRUNED
736,736,43.75,2025-05-24 19:00:24.230660,2025-05-24 19:00:28.467709,0 days 00:00:04.237049,Adam,0.3430473565795992,,0.00018294349721795978,,,,,27,,0.01631812468083599,,,PRUNED
737,737,39.583333333333336,2025-05-24 19:00:28.510667,2025-05-24 19:00:36.833154,0 days 00:00:08.322487,Adam,0.31525744707772113,,0.0001113547189769568,,,,,11,,0.01240186104844429,,,PRUNED
738,738,45.833333333333336,2025-05-24 19:00:36.870509,2025-05-24 19:00:44.410794,0 days 00:00:07.540285,Adam,0.128553812687169,,7.461450982538369e-05,,,,,22,,0.014431327574841,,,PRUNED
739,739,39.583333333333336,2025-05-24 19:00:44.449738,2025-05-24 19:00:49.370551,0 days 00:00:04.920813,Adam,0.27061820505450096,,9.71589740929062e-05,,,,,19,,0.011824406842647768,,,PRUNED
740,740,43.75,2025-05-24 19:00:49.402945,2025-05-24 19:00:54.293239,0 days 00:00:04.890294,Adam,0.3648151089872238,,4.832024854115116e-05,,,,,31,,0.017978169187584124,,,PRUNED
741,741,37.5,2025-05-24 19:00:54.334932,2025-05-24 19:01:06.507942,0 days 00:00:12.173010,Adam,0.32951346052885,,5.837024125629481e-05,,,,,21,,0.19987664148403053,,,PRUNED
742,742,54.166666666666664,2025-05-24 19:01:06.550842,2025-05-24 19:01:24.894233,0 days 00:00:18.343391,Adam,0.31220693456292636,,7.810480033357709e-05,,,,,20,,0.11976688221264588,,,COMPLETE
743,743,35.416666666666664,2025-05-24 19:01:24.968115,2025-05-24 19:01:37.241097,0 days 00:00:12.272982,Adam,0.28499005579643905,,3.991671136091739e-05,,,,,26,,0.01001316553991361,,,PRUNED
744,744,47.916666666666664,2025-05-24 19:01:37.283896,2025-05-24 19:01:49.540793,0 days 00:00:12.256897,Adam,0.32266445226112367,,9.657951030026198e-05,,,,,0,,0.014352034704795687,,,PRUNED
745,745,43.75,2025-05-24 19:01:49.585377,2025-05-24 19:02:01.847446,0 days 00:00:12.262069,Adam,0.29867717880519346,,6.579272243122261e-05,,,,,23,,0.01854086931948884,,,PRUNED
746,746,33.333333333333336,2025-05-24 19:02:01.890982,2025-05-24 19:02:14.064093,0 days 00:00:12.173111,AdamW,0.2530947684414273,,,0.0008126782514486703,,,,24,,,0.0008665971621030953,,PRUNED
747,747,47.916666666666664,2025-05-24 19:02:14.107412,2025-05-24 19:02:26.306414,0 days 00:00:12.199002,Adam,0.26486427369521204,,0.00012930278455974297,,,,,30,,0.011784435676396575,,,PRUNED
748,748,45.833333333333336,2025-05-24 19:02:26.348460,2025-05-24 19:02:38.588338,0 days 00:00:12.239878,Adam,0.2992300345943664,,5.361392013383248e-05,,,,,9,,0.09478126954085997,,,PRUNED
749,749,37.5,2025-05-24 19:02:38.632182,2025-05-24 19:02:50.931800,0 days 00:00:12.299618,Adam,0.15481363959521535,,2.8866805512741047e-05,,,,,27,,0.014836680358163924,,,PRUNED
750,750,45.833333333333336,2025-05-24 19:02:50.973533,2025-05-24 19:03:03.242985,0 days 00:00:12.269452,Adam,0.49176984133586427,,8.610498884033446e-05,,,,,17,,0.2336545298469955,,,PRUNED
751,751,43.75,2025-05-24 19:03:03.286487,2025-05-24 19:03:15.482267,0 days 00:00:12.195780,Adam,0.3082921234642726,,7.394981974133535e-05,,,,,29,,0.01235760109332189,,,PRUNED
752,752,66.66666666666667,2025-05-24 19:03:15.528494,2025-05-24 19:03:33.729032,0 days 00:00:18.200538,Adam,0.2857512629885925,,4.5776996337143536e-05,,,,,23,,0.07849675341836707,,,COMPLETE
753,753,33.333333333333336,2025-05-24 19:03:33.789232,2025-05-24 19:03:45.577553,0 days 00:00:11.788321,Adam,0.2546816040797689,,0.021580844643259482,,,,,23,,0.08200414436785577,,,PRUNED
754,754,41.666666666666664,2025-05-24 19:03:45.615332,2025-05-24 19:03:53.092374,0 days 00:00:07.477042,Adam,0.28884685096494767,,4.3430660608270475e-05,,,,,23,,0.1629340827294148,,,PRUNED
755,755,,2025-05-24 19:03:53.121828,2025-05-24 19:03:57.249039,0 days 00:00:04.127211,SGD,0.26413613426275895,,,,1.0789003885102441e-05,58.18416596141089,False,22,,,,0.018229535724558824,PRUNED
756,756,39.583333333333336,2025-05-24 19:03:57.291434,2025-05-24 19:04:07.049958,0 days 00:00:09.758524,Adam,0.2892661091959333,,3.435026048576933e-05,,,,,23,,0.08056504098972406,,,PRUNED
757,757,43.75,2025-05-24 19:04:07.087426,2025-05-24 19:04:12.773877,0 days 00:00:05.686451,Adam,0.27619109279531967,,0.00014850259840509835,,,,,24,,0.10694239788649983,,,PRUNED
758,758,47.916666666666664,2025-05-24 19:04:12.804118,2025-05-24 19:04:17.274059,0 days 00:00:04.469941,Adam,0.27603189549557344,,3.7679952670835004e-05,,,,,22,,0.1107160919191596,,,PRUNED
759,759,45.833333333333336,2025-05-24 19:04:17.316145,2025-05-24 19:04:29.515253,0 days 00:00:12.199108,AdamW,0.1487750015336228,,,0.0001098421724943919,,,,24,,,0.0021179057295140314,,PRUNED
760,760,39.583333333333336,2025-05-24 19:04:29.557327,2025-05-24 19:04:41.700221,0 days 00:00:12.142894,Adam,0.2788236729341913,,0.00010873784312056857,,,,,23,,0.14368497880498945,,,PRUNED
761,761,41.666666666666664,2025-05-24 19:04:41.743444,2025-05-24 19:04:53.956115,0 days 00:00:12.212671,Adadelta,0.16206467444794231,0.010541827301871021,,,,,,24,0.273397661750204,,,,PRUNED
762,762,33.333333333333336,2025-05-24 19:04:53.999988,2025-05-24 19:05:06.165714,0 days 00:00:12.165726,Adam,0.18105319746567247,,2.5451929918293276e-05,,,,,25,,0.1884196823616294,,,PRUNED
763,763,50.0,2025-05-24 19:05:06.210048,2025-05-24 19:05:18.351559,0 days 00:00:12.141511,Adam,0.2918146478236591,,4.793817213152926e-05,,,,,28,,0.04849293546921119,,,PRUNED
764,764,45.833333333333336,2025-05-24 19:05:18.396594,2025-05-24 19:05:30.644940,0 days 00:00:12.248346,Adam,0.2832855672747266,,5.9857470894119074e-05,,,,,13,,0.0915164263815109,,,PRUNED
765,765,33.333333333333336,2025-05-24 19:05:30.689030,2025-05-24 19:05:42.829067,0 days 00:00:12.140037,Adam,0.24430168092842164,,0.000793097128897029,,,,,23,,0.05335836971576293,,,PRUNED
766,766,47.916666666666664,2025-05-24 19:05:42.871634,2025-05-24 19:05:55.096676,0 days 00:00:12.225042,Adam,0.29797377897340876,,0.0002113510584983918,,,,,24,,0.043840662803862,,,PRUNED
767,767,29.166666666666668,2025-05-24 19:05:55.140692,2025-05-24 19:06:07.389080,0 days 00:00:12.248388,Adam,0.17626886459936253,,9.729454657322404e-05,,,,,26,,35.94717500200127,,,PRUNED
768,768,39.583333333333336,2025-05-24 19:06:07.432721,2025-05-24 19:06:19.642790,0 days 00:00:12.210069,Adam,0.22986499880345423,,0.00012471669079814368,,,,,14,,0.0631079388723954,,,PRUNED
769,769,43.75,2025-05-24 19:06:19.687443,2025-05-24 19:06:31.869794,0 days 00:00:12.182351,Adam,0.21802630204349813,,3.1821489380859064e-05,,,,,28,,0.15849675569304508,,,PRUNED
770,770,41.666666666666664,2025-05-24 19:06:31.913452,2025-05-24 19:06:44.111132,0 days 00:00:12.197680,Adam,0.2028060244994112,,6.685788736917877e-05,,,,,27,,0.10712770920887492,,,PRUNED
771,771,43.75,2025-05-24 19:06:44.156661,2025-05-24 19:06:56.449898,0 days 00:00:12.293237,Adam,0.18615328059275152,,5.037936581170845e-05,,,,,8,,0.07558556670940242,,,PRUNED
772,772,45.833333333333336,2025-05-24 19:06:56.493824,2025-05-24 19:07:08.564429,0 days 00:00:12.070605,AdamW,0.3030884311948063,,,1.9932111066373883e-05,,,,29,,,0.0004642750770737135,,PRUNED
773,773,52.083333333333336,2025-05-24 19:07:08.607805,2025-05-24 19:07:22.448376,0 days 00:00:13.840571,Adam,0.20699294089745365,,7.834337284855908e-05,,,,,30,,0.034259897850594384,,,PRUNED
774,774,62.5,2025-05-24 19:07:22.492317,2025-05-24 19:07:33.564341,0 days 00:00:11.072024,Adam,0.1682782348124022,,0.00017499842645869336,,,,,26,,0.1318231225237437,,,COMPLETE
775,775,45.833333333333336,2025-05-24 19:07:33.626071,2025-05-24 19:07:43.051476,0 days 00:00:09.425405,Adam,0.15027778635462707,,0.00016189094555355287,,,,,25,,0.05901765601757647,,,PRUNED
776,776,33.333333333333336,2025-05-24 19:07:43.083462,2025-05-24 19:07:46.947973,0 days 00:00:03.864511,Adam,0.1404176870327827,,0.00018312931527145621,,,,,23,,0.5084256190393474,,,PRUNED
777,777,33.333333333333336,2025-05-24 19:07:46.979584,2025-05-24 19:07:51.822609,0 days 00:00:04.843025,Adam,0.16520253189807743,,0.0001492930904143928,,,,,26,,0.8714086389239597,,,PRUNED
778,778,47.916666666666664,2025-05-24 19:07:51.866674,2025-05-24 19:08:04.180258,0 days 00:00:12.313584,Adam,0.16946755014199957,,0.0001277511878078317,,,,,25,,0.6418320208752629,,,PRUNED
779,779,33.333333333333336,2025-05-24 19:08:04.225387,2025-05-24 19:08:16.460558,0 days 00:00:12.235171,Adam,0.21963121553314466,,0.00015621227233957304,,,,,15,,0.04097881396262392,,,PRUNED
780,780,33.333333333333336,2025-05-24 19:08:16.504823,2025-05-24 19:08:28.791326,0 days 00:00:12.286503,Adam,0.25208966040240927,,0.00022918517864965203,,,,,24,,0.054379072513030376,,,PRUNED
781,781,45.833333333333336,2025-05-24 19:08:28.835748,2025-05-24 19:08:41.090558,0 days 00:00:12.254810,Adam,0.23774408438427813,,0.00011810744906411112,,,,,26,,0.12312731951620154,,,PRUNED
782,782,41.666666666666664,2025-05-24 19:08:41.135664,2025-05-24 19:08:53.438078,0 days 00:00:12.302414,Adam,0.40744850100399127,,0.00010594341320769045,,,,,22,,0.036722027332725386,,,PRUNED
783,783,33.333333333333336,2025-05-24 19:08:53.482966,2025-05-24 19:09:05.675016,0 days 00:00:12.192050,Adam,0.027225641865991412,,0.0001265474408457779,,,,,23,,0.02784008732716714,,,PRUNED
784,784,,2025-05-24 19:09:05.718342,2025-05-24 19:09:17.106032,0 days 00:00:11.387690,SGD,0.3788567041855069,,,,0.04575743442134015,30.04824132413861,True,25,,,,0.22970498890109867,PRUNED
785,785,60.416666666666664,2025-05-24 19:09:17.148739,2025-05-24 19:09:35.478565,0 days 00:00:18.329826,Adadelta,0.26629534685273043,0.1497292426268364,,,,,,24,0.012662376763341998,,,,COMPLETE
786,786,41.666666666666664,2025-05-24 19:09:35.539177,2025-05-24 19:09:47.768671,0 days 00:00:12.229494,Adam,0.16110974496023645,,9.571292377849591e-05,,,,,26,,0.01771097731801626,,,PRUNED
787,787,39.583333333333336,2025-05-24 19:09:47.811887,2025-05-24 19:10:00.092042,0 days 00:00:12.280155,AdamW,0.46315162383573527,,,0.0002688523401161521,,,,22,,,0.0012618819820043878,,PRUNED
788,788,60.416666666666664,2025-05-24 19:10:00.134686,2025-05-24 19:10:18.124130,0 days 00:00:17.989444,Adam,0.1727499480249204,,0.0001808047876068337,,,,,24,,0.0617892696579279,,,COMPLETE
789,789,33.333333333333336,2025-05-24 19:10:18.185919,2025-05-24 19:10:30.412631,0 days 00:00:12.226712,Adam,0.2831485615030306,,0.00010582554391464765,,,,,16,,0.07264881427271389,,,PRUNED
790,790,45.833333333333336,2025-05-24 19:10:30.456179,2025-05-24 19:10:42.634959,0 days 00:00:12.178780,Adam,0.4853500469300065,,8.795939501508651e-05,,,,,25,,0.046272986679053156,,,PRUNED
791,791,45.833333333333336,2025-05-24 19:10:42.677536,2025-05-24 19:10:51.810901,0 days 00:00:09.133365,Adam,0.19638746461493484,,0.00014604730350646853,,,,,9,,0.021597248726340782,,,PRUNED
792,792,50.0,2025-05-24 19:10:51.842849,2025-05-24 19:10:57.842268,0 days 00:00:05.999419,Adam,0.22959706455360313,,8.322517993015223e-05,,,,,29,,0.029700201612467895,,,PRUNED
793,793,45.833333333333336,2025-05-24 19:10:57.872512,2025-05-24 19:11:04.184039,0 days 00:00:06.311527,Adam,0.2964542566472959,,0.00013291846568074585,,,,,26,,0.014329461873221554,,,PRUNED
794,794,43.75,2025-05-24 19:11:04.226717,2025-05-24 19:11:14.809759,0 days 00:00:10.583042,Adam,0.21447722741989222,,0.00010821442309785253,,,,,27,,0.036574540856842475,,,PRUNED
795,795,43.75,2025-05-24 19:11:14.890020,2025-05-24 19:11:19.643360,0 days 00:00:04.753340,Adam,0.1846836376078825,,7.743694877454456e-05,,,,,29,,0.01190344195219063,,,PRUNED
796,796,35.416666666666664,2025-05-24 19:11:19.687742,2025-05-24 19:11:32.065840,0 days 00:00:12.378098,Adam,0.20189924669184314,,0.0005497373046666892,,,,,22,,0.5784924034916527,,,PRUNED
797,797,33.333333333333336,2025-05-24 19:11:32.109718,2025-05-24 19:11:44.430523,0 days 00:00:12.320805,Adam,0.24249272232287344,,0.00020320990042091276,,,,,10,,0.08579020840911192,,,PRUNED
798,798,47.916666666666664,2025-05-24 19:11:44.475082,2025-05-24 19:11:56.750199,0 days 00:00:12.275117,Adam,0.19088742462597716,,6.179071699714906e-05,,,,,23,,0.1352917988609428,,,PRUNED
799,799,47.916666666666664,2025-05-24 19:11:56.794660,2025-05-24 19:12:09.000949,0 days 00:00:12.206289,Adam,0.1736315389384602,,4.123396549529521e-05,,,,,25,,0.0182170738885454,,,PRUNED
800,800,33.333333333333336,2025-05-24 19:12:09.045237,2025-05-24 19:12:21.314523,0 days 00:00:12.269286,AdamW,0.2700065183498753,,,0.019574673554331356,,,,30,,,0.008501781240873578,,PRUNED
801,801,37.5,2025-05-24 19:12:21.358458,2025-05-24 19:12:33.668229,0 days 00:00:12.309771,Adam,0.22690142072338443,,9.463323721909218e-05,,,,,24,,0.016129613673408046,,,PRUNED
802,802,39.583333333333336,2025-05-24 19:12:33.713726,2025-05-24 19:12:45.905799,0 days 00:00:12.192073,Adam,0.2123229998558862,,0.0001738018392413324,,,,,28,,0.024129479086813274,,,PRUNED
803,803,39.583333333333336,2025-05-24 19:12:45.948905,2025-05-24 19:12:58.172043,0 days 00:00:12.223138,Adam,0.3058641200033248,,0.00011893263437472303,,,,,27,,0.010011448663065317,,,PRUNED
804,804,45.833333333333336,2025-05-24 19:12:58.216046,2025-05-24 19:13:10.451764,0 days 00:00:12.235718,Adam,0.1796223241739529,,7.257187832356956e-05,,,,,26,,0.04382188576035998,,,PRUNED
805,805,,2025-05-24 19:13:10.496112,2025-05-24 19:13:22.142450,0 days 00:00:11.646338,SGD,0.1581916969872811,,,,0.004713715697821649,41.90034091009948,False,31,,,,4.524282534590247,PRUNED
806,806,39.583333333333336,2025-05-24 19:13:22.186537,2025-05-24 19:13:34.380288,0 days 00:00:12.193751,Adam,0.19756807762749656,,5.244453114676543e-05,,,,,27,,0.02983541538736786,,,PRUNED
807,807,45.833333333333336,2025-05-24 19:13:34.426229,2025-05-24 19:13:46.673406,0 days 00:00:12.247177,Adam,0.20762955705190447,,9.260921226249303e-05,,,,,24,,0.013543811523725692,,,PRUNED
808,808,33.333333333333336,2025-05-24 19:13:46.719572,2025-05-24 19:13:58.862653,0 days 00:00:12.143081,Adadelta,0.1888392630455574,1.978958677065754,,,,,,25,0.1125379762625915,,,,PRUNED
809,809,39.583333333333336,2025-05-24 19:13:58.907580,2025-05-24 19:14:11.075643,0 days 00:00:12.168063,Adam,0.251392581331769,,0.00013961015733969935,,,,,28,,0.7786105017432342,,,PRUNED
810,810,47.916666666666664,2025-05-24 19:14:11.120797,2025-05-24 19:14:23.570212,0 days 00:00:12.449415,Adam,0.22198533984199176,,3.893420715484076e-05,,,,,23,,0.019951895178683208,,,PRUNED
811,811,43.75,2025-05-24 19:14:23.614185,2025-05-24 19:14:33.479316,0 days 00:00:09.865131,Adam,0.28812120662315865,,0.0003704829827045418,,,,,29,,0.01165296143792563,,,PRUNED
812,812,33.333333333333336,2025-05-24 19:14:33.522505,2025-05-24 19:14:45.581358,0 days 00:00:12.058853,Adam,0.17169010319105288,,6.463271819597613e-05,,,,,25,,0.06928088805046628,,,PRUNED
813,813,35.416666666666664,2025-05-24 19:14:45.625059,2025-05-24 19:14:54.578474,0 days 00:00:08.953415,Adam,0.3506031953481091,,3.264145236435784e-05,,,,,28,,0.09713919518546774,,,PRUNED
814,814,33.333333333333336,2025-05-24 19:14:54.615627,2025-05-24 19:15:05.504435,0 days 00:00:10.888808,AdamW,0.3215752126399597,,,0.0004575889784933258,,,,23,,,0.006762506662399813,,PRUNED
