,number,value,datetime_start,datetime_complete,duration,params_algorithm,params_dropout_rate,params_lr_Adadelta,params_lr_Adam,params_lr_AdamW,params_lr_SGD,params_momentum_SGD,params_nesterov_SGD,params_suggested_freeze,params_weight_decay_Adadelta,params_weight_decay_Adam,params_weight_decay_AdamW,params_weight_decay_SGD,state
0,0,37.5,2025-05-24 16:27:20.133735,2025-05-24 16:27:35.657141,0 days 00:00:15.523406,Adadelta,0.4753571532049581,0.017073967431528128,,,,,,11,29.154431891537552,,,,COMPLETE
1,1,58.333333333333336,2025-05-24 16:27:35.716882,2025-05-24 16:27:54.086880,0 days 00:00:18.369998,Adam,0.35403628889802274,,5.3370327626039544e-05,,,,,19,,0.05415244119402541,,,COMPLETE
2,2,52.083333333333336,2025-05-24 16:27:54.858361,2025-05-24 16:28:17.971664,0 days 00:00:23.113303,AdamW,0.2623782158161189,,,0.00014742753159914678,,,,9,,,0.0005404103854647331,,COMPLETE
3,3,33.333333333333336,2025-05-24 16:28:18.793941,2025-05-24 16:28:38.186512,0 days 00:00:19.392571,AdamW,0.3925879806965068,,,0.0026926469100861782,,,,14,,,0.00021930485556643703,,COMPLETE
4,4,33.333333333333336,2025-05-24 16:28:38.961164,2025-05-24 16:28:57.194251,0 days 00:00:18.233087,Adadelta,0.4744427686266666,5.456725485601478,,,,,,2,0.5762487216478605,,,,COMPLETE
5,5,37.5,2025-05-24 16:28:58.947980,2025-05-24 16:29:19.702598,0 days 00:00:20.754618,Adam,0.2475884550556351,,0.00017654048052495074,,,,,3,,1.2030178871154673,,,COMPLETE
6,6,33.333333333333336,2025-05-24 16:29:19.752249,2025-05-24 16:29:33.009523,0 days 00:00:13.257274,Adadelta,0.09242722776276352,2.463768595899747,,,,,,17,48.696409415209004,,,,PRUNED
7,7,33.333333333333336,2025-05-24 16:29:33.856825,2025-05-24 16:29:46.261533,0 days 00:00:12.404708,AdamW,0.0979914312095726,,,0.02065142557895925,,,,2,,,0.0005170191786366995,,PRUNED
8,8,33.333333333333336,2025-05-24 16:29:47.933005,2025-05-24 16:30:04.481130,0 days 00:00:16.548125,SGD,0.27134804157912423,,,,0.012273800987852962,0.5621564911890039,True,8,,,,0.06235377135673159,PRUNED
9,9,,2025-05-24 16:30:05.229466,2025-05-24 16:30:17.626637,0 days 00:00:12.397171,SGD,0.38563517334297287,,,,0.0031130959561221226,6.365199445099503,False,23,,,,0.2106648601704221,PRUNED
10,10,56.25,2025-05-24 16:30:17.660221,2025-05-24 16:30:36.295167,0 days 00:00:18.634946,Adam,0.0029985914779085965,,1.1799062523159256e-05,,,,,30,,0.011627478296224469,,,COMPLETE
11,11,50.0,2025-05-24 16:30:37.182952,2025-05-24 16:30:54.017896,0 days 00:00:16.834944,Adam,0.007797399829228002,,1.4092674202848303e-05,,,,,29,,0.010351345342149884,,,COMPLETE
12,12,50.0,2025-05-24 16:30:55.623319,2025-05-24 16:31:21.569184,0 days 00:00:25.945865,Adam,0.1780456116674968,,1.303899505677634e-05,,,,,31,,0.011705333802247565,,,COMPLETE
13,13,33.333333333333336,2025-05-24 16:31:21.625744,2025-05-24 16:31:36.539264,0 days 00:00:14.913520,Adam,0.34494521167484593,,0.03509224713892094,,,,,24,,0.07202554321357184,,,PRUNED
14,14,35.416666666666664,2025-05-24 16:31:36.620746,2025-05-24 16:31:47.308639,0 days 00:00:10.687893,Adam,0.006357269289235547,,0.00022102953841516675,,,,,21,,28.71704329664146,,,PRUNED
15,15,60.416666666666664,2025-05-24 16:31:48.908794,2025-05-24 16:32:05.816743,0 days 00:00:16.907949,Adam,0.1778133559297399,,5.625103603684528e-05,,,,,27,,0.15801715774258915,,,COMPLETE
16,16,41.666666666666664,2025-05-24 16:32:06.643993,2025-05-24 16:32:17.223587,0 days 00:00:10.579594,Adam,0.1851080041316471,,0.00027551193949285475,,,,,19,,0.37230480177438474,,,PRUNED
17,17,33.333333333333336,2025-05-24 16:32:17.257030,2025-05-24 16:32:27.885562,0 days 00:00:10.628532,Adam,0.3239477433104646,,0.0028549587020762083,,,,,26,,0.2773116308155133,,,PRUNED
18,18,,2025-05-24 16:32:27.918849,2025-05-24 16:32:34.847658,0 days 00:00:06.928809,SGD,0.1747154281887268,,,,3.908443370991221e-05,97.4924546650071,False,26,,,,25.319619734613873,PRUNED
19,19,54.166666666666664,2025-05-24 16:32:34.881924,2025-05-24 16:32:53.062695,0 days 00:00:18.180771,Adam,0.4057694026342346,,8.051995261493982e-05,,,,,14,,2.6308955801746947,,,COMPLETE
20,20,33.333333333333336,2025-05-24 16:32:53.112448,2025-05-24 16:33:06.224286,0 days 00:00:13.111838,Adam,0.11205911755332149,,0.0012645520144342998,,,,,19,,0.09442971127881689,,,PRUNED
21,21,50.0,2025-05-24 16:33:06.977102,2025-05-24 16:33:23.549106,0 days 00:00:16.572004,Adam,0.05066515165687685,,3.6524345437376747e-05,,,,,29,,0.0378610858850995,,,COMPLETE
22,22,56.25,2025-05-24 16:33:23.599282,2025-05-24 16:33:42.401444,0 days 00:00:18.802162,Adam,0.31837472033247816,,3.1131346646743656e-05,,,,,27,,0.03732730498711264,,,COMPLETE
23,23,56.25,2025-05-24 16:33:43.199958,2025-05-24 16:34:01.610448,0 days 00:00:18.410490,Adam,0.2197900237981126,,5.9928864983460224e-05,,,,,23,,0.2064621410320974,,,COMPLETE
24,24,35.416666666666664,2025-05-24 16:34:02.415873,2025-05-24 16:34:15.266999,0 days 00:00:12.851126,Adam,0.13203518323118493,,1.0037358116120055e-05,,,,,31,,0.029676745984187416,,,PRUNED
25,25,33.333333333333336,2025-05-24 16:34:16.168458,2025-05-24 16:34:29.750350,0 days 00:00:13.581892,Adam,0.05402646553412849,,0.0006451712292602032,,,,,28,,0.12405319719901486,,,PRUNED
26,26,31.25,2025-05-24 16:34:30.655615,2025-05-24 16:34:41.199437,0 days 00:00:10.543822,AdamW,0.43975039794403503,,,1.6462494656141686e-05,,,,24,,,0.00978075905358462,,PRUNED
27,27,,2025-05-24 16:34:41.233432,2025-05-24 16:34:50.982537,0 days 00:00:09.749105,SGD,0.3072491265495468,,,,1.8001158293361365e-05,68.54278835088991,True,21,,,,90.04727869618729,PRUNED
28,28,33.333333333333336,2025-05-24 16:34:51.015853,2025-05-24 16:34:59.562263,0 days 00:00:08.546410,Adadelta,0.3609555272514224,84.18841767904223,,,,,,31,0.014236305881279616,,,,PRUNED
29,29,33.333333333333336,2025-05-24 16:34:59.596122,2025-05-24 16:35:13.430316,0 days 00:00:13.834194,Adadelta,0.14066609175991898,0.0163326397242079,,,,,,12,0.010094931633979147,,,,PRUNED
30,30,31.25,2025-05-24 16:35:14.214188,2025-05-24 16:35:27.766476,0 days 00:00:13.552288,Adam,0.05373168408334303,,0.00010134990108102034,,,,,17,,0.6124842392044597,,,PRUNED
31,31,47.916666666666664,2025-05-24 16:35:27.800595,2025-05-24 16:35:49.051999,0 days 00:00:21.251404,Adam,0.30235607658858027,,2.849014023895212e-05,,,,,27,,0.030117618516002916,,,COMPLETE
32,32,54.166666666666664,2025-05-24 16:35:49.967081,2025-05-24 16:36:11.657209,0 days 00:00:21.690128,Adam,0.2165680753367213,,3.2085944540267664e-05,,,,,26,,0.030434217437068024,,,COMPLETE
33,33,52.083333333333336,2025-05-24 16:36:11.704640,2025-05-24 16:36:27.965532,0 days 00:00:16.260892,Adam,0.2734920242424279,,2.7463528082888617e-05,,,,,28,,0.010319490660873155,,,COMPLETE
34,34,33.333333333333336,2025-05-24 16:36:28.766139,2025-05-24 16:36:38.054432,0 days 00:00:09.288293,AdamW,0.43392474200945563,,,0.09946126450457445,,,,21,,,0.0045448386073854916,,PRUNED
35,35,41.666666666666664,2025-05-24 16:36:38.086171,2025-05-24 16:36:50.056032,0 days 00:00:11.969861,Adam,0.359781384542588,,6.331651968787996e-05,,,,,29,,0.05700920637608914,,,PRUNED
36,36,56.25,2025-05-24 16:36:50.845576,2025-05-24 16:37:06.612213,0 days 00:00:15.766637,Adam,0.4986801883039284,,2.1838171060410276e-05,,,,,7,,0.019727627933442904,,,COMPLETE
37,37,37.5,2025-05-24 16:37:07.106994,2025-05-24 16:37:16.430557,0 days 00:00:09.323563,Adadelta,0.3311104186632117,0.21514314769815227,,,,,,25,0.8609573721753037,,,,PRUNED
38,38,33.333333333333336,2025-05-24 16:37:16.462574,2025-05-24 16:37:30.660553,0 days 00:00:14.197979,AdamW,0.24977453972126268,,,0.0005516789129968933,,,,15,,,0.0021396821263543835,,PRUNED
39,39,33.333333333333336,2025-05-24 16:37:31.504754,2025-05-24 16:37:39.521350,0 days 00:00:08.016596,Adam,0.282111179374557,,0.008365047330010568,,,,,22,,0.12123449907534184,,,PRUNED
40,40,,2025-05-24 16:37:39.553911,2025-05-24 16:37:50.765821,0 days 00:00:11.211910,SGD,0.22442781099818837,,,,0.04553662854131712,36.28686457290567,True,18,,,,2.4943757639053636,PRUNED
41,41,50.0,2025-05-24 16:37:51.443361,2025-05-24 16:38:07.711782,0 days 00:00:16.268421,Adam,0.3056196990412929,,5.339277744590958e-05,,,,,23,,0.19865092766838002,,,COMPLETE
42,42,37.5,2025-05-24 16:38:07.759327,2025-05-24 16:38:14.209719,0 days 00:00:06.450392,Adam,0.21641733201675076,,0.0001366262093489908,,,,,25,,0.0607079800385049,,,PRUNED
43,43,37.5,2025-05-24 16:38:14.241059,2025-05-24 16:38:20.565268,0 days 00:00:06.324209,Adam,0.37448710202434154,,5.627410074857175e-05,,,,,30,,0.18346969513923767,,,PRUNED
44,44,35.416666666666664,2025-05-24 16:38:20.597533,2025-05-24 16:38:27.011386,0 days 00:00:06.413853,Adam,0.24453889416469882,,0.0004252795218144744,,,,,27,,1.3438558928848077,,,PRUNED
45,45,35.416666666666664,2025-05-24 16:38:27.042647,2025-05-24 16:38:33.638448,0 days 00:00:06.595801,Adam,0.40740578530559707,,1.8281442543519256e-05,,,,,23,,0.5611050160040346,,,PRUNED
46,46,37.5,2025-05-24 16:38:33.670828,2025-05-24 16:38:40.098791,0 days 00:00:06.427963,Adam,0.15614294039307972,,9.027556162660835e-05,,,,,20,,0.018958885558003843,,,PRUNED
47,47,33.333333333333336,2025-05-24 16:38:40.134575,2025-05-24 16:38:46.666215,0 days 00:00:06.531640,Adadelta,0.08206777385603724,98.43155468624178,,,,,,0,0.12410453331373307,,,,PRUNED
48,48,45.833333333333336,2025-05-24 16:38:46.700273,2025-05-24 16:38:54.070785,0 days 00:00:07.370512,AdamW,0.2901880957762785,,,1.6532915747157256e-05,,,,24,,,0.0001096724838697779,,PRUNED
49,49,37.5,2025-05-24 16:38:54.103038,2025-05-24 16:39:00.671532,0 days 00:00:06.568494,Adam,0.19373026966744397,,3.974566931725285e-05,,,,,17,,0.05075427102861869,,,PRUNED
50,50,,2025-05-24 16:39:00.704997,2025-05-24 16:39:06.559208,0 days 00:00:05.854211,SGD,0.030155740680654946,,,,0.00019617051137421125,47.540635735411044,False,28,,,,0.012267280752973314,PRUNED
51,51,37.5,2025-05-24 16:39:06.591807,2025-05-24 16:39:13.968112,0 days 00:00:07.376305,Adam,0.49003539439073296,,2.2947943579366435e-05,,,,,5,,0.015340999303352643,,,PRUNED
52,52,45.833333333333336,2025-05-24 16:39:14.000660,2025-05-24 16:39:32.403946,0 days 00:00:18.403286,Adam,0.4556523163571451,,1.700202340931696e-05,,,,,8,,0.022117061587793713,,,COMPLETE
53,53,33.333333333333336,2025-05-24 16:39:33.506035,2025-05-24 16:39:46.374531,0 days 00:00:12.868496,Adam,0.26174322667889954,,0.00016186760165568765,,,,,9,,0.019156454556584046,,,PRUNED
54,54,39.583333333333336,2025-05-24 16:39:47.073628,2025-05-24 16:39:59.688215,0 days 00:00:12.614587,Adam,0.20091060992700982,,1.0298841922781263e-05,,,,,30,,0.04772180831980235,,,PRUNED
55,55,39.583333333333336,2025-05-24 16:40:01.304032,2025-05-24 16:40:17.366494,0 days 00:00:16.062462,Adam,0.33676173777897966,,1.9145218951876263e-05,,,,,12,,0.13444623407770817,,,PRUNED
56,56,27.083333333333332,2025-05-24 16:40:19.016750,2025-05-24 16:40:33.002194,0 days 00:00:13.985444,Adam,0.16019716770505182,,4.624402180189483e-05,,,,,6,,0.011281222971506763,,,PRUNED
57,57,33.333333333333336,2025-05-24 16:40:33.900523,2025-05-24 16:40:45.927574,0 days 00:00:12.027051,Adam,0.40844237146326123,,0.08360603301436347,,,,,25,,0.08686418929766505,,,PRUNED
58,58,39.583333333333336,2025-05-24 16:40:47.036788,2025-05-24 16:41:00.201985,0 days 00:00:13.165197,Adam,0.12377540786208836,,1.4487661705798838e-05,,,,,22,,4.500166630234591,,,PRUNED
59,59,52.083333333333336,2025-05-24 16:41:01.141863,2025-05-24 16:41:17.588175,0 days 00:00:16.446312,Adam,0.47296920386026464,,0.0001047074721290902,,,,,27,,0.3060158131762764,,,COMPLETE
60,60,,2025-05-24 16:41:17.635420,2025-05-24 16:41:23.450490,0 days 00:00:05.815070,SGD,0.09848923114980704,,,,0.00036341024619856055,91.16455750012199,True,19,,,,3.177288097473464,PRUNED
61,61,39.583333333333336,2025-05-24 16:41:23.483490,2025-05-24 16:41:34.611364,0 days 00:00:11.127874,Adam,0.4085686360514559,,7.840681504008438e-05,,,,,13,,2.8255998051590256,,,PRUNED
62,62,33.333333333333336,2025-05-24 16:41:34.642370,2025-05-24 16:41:42.840619,0 days 00:00:08.198249,Adam,0.3562768430588038,,0.00026423625986252944,,,,,16,,7.200594725592219,,,PRUNED
63,63,39.583333333333336,2025-05-24 16:41:42.871767,2025-05-24 16:41:50.154870,0 days 00:00:07.283103,Adam,0.39476022690673507,,2.5737134697195717e-05,,,,,3,,1.194093695179066,,,PRUNED
64,64,33.333333333333336,2025-05-24 16:41:50.185833,2025-05-24 16:41:57.962878,0 days 00:00:07.777045,Adam,0.433453089445019,,4.721818519635003e-05,,,,,14,,18.61994350754371,,,PRUNED
65,65,33.333333333333336,2025-05-24 16:41:57.994035,2025-05-24 16:42:05.045659,0 days 00:00:07.051624,Adadelta,0.49737649638882764,0.184151355113088,,,,,,9,8.24020629459324,,,,PRUNED
66,66,37.5,2025-05-24 16:42:05.077250,2025-05-24 16:42:11.540711,0 days 00:00:06.463461,Adam,0.3190335184657892,,1.437388907791875e-05,,,,,30,,0.01764199403197035,,,PRUNED
67,67,33.333333333333336,2025-05-24 16:42:11.572903,2025-05-24 16:42:18.038895,0 days 00:00:06.465992,AdamW,0.37397369687732834,,,0.0020025150981560933,,,,10,,,0.0014639088684649893,,PRUNED
68,68,37.5,2025-05-24 16:42:18.070494,2025-05-24 16:42:24.617855,0 days 00:00:06.547361,Adam,0.4232001990520409,,0.0001395659649636101,,,,,6,,1.8695722917475275,,,PRUNED
69,69,37.5,2025-05-24 16:42:24.650588,2025-05-24 16:42:31.312215,0 days 00:00:06.661627,Adam,0.45502001879539067,,3.5822912272687165e-05,,,,,20,,0.03479697025942868,,,PRUNED
70,70,62.5,2025-05-24 16:42:31.343615,2025-05-24 16:42:42.304684,0 days 00:00:10.961069,Adam,0.34730557124251527,,7.274688726839535e-05,,,,,29,,0.5807207603073212,,,COMPLETE
71,71,58.333333333333336,2025-05-24 16:42:42.351282,2025-05-24 16:42:53.449727,0 days 00:00:11.098445,Adam,0.3409248663628026,,8.658847120424372e-05,,,,,28,,0.3571173835162434,,,COMPLETE
72,72,54.166666666666664,2025-05-24 16:42:53.497790,2025-05-24 16:43:12.412935,0 days 00:00:18.915145,Adam,0.23546392909136526,,6.907137397953346e-05,,,,,29,,0.6672229792665043,,,COMPLETE
73,73,33.333333333333336,2025-05-24 16:43:12.461946,2025-05-24 16:43:18.972388,0 days 00:00:06.510442,Adam,0.3449118215479567,,0.00020436889390660989,,,,,26,,0.21980304760004493,,,PRUNED
74,74,29.166666666666668,2025-05-24 16:43:19.004577,2025-05-24 16:43:25.450210,0 days 00:00:06.445633,Adam,0.26005916199615603,,2.5139094842699735e-05,,,,,28,,0.46785179895120804,,,PRUNED
75,75,50.0,2025-05-24 16:43:25.482465,2025-05-24 16:43:36.648484,0 days 00:00:11.166019,Adam,0.32522491642206236,,4.093124973736848e-05,,,,,31,,0.3593297688699374,,,COMPLETE
76,76,33.333333333333336,2025-05-24 16:43:36.696892,2025-05-24 16:43:43.107711,0 days 00:00:06.410819,Adam,0.2862973006813642,,9.692054101933408e-05,,,,,27,,0.08977724133987068,,,PRUNED
77,77,33.333333333333336,2025-05-24 16:43:43.140539,2025-05-24 16:43:49.564097,0 days 00:00:06.423558,Adam,0.3808081894354234,,0.0019966193821541692,,,,,29,,0.7031843242176335,,,PRUNED
78,78,33.333333333333336,2025-05-24 16:43:49.598797,2025-05-24 16:43:56.074453,0 days 00:00:06.475656,Adadelta,0.309874991996239,13.5689681377064,,,,,,24,6.3420025289775595,,,,PRUNED
79,79,,2025-05-24 16:43:56.107082,2025-05-24 16:44:02.089645,0 days 00:00:05.982563,SGD,0.3501821208365256,,,,0.07543707429298092,27.712418558374008,False,26,,,,0.3743271445833639,PRUNED
80,80,62.5,2025-05-24 16:44:02.124293,2025-05-24 16:44:13.019569,0 days 00:00:10.895276,AdamW,0.20558475585754796,,,0.00010898987308834993,,,,30,,,0.0035401130509912205,,COMPLETE
81,81,54.166666666666664,2025-05-24 16:44:13.068694,2025-05-24 16:44:23.997347,0 days 00:00:10.928653,AdamW,0.16945312095840226,,,0.00012679657859297213,,,,30,,,0.0036351277516955757,,COMPLETE
82,82,39.583333333333336,2025-05-24 16:44:24.046770,2025-05-24 16:44:32.465857,0 days 00:00:08.419087,AdamW,0.2059298462127881,,,0.00017777788358720655,,,,28,,,0.009036750256522206,,PRUNED
83,83,45.833333333333336,2025-05-24 16:44:32.497660,2025-05-24 16:44:40.422947,0 days 00:00:07.925287,AdamW,0.18647925554715564,,,4.2265148057132265e-05,,,,31,,,0.0008091078966681815,,PRUNED
84,84,33.333333333333336,2025-05-24 16:44:40.456164,2025-05-24 16:44:48.142429,0 days 00:00:07.686265,AdamW,0.23631424342298582,,,0.0073645274174562155,,,,27,,,0.0031589248923642927,,PRUNED
85,85,39.583333333333336,2025-05-24 16:44:48.174951,2025-05-24 16:44:54.621540,0 days 00:00:06.446589,Adam,0.07458156945236294,,1.040070059183705e-05,,,,,29,,0.1645483049369477,,,PRUNED
86,86,54.166666666666664,2025-05-24 16:44:54.654158,2025-05-24 16:45:05.745797,0 days 00:00:11.091639,AdamW,0.02061503866173703,,,0.0006137298769434754,,,,30,,,0.0012857942435621692,,COMPLETE
87,87,33.333333333333336,2025-05-24 16:45:05.795837,2025-05-24 16:45:12.177808,0 days 00:00:06.381971,Adam,0.27393381505091974,,0.0004237530308879304,,,,,22,,0.2804945103357771,,,PRUNED
88,88,56.25,2025-05-24 16:45:12.209178,2025-05-24 16:45:23.273622,0 days 00:00:11.064444,Adam,0.2115735118215922,,2.9049116592413363e-05,,,,,25,,0.025887815686212436,,,COMPLETE
89,89,41.666666666666664,2025-05-24 16:45:23.322667,2025-05-24 16:45:30.867991,0 days 00:00:07.545324,Adam,0.14942556071359656,,5.7426786385378e-05,,,,,28,,0.04270306198605521,,,PRUNED
90,90,33.333333333333336,2025-05-24 16:45:30.899620,2025-05-24 16:45:37.901538,0 days 00:00:07.001918,Adam,0.36347528949664853,,0.00837022464396943,,,,,26,,0.06595725052676937,,,PRUNED
91,91,41.666666666666664,2025-05-24 16:45:37.934290,2025-05-24 16:45:45.266584,0 days 00:00:07.332294,Adam,0.21974429757888855,,3.332163774243174e-05,,,,,25,,0.026184431643920987,,,PRUNED
92,92,37.5,2025-05-24 16:45:45.298105,2025-05-24 16:45:51.736841,0 days 00:00:06.438736,Adam,0.20761871485592756,,2.128115380762867e-05,,,,,28,,0.014699816070113664,,,PRUNED
93,93,62.5,2025-05-24 16:45:51.770677,2025-05-24 16:46:02.883975,0 days 00:00:11.113298,Adam,0.29623289763848465,,6.644409811129573e-05,,,,,23,,0.026317716169373426,,,COMPLETE
94,94,50.0,2025-05-24 16:46:02.930689,2025-05-24 16:46:13.789543,0 days 00:00:10.858854,Adam,0.29673480711795286,,0.00011383282423397384,,,,,29,,0.8914472504707251,,,COMPLETE
95,95,39.583333333333336,2025-05-24 16:46:13.836473,2025-05-24 16:46:20.250204,0 days 00:00:06.413731,Adam,0.3374130718812959,,6.9410712226009e-05,,,,,23,,0.43582920020511223,,,PRUNED
96,96,60.416666666666664,2025-05-24 16:46:20.282262,2025-05-24 16:46:33.725171,0 days 00:00:13.442909,Adam,0.3137279358519456,,5.440718742242263e-05,,,,,20,,0.012442368491691199,,,COMPLETE
97,97,54.166666666666664,2025-05-24 16:46:33.772561,2025-05-24 16:46:45.012675,0 days 00:00:11.240114,Adam,0.3278784616911973,,5.7343483902166326e-05,,,,,21,,0.013252811427042063,,,COMPLETE
98,98,,2025-05-24 16:46:45.060896,2025-05-24 16:46:50.870329,0 days 00:00:05.809433,SGD,0.3108533587612144,,,,0.0023630690523579684,67.69153705184817,False,18,,,,0.010030806503661342,PRUNED
99,99,33.333333333333336,2025-05-24 16:46:50.903378,2025-05-24 16:46:57.282255,0 days 00:00:06.378877,Adadelta,0.2758940058572871,0.38106994596996735,,,,,,30,0.04737436389652316,,,,PRUNED
100,100,68.75,2025-05-24 16:46:57.314916,2025-05-24 16:47:08.681838,0 days 00:00:11.366922,Adam,0.31688490901093114,,8.0321436372778e-05,,,,,18,,0.12889622838232076,,,COMPLETE
101,101,41.666666666666664,2025-05-24 16:47:08.729739,2025-05-24 16:47:18.184439,0 days 00:00:09.454700,Adam,0.3175724856071481,,0.00013626527192939965,,,,,18,,0.14535746936673308,,,PRUNED
102,102,39.583333333333336,2025-05-24 16:47:19.125162,2025-05-24 16:47:27.745007,0 days 00:00:08.619845,Adam,0.2965333029689818,,7.839927605961819e-05,,,,,20,,0.10554855823913234,,,PRUNED
103,103,47.916666666666664,2025-05-24 16:47:27.777534,2025-05-24 16:47:39.003174,0 days 00:00:11.225640,Adam,0.3646400321753917,,4.1821154479996894e-05,,,,,16,,0.21227953426828944,,,COMPLETE
104,104,31.25,2025-05-24 16:47:39.049986,2025-05-24 16:47:45.965725,0 days 00:00:06.915739,Adam,0.3452963765499867,,0.00018175012798198704,,,,,19,,0.010042891909241318,,,PRUNED
105,105,33.333333333333336,2025-05-24 16:47:46.001051,2025-05-24 16:47:52.581078,0 days 00:00:06.580027,Adam,0.2580953081754911,,9.587759744153081e-05,,,,,22,,0.03432667043448533,,,PRUNED
106,106,37.5,2025-05-24 16:47:52.613106,2025-05-24 16:47:59.343421,0 days 00:00:06.730315,Adam,0.3937404701974736,,5.2996905096827034e-05,,,,,20,,0.08372581058150105,,,PRUNED
107,107,37.5,2025-05-24 16:47:59.377883,2025-05-24 16:48:05.886144,0 days 00:00:06.508261,Adam,0.315456426204952,,7.248358955756834e-05,,,,,18,,94.24351478653367,,,PRUNED
108,108,37.5,2025-05-24 16:48:05.919054,2025-05-24 16:48:12.403534,0 days 00:00:06.484480,AdamW,0.3344554408031234,,,4.814436580149504e-05,,,,31,,,0.00535171833053829,,PRUNED
109,109,43.75,2025-05-24 16:48:12.437140,2025-05-24 16:48:18.937609,0 days 00:00:06.500469,Adam,0.2988293530920605,,3.4742751431748226e-05,,,,,17,,0.236184703066339,,,PRUNED
110,110,33.333333333333336,2025-05-24 16:48:18.970320,2025-05-24 16:48:25.469684,0 days 00:00:06.499364,Adam,0.37505894169828125,,0.00013265841599635234,,,,,24,,0.06452095238638159,,,PRUNED
111,111,37.5,2025-05-24 16:48:25.501429,2025-05-24 16:48:32.226558,0 days 00:00:06.725129,Adam,0.23917142841095665,,1.2506584933069986e-05,,,,,23,,0.021460255660932372,,,PRUNED
112,112,41.666666666666664,2025-05-24 16:48:32.257896,2025-05-24 16:48:38.736105,0 days 00:00:06.478209,Adam,0.2250299071972194,,1.9867280095247344e-05,,,,,21,,0.044945439289678195,,,PRUNED
113,113,37.5,2025-05-24 16:48:38.767846,2025-05-24 16:48:46.208231,0 days 00:00:07.440385,Adam,0.28750293377786795,,5.161534107214638e-05,,,,,27,,0.016698937038680677,,,PRUNED
114,114,41.666666666666664,2025-05-24 16:48:46.244989,2025-05-24 16:48:53.531661,0 days 00:00:07.286672,Adam,0.19186273343690144,,2.8418368657293943e-05,,,,,15,,0.025768373107206182,,,PRUNED
115,115,31.25,2025-05-24 16:48:53.564003,2025-05-24 16:49:00.410381,0 days 00:00:06.846378,Adam,0.1731465786287928,,1.770463923147448e-05,,,,,19,,0.12226556232420073,,,PRUNED
