,number,value,datetime_start,datetime_complete,duration,params_algorithm,params_dropout_rate,params_lr_Adadelta,params_lr_Adam,params_lr_AdamW,params_lr_SGD,params_momentum_SGD,params_nesterov_SGD,params_suggested_freeze,params_weight_decay_Adadelta,params_weight_decay_Adam,params_weight_decay_AdamW,params_weight_decay_SGD,state
799,799,37.5,2025-05-25 09:26:04.285817,2025-05-25 09:26:16.444962,0 days 00:00:12.159145,AdamW,0.12167480236679497,,,3.0811204753550046e-05,,,,27,,,0.0010920081500299461,,PRUNED
800,800,50.0,2025-05-25 09:26:16.490013,2025-05-25 09:26:28.637795,0 days 00:00:12.147782,AdamW,0.27300316503457284,,,4.771132377113198e-05,,,,26,,,0.0009815297505275408,,PRUNED
801,801,39.583333333333336,2025-05-25 09:26:28.680804,2025-05-25 09:26:40.769014,0 days 00:00:12.088210,AdamW,0.1552490039799616,,,0.0011903993141312186,,,,29,,,0.0007596734907817545,,PRUNED
802,802,45.833333333333336,2025-05-25 09:26:40.812757,2025-05-25 09:26:52.965779,0 days 00:00:12.153022,AdamW,0.17218613043027203,,,0.0001273563985537808,,,,28,,,0.00024074653034636555,,PRUNED
803,803,47.916666666666664,2025-05-25 09:26:53.008961,2025-05-25 09:27:05.062425,0 days 00:00:12.053464,AdamW,0.26366454323900423,,,0.00020347505370289142,,,,27,,,0.00011753544454421606,,PRUNED
804,804,41.666666666666664,2025-05-25 09:27:05.108235,2025-05-25 09:27:17.238701,0 days 00:00:12.130466,AdamW,0.14869400105336195,,,3.944316971084185e-05,,,,29,,,0.0008585599801729072,,PRUNED
805,805,62.5,2025-05-25 09:27:17.281437,2025-05-25 09:27:35.406974,0 days 00:00:18.125537,Adadelta,0.11246852711199068,0.1422118309671998,,,,,,28,0.011009185930140603,,,,COMPLETE
806,806,29.166666666666668,2025-05-25 09:27:35.466995,2025-05-25 09:27:47.633387,0 days 00:00:12.166392,Adadelta,0.11147840090137735,1.1686535536777236,,,,,,22,0.03223231349160656,,,,PRUNED
807,807,33.333333333333336,2025-05-25 09:27:47.676117,2025-05-25 09:27:59.866603,0 days 00:00:12.190486,Adadelta,0.09542400712033088,0.15447813700929894,,,,,,6,0.175725517202318,,,,PRUNED
808,808,33.333333333333336,2025-05-25 09:27:59.909539,2025-05-25 09:28:12.121951,0 days 00:00:12.212412,Adadelta,0.10134827326346871,0.024355164678590294,,,,,,27,0.08300819192267951,,,,PRUNED
809,809,47.916666666666664,2025-05-25 09:28:12.165115,2025-05-25 09:28:24.336150,0 days 00:00:12.171035,Adadelta,0.11206361284069924,0.2727516882170279,,,,,,27,0.05103919286634263,,,,PRUNED
810,810,50.0,2025-05-25 09:28:24.379511,2025-05-25 09:28:36.510591,0 days 00:00:12.131080,Adadelta,0.10919847411287605,0.043878529584350505,,,,,,26,0.01298861431152125,,,,PRUNED
811,811,33.333333333333336,2025-05-25 09:28:36.554859,2025-05-25 09:28:48.647858,0 days 00:00:12.092999,Adadelta,0.12604178858836793,0.7796364250397901,,,,,,28,0.010376101747425648,,,,PRUNED
812,812,56.25,2025-05-25 09:28:48.691378,2025-05-25 09:29:06.731756,0 days 00:00:18.040378,Adadelta,0.12270058965478034,0.11560310245452614,,,,,,28,0.025872476963260983,,,,COMPLETE
813,813,33.333333333333336,2025-05-25 09:29:06.793009,2025-05-25 09:29:19.110641,0 days 00:00:12.317632,Adadelta,0.10377039437038646,1.578519424926414,,,,,,17,0.5026645512623492,,,,PRUNED
814,814,33.333333333333336,2025-05-25 09:29:19.154510,2025-05-25 09:29:31.331196,0 days 00:00:12.176686,Adadelta,0.09227557043784262,3.551601067828491,,,,,,26,3.815104623520441,,,,PRUNED
815,815,35.416666666666664,2025-05-25 09:29:31.374173,2025-05-25 09:29:43.565493,0 days 00:00:12.191320,Adadelta,0.13394830692827464,0.29263307582594994,,,,,,27,0.12224800422405267,,,,PRUNED
816,816,33.333333333333336,2025-05-25 09:29:43.609674,2025-05-25 09:29:55.808717,0 days 00:00:12.199043,Adadelta,0.12385102731376407,0.17495332498913904,,,,,,3,0.7292947273189522,,,,PRUNED
817,817,,2025-05-25 09:29:55.852459,2025-05-25 09:30:07.393511,0 days 00:00:11.541052,SGD,0.14085489720624778,,,,9.682426749607249e-05,37.71790139747735,False,28,,,,4.514202102788987,PRUNED
818,818,35.416666666666664,2025-05-25 09:30:07.437472,2025-05-25 09:30:19.465239,0 days 00:00:12.027767,AdamW,0.11233194291165974,,,0.0003860931989161264,,,,28,,,0.00010220241930534756,,PRUNED
819,819,25.0,2025-05-25 09:30:19.507616,2025-05-25 09:30:26.549371,0 days 00:00:07.041755,Adadelta,0.11706928264608027,71.75006306599464,,,,,,27,0.05331958775433246,,,,PRUNED
820,820,50.0,2025-05-25 09:30:26.591768,2025-05-25 09:30:38.670153,0 days 00:00:12.078385,AdamW,0.13149240385818042,,,1.1519875916140549e-05,,,,16,,,0.001101247799048335,,PRUNED
821,821,33.333333333333336,2025-05-25 09:30:38.713209,2025-05-25 09:30:47.772900,0 days 00:00:09.059691,Adadelta,0.22543315415769377,0.7290885144291149,,,,,,27,0.2988212788245448,,,,PRUNED
822,822,35.416666666666664,2025-05-25 09:30:47.802226,2025-05-25 09:30:52.353214,0 days 00:00:04.550988,Adadelta,0.14404167334566184,0.019571542944325317,,,,,,28,6.396683155674953,,,,PRUNED
823,823,33.333333333333336,2025-05-25 09:30:52.384954,2025-05-25 09:30:57.437536,0 days 00:00:05.052582,Adadelta,0.09966364361026427,0.06564585470886543,,,,,,28,1.062204059751706,,,,PRUNED
824,824,43.75,2025-05-25 09:30:57.479930,2025-05-25 09:31:09.516277,0 days 00:00:12.036347,Adam,0.12015744446866171,,8.326834864282363e-05,,,,,26,,6.391990496550688,,,PRUNED
825,825,41.666666666666664,2025-05-25 09:31:09.559325,2025-05-25 09:31:21.863758,0 days 00:00:12.304433,AdamW,0.20347722509349353,,,0.00020342422879726326,,,,30,,,0.00014543409267112395,,PRUNED
826,826,56.25,2025-05-25 09:31:21.908570,2025-05-25 09:31:39.578185,0 days 00:00:17.669615,AdamW,0.16719117902421518,,,0.0002606427770489169,,,,29,,,0.00032972122840976495,,COMPLETE
827,827,47.916666666666664,2025-05-25 09:31:39.638640,2025-05-25 09:31:51.775813,0 days 00:00:12.137173,AdamW,0.1548724882449483,,,0.00014395503477551051,,,,27,,,0.003667986813501845,,PRUNED
828,828,41.666666666666664,2025-05-25 09:31:51.818699,2025-05-25 09:32:04.019532,0 days 00:00:12.200833,AdamW,0.13844295264472162,,,0.00011024669920433114,,,,28,,,0.00027181377704345376,,PRUNED
829,829,56.25,2025-05-25 09:32:04.063593,2025-05-25 09:32:21.971672,0 days 00:00:17.908079,AdamW,0.13275635412330128,,,0.00017135744758056445,,,,21,,,0.0009465084218515249,,COMPLETE
830,830,35.416666666666664,2025-05-25 09:32:22.031889,2025-05-25 09:32:34.131600,0 days 00:00:12.099711,Adadelta,0.1814718031149866,0.04594607159356708,,,,,,29,2.056966077800337,,,,PRUNED
831,831,41.666666666666664,2025-05-25 09:32:34.175219,2025-05-25 09:32:46.360245,0 days 00:00:12.185026,AdamW,0.0889234922239189,,,0.0005882778617820217,,,,19,,,0.0011412202944739314,,PRUNED
832,832,,2025-05-25 09:32:46.404789,2025-05-25 09:32:57.746106,0 days 00:00:11.341317,SGD,0.43454298271952246,,,,0.05238184905895049,18.51431850200443,False,26,,,,6.510212593450043,PRUNED
833,833,35.416666666666664,2025-05-25 09:32:57.788873,2025-05-25 09:33:09.924493,0 days 00:00:12.135620,AdamW,0.12457179056568733,,,1.0086710866767153e-05,,,,30,,,0.0010189324957157065,,PRUNED
834,834,33.333333333333336,2025-05-25 09:33:09.967739,2025-05-25 09:33:22.073461,0 days 00:00:12.105722,AdamW,0.15500254345781334,,,0.0003133961945389338,,,,27,,,0.0009094359179377375,,PRUNED
835,835,39.583333333333336,2025-05-25 09:33:22.117127,2025-05-25 09:33:34.239904,0 days 00:00:12.122777,AdamW,0.14409254020969023,,,0.0038402575198516298,,,,29,,,0.000805735131797273,,PRUNED
836,836,45.833333333333336,2025-05-25 09:33:34.283036,2025-05-25 09:33:46.328704,0 days 00:00:12.045668,AdamW,0.19350396456478625,,,0.00014307657586510176,,,,28,,,0.0011717811937569107,,PRUNED
837,837,50.0,2025-05-25 09:33:46.371157,2025-05-25 09:33:58.506574,0 days 00:00:12.135417,AdamW,0.41300732579657684,,,0.00010562623149411081,,,,27,,,0.0031175580696662657,,PRUNED
838,838,47.916666666666664,2025-05-25 09:33:58.550963,2025-05-25 09:34:10.754688,0 days 00:00:12.203725,AdamW,0.10383980452802716,,,0.00016659053113352078,,,,18,,,0.0009708178665942548,,PRUNED
839,839,47.916666666666664,2025-05-25 09:34:10.797491,2025-05-25 09:34:22.952279,0 days 00:00:12.154788,AdamW,0.3861529944403422,,,2.4749471560689127e-05,,,,29,,,0.00441752993760801,,PRUNED
840,840,31.25,2025-05-25 09:34:22.995354,2025-05-25 09:34:35.196226,0 days 00:00:12.200872,AdamW,0.16091600771153733,,,0.00023590688731499635,,,,10,,,0.00019150180786205073,,PRUNED
841,841,54.166666666666664,2025-05-25 09:34:35.239622,2025-05-25 09:34:47.342773,0 days 00:00:12.103151,AdamW,0.23690424564569146,,,0.00012138129965739166,,,,26,,,0.001607460143033332,,PRUNED
842,842,47.916666666666664,2025-05-25 09:34:47.386074,2025-05-25 09:34:59.665494,0 days 00:00:12.279420,AdamW,0.14953187657353859,,,1.806325351383137e-05,,,,0,,,0.0008563041567757837,,PRUNED
843,843,52.083333333333336,2025-05-25 09:34:59.710258,2025-05-25 09:35:11.792735,0 days 00:00:12.082477,AdamW,0.11597603054283975,,,9.468102357310992e-05,,,,27,,,0.0010038646253714893,,PRUNED
844,844,47.916666666666664,2025-05-25 09:35:11.836807,2025-05-25 09:35:23.985504,0 days 00:00:12.148697,Adam,0.0002823160326309017,,0.0001691322720069789,,,,,22,,0.24531957448874167,,,PRUNED
845,845,45.833333333333336,2025-05-25 09:35:24.029222,2025-05-25 09:35:36.100944,0 days 00:00:12.071722,AdamW,0.1302669644349035,,,0.00019576226396763436,,,,30,,,0.0010456548672963075,,PRUNED
846,846,39.583333333333336,2025-05-25 09:35:36.144329,2025-05-25 09:35:46.360336,0 days 00:00:10.216007,Adadelta,0.08413218183885415,0.4042043243443805,,,,,,28,0.18151304739374013,,,,PRUNED
847,847,45.833333333333336,2025-05-25 09:35:46.390024,2025-05-25 09:35:52.964872,0 days 00:00:06.574848,AdamW,0.14442840894676542,,,0.0001376207390966835,,,,27,,,0.004979463967378679,,PRUNED
848,848,33.333333333333336,2025-05-25 09:35:53.009559,2025-05-25 09:36:05.103622,0 days 00:00:12.094063,AdamW,0.4617843198403278,,,8.621653968875262e-05,,,,20,,,0.0009178203031528252,,PRUNED
849,849,33.333333333333336,2025-05-25 09:36:05.148517,2025-05-25 09:36:11.611722,0 days 00:00:06.463205,AdamW,0.16871361063132662,,,0.0002917325965062444,,,,13,,,0.000808119784002042,,PRUNED
850,850,45.833333333333336,2025-05-25 09:36:11.642083,2025-05-25 09:36:15.988867,0 days 00:00:04.346784,AdamW,0.008655703069358575,,,0.00010949566901573129,,,,28,,,0.001111466334715018,,PRUNED
851,851,41.666666666666664,2025-05-25 09:36:16.018633,2025-05-25 09:36:22.940686,0 days 00:00:06.922053,AdamW,0.13594330106073288,,,0.00015931612581791642,,,,29,,,0.0008946872683712132,,PRUNED
852,852,52.083333333333336,2025-05-25 09:36:22.984978,2025-05-25 09:36:35.091499,0 days 00:00:12.106521,AdamW,0.16076994417318635,,,6.366680128009853e-05,,,,28,,,0.0004462859119691021,,PRUNED
853,853,39.583333333333336,2025-05-25 09:36:35.134559,2025-05-25 09:36:47.201382,0 days 00:00:12.066823,AdamW,0.0004870977925411253,,,1.4530536616902724e-05,,,,26,,,0.0001271816119039002,,PRUNED
854,854,39.583333333333336,2025-05-25 09:36:47.245039,2025-05-25 09:36:59.545808,0 days 00:00:12.300769,AdamW,0.11777305109846728,,,0.00022792938468719825,,,,17,,,0.0012697827250979549,,PRUNED
855,855,54.166666666666664,2025-05-25 09:36:59.589674,2025-05-25 09:37:11.791657,0 days 00:00:12.201983,AdamW,0.10649494627071675,,,0.00012539475012952393,,,,30,,,0.0007411597365034518,,PRUNED
856,856,52.083333333333336,2025-05-25 09:37:11.834677,2025-05-25 09:37:23.961931,0 days 00:00:12.127254,AdamW,0.015240866763501908,,,7.761859635851806e-05,,,,29,,,0.00016805116756680668,,PRUNED
857,857,,2025-05-25 09:37:24.006409,2025-05-25 09:37:36.134934,0 days 00:00:12.128525,SGD,0.14969230736984684,,,,0.0003082890689343231,6.299576040673941,True,27,,,,0.010555803146702807,PRUNED
858,858,45.833333333333336,2025-05-25 09:37:36.177823,2025-05-25 09:37:48.305939,0 days 00:00:12.128116,AdamW,0.09226992645581811,,,2.9564271421428946e-05,,,,8,,,0.0018588428828838182,,PRUNED
859,859,45.833333333333336,2025-05-25 09:37:48.350248,2025-05-25 09:38:00.633621,0 days 00:00:12.283373,AdamW,0.13992571515460067,,,9.685585556560459e-05,,,,28,,,0.0008776451029828016,,PRUNED
860,860,29.166666666666668,2025-05-25 09:38:00.677435,2025-05-25 09:38:12.982267,0 days 00:00:12.304832,Adadelta,0.12431429937437039,14.807775991818223,,,,,,30,11.112751823863764,,,,PRUNED
861,861,45.833333333333336,2025-05-25 09:38:13.026128,2025-05-25 09:38:25.250229,0 days 00:00:12.224101,AdamW,0.018701401835298552,,,2.1747963608240784e-05,,,,28,,,0.00021367540927356944,,PRUNED
862,862,33.333333333333336,2025-05-25 09:38:25.294158,2025-05-25 09:38:37.346333,0 days 00:00:12.052175,AdamW,0.0001206048750286578,,,0.00019235369067431297,,,,26,,,0.0010072761549314846,,PRUNED
863,863,33.333333333333336,2025-05-25 09:38:37.389682,2025-05-25 09:38:49.560079,0 days 00:00:12.170397,AdamW,0.07927546259675486,,,0.08211347518505102,,,,29,,,0.00011316545908185722,,PRUNED
864,864,41.666666666666664,2025-05-25 09:38:49.604181,2025-05-25 09:39:01.725202,0 days 00:00:12.121021,AdamW,0.13337877597315478,,,0.00014826256805562348,,,,27,,,0.007006639458421501,,PRUNED
865,865,33.333333333333336,2025-05-25 09:39:01.768351,2025-05-25 09:39:13.883128,0 days 00:00:12.114777,AdamW,0.00816712273030217,,,0.0004472838881909596,,,,30,,,0.0007859769468856041,,PRUNED
866,866,43.75,2025-05-25 09:39:13.927274,2025-05-25 09:39:26.122659,0 days 00:00:12.195385,AdamW,0.1568294839928905,,,0.0001110195105370573,,,,29,,,0.0011527419025364918,,PRUNED
867,867,39.583333333333336,2025-05-25 09:39:26.174773,2025-05-25 09:39:38.289766,0 days 00:00:12.114993,AdamW,0.21671230936593736,,,8.434596107646248e-05,,,,15,,,0.0003847818963719572,,PRUNED
868,868,41.666666666666664,2025-05-25 09:39:38.334019,2025-05-25 09:39:50.525771,0 days 00:00:12.191752,AdamW,0.023717327187612172,,,6.319314958520095e-05,,,,28,,,0.0009454449799749166,,PRUNED
869,869,43.75,2025-05-25 09:39:50.569951,2025-05-25 09:40:02.771474,0 days 00:00:12.201523,AdamW,0.14922301387758274,,,0.00016344226675853163,,,,25,,,0.0008441794317646898,,PRUNED
870,870,45.833333333333336,2025-05-25 09:40:02.815027,2025-05-25 09:40:14.885337,0 days 00:00:12.070310,AdamW,0.49450928435744584,,,0.0003522556525740112,,,,27,,,0.0010742582467765855,,PRUNED
871,871,50.0,2025-05-25 09:40:14.929768,2025-05-25 09:40:27.091994,0 days 00:00:12.162226,AdamW,0.01146057187621726,,,0.0001268617658878132,,,,30,,,0.0006920874066362859,,PRUNED
872,872,33.333333333333336,2025-05-25 09:40:27.136012,2025-05-25 09:40:39.246458,0 days 00:00:12.110446,Adam,0.034907394363888136,,0.0013556899420171136,,,,,28,,21.225366707172547,,,PRUNED
873,873,33.333333333333336,2025-05-25 09:40:39.290501,2025-05-25 09:40:51.381351,0 days 00:00:12.090850,AdamW,0.16921326233581785,,,0.0007025798038296801,,,,29,,,0.00015104228917681202,,PRUNED
874,874,33.333333333333336,2025-05-25 09:40:51.426551,2025-05-25 09:41:03.652347,0 days 00:00:12.225796,Adadelta,0.11180573358752695,23.35319228639672,,,,,,27,0.01649839681904387,,,,PRUNED
875,875,43.75,2025-05-25 09:41:03.696187,2025-05-25 09:41:12.515637,0 days 00:00:08.819450,AdamW,0.2844852948163803,,,7.534344578154116e-05,,,,27,,,0.004060174877560022,,PRUNED
876,876,43.75,2025-05-25 09:41:12.558414,2025-05-25 09:41:24.675607,0 days 00:00:12.117193,AdamW,0.3512210153643641,,,0.00010068127891917319,,,,26,,,0.0033925161287896356,,PRUNED
877,877,33.333333333333336,2025-05-25 09:41:24.718722,2025-05-25 09:41:33.906238,0 days 00:00:09.187516,AdamW,0.1269847607645615,,,0.0002520794026185028,,,,28,,,0.0009534339121130833,,PRUNED
878,878,47.916666666666664,2025-05-25 09:41:33.935021,2025-05-25 09:41:38.351646,0 days 00:00:04.416625,AdamW,0.32458022394908037,,,5.785745362291e-05,,,,20,,,0.000807701685221105,,PRUNED
879,879,33.333333333333336,2025-05-25 09:41:38.387650,2025-05-25 09:41:49.721717,0 days 00:00:11.334067,AdamW,0.1395786004649734,,,0.001545889039359068,,,,30,,,0.0010170699728012625,,PRUNED
880,880,,2025-05-25 09:41:49.764722,2025-05-25 09:42:01.255144,0 days 00:00:11.490422,SGD,0.02240617697323504,,,,0.00752666412407366,74.07518209088018,True,29,,,,1.522778076317534,PRUNED
881,881,33.333333333333336,2025-05-25 09:42:01.297667,2025-05-25 09:42:13.390106,0 days 00:00:12.092439,AdamW,0.009210663484055193,,,0.00018190600311597817,,,,28,,,0.0014164466242813445,,PRUNED
882,882,33.333333333333336,2025-05-25 09:42:13.433389,2025-05-25 09:42:25.746620,0 days 00:00:12.313231,AdamW,0.0002465328503438678,,,0.0422693794661268,,,,5,,,0.0012367414648003694,,PRUNED
883,883,41.666666666666664,2025-05-25 09:42:25.791099,2025-05-25 09:42:37.866459,0 days 00:00:12.075360,AdamW,0.0386709306208647,,,4.243511773960804e-05,,,,26,,,0.0008757607992661564,,PRUNED
884,884,54.166666666666664,2025-05-25 09:42:37.910738,2025-05-25 09:42:56.029067,0 days 00:00:18.118329,AdamW,0.014753433054879406,,,0.0001400994099761681,,,,28,,,0.0007665786473642778,,COMPLETE
885,885,66.66666666666667,2025-05-25 09:42:56.091756,2025-05-25 09:43:13.765223,0 days 00:00:17.673467,AdamW,0.03121932877105114,,,9.331657114516812e-05,,,,29,,,0.0029764758707591134,,COMPLETE
886,886,37.5,2025-05-25 09:43:13.826513,2025-05-25 09:43:25.992168,0 days 00:00:12.165655,AdamW,0.04156421320387379,,,0.00011208258521913516,,,,27,,,0.0028009427311297018,,PRUNED
887,887,33.333333333333336,2025-05-25 09:43:26.035643,2025-05-25 09:43:38.203220,0 days 00:00:12.167577,Adadelta,0.30512919867726584,1.6848466272093554,,,,,,29,0.03974957162953112,,,,PRUNED
888,888,47.916666666666664,2025-05-25 09:43:38.246896,2025-05-25 09:43:50.303035,0 days 00:00:12.056139,AdamW,0.0956167738745571,,,8.733683550406058e-05,,,,29,,,0.002179808988035098,,PRUNED
889,889,47.916666666666664,2025-05-25 09:43:50.357591,2025-05-25 09:44:02.579802,0 days 00:00:12.222211,AdamW,0.05083498524642965,,,0.00012013932386168975,,,,26,,,0.002422790864204728,,PRUNED
890,890,50.0,2025-05-25 09:44:02.624416,2025-05-25 09:44:20.487464,0 days 00:00:17.863048,AdamW,0.02902782250881341,,,0.0001376983576690674,,,,21,,,0.0018255302568714114,,COMPLETE
891,891,43.75,2025-05-25 09:44:20.550220,2025-05-25 09:44:32.676109,0 days 00:00:12.125889,AdamW,0.07021889607042898,,,9.874917750450217e-05,,,,30,,,0.0029517527998153283,,PRUNED
892,892,33.333333333333336,2025-05-25 09:44:32.723197,2025-05-25 09:44:44.822322,0 days 00:00:12.099125,Adam,0.1770066108506428,,0.09505046123976953,,,,,28,,0.01613954921392629,,,PRUNED
893,893,37.5,2025-05-25 09:44:44.867238,2025-05-25 09:44:56.999335,0 days 00:00:12.132097,AdamW,0.15243968301710248,,,0.00010210722595849735,,,,30,,,0.002064050401242325,,PRUNED
894,894,33.333333333333336,2025-05-25 09:44:57.043639,2025-05-25 09:45:09.175482,0 days 00:00:12.131843,AdamW,0.13547469296174366,,,0.00020578818085578588,,,,18,,,0.002651986941684258,,PRUNED
895,895,54.166666666666664,2025-05-25 09:45:09.219121,2025-05-25 09:45:21.282385,0 days 00:00:12.063264,AdamW,0.14575444100807294,,,0.00016557002310823467,,,,27,,,0.0025793318801187203,,PRUNED
896,896,37.5,2025-05-25 09:45:21.325808,2025-05-25 09:45:33.548709,0 days 00:00:12.222901,AdamW,0.12208786409821944,,,1.6177862056814416e-05,,,,29,,,0.003017160322637664,,PRUNED
897,897,60.416666666666664,2025-05-25 09:45:33.593129,2025-05-25 09:45:51.402565,0 days 00:00:17.809436,AdamW,0.03636287210940459,,,8.675344398297803e-05,,,,28,,,0.0035769301366974115,,COMPLETE
898,898,41.666666666666664,2025-05-25 09:45:51.463828,2025-05-25 09:46:03.605894,0 days 00:00:12.142066,AdamW,0.16173640055895494,,,0.00012434985703101617,,,,25,,,0.0016606750878939867,,PRUNED
899,899,47.916666666666664,2025-05-25 09:46:03.649903,2025-05-25 09:46:15.783522,0 days 00:00:12.133619,AdamW,0.027812132835582003,,,0.00014252109342400898,,,,27,,,0.0017497534795383987,,PRUNED
900,900,33.333333333333336,2025-05-25 09:46:15.827338,2025-05-25 09:46:28.075983,0 days 00:00:12.248645,Adadelta,0.047073357833146125,3.744981609623938,,,,,,7,0.06610346687687926,,,,PRUNED
901,901,33.333333333333336,2025-05-25 09:46:28.120240,2025-05-25 09:46:32.488374,0 days 00:00:04.368134,AdamW,0.12981661283695412,,,0.00028326978430067616,,,,28,,,0.0033849591396969965,,PRUNED
902,902,43.75,2025-05-25 09:46:32.518181,2025-05-25 09:46:43.322627,0 days 00:00:10.804446,AdamW,0.10294146261061812,,,2.568612526378979e-05,,,,30,,,0.002038834003613338,,PRUNED
903,903,43.75,2025-05-25 09:46:43.366456,2025-05-25 09:46:55.155835,0 days 00:00:11.789379,AdamW,0.11241551783298773,,,0.00011276864559919321,,,,23,,,0.002452866513166782,,PRUNED
904,904,39.583333333333336,2025-05-25 09:46:55.195320,2025-05-25 09:46:59.564141,0 days 00:00:04.368821,AdamW,0.08462101144421008,,,7.564358418800679e-05,,,,26,,,0.0005291688434044819,,PRUNED
905,905,,2025-05-25 09:46:59.600859,2025-05-25 09:47:10.286994,0 days 00:00:10.686135,SGD,0.060436329909854467,,,,3.778237500413385e-05,98.79243014443719,False,29,,,,0.7157857025103944,PRUNED
906,906,39.583333333333336,2025-05-25 09:47:10.330628,2025-05-25 09:47:22.538716,0 days 00:00:12.208088,AdamW,0.019073175782423443,,,0.00017796258351634927,,,,28,,,0.005238462019675774,,PRUNED
907,907,45.833333333333336,2025-05-25 09:47:22.583418,2025-05-25 09:47:34.694106,0 days 00:00:12.110688,AdamW,0.03250486496022407,,,2.0463792099808755e-05,,,,29,,,0.0007030873418288459,,PRUNED
908,908,45.833333333333336,2025-05-25 09:47:34.739764,2025-05-25 09:47:46.902761,0 days 00:00:12.162997,AdamW,0.14241737950263228,,,9.570676188458212e-05,,,,27,,,0.0004196295047288983,,PRUNED
909,909,47.916666666666664,2025-05-25 09:47:46.946934,2025-05-25 09:47:59.091882,0 days 00:00:12.144948,AdamW,0.01787090092970997,,,0.0002380399627829431,,,,27,,,0.0009326879883403606,,PRUNED
910,910,47.916666666666664,2025-05-25 09:47:59.136611,2025-05-25 09:48:11.268721,0 days 00:00:12.132110,AdamW,0.15547791391088392,,,0.00014608273597776228,,,,30,,,0.0031937781831150288,,PRUNED
911,911,35.416666666666664,2025-05-25 09:48:11.313139,2025-05-25 09:48:23.540431,0 days 00:00:12.227292,AdamW,0.1849465099749622,,,8.273708939476178e-05,,,,2,,,0.0023199896940233086,,PRUNED
912,912,37.5,2025-05-25 09:48:23.587139,2025-05-25 09:48:35.719229,0 days 00:00:12.132090,AdamW,0.07342342412261502,,,0.00011614057032306916,,,,27,,,0.004642662940089478,,PRUNED
