,number,value,datetime_start,datetime_complete,duration,params_algorithm,params_dropout_rate,params_lr_Adadelta,params_lr_Adam,params_lr_AdamW,params_lr_SGD,params_momentum_SGD,params_nesterov_SGD,params_suggested_freeze,params_weight_decay_Adadelta,params_weight_decay_Adam,params_weight_decay_AdamW,params_weight_decay_SGD,state
571,571,41.666666666666664,2025-05-25 08:41:01.201654,2025-05-25 08:41:13.349661,0 days 00:00:12.148007,AdamW,0.08507232562142614,,,7.01465241692468e-05,,,,26,,,0.0006860216826394663,,PRUNED
572,572,35.416666666666664,2025-05-25 08:41:13.389609,2025-05-25 08:41:25.544427,0 days 00:00:12.154818,AdamW,0.11923479538583659,,,0.00027875731715361384,,,,17,,,0.0011013801289223488,,PRUNED
573,573,35.416666666666664,2025-05-25 08:41:25.788811,2025-05-25 08:41:37.900761,0 days 00:00:12.111950,AdamW,0.06752495667152172,,,0.00018184071507496323,,,,27,,,0.0008971559302123133,,PRUNED
574,574,43.75,2025-05-25 08:41:37.941669,2025-05-25 08:41:49.993928,0 days 00:00:12.052259,AdamW,0.018862138242565503,,,0.00013061086352568498,,,,31,,,0.0006131727467570405,,PRUNED
575,575,43.75,2025-05-25 08:41:50.033631,2025-05-25 08:42:02.262622,0 days 00:00:12.228991,AdamW,0.04085436855186453,,,0.00010986271092603705,,,,15,,,0.0038898892830000953,,PRUNED
576,576,33.333333333333336,2025-05-25 08:42:02.306494,2025-05-25 08:42:12.091826,0 days 00:00:09.785332,AdamW,0.027804622333122822,,,0.0008017192896405448,,,,29,,,0.0008071746035534573,,PRUNED
577,577,35.416666666666664,2025-05-25 08:42:12.122811,2025-05-25 08:42:24.239940,0 days 00:00:12.117129,AdamW,0.4233414875448691,,,8.556967726189626e-05,,,,14,,,0.0001454841607602377,,PRUNED
578,578,41.666666666666664,2025-05-25 08:42:24.280353,2025-05-25 08:42:34.432584,0 days 00:00:10.152231,AdamW,0.053227234754135586,,,4.9781684808429625e-05,,,,30,,,0.0010041081266034023,,PRUNED
579,579,50.0,2025-05-25 08:42:34.470158,2025-05-25 08:42:39.242641,0 days 00:00:04.772483,AdamW,0.0076658469889624645,,,6.897648104653037e-05,,,,31,,,0.0007168962348420256,,PRUNED
580,580,39.583333333333336,2025-05-25 08:42:39.272809,2025-05-25 08:42:45.096401,0 days 00:00:05.823592,Adadelta,0.01494785464220927,0.03136762985004675,,,,,,27,17.80703582115443,,,,PRUNED
581,581,43.75,2025-05-25 08:42:45.136421,2025-05-25 08:42:57.286689,0 days 00:00:12.150268,AdamW,0.07677509736304397,,,2.362403188706539e-05,,,,29,,,0.00034587620118798723,,PRUNED
582,582,45.833333333333336,2025-05-25 08:42:57.326775,2025-05-25 08:43:09.525220,0 days 00:00:12.198445,AdamW,0.03077246514397505,,,3.144568757499161e-05,,,,28,,,0.0009247793126277077,,PRUNED
583,583,43.75,2025-05-25 08:43:09.564497,2025-05-25 08:43:21.715701,0 days 00:00:12.151204,AdamW,0.02175239881052618,,,4.0497801390441124e-05,,,,20,,,0.00113763065834042,,PRUNED
584,584,,2025-05-25 08:43:21.755735,2025-05-25 08:43:33.302280,0 days 00:00:11.546545,SGD,0.0007235549606405232,,,,2.478059277341504e-05,74.39660926625962,True,30,,,,0.12606674267677045,PRUNED
585,585,45.833333333333336,2025-05-25 08:43:33.343318,2025-05-25 08:43:45.452223,0 days 00:00:12.108905,AdamW,0.13608047678610555,,,0.00021189974108495793,,,,25,,,0.0008177662972379937,,PRUNED
586,586,47.916666666666664,2025-05-25 08:43:45.492518,2025-05-25 08:43:57.677655,0 days 00:00:12.185137,AdamW,0.1975831849823636,,,0.00015184080474834615,,,,26,,,0.00250307569675704,,PRUNED
587,587,52.083333333333336,2025-05-25 08:43:57.718268,2025-05-25 08:44:09.810503,0 days 00:00:12.092235,AdamW,0.04215750489718449,,,5.946809857415987e-05,,,,31,,,0.0010446472236988952,,PRUNED
588,588,41.666666666666664,2025-05-25 08:44:09.850410,2025-05-25 08:44:22.029933,0 days 00:00:12.179523,AdamW,0.05599585720846558,,,0.00010021742876944794,,,,30,,,0.0007331437507894122,,PRUNED
589,589,60.416666666666664,2025-05-25 08:44:22.070211,2025-05-25 08:44:40.052859,0 days 00:00:17.982648,AdamW,0.010330075015144005,,,8.127910657807836e-05,,,,19,,,0.0015035699970839212,,COMPLETE
590,590,45.833333333333336,2025-05-25 08:44:40.127389,2025-05-25 08:44:52.246331,0 days 00:00:12.118942,AdamW,0.10590278431236069,,,0.00011518482015479015,,,,29,,,0.00023514993042147192,,PRUNED
591,591,50.0,2025-05-25 08:44:52.286820,2025-05-25 08:45:04.464067,0 days 00:00:12.177247,AdamW,0.03497009373056766,,,7.087095925926886e-05,,,,25,,,0.006267594944308954,,PRUNED
592,592,47.916666666666664,2025-05-25 08:45:04.505124,2025-05-25 08:45:16.576620,0 days 00:00:12.071496,AdamW,0.020278464398896787,,,9.323723404408506e-05,,,,27,,,0.0009040216535847776,,PRUNED
593,593,47.916666666666664,2025-05-25 08:45:16.616221,2025-05-25 08:45:28.922844,0 days 00:00:12.306623,AdamW,0.06759419864300681,,,0.0001362825574216803,,,,28,,,0.0012169237207550337,,PRUNED
594,594,47.916666666666664,2025-05-25 08:45:28.964331,2025-05-25 08:45:41.108740,0 days 00:00:12.144409,AdamW,0.009000761057115173,,,4.739303833932795e-05,,,,22,,,0.005249099680966956,,PRUNED
595,595,37.5,2025-05-25 08:45:41.148846,2025-05-25 08:45:55.597878,0 days 00:00:14.449032,Adam,0.32747476573538564,,0.0017126401669439438,,,,,29,,0.022618394226561776,,,PRUNED
596,596,47.916666666666664,2025-05-25 08:45:55.638578,2025-05-25 08:46:07.697660,0 days 00:00:12.059082,AdamW,0.000277687811598943,,,5.53986176426361e-05,,,,31,,,0.00010078624876029015,,PRUNED
597,597,35.416666666666664,2025-05-25 08:46:07.738070,2025-05-25 08:46:19.981213,0 days 00:00:12.243143,AdamW,0.026667831390077373,,,0.00016708267129896649,,,,26,,,0.003113726921407867,,PRUNED
598,598,45.833333333333336,2025-05-25 08:46:20.022454,2025-05-25 08:46:32.146362,0 days 00:00:12.123908,AdamW,0.043603561348813547,,,0.00010972300049656581,,,,28,,,0.0008272191048036651,,PRUNED
599,599,41.666666666666664,2025-05-25 08:46:32.187914,2025-05-25 08:46:44.357870,0 days 00:00:12.169956,AdamW,0.01509461967250402,,,7.99686065750359e-05,,,,31,,,0.0017998154506858085,,PRUNED
600,600,52.083333333333336,2025-05-25 08:46:44.398407,2025-05-25 08:46:56.574649,0 days 00:00:12.176242,AdamW,0.030748287394936256,,,6.494128431327002e-05,,,,24,,,0.008736771217387376,,PRUNED
601,601,45.833333333333336,2025-05-25 08:46:56.615349,2025-05-25 08:47:08.741429,0 days 00:00:12.126080,AdamW,0.056814889244661264,,,1.8141653367045618e-05,,,,29,,,0.0009810717937848894,,PRUNED
602,602,50.0,2025-05-25 08:47:08.781823,2025-05-25 08:47:20.832618,0 days 00:00:12.050795,AdamW,0.15095556611831018,,,0.000126597455891651,,,,30,,,0.004462088620704564,,PRUNED
603,603,41.666666666666664,2025-05-25 08:47:20.873470,2025-05-25 08:47:32.523273,0 days 00:00:11.649803,AdamW,0.017618464502822624,,,9.031082496159175e-05,,,,27,,,0.00039467432086431176,,PRUNED
604,604,43.75,2025-05-25 08:47:32.563356,2025-05-25 08:47:37.059433,0 days 00:00:04.496077,AdamW,0.03642498391630785,,,3.572346628958673e-05,,,,30,,,0.000528291619677694,,PRUNED
605,605,33.333333333333336,2025-05-25 08:47:37.099954,2025-05-25 08:47:49.183339,0 days 00:00:12.083385,Adadelta,0.02196586803726098,2.8542219946827934,,,,,,29,3.305930171057631,,,,PRUNED
606,606,52.083333333333336,2025-05-25 08:47:49.224103,2025-05-25 08:47:56.746386,0 days 00:00:07.522283,AdamW,0.008623477529911145,,,5.934659346673401e-05,,,,27,,,0.0006506404625723853,,PRUNED
607,607,50.0,2025-05-25 08:47:56.775234,2025-05-25 08:48:00.749328,0 days 00:00:03.974094,AdamW,0.09010172441090424,,,0.00023544556770942857,,,,31,,,0.0007891320837104481,,PRUNED
608,608,,2025-05-25 08:48:00.778592,2025-05-25 08:48:04.357066,0 days 00:00:03.578474,SGD,0.21037682235601457,,,,0.026024412444755982,30.81976755181177,False,26,,,,0.6469858265583316,PRUNED
609,609,47.916666666666664,2025-05-25 08:48:04.387580,2025-05-25 08:48:15.245679,0 days 00:00:10.858099,AdamW,0.0465334387044421,,,7.500316158717585e-05,,,,30,,,0.0011554595157323867,,PRUNED
610,610,35.416666666666664,2025-05-25 08:48:15.287744,2025-05-25 08:48:27.465678,0 days 00:00:12.177934,AdamW,0.0001364902015126429,,,2.669431960357066e-05,,,,28,,,0.0009045284170514061,,PRUNED
611,611,43.75,2025-05-25 08:48:27.506917,2025-05-25 08:48:39.761248,0 days 00:00:12.254331,AdamW,0.2952679413864901,,,0.0001005830926929197,,,,28,,,0.0013249314050858675,,PRUNED
612,612,33.333333333333336,2025-05-25 08:48:39.803078,2025-05-25 08:48:52.019664,0 days 00:00:12.216586,AdamW,0.07793612496712453,,,0.00015114023557630891,,,,8,,,0.0010185372728691948,,PRUNED
613,613,41.666666666666664,2025-05-25 08:48:52.059879,2025-05-25 08:49:04.239016,0 days 00:00:12.179137,AdamW,0.02487067543747317,,,4.556193022876335e-05,,,,27,,,0.0007585593095040363,,PRUNED
614,614,50.0,2025-05-25 08:49:04.280435,2025-05-25 08:49:16.402240,0 days 00:00:12.121805,AdamW,0.06286598961565815,,,0.0001226534309159581,,,,31,,,0.0022100818437860315,,PRUNED
615,615,39.583333333333336,2025-05-25 08:49:16.443160,2025-05-25 08:49:28.613610,0 days 00:00:12.170450,AdamW,0.013733516822324394,,,0.0001868333398725445,,,,25,,,0.0007020793870800314,,PRUNED
616,616,50.0,2025-05-25 08:49:28.657721,2025-05-25 08:49:40.795654,0 days 00:00:12.137933,AdamW,0.036297629955304576,,,8.252970276272244e-05,,,,29,,,0.0008804202585558248,,PRUNED
617,617,33.333333333333336,2025-05-25 08:49:40.837348,2025-05-25 08:49:52.970964,0 days 00:00:12.133616,AdamW,0.008864502098787362,,,0.06147750887321478,,,,30,,,0.0010555129887685115,,PRUNED
618,618,45.833333333333336,2025-05-25 08:49:53.013506,2025-05-25 08:50:05.175385,0 days 00:00:12.161879,AdamW,0.050899716429298775,,,6.488426268670111e-05,,,,28,,,0.002726639624618518,,PRUNED
619,619,33.333333333333336,2025-05-25 08:50:05.216032,2025-05-25 08:50:17.335113,0 days 00:00:12.119081,Adam,0.023494625497248536,,0.0038593283072265163,,,,,31,,2.453054821710659,,,PRUNED
620,620,45.833333333333336,2025-05-25 08:50:17.376956,2025-05-25 08:50:29.607780,0 days 00:00:12.230824,AdamW,0.03290552547677916,,,1.5180479006873219e-05,,,,26,,,0.00012850475415557503,,PRUNED
621,621,33.333333333333336,2025-05-25 08:50:29.648551,2025-05-25 08:50:41.794457,0 days 00:00:12.145906,AdamW,0.015349961390418823,,,0.0005769637489829762,,,,23,,,0.001988024284474149,,PRUNED
622,622,45.833333333333336,2025-05-25 08:50:41.835562,2025-05-25 08:50:54.040704,0 days 00:00:12.205142,AdamW,0.11595660543390653,,,9.482092903240028e-05,,,,30,,,0.0005967383194185011,,PRUNED
623,623,54.166666666666664,2025-05-25 08:50:54.081947,2025-05-25 08:51:08.481531,0 days 00:00:14.399584,AdamW,0.044618670012711546,,,5.481736032312649e-05,,,,28,,,0.0009525134060043924,,PRUNED
624,624,45.833333333333336,2025-05-25 08:51:08.523485,2025-05-25 08:51:20.587155,0 days 00:00:12.063670,AdamW,0.27814534833924526,,,0.00013669985954409294,,,,29,,,0.0008246758731889094,,PRUNED
625,625,45.833333333333336,2025-05-25 08:51:20.627575,2025-05-25 08:51:32.809600,0 days 00:00:12.182025,AdamW,0.007973717448176654,,,2.0722479381698233e-05,,,,31,,,0.007375075867155895,,PRUNED
626,626,43.75,2025-05-25 08:51:32.850487,2025-05-25 08:51:44.976717,0 days 00:00:12.126230,AdamW,0.06599839703680845,,,0.00010704642478032286,,,,29,,,0.0011402180574989426,,PRUNED
627,627,33.333333333333336,2025-05-25 08:51:45.018107,2025-05-25 08:51:57.175045,0 days 00:00:12.156938,AdamW,0.027983008455535106,,,0.00037506035559024223,,,,30,,,0.0007503067148927617,,PRUNED
628,628,45.833333333333336,2025-05-25 08:51:57.219039,2025-05-25 08:52:09.489192,0 days 00:00:12.270153,AdamW,0.014855892877568966,,,7.723315586165683e-05,,,,18,,,0.0008600440061559716,,PRUNED
629,629,33.333333333333336,2025-05-25 08:52:09.530692,2025-05-25 08:52:21.748463,0 days 00:00:12.217771,Adadelta,0.055494622196575895,10.786152016136796,,,,,,11,0.7418626487717892,,,,PRUNED
630,630,45.833333333333336,2025-05-25 08:52:21.792010,2025-05-25 08:52:33.920886,0 days 00:00:12.128876,AdamW,7.362064330026103e-05,,,4.386753674412094e-05,,,,27,,,0.00011206043729915737,,PRUNED
631,631,33.333333333333336,2025-05-25 08:52:33.962208,2025-05-25 08:52:46.060135,0 days 00:00:12.097927,AdamW,0.037123760263625474,,,0.006978017194836375,,,,25,,,0.0006554124251930861,,PRUNED
632,632,37.5,2025-05-25 08:52:46.101870,2025-05-25 08:52:53.806136,0 days 00:00:07.704266,SGD,0.027440749929048894,,,,0.007399610829328414,0.9740768594953124,True,30,,,,2.1398858289658884,PRUNED
633,633,31.25,2025-05-25 08:52:53.835378,2025-05-25 08:52:58.657201,0 days 00:00:04.821823,AdamW,0.3756407089975848,,,6.554869519998658e-05,,,,10,,,0.0010462763798217293,,PRUNED
634,634,45.833333333333336,2025-05-25 08:52:58.698165,2025-05-25 08:53:10.774965,0 days 00:00:12.076800,AdamW,0.01854616920478637,,,0.0001667553489180951,,,,29,,,0.0012269681496944206,,PRUNED
635,635,47.916666666666664,2025-05-25 08:53:10.815674,2025-05-25 08:53:21.710824,0 days 00:00:10.895150,AdamW,0.08118820125140243,,,9.05560202388743e-05,,,,26,,,0.001479710711572428,,PRUNED
636,636,50.0,2025-05-25 08:53:21.739804,2025-05-25 08:53:26.056279,0 days 00:00:04.316475,AdamW,0.35838805045326455,,,0.00011566790883098038,,,,31,,,0.0009411593654850932,,PRUNED
637,637,45.833333333333336,2025-05-25 08:53:26.084182,2025-05-25 08:53:34.357676,0 days 00:00:08.273494,AdamW,0.008448732720096715,,,5.095377410885963e-05,,,,27,,,0.0008049295075011818,,PRUNED
638,638,43.75,2025-05-25 08:53:34.398566,2025-05-25 08:53:46.577280,0 days 00:00:12.178714,AdamW,0.09828846253470289,,,3.892176887337506e-05,,,,30,,,0.000987503588723975,,PRUNED
639,639,41.666666666666664,2025-05-25 08:53:46.618089,2025-05-25 08:53:58.784319,0 days 00:00:12.166230,AdamW,0.12420559078486687,,,7.129371668290777e-05,,,,24,,,0.0007095680611711414,,PRUNED
640,640,43.75,2025-05-25 08:53:58.824898,2025-05-25 08:54:11.066661,0 days 00:00:12.241763,AdamW,0.04522148698102452,,,0.00014473361508498416,,,,29,,,0.0033927753613686054,,PRUNED
641,641,47.916666666666664,2025-05-25 08:54:11.107927,2025-05-25 08:54:23.295487,0 days 00:00:12.187560,AdamW,0.024507180982200123,,,0.00010392651710691788,,,,28,,,0.0004514640328150519,,PRUNED
642,642,47.916666666666664,2025-05-25 08:54:23.336926,2025-05-25 08:54:35.481734,0 days 00:00:12.144808,AdamW,0.03688837699597452,,,7.957524026152344e-05,,,,31,,,0.0008948225030606332,,PRUNED
643,643,41.666666666666664,2025-05-25 08:54:35.522455,2025-05-25 08:54:47.695844,0 days 00:00:12.173389,Adam,0.00025848285648430447,,0.0003436764217456892,,,,,26,,1.0008021251357524,,,PRUNED
644,644,52.083333333333336,2025-05-25 08:54:47.736370,2025-05-25 08:55:02.234205,0 days 00:00:14.497835,AdamW,0.05370815566668358,,,3.020879473466999e-05,,,,28,,,0.0016879555561766034,,PRUNED
645,645,47.916666666666664,2025-05-25 08:55:02.275665,2025-05-25 08:55:14.434435,0 days 00:00:12.158770,AdamW,0.13296333811347497,,,6.008005038617333e-05,,,,30,,,0.0013432361918013515,,PRUNED
646,646,33.333333333333336,2025-05-25 08:55:14.475997,2025-05-25 08:55:26.711076,0 days 00:00:12.235079,AdamW,0.06894899729089242,,,0.0002115789752069093,,,,27,,,0.0002058199518453521,,PRUNED
647,647,45.833333333333336,2025-05-25 08:55:26.752063,2025-05-25 08:55:38.902995,0 days 00:00:12.150932,AdamW,0.014196610673447865,,,0.00011898582394338126,,,,31,,,0.001098672435445332,,PRUNED
648,648,41.666666666666664,2025-05-25 08:55:38.945059,2025-05-25 08:55:51.144634,0 days 00:00:12.199575,AdamW,0.020772142793018852,,,8.61370771930492e-05,,,,22,,,0.0007674022090652457,,PRUNED
649,649,35.416666666666664,2025-05-25 08:55:51.187611,2025-05-25 08:56:03.373816,0 days 00:00:12.186205,AdamW,0.032917468587590766,,,1.13146912868505e-05,,,,29,,,0.0008652900898076622,,PRUNED
650,650,47.916666666666664,2025-05-25 08:56:03.415255,2025-05-25 08:56:15.538791,0 days 00:00:12.123536,AdamW,0.013295184618010276,,,5.118174347553189e-05,,,,28,,,0.009925926119478679,,PRUNED
651,651,45.833333333333336,2025-05-25 08:56:15.581420,2025-05-25 08:56:27.799864,0 days 00:00:12.218444,AdamW,0.00018421812012120974,,,0.00016901587609688726,,,,14,,,0.00017823143176370736,,PRUNED
652,652,43.75,2025-05-25 08:56:27.841118,2025-05-25 08:56:39.965971,0 days 00:00:12.124853,AdamW,0.1439433013934728,,,0.00012821805952356263,,,,30,,,0.0023539872424588057,,PRUNED
653,653,35.416666666666664,2025-05-25 08:56:40.007609,2025-05-25 08:56:52.185540,0 days 00:00:12.177931,AdamW,0.04284729035015131,,,6.955510033186466e-05,,,,20,,,0.00028987639798225143,,PRUNED
654,654,33.333333333333336,2025-05-25 08:56:52.228339,2025-05-25 08:57:04.480171,0 days 00:00:12.251832,Adadelta,0.023838111981673092,33.77274086001071,,,,,,6,0.438990014686653,,,,PRUNED
655,655,41.666666666666664,2025-05-25 08:57:04.523237,2025-05-25 08:57:16.640046,0 days 00:00:12.116809,AdamW,0.06114584306082811,,,2.3705734008463335e-05,,,,25,,,0.0009720978231184224,,PRUNED
656,656,62.5,2025-05-25 08:57:16.680925,2025-05-25 08:57:34.674865,0 days 00:00:17.993940,AdamW,0.011899088526169959,,,9.933027472164437e-05,,,,21,,,0.0012085411020575953,,COMPLETE
657,657,,2025-05-25 08:57:34.732552,2025-05-25 08:57:46.198696,0 days 00:00:11.466144,SGD,0.008814251490147966,,,,0.05083883716224521,14.386754019342682,False,20,,,,0.09868364599054431,PRUNED
658,658,41.666666666666664,2025-05-25 08:57:46.239249,2025-05-25 08:57:58.392175,0 days 00:00:12.152926,AdamW,0.012373612527485851,,,9.24853838004663e-05,,,,19,,,0.001256678350087496,,PRUNED
659,659,39.583333333333336,2025-05-25 08:57:58.433088,2025-05-25 08:58:10.618447,0 days 00:00:12.185359,AdamW,0.07400038742142145,,,6.088313998612078e-05,,,,21,,,0.0011317562957323688,,PRUNED
660,660,39.583333333333336,2025-05-25 08:58:10.661795,2025-05-25 08:58:19.857163,0 days 00:00:09.195368,AdamW,0.16283127692884844,,,7.988916894851193e-05,,,,21,,,0.0013608626569351348,,PRUNED
661,661,41.666666666666664,2025-05-25 08:58:19.890258,2025-05-25 08:58:31.122004,0 days 00:00:11.231746,AdamW,0.02924287561596311,,,0.00010272689869853674,,,,16,,,0.001207600152056655,,PRUNED
662,662,39.583333333333336,2025-05-25 08:58:31.163437,2025-05-25 08:58:42.574953,0 days 00:00:11.411516,AdamW,0.006961085052851735,,,7.179252620765439e-05,,,,23,,,0.001044385135070196,,PRUNED
663,663,45.833333333333336,2025-05-25 08:58:42.613877,2025-05-25 08:58:50.616828,0 days 00:00:08.002951,AdamW,0.11051902049073763,,,3.8909697255822615e-05,,,,18,,,0.0012109361151249416,,PRUNED
664,664,52.083333333333336,2025-05-25 08:58:50.658237,2025-05-25 08:59:02.860226,0 days 00:00:12.201989,AdamW,0.04933412853359572,,,8.821529747898809e-05,,,,22,,,0.0014034769384991736,,PRUNED
665,665,50.0,2025-05-25 08:59:02.901456,2025-05-25 08:59:15.167722,0 days 00:00:12.266266,AdamW,0.4396418568974099,,,5.643659915138532e-05,,,,17,,,0.0011046595511834025,,PRUNED
666,666,43.75,2025-05-25 08:59:15.210000,2025-05-25 08:59:27.394387,0 days 00:00:12.184387,AdamW,0.020541300117144813,,,0.00010720470179113363,,,,23,,,0.0005781938947493307,,PRUNED
667,667,47.916666666666664,2025-05-25 08:59:27.435469,2025-05-25 08:59:39.634642,0 days 00:00:12.199173,AdamW,0.08791030347838713,,,4.533613352953524e-05,,,,25,,,0.0006451576743222179,,PRUNED
668,668,50.0,2025-05-25 08:59:39.676155,2025-05-25 08:59:51.796491,0 days 00:00:12.120336,AdamW,0.24884188535927607,,,6.78051498014249e-05,,,,27,,,0.0010138902893093763,,PRUNED
669,669,33.333333333333336,2025-05-25 08:59:51.837549,2025-05-25 09:00:04.026287,0 days 00:00:12.188738,Adam,0.0343121161532236,,0.05528622833227387,,,,,19,,11.810851019994416,,,PRUNED
670,670,41.666666666666664,2025-05-25 09:00:04.068567,2025-05-25 09:00:16.187752,0 days 00:00:12.119185,AdamW,0.18026584356705028,,,9.16340920938057e-05,,,,18,,,0.0009244921141507799,,PRUNED
671,671,35.416666666666664,2025-05-25 09:00:16.228899,2025-05-25 09:00:28.420075,0 days 00:00:12.191176,AdamW,0.0008766330521183564,,,1.625286837253159e-05,,,,28,,,0.0012828399427654339,,PRUNED
672,672,43.75,2025-05-25 09:00:28.464095,2025-05-25 09:00:40.605768,0 days 00:00:12.141673,AdamW,0.016556720536458215,,,7.520195090281806e-05,,,,1,,,0.0008385309893100413,,PRUNED
673,673,47.916666666666664,2025-05-25 09:00:40.647672,2025-05-25 09:00:52.832254,0 days 00:00:12.184582,AdamW,0.026080478713490382,,,5.8388529914024306e-05,,,,26,,,0.0007169931839106395,,PRUNED
674,674,47.916666666666664,2025-05-25 09:00:52.874454,2025-05-25 09:01:04.954868,0 days 00:00:12.080414,AdamW,0.04256123684907422,,,0.00012208388850198161,,,,24,,,0.0011455456055255073,,PRUNED
675,675,47.916666666666664,2025-05-25 09:01:04.996187,2025-05-25 09:01:17.137963,0 days 00:00:12.141776,AdamW,0.009077824180903991,,,0.00010173862778393761,,,,27,,,0.0015270954314793325,,PRUNED
676,676,58.333333333333336,2025-05-25 09:01:17.180468,2025-05-25 09:01:34.957629,0 days 00:00:17.777161,AdamW,0.05824595590412239,,,5.111190613673517e-05,,,,29,,,0.0007848193342286886,,COMPLETE
677,677,50.0,2025-05-25 09:01:35.017064,2025-05-25 09:01:47.106623,0 days 00:00:12.089559,AdamW,0.019523025498720634,,,8.245117200787188e-05,,,,21,,,0.0009392524771246136,,PRUNED
678,678,33.333333333333336,2025-05-25 09:01:47.148284,2025-05-25 09:01:59.464226,0 days 00:00:12.315942,Adadelta,0.03338063414524884,7.883285212020325,,,,,,26,9.651431781426572,,,,PRUNED
679,679,33.333333333333336,2025-05-25 09:01:59.505912,2025-05-25 09:02:11.587655,0 days 00:00:12.081743,AdamW,0.007944377790234368,,,0.0025853874417453774,,,,24,,,0.006893632144144886,,PRUNED
680,680,39.583333333333336,2025-05-25 09:02:11.629008,2025-05-25 09:02:23.837044,0 days 00:00:12.208036,AdamW,0.07409113193417338,,,1.9986496752334266e-05,,,,28,,,0.0008355724930834352,,PRUNED
681,681,50.0,2025-05-25 09:02:23.880365,2025-05-25 09:02:35.961020,0 days 00:00:12.080655,AdamW,0.028580222774301202,,,0.00014533300457526612,,,,26,,,0.0010957384678099914,,PRUNED
682,682,,2025-05-25 09:02:36.003016,2025-05-25 09:02:47.358598,0 days 00:00:11.355582,SGD,0.00015068855397225688,,,,2.5921500965429945e-05,91.52397850694788,True,27,,,,55.32833609789129,PRUNED
683,683,45.833333333333336,2025-05-25 09:02:47.400029,2025-05-25 09:02:59.593387,0 days 00:00:12.193358,AdamW,0.051102526933086,,,3.388948140345184e-05,,,,29,,,0.0010303891552362883,,PRUNED
684,684,50.0,2025-05-25 09:02:59.634813,2025-05-25 09:03:11.754601,0 days 00:00:12.119788,AdamW,0.47940349811141414,,,6.548485140357285e-05,,,,27,,,0.0006874772498949698,,PRUNED
