,number,value,datetime_start,datetime_complete,duration,params_algorithm,params_dropout_rate,params_lr_Adadelta,params_lr_Adam,params_lr_AdamW,params_lr_SGD,params_momentum_SGD,params_nesterov_SGD,params_suggested_freeze,params_weight_decay_Adadelta,params_weight_decay_Adam,params_weight_decay_AdamW,params_weight_decay_SGD,state
582,582,60.416666666666664,2025-05-24 18:25:13.477933,2025-05-24 18:25:37.514820,0 days 00:00:24.036887,Adam,0.19802596848705228,,0.00011060564018329467,,,,,28,,0.013845018070044552,,,COMPLETE
583,583,37.5,2025-05-24 18:25:38.329660,2025-05-24 18:25:45.115575,0 days 00:00:06.785915,Adam,0.22996052894071942,,6.268915478234654e-05,,,,,22,,0.09764482060445717,,,PRUNED
584,584,35.416666666666664,2025-05-24 18:25:46.017681,2025-05-24 18:25:54.708446,0 days 00:00:08.690765,Adam,0.18916181857808212,,0.00015861988314749457,,,,,25,,0.030828641407747444,,,PRUNED
585,585,33.333333333333336,2025-05-24 18:25:54.745684,2025-05-24 18:26:03.407758,0 days 00:00:08.662074,Adadelta,0.304188630881126,9.533707663814637,,,,,,29,0.020329558760758024,,,,PRUNED
586,586,33.333333333333336,2025-05-24 18:26:03.683417,2025-05-24 18:26:10.186328,0 days 00:00:06.502911,Adam,0.24786868855808336,,0.005441818659654962,,,,,27,,0.019455955944114766,,,PRUNED
587,587,56.25,2025-05-24 18:26:10.227728,2025-05-24 18:26:35.237937,0 days 00:00:25.010209,Adam,0.1579514616934778,,8.90907344799707e-05,,,,,28,,0.3867505918723605,,,COMPLETE
588,588,45.833333333333336,2025-05-24 18:26:36.444644,2025-05-24 18:26:56.066218,0 days 00:00:19.621574,Adam,0.17667533534931681,,4.8083673987539865e-05,,,,,27,,0.011626230940391764,,,PRUNED
589,589,39.583333333333336,2025-05-24 18:26:56.104996,2025-05-24 18:27:08.953941,0 days 00:00:12.848945,Adam,0.2111442379522592,,6.988070956662897e-05,,,,,30,,0.059205105162421306,,,PRUNED
590,590,66.66666666666667,2025-05-24 18:27:09.981215,2025-05-24 18:27:32.741075,0 days 00:00:22.759860,Adam,0.2016444195048347,,9.037693177303653e-05,,,,,10,,0.5359685737531484,,,COMPLETE
591,591,50.0,2025-05-24 18:27:33.792157,2025-05-24 18:27:47.693361,0 days 00:00:13.901204,Adam,0.1864345129052365,,0.00012870733571604078,,,,,24,,0.8936612374727807,,,PRUNED
592,592,41.666666666666664,2025-05-24 18:27:48.626352,2025-05-24 18:28:02.439628,0 days 00:00:13.813276,Adam,0.20005989392046705,,0.0001039300663222662,,,,,26,,0.6915646139764173,,,PRUNED
593,593,37.5,2025-05-24 18:28:03.529671,2025-05-24 18:28:18.102012,0 days 00:00:14.572341,Adam,0.17100976995874156,,8.79296911544777e-05,,,,,9,,0.5338731731232821,,,PRUNED
594,594,37.5,2025-05-24 18:28:19.094073,2025-05-24 18:28:35.151252,0 days 00:00:16.057179,AdamW,0.19169515527279082,,,5.763852179016285e-05,,,,8,,,0.00018904323573735497,,PRUNED
595,595,39.583333333333336,2025-05-24 18:28:35.192581,2025-05-24 18:28:47.268626,0 days 00:00:12.076045,Adam,0.1817628518590102,,0.0001897406814099444,,,,,29,,0.015348743183725706,,,PRUNED
596,596,33.333333333333336,2025-05-24 18:28:47.308702,2025-05-24 18:29:01.025863,0 days 00:00:13.717161,Adam,0.2020683268834581,,0.00023590265501259464,,,,,13,,0.024975258235915176,,,PRUNED
597,597,37.5,2025-05-24 18:29:01.065848,2025-05-24 18:29:11.136351,0 days 00:00:10.070503,Adam,0.16561663149030728,,0.00011981837128370248,,,,,7,,1.1340844196001945,,,PRUNED
598,598,39.583333333333336,2025-05-24 18:29:11.809002,2025-05-24 18:29:20.391466,0 days 00:00:08.582464,Adam,0.19469983599691162,,3.333051085112699e-05,,,,,29,,0.01738228942002213,,,PRUNED
599,599,33.333333333333336,2025-05-24 18:29:20.426337,2025-05-24 18:29:28.954551,0 days 00:00:08.528214,Adam,0.17975678585324026,,0.012213958584597999,,,,,3,,0.04333216323913168,,,PRUNED
600,600,45.833333333333336,2025-05-24 18:29:29.835688,2025-05-24 18:29:35.697893,0 days 00:00:05.862205,Adam,0.20607709610986633,,9.144062943642371e-05,,,,,24,,0.14026884848106938,,,PRUNED
601,601,39.583333333333336,2025-05-24 18:29:36.686733,2025-05-24 18:29:54.218663,0 days 00:00:17.531930,Adam,0.2597667592892172,,0.0001493619922794153,,,,,4,,0.03332526696118879,,,PRUNED
602,602,39.583333333333336,2025-05-24 18:29:55.339048,2025-05-24 18:30:14.220799,0 days 00:00:18.881751,Adam,0.22269443715147894,,5.8877232641908815e-05,,,,,7,,0.012409166534662768,,,PRUNED
603,603,35.416666666666664,2025-05-24 18:30:15.308138,2025-05-24 18:30:33.107400,0 days 00:00:17.799262,Adam,0.2953689419855226,,7.801097934846992e-05,,,,,26,,0.022430108363529364,,,PRUNED
604,604,39.583333333333336,2025-05-24 18:30:34.229653,2025-05-24 18:30:52.278986,0 days 00:00:18.049333,Adam,0.14754196486267968,,0.00010961776960923293,,,,,28,,0.027140828018380022,,,PRUNED
605,605,,2025-05-24 18:30:53.343101,2025-05-24 18:31:05.924819,0 days 00:00:12.581718,SGD,0.1883981741459192,,,,0.020310881159948554,39.9334068655349,False,27,,,,50.33671925872663,PRUNED
606,606,66.66666666666667,2025-05-24 18:31:05.964316,2025-05-24 18:31:28.803008,0 days 00:00:22.838692,Adam,0.17511002787018043,,4.0999735344505954e-05,,,,,11,,0.03746566815220887,,,COMPLETE
607,607,33.333333333333336,2025-05-24 18:31:29.776001,2025-05-24 18:31:48.919714,0 days 00:00:19.143713,AdamW,0.15703614144845512,,,0.004746379828339892,,,,10,,,0.0017578530922031667,,PRUNED
608,608,45.833333333333336,2025-05-24 18:31:49.897094,2025-05-24 18:32:07.171792,0 days 00:00:17.274698,Adam,0.1694590888840276,,3.807916368288816e-05,,,,,9,,0.052075461604775906,,,PRUNED
609,609,45.833333333333336,2025-05-24 18:32:08.125347,2025-05-24 18:32:22.942966,0 days 00:00:14.817619,Adam,0.14124218597909172,,4.293728989542765e-05,,,,,11,,0.03784726964731711,,,PRUNED
610,610,33.333333333333336,2025-05-24 18:32:22.981900,2025-05-24 18:32:35.571605,0 days 00:00:12.589705,Adadelta,0.17485289431871687,2.1669605357719344,,,,,,12,22.122309110911214,,,,PRUNED
611,611,45.833333333333336,2025-05-24 18:32:35.600142,2025-05-24 18:32:42.543249,0 days 00:00:06.943107,Adam,0.16432936655939973,,2.2467704725531556e-05,,,,,10,,0.03338633089280467,,,PRUNED
612,612,45.833333333333336,2025-05-24 18:32:42.572075,2025-05-24 18:32:53.478431,0 days 00:00:10.906356,Adam,0.1817118058774796,,2.6441273097350096e-05,,,,,11,,0.04069499831390405,,,PRUNED
613,613,56.25,2025-05-24 18:32:53.518555,2025-05-24 18:33:05.914850,0 days 00:00:12.396295,Adam,0.19309763510645686,,3.1509083896430885e-05,,,,,22,,0.04749024459458598,,,COMPLETE
614,614,50.0,2025-05-24 18:33:05.966929,2025-05-24 18:33:11.326774,0 days 00:00:05.359845,Adam,0.17736387204168222,,3.8506944011019285e-05,,,,,5,,0.02802315181627481,,,PRUNED
615,615,33.333333333333336,2025-05-24 18:33:12.015703,2025-05-24 18:33:30.556067,0 days 00:00:18.540364,Adam,0.15705224944123267,,4.87218066039587e-05,,,,,10,,4.089352582427336,,,PRUNED
616,616,33.333333333333336,2025-05-24 18:33:30.598492,2025-05-24 18:33:50.253185,0 days 00:00:19.654693,Adam,0.18564999286324313,,5.383119316775888e-05,,,,,11,,0.019292319929480585,,,PRUNED
617,617,33.333333333333336,2025-05-24 18:33:51.657385,2025-05-24 18:34:09.670919,0 days 00:00:18.013534,Adam,0.17076218460799264,,0.06147750887321478,,,,,23,,0.034394222620805597,,,PRUNED
618,618,43.75,2025-05-24 18:34:11.202188,2025-05-24 18:34:23.460779,0 days 00:00:12.258591,Adam,0.20092186767510217,,4.0762543548495215e-05,,,,,10,,0.02280062307978003,,,PRUNED
619,619,41.666666666666664,2025-05-24 18:34:23.501340,2025-05-24 18:34:37.713853,0 days 00:00:14.212513,Adam,0.1944853878663902,,6.466414534624359e-05,,,,,24,,0.0652459892837503,,,PRUNED
620,620,29.166666666666668,2025-05-24 18:34:37.755208,2025-05-24 18:34:54.227617,0 days 00:00:16.472409,Adam,0.20829373076359614,,5.196731288030079e-05,,,,,10,,0.0155055286224385,,,PRUNED
621,621,33.333333333333336,2025-05-24 18:34:55.482712,2025-05-24 18:35:18.296385,0 days 00:00:22.813673,AdamW,0.18111551061261785,,,0.0104235283226794,,,,10,,,0.005203972546729466,,PRUNED
622,622,35.416666666666664,2025-05-24 18:35:19.492185,2025-05-24 18:35:39.379991,0 days 00:00:19.887806,Adam,0.16726253645115294,,3.373018863381263e-05,,,,,8,,0.011543519894239209,,,PRUNED
623,623,43.75,2025-05-24 18:35:40.872230,2025-05-24 18:36:01.086922,0 days 00:00:20.214692,Adam,0.1892372593872023,,7.951848152091127e-05,,,,,11,,0.030894597771825502,,,PRUNED
624,624,43.75,2025-05-24 18:36:02.431139,2025-05-24 18:36:12.988536,0 days 00:00:10.557397,Adam,0.21499140367388386,,4.5152820308300295e-05,,,,,9,,0.04597660502735739,,,PRUNED
625,625,37.5,2025-05-24 18:36:13.781690,2025-05-24 18:36:30.748835,0 days 00:00:16.967145,Adam,0.2029391249595148,,6.526470669645131e-05,,,,,9,,0.027312363948031777,,,PRUNED
626,626,45.833333333333336,2025-05-24 18:36:32.011988,2025-05-24 18:36:42.889739,0 days 00:00:10.877751,Adam,0.1765035216009855,,5.6692162892453295e-05,,,,,25,,0.037593738260717324,,,PRUNED
627,627,35.416666666666664,2025-05-24 18:36:44.783981,2025-05-24 18:37:01.552243,0 days 00:00:16.768262,Adam,0.15982229905186168,,9.098546816127842e-05,,,,,12,,0.013672822881068738,,,PRUNED
628,628,66.66666666666667,2025-05-24 18:37:02.983666,2025-05-24 18:37:31.671570,0 days 00:00:28.687904,Adam,0.3863138065443692,,7.541089969866599e-05,,,,,26,,0.010046985089991954,,,COMPLETE
629,629,43.75,2025-05-24 18:37:33.016263,2025-05-24 18:37:52.364984,0 days 00:00:19.348721,Adam,0.4056302116536429,,6.798238291224553e-05,,,,,25,,0.013239440941059213,,,PRUNED
630,630,43.75,2025-05-24 18:37:53.570762,2025-05-24 18:38:11.655924,0 days 00:00:18.085162,Adam,0.22021499356605997,,5.489830924195864e-05,,,,,25,,0.010463496847355182,,,PRUNED
631,631,33.333333333333336,2025-05-24 18:38:12.740965,2025-05-24 18:38:27.294974,0 days 00:00:14.554009,Adam,0.23894886183370076,,2.8708467946882876e-05,,,,,23,,0.011220442102177555,,,PRUNED
632,632,37.5,2025-05-24 18:38:27.339195,2025-05-24 18:38:43.583491,0 days 00:00:16.244296,SGD,0.383610584741293,,,,0.000643730216955261,0.9740768594953124,True,25,,,,0.0232662099831315,PRUNED
633,633,37.5,2025-05-24 18:38:44.462962,2025-05-24 18:39:01.728166,0 days 00:00:17.265204,Adam,0.3756407089975848,,4.5296408941781535e-05,,,,,26,,0.010738384011522635,,,PRUNED
634,634,33.333333333333336,2025-05-24 18:39:02.533451,2025-05-24 18:39:19.578724,0 days 00:00:17.045273,Adadelta,0.4149182077050878,5.392766561830505,,,,,,26,0.9427019618176448,,,,PRUNED
635,635,37.5,2025-05-24 18:39:20.493046,2025-05-24 18:39:35.786217,0 days 00:00:15.293171,Adam,0.33049133633899735,,7.304064936308771e-05,,,,,24,,0.010121338808929571,,,PRUNED
636,636,33.333333333333336,2025-05-24 18:39:36.551227,2025-05-24 18:39:44.280213,0 days 00:00:07.728986,AdamW,0.3103595070361272,,,0.002383424311789681,,,,30,,,0.002593561987851199,,PRUNED
637,637,47.916666666666664,2025-05-24 18:39:44.870451,2025-05-24 18:40:00.894876,0 days 00:00:16.024425,Adam,0.39542936886710944,,5.765857545441848e-05,,,,,26,,0.015453447767492327,,,PRUNED
638,638,43.75,2025-05-24 18:40:01.891605,2025-05-24 18:40:10.775362,0 days 00:00:08.883757,Adam,0.43971343458277756,,3.8057804106478836e-05,,,,,12,,0.013023731782767858,,,PRUNED
639,639,45.833333333333336,2025-05-24 18:40:11.752077,2025-05-24 18:40:29.157676,0 days 00:00:17.405599,Adam,0.3215557043053359,,8.547137887122158e-05,,,,,31,,0.010048178594257868,,,PRUNED
640,640,35.416666666666664,2025-05-24 18:40:30.117640,2025-05-24 18:40:47.463912,0 days 00:00:17.346272,Adam,0.3899917075592466,,1.5919745109618592e-05,,,,,23,,0.017734951024813882,,,PRUNED
641,641,35.416666666666664,2025-05-24 18:40:48.387886,2025-05-24 18:41:06.224414,0 days 00:00:17.836528,Adam,0.20999693908673323,,7.042204085188814e-05,,,,,24,,0.6774029518569774,,,PRUNED
642,642,37.5,2025-05-24 18:41:07.203134,2025-05-24 18:41:24.587513,0 days 00:00:17.384379,Adam,0.19953029139020872,,4.486027387724194e-05,,,,,26,,0.013767855940374024,,,PRUNED
643,643,33.333333333333336,2025-05-24 18:41:25.495933,2025-05-24 18:41:41.041800,0 days 00:00:15.545867,Adam,0.23319028303022668,,6.030707778893504e-05,,,,,15,,0.017135449003069573,,,PRUNED
644,644,43.75,2025-05-24 18:41:41.083616,2025-05-24 18:41:53.342289,0 days 00:00:12.258673,Adam,0.1933326922286977,,8.488604000831791e-05,,,,,25,,0.012171091167924926,,,PRUNED
645,645,39.583333333333336,2025-05-24 18:41:53.383467,2025-05-24 18:42:08.243624,0 days 00:00:14.860157,Adam,0.2233680570254341,,0.00010054991450808776,,,,,14,,0.019666584481332777,,,PRUNED
646,646,50.0,2025-05-24 18:42:09.276213,2025-05-24 18:42:25.068009,0 days 00:00:15.791796,Adam,0.21155468984059164,,4.95248973327845e-05,,,,,28,,0.011864982600897198,,,PRUNED
647,647,43.75,2025-05-24 18:42:25.109352,2025-05-24 18:42:40.911764,0 days 00:00:15.802412,Adam,0.20036686179981159,,6.95381837037866e-05,,,,,30,,0.014809959211620436,,,PRUNED
648,648,45.833333333333336,2025-05-24 18:42:41.971956,2025-05-24 18:42:56.683171,0 days 00:00:14.711215,Adam,0.18475410450261098,,7.858593996959471e-05,,,,,21,,0.02169834565441321,,,PRUNED
649,649,47.916666666666664,2025-05-24 18:42:57.571026,2025-05-24 18:43:06.440360,0 days 00:00:08.869334,AdamW,0.3678445143564983,,,2.6452230638888677e-05,,,,29,,,0.008066502740162485,,PRUNED
650,650,41.666666666666664,2025-05-24 18:43:07.364826,2025-05-24 18:43:15.514948,0 days 00:00:08.150122,Adam,0.1885144656750116,,0.00012037654307867295,,,,,26,,0.010170608531770787,,,PRUNED
651,651,37.5,2025-05-24 18:43:15.544154,2025-05-24 18:43:26.050370,0 days 00:00:10.506216,Adam,0.21729355927803484,,3.7072483757228035e-05,,,,,29,,0.0171266859019837,,,PRUNED
652,652,33.333333333333336,2025-05-24 18:43:26.831806,2025-05-24 18:43:36.328953,0 days 00:00:09.497147,Adam,0.20514184238544092,,5.664772289905618e-05,,,,,8,,0.16675003048430642,,,PRUNED
653,653,47.916666666666664,2025-05-24 18:43:36.368781,2025-05-24 18:43:47.162530,0 days 00:00:10.793749,Adam,0.23082824925150922,,9.29555661536579e-05,,,,,27,,0.024587382230770248,,,PRUNED
654,654,47.916666666666664,2025-05-24 18:43:48.036759,2025-05-24 18:44:03.694522,0 days 00:00:15.657763,Adam,0.19696118656060158,,6.432238327891113e-05,,,,,22,,0.5746779266625835,,,PRUNED
655,655,,2025-05-24 18:44:05.354330,2025-05-24 18:44:23.261650,0 days 00:00:17.907320,SGD,0.24936467700713144,,,,0.008481195688544767,73.1254580363052,False,27,,,,0.6328415586181289,PRUNED
656,656,45.833333333333336,2025-05-24 18:44:23.303049,2025-05-24 18:44:40.767974,0 days 00:00:17.464925,Adam,0.18050782874007118,,4.884886823548097e-05,,,,,9,,0.7826192258430948,,,PRUNED
657,657,47.916666666666664,2025-05-24 18:44:41.966798,2025-05-24 18:44:55.679782,0 days 00:00:13.712984,Adam,0.18862867116006343,,7.775921204186966e-05,,,,,24,,0.013734550835386944,,,PRUNED
658,658,35.416666666666664,2025-05-24 18:44:56.727333,2025-05-24 18:45:11.643847,0 days 00:00:14.916514,Adam,0.21246861916127857,,0.00011121514605967679,,,,,25,,0.011850204756738043,,,PRUNED
659,659,33.333333333333336,2025-05-24 18:45:11.684681,2025-05-24 18:45:25.828343,0 days 00:00:14.143662,Adadelta,0.31853746077669404,0.3092508516987861,,,,,,29,0.07159751442250072,,,,PRUNED
660,660,47.916666666666664,2025-05-24 18:45:26.760732,2025-05-24 18:45:42.588959,0 days 00:00:15.828227,Adam,0.19749595484644702,,3.0523455827528405e-05,,,,,23,,0.02080344804987246,,,PRUNED
661,661,50.0,2025-05-24 18:45:42.628569,2025-05-24 18:45:56.644323,0 days 00:00:14.015754,Adam,0.4290656246368757,,4.2210824508367076e-05,,,,,21,,0.01584863991971542,,,PRUNED
662,662,43.75,2025-05-24 18:45:56.828767,2025-05-24 18:46:10.242392,0 days 00:00:13.413625,AdamW,0.22126572808337183,,,1.4934772649705416e-05,,,,10,,,0.0037022781411739825,,PRUNED
663,663,47.916666666666664,2025-05-24 18:46:10.284049,2025-05-24 18:46:24.434620,0 days 00:00:14.150571,Adam,0.33533297639483006,,5.957497583452971e-05,,,,,27,,0.20217294212626868,,,PRUNED
664,664,43.75,2025-05-24 18:46:26.232199,2025-05-24 18:46:42.168949,0 days 00:00:15.936750,Adam,0.2061100137628907,,9.354166749954577e-05,,,,,28,,0.12151895020789442,,,PRUNED
665,665,33.333333333333336,2025-05-24 18:46:43.070231,2025-05-24 18:46:51.011892,0 days 00:00:07.941661,Adam,0.28725568852467803,,0.0030595173133823998,,,,,25,,0.026091177439523706,,,PRUNED
666,666,43.75,2025-05-24 18:46:51.052474,2025-05-24 18:47:02.104890,0 days 00:00:11.052416,Adam,0.17641964769541663,,5.2611253059131445e-05,,,,,28,,1.0175846389236052,,,PRUNED
667,667,62.5,2025-05-24 18:47:02.133691,2025-05-24 18:47:14.297337,0 days 00:00:12.163646,Adam,0.2383193046407641,,7.503567195697254e-05,,,,,20,,0.013014966731806073,,,COMPLETE
668,668,35.416666666666664,2025-05-24 18:47:14.355249,2025-05-24 18:47:28.364083,0 days 00:00:14.008834,Adam,0.2383999357904927,,6.817331118478809e-05,,,,,20,,0.013378942534857222,,,PRUNED
669,669,41.666666666666664,2025-05-24 18:47:28.844099,2025-05-24 18:47:43.723501,0 days 00:00:14.879402,Adam,0.24642484260418515,,3.51413696746286e-05,,,,,20,,0.016188832072081393,,,PRUNED
670,670,47.916666666666664,2025-05-24 18:47:44.590500,2025-05-24 18:48:02.311648,0 days 00:00:17.721148,Adam,0.2644053347733335,,7.652926213280687e-05,,,,,20,,0.012243904292113824,,,PRUNED
671,671,37.5,2025-05-24 18:48:03.439177,2025-05-24 18:48:19.878197,0 days 00:00:16.439020,Adam,0.23539147881345499,,4.554366845190681e-05,,,,,19,,0.018700476546932097,,,PRUNED
672,672,47.916666666666664,2025-05-24 18:48:20.770658,2025-05-24 18:48:37.115690,0 days 00:00:16.345032,Adam,0.24703324065504223,,5.6018358745078015e-05,,,,,21,,0.013829272009095074,,,PRUNED
673,673,37.5,2025-05-24 18:48:38.073560,2025-05-24 18:48:55.490045,0 days 00:00:17.416485,Adam,0.22630271264210966,,6.563866771657897e-05,,,,,23,,0.011905531848019502,,,PRUNED
674,674,43.75,2025-05-24 18:48:55.532330,2025-05-24 18:49:07.740776,0 days 00:00:12.208446,Adam,0.2576046029541043,,7.53035659356932e-05,,,,,21,,0.010360072323975433,,,PRUNED
675,675,50.0,2025-05-24 18:49:07.783801,2025-05-24 18:49:19.955673,0 days 00:00:12.171872,AdamW,0.2500219003479987,,,7.135063229566073e-05,,,,19,,,0.005966779669045871,,PRUNED
676,676,43.75,2025-05-24 18:49:19.997484,2025-05-24 18:49:32.309364,0 days 00:00:12.311880,Adam,0.23976713739068428,,5.473251599099148e-05,,,,,20,,0.08614051522720037,,,PRUNED
677,677,43.75,2025-05-24 18:49:32.351225,2025-05-24 18:49:44.224824,0 days 00:00:11.873599,Adam,0.2213039087721388,,4.2041831496827466e-05,,,,,21,,0.01568758965576207,,,PRUNED
678,678,45.833333333333336,2025-05-24 18:49:44.266623,2025-05-24 18:49:56.411361,0 days 00:00:12.144738,Adam,0.2289947581255418,,8.552959635139115e-05,,,,,22,,0.02103236138984984,,,PRUNED
679,679,33.333333333333336,2025-05-24 18:49:56.452494,2025-05-24 18:50:04.588995,0 days 00:00:08.136501,Adam,0.23771874364717743,,0.00010865901180975573,,,,,6,,0.01432521986748701,,,PRUNED
680,680,,2025-05-24 18:50:04.625747,2025-05-24 18:50:11.000760,0 days 00:00:06.375013,SGD,0.26972390871498,,,,0.00012945046664937645,91.96972252308328,False,20,,,,0.1566751578812292,PRUNED
681,681,33.333333333333336,2025-05-24 18:50:11.029212,2025-05-24 18:50:17.465179,0 days 00:00:06.435967,Adam,0.3018499289377695,,6.667253877460898e-05,,,,,18,,0.010107408605875159,,,PRUNED
682,682,41.666666666666664,2025-05-24 18:50:17.507260,2025-05-24 18:50:25.744222,0 days 00:00:08.236962,Adam,0.3877577179563265,,0.00013991802460700653,,,,,24,,0.02997696889609183,,,PRUNED
683,683,47.916666666666664,2025-05-24 18:50:25.773155,2025-05-24 18:50:29.947437,0 days 00:00:04.174282,Adam,0.4003153705627013,,5.072969333028661e-05,,,,,11,,0.018915902291698535,,,PRUNED
684,684,35.416666666666664,2025-05-24 18:50:29.977120,2025-05-24 18:50:33.922157,0 days 00:00:03.945037,Adadelta,0.22613733961069604,0.6580906398183625,,,,,,31,11.599198832710496,,,,PRUNED
685,685,39.583333333333336,2025-05-24 18:50:33.953580,2025-05-24 18:50:40.713761,0 days 00:00:06.760181,Adam,0.0636972570717218,,9.325490739741982e-05,,,,,22,,0.010009664810675728,,,PRUNED
686,686,37.5,2025-05-24 18:50:40.755253,2025-05-24 18:50:52.910383,0 days 00:00:12.155130,Adam,0.2089268662031873,,6.287717900478083e-05,,,,,26,,0.023853762611828196,,,PRUNED
687,687,47.916666666666664,2025-05-24 18:50:52.953515,2025-05-24 18:51:05.050278,0 days 00:00:12.096763,Adam,0.23395080049658798,,1.9016208043911494e-05,,,,,19,,0.012454430627966999,,,PRUNED
688,688,45.833333333333336,2025-05-24 18:51:05.093524,2025-05-24 18:51:17.242561,0 days 00:00:12.149037,Adam,0.21455316319426088,,7.942210128287995e-05,,,,,25,,0.016913678756769586,,,PRUNED
689,689,39.583333333333336,2025-05-24 18:51:17.284827,2025-05-24 18:51:29.451079,0 days 00:00:12.166252,AdamW,0.19378150560517235,,,3.85274929578085e-05,,,,23,,,0.0006145822098101245,,PRUNED
690,690,50.0,2025-05-24 18:51:29.493042,2025-05-24 18:51:41.668686,0 days 00:00:12.175644,Adam,0.35519904706791655,,3.6025564839099085e-05,,,,,26,,0.03253338776059959,,,PRUNED
691,691,41.666666666666664,2025-05-24 18:51:41.711319,2025-05-24 18:51:53.862823,0 days 00:00:12.151504,Adam,0.24330252153382925,,4.524092858510841e-05,,,,,30,,0.013998881147076984,,,PRUNED
692,692,37.5,2025-05-24 18:51:53.906165,2025-05-24 18:52:06.084203,0 days 00:00:12.178038,Adam,0.16820719660515915,,2.7564710030971656e-05,,,,,25,,0.05347275288636773,,,PRUNED
693,693,66.66666666666667,2025-05-24 18:52:06.126040,2025-05-24 18:52:24.556222,0 days 00:00:18.430182,Adam,0.49918811288833004,,0.00012087081472062702,,,,,24,,0.02274435457777503,,,COMPLETE
694,694,47.916666666666664,2025-05-24 18:52:24.615968,2025-05-24 18:52:36.751024,0 days 00:00:12.135056,Adam,0.4974081408494113,,0.00015665762619894582,,,,,24,,0.035997026868137556,,,PRUNED
695,695,45.833333333333336,2025-05-24 18:52:36.792640,2025-05-24 18:52:48.913594,0 days 00:00:12.120954,Adam,0.28913615014823707,,0.00012601356270166674,,,,,24,,0.027977442887345057,,,PRUNED
696,696,45.833333333333336,2025-05-24 18:52:48.955501,2025-05-24 18:53:01.177360,0 days 00:00:12.221859,Adam,0.43309365576902936,,0.00011949359906619157,,,,,23,,0.04210903058606999,,,PRUNED
697,697,33.333333333333336,2025-05-24 18:53:01.219184,2025-05-24 18:53:13.354653,0 days 00:00:12.135469,Adam,0.32653796593115164,,0.000146021065541643,,,,,24,,0.030101761136264504,,,PRUNED
698,698,45.833333333333336,2025-05-24 18:53:13.404124,2025-05-24 18:53:25.566749,0 days 00:00:12.162625,Adam,0.48110393435597154,,0.00010761632889470289,,,,,24,,0.02460786474089067,,,PRUNED
