,number,value,datetime_start,datetime_complete,duration,params_algorithm,params_dropout_rate,params_lr_Adadelta,params_lr_Adam,params_lr_AdamW,params_lr_SGD,params_momentum_SGD,params_nesterov_SGD,params_suggested_freeze,params_weight_decay_Adadelta,params_weight_decay_Adam,params_weight_decay_AdamW,params_weight_decay_SGD,state
815,815,33.333333333333336,2025-05-24 19:15:05.549341,2025-05-24 19:15:17.865217,0 days 00:00:12.315876,Adam,0.18308136901072491,,0.00025626884572560883,,,,,24,,0.43931021963517286,,,PRUNED
816,816,39.583333333333336,2025-05-24 19:15:17.909067,2025-05-24 19:15:30.205484,0 days 00:00:12.296417,Adam,0.13860537779163093,,0.00011077599714646548,,,,,26,,0.010210134766951824,,,PRUNED
817,817,39.583333333333336,2025-05-24 19:15:30.249826,2025-05-24 19:15:42.481579,0 days 00:00:12.231753,Adam,0.23721217874169287,,4.613448015670471e-05,,,,,22,,0.03487489091047805,,,PRUNED
818,818,45.833333333333336,2025-05-24 19:15:42.529131,2025-05-24 19:15:54.725035,0 days 00:00:12.195904,Adam,0.26089239563514766,,7.163044527864405e-05,,,,,27,,5.696827316447176,,,PRUNED
819,819,43.75,2025-05-24 19:15:54.768327,2025-05-24 19:16:07.226044,0 days 00:00:12.457717,Adam,0.20078712952459277,,8.417915831163929e-05,,,,,30,,0.27214326834610875,,,PRUNED
820,820,39.583333333333336,2025-05-24 19:16:07.268613,2025-05-24 19:16:19.728490,0 days 00:00:12.459877,Adam,0.1625662292494928,,5.674944273021493e-05,,,,,26,,0.013983381021925003,,,PRUNED
821,821,33.333333333333336,2025-05-24 19:16:19.772758,2025-05-24 19:16:32.121676,0 days 00:00:12.348918,Adam,0.21279792814612472,,2.0339324702171908e-05,,,,,29,,0.02564481720300969,,,PRUNED
822,822,43.75,2025-05-24 19:16:32.166483,2025-05-24 19:16:44.484167,0 days 00:00:12.317684,Adam,0.3072659454787515,,9.820626515240047e-05,,,,,28,,0.018050061529464007,,,PRUNED
823,823,29.166666666666668,2025-05-24 19:16:44.529064,2025-05-24 19:16:56.759080,0 days 00:00:12.230016,Adam,0.42119367702866234,,4.6005060222778794e-05,,,,,22,,11.988422251057056,,,PRUNED
824,824,33.333333333333336,2025-05-24 19:16:56.802918,2025-05-24 19:17:09.140257,0 days 00:00:12.337339,Adam,0.18985941942372067,,0.00014137429786954608,,,,,27,,0.012028277018171876,,,PRUNED
825,825,33.333333333333336,2025-05-24 19:17:09.188410,2025-05-24 19:17:21.441570,0 days 00:00:12.253160,Adam,0.4999616289999235,,2.7996873114222114e-05,,,,,29,,0.01004100237255459,,,PRUNED
826,826,33.333333333333336,2025-05-24 19:17:21.499098,2025-05-24 19:17:33.747247,0 days 00:00:12.248149,AdamW,0.2056140500915666,,,0.009254280987176558,,,,25,,,0.0003595091219227392,,PRUNED
827,827,41.666666666666664,2025-05-24 19:17:33.791614,2025-05-24 19:17:46.088605,0 days 00:00:12.296991,Adam,0.004033805111240574,,8.139804276515266e-05,,,,,6,,0.05095837280424276,,,PRUNED
828,828,45.833333333333336,2025-05-24 19:17:46.132605,2025-05-24 19:17:52.936152,0 days 00:00:06.803547,Adam,0.298625511969785,,6.1478830043886e-05,,,,,11,,0.015152103230567992,,,PRUNED
829,829,35.416666666666664,2025-05-24 19:17:52.980904,2025-05-24 19:17:57.473229,0 days 00:00:04.492325,Adam,0.222699237817741,,3.5306491897403164e-05,,,,,18,,0.04191178829068304,,,PRUNED
830,830,41.666666666666664,2025-05-24 19:17:57.516503,2025-05-24 19:18:02.723181,0 days 00:00:05.206678,Adam,0.44667828717679503,,0.00011740065341981078,,,,,24,,0.02129090607553583,,,PRUNED
831,831,43.75,2025-05-24 19:18:02.753560,2025-05-24 19:18:08.345202,0 days 00:00:05.591642,Adam,0.24454328866478456,,0.00016290868549322197,,,,,23,,0.030971749183365267,,,PRUNED
832,832,,2025-05-24 19:18:08.385080,2025-05-24 19:18:16.156308,0 days 00:00:07.771228,SGD,0.15073388686891906,,,,2.035558914345127e-05,23.66717737643841,True,30,,,,2.265023441909572,PRUNED
833,833,29.166666666666668,2025-05-24 19:18:16.187720,2025-05-24 19:18:20.135862,0 days 00:00:03.948142,Adadelta,0.1812315575631536,0.06915341213733132,,,,,,5,3.2461856992464515,,,,PRUNED
834,834,41.666666666666664,2025-05-24 19:18:20.167018,2025-05-24 19:18:26.360211,0 days 00:00:06.193193,Adam,0.19702290726401564,,7.138690564756539e-05,,,,,26,,0.6346397127394993,,,PRUNED
835,835,33.333333333333336,2025-05-24 19:18:26.404640,2025-05-24 19:18:38.646948,0 days 00:00:12.242308,Adam,0.27423130165799137,,0.0038402575198516298,,,,,17,,0.016061520662108888,,,PRUNED
836,836,62.5,2025-05-24 19:18:38.690960,2025-05-24 19:18:57.049115,0 days 00:00:18.358155,Adam,0.17139456463730623,,5.323536038517514e-05,,,,,28,,0.012525175524689043,,,COMPLETE
837,837,47.916666666666664,2025-05-24 19:18:57.112548,2025-05-24 19:19:09.335023,0 days 00:00:12.222475,Adam,0.1896559452010343,,8.974217116874255e-05,,,,,28,,0.17268111556210142,,,PRUNED
838,838,37.5,2025-05-24 19:19:09.378925,2025-05-24 19:19:21.641674,0 days 00:00:12.262749,Adam,0.3603317102290693,,0.00011603745493405533,,,,,24,,0.026544999919003717,,,PRUNED
839,839,45.833333333333336,2025-05-24 19:19:21.686050,2025-05-24 19:19:33.920005,0 days 00:00:12.233955,Adam,0.23498770549943987,,3.906914648686183e-05,,,,,27,,0.040592345292903356,,,PRUNED
840,840,33.333333333333336,2025-05-24 19:19:33.964208,2025-05-24 19:19:46.168810,0 days 00:00:12.204602,AdamW,0.29169663825797104,,,0.0026917931561001823,,,,29,,,0.0033370493365736257,,PRUNED
841,841,43.75,2025-05-24 19:19:46.215517,2025-05-24 19:19:58.438238,0 days 00:00:12.222721,Adam,0.31829623027232445,,6.470365389547559e-05,,,,,21,,0.5164135953647522,,,PRUNED
842,842,43.75,2025-05-24 19:19:58.482097,2025-05-24 19:20:10.852608,0 days 00:00:12.370511,Adam,0.21304400988563824,,4.873584758824478e-05,,,,,12,,0.012343113136019393,,,PRUNED
843,843,33.333333333333336,2025-05-24 19:20:10.896908,2025-05-24 19:20:23.195686,0 days 00:00:12.298778,Adam,0.22833033789730137,,8.251819690711562e-05,,,,,10,,0.020851581361556827,,,PRUNED
844,844,47.916666666666664,2025-05-24 19:20:23.239473,2025-05-24 19:20:35.429067,0 days 00:00:12.189594,Adam,0.1650702715874008,,0.00010093253880187516,,,,,25,,0.014289969569475909,,,PRUNED
845,845,33.333333333333336,2025-05-24 19:20:35.472558,2025-05-24 19:20:47.620161,0 days 00:00:12.147603,Adam,0.19814427905271817,,0.0022839904521462884,,,,,30,,2.099137555565672,,,PRUNED
846,846,35.416666666666664,2025-05-24 19:20:47.664864,2025-05-24 19:21:00.008891,0 days 00:00:12.344027,Adam,0.18425104503253678,,0.00013508251397735093,,,,,26,,0.01011446014219594,,,PRUNED
847,847,43.75,2025-05-24 19:21:00.053190,2025-05-24 19:21:11.673468,0 days 00:00:11.620278,Adam,0.34250790129530695,,5.7303863820069006e-05,,,,,22,,0.3800039300702908,,,PRUNED
848,848,50.0,2025-05-24 19:21:11.717531,2025-05-24 19:21:23.007117,0 days 00:00:11.289586,Adam,0.2585924465241434,,7.184019720547662e-05,,,,,23,,0.03279733085712183,,,PRUNED
849,849,45.833333333333336,2025-05-24 19:21:23.039275,2025-05-24 19:21:26.930027,0 days 00:00:03.890752,Adam,0.17567277677165094,,4.225995463174939e-05,,,,,21,,0.05964202807271656,,,PRUNED
850,850,66.66666666666667,2025-05-24 19:21:26.960364,2025-05-24 19:21:35.519833,0 days 00:00:08.559469,Adam,0.20868906796587666,,0.0001786918888601742,,,,,27,,0.23645171189538922,,,COMPLETE
851,851,39.583333333333336,2025-05-24 19:21:35.563954,2025-05-24 19:21:43.957360,0 days 00:00:08.393406,Adam,0.21298649906672343,,0.00010183265118057574,,,,,28,,0.22040675142482574,,,PRUNED
852,852,35.416666666666664,2025-05-24 19:21:43.995727,2025-05-24 19:21:51.038430,0 days 00:00:07.042703,Adam,0.21049292749054072,,8.418305166389323e-05,,,,,28,,0.01725477961981363,,,PRUNED
853,853,45.833333333333336,2025-05-24 19:21:51.084509,2025-05-24 19:21:55.675675,0 days 00:00:04.591166,AdamW,0.20406530160753722,,,0.00016674760084365453,,,,27,,,0.0001861420453448684,,PRUNED
854,854,35.416666666666664,2025-05-24 19:21:55.707642,2025-05-24 19:22:03.956198,0 days 00:00:08.248556,Adam,0.21998365622956148,,5.638001169175228e-05,,,,,27,,0.28848689681357137,,,PRUNED
855,855,,2025-05-24 19:22:04.002122,2025-05-24 19:22:15.359509,0 days 00:00:11.357387,SGD,0.226425866779471,,,,0.05376945094823414,69.8827731225153,False,28,,,,95.07857103034446,PRUNED
856,856,41.666666666666664,2025-05-24 19:22:15.404622,2025-05-24 19:22:27.671023,0 days 00:00:12.266401,Adam,0.21807569173980362,,3.0636760258766765e-05,,,,,29,,0.3146337110188266,,,PRUNED
857,857,33.333333333333336,2025-05-24 19:22:27.715473,2025-05-24 19:22:39.913514,0 days 00:00:12.198041,Adadelta,0.2051978210552424,3.30076910624342,,,,,,31,0.5569287932199386,,,,PRUNED
858,858,41.666666666666664,2025-05-24 19:22:39.957571,2025-05-24 19:22:52.268827,0 days 00:00:12.311256,Adam,0.23305951781978476,,6.945784318757285e-05,,,,,29,,0.25893702339885544,,,PRUNED
859,859,39.583333333333336,2025-05-24 19:22:52.315040,2025-05-24 19:23:04.618799,0 days 00:00:12.303759,Adam,0.3974764906878348,,4.591172467822219e-05,,,,,27,,0.38593823399509275,,,PRUNED
860,860,52.083333333333336,2025-05-24 19:23:04.663152,2025-05-24 19:23:19.220376,0 days 00:00:14.557224,Adam,0.20281259058575465,,0.00011926340201507612,,,,,28,,0.19894542542204724,,,PRUNED
861,861,35.416666666666664,2025-05-24 19:23:19.265271,2025-05-24 19:23:31.565049,0 days 00:00:12.299778,Adam,0.19455993755164613,,9.067961870754061e-05,,,,,18,,0.25822947775665656,,,PRUNED
862,862,43.75,2025-05-24 19:23:31.610624,2025-05-24 19:23:43.902435,0 days 00:00:12.291811,Adam,0.24375136309642492,,6.214449407808901e-05,,,,,23,,0.3245961062375518,,,PRUNED
863,863,52.083333333333336,2025-05-24 19:23:43.951256,2025-05-24 19:23:59.746670,0 days 00:00:15.795414,Adam,0.21633315925442687,,3.663375192665741e-05,,,,,21,,0.010023871878238234,,,PRUNED
864,864,52.083333333333336,2025-05-24 19:23:59.791821,2025-05-24 19:24:15.407133,0 days 00:00:15.615312,Adam,0.22487280919451186,,7.598542081975159e-05,,,,,24,,0.023511108993026875,,,PRUNED
865,865,33.333333333333336,2025-05-24 19:24:15.451901,2025-05-24 19:24:27.777017,0 days 00:00:12.325116,Adam,0.20721742940811125,,0.0015481078942575287,,,,,28,,0.01509138846050759,,,PRUNED
866,866,41.666666666666664,2025-05-24 19:24:27.821908,2025-05-24 19:24:40.081350,0 days 00:00:12.259442,Adam,0.28548910905250385,,0.00014166342863877363,,,,,27,,0.444577793147201,,,PRUNED
867,867,35.416666666666664,2025-05-24 19:24:40.126803,2025-05-24 19:24:52.355618,0 days 00:00:12.228815,AdamW,0.3074728776512167,,,0.0504394495524317,,,,8,,,0.0001188900468872344,,PRUNED
868,868,47.916666666666664,2025-05-24 19:24:52.401167,2025-05-24 19:25:04.248020,0 days 00:00:11.846853,Adam,0.19473511498548432,,0.00010401864561547016,,,,,29,,0.012121992272061581,,,PRUNED
869,869,43.75,2025-05-24 19:25:04.289204,2025-05-24 19:25:09.139989,0 days 00:00:04.850785,Adam,0.21647997691753942,,0.00020536307568557398,,,,,22,,3.3047260848068785,,,PRUNED
870,870,47.916666666666664,2025-05-24 19:25:09.185040,2025-05-24 19:25:21.119610,0 days 00:00:11.934570,Adam,0.32955057554137623,,5.080896909823934e-05,,,,,9,,0.03767695007208633,,,PRUNED
871,871,41.666666666666664,2025-05-24 19:25:21.159735,2025-05-24 19:25:28.464665,0 days 00:00:07.304930,Adam,0.24778268251721658,,2.6284707271941966e-05,,,,,11,,0.027633811427283272,,,PRUNED
872,872,47.916666666666664,2025-05-24 19:25:28.507257,2025-05-24 19:25:39.397700,0 days 00:00:10.890443,Adam,0.2342442033261892,,6.481468460746067e-05,,,,,30,,0.019178861550911364,,,PRUNED
873,873,41.666666666666664,2025-05-24 19:25:39.441429,2025-05-24 19:25:51.669200,0 days 00:00:12.227771,Adam,0.2959497027688832,,8.245684639703781e-05,,,,,27,,0.012162979568301391,,,PRUNED
874,874,35.416666666666664,2025-05-24 19:25:51.713560,2025-05-24 19:26:03.871893,0 days 00:00:12.158333,Adam,0.3737885713884572,,4.2586935557021896e-05,,,,,28,,0.22357180367185422,,,PRUNED
875,875,47.916666666666664,2025-05-24 19:26:03.915401,2025-05-24 19:26:16.255144,0 days 00:00:12.339743,Adam,0.19648821503976205,,0.00012434591088729345,,,,,29,,0.048636535442920154,,,PRUNED
876,876,33.333333333333336,2025-05-24 19:26:16.299502,2025-05-24 19:26:28.532537,0 days 00:00:12.233035,Adam,0.2093848145820872,,0.007020013357293128,,,,,22,,1.2693571795128362,,,PRUNED
877,877,,2025-05-24 19:26:28.578285,2025-05-24 19:26:39.994623,0 days 00:00:11.416338,SGD,0.3155802372026776,,,,0.00027127770693665136,52.27159665759572,True,23,,,,36.21146392719398,PRUNED
878,878,33.333333333333336,2025-05-24 19:26:40.038861,2025-05-24 19:26:52.333457,0 days 00:00:12.294596,Adam,0.18909704374037076,,0.000986514892414472,,,,,28,,0.01427559325959412,,,PRUNED
879,879,33.333333333333336,2025-05-24 19:26:52.377592,2025-05-24 19:27:04.588129,0 days 00:00:12.210537,Adam,0.27996131640551336,,5.436745912791479e-05,,,,,14,,0.03132538598831859,,,PRUNED
880,880,35.416666666666664,2025-05-24 19:27:04.632957,2025-05-24 19:27:16.895144,0 days 00:00:12.262187,AdamW,0.22234589889149234,,,6.395849341154337e-05,,,,2,,,0.0020674809623071264,,PRUNED
881,881,37.5,2025-05-24 19:27:16.940135,2025-05-24 19:27:29.197527,0 days 00:00:12.257392,Adam,0.2079593320461042,,0.00015743059707319347,,,,,24,,0.02412676206407854,,,PRUNED
882,882,41.666666666666664,2025-05-24 19:27:29.241679,2025-05-24 19:27:41.470201,0 days 00:00:12.228522,Adadelta,0.20020627210278977,0.25027056951257204,,,,,,26,0.01825808287795012,,,,PRUNED
883,883,45.833333333333336,2025-05-24 19:27:41.514158,2025-05-24 19:27:53.743484,0 days 00:00:12.229326,Adam,0.25456283908832544,,0.00010181469167086733,,,,,21,,0.01693638190725445,,,PRUNED
884,884,47.916666666666664,2025-05-24 19:27:53.789133,2025-05-24 19:28:05.987947,0 days 00:00:12.198814,Adam,0.19006126187851424,,7.737548716768924e-05,,,,,27,,0.010110613563533979,,,PRUNED
885,885,41.666666666666664,2025-05-24 19:28:06.032380,2025-05-24 19:28:18.159699,0 days 00:00:12.127319,Adam,0.270491471020007,,3.5416255777472364e-05,,,,,29,,0.7128861245739524,,,PRUNED
886,886,50.0,2025-05-24 19:28:18.205234,2025-05-24 19:28:33.907076,0 days 00:00:15.701842,Adam,0.2338309366329317,,6.353410568053761e-05,,,,,23,,0.3588293249509004,,,PRUNED
887,887,33.333333333333336,2025-05-24 19:28:33.952606,2025-05-24 19:28:41.783396,0 days 00:00:07.830790,Adam,0.41225061746312197,,8.928350089241283e-05,,,,,25,,0.49234064662161225,,,PRUNED
888,888,47.916666666666664,2025-05-24 19:28:41.815268,2025-05-24 19:28:46.411045,0 days 00:00:04.595777,Adam,0.216759915101721,,4.43702639401647e-05,,,,,17,,0.03691556684933385,,,PRUNED
889,889,58.333333333333336,2025-05-24 19:28:46.456171,2025-05-24 19:29:01.290948,0 days 00:00:14.834777,Adam,0.19744580532776443,,0.00012024413435580398,,,,,30,,0.013036631542574267,,,COMPLETE
890,890,43.75,2025-05-24 19:29:01.336927,2025-05-24 19:29:05.537197,0 days 00:00:04.200270,Adam,0.43513476906682647,,5.380853115202112e-05,,,,,24,,0.021765721276482203,,,PRUNED
891,891,45.833333333333336,2025-05-24 19:29:05.567552,2025-05-24 19:29:09.733788,0 days 00:00:04.166236,Adam,0.3032055625546318,,7.299731727451466e-05,,,,,27,,0.017083879607454083,,,PRUNED
892,892,54.166666666666664,2025-05-24 19:29:09.764581,2025-05-24 19:29:19.902704,0 days 00:00:10.138123,Adam,0.18567705769474085,,9.149041578680277e-05,,,,,28,,0.012550874962374874,,,PRUNED
893,893,45.833333333333336,2025-05-24 19:29:19.949066,2025-05-24 19:29:32.268956,0 days 00:00:12.319890,Adam,0.20709640081976713,,0.00014472765220792993,,,,,29,,0.028877027388082975,,,PRUNED
894,894,43.75,2025-05-24 19:29:32.313970,2025-05-24 19:29:44.497047,0 days 00:00:12.183077,AdamW,0.22954372125000744,,,4.6401215569898905e-05,,,,15,,,0.0009153479730827577,,PRUNED
895,895,45.833333333333336,2025-05-24 19:29:44.543939,2025-05-24 19:29:56.803425,0 days 00:00:12.259486,Adam,0.23977581281627044,,0.0001038121750511016,,,,,23,,0.014907706959357284,,,PRUNED
896,896,47.916666666666664,2025-05-24 19:29:56.847899,2025-05-24 19:30:11.450445,0 days 00:00:14.602546,Adam,0.1808876896237112,,6.118298941810442e-05,,,,,26,,1.0271310794929676,,,PRUNED
897,897,43.75,2025-05-24 19:30:11.495312,2025-05-24 19:30:23.788704,0 days 00:00:12.293392,Adam,0.38897927849615244,,4.880074993410347e-05,,,,,24,,0.011916615479659155,,,PRUNED
898,898,39.583333333333336,2025-05-24 19:30:23.833582,2025-05-24 19:30:36.129315,0 days 00:00:12.295733,Adam,0.33360861452816437,,3.121478481740394e-05,,,,,7,,0.04809475631004355,,,PRUNED
899,899,45.833333333333336,2025-05-24 19:30:36.174699,2025-05-24 19:30:48.435257,0 days 00:00:12.260558,Adam,0.4580356197759709,,3.8449829991007906e-05,,,,,25,,0.0361837446738188,,,PRUNED
900,900,50.0,2025-05-24 19:30:48.479657,2025-05-24 19:31:00.751527,0 days 00:00:12.271870,Adam,0.20085997873421155,,7.221888218570745e-05,,,,,28,,0.2872360269527171,,,PRUNED
901,901,50.0,2025-05-24 19:31:00.796321,2025-05-24 19:31:13.133924,0 days 00:00:12.337603,Adam,0.3221508518370644,,0.00017664842708460757,,,,,22,,0.019739335777719844,,,PRUNED
902,902,,2025-05-24 19:31:13.178743,2025-05-24 19:31:24.658641,0 days 00:00:11.479898,SGD,0.29285910194361786,,,,0.0014225072030794616,96.00044373290598,False,10,,,,0.2755603311564749,PRUNED
903,903,43.75,2025-05-24 19:31:24.702579,2025-05-24 19:31:36.993277,0 days 00:00:12.290698,Adam,0.2200686066769419,,0.00010650292771460508,,,,,1,,0.5699839589890618,,,PRUNED
904,904,33.333333333333336,2025-05-24 19:31:37.038293,2025-05-24 19:31:49.252879,0 days 00:00:12.214586,Adam,0.47436435034072927,,0.01698751235942129,,,,,13,,0.025731512579092165,,,PRUNED
905,905,33.333333333333336,2025-05-24 19:31:49.297984,2025-05-24 19:32:01.501741,0 days 00:00:12.203757,Adadelta,0.3097753481966506,0.018238899913199425,,,,,,27,8.663339663518185,,,,PRUNED
906,906,41.666666666666664,2025-05-24 19:32:01.547027,2025-05-24 19:32:13.646934,0 days 00:00:12.099907,Adam,0.2656858903231872,,8.304700851450119e-05,,,,,28,,0.014234882615387134,,,PRUNED
907,907,50.0,2025-05-24 19:32:13.692809,2025-05-24 19:32:20.983355,0 days 00:00:07.290546,Adam,0.2819932770826632,,5.6319698713554795e-05,,,,,31,,0.010176376611145649,,,PRUNED
908,908,25.0,2025-05-24 19:32:21.014594,2025-05-24 19:32:30.777365,0 days 00:00:09.762771,AdamW,0.19199809564783515,,,1.0297921151046795e-05,,,,22,,,0.005232011727714107,,PRUNED
909,909,37.5,2025-05-24 19:32:30.825505,2025-05-24 19:32:40.667049,0 days 00:00:09.841544,Adam,0.2416360857279078,,0.0001288299816229137,,,,,16,,0.1724857381259086,,,PRUNED
910,910,33.333333333333336,2025-05-24 19:32:40.697474,2025-05-24 19:32:47.225440,0 days 00:00:06.527966,Adam,0.25140839280046234,,0.07186887005126229,,,,,20,,0.22972660057018093,,,PRUNED
911,911,33.333333333333336,2025-05-24 19:32:47.270920,2025-05-24 19:32:59.579455,0 days 00:00:12.308535,Adam,0.21059465031914387,,0.0002449144407500202,,,,,30,,0.04307773408773179,,,PRUNED
912,912,43.75,2025-05-24 19:32:59.623692,2025-05-24 19:33:11.843432,0 days 00:00:12.219740,Adam,0.1799715232887512,,6.909636487359979e-05,,,,,25,,0.032632599250891764,,,PRUNED
913,913,39.583333333333336,2025-05-24 19:33:11.887603,2025-05-24 19:33:24.136746,0 days 00:00:12.249143,Adam,0.19343796191409876,,4.257274742009523e-05,,,,,29,,0.016279597699734305,,,PRUNED
914,914,41.666666666666664,2025-05-24 19:33:24.181799,2025-05-24 19:33:36.401522,0 days 00:00:12.219723,Adam,0.2291411030915428,,9.184412014263804e-05,,,,,27,,0.011749336558335046,,,PRUNED
915,915,31.25,2025-05-24 19:33:36.449104,2025-05-24 19:33:48.754707,0 days 00:00:12.305603,Adam,0.2017095238379233,,5.021764267099487e-05,,,,,21,,0.01965318579501373,,,PRUNED
916,916,47.916666666666664,2025-05-24 19:33:48.799803,2025-05-24 19:34:01.058690,0 days 00:00:12.258887,Adam,0.2987560760373118,,0.00011367686832992668,,,,,26,,0.4306982584332095,,,PRUNED
917,917,35.416666666666664,2025-05-24 19:34:01.104611,2025-05-24 19:34:13.286255,0 days 00:00:12.181644,Adam,0.18223177701723126,,2.225690491486868e-05,,,,,24,,0.013928057426896462,,,PRUNED
918,918,50.0,2025-05-24 19:34:13.330319,2025-05-24 19:34:25.655976,0 days 00:00:12.325657,Adam,0.34602269496305404,,6.446564152394887e-05,,,,,23,,0.023956410996300893,,,PRUNED
919,919,41.666666666666664,2025-05-24 19:34:25.703327,2025-05-24 19:34:37.940985,0 days 00:00:12.237658,Adam,0.21782770658756584,,7.8759249175053e-05,,,,,27,,0.3327334905646801,,,PRUNED
920,920,33.333333333333336,2025-05-24 19:34:37.985494,2025-05-24 19:34:50.362142,0 days 00:00:12.376648,AdamW,0.31711523486154386,,,0.0007016161254352779,,,,19,,,0.004316339979394233,,PRUNED
921,921,41.666666666666664,2025-05-24 19:34:50.407859,2025-05-24 19:35:02.538376,0 days 00:00:12.130517,Adam,0.2063577335673204,,3.550210921646294e-05,,,,,28,,0.011617292632653224,,,PRUNED
922,922,33.333333333333336,2025-05-24 19:35:02.576953,2025-05-24 19:35:14.416762,0 days 00:00:11.839809,Adam,0.22552743000927108,,0.0001406198775320525,,,,,26,,0.05671483332087272,,,PRUNED
923,923,45.833333333333336,2025-05-24 19:35:14.461934,2025-05-24 19:35:26.387505,0 days 00:00:11.925571,Adam,0.2590085513034879,,5.718504305679989e-05,,,,,29,,0.030715234338107293,,,PRUNED
924,924,47.916666666666664,2025-05-24 19:35:26.475816,2025-05-24 19:35:38.641369,0 days 00:00:12.165553,Adam,0.188448630824874,,9.208888981861433e-05,,,,,22,,0.016624470219786237,,,PRUNED
925,925,37.5,2025-05-24 19:35:38.685085,2025-05-24 19:35:50.669002,0 days 00:00:11.983917,Adam,0.3578627900494088,,4.303367233514704e-05,,,,,23,,84.05604816366825,,,PRUNED
926,926,39.583333333333336,2025-05-24 19:35:50.709144,2025-05-24 19:35:56.400324,0 days 00:00:05.691180,Adam,0.1781293085786871,,2.6726287548656948e-05,,,,,28,,0.011758015699277419,,,PRUNED
927,927,,2025-05-24 19:35:56.444483,2025-05-24 19:36:06.444269,0 days 00:00:09.999786,SGD,0.21122711584854978,,,,0.017491000303743273,12.663915339403658,True,24,,,,0.7377255974591401,PRUNED
928,928,41.666666666666664,2025-05-24 19:36:06.484854,2025-05-24 19:36:14.243157,0 days 00:00:07.758303,Adam,0.1961872975299766,,7.378017427624097e-05,,,,,29,,0.03841825508476994,,,PRUNED
929,929,33.333333333333336,2025-05-24 19:36:14.273292,2025-05-24 19:36:21.239523,0 days 00:00:06.966231,Adam,0.24657070470013925,,0.00011515094218779021,,,,,25,,0.021016101819225353,,,PRUNED
930,930,62.5,2025-05-24 19:36:21.283991,2025-05-24 19:36:40.150948,0 days 00:00:18.866957,Adam,0.3051657482959277,,5.885560375801685e-05,,,,,23,,0.010016789393498749,,,COMPLETE
