,number,value,datetime_start,datetime_complete,duration,params_algorithm,params_dropout_rate,params_lr_Adadelta,params_lr_Adam,params_lr_AdamW,params_lr_SGD,params_momentum_SGD,params_nesterov_SGD,params_suggested_freeze,params_weight_decay_Adadelta,params_weight_decay_Adam,params_weight_decay_AdamW,params_weight_decay_SGD,state
685,685,50.0,2025-05-25 09:03:11.795983,2025-05-25 09:03:24.061466,0 days 00:00:12.265483,AdamW,0.015423848860977843,,,0.00011240197728400627,,,,25,,,0.00015324700022498484,,PRUNED
686,686,41.666666666666664,2025-05-25 09:03:24.102434,2025-05-25 09:03:36.157318,0 days 00:00:12.054884,AdamW,0.03945379368652444,,,9.486002532257983e-05,,,,29,,,0.0008956945249478709,,PRUNED
687,687,45.833333333333336,2025-05-25 09:03:36.198636,2025-05-25 09:03:41.711981,0 days 00:00:05.513345,AdamW,0.06648268332706506,,,2.7599673569384345e-05,,,,17,,,0.000748623770962971,,PRUNED
688,688,37.5,2025-05-25 09:03:41.753251,2025-05-25 09:03:53.893410,0 days 00:00:12.140159,AdamW,0.02118484569943617,,,7.777609599675461e-05,,,,28,,,0.005868708182614152,,PRUNED
689,689,43.75,2025-05-25 09:03:53.934838,2025-05-25 09:04:05.053108,0 days 00:00:11.118270,AdamW,0.007364672195025337,,,4.385482324829466e-05,,,,30,,,0.007892115720743128,,PRUNED
690,690,33.333333333333336,2025-05-25 09:04:05.093533,2025-05-25 09:04:16.569241,0 days 00:00:11.475708,AdamW,0.030535390054833415,,,0.00026196865262874034,,,,22,,,0.0013431910845554563,,PRUNED
691,691,35.416666666666664,2025-05-25 09:04:16.615337,2025-05-25 09:04:28.889996,0 days 00:00:12.274659,AdamW,0.04548171631688134,,,5.984007193273078e-05,,,,20,,,0.0011866352903609433,,PRUNED
692,692,52.083333333333336,2025-05-25 09:04:28.931605,2025-05-25 09:04:40.993806,0 days 00:00:12.062201,Adam,0.10160053735102706,,0.0001067029947329232,,,,,29,,0.5762261538236438,,,PRUNED
693,693,33.333333333333336,2025-05-25 09:04:41.036132,2025-05-25 09:04:53.313533,0 days 00:00:12.277401,AdamW,0.014966911582971205,,,0.000180515992814066,,,,23,,,0.0006329838846331789,,PRUNED
694,694,45.833333333333336,2025-05-25 09:04:53.355191,2025-05-25 09:05:05.455005,0 days 00:00:12.099814,AdamW,0.08437363803528047,,,0.00013385224980021765,,,,28,,,0.0009612731233351239,,PRUNED
695,695,52.083333333333336,2025-05-25 09:05:05.496501,2025-05-25 09:05:17.693766,0 days 00:00:12.197265,AdamW,0.0004001923835113986,,,7.075347197284733e-05,,,,27,,,0.000836511612787707,,PRUNED
696,696,50.0,2025-05-25 09:05:17.735115,2025-05-25 09:05:29.926749,0 days 00:00:12.191634,AdamW,0.024810381779780243,,,9.263887176552995e-05,,,,26,,,0.0010526777544750282,,PRUNED
697,697,43.75,2025-05-25 09:05:29.969281,2025-05-25 09:05:42.140683,0 days 00:00:12.171402,AdamW,0.12982183171666928,,,0.0001153278422209157,,,,28,,,0.004221259079033871,,PRUNED
698,698,43.75,2025-05-25 09:05:42.182630,2025-05-25 09:05:54.324818,0 days 00:00:12.142188,AdamW,0.0585853869437585,,,5.104615559035873e-05,,,,25,,,0.0007907984176107406,,PRUNED
699,699,64.58333333333333,2025-05-25 09:05:54.365692,2025-05-25 09:06:12.178341,0 days 00:00:17.812649,AdamW,0.15306039919955966,,,0.00015107507739476003,,,,30,,,0.000918083053848136,,COMPLETE
700,700,39.583333333333336,2025-05-25 09:06:12.237440,2025-05-25 09:06:24.439624,0 days 00:00:12.202184,AdamW,0.15355207998824785,,,0.00022552122161749596,,,,29,,,0.0009660053852910423,,PRUNED
701,701,41.666666666666664,2025-05-25 09:06:24.481571,2025-05-25 09:06:36.562927,0 days 00:00:12.081356,AdamW,0.12056382524237014,,,0.00020247054506292278,,,,29,,,0.0012312199608416749,,PRUNED
702,702,47.916666666666664,2025-05-25 09:06:36.604725,2025-05-25 09:06:48.811285,0 days 00:00:12.206560,AdamW,0.1380029755511286,,,0.00016901338022219875,,,,29,,,0.001053423836401805,,PRUNED
703,703,29.166666666666668,2025-05-25 09:06:48.853522,2025-05-25 09:07:01.010952,0 days 00:00:12.157430,Adadelta,0.3134434966013677,0.010574371398143356,,,,,,30,57.95229998125714,,,,PRUNED
704,704,62.5,2025-05-25 09:07:01.053199,2025-05-25 09:07:18.847551,0 days 00:00:17.794352,AdamW,0.14857103989428325,,,0.00014226453951697997,,,,28,,,0.0008994334697660608,,COMPLETE
705,705,50.0,2025-05-25 09:07:18.907499,2025-05-25 09:07:31.128883,0 days 00:00:12.221384,AdamW,0.14811458575378852,,,0.00021292772011178356,,,,28,,,0.0009437268685309586,,PRUNED
706,706,52.083333333333336,2025-05-25 09:07:31.170934,2025-05-25 09:07:43.293346,0 days 00:00:12.122412,AdamW,0.010543511309870536,,,0.0002000326341169232,,,,28,,,0.0009119142353637344,,PRUNED
707,707,43.75,2025-05-25 09:07:43.335827,2025-05-25 09:07:55.542403,0 days 00:00:12.206576,AdamW,0.13600846052607074,,,0.00013831503049567878,,,,27,,,0.0009008164083178428,,PRUNED
708,708,45.833333333333336,2025-05-25 09:07:55.586242,2025-05-25 09:08:07.674989,0 days 00:00:12.088747,AdamW,0.14987399428183873,,,0.0001679468479821513,,,,27,,,0.0008514205364842446,,PRUNED
709,709,33.333333333333336,2025-05-25 09:08:07.718428,2025-05-25 09:08:19.835270,0 days 00:00:12.116842,SGD,0.16466881663833471,,,,0.0001809677879225071,2.9797335871296937,False,28,,,,0.03679755024268184,PRUNED
710,710,35.416666666666664,2025-05-25 09:08:19.878451,2025-05-25 09:08:32.009672,0 days 00:00:12.131221,AdamW,0.1279310794108838,,,0.0001621449261865444,,,,27,,,0.0010056111326887853,,PRUNED
711,711,47.916666666666664,2025-05-25 09:08:32.051748,2025-05-25 09:08:44.245112,0 days 00:00:12.193364,AdamW,0.14024884201811436,,,0.0002592334885339831,,,,28,,,0.0008824617716848587,,PRUNED
712,712,54.166666666666664,2025-05-25 09:08:44.287892,2025-05-25 09:08:59.864741,0 days 00:00:15.576849,AdamW,0.14702775955657493,,,0.00015052702149849107,,,,28,,,0.0007617265878157435,,COMPLETE
713,713,35.416666666666664,2025-05-25 09:08:59.916293,2025-05-25 09:09:06.976043,0 days 00:00:07.059750,AdamW,0.15586707060062371,,,1.3340087131717361e-05,,,,26,,,0.004853466806931424,,PRUNED
714,714,43.75,2025-05-25 09:09:07.018508,2025-05-25 09:09:19.196354,0 days 00:00:12.177846,AdamW,0.11835321399926696,,,0.00013821850424838205,,,,29,,,0.0008286637176367729,,PRUNED
715,715,66.66666666666667,2025-05-25 09:09:19.238259,2025-05-25 09:09:31.409043,0 days 00:00:12.170784,AdamW,0.1442979328325665,,,0.00015272628953200303,,,,28,,,0.000992726388800667,,COMPLETE
716,716,39.583333333333336,2025-05-25 09:09:31.467489,2025-05-25 09:09:43.546649,0 days 00:00:12.079160,AdamW,0.13015664855368278,,,0.00018919786896712677,,,,27,,,0.00012063618804808752,,PRUNED
717,717,33.333333333333336,2025-05-25 09:09:43.590680,2025-05-25 09:09:55.818823,0 days 00:00:12.228143,AdamW,0.17049041825709793,,,0.00030516353927203925,,,,28,,,0.001019073030235321,,PRUNED
718,718,45.833333333333336,2025-05-25 09:09:55.861057,2025-05-25 09:10:07.967465,0 days 00:00:12.106408,AdamW,0.15867121489235445,,,0.00015507432655701697,,,,26,,,0.0010921576491866776,,PRUNED
719,719,33.333333333333336,2025-05-25 09:10:08.009533,2025-05-25 09:10:20.096458,0 days 00:00:12.086925,Adam,0.1418903201471527,,0.0008736366494796518,,,,,27,,0.021870915702107866,,,PRUNED
720,720,64.58333333333333,2025-05-25 09:10:20.138315,2025-05-25 09:10:38.011516,0 days 00:00:17.873201,AdamW,0.1516534845238311,,,0.00017472207834992522,,,,28,,,0.0005221877659386502,,COMPLETE
721,721,50.0,2025-05-25 09:10:38.071605,2025-05-25 09:10:50.160335,0 days 00:00:12.088730,AdamW,0.1413179933352271,,,0.00024170296190512077,,,,28,,,0.0004164315963805075,,PRUNED
722,722,50.0,2025-05-25 09:10:50.202836,2025-05-25 09:11:02.410941,0 days 00:00:12.208105,AdamW,0.17117528495106854,,,0.00018523237242383682,,,,28,,,0.0005731954566868883,,PRUNED
723,723,43.75,2025-05-25 09:11:02.453498,2025-05-25 09:11:14.570595,0 days 00:00:12.117097,AdamW,0.16014455447695886,,,0.00019736113449396765,,,,27,,,0.0005121233688832118,,PRUNED
724,724,39.583333333333336,2025-05-25 09:11:14.613128,2025-05-25 09:11:26.802520,0 days 00:00:12.189392,AdamW,0.15426597140876247,,,0.00018145480219226598,,,,28,,,0.0005873948632578019,,PRUNED
725,725,66.66666666666667,2025-05-25 09:11:26.846825,2025-05-25 09:11:44.666342,0 days 00:00:17.819517,AdamW,0.1424136092677199,,,0.0003132893482451358,,,,27,,,0.0002587919426339559,,COMPLETE
726,726,35.416666666666664,2025-05-25 09:11:44.726510,2025-05-25 09:11:56.868293,0 days 00:00:12.141783,AdamW,0.14160135714893823,,,0.0003113382937796972,,,,27,,,0.00017350872270822693,,PRUNED
727,727,62.5,2025-05-25 09:11:56.911335,2025-05-25 09:12:14.762402,0 days 00:00:17.851067,AdamW,0.15475162812864118,,,0.0004204485401602004,,,,27,,,0.00023859266724570054,,COMPLETE
728,728,54.166666666666664,2025-05-25 09:12:14.822261,2025-05-25 09:12:26.985777,0 days 00:00:12.163516,AdamW,0.15736138367672847,,,0.0005366599088785228,,,,28,,,0.00021627268793447465,,PRUNED
729,729,33.333333333333336,2025-05-25 09:12:27.029041,2025-05-25 09:12:39.167876,0 days 00:00:12.138835,AdamW,0.17425076652183868,,,0.00041734942680105974,,,,28,,,0.0001889985201002073,,PRUNED
730,730,39.583333333333336,2025-05-25 09:12:39.210403,2025-05-25 09:12:51.368488,0 days 00:00:12.158085,AdamW,0.14854871883857254,,,0.0003341866179715681,,,,27,,,0.00032635156997338886,,PRUNED
731,731,33.333333333333336,2025-05-25 09:12:51.412386,2025-05-25 09:13:03.634573,0 days 00:00:12.222187,Adadelta,0.1502831635227862,53.45621520871191,,,,,,27,0.01764647831872561,,,,PRUNED
732,732,47.916666666666664,2025-05-25 09:13:03.677398,2025-05-25 09:13:15.885616,0 days 00:00:12.208218,AdamW,0.13525417376671406,,,0.0002096354103928266,,,,28,,,0.0003655352258714934,,PRUNED
733,733,52.083333333333336,2025-05-25 09:13:15.928465,2025-05-25 09:13:28.079022,0 days 00:00:12.150557,AdamW,0.16982347788897206,,,0.0006671589062793009,,,,27,,,0.00022543826448223842,,PRUNED
734,734,,2025-05-25 09:13:28.121796,2025-05-25 09:13:39.509960,0 days 00:00:11.388164,SGD,0.16547281418469797,,,,0.0007035296740355901,46.48787595079056,True,28,,,,21.40017219693311,PRUNED
735,735,33.333333333333336,2025-05-25 09:13:39.552366,2025-05-25 09:13:51.783097,0 days 00:00:12.230731,AdamW,0.14301294718334745,,,0.00046151394508931105,,,,28,,,0.000272778213656537,,PRUNED
736,736,52.083333333333336,2025-05-25 09:13:51.826016,2025-05-25 09:14:03.950419,0 days 00:00:12.124403,AdamW,0.15762884380347628,,,0.0003674969705445752,,,,27,,,0.00017074639833270256,,PRUNED
737,737,31.25,2025-05-25 09:14:03.993137,2025-05-25 09:14:16.178470,0 days 00:00:12.185333,AdamW,0.12958303348218567,,,0.00028117976048208876,,,,16,,,0.0002586474852655803,,PRUNED
738,738,50.0,2025-05-25 09:14:16.419703,2025-05-25 09:14:22.609525,0 days 00:00:06.189822,AdamW,0.14712859425280986,,,0.00022695967989828892,,,,28,,,0.000195089561222284,,PRUNED
739,739,47.916666666666664,2025-05-25 09:14:22.639982,2025-05-25 09:14:33.894111,0 days 00:00:11.254129,AdamW,0.13135024517025676,,,0.00027976367841000166,,,,27,,,0.0003192738976748163,,PRUNED
740,740,33.333333333333336,2025-05-25 09:14:33.936551,2025-05-25 09:14:45.217205,0 days 00:00:11.280654,AdamW,0.14872402288167916,,,0.0003956801775301308,,,,15,,,0.00025066716562452434,,PRUNED
741,741,41.666666666666664,2025-05-25 09:14:45.256939,2025-05-25 09:14:51.203168,0 days 00:00:05.946229,AdamW,0.18386995972358308,,,0.00033908814652409313,,,,29,,,0.00045692468826054436,,PRUNED
742,742,33.333333333333336,2025-05-25 09:14:51.233636,2025-05-25 09:14:59.236219,0 days 00:00:08.002583,AdamW,0.16247770241287052,,,0.00023921257675230375,,,,27,,,0.00014797314838786382,,PRUNED
743,743,47.916666666666664,2025-05-25 09:14:59.278630,2025-05-25 09:15:11.598825,0 days 00:00:12.320195,AdamW,0.1365457691006423,,,0.0002636369504616925,,,,28,,,0.00013781806561148359,,PRUNED
744,744,33.333333333333336,2025-05-25 09:15:11.640124,2025-05-25 09:15:23.844216,0 days 00:00:12.204092,AdamW,0.11775806061893077,,,0.00015744916571337788,,,,4,,,0.0005474311318516467,,PRUNED
745,745,33.333333333333336,2025-05-25 09:15:23.886765,2025-05-25 09:15:36.085626,0 days 00:00:12.198861,Adam,0.13727322077373283,,0.013770052800014735,,,,,29,,1.3060330977382295,,,PRUNED
746,746,43.75,2025-05-25 09:15:36.128088,2025-05-25 09:15:48.182232,0 days 00:00:12.054144,AdamW,0.15601606163683085,,,0.0002407986667224677,,,,27,,,0.00013030165225832814,,PRUNED
747,747,33.333333333333336,2025-05-25 09:15:48.225126,2025-05-25 09:16:00.449614,0 days 00:00:12.224488,AdamW,0.12940880928719423,,,0.0004518817832707709,,,,29,,,0.0005139025553567908,,PRUNED
748,748,52.083333333333336,2025-05-25 09:16:00.492174,2025-05-25 09:16:12.528504,0 days 00:00:12.036330,AdamW,0.1446173680403354,,,0.0009341303736010508,,,,28,,,0.0002575129863896528,,PRUNED
749,749,54.166666666666664,2025-05-25 09:16:12.572678,2025-05-25 09:16:24.691909,0 days 00:00:12.119231,AdamW,0.15855959380265472,,,0.00031836737526183366,,,,28,,,0.00020385048422585995,,PRUNED
750,750,54.166666666666664,2025-05-25 09:16:24.737539,2025-05-25 09:16:36.819172,0 days 00:00:12.081633,AdamW,0.1807912959445629,,,0.00017542832649627597,,,,29,,,0.00015612446485100879,,PRUNED
751,751,45.833333333333336,2025-05-25 09:16:36.861677,2025-05-25 09:16:48.892562,0 days 00:00:12.030885,AdamW,0.11989086867980384,,,0.0001413799489388563,,,,27,,,0.000295478502557602,,PRUNED
752,752,33.333333333333336,2025-05-25 09:16:48.937831,2025-05-25 09:17:01.132332,0 days 00:00:12.194501,AdamW,0.1387269080337397,,,0.00018979249663274547,,,,28,,,0.00010544387043783603,,PRUNED
753,753,33.333333333333336,2025-05-25 09:17:01.176577,2025-05-25 09:17:13.229524,0 days 00:00:12.052947,AdamW,0.12490915120090036,,,0.021580844643259482,,,,26,,,0.00038516450535653983,,PRUNED
754,754,37.5,2025-05-25 09:17:13.271934,2025-05-25 09:17:25.443138,0 days 00:00:12.171204,AdamW,0.15306342665149672,,,0.00022060761584458653,,,,27,,,0.0006427602675906017,,PRUNED
755,755,22.916666666666668,2025-05-25 09:17:25.485549,2025-05-25 09:17:37.559982,0 days 00:00:12.074433,Adadelta,0.11258194439297993,2.473051960703544,,,,,,29,29.410794932980433,,,,PRUNED
756,756,47.916666666666664,2025-05-25 09:17:37.605029,2025-05-25 09:17:49.668963,0 days 00:00:12.063934,AdamW,0.16658186869183583,,,0.00206124148017834,,,,28,,,0.0001110730955654162,,PRUNED
757,757,39.583333333333336,2025-05-25 09:17:49.712037,2025-05-25 09:18:01.800005,0 days 00:00:12.087968,AdamW,0.14295610196115793,,,0.000158010972961284,,,,29,,,0.0004788342867096059,,PRUNED
758,758,37.5,2025-05-25 09:18:01.842469,2025-05-25 09:18:13.927535,0 days 00:00:12.085066,AdamW,0.12544480079686543,,,2.1716224879541163e-05,,,,26,,,0.003803945374049249,,PRUNED
759,759,,2025-05-25 09:18:13.970339,2025-05-25 09:18:25.524519,0 days 00:00:11.554180,SGD,0.15498708547799728,,,,1.0003966242018924e-05,60.69197797593446,False,27,,,,0.023366706104668202,PRUNED
760,760,41.666666666666664,2025-05-25 09:18:25.570154,2025-05-25 09:18:37.718233,0 days 00:00:12.148079,AdamW,0.14999276999776698,,,1.7334363280112908e-05,,,,19,,,0.0002347844271622567,,PRUNED
761,761,47.916666666666664,2025-05-25 09:18:37.760983,2025-05-25 09:18:49.877710,0 days 00:00:12.116727,AdamW,0.17504940016562587,,,0.00020459272835476574,,,,28,,,0.0006808635680355754,,PRUNED
762,762,33.333333333333336,2025-05-25 09:18:49.920415,2025-05-25 09:19:02.023179,0 days 00:00:12.102764,AdamW,0.13255355331520197,,,0.00026875469707802297,,,,29,,,0.0005538203053019377,,PRUNED
763,763,52.083333333333336,2025-05-25 09:19:02.065972,2025-05-25 09:19:14.199063,0 days 00:00:12.133091,AdamW,0.13822037028258327,,,0.00013288275611106202,,,,27,,,0.0001336988654580169,,PRUNED
764,764,37.5,2025-05-25 09:19:14.242684,2025-05-25 09:19:26.351079,0 days 00:00:12.108395,AdamW,0.1609203686734941,,,0.00015938710963664182,,,,29,,,0.00012112405769108233,,PRUNED
765,765,35.416666666666664,2025-05-25 09:19:26.394597,2025-05-25 09:19:38.536209,0 days 00:00:12.141612,AdamW,0.1451829146062155,,,0.000793097128897029,,,,28,,,0.00016015904399368578,,PRUNED
766,766,47.916666666666664,2025-05-25 09:19:38.579066,2025-05-25 09:19:45.784203,0 days 00:00:07.205137,AdamW,0.11875213967702199,,,0.00013184150430238338,,,,27,,,0.0006940440542112003,,PRUNED
767,767,35.416666666666664,2025-05-25 09:19:45.813539,2025-05-25 09:19:57.420875,0 days 00:00:11.607336,AdamW,0.12957147956380954,,,0.0001870129376638991,,,,29,,,0.0003051002681594373,,PRUNED
768,768,50.0,2025-05-25 09:19:57.463165,2025-05-25 09:20:08.042209,0 days 00:00:10.579044,AdamW,0.18892776702627578,,,3.1357074495663285e-05,,,,28,,,0.0003508503312329134,,PRUNED
769,769,37.5,2025-05-25 09:20:08.071622,2025-05-25 09:20:13.683448,0 days 00:00:05.611826,AdamW,0.1650930870653091,,,0.0002989391643007362,,,,27,,,0.0007323724655049498,,PRUNED
770,770,35.416666666666664,2025-05-25 09:20:13.725419,2025-05-25 09:20:25.986142,0 days 00:00:12.260723,Adam,0.14598093316366512,,3.932264474012686e-05,,,,,18,,54.34145305411152,,,PRUNED
771,771,39.583333333333336,2025-05-25 09:20:26.028015,2025-05-25 09:20:38.078682,0 days 00:00:12.050667,AdamW,0.10689595799191631,,,0.00012441135705080388,,,,28,,,0.0006379171395779669,,PRUNED
772,772,47.916666666666664,2025-05-25 09:20:38.120581,2025-05-25 09:20:50.238612,0 days 00:00:12.118031,AdamW,0.13452093635138287,,,3.921862390713429e-05,,,,29,,,0.00018387262771256538,,PRUNED
773,773,41.666666666666664,2025-05-25 09:20:50.280498,2025-05-25 09:21:02.393641,0 days 00:00:12.113143,AdamW,0.1547818050196428,,,0.0001460154455498129,,,,26,,,0.0007683151244598967,,PRUNED
774,774,47.916666666666664,2025-05-25 09:21:02.436179,2025-05-25 09:21:14.558547,0 days 00:00:12.122368,AdamW,0.1259063838406718,,,0.0004895239271940358,,,,26,,,0.0006104897932612575,,PRUNED
775,775,33.333333333333336,2025-05-25 09:21:14.601396,2025-05-25 09:21:26.736157,0 days 00:00:12.134761,AdamW,0.1488711677884933,,,0.00022629041199223753,,,,20,,,0.0008789216098216057,,PRUNED
776,776,52.083333333333336,2025-05-25 09:21:26.779456,2025-05-25 09:21:39.002085,0 days 00:00:12.222629,AdamW,0.10702938702883863,,,0.000178036296603657,,,,28,,,0.0009322253758103157,,PRUNED
777,777,47.916666666666664,2025-05-25 09:21:39.045110,2025-05-25 09:21:51.092930,0 days 00:00:12.047820,AdamW,0.13902030435008444,,,2.565620390957474e-05,,,,28,,,0.00555885052539573,,PRUNED
778,778,41.666666666666664,2025-05-25 09:21:51.135822,2025-05-25 09:22:03.497278,0 days 00:00:12.361456,AdamW,0.17193991113215273,,,0.000352279177336501,,,,27,,,0.0007317502240949021,,PRUNED
779,779,33.333333333333336,2025-05-25 09:22:03.544518,2025-05-25 09:22:15.636656,0 days 00:00:12.092138,Adadelta,0.1173114867985986,0.4183445170410329,,,,,,29,0.0847172650769881,,,,PRUNED
780,780,50.0,2025-05-25 09:22:15.679724,2025-05-25 09:22:27.930359,0 days 00:00:12.250635,AdamW,0.15932493397603098,,,0.00015599625581410383,,,,27,,,0.0008528516771932179,,PRUNED
781,781,37.5,2025-05-25 09:22:27.974195,2025-05-25 09:22:40.109275,0 days 00:00:12.135080,AdamW,0.1408329617800035,,,0.00012019313448994482,,,,2,,,0.00040990222884702257,,PRUNED
782,782,35.416666666666664,2025-05-25 09:22:40.152617,2025-05-25 09:22:52.409680,0 days 00:00:12.257063,AdamW,0.1313550670965118,,,0.0002562297713328949,,,,12,,,0.0009754197620681122,,PRUNED
783,783,54.166666666666664,2025-05-25 09:22:52.452257,2025-05-25 09:23:04.490396,0 days 00:00:12.038139,AdamW,0.1509383021758656,,,3.6545697375578065e-05,,,,29,,,0.00021182574706603448,,PRUNED
784,784,,2025-05-25 09:23:04.534545,2025-05-25 09:23:15.923960,0 days 00:00:11.389415,SGD,0.16388302913879402,,,,0.0019531886331163035,28.931968553237844,True,27,,,,0.22970498890109867,PRUNED
785,785,45.833333333333336,2025-05-25 09:23:15.969332,2025-05-25 09:23:28.154930,0 days 00:00:12.185598,AdamW,0.14612109820951974,,,4.626344460256474e-05,,,,26,,,0.0006588566537542465,,PRUNED
786,786,39.583333333333336,2025-05-25 09:23:28.197581,2025-05-25 09:23:40.286738,0 days 00:00:12.089157,AdamW,0.10950717820868837,,,0.00012197290341518636,,,,9,,,0.0007987499461487407,,PRUNED
787,787,37.5,2025-05-25 09:23:40.330193,2025-05-25 09:23:52.567932,0 days 00:00:12.237739,AdamW,0.12767157679113816,,,0.00018847011101736567,,,,28,,,0.00016321580160830933,,PRUNED
788,788,45.833333333333336,2025-05-25 09:23:52.611229,2025-05-25 09:24:04.685900,0 days 00:00:12.074671,AdamW,0.14437281958105583,,,1.852229537415081e-05,,,,21,,,0.00013846514197809806,,PRUNED
789,789,52.083333333333336,2025-05-25 09:24:04.729836,2025-05-25 09:24:16.891395,0 days 00:00:12.161559,AdamW,0.3415002636665916,,,0.00015504810289744748,,,,28,,,0.0004913976571995784,,PRUNED
790,790,60.416666666666664,2025-05-25 09:24:16.934232,2025-05-25 09:24:34.718020,0 days 00:00:17.783788,AdamW,0.39809171945076954,,,0.00011598717734808911,,,,28,,,0.008344691790860765,,COMPLETE
791,791,33.333333333333336,2025-05-25 09:24:34.778849,2025-05-25 09:24:46.816774,0 days 00:00:12.037925,AdamW,0.09662094607023594,,,0.00022950437654572454,,,,29,,,0.0010086181444792371,,PRUNED
792,792,52.083333333333336,2025-05-25 09:24:46.859587,2025-05-25 09:24:59.022860,0 days 00:00:12.163273,AdamW,0.137331742675523,,,1.4686668734555515e-05,,,,27,,,0.0005911731850351202,,PRUNED
793,793,45.833333333333336,2025-05-25 09:24:59.066472,2025-05-25 09:25:06.134883,0 days 00:00:07.068411,AdamW,0.1769905441515033,,,2.2712056026823746e-05,,,,29,,,0.009270909430080548,,PRUNED
794,794,43.75,2025-05-25 09:25:06.177571,2025-05-25 09:25:18.247445,0 days 00:00:12.069874,AdamW,0.12026979901367751,,,0.0001378042583444814,,,,26,,,0.0008166524103370118,,PRUNED
795,795,33.333333333333336,2025-05-25 09:25:18.292246,2025-05-25 09:25:29.486659,0 days 00:00:11.194413,Adam,0.1616562078418527,,0.003639957619315553,,,,,19,,0.08408792487761654,,,PRUNED
796,796,60.416666666666664,2025-05-25 09:25:29.524898,2025-05-25 09:25:39.716835,0 days 00:00:10.191937,AdamW,0.13713220145124047,,,5.3194078684387625e-05,,,,28,,,0.00643138031429984,,COMPLETE
797,797,37.5,2025-05-25 09:25:39.776640,2025-05-25 09:25:52.097157,0 days 00:00:12.320517,AdamW,0.15299666412526577,,,0.0001695304656381431,,,,29,,,0.0008994605417434535,,PRUNED
798,798,33.333333333333336,2025-05-25 09:25:52.140739,2025-05-25 09:26:04.242192,0 days 00:00:12.101453,AdamW,0.13078020108654187,,,0.00010413214787513796,,,,14,,,0.0007065296342974905,,PRUNED
