,number,value,datetime_start,datetime_complete,duration,params_algorithm,params_dropout_rate,params_lr_Adadelta,params_lr_Adam,params_lr_AdamW,params_lr_SGD,params_momentum_SGD,params_nesterov_SGD,params_suggested_freeze,params_weight_decay_Adadelta,params_weight_decay_Adam,params_weight_decay_AdamW,params_weight_decay_SGD,state
457,457,47.916666666666664,2025-05-25 08:18:05.675096,2025-05-25 08:18:17.933851,0 days 00:00:12.258755,AdamW,0.08217240827579685,,,7.287928642066264e-05,,,,30,,,0.00022450965097338624,,PRUNED
458,458,27.083333333333332,2025-05-25 08:18:17.972647,2025-05-25 08:18:30.142907,0 days 00:00:12.170260,Adadelta,0.041150789779490694,0.02823041754010538,,,,,,30,13.749882900422303,,,,PRUNED
459,459,52.083333333333336,2025-05-25 08:18:30.182284,2025-05-25 08:18:42.382956,0 days 00:00:12.200672,AdamW,0.12528301725306257,,,3.8602409120718186e-05,,,,31,,,0.0010379742983730098,,PRUNED
460,460,33.333333333333336,2025-05-25 08:18:42.421663,2025-05-25 08:18:54.536436,0 days 00:00:12.114773,AdamW,0.01743130749589098,,,5.875179951527801e-05,,,,26,,,0.0009004507845362954,,PRUNED
461,461,50.0,2025-05-25 08:18:54.575105,2025-05-25 08:19:06.657637,0 days 00:00:12.082532,AdamW,0.05161298819104902,,,9.852495235788806e-05,,,,28,,,0.0023947144514169056,,PRUNED
462,462,,2025-05-25 08:19:06.696323,2025-05-25 08:19:18.114198,0 days 00:00:11.417875,SGD,0.010099145787698188,,,,0.0001971569887190703,91.95695478026963,True,31,,,,13.100751704623914,PRUNED
463,463,33.333333333333336,2025-05-25 08:19:18.153863,2025-05-25 08:19:30.441311,0 days 00:00:12.287448,AdamW,0.06862643264288655,,,0.000148057626320345,,,,12,,,0.003795407894241893,,PRUNED
464,464,52.083333333333336,2025-05-25 08:19:30.479438,2025-05-25 08:19:44.815181,0 days 00:00:14.335743,AdamW,0.03376690266209014,,,8.05332730649686e-05,,,,25,,,0.0007378507373198111,,PRUNED
465,465,33.333333333333336,2025-05-25 08:19:44.856806,2025-05-25 08:19:57.036699,0 days 00:00:12.179893,AdamW,0.023948770296106637,,,0.012561966873814062,,,,30,,,0.0018753579988229395,,PRUNED
466,466,37.5,2025-05-25 08:19:57.074946,2025-05-25 08:20:09.140680,0 days 00:00:12.065734,AdamW,0.14262109598206035,,,1.259034877021313e-05,,,,29,,,0.0013154717376720453,,PRUNED
467,467,43.75,2025-05-25 08:20:09.181019,2025-05-25 08:20:21.261770,0 days 00:00:12.080751,AdamW,0.009479873586687497,,,0.00011080008390050287,,,,24,,,0.0003169561235607643,,PRUNED
468,468,41.666666666666664,2025-05-25 08:20:21.301601,2025-05-25 08:20:33.412480,0 days 00:00:12.110879,AdamW,0.025265794528717585,,,3.177503043411343e-05,,,,27,,,0.003365490820043681,,PRUNED
469,469,58.333333333333336,2025-05-25 08:20:33.450970,2025-05-25 08:20:48.804455,0 days 00:00:15.353485,AdamW,0.00034858143545750744,,,4.76478053410332e-05,,,,29,,,0.0011975365860548179,,COMPLETE
470,470,50.0,2025-05-25 08:20:48.861554,2025-05-25 08:21:00.970363,0 days 00:00:12.108809,AdamW,0.045184318472313106,,,6.574756401371233e-05,,,,26,,,0.0008614074366422911,,PRUNED
471,471,45.833333333333336,2025-05-25 08:21:01.008638,2025-05-25 08:21:08.569168,0 days 00:00:07.560530,AdamW,0.03498714803932344,,,9.446008570388107e-05,,,,30,,,0.0009824758830095973,,PRUNED
472,472,47.916666666666664,2025-05-25 08:21:08.596224,2025-05-25 08:21:12.909495,0 days 00:00:04.313271,AdamW,0.059534115084102134,,,0.00016887920475411173,,,,28,,,0.0006628342511474589,,PRUNED
473,473,39.583333333333336,2025-05-25 08:21:12.937187,2025-05-25 08:21:17.314443,0 days 00:00:04.377256,Adam,0.01704116822442675,,0.0005660815792968882,,,,,31,,2.932303533686814,,,PRUNED
474,474,47.916666666666664,2025-05-25 08:21:17.352959,2025-05-25 08:21:29.444890,0 days 00:00:12.091931,AdamW,6.029471466765149e-05,,,0.0001308646736498471,,,,27,,,0.0007807197586993258,,PRUNED
475,475,52.083333333333336,2025-05-25 08:21:29.485351,2025-05-25 08:21:41.583669,0 days 00:00:12.098318,AdamW,0.09188150147376965,,,5.463983217422585e-05,,,,28,,,0.0010745060141475475,,PRUNED
476,476,56.25,2025-05-25 08:21:41.621929,2025-05-25 08:21:59.339518,0 days 00:00:17.717589,AdamW,0.015966464119458887,,,2.367100578000204e-05,,,,29,,,0.0008924630621438536,,COMPLETE
477,477,47.916666666666664,2025-05-25 08:21:59.395984,2025-05-25 08:22:11.443267,0 days 00:00:12.047283,AdamW,0.026873882621470325,,,7.745261232081625e-05,,,,30,,,0.002866031151539547,,PRUNED
478,478,45.833333333333336,2025-05-25 08:22:11.480986,2025-05-25 08:22:23.730353,0 days 00:00:12.249367,AdamW,0.040140504016424,,,0.00011191399565333513,,,,31,,,0.002073734302142357,,PRUNED
479,479,52.083333333333336,2025-05-25 08:22:23.771153,2025-05-25 08:22:35.821517,0 days 00:00:12.050364,AdamW,0.009271396943973534,,,6.919973551703088e-05,,,,28,,,0.0001786713092670203,,PRUNED
480,480,47.916666666666664,2025-05-25 08:22:35.859914,2025-05-25 08:22:47.966032,0 days 00:00:12.106118,AdamW,0.05261932995000847,,,9.52988478457537e-05,,,,25,,,0.0009927436816231578,,PRUNED
481,481,50.0,2025-05-25 08:22:48.005523,2025-05-25 08:23:00.142639,0 days 00:00:12.137116,AdamW,0.02303659133045893,,,4.338274527109345e-05,,,,27,,,0.001491594881962536,,PRUNED
482,482,50.0,2025-05-25 08:23:00.181273,2025-05-25 08:23:12.241270,0 days 00:00:12.059997,AdamW,0.030841436785291172,,,6.195067187896704e-05,,,,29,,,0.0008381161123359166,,PRUNED
483,483,33.333333333333336,2025-05-25 08:23:12.280825,2025-05-25 08:23:24.470679,0 days 00:00:12.189854,Adadelta,0.011029775372193058,0.09675068084853286,,,,,,26,0.02171298384603158,,,,PRUNED
484,484,43.75,2025-05-25 08:23:24.511634,2025-05-25 08:23:36.619760,0 days 00:00:12.108126,AdamW,0.06972698425053743,,,0.0001971861336010755,,,,19,,,0.0012409548067008806,,PRUNED
485,485,33.333333333333336,2025-05-25 08:23:36.663388,2025-05-25 08:23:48.779133,0 days 00:00:12.115745,AdamW,0.036246044757092075,,,0.0011054675798187735,,,,30,,,0.0007305482605397412,,PRUNED
486,486,,2025-05-25 08:23:48.816657,2025-05-25 08:24:00.891490,0 days 00:00:12.074833,SGD,0.0488646191915067,,,,4.560231540476142e-05,61.27308829300076,False,29,,,,0.45542105614145884,PRUNED
487,487,45.833333333333336,2025-05-25 08:24:00.931913,2025-05-25 08:24:13.055929,0 days 00:00:12.124016,AdamW,0.019156406827702924,,,8.572827422832427e-05,,,,31,,,0.0011311403050129865,,PRUNED
488,488,45.833333333333336,2025-05-25 08:24:13.093411,2025-05-25 08:24:25.201106,0 days 00:00:12.107695,AdamW,0.13420906749637845,,,0.00014088200921287888,,,,26,,,0.0006236001211400198,,PRUNED
489,489,47.916666666666664,2025-05-25 08:24:25.240707,2025-05-25 08:24:37.456738,0 days 00:00:12.216031,AdamW,0.008971817467986793,,,3.6257662523445436e-05,,,,31,,,0.0009127159733077189,,PRUNED
490,490,52.083333333333336,2025-05-25 08:24:37.494927,2025-05-25 08:24:49.613853,0 days 00:00:12.118926,AdamW,0.022385473254908896,,,0.00043221455863940323,,,,27,,,0.0005486884832905389,,PRUNED
491,491,37.5,2025-05-25 08:24:49.652329,2025-05-25 08:25:01.911497,0 days 00:00:12.259168,AdamW,0.030941900437763268,,,5.3023614650600637e-05,,,,23,,,0.000796117378471058,,PRUNED
492,492,45.833333333333336,2025-05-25 08:25:01.949870,2025-05-25 08:25:14.142460,0 days 00:00:12.192590,AdamW,0.39061231134513585,,,0.000107240720910471,,,,1,,,0.006699082597704784,,PRUNED
493,493,35.416666666666664,2025-05-25 08:25:14.180574,2025-05-25 08:25:26.418243,0 days 00:00:12.237669,AdamW,0.368570046926448,,,1.9530558087272116e-05,,,,30,,,0.0009808976483075067,,PRUNED
494,494,45.833333333333336,2025-05-25 08:25:26.456716,2025-05-25 08:25:38.566360,0 days 00:00:12.109644,AdamW,0.041735149971103384,,,7.678226456767327e-05,,,,28,,,0.0007164883494261471,,PRUNED
495,495,50.0,2025-05-25 08:25:38.605027,2025-05-25 08:25:50.736205,0 days 00:00:12.131178,AdamW,0.3535005671983086,,,0.00012325454430145102,,,,29,,,0.001097234351903931,,PRUNED
496,496,41.666666666666664,2025-05-25 08:25:50.776748,2025-05-25 08:26:01.889637,0 days 00:00:11.112889,AdamW,0.06103591227399863,,,1.4845657888450958e-05,,,,30,,,0.0041465490393394625,,PRUNED
497,497,33.333333333333336,2025-05-25 08:26:01.924375,2025-05-25 08:26:07.573045,0 days 00:00:05.648670,Adam,0.008291770951615282,,0.0452304033997881,,,,,25,,0.15001599416641573,,,PRUNED
498,498,47.916666666666664,2025-05-25 08:26:07.600706,2025-05-25 08:26:17.461591,0 days 00:00:09.860885,AdamW,0.48736113440431045,,,6.676699860735819e-05,,,,31,,,0.0008480448993013241,,PRUNED
499,499,39.583333333333336,2025-05-25 08:26:17.500928,2025-05-25 08:26:29.277352,0 days 00:00:11.776424,AdamW,0.11561457264766292,,,9.032450470906134e-05,,,,20,,,0.0013811934233656504,,PRUNED
500,500,45.833333333333336,2025-05-25 08:26:29.313418,2025-05-25 08:26:35.900796,0 days 00:00:06.587378,AdamW,0.0006911562139726566,,,5.0363073480768174e-05,,,,28,,,0.000913367174094663,,PRUNED
501,501,47.916666666666664,2025-05-25 08:26:35.937931,2025-05-25 08:26:48.044920,0 days 00:00:12.106989,AdamW,0.15290492800179856,,,0.0001627142787161949,,,,27,,,0.005003568315804705,,PRUNED
502,502,50.0,2025-05-25 08:26:48.083264,2025-05-25 08:27:00.254990,0 days 00:00:12.171726,AdamW,0.017635911334417,,,5.840214106393649e-05,,,,24,,,0.0025529352703351892,,PRUNED
503,503,41.666666666666664,2025-05-25 08:27:00.292662,2025-05-25 08:27:12.416249,0 days 00:00:12.123587,AdamW,0.10366997579532403,,,8.121452530868645e-05,,,,29,,,0.0007846640503885612,,PRUNED
504,504,72.91666666666667,2025-05-25 08:27:12.454259,2025-05-25 08:27:30.679870,0 days 00:00:18.225611,AdamW,0.07826930777531575,,,0.00011303217781056166,,,,5,,,0.0010162562357467616,,COMPLETE
505,505,33.333333333333336,2025-05-25 08:27:30.735201,2025-05-25 08:27:42.860613,0 days 00:00:12.125412,AdamW,0.0722434040020539,,,0.00012953321643148063,,,,7,,,0.0012354353517331086,,PRUNED
506,506,39.583333333333336,2025-05-25 08:27:42.898501,2025-05-25 08:27:55.185945,0 days 00:00:12.287444,AdamW,0.08017630669684701,,,0.00020504797139343493,,,,11,,,0.0010313450089004664,,PRUNED
507,507,33.333333333333336,2025-05-25 08:27:55.223695,2025-05-25 08:28:07.337679,0 days 00:00:12.113984,AdamW,0.0714769200621916,,,0.00011230250028763789,,,,10,,,0.0018020568972635287,,PRUNED
508,508,33.333333333333336,2025-05-25 08:28:07.376556,2025-05-25 08:28:19.601223,0 days 00:00:12.224667,AdamW,0.0842587734617834,,,0.0001521607702500926,,,,8,,,0.00027488823089312877,,PRUNED
509,509,37.5,2025-05-25 08:28:19.639269,2025-05-25 08:28:31.772530,0 days 00:00:12.133261,AdamW,0.09934708450249399,,,0.00010456670470038027,,,,22,,,0.0010127688854359195,,PRUNED
510,510,,2025-05-25 08:28:31.811163,2025-05-25 08:28:43.165801,0 days 00:00:11.354638,SGD,0.062450205111829665,,,,0.002014596125728708,76.70980288516385,True,18,,,,9.677032050769569,PRUNED
511,511,33.333333333333336,2025-05-25 08:28:43.205393,2025-05-25 08:28:55.334378,0 days 00:00:12.128985,Adadelta,0.08062585611559554,0.49602788845193513,,,,,,31,0.22533794741880017,,,,PRUNED
512,512,39.583333333333336,2025-05-25 08:28:55.373414,2025-05-25 08:29:07.550124,0 days 00:00:12.176710,AdamW,0.08953956582962323,,,0.00018197387553010717,,,,30,,,0.007516202134140526,,PRUNED
513,513,52.083333333333336,2025-05-25 08:29:07.588761,2025-05-25 08:29:19.672339,0 days 00:00:12.083578,AdamW,0.12417099545815385,,,2.7339614531483982e-05,,,,15,,,0.00013573854795142557,,PRUNED
514,514,33.333333333333336,2025-05-25 08:29:19.710512,2025-05-25 08:29:31.911684,0 days 00:00:12.201172,AdamW,0.06312353582719915,,,9.402359415975298e-05,,,,16,,,0.001140723175118328,,PRUNED
515,515,41.666666666666664,2025-05-25 08:29:31.949082,2025-05-25 08:29:44.219386,0 days 00:00:12.270304,AdamW,0.3044447041395898,,,0.00013385151671550512,,,,4,,,0.0009621361406454866,,PRUNED
516,516,35.416666666666664,2025-05-25 08:29:44.257259,2025-05-25 08:29:56.474829,0 days 00:00:12.217570,AdamW,0.05226080636078691,,,0.00011260703929341646,,,,17,,,0.005749826547809715,,PRUNED
517,517,54.166666666666664,2025-05-25 08:29:56.514919,2025-05-25 08:30:14.328509,0 days 00:00:17.813590,AdamW,0.011987781679828197,,,0.00015453937816702133,,,,30,,,0.0006525777293540095,,COMPLETE
518,518,43.75,2025-05-25 08:30:14.384216,2025-05-25 08:30:26.505381,0 days 00:00:12.121165,AdamW,0.050079529395681256,,,8.925082140028515e-05,,,,26,,,0.0015488235879456953,,PRUNED
519,519,37.5,2025-05-25 08:30:26.543324,2025-05-25 08:30:38.760483,0 days 00:00:12.217159,AdamW,0.007127869800359495,,,0.0001274839968125813,,,,21,,,0.003077808543955323,,PRUNED
520,520,47.916666666666664,2025-05-25 08:30:38.799007,2025-05-25 08:30:50.879267,0 days 00:00:12.080260,AdamW,0.0003025391375409395,,,7.553918769788784e-05,,,,25,,,0.0012890481532344114,,PRUNED
521,521,60.416666666666664,2025-05-25 08:30:50.918700,2025-05-25 08:31:09.245082,0 days 00:00:18.326382,AdamW,0.02190985803353472,,,4.266384109107837e-05,,,,0,,,0.00010907543959056635,,COMPLETE
522,522,33.333333333333336,2025-05-25 08:31:09.300546,2025-05-25 08:31:21.458447,0 days 00:00:12.157901,Adam,0.07341852258245708,,9.586686550616953e-05,,,,,4,,0.3296812854147142,,,PRUNED
523,523,35.416666666666664,2025-05-25 08:31:21.510031,2025-05-25 08:31:28.660492,0 days 00:00:07.150461,AdamW,0.03576862101865587,,,0.00010239274568668227,,,,5,,,0.002257012409782457,,PRUNED
524,524,54.166666666666664,2025-05-25 08:31:28.688098,2025-05-25 08:31:41.586252,0 days 00:00:12.898154,AdamW,0.01745100171892636,,,7.726549715762118e-05,,,,31,,,0.0010996641564655282,,PRUNED
525,525,50.0,2025-05-25 08:31:41.624556,2025-05-25 08:31:51.975492,0 days 00:00:10.350936,AdamW,0.05696312770947632,,,2.344724006823578e-05,,,,24,,,0.0006977493482859093,,PRUNED
526,526,45.833333333333336,2025-05-25 08:31:52.003855,2025-05-25 08:31:56.545994,0 days 00:00:04.542139,AdamW,0.026435945808940896,,,3.4752450610844294e-05,,,,12,,,0.00048472935702396805,,PRUNED
527,527,50.0,2025-05-25 08:31:56.572520,2025-05-25 08:32:07.166764,0 days 00:00:10.594244,AdamW,0.04165119698753785,,,0.0001449145922129438,,,,30,,,0.000859791665337588,,PRUNED
528,528,41.666666666666664,2025-05-25 08:32:07.204965,2025-05-25 08:32:19.357450,0 days 00:00:12.152485,AdamW,0.3384701809469965,,,0.0001804726827514211,,,,3,,,0.0007837327397993871,,PRUNED
529,529,52.083333333333336,2025-05-25 08:32:19.396847,2025-05-25 08:32:33.745925,0 days 00:00:14.349078,AdamW,0.09059153151998109,,,6.302722561847519e-05,,,,31,,,0.00019515730020735775,,PRUNED
530,530,47.916666666666664,2025-05-25 08:32:33.785936,2025-05-25 08:32:45.830218,0 days 00:00:12.044282,AdamW,1.6467241908117713e-05,,,0.00010051599714932628,,,,29,,,0.0006068280429720061,,PRUNED
531,531,50.0,2025-05-25 08:32:45.869152,2025-05-25 08:32:58.124487,0 days 00:00:12.255335,AdamW,0.0139830080110229,,,0.00011951709793662108,,,,27,,,0.0009621913732176333,,PRUNED
532,532,45.833333333333336,2025-05-25 08:32:58.163047,2025-05-25 08:33:10.225245,0 days 00:00:12.062198,AdamW,0.1097408814141899,,,8.52163338722517e-05,,,,31,,,0.0010881718723122712,,PRUNED
533,533,52.083333333333336,2025-05-25 08:33:10.264922,2025-05-25 08:33:22.519966,0 days 00:00:12.255044,AdamW,0.030236092682008206,,,5.084022722594543e-05,,,,29,,,0.0008432997662857941,,PRUNED
534,534,33.333333333333336,2025-05-25 08:33:22.558639,2025-05-25 08:33:34.613733,0 days 00:00:12.055094,Adadelta,0.04553441034593815,0.14220865941634842,,,,,,30,1.1724005971769698,,,,PRUNED
535,535,,2025-05-25 08:33:34.651859,2025-05-25 08:33:46.188270,0 days 00:00:11.536411,SGD,0.010091407733647896,,,,0.0005788044823625374,44.289317739380664,False,31,,,,47.16106555326323,PRUNED
536,536,39.583333333333336,2025-05-25 08:33:46.227791,2025-05-25 08:33:58.435926,0 days 00:00:12.208135,AdamW,0.020110916316719442,,,7.24713937354445e-05,,,,25,,,0.0011877853702450597,,PRUNED
537,537,43.75,2025-05-25 08:33:58.474135,2025-05-25 08:34:10.580402,0 days 00:00:12.106267,AdamW,0.06049130469381275,,,0.0002248973206387029,,,,30,,,0.001017306589405875,,PRUNED
538,538,39.583333333333336,2025-05-25 08:34:10.619426,2025-05-25 08:34:22.863522,0 days 00:00:12.244096,AdamW,0.038288102566703924,,,1.732922670948965e-05,,,,6,,,0.0006910073059215527,,PRUNED
539,539,52.083333333333336,2025-05-25 08:34:22.903438,2025-05-25 08:34:34.961058,0 days 00:00:12.057620,AdamW,0.2560825708708622,,,5.961252944526742e-05,,,,27,,,0.004637024517630391,,PRUNED
540,540,47.916666666666664,2025-05-25 08:34:34.999924,2025-05-25 08:34:47.116905,0 days 00:00:12.116981,AdamW,0.027301085535043415,,,0.00012192740106988932,,,,26,,,0.00016170635800913022,,PRUNED
541,541,47.916666666666664,2025-05-25 08:34:47.155545,2025-05-25 08:34:59.283181,0 days 00:00:12.127636,AdamW,0.009046396234381221,,,9.20887852378443e-05,,,,28,,,0.001970805474099133,,PRUNED
542,542,41.666666666666664,2025-05-25 08:34:59.323185,2025-05-25 08:35:11.443516,0 days 00:00:12.120331,AdamW,0.07684497770304922,,,0.000148963468047205,,,,13,,,0.0007620281155612553,,PRUNED
543,543,33.333333333333336,2025-05-25 08:35:11.482632,2025-05-25 08:35:23.595616,0 days 00:00:12.112984,AdamW,0.01805771210659821,,,4.292020109465742e-05,,,,31,,,0.0008992797637593511,,PRUNED
544,544,60.416666666666664,2025-05-25 08:35:23.634345,2025-05-25 08:35:41.394354,0 days 00:00:17.760009,AdamW,0.0003099807609535379,,,0.010716109262896326,,,,30,,,0.0009302067346654229,,COMPLETE
545,545,60.416666666666664,2025-05-25 08:35:41.450636,2025-05-25 08:35:59.240335,0 days 00:00:17.789699,AdamW,0.16666933885135918,,,0.00010488894241811154,,,,29,,,0.0014079835387806037,,COMPLETE
546,546,52.083333333333336,2025-05-25 08:35:59.295760,2025-05-25 08:36:11.482183,0 days 00:00:12.186423,AdamW,0.05089148377887796,,,6.795093831739402e-05,,,,26,,,0.0008269439360328327,,PRUNED
547,547,33.333333333333336,2025-05-25 08:36:11.525270,2025-05-25 08:36:23.694254,0 days 00:00:12.168984,Adam,0.40847565106886696,,0.012905273231847125,,,,,28,,45.17889428084873,,,PRUNED
548,548,39.583333333333336,2025-05-25 08:36:23.734028,2025-05-25 08:36:35.868524,0 days 00:00:12.134496,AdamW,0.14379084130569394,,,0.00017795451439992535,,,,27,,,0.0010364882407179067,,PRUNED
549,549,45.833333333333336,2025-05-25 08:36:35.906728,2025-05-25 08:36:47.878432,0 days 00:00:11.971704,AdamW,0.06799441326146538,,,2.8613455231340734e-05,,,,1,,,0.0007408613143592883,,PRUNED
550,550,47.916666666666664,2025-05-25 08:36:47.915497,2025-05-25 08:36:53.228412,0 days 00:00:05.312915,AdamW,0.46981172935345367,,,8.279038034555903e-05,,,,29,,,0.0012118343726180438,,PRUNED
551,551,41.666666666666664,2025-05-25 08:36:53.266499,2025-05-25 08:37:05.380319,0 days 00:00:12.113820,AdamW,0.0343520859874856,,,5.5384311948833474e-05,,,,2,,,0.0024022896293117444,,PRUNED
552,552,39.583333333333336,2025-05-25 08:37:05.418975,2025-05-25 08:37:16.999796,0 days 00:00:11.580821,AdamW,0.016236186746038835,,,1.978701206666502e-05,,,,30,,,0.0006590457139446974,,PRUNED
553,553,43.75,2025-05-25 08:37:17.028033,2025-05-25 08:37:20.808394,0 days 00:00:03.780361,AdamW,0.23303792932733433,,,0.00012342947920718325,,,,31,,,0.0034831538383236762,,PRUNED
554,554,37.5,2025-05-25 08:37:20.836310,2025-05-25 08:37:33.155839,0 days 00:00:12.319529,AdamW,0.12925769702904752,,,9.849333127648752e-05,,,,30,,,0.00012105513262742148,,PRUNED
555,555,41.666666666666664,2025-05-25 08:37:33.194968,2025-05-25 08:37:45.284900,0 days 00:00:12.089932,AdamW,0.024495981085613263,,,1.2331572963690415e-05,,,,25,,,0.0005631722999158511,,PRUNED
556,556,43.75,2025-05-25 08:37:45.323684,2025-05-25 08:37:57.619785,0 days 00:00:12.296101,Adadelta,0.008910852580180213,0.013857177776044987,,,,,,28,36.11713368530487,,,,PRUNED
557,557,33.333333333333336,2025-05-25 08:37:57.658496,2025-05-25 08:38:09.770387,0 days 00:00:12.111891,AdamW,0.045584161474357204,,,7.31701890285704e-05,,,,9,,,0.0008879702246300391,,PRUNED
558,558,52.083333333333336,2025-05-25 08:38:09.809431,2025-05-25 08:38:22.121024,0 days 00:00:12.311593,AdamW,0.03167673055144363,,,4.648095376818831e-05,,,,31,,,0.0009672362979298546,,PRUNED
559,559,37.5,2025-05-25 08:38:22.160009,2025-05-25 08:38:34.234168,0 days 00:00:12.074159,AdamW,0.016222604614766302,,,0.0001551545210279515,,,,26,,,0.0028080784301895327,,PRUNED
560,560,,2025-05-25 08:38:34.273195,2025-05-25 08:38:45.870505,0 days 00:00:11.597310,SGD,0.008258198614705978,,,,0.006149618260083309,12.145211309456506,True,29,,,,0.020341503921108096,PRUNED
561,561,33.333333333333336,2025-05-25 08:38:45.911426,2025-05-25 08:38:58.079863,0 days 00:00:12.168437,AdamW,0.039647827074029876,,,0.0014371677467819245,,,,21,,,0.0008019637120859841,,PRUNED
562,562,52.083333333333336,2025-05-25 08:38:58.118277,2025-05-25 08:39:10.296115,0 days 00:00:12.177838,AdamW,0.05996715915885408,,,3.615978868423273e-05,,,,30,,,0.0011019716034106992,,PRUNED
563,563,47.916666666666664,2025-05-25 08:39:10.337356,2025-05-25 08:39:22.460400,0 days 00:00:12.123044,AdamW,0.021467477273378575,,,6.16587179110522e-05,,,,27,,,0.0013563685717527538,,PRUNED
564,564,56.25,2025-05-25 08:39:22.499453,2025-05-25 08:39:40.266163,0 days 00:00:17.766710,AdamW,0.09673222322332509,,,8.180499668137535e-05,,,,31,,,0.0007542463751812864,,COMPLETE
565,565,52.083333333333336,2025-05-25 08:39:40.325839,2025-05-25 08:39:58.102937,0 days 00:00:17.777098,AdamW,0.03370172251462183,,,0.0001346109775669508,,,,29,,,0.0008526722929227958,,COMPLETE
566,566,52.083333333333336,2025-05-25 08:39:58.160107,2025-05-25 08:40:12.437145,0 days 00:00:14.277038,AdamW,0.45651520717813654,,,0.00010803352361966884,,,,30,,,0.0009753692637968266,,PRUNED
567,567,50.0,2025-05-25 08:40:12.477321,2025-05-25 08:40:24.669632,0 days 00:00:12.192311,AdamW,0.0002199729887186995,,,1.4584368253305202e-05,,,,28,,,0.0016428986295295982,,PRUNED
568,568,41.666666666666664,2025-05-25 08:40:24.708638,2025-05-25 08:40:36.792609,0 days 00:00:12.083971,AdamW,0.025600885566746327,,,9.176133598861835e-05,,,,24,,,0.0021238235155793114,,PRUNED
569,569,37.5,2025-05-25 08:40:36.832113,2025-05-25 08:40:48.983362,0 days 00:00:12.151249,AdamW,0.04886154452776382,,,5.425186478012903e-05,,,,23,,,0.001267343124705192,,PRUNED
570,570,45.833333333333336,2025-05-25 08:40:49.022645,2025-05-25 08:41:01.162369,0 days 00:00:12.139724,Adam,0.010061096980007418,,2.1260240782163088e-05,,,,,28,,0.08448134280020933,,,PRUNED
