,number,value,datetime_start,datetime_complete,duration,params_algorithm,params_dropout_rate,params_lr_Adadelta,params_lr_Adam,params_lr_AdamW,params_lr_SGD,params_momentum_SGD,params_nesterov_SGD,params_suggested_freeze,params_weight_decay_Adadelta,params_weight_decay_Adam,params_weight_decay_AdamW,params_weight_decay_SGD,state
466,466,43.75,2025-05-24 17:58:34.894767,2025-05-24 17:58:48.034620,0 days 00:00:13.139853,Adam,0.20476039737164065,,4.295775252321456e-05,,,,,27,,0.8434763438719136,,,PRUNED
467,467,33.333333333333336,2025-05-24 17:58:48.073383,2025-05-24 17:59:01.673158,0 days 00:00:13.599775,Adadelta,0.194185725752301,5.902961133301343,,,,,,29,84.99527203951907,,,,PRUNED
468,468,64.58333333333333,2025-05-24 17:59:01.710898,2025-05-24 17:59:19.529703,0 days 00:00:17.818805,Adam,0.24661024722680772,,8.188458423554927e-05,,,,,22,,0.012646385823498871,,,COMPLETE
469,469,50.0,2025-05-24 17:59:19.585038,2025-05-24 17:59:33.355039,0 days 00:00:13.770001,Adam,0.24415840066119948,,7.44504313327222e-05,,,,,22,,0.010966703366464374,,,PRUNED
470,470,60.416666666666664,2025-05-24 17:59:33.401264,2025-05-24 17:59:53.843629,0 days 00:00:20.442365,Adam,0.2564961859678435,,5.370289351588513e-05,,,,,23,,0.011852495780758794,,,COMPLETE
471,471,43.75,2025-05-24 17:59:53.898784,2025-05-24 18:00:06.051139,0 days 00:00:12.152355,Adam,0.2547835633855345,,5.5690646340929526e-05,,,,,23,,0.011749242013040728,,,PRUNED
472,472,33.333333333333336,2025-05-24 18:00:06.088570,2025-05-24 18:00:19.623471,0 days 00:00:13.534901,Adam,0.26634543524764526,,0.001559179320333773,,,,,22,,0.012864633915792786,,,PRUNED
473,473,58.333333333333336,2025-05-24 18:00:19.660885,2025-05-24 18:00:39.622806,0 days 00:00:19.961921,AdamW,0.25306953379811287,,,3.0772237735626835e-05,,,,23,,,0.00013293423264419617,,COMPLETE
474,474,35.416666666666664,2025-05-24 18:00:40.504488,2025-05-24 18:00:48.740725,0 days 00:00:08.236237,Adam,0.2704796590005513,,8.720516068275312e-05,,,,,23,,0.01461251376836087,,,PRUNED
475,475,52.083333333333336,2025-05-24 18:00:48.767750,2025-05-24 18:01:01.630361,0 days 00:00:12.862611,Adam,0.2557491419410383,,6.038913216797281e-05,,,,,24,,0.010844030766587283,,,COMPLETE
476,476,47.916666666666664,2025-05-24 18:01:01.681462,2025-05-24 18:01:09.626280,0 days 00:00:07.944818,Adam,0.24345763840897744,,0.00010685467276462488,,,,,22,,0.014590326039496343,,,PRUNED
477,477,39.583333333333336,2025-05-24 18:01:09.665793,2025-05-24 18:01:14.504224,0 days 00:00:04.838431,Adam,0.23548195707682829,,0.00014631252292390205,,,,,22,,0.010136638287099346,,,PRUNED
478,478,41.666666666666664,2025-05-24 18:01:14.532007,2025-05-24 18:01:20.978799,0 days 00:00:06.446792,Adam,0.24870737686800565,,4.805014964306112e-05,,,,,21,,0.01665650901407884,,,PRUNED
479,479,54.166666666666664,2025-05-24 18:01:21.016148,2025-05-24 18:01:39.083469,0 days 00:00:18.067321,Adam,0.28031777488734294,,3.812021507204589e-05,,,,,23,,0.013396147235607496,,,COMPLETE
480,480,47.916666666666664,2025-05-24 18:01:39.783804,2025-05-24 18:01:54.856543,0 days 00:00:15.072739,Adam,0.2350762422296122,,7.189714041435153e-05,,,,,24,,0.012379455708541888,,,PRUNED
481,481,39.583333333333336,2025-05-24 18:01:54.894257,2025-05-24 18:02:07.124693,0 days 00:00:12.230436,Adam,0.24450673513839088,,8.41605655654888e-05,,,,,22,,0.017540741959973814,,,PRUNED
482,482,33.333333333333336,2025-05-24 18:02:07.164366,2025-05-24 18:02:22.526960,0 days 00:00:15.362594,Adam,0.2586329028605054,,0.00025513551879184453,,,,,24,,0.015557838823683213,,,PRUNED
483,483,60.416666666666664,2025-05-24 18:02:22.567615,2025-05-24 18:02:45.723872,0 days 00:00:23.156257,Adam,0.22797378442557664,,6.472984141420445e-05,,,,,23,,0.020730368443898046,,,COMPLETE
484,484,,2025-05-24 18:02:46.686501,2025-05-24 18:02:59.979014,0 days 00:00:13.292513,SGD,0.26868865284037774,,,,0.0016390456677542668,99.85436684954014,True,24,,,,0.027528585249743644,PRUNED
485,485,47.916666666666664,2025-05-24 18:03:00.019200,2025-05-24 18:03:14.853578,0 days 00:00:14.834378,Adam,0.2203211716269815,,0.00012806629207063014,,,,,24,,0.011397167728101098,,,PRUNED
486,486,33.333333333333336,2025-05-24 18:03:15.914793,2025-05-24 18:03:30.779642,0 days 00:00:14.864849,AdamW,0.236529154954822,,,1.1887912359425187e-05,,,,21,,,0.000785373757627528,,PRUNED
487,487,37.5,2025-05-24 18:03:30.817138,2025-05-24 18:03:44.634370,0 days 00:00:13.817232,Adam,0.1306883913494955,,5.1597381969952955e-05,,,,,22,,0.01286014560568681,,,PRUNED
488,488,33.333333333333336,2025-05-24 18:03:45.532569,2025-05-24 18:04:04.181478,0 days 00:00:18.648909,Adadelta,0.21034934602256453,0.11706724883673612,,,,,,23,0.40798043896416186,,,,PRUNED
489,489,31.25,2025-05-24 18:04:05.508078,2025-05-24 18:04:22.177115,0 days 00:00:16.669037,Adam,0.17094264112470103,,2.7020121340784255e-05,,,,,4,,0.01873456934194804,,,PRUNED
490,490,39.583333333333336,2025-05-24 18:04:23.017903,2025-05-24 18:04:29.782218,0 days 00:00:06.764315,Adam,0.18537516268672483,,8.73431100225474e-05,,,,,30,,0.010238192744545396,,,PRUNED
491,491,43.75,2025-05-24 18:04:29.820724,2025-05-24 18:04:40.692628,0 days 00:00:10.871904,Adam,0.21851905022604626,,7.042976822849319e-05,,,,,25,,1.2165865380610945,,,PRUNED
492,492,33.333333333333336,2025-05-24 18:04:40.721596,2025-05-24 18:04:48.029327,0 days 00:00:07.307731,Adam,0.15557037152469072,,0.00010512375080139553,,,,,1,,0.015369226618523963,,,PRUNED
493,493,33.333333333333336,2025-05-24 18:04:48.057540,2025-05-24 18:04:56.303591,0 days 00:00:08.246051,Adam,0.2493025556578886,,4.384844245743563e-05,,,,,24,,0.023576361420529303,,,PRUNED
494,494,37.5,2025-05-24 18:04:57.263106,2025-05-24 18:05:11.833867,0 days 00:00:14.570761,Adam,0.26360210791122457,,0.0001707104784810448,,,,,23,,0.01933015843836222,,,PRUNED
495,495,50.0,2025-05-24 18:05:11.876143,2025-05-24 18:05:27.397287,0 days 00:00:15.521144,Adam,0.196644562401184,,5.8431499390914564e-05,,,,,21,,0.01488677767594097,,,PRUNED
496,496,47.916666666666664,2025-05-24 18:05:27.516715,2025-05-24 18:05:39.709371,0 days 00:00:12.192656,Adam,0.22813822150778745,,3.385485054755598e-05,,,,,28,,0.012577614858107395,,,PRUNED
497,497,37.5,2025-05-24 18:05:39.747737,2025-05-24 18:05:52.427639,0 days 00:00:12.679902,Adam,0.1836649882334105,,0.00010018574066169089,,,,,22,,0.13252612254879223,,,PRUNED
498,498,39.583333333333336,2025-05-24 18:05:52.465763,2025-05-24 18:06:04.545004,0 days 00:00:12.079241,Adam,0.29386399147416603,,5.382907792372639e-05,,,,,14,,0.6727135308073215,,,PRUNED
499,499,52.083333333333336,2025-05-24 18:06:04.583604,2025-05-24 18:06:20.087727,0 days 00:00:15.504123,AdamW,0.21334030295854944,,,9.053976916308622e-05,,,,25,,,0.007628361928602076,,PRUNED
500,500,60.416666666666664,2025-05-24 18:06:20.127363,2025-05-24 18:06:38.058606,0 days 00:00:17.931243,Adam,0.1724552029610039,,7.708435892857246e-05,,,,,27,,0.03184755640729395,,,COMPLETE
501,501,33.333333333333336,2025-05-24 18:06:38.116355,2025-05-24 18:06:52.255694,0 days 00:00:14.139339,Adam,0.2042049185514459,,0.00012007963334918585,,,,,23,,0.16910182729452003,,,PRUNED
502,502,43.75,2025-05-24 18:06:52.294034,2025-05-24 18:07:05.612963,0 days 00:00:13.318929,Adam,0.18502161455138688,,6.551304288215922e-05,,,,,29,,0.025121575408626137,,,PRUNED
503,503,45.833333333333336,2025-05-24 18:07:05.653885,2025-05-24 18:07:19.440222,0 days 00:00:13.786337,Adam,0.16246699480399773,,4.210090031611364e-05,,,,,28,,0.017137967859009923,,,PRUNED
504,504,62.5,2025-05-24 18:07:19.478939,2025-05-24 18:07:42.868183,0 days 00:00:23.389244,Adam,0.19501036812536987,,9.781834118088665e-05,,,,,26,,0.010041118121994553,,,COMPLETE
505,505,39.583333333333336,2025-05-24 18:07:43.843066,2025-05-24 18:07:52.883042,0 days 00:00:09.039976,Adam,0.19889205719865063,,0.00014573140967633262,,,,,26,,0.02791297798992401,,,PRUNED
506,506,45.833333333333336,2025-05-24 18:07:53.751251,2025-05-24 18:08:00.992926,0 days 00:00:07.241675,Adam,0.1923026199634771,,9.95722866419415e-05,,,,,26,,0.010465289673118092,,,PRUNED
507,507,33.333333333333336,2025-05-24 18:08:01.029176,2025-05-24 18:08:12.331433,0 days 00:00:11.302257,Adam,0.20650049096474718,,0.0001223061258796271,,,,,26,,0.21251755557149246,,,PRUNED
508,508,,2025-05-24 18:08:13.272219,2025-05-24 18:08:20.046890,0 days 00:00:06.774671,SGD,0.1886773203540085,,,,0.09097399006786012,78.92815945887659,False,25,,,,0.5365092731325486,PRUNED
509,509,33.333333333333336,2025-05-24 18:08:20.075522,2025-05-24 18:08:32.740924,0 days 00:00:12.665402,Adam,0.17960203516953174,,8.9853153337471e-05,,,,,26,,0.021618805065047673,,,PRUNED
510,510,56.25,2025-05-24 18:08:33.621761,2025-05-24 18:08:54.635386,0 days 00:00:21.013625,Adam,0.14605237008774727,,8.161060855624056e-05,,,,,27,,0.03809187969414616,,,COMPLETE
511,511,35.416666666666664,2025-05-24 18:08:55.713049,2025-05-24 18:09:09.623715,0 days 00:00:13.910666,Adadelta,0.2133771618779676,0.04275893159307216,,,,,,27,1.9190831103205455,,,,PRUNED
512,512,45.833333333333336,2025-05-24 18:09:09.661690,2025-05-24 18:09:25.350098,0 days 00:00:15.688408,Adam,0.19482771632667636,,0.00011081816720858228,,,,,27,,0.3000640270069844,,,PRUNED
513,513,39.583333333333336,2025-05-24 18:09:26.543103,2025-05-24 18:09:44.083989,0 days 00:00:17.540886,Adam,0.1708167637055057,,0.00019080313617917993,,,,,25,,0.013144508782099587,,,PRUNED
514,514,33.333333333333336,2025-05-24 18:09:44.960126,2025-05-24 18:10:00.343925,0 days 00:00:15.383799,AdamW,0.2021514984594105,,,0.001668774106661549,,,,26,,,0.00106208795513059,,PRUNED
515,515,43.75,2025-05-24 18:10:00.384779,2025-05-24 18:10:16.084403,0 days 00:00:15.699624,Adam,0.17788029063828664,,0.00014647456337534817,,,,,27,,0.010068186761946707,,,PRUNED
516,516,35.416666666666664,2025-05-24 18:10:17.044116,2025-05-24 18:10:35.289967,0 days 00:00:18.245851,Adam,0.3065500328750065,,7.553321523181002e-05,,,,,28,,0.5065150537228332,,,PRUNED
517,517,41.666666666666664,2025-05-24 18:10:36.366778,2025-05-24 18:10:52.528441,0 days 00:00:16.161663,Adam,0.19348426614123818,,9.73908581795615e-05,,,,,15,,0.031703326484687995,,,PRUNED
518,518,39.583333333333336,2025-05-24 18:10:53.526636,2025-05-24 18:11:10.006448,0 days 00:00:16.479812,Adam,0.22224447931722285,,6.571850929260354e-05,,,,,29,,0.015029980470455902,,,PRUNED
519,519,33.333333333333336,2025-05-24 18:11:11.130214,2025-05-24 18:11:22.411173,0 days 00:00:11.280959,Adam,0.210387014737599,,0.023790864027020315,,,,,26,,0.39158880701955573,,,PRUNED
520,520,45.833333333333336,2025-05-24 18:11:23.390355,2025-05-24 18:11:32.950141,0 days 00:00:09.559786,Adam,0.18715028784378085,,8.387957668372462e-05,,,,,28,,0.590073049946206,,,PRUNED
521,521,50.0,2025-05-24 18:11:34.364282,2025-05-24 18:11:45.718893,0 days 00:00:11.354611,Adam,0.16496913210594355,,0.00012033609467524333,,,,,30,,0.01977147961356515,,,PRUNED
522,522,54.166666666666664,2025-05-24 18:11:45.747196,2025-05-24 18:11:55.438438,0 days 00:00:09.691242,Adam,0.2008692467027306,,9.50165740780524e-05,,,,,25,,0.027432470611368682,,,COMPLETE
523,523,29.166666666666668,2025-05-24 18:11:55.495155,2025-05-24 18:12:08.246933,0 days 00:00:12.751778,Adam,0.22668811170225334,,6.982304986446107e-05,,,,,27,,9.233015804545142,,,PRUNED
524,524,33.333333333333336,2025-05-24 18:12:08.288801,2025-05-24 18:12:20.370770,0 days 00:00:12.081969,Adam,0.17469708129566142,,0.0006556130095503885,,,,,28,,0.03747832234100518,,,PRUNED
525,525,54.166666666666664,2025-05-24 18:12:20.409879,2025-05-24 18:12:38.178361,0 days 00:00:17.768482,Adam,0.20979783040408861,,0.00013601213118894257,,,,,29,,0.01282430394267487,,,PRUNED
526,526,33.333333333333336,2025-05-24 18:12:38.219786,2025-05-24 18:12:52.790433,0 days 00:00:14.570647,AdamW,0.18558632283334064,,,0.00013599816392562643,,,,28,,,0.0014808613973229074,,PRUNED
527,527,33.333333333333336,2025-05-24 18:12:53.766251,2025-05-24 18:13:10.963606,0 days 00:00:17.197355,Adam,0.21747883398544604,,0.0004327311276022412,,,,,26,,0.024180689433617134,,,PRUNED
528,528,45.833333333333336,2025-05-24 18:13:11.834183,2025-05-24 18:13:27.141958,0 days 00:00:15.307775,Adam,0.19615427777566527,,6.0366205422221935e-05,,,,,31,,0.016756792364980823,,,PRUNED
529,529,41.666666666666664,2025-05-24 18:13:27.180611,2025-05-24 18:13:41.586664,0 days 00:00:14.406053,Adam,0.15727324248794997,,4.748525466434235e-05,,,,,27,,0.41042522376812846,,,PRUNED
530,530,52.083333333333336,2025-05-24 18:13:42.133939,2025-05-24 18:13:59.981778,0 days 00:00:17.847839,Adam,0.17742118375015647,,8.127034216867985e-05,,,,,25,,0.030617431386218953,,,COMPLETE
531,531,43.75,2025-05-24 18:14:00.041825,2025-05-24 18:14:12.109452,0 days 00:00:12.067627,Adam,0.23547279476306762,,0.00011363455454130673,,,,,27,,0.3193269341208266,,,PRUNED
532,532,50.0,2025-05-24 18:14:12.149495,2025-05-24 18:14:29.124685,0 days 00:00:16.975190,Adam,0.2053087211082798,,3.1362254034835684e-05,,,,,16,,0.25864149234332084,,,PRUNED
533,533,,2025-05-24 18:14:30.266961,2025-05-24 18:14:45.322929,0 days 00:00:15.055968,SGD,0.19559652782411732,,,,0.006724679331168646,89.9217049938888,False,28,,,,0.17820221500508335,PRUNED
534,534,41.666666666666664,2025-05-24 18:14:45.361786,2025-05-24 18:14:57.133399,0 days 00:00:11.771613,Adam,0.18611415593333935,,7.094261171484428e-05,,,,,29,,0.010001865965154302,,,PRUNED
535,535,47.916666666666664,2025-05-24 18:14:58.931171,2025-05-24 18:15:04.273427,0 days 00:00:05.342256,Adam,0.2165657592030623,,9.669139129902149e-05,,,,,30,,0.01990471522987662,,,PRUNED
536,536,33.333333333333336,2025-05-24 18:15:04.302036,2025-05-24 18:15:10.767865,0 days 00:00:06.465829,Adadelta,0.16602868957251934,43.730900672650506,,,,,,29,3.883016602188173,,,,PRUNED
537,537,41.666666666666664,2025-05-24 18:15:10.797022,2025-05-24 18:15:15.013755,0 days 00:00:04.216733,Adam,0.22359764947713737,,0.00015920757610016358,,,,,26,,0.04152658139417962,,,PRUNED
538,538,45.833333333333336,2025-05-24 18:15:15.042259,2025-05-24 18:15:21.962249,0 days 00:00:06.919990,Adam,0.2025726049136331,,3.837731172607228e-05,,,,,28,,0.01429604553998295,,,PRUNED
539,539,58.333333333333336,2025-05-24 18:15:21.992395,2025-05-24 18:15:33.452435,0 days 00:00:11.460040,Adam,0.18191953966171567,,5.6325973032789786e-05,,,,,24,,0.012508251879458948,,,COMPLETE
540,540,33.333333333333336,2025-05-24 18:15:33.508448,2025-05-24 18:15:48.162874,0 days 00:00:14.654426,AdamW,0.31280109735500816,,,0.0006717322474498476,,,,28,,,0.00042257196856822693,,PRUNED
541,541,45.833333333333336,2025-05-24 18:15:49.150607,2025-05-24 18:16:03.887938,0 days 00:00:14.737331,Adam,0.23249512502648015,,8.147599386580942e-05,,,,,27,,0.024539165014599587,,,PRUNED
542,542,41.666666666666664,2025-05-24 18:16:03.926336,2025-05-24 18:16:17.737507,0 days 00:00:13.811171,Adam,0.19136441784810398,,5.002185693604688e-05,,,,,29,,0.017301242993805595,,,PRUNED
543,543,47.916666666666664,2025-05-24 18:16:17.776938,2025-05-24 18:16:32.884312,0 days 00:00:15.107374,Adam,0.21076840449941517,,0.00029831107295840055,,,,,25,,0.4630189076072252,,,PRUNED
544,544,37.5,2025-05-24 18:16:32.923168,2025-05-24 18:16:47.253437,0 days 00:00:14.330269,Adam,0.17538911624257775,,6.38040992744589e-05,,,,,27,,0.20114319781469991,,,PRUNED
545,545,33.333333333333336,2025-05-24 18:16:47.294373,2025-05-24 18:17:01.655412,0 days 00:00:14.361039,Adam,0.24266345275154982,,0.00010532005476633792,,,,,26,,0.1213164120341047,,,PRUNED
546,546,39.583333333333336,2025-05-24 18:17:02.711813,2025-05-24 18:17:18.457577,0 days 00:00:15.745764,Adam,0.14981981983145334,,0.00013078352531422426,,,,,29,,73.75403839378902,,,PRUNED
547,547,43.75,2025-05-24 18:17:18.496321,2025-05-24 18:17:33.465325,0 days 00:00:14.969004,Adam,0.19817678655027401,,7.700540697156089e-05,,,,,21,,0.03517307571531482,,,PRUNED
548,548,43.75,2025-05-24 18:17:33.506138,2025-05-24 18:17:47.646220,0 days 00:00:14.140082,Adam,0.18323801689407138,,9.112945420374532e-05,,,,,20,,0.022421906470850673,,,PRUNED
549,549,43.75,2025-05-24 18:17:47.685049,2025-05-24 18:18:00.875005,0 days 00:00:13.189956,Adam,0.16773657920041657,,4.789904399747946e-05,,,,,17,,0.028586541372921954,,,PRUNED
550,550,45.833333333333336,2025-05-24 18:18:00.913744,2025-05-24 18:18:14.729798,0 days 00:00:13.816054,Adam,0.2161742773844945,,5.8284893356429014e-05,,,,,28,,0.7654027041527036,,,PRUNED
551,551,54.166666666666664,2025-05-24 18:18:15.749890,2025-05-24 18:18:32.085023,0 days 00:00:16.335133,Adam,0.28700088934137336,,7.103504261123045e-05,,,,,30,,0.04500778257621716,,,COMPLETE
552,552,35.416666666666664,2025-05-24 18:18:33.045143,2025-05-24 18:18:41.056532,0 days 00:00:08.011389,AdamW,0.3004312357182401,,,0.0002403351755999036,,,,27,,,0.004284498890150625,,PRUNED
553,553,41.666666666666664,2025-05-24 18:18:41.086121,2025-05-24 18:18:47.731110,0 days 00:00:06.644989,Adam,0.2038038968649645,,4.005395663193741e-05,,,,,25,,0.36236625836600644,,,PRUNED
554,554,33.333333333333336,2025-05-24 18:18:47.765694,2025-05-24 18:18:57.816500,0 days 00:00:10.050806,Adam,0.22627258561015848,,0.00020413194212765722,,,,,24,,0.014353750082464284,,,PRUNED
555,555,37.5,2025-05-24 18:18:58.723535,2025-05-24 18:19:05.824808,0 days 00:00:07.101273,Adam,0.1873224487464597,,0.00010544565484207994,,,,,13,,0.011659903043093299,,,PRUNED
556,556,43.75,2025-05-24 18:19:06.644052,2025-05-24 18:19:21.414921,0 days 00:00:14.770869,Adam,0.17385648237618975,,8.535121234566865e-05,,,,,28,,0.5870005722161535,,,PRUNED
557,557,,2025-05-24 18:19:21.453858,2025-05-24 18:19:35.155117,0 days 00:00:13.701259,SGD,0.1967281366694842,,,,8.518188469051609e-05,64.68074375689974,True,26,,,,6.589557072213132,PRUNED
558,558,45.833333333333336,2025-05-24 18:19:35.194951,2025-05-24 18:19:48.672029,0 days 00:00:13.477078,Adam,0.20961733210401365,,0.0001627036500368171,,,,,24,,1.5060250543295621,,,PRUNED
559,559,45.833333333333336,2025-05-24 18:19:48.712162,2025-05-24 18:20:01.939771,0 days 00:00:13.227609,Adam,0.1566961294535737,,5.8623915435078176e-05,,,,,30,,1.8956902313101964,,,PRUNED
560,560,39.583333333333336,2025-05-24 18:20:01.978532,2025-05-24 18:20:15.175556,0 days 00:00:13.197024,Adadelta,0.19091240292265446,0.029102509777970412,,,,,,27,42.97150212120641,,,,PRUNED
561,561,50.0,2025-05-24 18:20:15.215033,2025-05-24 18:20:29.875812,0 days 00:00:14.660779,Adam,0.23732116882683016,,6.722675993127989e-05,,,,,25,,0.010005096658731064,,,PRUNED
562,562,47.916666666666664,2025-05-24 18:20:29.917637,2025-05-24 18:20:43.348436,0 days 00:00:13.430799,Adam,0.22305362879651078,,0.00012731537438992937,,,,,27,,0.017004866332210797,,,PRUNED
563,563,45.833333333333336,2025-05-24 18:20:43.387639,2025-05-24 18:20:58.139350,0 days 00:00:14.751711,Adam,0.042472532436343746,,4.85292236482217e-05,,,,,29,,0.034380541519179394,,,PRUNED
564,564,35.416666666666664,2025-05-24 18:20:58.178914,2025-05-24 18:21:11.784216,0 days 00:00:13.605302,Adam,0.18068752892587114,,9.174668172507888e-05,,,,,28,,0.022073748347883285,,,PRUNED
565,565,39.583333333333336,2025-05-24 18:21:11.823876,2025-05-24 18:21:26.849080,0 days 00:00:15.025204,Adam,0.20898514706345586,,2.998016191571343e-05,,,,,29,,0.321727104947079,,,PRUNED
566,566,41.666666666666664,2025-05-24 18:21:26.889929,2025-05-24 18:21:40.118591,0 days 00:00:13.228662,Adam,0.16480542093536632,,2.3697397587594653e-05,,,,,27,,0.1662685568891966,,,PRUNED
567,567,37.5,2025-05-24 18:21:40.157746,2025-05-24 18:21:54.162976,0 days 00:00:14.005230,AdamW,0.19438381611686423,,,0.00046206926387479236,,,,28,,,0.002891224750987308,,PRUNED
568,568,33.333333333333336,2025-05-24 18:21:54.204061,2025-05-24 18:22:07.054602,0 days 00:00:12.850541,Adam,0.20176752843405527,,0.0021281226188403814,,,,,26,,0.049898868685726676,,,PRUNED
569,569,54.166666666666664,2025-05-24 18:22:07.083841,2025-05-24 18:22:19.106709,0 days 00:00:12.022868,Adam,0.31457096683260805,,7.257824934720114e-05,,,,,28,,0.46471226409271243,,,PRUNED
570,570,31.25,2025-05-24 18:22:19.809345,2025-05-24 18:22:33.842372,0 days 00:00:14.033027,Adam,0.2174630868187734,,0.00010929448473565369,,,,,29,,20.85439033441821,,,PRUNED
571,571,37.5,2025-05-24 18:22:34.750442,2025-05-24 18:22:44.045615,0 days 00:00:09.295173,Adam,0.08507232562142614,,3.8024656929318906e-05,,,,,25,,0.01238830566234683,,,PRUNED
572,572,47.916666666666664,2025-05-24 18:22:44.085692,2025-05-24 18:22:56.288176,0 days 00:00:12.202484,Adam,0.2766834630311702,,5.7141302931964914e-05,,,,,21,,0.019051694048864597,,,PRUNED
573,573,43.75,2025-05-24 18:22:56.328902,2025-05-24 18:23:10.416517,0 days 00:00:14.087615,Adam,0.1767244580658308,,8.114159016689534e-05,,,,,19,,0.02913429051225674,,,PRUNED
574,574,33.333333333333336,2025-05-24 18:23:11.450666,2025-05-24 18:23:25.974678,0 days 00:00:14.524012,Adam,0.23025913708894732,,4.377764644415749e-05,,,,,31,,0.23153916267672262,,,PRUNED
575,575,41.666666666666664,2025-05-24 18:23:26.015329,2025-05-24 18:23:40.031877,0 days 00:00:14.016548,Adam,0.18397463442937978,,6.460843052564656e-05,,,,,17,,0.024930433699267014,,,PRUNED
576,576,37.5,2025-05-24 18:23:41.174868,2025-05-24 18:23:54.427711,0 days 00:00:13.252843,Adam,0.24252541955140758,,9.923980506611204e-05,,,,,24,,0.015068881872271258,,,PRUNED
577,577,45.833333333333336,2025-05-24 18:23:54.468057,2025-05-24 18:24:09.682587,0 days 00:00:15.214530,Adam,0.19055771345524194,,0.00013217667107089193,,,,,30,,0.2732025013425139,,,PRUNED
578,578,47.916666666666664,2025-05-24 18:24:10.649095,2025-05-24 18:24:26.261218,0 days 00:00:15.612123,Adam,0.17065119043373128,,5.1419904271538004e-05,,,,,27,,0.0394220170770991,,,PRUNED
579,579,35.416666666666664,2025-05-24 18:24:26.302325,2025-05-24 18:24:40.482503,0 days 00:00:14.180178,AdamW,0.20425016307210864,,,0.027377202109175866,,,,28,,,0.0007236175011511994,,PRUNED
580,580,33.333333333333336,2025-05-24 18:24:41.354605,2025-05-24 18:24:57.722446,0 days 00:00:16.367841,Adam,0.3232816916454146,,7.799008808170792e-05,,,,,20,,0.07568320403237554,,,PRUNED
581,581,,2025-05-24 18:24:58.579364,2025-05-24 18:25:13.275380,0 days 00:00:14.696016,SGD,0.21688811080124157,,,,2.1755007798042147e-05,8.42281725498787,True,26,,,,1.8147478451296342,PRUNED
