,number,value,datetime_start,datetime_complete,duration,params_algorithm,params_dropout_rate,params_lr_Adadelta,params_lr_Adam,params_lr_AdamW,params_lr_SGD,params_momentum_SGD,params_nesterov_SGD,params_suggested_freeze,params_weight_decay_Adadelta,params_weight_decay_Adam,params_weight_decay_AdamW,params_weight_decay_SGD,state
693,693,35.416666666666664,2025-05-25 11:19:49.860009,2025-05-25 11:19:56.023903,0 days 00:00:06.163894,AdamW,0.27847842787997107,,,3.2817053312303066e-05,,,,0,,,0.005131179821581951,,PRUNED
694,694,41.666666666666664,2025-05-25 11:19:56.065169,2025-05-25 11:20:02.130430,0 days 00:00:06.065261,AdamW,0.26986151329727176,,,6.04186781515383e-05,,,,10,,,0.0065047064194315215,,PRUNED
695,695,33.333333333333336,2025-05-25 11:20:02.171912,2025-05-25 11:20:08.293882,0 days 00:00:06.121970,AdamW,0.04819286851162001,,,0.001564028441181805,,,,1,,,0.0019783910041032806,,PRUNED
696,696,35.416666666666664,2025-05-25 11:20:08.334765,2025-05-25 11:20:14.462727,0 days 00:00:06.127962,AdamW,0.2873662098183099,,,2.1921308369143218e-05,,,,3,,,0.0031071626652863253,,PRUNED
697,697,33.333333333333336,2025-05-25 11:20:14.504150,2025-05-25 11:20:20.571078,0 days 00:00:06.066928,Adam,0.2474069349238886,,8.147453132408626e-05,,,,,11,,0.46961980039152884,,,PRUNED
698,698,37.5,2025-05-25 11:20:20.613722,2025-05-25 11:20:26.744621,0 days 00:00:06.130899,AdamW,0.263304186942942,,,2.555308619042168e-05,,,,8,,,0.0009316992731492361,,PRUNED
699,699,33.333333333333336,2025-05-25 11:20:26.785725,2025-05-25 11:20:32.943094,0 days 00:00:06.157369,AdamW,0.2961986617684571,,,0.00011761473565354028,,,,0,,,0.001758394025303417,,PRUNED
700,700,39.583333333333336,2025-05-25 11:20:32.984677,2025-05-25 11:20:39.197664,0 days 00:00:06.212987,AdamW,0.2816476843222974,,,5.050064227905581e-05,,,,1,,,0.0022042350720426233,,PRUNED
701,701,37.5,2025-05-25 11:20:39.239839,2025-05-25 11:20:45.349391,0 days 00:00:06.109552,AdamW,0.3095919558026236,,,3.0319582830867595e-05,,,,0,,,0.0024277700781177147,,PRUNED
702,702,35.416666666666664,2025-05-25 11:20:45.392170,2025-05-25 11:20:51.466951,0 days 00:00:06.074781,AdamW,0.2579497762163642,,,1.765254122840341e-05,,,,7,,,0.002832625790592495,,PRUNED
703,703,33.333333333333336,2025-05-25 11:20:51.543626,2025-05-25 11:20:57.665206,0 days 00:00:06.121580,AdamW,0.08169542442357357,,,4.035706407847536e-05,,,,11,,,0.004373978201511271,,PRUNED
704,704,33.333333333333336,2025-05-25 11:20:57.706505,2025-05-25 11:21:03.845540,0 days 00:00:06.139035,Adadelta,0.2691341382396426,15.356856680924464,,,,,,5,99.11593084243131,,,,PRUNED
705,705,35.416666666666664,2025-05-25 11:21:03.887348,2025-05-25 11:21:09.990798,0 days 00:00:06.103450,AdamW,0.3753709296919105,,,6.846063632992845e-05,,,,0,,,0.0014049693576629835,,PRUNED
706,706,35.416666666666664,2025-05-25 11:21:10.032410,2025-05-25 11:21:16.123416,0 days 00:00:06.091006,AdamW,0.2275629362122624,,,2.1065840465213392e-05,,,,1,,,0.003799285638211623,,PRUNED
707,707,33.333333333333336,2025-05-25 11:21:16.166011,2025-05-25 11:21:22.331113,0 days 00:00:06.165102,Adam,0.18724272299713304,,0.000619766717665348,,,,,4,,4.997709632007373,,,PRUNED
708,708,43.75,2025-05-25 11:21:22.372765,2025-05-25 11:21:28.484106,0 days 00:00:06.111341,AdamW,0.13855664595279435,,,1.6473078822418756e-05,,,,6,,,0.002043839385011119,,PRUNED
709,709,33.333333333333336,2025-05-25 11:21:28.526424,2025-05-25 11:21:34.630779,0 days 00:00:06.104355,AdamW,0.016653573822095803,,,1.2344405179768247e-05,,,,0,,,0.0047881502627582515,,PRUNED
710,710,31.25,2025-05-25 11:21:34.673095,2025-05-25 11:21:40.771230,0 days 00:00:06.098135,AdamW,0.27733113156267325,,,2.6689933794727515e-05,,,,4,,,0.002591527997965238,,PRUNED
711,711,,2025-05-25 11:21:40.812524,2025-05-25 11:21:46.384511,0 days 00:00:05.571987,SGD,0.2439434498239318,,,,0.00011182154003614735,8.706029837834464,False,3,,,,52.15474806318808,PRUNED
712,712,35.416666666666664,2025-05-25 11:21:46.425241,2025-05-25 11:21:52.614077,0 days 00:00:06.188836,AdamW,0.286895434513291,,,8.105060725615101e-05,,,,0,,,0.0053114805175745105,,PRUNED
713,713,31.25,2025-05-25 11:21:52.656359,2025-05-25 11:21:58.759944,0 days 00:00:06.103585,AdamW,0.3892479440641113,,,1.0249071389841085e-05,,,,2,,,0.002303584302432867,,PRUNED
714,714,39.583333333333336,2025-05-25 11:21:58.801884,2025-05-25 11:22:04.907901,0 days 00:00:06.106017,AdamW,0.02875218425166292,,,3.787123369742241e-05,,,,1,,,0.001874115202557636,,PRUNED
715,715,35.416666666666664,2025-05-25 11:22:04.948927,2025-05-25 11:22:11.030159,0 days 00:00:06.081232,AdamW,0.09768907980365582,,,0.00015625215005259384,,,,10,,,0.003466260974568055,,PRUNED
716,716,33.333333333333336,2025-05-25 11:22:11.072520,2025-05-25 11:22:17.178617,0 days 00:00:06.106097,Adam,0.009265394570893969,,0.05608424769512039,,,,,13,,0.07192123515290486,,,PRUNED
717,717,41.666666666666664,2025-05-25 11:22:17.220197,2025-05-25 11:22:23.385839,0 days 00:00:06.165642,AdamW,0.4106412380708252,,,1.4786772618473408e-05,,,,0,,,0.004011598230442674,,PRUNED
718,718,43.75,2025-05-25 11:22:23.427983,2025-05-25 11:22:29.574502,0 days 00:00:06.146519,AdamW,0.300204001764697,,,5.2750779877201495e-05,,,,11,,,0.0015750081231778864,,PRUNED
719,719,39.583333333333336,2025-05-25 11:22:29.615761,2025-05-25 11:22:35.751036,0 days 00:00:06.135275,AdamW,0.039209241848447,,,3.0378931090748267e-05,,,,5,,,0.0029229744256889607,,PRUNED
720,720,31.25,2025-05-25 11:22:35.793271,2025-05-25 11:22:41.873902,0 days 00:00:06.080631,AdamW,0.25297573950650576,,,2.2295134923714883e-05,,,,9,,,0.005676668005823578,,PRUNED
721,721,47.916666666666664,2025-05-25 11:22:41.916355,2025-05-25 11:22:53.265418,0 days 00:00:11.349063,AdamW,0.26494476783073756,,,4.309912459266569e-05,,,,0,,,0.0010871703971799733,,COMPLETE
722,722,33.333333333333336,2025-05-25 11:22:53.318914,2025-05-25 11:22:57.207915,0 days 00:00:03.889001,AdamW,0.27417021508074885,,,1.954458976978781e-05,,,,1,,,0.0021173978529835176,,PRUNED
723,723,35.416666666666664,2025-05-25 11:22:57.236828,2025-05-25 11:23:00.226547,0 days 00:00:02.989719,AdamW,0.21776782971574377,,,0.00010052704912851165,,,,0,,,0.0017043865612611946,,PRUNED
724,724,43.75,2025-05-25 11:23:00.255545,2025-05-25 11:23:03.011937,0 days 00:00:02.756392,AdamW,0.0005271695961781351,,,5.762116310815995e-05,,,,6,,,0.0025342157067082304,,PRUNED
725,725,35.416666666666664,2025-05-25 11:23:03.053617,2025-05-25 11:23:09.141245,0 days 00:00:06.087628,Adam,0.3580320209982488,,0.0004319427185720757,,,,,4,,0.8587003509888651,,,PRUNED
726,726,39.583333333333336,2025-05-25 11:23:09.184278,2025-05-25 11:23:15.288019,0 days 00:00:06.103741,AdamW,0.23687367576480423,,,1.5714288481185174e-05,,,,0,,,0.002299609215929665,,PRUNED
727,727,56.25,2025-05-25 11:23:15.329408,2025-05-25 11:23:26.203698,0 days 00:00:10.874290,AdamW,0.29534136686908435,,,3.439851171948123e-05,,,,1,,,0.004565767864820403,,COMPLETE
728,728,37.5,2025-05-25 11:23:26.244856,2025-05-25 11:23:30.081944,0 days 00:00:03.837088,AdamW,0.30977931390088903,,,3.127378076671074e-05,,,,1,,,0.004334309001386327,,PRUNED
729,729,33.333333333333336,2025-05-25 11:23:30.123480,2025-05-25 11:23:36.261129,0 days 00:00:06.137649,Adadelta,0.30270876192404683,4.476286276001673,,,,,,2,0.010895460557292529,,,,PRUNED
730,730,54.166666666666664,2025-05-25 11:23:36.302581,2025-05-25 11:23:47.666517,0 days 00:00:11.363936,AdamW,0.31959136051197196,,,3.455683876835261e-05,,,,1,,,0.004059177830160961,,COMPLETE
731,731,37.5,2025-05-25 11:23:47.725831,2025-05-25 11:23:53.921817,0 days 00:00:06.195986,AdamW,0.31134398936536056,,,2.450024840236055e-05,,,,1,,,0.004897676886832864,,PRUNED
732,732,37.5,2025-05-25 11:23:53.966033,2025-05-25 11:24:00.064393,0 days 00:00:06.098360,AdamW,0.2924203014943223,,,3.603630675813877e-05,,,,1,,,0.004734044441740617,,PRUNED
733,733,39.583333333333336,2025-05-25 11:24:00.106286,2025-05-25 11:24:06.200850,0 days 00:00:06.094564,AdamW,0.2952731978911963,,,2.8987178344769226e-05,,,,2,,,0.005456391303446078,,PRUNED
734,734,43.75,2025-05-25 11:24:06.242185,2025-05-25 11:24:12.438572,0 days 00:00:06.196387,SGD,0.30272773043930357,,,,1.1071023423749761e-05,2.0547692133571687,True,1,,,,0.021968752717338943,PRUNED
735,735,33.333333333333336,2025-05-25 11:24:12.481317,2025-05-25 11:24:18.562192,0 days 00:00:06.080875,Adam,0.28523253216890165,,0.005068074182869582,,,,,1,,0.011404952864675763,,,PRUNED
736,736,37.5,2025-05-25 11:24:18.604769,2025-05-25 11:24:24.739823,0 days 00:00:06.135054,AdamW,0.2919228248430439,,,2.5868962958705255e-05,,,,12,,,0.003632226781104595,,PRUNED
737,737,37.5,2025-05-25 11:24:24.781671,2025-05-25 11:24:30.913171,0 days 00:00:06.131500,AdamW,0.024056766337066875,,,4.2558358754804104e-05,,,,1,,,0.004490087742776364,,PRUNED
738,738,33.333333333333336,2025-05-25 11:24:30.955240,2025-05-25 11:24:37.115805,0 days 00:00:06.160565,AdamW,0.325985296452594,,,1.8899594698312784e-05,,,,8,,,0.006347923202768443,,PRUNED
739,739,35.416666666666664,2025-05-25 11:24:37.157510,2025-05-25 11:24:43.237160,0 days 00:00:06.079650,AdamW,0.3025224998599712,,,2.3088053170629042e-05,,,,11,,,0.0031400496605368347,,PRUNED
740,740,43.75,2025-05-25 11:24:43.280612,2025-05-25 11:24:49.373778,0 days 00:00:06.093166,AdamW,0.04820829966001835,,,1.344722795291676e-05,,,,2,,,0.0040357589248561955,,PRUNED
741,741,33.333333333333336,2025-05-25 11:24:49.415275,2025-05-25 11:24:55.595421,0 days 00:00:06.180146,AdamW,0.061272159486751236,,,3.445144303383729e-05,,,,10,,,0.005311736801295262,,PRUNED
742,742,43.75,2025-05-25 11:24:55.637411,2025-05-25 11:25:01.796883,0 days 00:00:06.159472,AdamW,0.40101218474997924,,,4.516564263944227e-05,,,,4,,,0.004731913103830084,,PRUNED
743,743,33.333333333333336,2025-05-25 11:25:01.838920,2025-05-25 11:25:07.931117,0 days 00:00:06.092197,AdamW,0.28573544966378084,,,2.670125374636277e-05,,,,1,,,0.0027224485167823913,,PRUNED
744,744,33.333333333333336,2025-05-25 11:25:07.973852,2025-05-25 11:25:14.082769,0 days 00:00:06.108917,Adam,0.31552923766275454,,0.001572174193536713,,,,,6,,0.2611996464852392,,,PRUNED
745,745,39.583333333333336,2025-05-25 11:25:14.124407,2025-05-25 11:25:20.311600,0 days 00:00:06.187193,AdamW,0.10864286998391615,,,1.180163117616272e-05,,,,7,,,0.0019595039879702746,,PRUNED
746,746,35.416666666666664,2025-05-25 11:25:20.353515,2025-05-25 11:25:26.521016,0 days 00:00:06.167501,AdamW,0.4297165377785952,,,1.640306504627586e-05,,,,9,,,0.005921190022324903,,PRUNED
747,747,37.5,2025-05-25 11:25:26.567027,2025-05-25 11:25:32.663924,0 days 00:00:06.096897,AdamW,0.28070865445467236,,,1.984328055698072e-05,,,,3,,,0.0021647653196681066,,PRUNED
748,748,37.5,2025-05-25 11:25:32.705599,2025-05-25 11:25:38.794797,0 days 00:00:06.089198,AdamW,0.3399240761185166,,,3.099910209328777e-05,,,,2,,,0.0033763855339496297,,PRUNED
749,749,35.416666666666664,2025-05-25 11:25:38.836869,2025-05-25 11:25:44.986630,0 days 00:00:06.149761,AdamW,0.017096611664570795,,,1.3863819873287773e-05,,,,5,,,0.004411457387841646,,PRUNED
750,750,37.5,2025-05-25 11:25:45.028901,2025-05-25 11:25:51.154889,0 days 00:00:06.125988,AdamW,0.29018059281962455,,,1.002120028041266e-05,,,,1,,,0.0002693246222219975,,PRUNED
751,751,33.333333333333336,2025-05-25 11:25:51.198563,2025-05-25 11:25:57.332315,0 days 00:00:06.133752,AdamW,0.46230470775129506,,,3.7937029281185955e-05,,,,11,,,0.0018427989568912968,,PRUNED
752,752,35.416666666666664,2025-05-25 11:25:57.374631,2025-05-25 11:26:03.453779,0 days 00:00:06.079148,Adam,0.15404813323209543,,0.00011552760448327536,,,,,1,,6.14630954759245,,,PRUNED
753,753,31.25,2025-05-25 11:26:03.496360,2025-05-25 11:26:09.624634,0 days 00:00:06.128274,AdamW,0.2988036575105265,,,2.3517597360341035e-05,,,,5,,,0.00010170461909231278,,PRUNED
754,754,33.333333333333336,2025-05-25 11:26:09.666509,2025-05-25 11:26:15.804669,0 days 00:00:06.138160,Adadelta,0.2768580266276247,1.8246483308304597,,,,,,10,14.755574924385487,,,,PRUNED
755,755,39.583333333333336,2025-05-25 11:26:15.847954,2025-05-25 11:26:22.009719,0 days 00:00:06.161765,AdamW,0.007239146060601956,,,4.8284669855491876e-05,,,,4,,,0.0023796847544985205,,PRUNED
756,756,39.583333333333336,2025-05-25 11:26:22.052377,2025-05-25 11:26:28.140623,0 days 00:00:06.088246,AdamW,0.0895946432935113,,,1.7513149318929495e-05,,,,1,,,0.005116348384446909,,PRUNED
757,757,43.75,2025-05-25 11:26:28.182530,2025-05-25 11:26:34.325076,0 days 00:00:06.142546,AdamW,0.07452393730042636,,,0.00028978665987673566,,,,7,,,0.0028854263782975825,,PRUNED
758,758,41.666666666666664,2025-05-25 11:26:34.368639,2025-05-25 11:26:40.477483,0 days 00:00:06.108844,AdamW,0.12034634104593328,,,3.033464328148157e-05,,,,12,,,0.003702216610239073,,PRUNED
759,759,,2025-05-25 11:26:40.520254,2025-05-25 11:26:45.897047,0 days 00:00:05.376793,SGD,0.03484614740775971,,,,0.002734335047201192,46.96899533891199,False,6,,,,3.9718639960854407,PRUNED
760,760,29.166666666666668,2025-05-25 11:26:45.937809,2025-05-25 11:26:52.132712,0 days 00:00:06.194903,AdamW,0.30727749989589065,,,2.139086131243332e-05,,,,5,,,0.002574451893592786,,PRUNED
761,761,33.333333333333336,2025-05-25 11:26:52.177470,2025-05-25 11:26:58.312524,0 days 00:00:06.135054,AdamW,0.37862113860677293,,,1.5050735778414046e-05,,,,4,,,0.0065001000827043815,,PRUNED
762,762,43.75,2025-05-25 11:26:58.357909,2025-05-25 11:27:04.506147,0 days 00:00:06.148238,AdamW,0.2738637153080421,,,3.712285205350451e-05,,,,8,,,0.002111600069482316,,PRUNED
763,763,31.25,2025-05-25 11:27:04.551168,2025-05-25 11:27:10.768497,0 days 00:00:06.217329,Adam,0.289201633608698,,4.329226011146676e-05,,,,,2,,3.1107485557342884,,,PRUNED
764,764,33.333333333333336,2025-05-25 11:27:10.811430,2025-05-25 11:27:16.945538,0 days 00:00:06.134108,AdamW,0.023768030522241662,,,0.005593252946729887,,,,1,,,0.001689473198580538,,PRUNED
765,765,39.583333333333336,2025-05-25 11:27:16.987840,2025-05-25 11:27:23.134995,0 days 00:00:06.147155,AdamW,0.3243422332288234,,,2.612967468348053e-05,,,,11,,,0.0014796198035336176,,PRUNED
766,766,31.25,2025-05-25 11:27:23.177919,2025-05-25 11:27:29.302779,0 days 00:00:06.124860,AdamW,0.17712707274111728,,,1.3108192662812044e-05,,,,1,,,0.007204506139518416,,PRUNED
767,767,27.083333333333332,2025-05-25 11:27:29.345691,2025-05-25 11:27:35.437247,0 days 00:00:06.091556,AdamW,0.3645728950658905,,,4.536335455916395e-05,,,,4,,,0.0031266076057915523,,PRUNED
768,768,43.75,2025-05-25 11:27:35.478651,2025-05-25 11:27:41.623413,0 days 00:00:06.144762,AdamW,0.28200262405887977,,,1.8956593974864898e-05,,,,0,,,0.0024041267147612328,,PRUNED
769,769,31.25,2025-05-25 11:27:41.665282,2025-05-25 11:27:47.769869,0 days 00:00:06.104587,AdamW,0.25637333494547737,,,1.1804927467046866e-05,,,,11,,,0.004283740145819717,,PRUNED
770,770,43.75,2025-05-25 11:27:47.814771,2025-05-25 11:27:53.987115,0 days 00:00:06.172344,AdamW,0.2688245457510396,,,3.0597605440422276e-05,,,,1,,,0.001978445875603516,,PRUNED
771,771,39.583333333333336,2025-05-25 11:27:54.029227,2025-05-25 11:28:00.107689,0 days 00:00:06.078462,Adam,0.2875333478564831,,0.00029970117974625747,,,,,3,,23.946484788039115,,,PRUNED
772,772,35.416666666666664,2025-05-25 11:28:00.149671,2025-05-25 11:28:06.265426,0 days 00:00:06.115755,AdamW,0.29619866392347766,,,3.942925099989565e-05,,,,6,,,0.005758691971319049,,PRUNED
773,773,33.333333333333336,2025-05-25 11:28:06.308887,2025-05-25 11:28:12.437593,0 days 00:00:06.128706,AdamW,0.05242183386886501,,,0.00431414732433218,,,,0,,,0.0026963070600365246,,PRUNED
774,774,35.416666666666664,2025-05-25 11:28:12.481721,2025-05-25 11:28:18.551817,0 days 00:00:06.070096,AdamW,0.3923751090594192,,,2.2878852532265774e-05,,,,12,,,0.004931682098833853,,PRUNED
775,775,20.833333333333332,2025-05-25 11:28:18.594797,2025-05-25 11:28:21.054856,0 days 00:00:02.460059,AdamW,0.010149530495065243,,,1.5465427509801924e-05,,,,10,,,0.0022350734133796232,,PRUNED
776,776,37.5,2025-05-25 11:28:21.096078,2025-05-25 11:28:23.685768,0 days 00:00:02.589690,AdamW,0.24405379660997484,,,5.35169045612583e-05,,,,4,,,0.003774919749492364,,PRUNED
777,777,33.333333333333336,2025-05-25 11:28:23.730934,2025-05-25 11:28:29.818229,0 days 00:00:06.087295,Adadelta,0.2754981609963132,0.4599284627499968,,,,,,8,0.9122275758136802,,,,PRUNED
778,778,37.5,2025-05-25 11:28:29.862455,2025-05-25 11:28:35.963252,0 days 00:00:06.100797,AdamW,0.3073235056494071,,,1.8736933957277193e-05,,,,1,,,0.0017772771977153613,,PRUNED
779,779,33.333333333333336,2025-05-25 11:28:36.005789,2025-05-25 11:28:41.888099,0 days 00:00:05.882310,AdamW,0.331250481647324,,,2.8213383459539718e-05,,,,0,,,0.002010402614204083,,PRUNED
780,780,33.333333333333336,2025-05-25 11:28:41.926461,2025-05-25 11:28:45.680378,0 days 00:00:03.753917,AdamW,0.3496666489396636,,,0.002192610508759916,,,,9,,,0.0032911429521260854,,PRUNED
781,781,35.416666666666664,2025-05-25 11:28:45.719586,2025-05-25 11:28:48.557512,0 days 00:00:02.837926,Adam,0.2649031196048391,,1.7333753403077116e-05,,,,,5,,0.023477621365433972,,,PRUNED
782,782,25.0,2025-05-25 11:28:48.590118,2025-05-25 11:28:50.675816,0 days 00:00:02.085698,AdamW,0.00017292843019353459,,,3.583658233105732e-05,,,,11,,,0.002369009763623412,,PRUNED
783,783,27.083333333333332,2025-05-25 11:28:50.706145,2025-05-25 11:28:53.313654,0 days 00:00:02.607509,AdamW,0.03331968217850657,,,2.2324733998959586e-05,,,,2,,,0.005256818432078928,,PRUNED
784,784,,2025-05-25 11:28:53.355839,2025-05-25 11:28:58.629505,0 days 00:00:05.273666,SGD,0.2545879972440293,,,,0.05576258162952781,52.47462487894751,True,1,,,,9.728001111569336,PRUNED
785,785,50.0,2025-05-25 11:28:58.671952,2025-05-25 11:29:10.168132,0 days 00:00:11.496180,AdamW,0.016999679202357523,,,4.5499562900561835e-05,,,,0,,,0.0028420650456638832,,COMPLETE
786,786,35.416666666666664,2025-05-25 11:29:10.227793,2025-05-25 11:29:16.321886,0 days 00:00:06.094093,AdamW,0.29653972834259207,,,0.0004021210694290403,,,,6,,,0.00474065205399512,,PRUNED
787,787,39.583333333333336,2025-05-25 11:29:16.366951,2025-05-25 11:29:22.537582,0 days 00:00:06.170631,AdamW,0.28163713196208107,,,1.613006518142966e-05,,,,3,,,0.004123182307144575,,PRUNED
788,788,39.583333333333336,2025-05-25 11:29:22.582482,2025-05-25 11:29:28.731259,0 days 00:00:06.148777,AdamW,0.22731030372558217,,,1.2249500054692633e-05,,,,0,,,0.002107578580049858,,PRUNED
789,789,33.333333333333336,2025-05-25 11:29:28.773775,2025-05-25 11:29:34.923922,0 days 00:00:06.150147,AdamW,0.4191384416919048,,,2.5102584288500325e-05,,,,7,,,0.001316401026780027,,PRUNED
790,790,27.083333333333332,2025-05-25 11:29:34.968801,2025-05-25 11:29:41.127760,0 days 00:00:06.158959,Adam,0.2038061607426745,,5.646564583634365e-05,,,,,1,,10.039457306595086,,,PRUNED
791,791,33.333333333333336,2025-05-25 11:29:41.172662,2025-05-25 11:29:47.291107,0 days 00:00:06.118445,AdamW,0.271771936218721,,,0.008476627374771888,,,,0,,,0.00262205185588436,,PRUNED
792,792,35.416666666666664,2025-05-25 11:29:47.335161,2025-05-25 11:29:53.556125,0 days 00:00:06.220964,AdamW,0.2885854401494237,,,1.0071141256613623e-05,,,,4,,,0.0015680475638124238,,PRUNED
793,793,33.333333333333336,2025-05-25 11:29:53.600016,2025-05-25 11:29:59.743619,0 days 00:00:06.143603,AdamW,0.07091012441315898,,,3.4597387247837164e-05,,,,10,,,0.006091397076211121,,PRUNED
794,794,35.416666666666664,2025-05-25 11:29:59.786742,2025-05-25 11:30:05.906709,0 days 00:00:06.119967,AdamW,0.3171868866171804,,,1.9777340054488485e-05,,,,0,,,0.0018272789512517194,,PRUNED
795,795,39.583333333333336,2025-05-25 11:30:05.949860,2025-05-25 11:30:12.056334,0 days 00:00:06.106474,AdamW,0.0401721504249161,,,5.308936653834179e-05,,,,1,,,0.0024402869933471166,,PRUNED
796,796,35.416666666666664,2025-05-25 11:30:12.100837,2025-05-25 11:30:18.223031,0 days 00:00:06.122194,AdamW,0.2655268226118399,,,1.3534706937597435e-05,,,,11,,,0.002253304405219587,,PRUNED
797,797,35.416666666666664,2025-05-25 11:30:18.266141,2025-05-25 11:30:24.482995,0 days 00:00:06.216854,AdamW,0.24979731994303117,,,2.7892953259486372e-05,,,,0,,,0.004424701044079328,,PRUNED
798,798,29.166666666666668,2025-05-25 11:30:24.527970,2025-05-25 11:30:30.626973,0 days 00:00:06.099003,AdamW,0.4515495178534062,,,4.1623040337718244e-05,,,,6,,,0.0030598567055311857,,PRUNED
799,799,33.333333333333336,2025-05-25 11:30:30.669749,2025-05-25 11:30:36.840061,0 days 00:00:06.170312,Adam,0.13282623612380154,,0.00021031115015161168,,,,,0,,0.6964945831508813,,,PRUNED
800,800,33.333333333333336,2025-05-25 11:30:36.886021,2025-05-25 11:30:42.998370,0 days 00:00:06.112349,AdamW,0.30551656261338334,,,0.0008416046134114256,,,,5,,,0.003471546263275525,,PRUNED
801,801,33.333333333333336,2025-05-25 11:30:43.043385,2025-05-25 11:30:49.158020,0 days 00:00:06.114635,Adadelta,0.2822744649569735,58.580825705261205,,,,,,1,0.355641159661845,,,,PRUNED
802,802,35.416666666666664,2025-05-25 11:30:49.201251,2025-05-25 11:30:55.356989,0 days 00:00:06.155738,AdamW,0.2577374245286213,,,1.7174932030978033e-05,,,,9,,,0.005590051095729563,,PRUNED
803,803,41.666666666666664,2025-05-25 11:30:55.399423,2025-05-25 11:31:03.617226,0 days 00:00:08.217803,AdamW,0.026834701594952937,,,3.1900810611682246e-05,,,,6,,,0.0018860858599839504,,PRUNED
804,804,25.0,2025-05-25 11:31:03.663186,2025-05-25 11:31:09.789178,0 days 00:00:06.125992,AdamW,0.24093361651270795,,,6.621653565205363e-05,,,,11,,,0.0071543232990279575,,PRUNED
805,805,33.333333333333336,2025-05-25 11:31:09.832496,2025-05-25 11:31:15.967949,0 days 00:00:06.135453,AdamW,0.27443842945317193,,,2.3012849798708767e-05,,,,1,,,0.002148356832534524,,PRUNED
806,806,33.333333333333336,2025-05-25 11:31:16.011838,2025-05-25 11:31:22.182163,0 days 00:00:06.170325,AdamW,0.0976588884726212,,,1.5466483293930873e-05,,,,4,,,0.0025747612586415948,,PRUNED
807,807,,2025-05-25 11:31:22.230335,2025-05-25 11:31:27.679530,0 days 00:00:05.449195,SGD,0.010839387305645596,,,,0.0004178449434261928,31.852840653014965,False,2,,,,0.1657427239771749,PRUNED
808,808,54.166666666666664,2025-05-25 11:31:27.721177,2025-05-25 11:31:39.150446,0 days 00:00:11.429269,AdamW,0.36293099323556344,,,5.743036826793887e-05,,,,0,,,0.004038570400534465,,COMPLETE
