,number,value,datetime_start,datetime_complete,duration,params_algorithm,params_dropout_rate,params_lr_Adadelta,params_lr_Adam,params_lr_AdamW,params_lr_SGD,params_momentum_SGD,params_nesterov_SGD,params_suggested_freeze,params_weight_decay_Adadelta,params_weight_decay_Adam,params_weight_decay_AdamW,params_weight_decay_SGD,state
575,575,39.583333333333336,2025-05-24 20:41:15.004373,2025-05-24 20:41:19.204951,0 days 00:00:04.200578,AdamW,0.11806229069452007,,,0.0003361392208606529,,,,8,,,0.0020334847464553367,,PRUNED
576,576,39.583333333333336,2025-05-24 20:41:19.245585,2025-05-24 20:41:24.792551,0 days 00:00:05.546966,AdamW,0.4358463936711688,,,0.0011697037222616995,,,,9,,,0.0012353690279418052,,PRUNED
577,577,33.333333333333336,2025-05-24 20:41:24.832191,2025-05-24 20:41:29.300979,0 days 00:00:04.468788,AdamW,0.24073954544959095,,,5.599838938687637e-05,,,,10,,,0.0016052890262767995,,PRUNED
578,578,41.666666666666664,2025-05-24 20:41:29.340410,2025-05-24 20:41:35.395159,0 days 00:00:06.054749,AdamW,0.08448709939693266,,,0.00010374169505084698,,,,9,,,0.002412567078732395,,PRUNED
579,579,37.5,2025-05-24 20:41:35.434952,2025-05-24 20:41:41.526737,0 days 00:00:06.091785,AdamW,0.17929654712309803,,,0.00012176150806558917,,,,6,,,0.0018551119290459077,,PRUNED
580,580,29.166666666666668,2025-05-24 20:41:41.568614,2025-05-24 20:41:47.635989,0 days 00:00:06.067375,AdamW,0.10241300458024744,,,0.00024208567212130567,,,,3,,,0.0014159468955419368,,PRUNED
581,581,31.25,2025-05-24 20:41:47.676642,2025-05-24 20:41:53.767447,0 days 00:00:06.090805,AdamW,0.16603867899025163,,,6.854592625834391e-05,,,,8,,,0.00060028946861766,,PRUNED
582,582,41.666666666666664,2025-05-24 20:41:53.809270,2025-05-24 20:41:59.886117,0 days 00:00:06.076847,AdamW,0.2076328629362122,,,9.033198466113842e-05,,,,8,,,0.002654413558064438,,PRUNED
583,583,33.333333333333336,2025-05-24 20:41:59.927143,2025-05-24 20:42:06.121053,0 days 00:00:06.193910,Adadelta,0.13855774144441657,0.33437002848490505,,,,,,2,42.42684809067951,,,,PRUNED
584,584,35.416666666666664,2025-05-24 20:42:06.161703,2025-05-24 20:42:12.282903,0 days 00:00:06.121200,AdamW,0.19215271306797496,,,1.0484980391244389e-05,,,,13,,,0.008003645667689544,,PRUNED
585,585,39.583333333333336,2025-05-24 20:42:12.323744,2025-05-24 20:42:18.397445,0 days 00:00:06.073701,AdamW,0.15704002551345977,,,5.142591385856221e-05,,,,7,,,0.00045713222000591525,,PRUNED
586,586,33.333333333333336,2025-05-24 20:42:18.437769,2025-05-24 20:42:24.570851,0 days 00:00:06.133082,Adam,0.09611706029308548,,0.0012706314248368575,,,,,5,,2.2827125140909863,,,PRUNED
587,587,33.333333333333336,2025-05-24 20:42:24.610612,2025-05-24 20:42:30.740576,0 days 00:00:06.129964,AdamW,0.11051264830204398,,,0.0001396863030461068,,,,3,,,0.0020825586978850397,,PRUNED
588,588,,2025-05-24 20:42:30.781004,2025-05-24 20:42:36.216401,0 days 00:00:05.435397,SGD,0.229327457298002,,,,0.014052770426000361,9.139654965993692,True,9,,,,0.35013086955800055,PRUNED
589,589,37.5,2025-05-24 20:42:36.255779,2025-05-24 20:42:42.386476,0 days 00:00:06.130697,AdamW,0.41472252268315424,,,0.00010505290912405669,,,,11,,,0.0022741355387993854,,PRUNED
590,590,37.5,2025-05-24 20:42:42.427445,2025-05-24 20:42:48.515108,0 days 00:00:06.087663,AdamW,0.17644740278928914,,,1.6400450045349222e-05,,,,8,,,0.0010118165386768536,,PRUNED
591,591,35.416666666666664,2025-05-24 20:42:48.555182,2025-05-24 20:42:54.685866,0 days 00:00:06.130684,AdamW,0.20103763747737974,,,0.00017363616190831693,,,,9,,,0.0033010460217417843,,PRUNED
592,592,33.333333333333336,2025-05-24 20:42:54.726611,2025-05-24 20:43:00.846235,0 days 00:00:06.119624,AdamW,0.27828315578035334,,,6.842541740542687e-05,,,,3,,,0.0017411551606418333,,PRUNED
593,593,31.25,2025-05-24 20:43:00.887494,2025-05-24 20:43:06.967396,0 days 00:00:06.079902,AdamW,0.06759419864300681,,,8.529366948566441e-05,,,,8,,,0.0007060180186049452,,PRUNED
594,594,33.333333333333336,2025-05-24 20:43:07.007831,2025-05-24 20:43:13.135056,0 days 00:00:06.127225,AdamW,0.2546134992253938,,,0.00011924031000327579,,,,10,,,0.0019451894363388758,,PRUNED
595,595,33.333333333333336,2025-05-24 20:43:13.174117,2025-05-24 20:43:19.245394,0 days 00:00:06.071277,AdamW,0.18559124380622857,,,0.05537828526267902,,,,9,,,0.0015962499010953816,,PRUNED
596,596,33.333333333333336,2025-05-24 20:43:19.287158,2025-05-24 20:43:25.418568,0 days 00:00:06.131410,AdamW,0.16789639140195567,,,0.00021685646074019326,,,,7,,,0.00298121071215523,,PRUNED
597,597,35.416666666666664,2025-05-24 20:43:25.460726,2025-05-24 20:43:31.589187,0 days 00:00:06.128461,AdamW,0.12980394472029744,,,7.989833413839608e-05,,,,4,,,0.0024646189441138075,,PRUNED
598,598,33.333333333333336,2025-05-24 20:43:31.681006,2025-05-24 20:43:37.818165,0 days 00:00:06.137159,AdamW,0.08006973415701035,,,0.00013785748833759922,,,,8,,,0.0017730075708662844,,PRUNED
599,599,37.5,2025-05-24 20:43:37.861054,2025-05-24 20:43:43.928649,0 days 00:00:06.067595,AdamW,0.21495630958279668,,,5.774713442461239e-05,,,,3,,,0.0008716917129742545,,PRUNED
600,600,41.666666666666664,2025-05-24 20:43:43.969070,2025-05-24 20:43:50.110895,0 days 00:00:06.141825,AdamW,0.10995862370078978,,,0.00010022481137807101,,,,4,,,0.0012941259143786075,,PRUNED
601,601,39.583333333333336,2025-05-24 20:43:50.152570,2025-05-24 20:43:56.298134,0 days 00:00:06.145564,AdamW,0.08832455661004213,,,4.7033185477344436e-05,,,,10,,,0.0004200854962172125,,PRUNED
602,602,35.416666666666664,2025-05-24 20:43:56.338458,2025-05-24 20:44:02.420267,0 days 00:00:06.081809,AdamW,0.19378997746331564,,,0.0001725220869747894,,,,13,,,0.0005271082467528596,,PRUNED
603,603,33.333333333333336,2025-05-24 20:44:02.460776,2025-05-24 20:44:08.579881,0 days 00:00:06.119105,AdamW,0.15648874203295382,,,7.126556726690011e-05,,,,11,,,0.0022072677255869293,,PRUNED
604,604,35.416666666666664,2025-05-24 20:44:08.621586,2025-05-24 20:44:14.699866,0 days 00:00:06.078280,AdamW,0.4520681843815143,,,2.8083468689068433e-05,,,,9,,,0.005770665072055469,,PRUNED
605,605,33.333333333333336,2025-05-24 20:44:14.741793,2025-05-24 20:44:20.806857,0 days 00:00:06.065064,AdamW,0.1734524242045205,,,0.00011779989786291825,,,,8,,,0.003810500159057597,,PRUNED
606,606,33.333333333333336,2025-05-24 20:44:20.848069,2025-05-24 20:44:27.003560,0 days 00:00:06.155491,AdamW,0.10008376909940014,,,9.341520923218573e-05,,,,4,,,0.001954747532759756,,PRUNED
607,607,37.5,2025-05-24 20:44:27.044117,2025-05-24 20:44:33.145801,0 days 00:00:06.101684,AdamW,0.12136999216201949,,,0.0001477292114994189,,,,7,,,0.0026661154602943475,,PRUNED
608,608,33.333333333333336,2025-05-24 20:44:33.189707,2025-05-24 20:44:39.344000,0 days 00:00:06.154293,Adam,0.3300938430586976,,0.002331880836748358,,,,,9,,13.566676997420197,,,PRUNED
609,609,33.333333333333336,2025-05-24 20:44:39.384286,2025-05-24 20:44:45.473987,0 days 00:00:06.089701,AdamW,0.26392279320045764,,,6.262841669785364e-05,,,,9,,,0.0007462380393902534,,PRUNED
610,610,33.333333333333336,2025-05-24 20:44:45.514542,2025-05-24 20:44:51.587572,0 days 00:00:06.073030,Adadelta,0.24599532853562914,1.569933680299865,,,,,,8,1.0729899099792353,,,,PRUNED
611,611,37.5,2025-05-24 20:44:51.628494,2025-05-24 20:44:57.729079,0 days 00:00:06.100585,AdamW,0.14608548909849167,,,1.3737572781962423e-05,,,,6,,,0.0014569301834324994,,PRUNED
612,612,37.5,2025-05-24 20:44:57.772734,2025-05-24 20:45:03.882778,0 days 00:00:06.110044,AdamW,0.1828116161421648,,,3.994407224970391e-05,,,,8,,,0.0010545298490402114,,PRUNED
613,613,33.333333333333336,2025-05-24 20:45:03.924163,2025-05-24 20:45:10.027347,0 days 00:00:06.103184,AdamW,0.16337578067702102,,,0.0009253262413533269,,,,5,,,0.0021970350369647554,,PRUNED
614,614,33.333333333333336,2025-05-24 20:45:10.068116,2025-05-24 20:45:16.209470,0 days 00:00:06.141354,SGD,0.20437383533266254,,,,0.004957970585536609,1.4303260780868001,False,3,,,,0.9929252683427794,PRUNED
615,615,45.833333333333336,2025-05-24 20:45:16.250665,2025-05-24 20:45:24.465337,0 days 00:00:08.214672,AdamW,0.236122692802456,,,8.414147404669783e-05,,,,9,,,0.0016260311403454488,,PRUNED
616,616,33.333333333333336,2025-05-24 20:45:24.506339,2025-05-24 20:45:30.600354,0 days 00:00:06.094015,AdamW,0.09415057029396363,,,0.00019746328603543375,,,,11,,,0.0020697872343701687,,PRUNED
617,617,33.333333333333336,2025-05-24 20:45:30.642035,2025-05-24 20:45:36.738620,0 days 00:00:06.096585,AdamW,0.4728783139863976,,,0.00029174829795462943,,,,4,,,0.0023604011763832334,,PRUNED
618,618,29.166666666666668,2025-05-24 20:45:36.779162,2025-05-24 20:45:42.886128,0 days 00:00:06.106966,AdamW,0.1778012077888963,,,2.1715530866410873e-05,,,,13,,,0.0011921107424818086,,PRUNED
619,619,39.583333333333336,2025-05-24 20:45:42.928448,2025-05-24 20:45:49.015088,0 days 00:00:06.086640,AdamW,0.370342775171002,,,0.00010832767171471794,,,,8,,,0.001780779685960621,,PRUNED
620,620,33.333333333333336,2025-05-24 20:45:49.061653,2025-05-24 20:45:55.209033,0 days 00:00:06.147380,AdamW,0.3126892616184987,,,7.501170382070014e-05,,,,10,,,0.0013519574729569674,,PRUNED
621,621,37.5,2025-05-24 20:45:55.250147,2025-05-24 20:46:01.368657,0 days 00:00:06.118510,AdamW,0.1075865255281123,,,0.0001303673902706918,,,,4,,,0.0008164845112407456,,PRUNED
622,622,35.416666666666664,2025-05-24 20:46:01.412019,2025-05-24 20:46:07.423460,0 days 00:00:06.011441,AdamW,0.4241993384975038,,,5.64215561644036e-05,,,,5,,,0.004782768767928554,,PRUNED
623,623,33.333333333333336,2025-05-24 20:46:07.462453,2025-05-24 20:46:11.473762,0 days 00:00:04.011309,AdamW,0.18892457445625477,,,0.00015978147837418676,,,,9,,,0.0006334675087513375,,PRUNED
624,624,35.416666666666664,2025-05-24 20:46:11.513105,2025-05-24 20:46:15.794225,0 days 00:00:04.281120,AdamW,0.2138663974312368,,,9.746146041427311e-05,,,,12,,,0.0018683655609643488,,PRUNED
625,625,33.333333333333336,2025-05-24 20:46:15.836255,2025-05-24 20:46:19.872355,0 days 00:00:04.036100,AdamW,0.22769435274063193,,,0.00067585502163788,,,,3,,,0.0027987941702719726,,PRUNED
626,626,39.583333333333336,2025-05-24 20:46:19.911145,2025-05-24 20:46:24.232794,0 days 00:00:04.321649,AdamW,0.1189846245053528,,,4.770514607271546e-05,,,,7,,,0.0024633510214660207,,PRUNED
627,627,35.416666666666664,2025-05-24 20:46:24.275818,2025-05-24 20:46:30.325626,0 days 00:00:06.049808,AdamW,0.09120495043651397,,,8.701517719359666e-05,,,,8,,,0.0009170404194924998,,PRUNED
628,628,37.5,2025-05-24 20:46:30.368011,2025-05-24 20:46:36.469059,0 days 00:00:06.101048,AdamW,0.13979706401600026,,,6.801648303062759e-05,,,,10,,,0.0020530118022857946,,PRUNED
629,629,33.333333333333336,2025-05-24 20:46:36.510021,2025-05-24 20:46:41.635231,0 days 00:00:05.125210,AdamW,0.2907421361388665,,,0.002002585406440082,,,,0,,,0.0015268627461928058,,PRUNED
630,630,33.333333333333336,2025-05-24 20:46:41.664878,2025-05-24 20:46:44.301521,0 days 00:00:02.636643,AdamW,0.1629577925501447,,,0.00011972249164768146,,,,9,,,0.0016607148473090957,,PRUNED
631,631,33.333333333333336,2025-05-24 20:46:44.341364,2025-05-24 20:46:47.295074,0 days 00:00:02.953710,Adadelta,0.07572159207634427,6.978017194836371,,,,,,11,0.04684216083970074,,,,PRUNED
632,632,33.333333333333336,2025-05-24 20:46:47.324051,2025-05-24 20:46:49.453833,0 days 00:00:02.129782,AdamW,0.19717213357370034,,,0.0014141353691641205,,,,7,,,0.00012403875085658202,,PRUNED
633,633,37.5,2025-05-24 20:46:49.485165,2025-05-24 20:46:51.684659,0 days 00:00:02.199494,AdamW,0.32174238024378377,,,3.336016287878732e-05,,,,2,,,0.0011070573964528914,,PRUNED
634,634,33.333333333333336,2025-05-24 20:46:51.723645,2025-05-24 20:46:54.114026,0 days 00:00:02.390381,Adam,0.3967430141883557,,0.020861506217876583,,,,,6,,0.3086229615759568,,,PRUNED
635,635,33.333333333333336,2025-05-24 20:46:54.143048,2025-05-24 20:46:56.820409,0 days 00:00:02.677361,AdamW,0.17855000240687455,,,0.0002487320670695781,,,,8,,,0.0005876651619123959,,PRUNED
636,636,33.333333333333336,2025-05-24 20:46:56.863643,2025-05-24 20:47:02.937469,0 days 00:00:06.073826,AdamW,0.30249564230347037,,,0.00013848870672587973,,,,3,,,0.002314147694939035,,PRUNED
637,637,,2025-05-24 20:47:02.978454,2025-05-24 20:47:08.265213,0 days 00:00:05.286759,SGD,0.345466771312401,,,,0.041677614508934126,67.38373398223422,True,9,,,,13.12638320435858,PRUNED
638,638,33.333333333333336,2025-05-24 20:47:08.306714,2025-05-24 20:47:14.458032,0 days 00:00:06.151318,AdamW,0.10012906638946582,,,0.00035709927411040114,,,,4,,,0.0019314444641166174,,PRUNED
639,639,35.416666666666664,2025-05-24 20:47:14.500682,2025-05-24 20:47:20.655059,0 days 00:00:06.154377,AdamW,0.3805575540741617,,,0.0001771717132288048,,,,13,,,0.0031327555228695867,,PRUNED
640,640,37.5,2025-05-24 20:47:20.698509,2025-05-24 20:47:26.852075,0 days 00:00:06.153566,AdamW,0.1714397605555037,,,0.00010222259869195606,,,,12,,,0.0006841626466590121,,PRUNED
641,641,41.666666666666664,2025-05-24 20:47:26.886313,2025-05-24 20:47:33.002110,0 days 00:00:06.115797,AdamW,0.2702649188795795,,,7.858310449748548e-05,,,,10,,,0.0026268423546509023,,PRUNED
642,642,33.333333333333336,2025-05-24 20:47:33.045696,2025-05-24 20:47:39.070844,0 days 00:00:06.025148,AdamW,0.40761149223899296,,,5.417954587422699e-05,,,,9,,,0.0017685717122101754,,PRUNED
643,643,41.666666666666664,2025-05-24 20:47:39.112879,2025-05-24 20:47:45.328082,0 days 00:00:06.215203,AdamW,0.15348418455333337,,,0.00011294519359112716,,,,8,,,0.002098689578528754,,PRUNED
644,644,41.666666666666664,2025-05-24 20:47:45.370175,2025-05-24 20:47:51.509149,0 days 00:00:06.138974,AdamW,0.11133447951787522,,,6.621628295457307e-05,,,,4,,,0.0007699838727563979,,PRUNED
645,645,33.333333333333336,2025-05-24 20:47:51.584393,2025-05-24 20:47:57.751883,0 days 00:00:06.167490,AdamW,0.252600980393513,,,0.0002072556883854809,,,,3,,,0.0013890290051159191,,PRUNED
646,646,33.333333333333336,2025-05-24 20:47:57.794823,2025-05-24 20:48:03.909833,0 days 00:00:06.115010,AdamW,0.05055838729756839,,,8.78137504719426e-05,,,,5,,,0.002210890697048629,,PRUNED
647,647,31.25,2025-05-24 20:48:03.953044,2025-05-24 20:48:10.097752,0 days 00:00:06.144708,AdamW,0.12737400248756992,,,1.21025164399628e-05,,,,8,,,0.0016200356420931548,,PRUNED
648,648,35.416666666666664,2025-05-24 20:48:10.141702,2025-05-24 20:48:16.258274,0 days 00:00:06.116572,AdamW,0.186179075597125,,,4.2694523985889266e-05,,,,8,,,0.001899543332866556,,PRUNED
649,649,33.333333333333336,2025-05-24 20:48:16.303527,2025-05-24 20:48:22.544779,0 days 00:00:06.241252,AdamW,0.08792227744695014,,,0.00014234582181702247,,,,4,,,0.0012812707597959828,,PRUNED
650,650,33.333333333333336,2025-05-24 20:48:22.594340,2025-05-24 20:48:28.764997,0 days 00:00:06.170657,AdamW,0.33456383481314056,,,0.0011280009034305343,,,,12,,,0.0024492865031985217,,PRUNED
651,651,35.416666666666664,2025-05-24 20:48:28.810219,2025-05-24 20:48:34.923038,0 days 00:00:06.112819,AdamW,0.2779523044111432,,,7.397042862675637e-05,,,,9,,,0.002959947689266644,,PRUNED
652,652,39.583333333333336,2025-05-24 20:48:34.962818,2025-05-24 20:48:41.053751,0 days 00:00:06.090933,AdamW,0.22080771859793719,,,1.6516685464626824e-05,,,,3,,,0.0020788103243551195,,PRUNED
653,653,56.25,2025-05-24 20:48:41.091503,2025-05-24 20:48:52.853989,0 days 00:00:11.762486,AdamW,0.24093066230332785,,,9.729061257405668e-05,,,,7,,,0.0004866508115836409,,COMPLETE
654,654,39.583333333333336,2025-05-24 20:48:52.914846,2025-05-24 20:48:59.077451,0 days 00:00:06.162605,AdamW,0.24288365064012157,,,9.680615947515167e-05,,,,7,,,0.0004925194074691696,,PRUNED
655,655,33.333333333333336,2025-05-24 20:48:59.119595,2025-05-24 20:49:05.287164,0 days 00:00:06.167569,Adadelta,0.23313397198424657,19.389867846476974,,,,,,7,0.5202000360048509,,,,PRUNED
656,656,27.083333333333332,2025-05-24 20:49:05.330245,2025-05-24 20:49:11.389552,0 days 00:00:06.059307,AdamW,0.2308044035131091,,,8.430391871645729e-05,,,,7,,,0.0005312486088707941,,PRUNED
657,657,35.416666666666664,2025-05-24 20:49:11.432075,2025-05-24 20:49:17.765993,0 days 00:00:06.333918,AdamW,0.2598903541264277,,,0.00011000861176503947,,,,7,,,0.00043509178799959805,,PRUNED
658,658,33.333333333333336,2025-05-24 20:49:17.807693,2025-05-24 20:49:23.994017,0 days 00:00:06.186324,Adam,0.210457345321478,,0.04092373900939445,,,,,6,,4.029310452389316,,,PRUNED
659,659,37.5,2025-05-24 20:49:24.035716,2025-05-24 20:49:30.141962,0 days 00:00:06.106246,AdamW,0.2460719421598958,,,6.498374030211164e-05,,,,7,,,0.0005172783802199262,,PRUNED
660,660,37.5,2025-05-24 20:49:30.183947,2025-05-24 20:49:36.283436,0 days 00:00:06.099489,AdamW,0.24256626986512986,,,9.846672941051428e-05,,,,7,,,0.0004818163269294623,,PRUNED
661,661,,2025-05-24 20:49:36.325067,2025-05-24 20:49:41.904929,0 days 00:00:05.579862,SGD,0.22705637640659326,,,,2.3572184658264747e-05,19.40546092849604,False,6,,,,0.0925199713864118,PRUNED
662,662,33.333333333333336,2025-05-24 20:49:41.945366,2025-05-24 20:49:48.037378,0 days 00:00:06.092012,AdamW,0.2543389265331621,,,5.364236071961227e-05,,,,7,,,0.000407296665946719,,PRUNED
663,663,41.666666666666664,2025-05-24 20:49:48.078516,2025-05-24 20:49:54.372824,0 days 00:00:06.294308,AdamW,0.2483325183888271,,,1.0027710387674928e-05,,,,10,,,0.0004775634487426918,,PRUNED
664,664,35.416666666666664,2025-05-24 20:49:54.415592,2025-05-24 20:50:00.565777,0 days 00:00:06.150185,AdamW,0.2633412261714853,,,7.611486592079873e-05,,,,4,,,0.00044974969165934703,,PRUNED
665,665,50.0,2025-05-24 20:50:00.610157,2025-05-24 20:50:12.064480,0 days 00:00:11.454323,AdamW,0.23554553656715077,,,0.00012591630181063072,,,,12,,,0.0005407871893256553,,COMPLETE
666,666,41.666666666666664,2025-05-24 20:50:12.123391,2025-05-24 20:50:18.297513,0 days 00:00:06.174122,AdamW,0.10462439793000214,,,9.473208832102951e-05,,,,6,,,0.005302722104296855,,PRUNED
667,667,39.583333333333336,2025-05-24 20:50:18.343462,2025-05-24 20:50:24.524341,0 days 00:00:06.180879,AdamW,0.21552865376903432,,,0.00011364062502856923,,,,11,,,0.000598056959772576,,PRUNED
668,668,33.333333333333336,2025-05-24 20:50:24.569042,2025-05-24 20:50:30.749691,0 days 00:00:06.180649,AdamW,0.20365947093730657,,,2.7622893798272486e-05,,,,3,,,0.0003713277623790236,,PRUNED
669,669,33.333333333333336,2025-05-24 20:50:30.794217,2025-05-24 20:50:36.928046,0 days 00:00:06.133829,AdamW,0.07989449918175995,,,6.176647562952893e-05,,,,5,,,0.0025964029717563636,,PRUNED
670,670,29.166666666666668,2025-05-24 20:50:36.969852,2025-05-24 20:50:43.105173,0 days 00:00:06.135321,AdamW,0.3133660257190274,,,2.0297977806062097e-05,,,,13,,,0.0006459229146514939,,PRUNED
671,671,39.583333333333336,2025-05-24 20:50:43.150676,2025-05-24 20:50:49.241544,0 days 00:00:06.090868,AdamW,0.11634698062462694,,,7.732818239294088e-05,,,,9,,,0.0005690295453123609,,PRUNED
672,672,39.583333333333336,2025-05-24 20:50:49.285743,2025-05-24 20:50:55.506507,0 days 00:00:06.220764,AdamW,0.284743558149801,,,8.399545496050003e-05,,,,4,,,0.002240022691975773,,PRUNED
673,673,37.5,2025-05-24 20:50:55.550364,2025-05-24 20:51:01.659486,0 days 00:00:06.109122,AdamW,0.32436311034620074,,,3.6539975632368036e-05,,,,10,,,0.0009618423405416363,,PRUNED
674,674,52.083333333333336,2025-05-24 20:51:01.700650,2025-05-24 20:51:13.088395,0 days 00:00:11.387745,AdamW,0.09100500431242528,,,0.00012866250408895074,,,,7,,,0.0035279282238240423,,PRUNED
675,675,33.333333333333336,2025-05-24 20:51:13.132852,2025-05-24 20:51:19.353520,0 days 00:00:06.220668,AdamW,0.24076796591144584,,,5.217029056173333e-05,,,,9,,,0.0007218484842309692,,PRUNED
676,676,33.333333333333336,2025-05-24 20:51:19.397184,2025-05-24 20:51:25.634286,0 days 00:00:06.237102,AdamW,0.06535135736487765,,,0.00010135196169662124,,,,2,,,0.0018665101488959494,,PRUNED
677,677,39.583333333333336,2025-05-24 20:51:25.678540,2025-05-24 20:51:31.775347,0 days 00:00:06.096807,AdamW,0.2975077808501094,,,6.404898847096242e-05,,,,11,,,0.002363425825075033,,PRUNED
678,678,29.166666666666668,2025-05-24 20:51:31.816922,2025-05-24 20:51:37.955165,0 days 00:00:06.138243,AdamW,0.2255967387998752,,,8.33461484590452e-05,,,,1,,,0.00210116836298909,,PRUNED
679,679,33.333333333333336,2025-05-24 20:51:37.996958,2025-05-24 20:51:43.532831,0 days 00:00:05.535873,AdamW,0.1037804986040344,,,0.0025853874417453774,,,,12,,,0.0040364132302628,,PRUNED
680,680,33.333333333333336,2025-05-24 20:51:43.645504,2025-05-24 20:51:48.312709,0 days 00:00:04.667205,Adadelta,0.12250982199262897,45.2972049270957,,,,,,7,0.019415889354644406,,,,PRUNED
681,681,35.416666666666664,2025-05-24 20:51:48.351778,2025-05-24 20:51:52.276704,0 days 00:00:03.924926,AdamW,0.19131592008391865,,,0.00014929639413385507,,,,9,,,0.0028070293526719983,,PRUNED
682,682,33.333333333333336,2025-05-24 20:51:52.316164,2025-05-24 20:51:55.177063,0 days 00:00:02.860899,AdamW,0.27166225542873346,,,0.00010488918702669199,,,,3,,,0.0008278763072849435,,PRUNED
683,683,33.333333333333336,2025-05-24 20:51:55.206477,2025-05-24 20:51:59.058722,0 days 00:00:03.852245,Adam,0.2516076096322541,,0.00901524224629267,,,,,13,,0.5428640861875157,,,PRUNED
684,684,35.416666666666664,2025-05-24 20:51:59.102680,2025-05-24 20:52:05.268264,0 days 00:00:06.165584,AdamW,0.3512456067871482,,,4.742650138838354e-05,,,,4,,,0.0017582874676186032,,PRUNED
685,685,33.333333333333336,2025-05-24 20:52:05.310381,2025-05-24 20:52:11.518858,0 days 00:00:06.208477,SGD,0.08468057936284187,,,,0.0022801824028628134,0.9157240206642143,True,10,,,,3.6167539865714953,PRUNED
686,686,35.416666666666664,2025-05-24 20:52:11.562995,2025-05-24 20:52:14.542983,0 days 00:00:02.979988,AdamW,0.19902043292855398,,,6.653607273223464e-05,,,,9,,,0.0019229516075453892,,PRUNED
687,687,27.083333333333332,2025-05-24 20:52:14.574267,2025-05-24 20:52:17.083118,0 days 00:00:02.508851,AdamW,0.2164860576696747,,,0.0008264970659372723,,,,3,,,0.002321409162306474,,PRUNED
688,688,56.25,2025-05-24 20:52:17.112604,2025-05-24 20:52:22.128228,0 days 00:00:05.015624,AdamW,0.09610528052733643,,,2.5303866850149365e-05,,,,5,,,0.0006617638244353825,,COMPLETE
689,689,29.166666666666668,2025-05-24 20:52:22.171731,2025-05-24 20:52:24.375969,0 days 00:00:02.204238,AdamW,0.1030559688713527,,,2.5633433131154993e-05,,,,5,,,0.0008073030915344545,,PRUNED
