,number,value,datetime_start,datetime_complete,duration,params_algorithm,params_dropout_rate,params_lr_Adadelta,params_lr_Adam,params_lr_AdamW,params_lr_SGD,params_momentum_SGD,params_nesterov_SGD,params_suggested_freeze,params_weight_decay_Adadelta,params_weight_decay_Adam,params_weight_decay_AdamW,params_weight_decay_SGD,state
690,690,43.75,2025-05-24 20:52:24.407626,2025-05-24 20:52:28.480355,0 days 00:00:04.072729,AdamW,0.09804807241698484,,,1.9493890251664347e-05,,,,5,,,0.0006052711137989361,,PRUNED
691,691,35.416666666666664,2025-05-24 20:52:28.514706,2025-05-24 20:52:30.898953,0 days 00:00:02.384247,AdamW,0.09204859787243308,,,3.280305440774496e-05,,,,6,,,0.0006757788478993614,,PRUNED
692,692,39.583333333333336,2025-05-24 20:52:30.929875,2025-05-24 20:52:33.903700,0 days 00:00:02.973825,AdamW,0.07513750497411448,,,2.2362776489788484e-05,,,,5,,,0.000695630792341969,,PRUNED
693,693,33.333333333333336,2025-05-24 20:52:33.948050,2025-05-24 20:52:40.075533,0 days 00:00:06.127483,AdamW,0.09372438196547969,,,1.4178356978554942e-05,,,,5,,,0.0006306366493015149,,PRUNED
694,694,56.25,2025-05-24 20:52:40.120122,2025-05-24 20:52:51.626950,0 days 00:00:11.506828,AdamW,0.11564145334779838,,,2.607219198406271e-05,,,,6,,,0.0005519183153205334,,COMPLETE
695,695,35.416666666666664,2025-05-24 20:52:51.689702,2025-05-24 20:52:57.863839,0 days 00:00:06.174137,AdamW,0.11452123618526547,,,2.5991639635586202e-05,,,,6,,,0.0005575370798586903,,PRUNED
696,696,29.166666666666668,2025-05-24 20:52:57.908436,2025-05-24 20:53:04.032971,0 days 00:00:06.124535,AdamW,0.12951515952318446,,,1.7472543726543907e-05,,,,7,,,0.0005605292387691083,,PRUNED
697,697,41.666666666666664,2025-05-24 20:53:04.075505,2025-05-24 20:53:12.273814,0 days 00:00:08.198309,AdamW,0.1082697424262495,,,2.368174017659842e-05,,,,5,,,0.00048605148456258953,,PRUNED
698,698,39.583333333333336,2025-05-24 20:53:12.316846,2025-05-24 20:53:18.431665,0 days 00:00:06.114819,AdamW,0.11351209936853404,,,3.09337902103746e-05,,,,6,,,0.0005554630413284806,,PRUNED
699,699,41.666666666666664,2025-05-24 20:53:18.473215,2025-05-24 20:53:25.751871,0 days 00:00:07.278656,AdamW,0.12383399991042356,,,2.6364097752456422e-05,,,,6,,,0.0006514355470349145,,PRUNED
700,700,33.333333333333336,2025-05-24 20:53:25.794768,2025-05-24 20:53:31.907084,0 days 00:00:06.112316,AdamW,0.13701225686972324,,,2.22401016962098e-05,,,,5,,,0.0005836652123099906,,PRUNED
701,701,37.5,2025-05-24 20:53:31.949348,2025-05-24 20:53:38.147777,0 days 00:00:06.198429,AdamW,0.10767919386925359,,,3.112827413761383e-05,,,,5,,,0.0005475616781432658,,PRUNED
702,702,35.416666666666664,2025-05-24 20:53:38.191639,2025-05-24 20:53:44.295860,0 days 00:00:06.104221,AdamW,0.08440222056223008,,,1.81995819960737e-05,,,,6,,,0.0005044491210917763,,PRUNED
703,703,33.333333333333336,2025-05-24 20:53:44.339007,2025-05-24 20:53:50.401674,0 days 00:00:06.062667,AdamW,0.11723201662651436,,,3.981939715877122e-05,,,,4,,,0.0004585373632306077,,PRUNED
704,704,41.666666666666664,2025-05-24 20:53:50.445873,2025-05-24 20:53:56.753789,0 days 00:00:06.307916,AdamW,0.0995389690604207,,,3.4410980596165266e-05,,,,6,,,0.0006378234829999431,,PRUNED
705,705,31.25,2025-05-24 20:53:56.799000,2025-05-24 20:54:02.999955,0 days 00:00:06.200955,AdamW,0.0727197146392263,,,2.645131439707678e-05,,,,6,,,0.0006802481530660948,,PRUNED
706,706,35.416666666666664,2025-05-24 20:54:03.044665,2025-05-24 20:54:09.220398,0 days 00:00:06.175733,AdamW,0.12267442998090128,,,2.148931977196207e-05,,,,5,,,0.0005862688428976285,,PRUNED
707,707,33.333333333333336,2025-05-24 20:54:09.265283,2025-05-24 20:54:15.455758,0 days 00:00:06.190475,Adadelta,0.10005506838855063,3.874499076011838,,,,,,5,53.402416131934366,,,,PRUNED
708,708,33.333333333333336,2025-05-24 20:54:15.500230,2025-05-24 20:54:21.684791,0 days 00:00:06.184561,AdamW,0.1334116111475666,,,2.834278476289751e-05,,,,7,,,0.0007541527571442243,,PRUNED
709,709,27.083333333333332,2025-05-24 20:54:21.729669,2025-05-24 20:54:27.925230,0 days 00:00:06.195561,AdamW,0.10916105946118775,,,1.4787829120635198e-05,,,,4,,,0.0007274447108595037,,PRUNED
710,710,35.416666666666664,2025-05-24 20:54:27.968994,2025-05-24 20:54:34.102847,0 days 00:00:06.133853,Adam,0.08442357304455865,,0.0003172726110600463,,,,,6,,1.666120623108916,,,PRUNED
711,711,,2025-05-24 20:54:34.147590,2025-05-24 20:54:39.655346,0 days 00:00:05.507756,SGD,0.09505060253023086,,,,0.00011182154003614735,93.92029293733813,False,5,,,,52.15474806318808,PRUNED
712,712,39.583333333333336,2025-05-24 20:54:39.697767,2025-05-24 20:54:45.843742,0 days 00:00:06.145975,AdamW,0.060596495512276805,,,4.493114093727506e-05,,,,7,,,0.0008999103269857554,,PRUNED
713,713,47.916666666666664,2025-05-24 20:54:45.888629,2025-05-24 20:54:57.439203,0 days 00:00:11.550574,AdamW,0.11862930062227485,,,3.812268050119626e-05,,,,4,,,0.00041346730917908944,,PRUNED
714,714,50.0,2025-05-24 20:54:57.485133,2025-05-24 20:55:08.879363,0 days 00:00:11.394230,AdamW,0.3703059554666658,,,1.9050677144642335e-05,,,,4,,,0.0006383086075595882,,PRUNED
715,715,33.333333333333336,2025-05-24 20:55:08.926341,2025-05-24 20:55:15.217030,0 days 00:00:06.290689,AdamW,0.11242292863765517,,,5.075688556643093e-05,,,,4,,,0.0005122574703443668,,PRUNED
716,716,41.666666666666664,2025-05-24 20:55:15.261029,2025-05-24 20:55:21.425835,0 days 00:00:06.164806,AdamW,0.46396309771657396,,,6.118926818979627e-05,,,,6,,,0.0004547998953481069,,PRUNED
717,717,41.666666666666664,2025-05-24 20:55:21.470823,2025-05-24 20:55:27.689616,0 days 00:00:06.218793,AdamW,0.09166616391029214,,,7.220493873619819e-05,,,,7,,,0.0006912127852842617,,PRUNED
718,718,33.333333333333336,2025-05-24 20:55:27.734079,2025-05-24 20:55:33.860614,0 days 00:00:06.126535,AdamW,0.09896929727798688,,,3.845696809227691e-05,,,,5,,,0.0005368731607441251,,PRUNED
719,719,37.5,2025-05-24 20:55:33.906050,2025-05-24 20:55:40.152282,0 days 00:00:06.246232,AdamW,0.3398087144571814,,,8.84661044061889e-05,,,,4,,,0.006423791209363692,,PRUNED
720,720,31.25,2025-05-24 20:55:40.199770,2025-05-24 20:55:46.335710,0 days 00:00:06.135940,AdamW,0.08481059118195033,,,2.4447336052573313e-05,,,,3,,,0.001006909700483695,,PRUNED
721,721,31.25,2025-05-24 20:55:46.379452,2025-05-24 20:55:52.549376,0 days 00:00:06.169924,AdamW,0.1052457630962088,,,2.948688668014488e-05,,,,9,,,0.0007588026456371495,,PRUNED
722,722,33.333333333333336,2025-05-24 20:55:52.592655,2025-05-24 20:55:58.716918,0 days 00:00:06.124263,AdamW,0.36264254182926386,,,5.694044289263069e-05,,,,9,,,0.0006139017208594376,,PRUNED
723,723,41.666666666666664,2025-05-24 20:55:58.759609,2025-05-24 20:56:04.938633,0 days 00:00:06.179024,AdamW,0.1259112417233762,,,7.127848655750611e-05,,,,8,,,0.0005121233688832118,,PRUNED
724,724,33.333333333333336,2025-05-24 20:56:04.982542,2025-05-24 20:56:11.158156,0 days 00:00:06.175614,AdamW,0.0755131560070342,,,8.737502996390929e-05,,,,3,,,0.0008626827082760315,,PRUNED
725,725,33.333333333333336,2025-05-24 20:56:11.201494,2025-05-24 20:56:17.347180,0 days 00:00:06.145686,AdamW,0.4416080259026385,,,0.00010857637593869063,,,,7,,,0.0011549855328465038,,PRUNED
726,726,29.166666666666668,2025-05-24 20:56:17.389099,2025-05-24 20:56:23.562980,0 days 00:00:06.173881,AdamW,0.10897610872828092,,,7.663442610234785e-05,,,,5,,,0.0033259573718480086,,PRUNED
727,727,33.333333333333336,2025-05-24 20:56:23.605754,2025-05-24 20:56:29.679573,0 days 00:00:06.073819,AdamW,0.3915556202148627,,,4.5509961410729904e-05,,,,10,,,0.0005990994655316623,,PRUNED
728,728,37.5,2025-05-24 20:56:29.773872,2025-05-24 20:56:36.026563,0 days 00:00:06.252691,AdamW,0.3276287065294887,,,3.1533898234380116e-05,,,,4,,,0.000791633491557478,,PRUNED
729,729,39.583333333333336,2025-05-24 20:56:36.070278,2025-05-24 20:56:42.292700,0 days 00:00:06.222422,Adadelta,0.14515758584895533,0.030526325256648806,,,,,,6,0.14755144873168363,,,,PRUNED
730,730,33.333333333333336,2025-05-24 20:56:42.335257,2025-05-24 20:56:48.296677,0 days 00:00:05.961420,AdamW,0.09178784095673413,,,0.009237586750970942,,,,9,,,0.0004843926893517754,,PRUNED
731,731,37.5,2025-05-24 20:56:48.338834,2025-05-24 20:56:54.505659,0 days 00:00:06.166825,AdamW,0.4852909254163276,,,1.5659822054259842e-05,,,,7,,,0.0016660776090492992,,PRUNED
732,732,33.333333333333336,2025-05-24 20:56:54.550569,2025-05-24 20:57:00.665851,0 days 00:00:06.115282,AdamW,0.11371794008103064,,,0.023333165169462104,,,,3,,,0.0006977711192562523,,PRUNED
733,733,33.333333333333336,2025-05-24 20:57:00.708313,2025-05-24 20:57:06.825907,0 days 00:00:06.117594,Adam,0.09760198073925809,,0.013108097001518977,,,,,9,,0.17111769892601192,,,PRUNED
734,734,37.5,2025-05-24 20:57:06.868362,2025-05-24 20:57:12.443762,0 days 00:00:05.575400,AdamW,0.08088752297036314,,,9.385870319705075e-05,,,,8,,,0.00018061684260957769,,PRUNED
735,735,,2025-05-24 20:57:12.482183,2025-05-24 20:57:15.986278,0 days 00:00:03.504095,SGD,0.014264794155719296,,,,0.004076188691109705,80.59042767027704,True,3,,,,0.023583827126782215,PRUNED
736,736,33.333333333333336,2025-05-24 20:57:16.023012,2025-05-24 20:57:21.827137,0 days 00:00:05.804125,AdamW,0.131661589159892,,,0.00012238674245525257,,,,7,,,0.001097896294465595,,PRUNED
737,737,37.5,2025-05-24 20:57:21.869407,2025-05-24 20:57:26.855907,0 days 00:00:04.986500,AdamW,0.22486471725685295,,,5.581620153095233e-05,,,,2,,,0.004359860144217227,,PRUNED
738,738,33.333333333333336,2025-05-24 20:57:26.885894,2025-05-24 20:57:29.393552,0 days 00:00:02.507658,AdamW,0.237232585903476,,,2.2761148246787877e-05,,,,4,,,0.00156245651612536,,PRUNED
739,739,41.666666666666664,2025-05-24 20:57:29.422848,2025-05-24 20:57:32.919622,0 days 00:00:03.496774,AdamW,0.38047642042072266,,,1.2500466377018834e-05,,,,5,,,0.0009201803961936156,,PRUNED
740,740,33.333333333333336,2025-05-24 20:57:32.963013,2025-05-24 20:57:39.034257,0 days 00:00:06.071244,AdamW,0.12166609036235604,,,7.61365931763764e-05,,,,9,,,0.00042483514970724403,,PRUNED
741,741,33.333333333333336,2025-05-24 20:57:39.076789,2025-05-24 20:57:45.188089,0 days 00:00:06.111300,AdamW,0.10384059321685186,,,0.00010009759746453775,,,,10,,,0.0017387598943895714,,PRUNED
742,742,33.333333333333336,2025-05-24 20:57:45.230969,2025-05-24 20:57:49.881256,0 days 00:00:04.650287,AdamW,0.30942052732198794,,,6.256788798240947e-05,,,,8,,,0.0006308219021779284,,PRUNED
743,743,39.583333333333336,2025-05-24 20:57:49.910147,2025-05-24 20:57:52.136431,0 days 00:00:02.226284,AdamW,0.3512063557215275,,,4.2875019840684826e-05,,,,8,,,0.0005383969078585144,,PRUNED
744,744,33.333333333333336,2025-05-24 20:57:52.166899,2025-05-24 20:57:54.285991,0 days 00:00:02.119092,AdamW,0.20521264364100342,,,0.0001321260536791866,,,,9,,,0.005618244369356465,,PRUNED
745,745,54.166666666666664,2025-05-24 20:57:54.316817,2025-05-24 20:57:59.735136,0 days 00:00:05.418319,AdamW,0.1384695842804202,,,8.902890243797366e-05,,,,4,,,0.004968427210385096,,COMPLETE
746,746,37.5,2025-05-24 20:57:59.780374,2025-05-24 20:58:01.962505,0 days 00:00:02.182131,AdamW,0.08921686240022339,,,0.0001542524862802117,,,,6,,,0.003654519812246787,,PRUNED
747,747,35.416666666666664,2025-05-24 20:58:01.992614,2025-05-24 20:58:04.456833,0 days 00:00:02.464219,AdamW,0.3386376246489291,,,3.465712014957825e-05,,,,4,,,0.0007583724921384216,,PRUNED
748,748,37.5,2025-05-24 20:58:04.486135,2025-05-24 20:58:07.034101,0 days 00:00:02.547966,AdamW,0.11444089668833946,,,7.257259483186676e-05,,,,7,,,0.0018563484934269372,,PRUNED
749,749,37.5,2025-05-24 20:58:07.075786,2025-05-24 20:58:14.212428,0 days 00:00:07.136642,AdamW,0.09928852933665096,,,0.00010812357999682205,,,,9,,,0.0030499688021977463,,PRUNED
750,750,41.666666666666664,2025-05-24 20:58:14.256385,2025-05-24 20:58:20.368084,0 days 00:00:06.111699,AdamW,0.31930855393987506,,,1.904914212522053e-05,,,,10,,,0.0015727110222467212,,PRUNED
751,751,29.166666666666668,2025-05-24 20:58:20.412662,2025-05-24 20:58:26.587025,0 days 00:00:06.174363,AdamW,0.23317117494842365,,,5.426943429612639e-05,,,,9,,,0.002691136065758961,,PRUNED
752,752,33.333333333333336,2025-05-24 20:58:26.629616,2025-05-24 20:58:32.830929,0 days 00:00:06.201313,AdamW,0.07595269871558942,,,0.00011387429967059253,,,,3,,,0.0010311986149397676,,PRUNED
753,753,33.333333333333336,2025-05-24 20:58:32.873235,2025-05-24 20:58:39.017204,0 days 00:00:06.143969,AdamW,0.4036955479204917,,,8.872413741491067e-05,,,,5,,,0.001237947249591434,,PRUNED
754,754,37.5,2025-05-24 20:58:39.059986,2025-05-24 20:58:45.168693,0 days 00:00:06.108707,Adadelta,0.20770224596584322,0.181545281453141,,,,,,4,3.5905896928661156,,,,PRUNED
755,755,31.25,2025-05-24 20:58:45.211563,2025-05-24 20:58:51.372269,0 days 00:00:06.160706,Adam,0.10543029127591193,,0.0008390351246929221,,,,,6,,5.417004460809813,,,PRUNED
756,756,33.333333333333336,2025-05-24 20:58:51.415795,2025-05-24 20:58:57.638981,0 days 00:00:06.223186,AdamW,0.4257770249925287,,,6.720085113063031e-05,,,,8,,,0.0004539231165805943,,PRUNED
757,757,37.5,2025-05-24 20:58:57.687869,2025-05-24 20:59:03.878762,0 days 00:00:06.190893,AdamW,0.12917428147695467,,,0.0001598539607836257,,,,3,,,0.0005823381436803365,,PRUNED
758,758,33.333333333333336,2025-05-24 20:59:03.922567,2025-05-24 20:59:10.022538,0 days 00:00:06.099971,AdamW,0.33287018319936734,,,8.040197804494774e-05,,,,8,,,0.0019567481471660588,,PRUNED
759,759,,2025-05-24 20:59:10.065883,2025-05-24 20:59:15.500089,0 days 00:00:05.434206,SGD,0.19432112691036815,,,,0.008946397694743152,43.27239176727756,False,2,,,,1.2862495132408527,PRUNED
760,760,39.583333333333336,2025-05-24 20:59:15.542220,2025-05-24 20:59:21.728031,0 days 00:00:06.185811,AdamW,0.36071602106233175,,,0.0001223396604759423,,,,7,,,0.0003942658806435402,,PRUNED
761,761,31.25,2025-05-24 20:59:21.771092,2025-05-24 20:59:27.898130,0 days 00:00:06.127038,AdamW,0.09403136435951202,,,3.926603878565486e-05,,,,5,,,0.0008437793944391698,,PRUNED
762,762,33.333333333333336,2025-05-24 20:59:27.943260,2025-05-24 20:59:34.085497,0 days 00:00:06.142237,AdamW,0.11549579032975146,,,4.865473495121279e-05,,,,8,,,0.0014671218190905064,,PRUNED
763,763,41.666666666666664,2025-05-24 20:59:34.130239,2025-05-24 20:59:40.257927,0 days 00:00:06.127688,AdamW,0.14633811775290198,,,2.620600975707683e-05,,,,4,,,0.002081293894168819,,PRUNED
764,764,33.333333333333336,2025-05-24 20:59:40.300623,2025-05-24 20:59:46.547754,0 days 00:00:06.247131,AdamW,0.0697638814125483,,,0.0004657002512209371,,,,9,,,0.0007019427656803698,,PRUNED
765,765,35.416666666666664,2025-05-24 20:59:46.591713,2025-05-24 20:59:52.754571,0 days 00:00:06.162858,AdamW,0.0854162363218792,,,9.779859569184585e-05,,,,9,,,0.0017599295991154614,,PRUNED
766,766,33.333333333333336,2025-05-24 20:59:52.798282,2025-05-24 20:59:59.080239,0 days 00:00:06.281957,AdamW,0.21929186270810513,,,0.0032566113565451566,,,,3,,,0.002519933344975415,,PRUNED
767,767,33.333333333333336,2025-05-24 20:59:59.124024,2025-05-24 21:00:05.356795,0 days 00:00:06.232771,AdamW,0.18515987937451645,,,6.642627007289099e-05,,,,8,,,0.0005011491958696828,,PRUNED
768,768,37.5,2025-05-24 21:00:05.399978,2025-05-24 21:00:11.547789,0 days 00:00:06.147811,AdamW,0.2439232401368388,,,7.96062664504114e-05,,,,10,,,0.002170710420743641,,PRUNED
769,769,56.25,2025-05-24 21:00:11.591603,2025-05-24 21:00:23.309546,0 days 00:00:11.717943,AdamW,0.10622075982215044,,,5.823291142855945e-05,,,,7,,,0.0013575137783380375,,COMPLETE
770,770,37.5,2025-05-24 21:00:23.369772,2025-05-24 21:00:29.496457,0 days 00:00:06.126685,AdamW,0.4156538873095701,,,4.558298837257362e-05,,,,7,,,0.0012125366560018609,,PRUNED
771,771,39.583333333333336,2025-05-24 21:00:29.540896,2025-05-24 21:00:35.746456,0 days 00:00:06.205560,AdamW,0.10303335155929198,,,5.238529436071244e-05,,,,7,,,0.0013447322000346307,,PRUNED
772,772,37.5,2025-05-24 21:00:35.789226,2025-05-24 21:00:41.949713,0 days 00:00:06.160487,AdamW,0.08881347233629407,,,5.991848094135496e-05,,,,7,,,0.001286567870683821,,PRUNED
773,773,29.166666666666668,2025-05-24 21:00:41.993475,2025-05-24 21:00:48.131092,0 days 00:00:06.137617,AdamW,0.0997807503308054,,,3.552502665231843e-05,,,,7,,,0.001160519315388972,,PRUNED
774,774,33.333333333333336,2025-05-24 21:00:48.174175,2025-05-24 21:00:54.363867,0 days 00:00:06.189692,AdamW,0.25256566824931986,,,4.358425937705629e-05,,,,7,,,0.0006530551711360858,,PRUNED
775,775,39.583333333333336,2025-05-24 21:00:54.409906,2025-05-24 21:01:00.560951,0 days 00:00:06.151045,AdamW,0.20005173800668508,,,5.9965879173398605e-05,,,,6,,,0.0013329235273616981,,PRUNED
776,776,33.333333333333336,2025-05-24 21:01:00.604587,2025-05-24 21:01:06.868410,0 days 00:00:06.263823,AdamW,0.3455672423997115,,,2.2274973695729473e-05,,,,7,,,0.0010614835113709432,,PRUNED
777,777,41.666666666666664,2025-05-24 21:01:06.911414,2025-05-24 21:01:13.037927,0 days 00:00:06.126513,AdamW,0.08004843558806049,,,1.5830083571570165e-05,,,,7,,,0.001390788891423444,,PRUNED
778,778,33.333333333333336,2025-05-24 21:01:13.081751,2025-05-24 21:01:19.195591,0 days 00:00:06.113840,Adadelta,0.10741809967376939,1.5051873523148038,,,,,,8,8.265245281022619,,,,PRUNED
779,779,31.25,2025-05-24 21:01:19.238926,2025-05-24 21:01:25.399159,0 days 00:00:06.160233,AdamW,0.06613871473761146,,,3.0344736400068812e-05,,,,7,,,0.001504358865721655,,PRUNED
780,780,33.333333333333336,2025-05-24 21:01:25.441941,2025-05-24 21:01:31.549552,0 days 00:00:06.107611,Adam,0.15539791251321095,,0.002192610508759916,,,,,6,,43.58544896709497,,,PRUNED
781,781,31.25,2025-05-24 21:01:31.592422,2025-05-24 21:01:37.779537,0 days 00:00:06.187115,AdamW,0.3036691311729587,,,5.245232759461159e-05,,,,7,,,0.0011348501268745922,,PRUNED
782,782,39.583333333333336,2025-05-24 21:01:37.822187,2025-05-24 21:01:43.936371,0 days 00:00:06.114184,AdamW,0.09341926146715258,,,6.813352338315143e-05,,,,8,,,0.0013970309492127616,,PRUNED
783,783,35.416666666666664,2025-05-24 21:01:43.978967,2025-05-24 21:01:50.154185,0 days 00:00:06.175218,AdamW,0.18078854817656895,,,0.00018910416992716915,,,,7,,,0.001286669368282518,,PRUNED
784,784,,2025-05-24 21:01:50.197364,2025-05-24 21:01:55.778681,0 days 00:00:05.581317,SGD,0.2337964438792756,,,,0.00037125268563938265,52.47462487894751,True,9,,,,0.22970498890109867,PRUNED
785,785,35.416666666666664,2025-05-24 21:01:55.820337,2025-05-24 21:02:02.010788,0 days 00:00:06.190451,AdamW,0.1661555947603244,,,3.706144863880365e-05,,,,6,,,0.0009656858645571655,,PRUNED
786,786,35.416666666666664,2025-05-24 21:02:02.059883,2025-05-24 21:02:08.174384,0 days 00:00:06.114501,AdamW,0.3210010756103551,,,5.611578894657243e-05,,,,10,,,0.0005631869612883751,,PRUNED
787,787,56.25,2025-05-24 21:02:08.216744,2025-05-24 21:02:19.654277,0 days 00:00:11.437533,AdamW,0.21035901871125362,,,7.395624773148618e-05,,,,5,,,0.0014841365912197793,,COMPLETE
788,788,33.333333333333336,2025-05-24 21:02:19.714665,2025-05-24 21:02:25.870822,0 days 00:00:06.156157,AdamW,0.21647773583142613,,,7.95929886200142e-05,,,,5,,,0.0014309803976817635,,PRUNED
789,789,39.583333333333336,2025-05-24 21:02:25.913233,2025-05-24 21:02:32.056521,0 days 00:00:06.143288,AdamW,0.21136672714808286,,,6.957909338101083e-05,,,,6,,,0.001247230962868946,,PRUNED
790,790,37.5,2025-05-24 21:02:32.101585,2025-05-24 21:02:39.276242,0 days 00:00:07.174657,AdamW,0.18909392934633248,,,9.318291559861998e-05,,,,5,,,0.001470825533464062,,PRUNED
791,791,33.333333333333336,2025-05-24 21:02:39.319679,2025-05-24 21:02:45.344659,0 days 00:00:06.024980,AdamW,0.22723123166473624,,,8.345416792354878e-05,,,,5,,,0.0014598312414163305,,PRUNED
792,792,39.583333333333336,2025-05-24 21:02:45.387153,2025-05-24 21:02:51.505121,0 days 00:00:06.117968,AdamW,0.20555653263039658,,,6.26568845193615e-05,,,,5,,,0.0016386669263909479,,PRUNED
793,793,33.333333333333336,2025-05-24 21:02:51.581187,2025-05-24 21:02:57.672200,0 days 00:00:06.091013,AdamW,0.20075372204257655,,,0.00010954781996143053,,,,5,,,0.0013899008643910287,,PRUNED
794,794,31.25,2025-05-24 21:02:57.715774,2025-05-24 21:03:03.796171,0 days 00:00:06.080397,AdamW,0.22364833958310237,,,6.830377108386845e-05,,,,6,,,0.0012462679930346375,,PRUNED
795,795,35.416666666666664,2025-05-24 21:03:03.839600,2025-05-24 21:03:08.792778,0 days 00:00:04.953178,AdamW,0.18906907437690706,,,4.722551701178139e-05,,,,7,,,0.0010965153481230137,,PRUNED
796,796,37.5,2025-05-24 21:03:08.831407,2025-05-24 21:03:11.038329,0 days 00:00:02.206922,AdamW,0.21752318331708312,,,0.0001371017547548199,,,,8,,,0.001616806606251894,,PRUNED
797,797,41.666666666666664,2025-05-24 21:03:11.069511,2025-05-24 21:03:17.027065,0 days 00:00:05.957554,AdamW,0.20298064660809853,,,8.007446240508452e-05,,,,5,,,0.0015474830779708742,,PRUNED
798,798,41.666666666666664,2025-05-24 21:03:17.072080,2025-05-24 21:03:23.217432,0 days 00:00:06.145352,AdamW,0.19679366995775044,,,0.00010085277058645805,,,,5,,,0.0012081585518030995,,PRUNED
799,799,39.583333333333336,2025-05-24 21:03:23.262546,2025-05-24 21:03:29.560270,0 days 00:00:06.297724,AdamW,0.21915391581468094,,,5.515372834935612e-05,,,,5,,,0.000763489131235288,,PRUNED
800,800,41.666666666666664,2025-05-24 21:03:29.603649,2025-05-24 21:03:34.414661,0 days 00:00:04.811012,AdamW,0.39187929759836687,,,0.0001643544590209856,,,,9,,,0.0014945496660572837,,PRUNED
801,801,39.583333333333336,2025-05-24 21:03:34.453149,2025-05-24 21:03:38.232794,0 days 00:00:03.779645,AdamW,0.24071376965752384,,,7.314026986214358e-05,,,,6,,,0.0005196001198645391,,PRUNED
802,802,33.333333333333336,2025-05-24 21:03:38.262187,2025-05-24 21:03:40.362799,0 days 00:00:02.100612,AdamW,0.177030275911327,,,0.00012184190481881502,,,,8,,,0.0013296319304818187,,PRUNED
803,803,39.583333333333336,2025-05-24 21:03:40.392066,2025-05-24 21:03:42.488142,0 days 00:00:02.096076,AdamW,0.37273374392611874,,,9.171275688044382e-05,,,,9,,,0.0006468514754608974,,PRUNED
804,804,33.333333333333336,2025-05-24 21:03:42.755815,2025-05-24 21:03:45.039927,0 days 00:00:02.284112,Adam,0.44987699838303696,,0.09102234697554686,,,,,7,,0.39752957312763393,,,PRUNED
