,number,value,datetime_start,datetime_complete,duration,params_algorithm,params_dropout_rate,params_lr_Adadelta,params_lr_Adam,params_lr_AdamW,params_lr_SGD,params_momentum_SGD,params_nesterov_SGD,params_suggested_freeze,params_weight_decay_Adadelta,params_weight_decay_Adam,params_weight_decay_AdamW,params_weight_decay_SGD,state
460,460,33.333333333333336,2025-05-24 20:30:12.393161,2025-05-24 20:30:18.400390,0 days 00:00:06.007229,AdamW,0.4786078357125494,,,0.0008184654611115953,,,,8,,,0.001144888906976116,,PRUNED
461,461,37.5,2025-05-24 20:30:18.441364,2025-05-24 20:30:26.594428,0 days 00:00:08.153064,AdamW,0.09149548154829111,,,9.515078181004693e-05,,,,9,,,0.0018459026445997175,,PRUNED
462,462,33.333333333333336,2025-05-24 20:30:26.634825,2025-05-24 20:30:32.754668,0 days 00:00:06.119843,AdamW,0.1750023426300073,,,0.0005029035273085909,,,,4,,,0.0004230824450507809,,PRUNED
463,463,33.333333333333336,2025-05-24 20:30:32.795335,2025-05-24 20:30:38.861119,0 days 00:00:06.065784,Adadelta,0.4988571369220832,0.023503788511322427,,,,,,5,0.5016773083038147,,,,PRUNED
464,464,39.583333333333336,2025-05-24 20:30:38.899720,2025-05-24 20:30:45.008191,0 days 00:00:06.108471,AdamW,0.05399909171449239,,,1.698149961986917e-05,,,,5,,,0.001339392530005235,,PRUNED
465,465,,2025-05-24 20:30:45.047756,2025-05-24 20:30:50.599476,0 days 00:00:05.551720,SGD,0.3162821342818199,,,,0.0001282071673702791,25.56488733608975,False,8,,,,0.032629371256963025,PRUNED
466,466,33.333333333333336,2025-05-24 20:30:50.639224,2025-05-24 20:30:56.750429,0 days 00:00:06.111205,AdamW,0.18813401760700418,,,0.0001242338898565293,,,,3,,,0.0020371825485797574,,PRUNED
467,467,41.666666666666664,2025-05-24 20:30:56.790470,2025-05-24 20:31:02.816814,0 days 00:00:06.026344,AdamW,0.21076520303176483,,,3.8614303846381696e-05,,,,13,,,0.0025497264301456925,,PRUNED
468,468,33.333333333333336,2025-05-24 20:31:02.857718,2025-05-24 20:31:08.917820,0 days 00:00:06.060102,AdamW,0.29171600841657247,,,7.290651177492693e-05,,,,8,,,0.0016759074581463116,,PRUNED
469,469,35.416666666666664,2025-05-24 20:31:08.958238,2025-05-24 20:31:15.020957,0 days 00:00:06.062719,AdamW,0.413180216167692,,,5.274385396096197e-05,,,,9,,,0.0023182103528007715,,PRUNED
470,470,33.333333333333336,2025-05-24 20:31:15.061284,2025-05-24 20:31:21.216654,0 days 00:00:06.155370,AdamW,0.13550906478357758,,,0.00016507686696993899,,,,10,,,0.0006407623649034877,,PRUNED
471,471,35.416666666666664,2025-05-24 20:31:21.258955,2025-05-24 20:31:27.133667,0 days 00:00:05.874712,AdamW,0.30871428788310773,,,8.962683339202244e-05,,,,4,,,0.0014535030496443052,,PRUNED
472,472,35.416666666666664,2025-05-24 20:31:27.172496,2025-05-24 20:31:33.221575,0 days 00:00:06.049079,AdamW,0.10013364668772776,,,0.0012394997182291474,,,,3,,,0.001985711735483405,,PRUNED
473,473,41.666666666666664,2025-05-24 20:31:33.261510,2025-05-24 20:31:39.349016,0 days 00:00:06.087506,AdamW,0.22995750462763703,,,0.00010940781347043621,,,,9,,,0.0018439596103733912,,PRUNED
474,474,33.333333333333336,2025-05-24 20:31:39.387683,2025-05-24 20:31:45.426819,0 days 00:00:06.039136,AdamW,0.11645195190351795,,,6.048005192067421e-05,,,,12,,,0.0028332599473389303,,PRUNED
475,475,33.333333333333336,2025-05-24 20:31:45.465789,2025-05-24 20:31:51.579576,0 days 00:00:06.113787,AdamW,0.08693165204385232,,,7.324629026221687e-05,,,,7,,,0.0005317431054250258,,PRUNED
476,476,29.166666666666668,2025-05-24 20:31:51.618609,2025-05-24 20:31:57.753081,0 days 00:00:06.134472,AdamW,0.20319432018754266,,,1.150552251740122e-05,,,,8,,,0.006145188193744183,,PRUNED
477,477,43.75,2025-05-24 20:31:57.793443,2025-05-24 20:32:05.906199,0 days 00:00:08.112756,AdamW,0.1898501933962064,,,4.608454393429056e-05,,,,10,,,0.0007325003187906055,,PRUNED
478,478,33.333333333333336,2025-05-24 20:32:05.944839,2025-05-24 20:32:12.037388,0 days 00:00:06.092549,AdamW,0.15768359914765914,,,0.00014133403553837962,,,,4,,,0.001671697647372515,,PRUNED
479,479,35.416666666666664,2025-05-24 20:32:12.077859,2025-05-24 20:32:18.109428,0 days 00:00:06.031569,AdamW,0.18078992053745374,,,8.65585287811122e-05,,,,9,,,0.003938455576070715,,PRUNED
480,480,33.333333333333336,2025-05-24 20:32:18.149002,2025-05-24 20:32:24.273680,0 days 00:00:06.124678,AdamW,0.21856509796463003,,,0.00010287507844855357,,,,2,,,0.002147577146123334,,PRUNED
481,481,33.333333333333336,2025-05-24 20:32:24.314427,2025-05-24 20:32:30.446759,0 days 00:00:06.132332,AdamW,0.07874522616808206,,,6.120896107995293e-05,,,,6,,,0.0025181579853122546,,PRUNED
482,482,33.333333333333336,2025-05-24 20:32:30.487365,2025-05-24 20:32:36.503996,0 days 00:00:06.016631,AdamW,0.10950395962524646,,,0.0001817257145777926,,,,4,,,0.0009621581913241817,,PRUNED
483,483,33.333333333333336,2025-05-24 20:32:36.544481,2025-05-24 20:32:42.614664,0 days 00:00:06.070183,Adadelta,0.4278668493450669,0.09675068084853286,,,,,,5,0.010676705515400236,,,,PRUNED
484,484,37.5,2025-05-24 20:32:42.653357,2025-05-24 20:32:48.686934,0 days 00:00:06.033577,AdamW,0.12570288675770314,,,7.805934410635991e-05,,,,9,,,0.0011820560718030088,,PRUNED
485,485,58.333333333333336,2025-05-24 20:32:48.725483,2025-05-24 20:33:00.053511,0 days 00:00:11.328028,AdamW,0.24093283220488987,,,0.00012870852365353555,,,,12,,,0.0018545055679586875,,COMPLETE
486,486,54.166666666666664,2025-05-24 20:33:00.109600,2025-05-24 20:33:11.310470,0 days 00:00:11.200870,AdamW,0.26174615117347233,,,0.00013238929946075758,,,,12,,,0.0023467326065877907,,COMPLETE
487,487,35.416666666666664,2025-05-24 20:33:11.367189,2025-05-24 20:33:17.407668,0 days 00:00:06.040479,AdamW,0.24520990031811538,,,0.000149948635804693,,,,12,,,0.002379195628362507,,PRUNED
488,488,33.333333333333336,2025-05-24 20:33:17.449151,2025-05-24 20:33:23.535114,0 days 00:00:06.085963,AdamW,0.2535510707354884,,,0.00022377585295091541,,,,12,,,0.002582806366508103,,PRUNED
489,489,37.5,2025-05-24 20:33:23.574492,2025-05-24 20:33:29.596926,0 days 00:00:06.022434,AdamW,0.2393756197054738,,,0.00012808209231346924,,,,12,,,0.0021936364791157507,,PRUNED
490,490,,2025-05-24 20:33:29.637180,2025-05-24 20:33:35.133381,0 days 00:00:05.496201,SGD,0.2323455522586647,,,,0.001803213944812756,79.87324334444577,True,12,,,,0.6352100689942022,PRUNED
491,491,29.166666666666668,2025-05-24 20:33:35.171147,2025-05-24 20:33:41.185264,0 days 00:00:06.014117,AdamW,0.2578263008128242,,,0.00018262071122366805,,,,11,,,0.003083379013299975,,PRUNED
492,492,35.416666666666664,2025-05-24 20:33:41.223592,2025-05-24 20:33:47.261731,0 days 00:00:06.038139,AdamW,0.2732293421346004,,,0.00012665401410627715,,,,12,,,0.0028643932383970003,,PRUNED
493,493,31.25,2025-05-24 20:33:47.301448,2025-05-24 20:33:53.412475,0 days 00:00:06.111027,AdamW,0.24615138319294927,,,0.0001131536725832166,,,,12,,,0.0023239010646009263,,PRUNED
494,494,33.333333333333336,2025-05-24 20:33:53.452423,2025-05-24 20:33:59.491693,0 days 00:00:06.039270,AdamW,0.26680631710237723,,,0.00013552213613332166,,,,13,,,0.00025213422712955274,,PRUNED
495,495,33.333333333333336,2025-05-24 20:33:59.531845,2025-05-24 20:34:05.618883,0 days 00:00:06.087038,AdamW,0.2869740731787396,,,0.0001506191267017829,,,,11,,,0.002029538804546071,,PRUNED
496,496,37.5,2025-05-24 20:34:05.659788,2025-05-24 20:34:11.685176,0 days 00:00:06.025388,AdamW,0.2370101995978456,,,0.00011264725681579052,,,,13,,,0.008622727100930245,,PRUNED
497,497,33.333333333333336,2025-05-24 20:34:11.725955,2025-05-24 20:34:17.787862,0 days 00:00:06.061907,AdamW,0.3031725670491266,,,0.09951281491545229,,,,3,,,0.002588479204637916,,PRUNED
498,498,39.583333333333336,2025-05-24 20:34:17.826680,2025-05-24 20:34:23.956446,0 days 00:00:06.129766,AdamW,0.2222508388458197,,,2.3779729614074043e-05,,,,4,,,0.002174316990451025,,PRUNED
499,499,35.416666666666664,2025-05-24 20:34:23.998111,2025-05-24 20:34:29.845815,0 days 00:00:05.847704,AdamW,0.2286391424602333,,,0.00010305085681320048,,,,12,,,0.0006016206446871022,,PRUNED
500,500,39.583333333333336,2025-05-24 20:34:29.888269,2025-05-24 20:34:35.932878,0 days 00:00:06.044609,AdamW,0.2786765117657458,,,0.00017964747194743164,,,,13,,,0.0007446358709017533,,PRUNED
501,501,37.5,2025-05-24 20:34:35.974748,2025-05-24 20:34:42.740450,0 days 00:00:06.765702,AdamW,0.24957899630767333,,,0.0001584961211507496,,,,12,,,0.0024174544100661038,,PRUNED
502,502,43.75,2025-05-24 20:34:42.783108,2025-05-24 20:34:50.786471,0 days 00:00:08.003363,AdamW,0.2952237955868893,,,0.00012649973756966826,,,,10,,,0.00047707977918782,,PRUNED
503,503,33.333333333333336,2025-05-24 20:34:50.828270,2025-05-24 20:34:53.980645,0 days 00:00:03.152375,AdamW,0.17390736493638298,,,0.00026130274533025074,,,,3,,,0.001923166919309121,,PRUNED
504,504,33.333333333333336,2025-05-24 20:34:54.010621,2025-05-24 20:34:56.115268,0 days 00:00:02.104647,AdamW,0.19879018305252993,,,9.838804795607658e-05,,,,2,,,0.007001949334757958,,PRUNED
505,505,31.25,2025-05-24 20:34:56.147429,2025-05-24 20:34:59.760450,0 days 00:00:03.613021,AdamW,0.21355999539715967,,,1.4249478151150227e-05,,,,9,,,0.002662056446512629,,PRUNED
506,506,31.25,2025-05-24 20:34:59.803240,2025-05-24 20:35:01.892198,0 days 00:00:02.088958,AdamW,0.2589374721974017,,,8.676541740908551e-05,,,,4,,,0.005068115130199393,,PRUNED
507,507,33.333333333333336,2025-05-24 20:35:01.924121,2025-05-24 20:35:04.011697,0 days 00:00:02.087576,AdamW,0.1848285998518604,,,0.0017490024462273007,,,,3,,,0.0006674172440778695,,PRUNED
508,508,33.333333333333336,2025-05-24 20:35:04.044060,2025-05-24 20:35:06.170107,0 days 00:00:02.126047,Adam,0.2813395247510219,,0.09097399006786012,,,,,4,,8.398672647532498,,,PRUNED
509,509,27.083333333333332,2025-05-24 20:35:06.202494,2025-05-24 20:35:09.226235,0 days 00:00:03.023741,AdamW,0.2367473223721438,,,2.8957284988208397e-05,,,,9,,,0.0009036700258521676,,PRUNED
510,510,37.5,2025-05-24 20:35:09.254764,2025-05-24 20:35:11.982557,0 days 00:00:02.727793,AdamW,0.14210931299463694,,,0.00020282880108006088,,,,11,,,0.00010088142372608838,,PRUNED
511,511,33.333333333333336,2025-05-24 20:35:12.024384,2025-05-24 20:35:18.105859,0 days 00:00:06.081475,Adadelta,0.31230105406090286,10.101749426178444,,,,,,5,94.06436134028387,,,,PRUNED
512,512,39.583333333333336,2025-05-24 20:35:18.151676,2025-05-24 20:35:24.231750,0 days 00:00:06.080074,AdamW,0.1682518420015968,,,0.000116840709623717,,,,11,,,0.0021281479627180276,,PRUNED
513,513,33.333333333333336,2025-05-24 20:35:24.272748,2025-05-24 20:35:29.929810,0 days 00:00:05.657062,AdamW,0.19636483971002955,,,0.00041062536580598573,,,,10,,,0.0018089986685805512,,PRUNED
514,514,,2025-05-24 20:35:29.961042,2025-05-24 20:35:31.650069,0 days 00:00:01.689027,SGD,0.15655880632995803,,,,0.00869804142419418,61.24139545139082,False,6,,,,35.44023237328622,PRUNED
515,515,39.583333333333336,2025-05-24 20:35:31.680132,2025-05-24 20:35:33.730442,0 days 00:00:02.050310,AdamW,0.30131359568741456,,,0.0001520135799808866,,,,12,,,0.0023053239613356658,,PRUNED
516,516,37.5,2025-05-24 20:35:33.758659,2025-05-24 20:35:35.844805,0 days 00:00:02.086146,AdamW,0.2140781557600277,,,9.633260298746775e-05,,,,4,,,0.003364161265021231,,PRUNED
517,517,33.333333333333336,2025-05-24 20:35:35.874627,2025-05-24 20:35:37.948071,0 days 00:00:02.073444,AdamW,0.17685656994771345,,,0.0001334026259834628,,,,9,,,0.0007993111810947194,,PRUNED
518,518,37.5,2025-05-24 20:35:37.979099,2025-05-24 20:35:40.112424,0 days 00:00:02.133325,AdamW,0.24466715147777046,,,8.38680386901362e-05,,,,7,,,0.002007045355516238,,PRUNED
519,519,41.666666666666664,2025-05-24 20:35:40.142933,2025-05-24 20:35:43.427174,0 days 00:00:03.284241,AdamW,0.456918003953218,,,3.660804029778668e-05,,,,3,,,0.0017900745056756303,,PRUNED
520,520,33.333333333333336,2025-05-24 20:35:43.456228,2025-05-24 20:35:46.949932,0 days 00:00:03.493704,AdamW,0.26831985450485885,,,0.00010937350178439219,,,,3,,,0.0027731349606738716,,PRUNED
521,521,31.25,2025-05-24 20:35:46.990646,2025-05-24 20:35:53.099276,0 days 00:00:06.108630,AdamW,0.18581583217888975,,,1.9886980417682148e-05,,,,13,,,0.0024402316323284975,,PRUNED
522,522,37.5,2025-05-24 20:35:53.143712,2025-05-24 20:35:59.212807,0 days 00:00:06.069095,AdamW,0.22303701399585685,,,7.504171389295316e-05,,,,12,,,0.0009731062230005464,,PRUNED
523,523,33.333333333333336,2025-05-24 20:35:59.256041,2025-05-24 20:36:05.341530,0 days 00:00:06.085489,AdamW,0.3201900756772792,,,0.0006308623938109274,,,,4,,,0.002128257536741563,,PRUNED
524,524,33.333333333333336,2025-05-24 20:36:05.385045,2025-05-24 20:36:11.433649,0 days 00:00:06.048604,AdamW,0.12089610452405472,,,9.615640603501897e-05,,,,9,,,0.001260874116343009,,PRUNED
525,525,37.5,2025-05-24 20:36:11.475257,2025-05-24 20:36:17.616128,0 days 00:00:06.140871,AdamW,0.16437783316839744,,,0.0009829291910446497,,,,10,,,0.00031582803033288777,,PRUNED
526,526,37.5,2025-05-24 20:36:17.656622,2025-05-24 20:36:23.761665,0 days 00:00:06.105043,AdamW,0.19766549791339025,,,0.00016373734445110193,,,,11,,,0.0010652335223509512,,PRUNED
527,527,35.416666666666664,2025-05-24 20:36:23.805644,2025-05-24 20:36:29.921872,0 days 00:00:06.116228,AdamW,0.1369448090758299,,,0.00012739289526891037,,,,3,,,0.001942862423823307,,PRUNED
528,528,35.416666666666664,2025-05-24 20:36:29.963781,2025-05-24 20:36:36.248321,0 days 00:00:06.284540,AdamW,0.10623121331403894,,,4.253154916013388e-05,,,,4,,,0.0016902008470564603,,PRUNED
529,529,41.666666666666664,2025-05-24 20:36:36.294125,2025-05-24 20:36:42.356185,0 days 00:00:06.062060,AdamW,0.20680654261215728,,,8.557403138895809e-05,,,,9,,,0.0005659689364777211,,PRUNED
530,530,33.333333333333336,2025-05-24 20:36:42.399069,2025-05-24 20:36:48.433415,0 days 00:00:06.034346,AdamW,0.2941913525447235,,,0.014163056539785621,,,,9,,,0.0003866711551415043,,PRUNED
531,531,33.333333333333336,2025-05-24 20:36:48.475650,2025-05-24 20:36:54.762948,0 days 00:00:06.287298,AdamW,0.09729595287705028,,,1.2596815660380918e-05,,,,5,,,0.0006639208489657087,,PRUNED
532,532,33.333333333333336,2025-05-24 20:36:54.804536,2025-05-24 20:37:00.832432,0 days 00:00:06.027896,Adam,0.18322379677904604,,0.003475280157167274,,,,,12,,49.80596672089532,,,PRUNED
533,533,35.416666666666664,2025-05-24 20:37:00.874482,2025-05-24 20:37:06.925835,0 days 00:00:06.051353,AdamW,0.06384900706761282,,,3.276616260516827e-05,,,,6,,,0.003103059402282252,,PRUNED
534,534,33.333333333333336,2025-05-24 20:37:06.969790,2025-05-24 20:37:13.079583,0 days 00:00:06.109793,Adadelta,0.2853507239334408,0.8375239886061169,,,,,,7,13.755313267120679,,,,PRUNED
535,535,56.25,2025-05-24 20:37:13.122703,2025-05-24 20:37:24.639514,0 days 00:00:11.516811,AdamW,0.17107385849051132,,,0.00019500347825403765,,,,8,,,0.0015260107516009466,,COMPLETE
536,536,54.166666666666664,2025-05-24 20:37:24.699797,2025-05-24 20:37:36.076116,0 days 00:00:11.376319,AdamW,0.17005675217635927,,,0.00022649184253933504,,,,8,,,0.0014409270654005433,,COMPLETE
537,537,33.333333333333336,2025-05-24 20:37:36.135593,2025-05-24 20:37:42.374405,0 days 00:00:06.238812,AdamW,0.16901924624081638,,,0.0002138806012508963,,,,8,,,0.001528939415584871,,PRUNED
538,538,33.333333333333336,2025-05-24 20:37:42.417196,2025-05-24 20:37:48.551387,0 days 00:00:06.134191,AdamW,0.14899882498873657,,,0.00019889402089298287,,,,8,,,0.0013178825314071388,,PRUNED
539,539,37.5,2025-05-24 20:37:48.592954,2025-05-24 20:37:54.730144,0 days 00:00:06.137190,AdamW,0.15353088169486406,,,0.0003054098111173059,,,,8,,,0.0014268333725108479,,PRUNED
540,540,,2025-05-24 20:37:54.770670,2025-05-24 20:38:00.148487,0 days 00:00:05.377817,SGD,0.162767222422338,,,,0.03757381032565768,45.685336952396455,False,8,,,,0.01786463242189696,PRUNED
541,541,41.666666666666664,2025-05-24 20:38:00.189774,2025-05-24 20:38:06.338516,0 days 00:00:06.148742,AdamW,0.17583600947685213,,,0.00023119328099912437,,,,8,,,0.001404186591622868,,PRUNED
542,542,33.333333333333336,2025-05-24 20:38:06.382680,2025-05-24 20:38:12.463992,0 days 00:00:06.081312,AdamW,0.16857060970040108,,,0.0001955487408785499,,,,8,,,0.0015443744357792957,,PRUNED
543,543,33.333333333333336,2025-05-24 20:38:12.505722,2025-05-24 20:38:18.662201,0 days 00:00:06.156479,AdamW,0.4029479036701973,,,0.0002398787072315665,,,,8,,,0.0011908303984036587,,PRUNED
544,544,41.666666666666664,2025-05-24 20:38:18.702778,2025-05-24 20:38:24.853543,0 days 00:00:06.150765,AdamW,0.15893911890672371,,,0.00016403888753818602,,,,7,,,0.0015329129908397596,,PRUNED
545,545,33.333333333333336,2025-05-24 20:38:24.894678,2025-05-24 20:38:30.992855,0 days 00:00:06.098177,AdamW,0.18959676833821024,,,0.00031481845267945774,,,,8,,,0.0016687536577263717,,PRUNED
546,546,37.5,2025-05-24 20:38:31.031840,2025-05-24 20:38:37.095669,0 days 00:00:06.063829,AdamW,0.11149777249460173,,,0.00025616351024509813,,,,8,,,0.00132543106753109,,PRUNED
547,547,33.333333333333336,2025-05-24 20:38:37.135948,2025-05-24 20:38:43.208131,0 days 00:00:06.072183,AdamW,0.18018252111635047,,,0.00018113724661549031,,,,8,,,0.0014305877844176156,,PRUNED
548,548,33.333333333333336,2025-05-24 20:38:43.248916,2025-05-24 20:38:49.356354,0 days 00:00:06.107438,AdamW,0.13080966515546538,,,0.00015309227210031907,,,,8,,,0.0016583248018291483,,PRUNED
549,549,39.583333333333336,2025-05-24 20:38:49.397175,2025-05-24 20:38:55.492603,0 days 00:00:06.095428,AdamW,0.1470071585903276,,,0.0004064345183454976,,,,9,,,0.003636367101519494,,PRUNED
550,550,37.5,2025-05-24 20:38:55.532163,2025-05-24 20:39:01.704260,0 days 00:00:06.172097,AdamW,0.25712795397637284,,,0.0001427936757513473,,,,7,,,0.0017119134940399422,,PRUNED
551,551,33.333333333333336,2025-05-24 20:39:01.743411,2025-05-24 20:39:07.842806,0 days 00:00:06.099395,AdamW,0.16775517535996132,,,0.00011486634738486445,,,,8,,,0.0018168816541492489,,PRUNED
552,552,52.083333333333336,2025-05-24 20:39:07.884072,2025-05-24 20:39:19.200402,0 days 00:00:11.316330,AdamW,0.3852747165462611,,,0.0002618746239086928,,,,9,,,0.00125956772962396,,COMPLETE
553,553,33.333333333333336,2025-05-24 20:39:19.257593,2025-05-24 20:39:25.379438,0 days 00:00:06.121845,AdamW,0.23553306801410412,,,0.00020226497855985558,,,,9,,,0.0019305155822780418,,PRUNED
554,554,39.583333333333336,2025-05-24 20:39:25.419441,2025-05-24 20:39:31.503755,0 days 00:00:06.084314,AdamW,0.19639048899023964,,,0.00010503686385615099,,,,7,,,0.0015471858164274694,,PRUNED
555,555,35.416666666666664,2025-05-24 20:39:31.543835,2025-05-24 20:39:38.673041,0 days 00:00:07.129206,AdamW,0.09583716928218464,,,0.0001282964600483242,,,,10,,,0.001089296485434797,,PRUNED
556,556,33.333333333333336,2025-05-24 20:39:38.714229,2025-05-24 20:39:44.847208,0 days 00:00:06.132979,AdamW,0.17500409385990195,,,0.0014543172418128472,,,,8,,,0.0014882734708081202,,PRUNED
557,557,39.583333333333336,2025-05-24 20:39:44.887003,2025-05-24 20:39:50.966764,0 days 00:00:06.079761,AdamW,0.11766499069668986,,,7.065966255666162e-05,,,,8,,,0.0022263071705460667,,PRUNED
558,558,20.833333333333332,2025-05-24 20:39:51.007004,2025-05-24 20:39:57.153350,0 days 00:00:06.146346,Adadelta,0.20668600791309935,0.017555831737622082,,,,,,8,22.333954222157075,,,,PRUNED
559,559,35.416666666666664,2025-05-24 20:39:57.192750,2025-05-24 20:40:05.357892,0 days 00:00:08.165142,AdamW,0.18710895648020187,,,9.076810540903546e-05,,,,9,,,0.001353070556768663,,PRUNED
560,560,35.416666666666664,2025-05-24 20:40:05.398397,2025-05-24 20:40:11.522872,0 days 00:00:06.124475,AdamW,0.08681869152781099,,,0.00015365223867471248,,,,2,,,0.0005077850972796829,,PRUNED
561,561,39.583333333333336,2025-05-24 20:40:11.563659,2025-05-24 20:40:17.613087,0 days 00:00:06.049428,AdamW,0.22411011468100298,,,1.790223946176291e-05,,,,9,,,0.0020447922424626694,,PRUNED
562,562,37.5,2025-05-24 20:40:17.654535,2025-05-24 20:40:23.806728,0 days 00:00:06.152193,AdamW,0.15927985720996118,,,0.0001861407919671205,,,,9,,,0.0017880034117847055,,PRUNED
563,563,,2025-05-24 20:40:23.847974,2025-05-24 20:40:28.857954,0 days 00:00:05.009980,SGD,0.24985722701084287,,,,0.0005649071788566716,85.83436832221024,True,7,,,,0.11003191391872037,PRUNED
564,564,33.333333333333336,2025-05-24 20:40:28.894367,2025-05-24 20:40:33.295462,0 days 00:00:04.401095,Adam,0.10755903685487576,,0.020201271239574974,,,,,2,,94.88487622268329,,,PRUNED
565,565,37.5,2025-05-24 20:40:33.332447,2025-05-24 20:40:38.643700,0 days 00:00:05.311253,AdamW,0.07638439558793506,,,0.00011223883214982879,,,,10,,,0.004154431309719003,,PRUNED
566,566,39.583333333333336,2025-05-24 20:40:38.686407,2025-05-24 20:40:43.687105,0 days 00:00:05.000698,AdamW,0.17293981531402203,,,7.833269159457434e-05,,,,8,,,0.0026079312629222777,,PRUNED
567,567,33.333333333333336,2025-05-24 20:40:43.726936,2025-05-24 20:40:49.776319,0 days 00:00:06.049383,AdamW,0.12908659722840257,,,0.00013295080808940082,,,,8,,,0.001149655464401369,,PRUNED
568,568,47.916666666666664,2025-05-24 20:40:49.817086,2025-05-24 20:40:59.072094,0 days 00:00:09.255008,AdamW,0.0987105405195263,,,9.553251244656978e-05,,,,9,,,0.002402322205638206,,PRUNED
569,569,39.583333333333336,2025-05-24 20:40:59.115682,2025-05-24 20:41:03.523129,0 days 00:00:04.407447,AdamW,0.19556992547212354,,,6.438162606843751e-05,,,,7,,,0.0018870333803957323,,PRUNED
570,570,33.333333333333336,2025-05-24 20:41:03.551153,2025-05-24 20:41:05.628364,0 days 00:00:02.077211,AdamW,0.26912762483419334,,,0.00016170950494806335,,,,3,,,0.004566660742207401,,PRUNED
571,571,37.5,2025-05-24 20:41:05.658018,2025-05-24 20:41:07.751606,0 days 00:00:02.093588,AdamW,0.1847168599512962,,,0.0004773669511937568,,,,9,,,0.0028844749386801117,,PRUNED
572,572,33.333333333333336,2025-05-24 20:41:07.779067,2025-05-24 20:41:10.204419,0 days 00:00:02.425352,AdamW,0.14891880806896846,,,0.0007534443020868977,,,,13,,,0.0016826637816805344,,PRUNED
573,573,25.0,2025-05-24 20:41:10.241729,2025-05-24 20:41:12.634440,0 days 00:00:02.392711,AdamW,0.2184631867705743,,,8.000952300658394e-05,,,,10,,,0.0022057886919124373,,PRUNED
574,574,41.666666666666664,2025-05-24 20:41:12.674477,2025-05-24 20:41:14.966359,0 days 00:00:02.291882,AdamW,0.3911764129733202,,,2.396980861716766e-05,,,,3,,,0.0015078235868467183,,PRUNED
