,number,value,datetime_start,datetime_complete,duration,params_algorithm,params_dropout_rate,params_lr_Adadelta,params_lr_Adam,params_lr_AdamW,params_lr_SGD,params_momentum_SGD,params_nesterov_SGD,params_suggested_freeze,params_weight_decay_Adadelta,params_weight_decay_Adam,params_weight_decay_AdamW,params_weight_decay_SGD,state
805,805,33.333333333333336,2025-05-24 21:03:45.073133,2025-05-24 21:03:49.170072,0 days 00:00:04.096939,Adadelta,0.20774709960580953,84.61979731364879,,,,,,8,0.025520533269260348,,,,PRUNED
806,806,39.583333333333336,2025-05-24 21:03:49.212893,2025-05-24 21:03:55.348228,0 days 00:00:06.135335,AdamW,0.22940327442785166,,,5.590673112732831e-05,,,,7,,,0.0016116925998250155,,PRUNED
807,807,33.333333333333336,2025-05-24 21:03:55.392742,2025-05-24 21:04:01.545139,0 days 00:00:06.152397,AdamW,0.1208873535152343,,,0.0005753457842376002,,,,8,,,0.00045426544865011486,,PRUNED
808,808,50.0,2025-05-24 21:04:01.587686,2025-05-24 21:04:12.996471,0 days 00:00:11.408785,AdamW,0.21082154666691427,,,6.4179687607151e-05,,,,6,,,0.0005958336744896307,,PRUNED
809,809,,2025-05-24 21:04:13.040114,2025-05-24 21:04:18.420423,0 days 00:00:05.380309,SGD,0.43446916409198166,,,,0.05659679792371799,92.25393650398502,False,9,,,,2.469156949920664,PRUNED
810,810,33.333333333333336,2025-05-24 21:04:18.462059,2025-05-24 21:04:24.700868,0 days 00:00:06.238809,AdamW,0.08541316568805943,,,0.00011105608117568818,,,,5,,,0.0011711910550707672,,PRUNED
811,811,43.75,2025-05-24 21:04:24.741140,2025-05-24 21:04:32.900432,0 days 00:00:08.159292,AdamW,0.10744834861589907,,,8.426379119424047e-05,,,,10,,,0.0032951894684271213,,PRUNED
812,812,35.416666666666664,2025-05-24 21:04:32.945040,2025-05-24 21:04:39.105586,0 days 00:00:06.160546,AdamW,0.17099734586684315,,,0.00015851839734258067,,,,5,,,0.000903707500922415,,PRUNED
813,813,39.583333333333336,2025-05-24 21:04:39.149084,2025-05-24 21:04:45.391193,0 days 00:00:06.242109,AdamW,0.19361479664689638,,,4.583006382508191e-05,,,,9,,,0.0016616193928924554,,PRUNED
814,814,39.583333333333336,2025-05-24 21:04:45.435106,2025-05-24 21:04:51.459776,0 days 00:00:06.024670,AdamW,0.09300339639943131,,,7.667663403188488e-05,,,,7,,,0.001020974271977603,,PRUNED
815,815,37.5,2025-05-24 21:04:51.537372,2025-05-24 21:04:57.693751,0 days 00:00:06.156379,AdamW,0.09887826876919342,,,2.4975419273225266e-05,,,,8,,,0.004435166525453324,,PRUNED
816,816,37.5,2025-05-24 21:04:57.735730,2025-05-24 21:05:03.907627,0 days 00:00:06.171897,AdamW,0.11279545662557126,,,0.00013022131541926384,,,,8,,,0.0007353724364593538,,PRUNED
817,817,33.333333333333336,2025-05-24 21:05:03.951225,2025-05-24 21:05:10.107534,0 days 00:00:06.156309,AdamW,0.08026877075596184,,,0.07001626647794681,,,,9,,,0.0013963346680274744,,PRUNED
818,818,33.333333333333336,2025-05-24 21:05:10.150423,2025-05-24 21:05:16.317405,0 days 00:00:06.166982,AdamW,0.15590162719104694,,,6.150578436505565e-05,,,,6,,,0.0004961901862659658,,PRUNED
819,819,33.333333333333336,2025-05-24 21:05:16.361271,2025-05-24 21:05:22.515414,0 days 00:00:06.154143,AdamW,0.1818930132462141,,,9.735070190678375e-05,,,,9,,,0.0006743686754974481,,PRUNED
820,820,39.583333333333336,2025-05-24 21:05:22.559277,2025-05-24 21:05:28.804034,0 days 00:00:06.244757,AdamW,0.05612289973073109,,,4.091847894636682e-05,,,,10,,,0.0005735512211930442,,PRUNED
821,821,39.583333333333336,2025-05-24 21:05:28.847477,2025-05-24 21:05:35.011870,0 days 00:00:06.164393,AdamW,0.238006728443903,,,0.00010549126701670344,,,,7,,,0.003993411140536585,,PRUNED
822,822,31.25,2025-05-24 21:05:35.055265,2025-05-24 21:05:41.222795,0 days 00:00:06.167530,AdamW,0.21989541054599038,,,2.8858176443722826e-05,,,,5,,,0.0008055497361668177,,PRUNED
823,823,39.583333333333336,2025-05-24 21:05:41.267988,2025-05-24 21:05:47.385145,0 days 00:00:06.117157,AdamW,0.35682233976244304,,,7.086283011162546e-05,,,,8,,,0.0014991022408364265,,PRUNED
824,824,37.5,2025-05-24 21:05:47.428013,2025-05-24 21:05:53.620682,0 days 00:00:06.192669,AdamW,0.1964631840143133,,,0.00019364766811139764,,,,9,,,0.0017538639703339283,,PRUNED
825,825,41.666666666666664,2025-05-24 21:05:53.663271,2025-05-24 21:05:59.781564,0 days 00:00:06.118293,AdamW,0.2508956302141435,,,2.06882901607446e-05,,,,10,,,0.001284158353565696,,PRUNED
826,826,31.25,2025-05-24 21:05:59.825229,2025-05-24 21:06:05.993931,0 days 00:00:06.168702,AdamW,0.3781373914056963,,,0.0001403843236650066,,,,5,,,0.002922204835318583,,PRUNED
827,827,33.333333333333336,2025-05-24 21:06:06.039516,2025-05-24 21:06:12.183905,0 days 00:00:06.144389,AdamW,0.09881023415568398,,,8.999195045174717e-05,,,,7,,,0.007779151444262793,,PRUNED
828,828,33.333333333333336,2025-05-24 21:06:12.227625,2025-05-24 21:06:18.409034,0 days 00:00:06.181409,Adadelta,0.12444668823041836,0.09129808450111865,,,,,,9,1.0759118847502305,,,,PRUNED
829,829,27.083333333333332,2025-05-24 21:06:18.452890,2025-05-24 21:06:24.733720,0 days 00:00:06.280830,AdamW,0.07150991243202465,,,5.899940779249984e-05,,,,8,,,0.0003243172371296198,,PRUNED
830,830,33.333333333333336,2025-05-24 21:06:24.779036,2025-05-24 21:06:30.895110,0 days 00:00:06.116074,Adam,0.21011920266120257,,0.0054242343463554955,,,,,6,,0.05374018101707528,,,PRUNED
831,831,35.416666666666664,2025-05-24 21:06:30.938618,2025-05-24 21:06:37.186548,0 days 00:00:06.247930,AdamW,0.029519714712425704,,,4.959886267295108e-05,,,,8,,,0.0003596762028551692,,PRUNED
832,832,54.166666666666664,2025-05-24 21:06:37.230391,2025-05-24 21:06:48.831600,0 days 00:00:11.601209,AdamW,0.1650988352141335,,,0.0001193728382822195,,,,9,,,0.0006201718707069124,,COMPLETE
833,833,,2025-05-24 21:06:48.893982,2025-05-24 21:06:54.368242,0 days 00:00:05.474260,SGD,0.1126562393896105,,,,0.0012983915493250879,27.318023193902985,True,7,,,,11.413963336969447,PRUNED
834,834,31.25,2025-05-24 21:06:54.409648,2025-05-24 21:07:00.602365,0 days 00:00:06.192717,AdamW,0.174618104916202,,,0.0002844747853244721,,,,5,,,0.001094921153823353,,PRUNED
835,835,37.5,2025-05-24 21:07:00.644778,2025-05-24 21:07:06.829913,0 days 00:00:06.185135,AdamW,0.13878779551047266,,,7.748627292088736e-05,,,,8,,,0.0015713894177817962,,PRUNED
836,836,31.25,2025-05-24 21:07:06.873182,2025-05-24 21:07:13.077406,0 days 00:00:06.204224,AdamW,0.4071128685433367,,,3.175490936771164e-05,,,,9,,,0.00042826802034065693,,PRUNED
837,837,35.416666666666664,2025-05-24 21:07:13.121809,2025-05-24 21:07:19.281325,0 days 00:00:06.159516,AdamW,0.10300107367091053,,,9.942395317885556e-05,,,,10,,,0.0013366193062501709,,PRUNED
838,838,29.166666666666668,2025-05-24 21:07:19.325023,2025-05-24 21:07:25.494433,0 days 00:00:06.169410,AdamW,0.19124904319442115,,,7.122662159984835e-05,,,,7,,,0.0005507110235376284,,PRUNED
839,839,39.583333333333336,2025-05-24 21:07:25.538913,2025-05-24 21:07:31.698840,0 days 00:00:06.159927,AdamW,0.08951666170459265,,,0.00014732194327212955,,,,6,,,0.00279011065346449,,PRUNED
840,840,33.333333333333336,2025-05-24 21:07:31.743437,2025-05-24 21:07:37.864466,0 days 00:00:06.121029,AdamW,0.18220220659014605,,,0.000178891692093063,,,,8,,,0.0009634114075273504,,PRUNED
841,841,39.583333333333336,2025-05-24 21:07:37.907830,2025-05-24 21:07:44.035537,0 days 00:00:06.127707,AdamW,0.22566951131332116,,,5.152705973119357e-05,,,,5,,,0.001726391218002678,,PRUNED
842,842,37.5,2025-05-24 21:07:44.080234,2025-05-24 21:07:50.076851,0 days 00:00:05.996617,AdamW,0.2425057400516059,,,8.700038180836997e-05,,,,9,,,0.00083739992112281,,PRUNED
843,843,64.58333333333333,2025-05-24 21:07:50.119747,2025-05-24 21:08:01.194010,0 days 00:00:11.074263,AdamW,0.10947337964935257,,,0.0001202580194134861,,,,10,,,0.0011635317378611456,,COMPLETE
844,844,54.166666666666664,2025-05-24 21:08:01.255139,2025-05-24 21:08:12.649248,0 days 00:00:11.394109,AdamW,0.1290525627469253,,,0.00012235080182380057,,,,10,,,0.0012088227415783213,,COMPLETE
845,845,35.416666666666664,2025-05-24 21:08:12.709412,2025-05-24 21:08:18.974017,0 days 00:00:06.264605,AdamW,0.11552178667654125,,,0.00011756392214451405,,,,9,,,0.0012055848695760264,,PRUNED
846,846,37.5,2025-05-24 21:08:19.017923,2025-05-24 21:08:24.746121,0 days 00:00:05.728198,AdamW,0.11402438836175602,,,0.00015101157189652774,,,,10,,,0.001055246789341795,,PRUNED
847,847,35.416666666666664,2025-05-24 21:08:24.789115,2025-05-24 21:08:30.899315,0 days 00:00:06.110200,AdamW,0.12618058593330342,,,0.00013907223001591548,,,,10,,,0.001142744244355353,,PRUNED
848,848,39.583333333333336,2025-05-24 21:08:30.942819,2025-05-24 21:08:37.078038,0 days 00:00:06.135219,AdamW,0.12238123572370833,,,0.00010760701596196592,,,,11,,,0.0013297359156769016,,PRUNED
849,849,33.333333333333336,2025-05-24 21:08:37.121137,2025-05-24 21:08:41.996493,0 days 00:00:04.875356,AdamW,0.14588359637064707,,,0.00017853095229504985,,,,10,,,0.0011640434752614726,,PRUNED
850,850,33.333333333333336,2025-05-24 21:08:42.038955,2025-05-24 21:08:47.733725,0 days 00:00:05.694770,AdamW,0.1026449120275439,,,9.818226522635423e-05,,,,10,,,0.001386599355676413,,PRUNED
851,851,33.333333333333336,2025-05-24 21:08:47.774840,2025-05-24 21:08:52.033203,0 days 00:00:04.258363,AdamW,0.2592047138927181,,,0.0002270306061514622,,,,10,,,0.00047839443546374556,,PRUNED
852,852,35.416666666666664,2025-05-24 21:08:52.073185,2025-05-24 21:08:54.773226,0 days 00:00:02.700041,AdamW,0.13368926177948573,,,0.00011594319357882263,,,,11,,,0.00026547798370409335,,PRUNED
853,853,31.25,2025-05-24 21:08:54.803179,2025-05-24 21:08:57.156904,0 days 00:00:02.353725,Adadelta,0.16149478525705144,0.013085477513787958,,,,,,10,0.06892008184083365,,,,PRUNED
854,854,33.333333333333336,2025-05-24 21:08:57.199156,2025-05-24 21:09:00.033652,0 days 00:00:02.834496,AdamW,0.11078939395937154,,,0.00016549317045691037,,,,10,,,0.0014651934689513806,,PRUNED
855,855,37.5,2025-05-24 21:09:00.064768,2025-05-24 21:09:02.169055,0 days 00:00:02.104287,AdamW,0.21184962856589706,,,0.00013437882670303876,,,,10,,,0.0012811285632178347,,PRUNED
856,856,33.333333333333336,2025-05-24 21:09:02.199354,2025-05-24 21:09:04.344697,0 days 00:00:02.145343,Adam,0.23385863348813474,,0.03313949990847007,,,,,1,,1.4971249512287017,,,PRUNED
857,857,35.416666666666664,2025-05-24 21:09:04.374599,2025-05-24 21:09:07.463958,0 days 00:00:03.089359,AdamW,0.19587243745233743,,,9.042086472670373e-05,,,,9,,,0.0011001202350335222,,PRUNED
858,858,35.416666666666664,2025-05-24 21:09:07.493582,2025-05-24 21:09:09.644026,0 days 00:00:02.150444,AdamW,0.12000618020385594,,,0.0001080582326820089,,,,10,,,0.001531493178903616,,PRUNED
859,859,31.25,2025-05-24 21:09:09.673882,2025-05-24 21:09:12.499739,0 days 00:00:02.825857,AdamW,0.18506487814390826,,,8.117507962554965e-05,,,,9,,,0.0026067246425669588,,PRUNED
860,860,,2025-05-24 21:09:12.541795,2025-05-24 21:09:17.183087,0 days 00:00:04.641292,SGD,0.1072685725069245,,,,0.00018800474646923172,65.73399906943934,False,11,,,,23.73377263865075,PRUNED
861,861,33.333333333333336,2025-05-24 21:09:17.225000,2025-05-24 21:09:23.401740,0 days 00:00:06.176740,AdamW,0.20427579553009925,,,0.0003835721377193252,,,,10,,,0.0061301880092169405,,PRUNED
862,862,33.333333333333336,2025-05-24 21:09:23.447258,2025-05-24 21:09:29.567930,0 days 00:00:06.120672,AdamW,0.17120928901764612,,,0.00013016568712348253,,,,8,,,0.0016952158185432882,,PRUNED
863,863,35.416666666666664,2025-05-24 21:09:29.612358,2025-05-24 21:09:34.593650,0 days 00:00:04.981292,AdamW,0.22310783777988907,,,9.345595569756775e-05,,,,7,,,0.003503807149582526,,PRUNED
864,864,33.333333333333336,2025-05-24 21:09:34.632104,2025-05-24 21:09:39.633347,0 days 00:00:05.001243,AdamW,0.09713284385508787,,,0.00020808142208225987,,,,6,,,0.000525698861405091,,PRUNED
865,865,37.5,2025-05-24 21:09:39.664158,2025-05-24 21:09:41.877360,0 days 00:00:02.213202,AdamW,0.4198458859663026,,,1.9555783125226808e-05,,,,9,,,0.0012524195723192769,,PRUNED
866,866,35.416666666666664,2025-05-24 21:09:41.908243,2025-05-24 21:09:44.047865,0 days 00:00:02.139622,AdamW,0.3986247302380111,,,8.0751464895335e-05,,,,7,,,0.0010411893215327387,,PRUNED
867,867,35.416666666666664,2025-05-24 21:09:44.077607,2025-05-24 21:09:46.475165,0 days 00:00:02.397558,AdamW,0.24517749461705782,,,0.00011238748780150703,,,,8,,,0.0019073615431416961,,PRUNED
868,868,33.333333333333336,2025-05-24 21:09:46.505943,2025-05-24 21:09:48.594193,0 days 00:00:02.088250,AdamW,0.36491975977793356,,,0.0001490569562726554,,,,10,,,0.0014193481123304377,,PRUNED
869,869,33.333333333333336,2025-05-24 21:09:48.623673,2025-05-24 21:09:51.301259,0 days 00:00:02.677586,AdamW,0.1559091408320163,,,9.24112651314951e-05,,,,9,,,0.003019381631946249,,PRUNED
870,870,35.416666666666664,2025-05-24 21:09:51.343628,2025-05-24 21:09:57.457881,0 days 00:00:06.114253,AdamW,0.3482040718240731,,,6.545015219825333e-05,,,,9,,,0.0016077356516334006,,PRUNED
871,871,37.5,2025-05-24 21:09:57.501496,2025-05-24 21:10:04.651351,0 days 00:00:07.149855,AdamW,0.10590309575118975,,,7.658058483850831e-05,,,,7,,,0.00048391667950878575,,PRUNED
872,872,33.333333333333336,2025-05-24 21:10:04.694892,2025-05-24 21:10:10.929311,0 days 00:00:06.234419,AdamW,0.3844842710254713,,,0.0001245611091385423,,,,6,,,0.0018365951052344018,,PRUNED
873,873,37.5,2025-05-24 21:10:10.972490,2025-05-24 21:10:17.088018,0 days 00:00:06.115528,AdamW,0.12102061110923434,,,2.3941435002735486e-05,,,,13,,,0.00251013041921934,,PRUNED
874,874,35.416666666666664,2025-05-24 21:10:17.133281,2025-05-24 21:10:23.337868,0 days 00:00:06.204587,AdamW,0.13922247169320143,,,0.00010581117523000137,,,,11,,,0.0013238411597400984,,PRUNED
875,875,35.416666666666664,2025-05-24 21:10:23.381279,2025-05-24 21:10:29.558592,0 days 00:00:06.177313,AdamW,0.17903168291536303,,,0.00017007731706405164,,,,8,,,0.004938920809043835,,PRUNED
876,876,33.333333333333336,2025-05-24 21:10:29.602710,2025-05-24 21:10:35.731910,0 days 00:00:06.129200,Adadelta,0.26375573087258997,12.255723417982617,,,,,,10,0.010837563516749343,,,,PRUNED
877,877,33.333333333333336,2025-05-24 21:10:35.775101,2025-05-24 21:10:41.936113,0 days 00:00:06.161012,AdamW,0.20137401913794983,,,6.995432737749987e-05,,,,9,,,0.0011831588996669958,,PRUNED
878,878,35.416666666666664,2025-05-24 21:10:41.991160,2025-05-24 21:10:48.178538,0 days 00:00:06.187378,AdamW,0.09086952496993936,,,9.456147422041153e-05,,,,8,,,0.0004184026035873502,,PRUNED
879,879,33.333333333333336,2025-05-24 21:10:48.221723,2025-05-24 21:10:54.490220,0 days 00:00:06.268497,Adam,0.18833063018071744,,0.00027490041676606574,,,,,7,,0.8202801767358591,,,PRUNED
880,880,33.333333333333336,2025-05-24 21:10:54.535792,2025-05-24 21:11:00.717464,0 days 00:00:06.181672,AdamW,0.23132193150110933,,,0.00013669528198871874,,,,9,,,0.001522515202959883,,PRUNED
881,881,33.333333333333336,2025-05-24 21:11:00.761357,2025-05-24 21:11:07.067394,0 days 00:00:06.306037,AdamW,0.1092732509386852,,,8.181271736032725e-05,,,,8,,,0.0017061161856783485,,PRUNED
882,882,,2025-05-24 21:11:07.111892,2025-05-24 21:11:12.745860,0 days 00:00:05.633968,SGD,0.16886913907958212,,,,1.3855670619287797e-05,53.92122932243956,True,7,,,,0.016261598531066127,PRUNED
883,883,39.583333333333336,2025-05-24 21:11:12.788120,2025-05-24 21:11:18.960442,0 days 00:00:06.172322,AdamW,0.25369913986977766,,,0.0002519867212486165,,,,10,,,0.0023561594514482846,,PRUNED
884,884,41.666666666666664,2025-05-24 21:11:19.003840,2025-05-24 21:11:25.173284,0 days 00:00:06.169444,AdamW,0.09816035597533372,,,0.00011053849516630564,,,,11,,,0.0005442912629905207,,PRUNED
885,885,39.583333333333336,2025-05-24 21:11:25.217199,2025-05-24 21:11:31.440362,0 days 00:00:06.223163,AdamW,0.2188565895930115,,,0.0001883841861219598,,,,8,,,0.002041392370273684,,PRUNED
886,886,41.666666666666664,2025-05-24 21:11:31.485480,2025-05-24 21:11:37.607278,0 days 00:00:06.121798,AdamW,0.193549673110172,,,6.118274385514366e-05,,,,13,,,0.001120158030403475,,PRUNED
887,887,33.333333333333336,2025-05-24 21:11:37.652049,2025-05-24 21:11:43.781466,0 days 00:00:06.129417,AdamW,0.11746771483240218,,,7.210441752321683e-05,,,,5,,,0.0005896949047786828,,PRUNED
888,888,39.583333333333336,2025-05-24 21:11:43.826517,2025-05-24 21:11:50.020003,0 days 00:00:06.193486,AdamW,0.21021581452650306,,,9.629747383542301e-05,,,,2,,,0.0038253951592764402,,PRUNED
889,889,35.416666666666664,2025-05-24 21:11:50.064599,2025-05-24 21:11:56.293945,0 days 00:00:06.229346,AdamW,0.10388138737522952,,,0.00014474959097771954,,,,9,,,0.001374842436469987,,PRUNED
890,890,45.833333333333336,2025-05-24 21:11:56.337992,2025-05-24 21:12:05.941643,0 days 00:00:09.603651,AdamW,0.15176892790720287,,,2.565620242200203e-05,,,,6,,,0.0010091888222710241,,PRUNED
891,891,35.416666666666664,2025-05-24 21:12:05.986596,2025-05-24 21:12:11.955026,0 days 00:00:05.968430,AdamW,0.46595766513255166,,,0.00012205759011562074,,,,7,,,0.0027637191893021135,,PRUNED
892,892,35.416666666666664,2025-05-24 21:12:11.995061,2025-05-24 21:12:18.120565,0 days 00:00:06.125504,AdamW,0.34071052511080857,,,8.44270337376516e-05,,,,10,,,0.0017658980171600972,,PRUNED
893,893,35.416666666666664,2025-05-24 21:12:18.166947,2025-05-24 21:12:24.206710,0 days 00:00:06.039763,AdamW,0.13374720481891608,,,2.129046988021432e-05,,,,9,,,0.0004611445194080335,,PRUNED
894,894,35.416666666666664,2025-05-24 21:12:24.251139,2025-05-24 21:12:30.353268,0 days 00:00:06.102129,AdamW,0.17783112861369663,,,6.471489489518299e-05,,,,8,,,0.0015478468988822732,,PRUNED
895,895,37.5,2025-05-24 21:12:30.397312,2025-05-24 21:12:36.536600,0 days 00:00:06.139288,AdamW,0.08643009609070208,,,0.00010256903904101303,,,,8,,,0.002262406210966896,,PRUNED
896,896,37.5,2025-05-24 21:12:36.581707,2025-05-24 21:12:42.759632,0 days 00:00:06.177925,AdamW,0.16183942868585233,,,0.00015248498843270768,,,,6,,,0.0019797943910727874,,PRUNED
897,897,39.583333333333336,2025-05-24 21:12:42.804257,2025-05-24 21:12:48.919047,0 days 00:00:06.114790,AdamW,0.23992921749982224,,,7.80296461027503e-05,,,,5,,,0.00123288211218644,,PRUNED
898,898,27.083333333333332,2025-05-24 21:12:48.964142,2025-05-24 21:12:55.318342,0 days 00:00:06.354200,AdamW,0.11361000181771409,,,1.6906821814143627e-05,,,,9,,,0.00020446674823248852,,PRUNED
899,899,35.416666666666664,2025-05-24 21:12:55.363926,2025-05-24 21:13:01.515903,0 days 00:00:06.151977,AdamW,0.09451709225916319,,,0.00011935775913326763,,,,8,,,0.00319508201004382,,PRUNED
900,900,33.333333333333336,2025-05-24 21:13:01.559970,2025-05-24 21:13:07.728232,0 days 00:00:06.168262,Adadelta,0.355670733459058,3.691337459610031,,,,,,5,0.26776622944742023,,,,PRUNED
901,901,37.5,2025-05-24 21:13:07.771394,2025-05-24 21:13:13.966895,0 days 00:00:06.195501,AdamW,0.33132147688725533,,,6.14222517061986e-05,,,,7,,,0.0014650654041495552,,PRUNED
902,902,35.416666666666664,2025-05-24 21:13:14.011124,2025-05-24 21:13:20.157211,0 days 00:00:06.146087,AdamW,0.2010169258600408,,,0.00020489074513116892,,,,9,,,0.0006142747027742969,,PRUNED
903,903,39.583333333333336,2025-05-24 21:13:20.200986,2025-05-24 21:13:26.429599,0 days 00:00:06.228613,AdamW,0.22963433638452235,,,9.752094342776073e-05,,,,10,,,0.0005307341318590949,,PRUNED
904,904,41.666666666666664,2025-05-24 21:13:26.474172,2025-05-24 21:13:32.568985,0 days 00:00:06.094813,Adam,0.12387319650098744,,0.00013518019160104665,,,,,11,,13.27304838732023,,,PRUNED
905,905,33.333333333333336,2025-05-24 21:13:32.613896,2025-05-24 21:13:38.817227,0 days 00:00:06.203331,AdamW,0.18666350067766135,,,0.00031875745382375925,,,,7,,,0.0024928867370469193,,PRUNED
906,906,31.25,2025-05-24 21:13:38.861938,2025-05-24 21:13:44.968115,0 days 00:00:06.106177,AdamW,0.08034144229973239,,,3.357131263474389e-05,,,,9,,,0.0016919055603877434,,PRUNED
907,907,,2025-05-24 21:13:45.014377,2025-05-24 21:13:50.553551,0 days 00:00:05.539174,SGD,0.21461796374269132,,,,0.09123735640510511,14.142969791782114,False,10,,,,0.07602886741465863,PRUNED
908,908,35.416666666666664,2025-05-24 21:13:50.596817,2025-05-24 21:13:56.829044,0 days 00:00:06.232227,AdamW,0.3672540838671918,,,5.409771691424874e-05,,,,1,,,0.006752737877986107,,PRUNED
909,909,35.416666666666664,2025-05-24 21:13:56.873260,2025-05-24 21:14:03.019526,0 days 00:00:06.146266,AdamW,0.10377950661465932,,,8.112043269076158e-05,,,,8,,,0.002069383994801705,,PRUNED
910,910,39.583333333333336,2025-05-24 21:14:03.063213,2025-05-24 21:14:09.220724,0 days 00:00:06.157511,AdamW,0.25092097443601163,,,0.0001676680232018647,,,,6,,,0.0005036102461684975,,PRUNED
911,911,33.333333333333336,2025-05-24 21:14:09.264914,2025-05-24 21:14:15.396722,0 days 00:00:06.131808,AdamW,0.17316223600521707,,,0.00012949274450909978,,,,5,,,0.0019159853827841967,,PRUNED
912,912,33.333333333333336,2025-05-24 21:14:15.440517,2025-05-24 21:14:21.638210,0 days 00:00:06.197693,AdamW,0.11074641399580683,,,4.214864578895472e-05,,,,7,,,0.004380514493317412,,PRUNED
913,913,31.25,2025-05-24 21:14:21.681871,2025-05-24 21:14:27.860594,0 days 00:00:06.178723,AdamW,0.14446913446669946,,,2.7710229448344e-05,,,,9,,,0.0013898702923587482,,PRUNED
914,914,33.333333333333336,2025-05-24 21:14:27.904409,2025-05-24 21:14:34.052470,0 days 00:00:06.148061,AdamW,0.19146731477839343,,,7.285742218408913e-05,,,,8,,,0.0009844783962092286,,PRUNED
915,915,35.416666666666664,2025-05-24 21:14:34.098587,2025-05-24 21:14:38.655081,0 days 00:00:04.556494,AdamW,0.1300452586827139,,,8.995475133645845e-05,,,,6,,,0.002233846389602952,,PRUNED
916,916,35.416666666666664,2025-05-24 21:14:38.695214,2025-05-24 21:14:42.819858,0 days 00:00:04.124644,AdamW,0.0961285960541931,,,0.00011127942131596954,,,,8,,,0.001808341053405976,,PRUNED
917,917,37.5,2025-05-24 21:14:42.849729,2025-05-24 21:14:44.984231,0 days 00:00:02.134502,AdamW,0.2229426188502672,,,5.278582831318428e-05,,,,9,,,0.005343213025474488,,PRUNED
918,918,37.5,2025-05-24 21:14:45.014667,2025-05-24 21:14:48.104124,0 days 00:00:03.089457,AdamW,0.41054162655595083,,,6.724465862430347e-05,,,,10,,,0.0015969070414321032,,PRUNED
919,919,33.333333333333336,2025-05-24 21:14:48.133905,2025-05-24 21:14:50.295886,0 days 00:00:02.161981,AdamW,0.20188728247252485,,,0.00014589253477799107,,,,5,,,0.0013085554220512478,,PRUNED
