,number,value,datetime_start,datetime_complete,duration,params_algorithm,params_dropout_rate,params_lr_Adadelta,params_lr_Adam,params_lr_AdamW,params_lr_SGD,params_momentum_SGD,params_nesterov_SGD,params_suggested_freeze,params_weight_decay_Adadelta,params_weight_decay_Adam,params_weight_decay_AdamW,params_weight_decay_SGD,state
0,0,37.5,2025-05-25 10:05:41.242030,2025-05-25 10:05:52.791200,0 days 00:00:11.549170,Adadelta,0.4753571532049581,0.017073967431528128,,,,,,5,29.154431891537552,,,,COMPLETE
1,1,50.0,2025-05-25 10:05:52.849128,2025-05-25 10:06:03.852491,0 days 00:00:11.003363,Adam,0.35403628889802274,,5.3370327626039544e-05,,,,,8,,0.05415244119402541,,,COMPLETE
2,2,47.916666666666664,2025-05-25 10:06:03.902500,2025-05-25 10:06:15.039460,0 days 00:00:11.136960,AdamW,0.2623782158161189,,,0.00014742753159914678,,,,4,,,0.0005404103854647331,,COMPLETE
3,3,33.333333333333336,2025-05-25 10:06:15.089362,2025-05-25 10:06:26.198952,0 days 00:00:11.109590,AdamW,0.3925879806965068,,,0.0026926469100861782,,,,6,,,0.00021930485556643703,,COMPLETE
4,4,33.333333333333336,2025-05-25 10:06:26.248530,2025-05-25 10:06:37.465163,0 days 00:00:11.216633,Adadelta,0.4744427686266666,5.456725485601478,,,,,,0,0.5762487216478605,,,,COMPLETE
5,5,35.416666666666664,2025-05-25 10:06:37.514885,2025-05-25 10:06:48.593955,0 days 00:00:11.079070,Adam,0.2475884550556351,,0.00017654048052495074,,,,,1,,1.2030178871154673,,,COMPLETE
6,6,33.333333333333336,2025-05-25 10:06:48.642870,2025-05-25 10:06:57.748211,0 days 00:00:09.105341,Adadelta,0.09242722776276352,2.463768595899747,,,,,,7,48.696409415209004,,,,PRUNED
7,7,33.333333333333336,2025-05-25 10:06:57.782522,2025-05-25 10:07:06.730073,0 days 00:00:08.947551,AdamW,0.0979914312095726,,,0.02065142557895925,,,,1,,,0.0005170191786366995,,PRUNED
8,8,33.333333333333336,2025-05-25 10:07:06.764570,2025-05-25 10:07:15.674855,0 days 00:00:08.910285,SGD,0.27134804157912423,,,,0.012273800987852962,0.5621564911890039,True,3,,,,0.06235377135673159,PRUNED
9,9,,2025-05-25 10:07:15.709977,2025-05-25 10:07:21.525806,0 days 00:00:05.815829,SGD,0.38563517334297287,,,,0.0031130959561221226,6.365199445099503,False,10,,,,0.2106648601704221,PRUNED
10,10,31.25,2025-05-25 10:07:21.585746,2025-05-25 10:07:27.513369,0 days 00:00:05.927623,Adam,0.0029985914779085965,,1.1799062523159256e-05,,,,,13,,0.011627478296224469,,,PRUNED
11,11,29.166666666666668,2025-05-25 10:07:27.548493,2025-05-25 10:07:36.595922,0 days 00:00:09.047429,Adam,0.2687772072034616,,0.06135465318705142,,,,,9,,0.020123694972889298,,,PRUNED
12,12,56.25,2025-05-25 10:07:36.630095,2025-05-25 10:07:47.789230,0 days 00:00:11.159135,AdamW,0.33917540003066937,,,2.031973943675742e-05,,,,4,,,0.008383621437420495,,COMPLETE
13,13,31.25,2025-05-25 10:07:47.838339,2025-05-25 10:07:53.288811,0 days 00:00:05.450472,Adam,0.3542164736360214,,0.00026931176066398395,,,,,8,,37.639965874722925,,,PRUNED
14,14,52.083333333333336,2025-05-25 10:07:53.322421,2025-05-25 10:08:01.472441,0 days 00:00:08.150020,AdamW,0.34476830056032093,,,1.5192830160460168e-05,,,,11,,,0.009180512189609047,,COMPLETE
15,15,33.333333333333336,2025-05-25 10:08:01.522328,2025-05-25 10:08:10.483374,0 days 00:00:08.961046,AdamW,0.18189443592807747,,,1.5439717330315257e-05,,,,12,,,0.009639093552392489,,PRUNED
16,16,33.333333333333336,2025-05-25 10:08:10.518554,2025-05-25 10:08:16.421413,0 days 00:00:05.902859,AdamW,0.3244085375265818,,,1.392137862025427e-05,,,,11,,,0.009880588533888778,,PRUNED
17,17,35.416666666666664,2025-05-25 10:08:16.455410,2025-05-25 10:08:23.192345,0 days 00:00:06.736935,AdamW,0.42794027956218794,,,0.00015678605890211963,,,,3,,,0.0029936200869893704,,PRUNED
18,18,33.333333333333336,2025-05-25 10:08:23.226081,2025-05-25 10:08:25.618692,0 days 00:00:02.392611,AdamW,0.19527068919872193,,,6.353596102654242e-05,,,,6,,,0.0028062449195582866,,PRUNED
19,19,33.333333333333336,2025-05-25 10:08:25.645458,2025-05-25 10:08:27.921947,0 days 00:00:02.276489,AdamW,0.3308851073086485,,,0.0010909477444468072,,,,10,,,0.0029528977673212915,,PRUNED
20,20,,2025-05-25 10:08:27.949072,2025-05-25 10:08:30.669370,0 days 00:00:02.720298,SGD,0.43146366092662647,,,,2.025934909325147e-05,88.37749112170019,True,13,,,,71.38393633927497,PRUNED
21,21,31.25,2025-05-25 10:08:30.702426,2025-05-25 10:08:36.649459,0 days 00:00:05.947033,Adam,0.3146643330149076,,1.0092510080927751e-05,,,,,8,,0.3469358819028498,,,PRUNED
22,22,33.333333333333336,2025-05-25 10:08:36.686083,2025-05-25 10:08:42.597662,0 days 00:00:05.911579,Adam,0.379376137937382,,0.006223444635816401,,,,,8,,0.2749461091626755,,,PRUNED
23,23,54.166666666666664,2025-05-25 10:08:42.632738,2025-05-25 10:08:53.717453,0 days 00:00:11.084715,AdamW,0.3006100111148764,,,1.3970734935405238e-05,,,,11,,,0.0051088003270523125,,COMPLETE
24,24,31.25,2025-05-25 10:08:53.768428,2025-05-25 10:09:02.744574,0 days 00:00:08.976146,AdamW,0.20290819947002905,,,1.0036240708078846e-05,,,,11,,,0.005357892114041758,,PRUNED
25,25,47.916666666666664,2025-05-25 10:09:02.779348,2025-05-25 10:09:13.822050,0 days 00:00:11.042702,AdamW,0.29894843056066406,,,4.74596847963918e-05,,,,11,,,0.005510426028518221,,COMPLETE
26,26,54.166666666666664,2025-05-25 10:09:13.872756,2025-05-25 10:09:25.204415,0 days 00:00:11.331659,AdamW,0.23475084634686694,,,5.0001661763933946e-05,,,,4,,,0.005531348116724926,,COMPLETE
27,27,54.166666666666664,2025-05-25 10:09:25.254024,2025-05-25 10:09:36.419711,0 days 00:00:11.165687,AdamW,0.14618991401199255,,,6.775342753653531e-05,,,,4,,,0.0014055588056137117,,COMPLETE
28,28,33.333333333333336,2025-05-25 10:09:36.470632,2025-05-25 10:09:42.390908,0 days 00:00:05.920276,AdamW,0.24188355223985702,,,0.0003648363846844233,,,,2,,,0.004126991221962181,,PRUNED
29,29,33.333333333333336,2025-05-25 10:09:42.424783,2025-05-25 10:09:48.361167,0 days 00:00:05.936384,Adadelta,0.2231993814100855,64.45644666931992,,,,,,5,0.01286892803974938,,,,PRUNED
30,30,35.416666666666664,2025-05-25 10:09:48.397470,2025-05-25 10:09:54.382327,0 days 00:00:05.984857,AdamW,0.15502842471462705,,,3.777975437849437e-05,,,,5,,,0.001544948888891324,,PRUNED
31,31,33.333333333333336,2025-05-25 10:09:54.416794,2025-05-25 10:10:00.377069,0 days 00:00:05.960275,AdamW,0.13996812746114407,,,5.430804097462278e-05,,,,4,,,0.0012490142268242806,,PRUNED
32,32,35.416666666666664,2025-05-25 10:10:00.412946,2025-05-25 10:10:06.335089,0 days 00:00:05.922143,AdamW,0.11129153576191063,,,3.195232538086553e-05,,,,4,,,0.005651460551742822,,PRUNED
33,33,47.916666666666664,2025-05-25 10:10:06.370549,2025-05-25 10:10:17.693783,0 days 00:00:11.323234,AdamW,0.29169789942567037,,,0.00015398329437817386,,,,3,,,0.0021799372706884186,,PRUNED
34,34,52.083333333333336,2025-05-25 10:10:17.730420,2025-05-25 10:10:28.923852,0 days 00:00:11.193432,AdamW,0.06803668022402384,,,2.8083433326867697e-05,,,,6,,,0.0008403991127384979,,COMPLETE
35,35,33.333333333333336,2025-05-25 10:10:28.974236,2025-05-25 10:10:34.942857,0 days 00:00:05.968621,Adadelta,0.1703958190593637,0.019088210580947403,,,,,,2,0.013380939940168727,,,,PRUNED
36,36,29.166666666666668,2025-05-25 10:10:34.978284,2025-05-25 10:10:40.899461,0 days 00:00:05.921177,AdamW,0.21834605831927242,,,8.378763988031478e-05,,,,5,,,0.00010433696140601205,,PRUNED
37,37,,2025-05-25 10:10:40.935160,2025-05-25 10:10:46.249105,0 days 00:00:05.313945,SGD,0.04721737775545698,,,,1.0144058778624823e-05,95.45733560554316,False,7,,,,14.688686511696513,PRUNED
38,38,33.333333333333336,2025-05-25 10:10:46.282539,2025-05-25 10:10:52.273005,0 days 00:00:05.990466,AdamW,0.2414339135252332,,,0.0005080405898545492,,,,4,,,0.006498758589204362,,PRUNED
39,39,33.333333333333336,2025-05-25 10:10:52.307931,2025-05-25 10:10:58.269596,0 days 00:00:05.961665,Adadelta,0.1377395650453972,0.2697998746826366,,,,,,2,1.2731205051110535,,,,PRUNED
40,40,60.416666666666664,2025-05-25 10:10:58.305022,2025-05-25 10:11:09.500851,0 days 00:00:11.195829,AdamW,0.2871574055686184,,,2.147762049493491e-05,,,,0,,,0.003720561311304489,,COMPLETE
41,41,35.416666666666664,2025-05-25 10:11:09.551230,2025-05-25 10:11:15.532231,0 days 00:00:05.981001,AdamW,0.2978564232554323,,,2.294445495177369e-05,,,,0,,,0.0039468726219332425,,PRUNED
42,42,50.0,2025-05-25 10:11:15.569036,2025-05-25 10:11:26.849523,0 days 00:00:11.280487,AdamW,0.2585851953593351,,,2.6764015585258727e-05,,,,1,,,0.001977107177090047,,COMPLETE
43,43,35.416666666666664,2025-05-25 10:11:26.899848,2025-05-25 10:11:32.967783,0 days 00:00:06.067935,AdamW,0.3678568872784426,,,1.0489812464088019e-05,,,,0,,,0.0070171110314307256,,PRUNED
44,44,50.0,2025-05-25 10:11:33.004217,2025-05-25 10:11:44.227664,0 days 00:00:11.223447,AdamW,0.4126624024590751,,,9.446574617683816e-05,,,,5,,,0.004039439928631255,,COMPLETE
45,45,,2025-05-25 10:11:44.278009,2025-05-25 10:11:49.448591,0 days 00:00:05.170582,SGD,0.2866106776330739,,,,0.07697336416909212,50.556122432111465,False,3,,,,0.014941059416646479,PRUNED
46,46,33.333333333333336,2025-05-25 10:11:49.482071,2025-05-25 10:11:55.528142,0 days 00:00:06.046071,AdamW,0.3377546194923831,,,2.5567070303076573e-05,,,,7,,,0.004182037225140581,,PRUNED
47,47,33.333333333333336,2025-05-25 10:11:55.563587,2025-05-25 10:12:01.502093,0 days 00:00:05.938506,AdamW,0.2700674321872577,,,0.09843155468624189,,,,1,,,0.006977152759475859,,PRUNED
48,48,52.083333333333336,2025-05-25 10:12:01.536481,2025-05-25 10:12:12.836386,0 days 00:00:11.299905,AdamW,0.47635514056864386,,,8.517337932324344e-05,,,,2,,,0.0007594162269539257,,COMPLETE
49,49,33.333333333333336,2025-05-25 10:12:12.887522,2025-05-25 10:12:18.811977,0 days 00:00:05.924455,Adadelta,0.22810945242157527,95.61311598960178,,,,,,9,0.5053832131184154,,,,PRUNED
50,50,33.333333333333336,2025-05-25 10:12:18.845915,2025-05-25 10:12:24.874416,0 days 00:00:06.028501,AdamW,0.30571010529365744,,,0.00023986803295775232,,,,6,,,0.0005481854050298365,,PRUNED
51,51,39.583333333333336,2025-05-25 10:12:24.908585,2025-05-25 10:12:33.914960,0 days 00:00:09.006375,AdamW,0.3496152747292197,,,1.7496235054364685e-05,,,,10,,,0.008477824311880081,,PRUNED
52,52,33.333333333333336,2025-05-25 10:12:33.950528,2025-05-25 10:12:39.886074,0 days 00:00:05.935546,AdamW,0.40348821161313086,,,1.809229536404757e-05,,,,9,,,0.007640683012972201,,PRUNED
53,53,35.416666666666664,2025-05-25 10:12:39.922499,2025-05-25 10:12:45.838908,0 days 00:00:05.916409,AdamW,0.34081519500423096,,,4.408351748637256e-05,,,,12,,,0.004948183995043967,,PRUNED
54,54,33.333333333333336,2025-05-25 10:12:45.875502,2025-05-25 10:12:51.845168,0 days 00:00:05.969666,AdamW,0.37170167271628035,,,0.006075013141662347,,,,12,,,0.007139392778998346,,PRUNED
55,55,33.333333333333336,2025-05-25 10:12:51.880532,2025-05-25 10:12:57.848620,0 days 00:00:05.968088,Adam,0.3187231055221246,,0.004698602405888743,,,,,4,,63.58466387206514,,,PRUNED
56,56,,2025-05-25 10:12:57.884519,2025-05-25 10:13:03.318758,0 days 00:00:05.434239,SGD,0.2763569454897993,,,,0.00023157658815185116,51.4427435384869,True,13,,,,2.5777506692584136,PRUNED
57,57,33.333333333333336,2025-05-25 10:13:03.351820,2025-05-25 10:13:09.288583,0 days 00:00:05.936763,AdamW,0.35539339079812593,,,1.0859012588685611e-05,,,,3,,,0.009424211887928972,,PRUNED
58,58,35.416666666666664,2025-05-25 10:13:09.325619,2025-05-25 10:13:15.235211,0 days 00:00:05.909592,AdamW,0.4499293572956007,,,1.9641884514913177e-05,,,,10,,,0.00035772904575805033,,PRUNED
59,59,35.416666666666664,2025-05-25 10:13:15.277955,2025-05-25 10:13:20.238339,0 days 00:00:04.960384,AdamW,0.20030847381596745,,,3.7747281447285965e-05,,,,11,,,0.003252735112359871,,PRUNED
60,60,33.333333333333336,2025-05-25 10:13:20.266164,2025-05-25 10:13:22.799896,0 days 00:00:02.533732,Adam,0.3915110758236399,,0.07228331346383857,,,,,8,,8.159831276618172,,,PRUNED
61,61,37.5,2025-05-25 10:13:22.835895,2025-05-25 10:13:28.764583,0 days 00:00:05.928688,AdamW,0.060081162471842586,,,1.8400854321079385e-05,,,,6,,,0.0007849816411577329,,PRUNED
62,62,33.333333333333336,2025-05-25 10:13:28.801618,2025-05-25 10:13:34.731985,0 days 00:00:05.930367,AdamW,0.061895683265833015,,,2.9002098321430805e-05,,,,5,,,0.0009670047463120651,,PRUNED
63,63,54.166666666666664,2025-05-25 10:13:34.767645,2025-05-25 10:13:44.796653,0 days 00:00:10.029008,AdamW,0.036271608961891875,,,1.5052155964180895e-05,,,,6,,,0.002131477765889883,,COMPLETE
64,64,56.25,2025-05-25 10:13:44.848796,2025-05-25 10:13:50.022812,0 days 00:00:05.174016,AdamW,0.09338354387010711,,,1.2382618749940406e-05,,,,4,,,0.0022840467191810147,,COMPLETE
65,65,52.083333333333336,2025-05-25 10:13:50.063680,2025-05-25 10:14:00.459795,0 days 00:00:10.396115,AdamW,0.0032934025783225435,,,1.3767342248962932e-05,,,,7,,,0.0022473818277994385,,COMPLETE
66,66,35.416666666666664,2025-05-25 10:14:00.512729,2025-05-25 10:14:06.454942,0 days 00:00:05.942213,AdamW,0.09344033378132248,,,6.508403987143022e-05,,,,4,,,0.0014556750807833323,,PRUNED
67,67,37.5,2025-05-25 10:14:06.490052,2025-05-25 10:14:12.421200,0 days 00:00:05.931148,AdamW,0.01855057443841264,,,1.4737753805963336e-05,,,,3,,,0.0018318063188928785,,PRUNED
68,68,37.5,2025-05-25 10:14:12.539145,2025-05-25 10:14:18.583882,0 days 00:00:06.044737,AdamW,0.11532701429346986,,,1.0249581696721652e-05,,,,6,,,0.002485383330117164,,PRUNED
69,69,33.333333333333336,2025-05-25 10:14:18.619488,2025-05-25 10:14:24.693972,0 days 00:00:06.074484,Adadelta,0.0376904974401916,0.24925247345003218,,,,,,3,8.396148259479292,,,,PRUNED
70,70,,2025-05-25 10:14:24.728617,2025-05-25 10:14:30.008825,0 days 00:00:05.280208,SGD,0.08609923215062332,,,,0.00022589205489563976,24.761212396917543,True,5,,,,1.1072077330342096,PRUNED
71,71,35.416666666666664,2025-05-25 10:14:30.042996,2025-05-25 10:14:35.973485,0 days 00:00:05.930489,AdamW,0.32369908934691966,,,1.7465927850336876e-05,,,,4,,,0.0033287626209043313,,PRUNED
72,72,33.333333333333336,2025-05-25 10:14:36.007430,2025-05-25 10:14:42.028731,0 days 00:00:06.021301,AdamW,0.08023620085536892,,,4.303529128267128e-05,,,,4,,,0.005515741256031156,,PRUNED
73,73,33.333333333333336,2025-05-25 10:14:42.064795,2025-05-25 10:14:47.989464,0 days 00:00:05.924669,AdamW,0.12374531995276114,,,1.4113744383444599e-05,,,,7,,,0.001508053935598339,,PRUNED
74,74,33.333333333333336,2025-05-25 10:14:48.025689,2025-05-25 10:14:54.032960,0 days 00:00:06.007271,AdamW,0.24975796855185664,,,2.6567987806512207e-05,,,,9,,,0.0099233219042989,,PRUNED
75,75,37.5,2025-05-25 10:14:54.067523,2025-05-25 10:15:00.046026,0 days 00:00:05.978503,AdamW,0.49854393606930536,,,5.1063219653636536e-05,,,,1,,,0.0025533054192827752,,PRUNED
76,76,37.5,2025-05-25 10:15:00.080363,2025-05-25 10:15:06.051808,0 days 00:00:05.971445,AdamW,0.3086539618480079,,,0.00011072034327111261,,,,5,,,0.004658107516141721,,PRUNED
77,77,33.333333333333336,2025-05-25 10:15:06.086003,2025-05-25 10:15:12.016886,0 days 00:00:05.930883,AdamW,0.18189626972639927,,,0.0019966193821541692,,,,2,,,0.006313669332564248,,PRUNED
78,78,33.333333333333336,2025-05-25 10:15:12.052262,2025-05-25 10:15:17.977883,0 days 00:00:05.925621,Adam,0.16004332939495675,,0.0037563790906469793,,,,,12,,4.189740435370202,,,PRUNED
79,79,35.416666666666664,2025-05-25 10:15:18.011822,2025-05-25 10:15:24.080186,0 days 00:00:06.068364,AdamW,0.025587740664307555,,,3.407480120120297e-05,,,,4,,,0.0011320509461915976,,PRUNED
80,80,37.5,2025-05-25 10:15:24.115176,2025-05-25 10:15:30.050986,0 days 00:00:05.935810,AdamW,0.2629966482843127,,,6.14224467442632e-05,,,,6,,,0.002907846895805228,,PRUNED
81,81,37.5,2025-05-25 10:15:30.089213,2025-05-25 10:15:36.042535,0 days 00:00:05.953322,AdamW,0.057053048961912205,,,2.4199216553749528e-05,,,,5,,,0.0016771556676488024,,PRUNED
82,82,31.25,2025-05-25 10:15:36.078205,2025-05-25 10:15:42.064955,0 days 00:00:05.986750,AdamW,0.28391149580018654,,,1.4857752774467734e-05,,,,11,,,0.008232494896995254,,PRUNED
83,83,33.333333333333336,2025-05-25 10:15:42.098801,2025-05-25 10:15:48.084543,0 days 00:00:05.985742,AdamW,0.07361423150082813,,,3.317789279359121e-05,,,,6,,,0.0036124159006519496,,PRUNED
84,84,33.333333333333336,2025-05-25 10:15:48.121720,2025-05-25 10:15:54.137412,0 days 00:00:06.015692,AdamW,0.10531824530755693,,,2.2257967203939593e-05,,,,3,,,0.0012286674450360194,,PRUNED
85,85,33.333333333333336,2025-05-25 10:15:54.173037,2025-05-25 10:16:00.115782,0 days 00:00:05.942745,Adadelta,0.1382329968032403,11.909419283350534,,,,,,8,0.1086270079831175,,,,PRUNED
86,86,29.166666666666668,2025-05-25 10:16:00.154275,2025-05-25 10:16:06.113210,0 days 00:00:05.958935,AdamW,0.0407531666448432,,,1.0336595612252792e-05,,,,5,,,0.0008764955701369,,PRUNED
87,87,31.25,2025-05-25 10:16:06.150597,2025-05-25 10:16:12.153529,0 days 00:00:06.002932,AdamW,0.3640711469486208,,,2.1772742054595736e-05,,,,6,,,0.006032065780239276,,PRUNED
88,88,,2025-05-25 10:16:12.188145,2025-05-25 10:16:17.398989,0 days 00:00:05.210844,SGD,0.2145266771110564,,,,0.03822927253823338,64.03392489483738,False,7,,,,6.489648692471902,PRUNED
89,89,29.166666666666668,2025-05-25 10:16:17.432349,2025-05-25 10:16:23.450796,0 days 00:00:06.018447,AdamW,0.33986077992958885,,,1.3421037885341015e-05,,,,10,,,0.004666519419988979,,PRUNED
90,90,41.666666666666664,2025-05-25 10:16:23.485939,2025-05-25 10:16:31.608548,0 days 00:00:08.122609,AdamW,0.30795558283799407,,,6.67237070090605e-05,,,,0,,,0.0020078841776869773,,PRUNED
91,91,35.416666666666664,2025-05-25 10:16:31.644487,2025-05-25 10:16:37.653244,0 days 00:00:06.008757,AdamW,0.4547379098527441,,,0.000128692600699195,,,,2,,,0.0004771364783586047,,PRUNED
92,92,33.333333333333336,2025-05-25 10:16:37.690139,2025-05-25 10:16:43.660716,0 days 00:00:05.970577,AdamW,0.12652312563946508,,,0.0002757673146768576,,,,2,,,0.0006086167940208803,,PRUNED
93,93,37.5,2025-05-25 10:16:43.697157,2025-05-25 10:16:49.648953,0 days 00:00:05.951796,AdamW,0.23425714480673104,,,3.5559197582778416e-05,,,,1,,,0.0006564721711302862,,PRUNED
94,94,39.583333333333336,2025-05-25 10:16:49.684070,2025-05-25 10:16:55.759596,0 days 00:00:06.075526,AdamW,0.07007345129423936,,,7.366898038944489e-05,,,,2,,,0.0007648964406713195,,PRUNED
95,95,47.916666666666664,2025-05-25 10:16:55.796156,2025-05-25 10:17:07.006344,0 days 00:00:11.210188,AdamW,0.29558963908716734,,,2.6936864445910454e-05,,,,4,,,0.008710649076708817,,COMPLETE
96,96,31.25,2025-05-25 10:17:07.056634,2025-05-25 10:17:13.071430,0 days 00:00:06.014796,AdamW,0.32983551212333934,,,5.056113220080974e-05,,,,1,,,0.0013886532881348288,,PRUNED
97,97,39.583333333333336,2025-05-25 10:17:13.107326,2025-05-25 10:17:19.088969,0 days 00:00:05.981643,Adam,0.42197487327394234,,0.0009749536913735565,,,,,0,,0.09249797233124378,,,PRUNED
98,98,33.333333333333336,2025-05-25 10:17:19.125670,2025-05-25 10:17:25.129904,0 days 00:00:06.004234,AdamW,0.09900945554501442,,,9.38878830117859e-05,,,,3,,,0.0010179427411776368,,PRUNED
99,99,33.333333333333336,2025-05-25 10:17:25.165414,2025-05-25 10:17:31.162988,0 days 00:00:05.997574,AdamW,0.02906563107673416,,,0.00018036790011730533,,,,3,,,0.00045317772595480547,,PRUNED
100,100,33.333333333333336,2025-05-25 10:17:31.208073,2025-05-25 10:17:37.212116,0 days 00:00:06.004043,Adadelta,0.3822710206776795,0.14348854720522328,,,,,,4,3.7895102440099517,,,,PRUNED
101,101,31.25,2025-05-25 10:17:37.247720,2025-05-25 10:17:43.209139,0 days 00:00:05.961419,AdamW,0.01871574455615617,,,1.4807706852028079e-05,,,,7,,,0.002440828875856764,,PRUNED
102,102,29.166666666666668,2025-05-25 10:17:43.244063,2025-05-25 10:17:49.220964,0 days 00:00:05.976901,AdamW,0.008749858964187764,,,1.308824807375509e-05,,,,5,,,0.002210595418716481,,PRUNED
103,103,50.0,2025-05-25 10:17:49.256395,2025-05-25 10:18:00.582936,0 days 00:00:11.326541,AdamW,0.040910754924831046,,,1.966237108039074e-05,,,,4,,,0.001834791569470229,,PRUNED
104,104,58.333333333333336,2025-05-25 10:18:00.620267,2025-05-25 10:18:11.714415,0 days 00:00:11.094148,AdamW,0.003671937752101506,,,1.2228053898822109e-05,,,,9,,,0.003714938444573141,,COMPLETE
105,105,47.916666666666664,2025-05-25 10:18:11.765379,2025-05-25 10:18:22.946985,0 days 00:00:11.181606,AdamW,0.05366411111582834,,,1.978406410421764e-05,,,,9,,,0.0037765238217012612,,COMPLETE
106,106,33.333333333333336,2025-05-25 10:18:22.998606,2025-05-25 10:18:28.971027,0 days 00:00:05.972421,AdamW,0.2745901954978551,,,1.1992373768354837e-05,,,,12,,,0.005114610692910095,,PRUNED
107,107,33.333333333333336,2025-05-25 10:18:29.007215,2025-05-25 10:18:34.968565,0 days 00:00:05.961350,AdamW,0.1843826795313682,,,0.007061795457071586,,,,11,,,0.003330182766914061,,PRUNED
108,108,,2025-05-25 10:18:35.003366,2025-05-25 10:18:40.188410,0 days 00:00:05.185044,SGD,0.15238295226948712,,,,0.000840463647952095,72.1949632095048,True,10,,,,0.2638107846204855,PRUNED
109,109,37.5,2025-05-25 10:18:40.215115,2025-05-25 10:18:42.869874,0 days 00:00:02.654759,AdamW,0.2563662058780906,,,4.5073602284372115e-05,,,,8,,,0.007594229789664099,,PRUNED
110,110,37.5,2025-05-25 10:18:42.897516,2025-05-25 10:18:47.337524,0 days 00:00:04.440008,AdamW,0.013399371092986306,,,2.8828663948384088e-05,,,,6,,,0.004564232841311672,,PRUNED
111,111,27.083333333333332,2025-05-25 10:18:47.374826,2025-05-25 10:18:53.444243,0 days 00:00:06.069417,AdamW,0.034216314187827175,,,1.5363185211661124e-05,,,,7,,,0.0026586954080067312,,PRUNED
112,112,35.416666666666664,2025-05-25 10:18:53.480377,2025-05-25 10:18:59.437367,0 days 00:00:05.956990,AdamW,0.050506409180320344,,,1.7658272319304e-05,,,,10,,,0.0022175391645372247,,PRUNED
113,113,31.25,2025-05-25 10:18:59.471568,2025-05-25 10:19:04.577667,0 days 00:00:05.106099,AdamW,0.0043407185472230676,,,1.1632251336363434e-05,,,,5,,,0.006577173629985945,,PRUNED
