,number,value,datetime_start,datetime_complete,duration,params_algorithm,params_dropout_rate,params_lr_Adadelta,params_lr_Adam,params_lr_AdamW,params_lr_SGD,params_momentum_SGD,params_nesterov_SGD,params_suggested_freeze,params_weight_decay_Adadelta,params_weight_decay_Adam,params_weight_decay_AdamW,params_weight_decay_SGD,state
809,809,33.333333333333336,2025-05-25 11:31:39.212564,2025-05-25 11:31:45.308816,0 days 00:00:06.096252,Adam,0.2935895925862522,,8.856660677552401e-05,,,,,0,,0.030124222006253854,,,PRUNED
810,810,39.583333333333336,2025-05-25 11:31:45.351317,2025-05-25 11:31:51.500737,0 days 00:00:06.149420,AdamW,0.2631591007684473,,,1.98271556115735e-05,,,,5,,,0.001977543389889423,,PRUNED
811,811,35.416666666666664,2025-05-25 11:31:51.584365,2025-05-25 11:31:57.743360,0 days 00:00:06.158995,AdamW,0.057042475486145966,,,3.960951616645159e-05,,,,10,,,0.005201280644216301,,PRUNED
812,812,35.416666666666664,2025-05-25 11:31:57.786355,2025-05-25 11:32:03.958805,0 days 00:00:06.172450,AdamW,0.2971681170485376,,,2.7169799036531202e-05,,,,0,,,0.0016505601943836996,,PRUNED
813,813,35.416666666666664,2025-05-25 11:32:04.003265,2025-05-25 11:32:10.126996,0 days 00:00:06.123731,AdamW,0.3424371455988383,,,3.1822716204487265e-05,,,,2,,,0.0028647545184751592,,PRUNED
814,814,33.333333333333336,2025-05-25 11:32:10.169716,2025-05-25 11:32:16.276805,0 days 00:00:06.107089,AdamW,0.23535946091339305,,,1.3447031291232221e-05,,,,4,,,0.006448008575416519,,PRUNED
815,815,43.75,2025-05-25 11:32:16.320149,2025-05-25 11:32:22.517747,0 days 00:00:06.197598,AdamW,0.2838943652280828,,,4.700794040466353e-05,,,,12,,,0.0023449846634893026,,PRUNED
816,816,33.333333333333336,2025-05-25 11:32:22.562249,2025-05-25 11:32:28.707597,0 days 00:00:06.145348,AdamW,0.08596540340213872,,,8.163588085019124e-05,,,,1,,,0.0036900552381933585,,PRUNED
817,817,33.333333333333336,2025-05-25 11:32:28.750671,2025-05-25 11:32:34.865747,0 days 00:00:06.115076,AdamW,0.38511498130327015,,,1.7228243575437135e-05,,,,0,,,0.004764740830370905,,PRUNED
818,818,41.666666666666664,2025-05-25 11:32:34.908545,2025-05-25 11:32:41.050704,0 days 00:00:06.142159,AdamW,0.019041838231012548,,,2.215708218314596e-05,,,,4,,,0.002166477105244383,,PRUNED
819,819,33.333333333333336,2025-05-25 11:32:41.093289,2025-05-25 11:32:47.172469,0 days 00:00:06.079180,Adam,0.27310291676229553,,0.000903843493378373,,,,,11,,0.10490071108373607,,,PRUNED
820,820,35.416666666666664,2025-05-25 11:32:47.216330,2025-05-25 11:32:53.407029,0 days 00:00:06.190699,AdamW,0.30693719446879464,,,1.1708239002654893e-05,,,,8,,,0.0031193824549566175,,PRUNED
821,821,43.75,2025-05-25 11:32:53.449839,2025-05-25 11:32:59.559783,0 days 00:00:06.109944,AdamW,0.255690054301914,,,3.493085232086652e-05,,,,1,,,0.0026642598781895874,,PRUNED
822,822,41.666666666666664,2025-05-25 11:32:59.602472,2025-05-25 11:33:05.784386,0 days 00:00:06.181914,AdamW,0.21467977061769924,,,2.6093305638123154e-05,,,,3,,,0.0024311504602463944,,PRUNED
823,823,39.583333333333336,2025-05-25 11:33:05.827259,2025-05-25 11:33:11.991601,0 days 00:00:06.164342,AdamW,0.2765281626973073,,,6.145797544024822e-05,,,,0,,,0.005738926485966283,,PRUNED
824,824,43.75,2025-05-25 11:33:12.034897,2025-05-25 11:33:18.161704,0 days 00:00:06.126807,AdamW,0.2638454660121491,,,1.8067472772716817e-05,,,,9,,,0.001971263355823037,,PRUNED
825,825,33.333333333333336,2025-05-25 11:33:18.204613,2025-05-25 11:33:24.379884,0 days 00:00:06.175271,AdamW,0.04557907062502117,,,4.7578529324889703e-05,,,,7,,,0.004320212150110583,,PRUNED
826,826,35.416666666666664,2025-05-25 11:33:24.422455,2025-05-25 11:33:30.554274,0 days 00:00:06.131819,Adam,0.29174188294174364,,2.611162525369848e-05,,,,,1,,0.16127786708482417,,,PRUNED
827,827,43.75,2025-05-25 11:33:30.597883,2025-05-25 11:33:36.714200,0 days 00:00:06.116317,AdamW,0.31506087062869326,,,1.3784646745190404e-05,,,,5,,,0.0014061246040847444,,PRUNED
828,828,33.333333333333336,2025-05-25 11:33:36.757325,2025-05-25 11:33:41.072029,0 days 00:00:04.314704,Adadelta,0.1443813950416974,0.31363912701889635,,,,,,11,5.427331262895865,,,,PRUNED
829,829,41.666666666666664,2025-05-25 11:33:41.101144,2025-05-25 11:33:43.867980,0 days 00:00:02.766836,AdamW,0.24996708045566257,,,2.230647305574131e-05,,,,0,,,0.0033440074277067363,,PRUNED
830,830,54.166666666666664,2025-05-25 11:33:43.910207,2025-05-25 11:33:51.972991,0 days 00:00:08.062784,AdamW,0.16619214611556898,,,3.257611118681537e-05,,,,3,,,0.0017504248305664335,,COMPLETE
831,831,31.25,2025-05-25 11:33:52.034401,2025-05-25 11:33:58.172233,0 days 00:00:06.137832,AdamW,0.37055758804033545,,,3.968473949299495e-05,,,,6,,,0.001212803954187948,,PRUNED
832,832,,2025-05-25 11:33:58.216487,2025-05-25 11:34:03.614256,0 days 00:00:05.397769,SGD,0.008468679142342391,,,,0.006563932284445411,23.66717737643841,True,1,,,,0.04419918935936531,PRUNED
833,833,37.5,2025-05-25 11:34:03.655884,2025-05-25 11:34:07.930041,0 days 00:00:04.274157,AdamW,0.33064407054233735,,,1.5358898308453513e-05,,,,0,,,0.002214387396181707,,PRUNED
834,834,35.416666666666664,2025-05-25 11:34:07.971501,2025-05-25 11:34:10.516134,0 days 00:00:02.544633,AdamW,0.00032458395521633076,,,2.6999702419751887e-05,,,,4,,,0.007642081612406559,,PRUNED
835,835,37.5,2025-05-25 11:34:10.557045,2025-05-25 11:34:13.669083,0 days 00:00:03.112038,AdamW,0.10491123044224994,,,5.294154678137609e-05,,,,0,,,0.003834606019410534,,PRUNED
836,836,25.0,2025-05-25 11:34:13.706221,2025-05-25 11:34:18.970807,0 days 00:00:05.264586,AdamW,0.28071718504300364,,,1.954173790819199e-05,,,,10,,,0.005101558076980564,,PRUNED
837,837,33.333333333333336,2025-05-25 11:34:19.014202,2025-05-25 11:34:25.249676,0 days 00:00:06.235474,Adam,0.02666640935696419,,3.19196780421009e-05,,,,,9,,0.21395995381578056,,,PRUNED
838,838,37.5,2025-05-25 11:34:25.293837,2025-05-25 11:34:31.457501,0 days 00:00:06.163664,AdamW,0.4404088397008458,,,1.006423956108959e-05,,,,0,,,0.0028063935073429592,,PRUNED
839,839,33.333333333333336,2025-05-25 11:34:31.502221,2025-05-25 11:34:37.622455,0 days 00:00:06.120234,AdamW,0.3535075343491938,,,7.322348937076311e-05,,,,1,,,0.0024326408382324416,,PRUNED
840,840,41.666666666666664,2025-05-25 11:34:37.665900,2025-05-25 11:34:43.816517,0 days 00:00:06.150617,AdamW,0.2990298382423513,,,3.9290865256312046e-05,,,,7,,,0.004712829025832725,,PRUNED
841,841,35.416666666666664,2025-05-25 11:34:43.859185,2025-05-25 11:34:50.051444,0 days 00:00:06.192259,AdamW,0.2681361078623006,,,1.2294691819781392e-05,,,,0,,,0.0019249124695068826,,PRUNED
842,842,41.666666666666664,2025-05-25 11:34:50.094735,2025-05-25 11:34:56.257861,0 days 00:00:06.163126,AdamW,0.2849981840771768,,,2.9854511240841154e-05,,,,10,,,0.002156867680724884,,PRUNED
843,843,33.333333333333336,2025-05-25 11:34:56.301842,2025-05-25 11:35:02.527462,0 days 00:00:06.225620,AdamW,0.40427953320576365,,,9.656252457023292e-05,,,,5,,,0.0026263494928327642,,PRUNED
844,844,31.25,2025-05-25 11:35:02.571378,2025-05-25 11:35:08.744112,0 days 00:00:06.172734,AdamW,0.259841601631203,,,1.6502081207788936e-05,,,,1,,,0.006492717690557499,,PRUNED
845,845,33.333333333333336,2025-05-25 11:35:08.788749,2025-05-25 11:35:14.944620,0 days 00:00:06.155871,Adam,0.2734108787100799,,1.1723270432086905e-05,,,,,6,,0.07619008636245368,,,PRUNED
846,846,45.833333333333336,2025-05-25 11:35:14.988570,2025-05-25 11:35:21.078354,0 days 00:00:06.089784,AdamW,0.23939234373487248,,,2.571378722156144e-05,,,,11,,,0.002952020651497976,,PRUNED
847,847,33.333333333333336,2025-05-25 11:35:21.122437,2025-05-25 11:35:27.308343,0 days 00:00:06.185906,AdamW,0.22694698541882272,,,2.1922565222347643e-05,,,,4,,,0.005487763163873544,,PRUNED
848,848,33.333333333333336,2025-05-25 11:35:27.352042,2025-05-25 11:35:33.528949,0 days 00:00:06.176907,AdamW,0.01671392778886186,,,0.027756582454229198,,,,2,,,0.0015998571078276718,,PRUNED
849,849,33.333333333333336,2025-05-25 11:35:33.572065,2025-05-25 11:35:39.729263,0 days 00:00:06.157198,AdamW,0.11894267645905798,,,4.625763713979128e-05,,,,0,,,0.002063437648352028,,PRUNED
850,850,33.333333333333336,2025-05-25 11:35:39.773071,2025-05-25 11:35:45.898798,0 days 00:00:06.125727,Adadelta,0.2918459844579518,0.20130207404108225,,,,,,1,0.6122119841296289,,,,PRUNED
851,851,33.333333333333336,2025-05-25 11:35:45.943531,2025-05-25 11:35:52.130143,0 days 00:00:06.186612,AdamW,0.031767623931079896,,,0.0001724158544225932,,,,0,,,0.004351000184913495,,PRUNED
852,852,33.333333333333336,2025-05-25 11:35:52.174342,2025-05-25 11:35:58.328198,0 days 00:00:06.153856,AdamW,0.06516245608616666,,,3.48686397394862e-05,,,,0,,,0.0035144814885981427,,PRUNED
853,853,29.166666666666668,2025-05-25 11:35:58.371196,2025-05-25 11:36:04.511014,0 days 00:00:06.139818,AdamW,0.3201863963586776,,,1.519664367006565e-05,,,,12,,,0.0023553858203623867,,PRUNED
854,854,31.25,2025-05-25 11:36:04.557778,2025-05-25 11:36:10.659730,0 days 00:00:06.101952,AdamW,0.2776870167876241,,,6.047917781014648e-05,,,,11,,,0.0018878221198979912,,PRUNED
855,855,33.333333333333336,2025-05-25 11:36:10.704320,2025-05-25 11:36:16.804126,0 days 00:00:06.099806,Adam,0.2491048980490915,,0.0006485280432588094,,,,,1,,1.2520183782332612,,,PRUNED
856,856,37.5,2025-05-25 11:36:16.864005,2025-05-25 11:36:23.073741,0 days 00:00:06.209736,AdamW,0.29767280219120745,,,1.808109341349019e-05,,,,4,,,0.0058699055048139544,,PRUNED
857,857,,2025-05-25 11:36:23.117342,2025-05-25 11:36:28.518046,0 days 00:00:05.400704,SGD,0.30951499161123575,,,,0.023104728208783676,68.67594091163392,False,0,,,,0.010555803146702807,PRUNED
858,858,37.5,2025-05-25 11:36:28.560513,2025-05-25 11:36:34.683048,0 days 00:00:06.122535,AdamW,0.2681785047197245,,,1.2470770982986967e-05,,,,3,,,0.0025681927352327835,,PRUNED
859,859,37.5,2025-05-25 11:36:34.727845,2025-05-25 11:36:40.846358,0 days 00:00:06.118513,AdamW,0.28504918400771584,,,2.186630358839378e-05,,,,6,,,0.0031242115280269316,,PRUNED
860,860,41.666666666666664,2025-05-25 11:36:40.891064,2025-05-25 11:36:47.037683,0 days 00:00:06.146619,AdamW,0.3784649469345326,,,0.00012129627293768357,,,,10,,,0.003968589385437185,,PRUNED
861,861,37.5,2025-05-25 11:36:47.081116,2025-05-25 11:36:53.331873,0 days 00:00:06.250757,AdamW,0.2575676429641832,,,2.8835278800822517e-05,,,,5,,,0.0014725968373846966,,PRUNED
862,862,45.833333333333336,2025-05-25 11:36:53.374459,2025-05-25 11:36:59.721787,0 days 00:00:06.347328,AdamW,0.022220757972779413,,,3.980959057165893e-05,,,,2,,,0.00508285062423718,,PRUNED
863,863,33.333333333333336,2025-05-25 11:36:59.765418,2025-05-25 11:37:05.885277,0 days 00:00:06.119859,AdamW,0.07849128934235837,,,4.63431788003258e-05,,,,8,,,0.0017901701140394695,,PRUNED
864,864,33.333333333333336,2025-05-25 11:37:05.928618,2025-05-25 11:37:12.114159,0 days 00:00:06.185541,Adam,0.3002494742071505,,0.00015255278089399768,,,,,0,,0.37800883882228925,,,PRUNED
865,865,31.25,2025-05-25 11:37:12.157808,2025-05-25 11:37:18.340194,0 days 00:00:06.182386,AdamW,0.2689744146479475,,,1.389069521205439e-05,,,,4,,,0.002125412283252349,,PRUNED
866,866,45.833333333333336,2025-05-25 11:37:18.385198,2025-05-25 11:37:24.574375,0 days 00:00:06.189177,AdamW,0.042835390769306134,,,1.907280796509564e-05,,,,1,,,0.0001593470535159976,,PRUNED
867,867,43.75,2025-05-25 11:37:24.617183,2025-05-25 11:37:30.732509,0 days 00:00:06.115326,AdamW,0.28274867684409155,,,5.422839397735557e-05,,,,5,,,0.006831714065719758,,PRUNED
868,868,43.75,2025-05-25 11:37:30.775939,2025-05-25 11:37:36.916016,0 days 00:00:06.140077,AdamW,0.339887144257101,,,7.484800372015649e-05,,,,7,,,0.0023678634564378823,,PRUNED
869,869,35.416666666666664,2025-05-25 11:37:36.959685,2025-05-25 11:37:43.183488,0 days 00:00:06.223803,AdamW,0.275864446789703,,,2.5892116578937075e-05,,,,0,,,0.004572644090525697,,PRUNED
870,870,62.5,2025-05-25 11:37:43.228038,2025-05-25 11:37:54.693069,0 days 00:00:11.465031,AdamW,0.49450928435744584,,,3.2813856334991265e-05,,,,1,,,0.0028378069877034264,,COMPLETE
871,871,29.166666666666668,2025-05-25 11:37:54.753957,2025-05-25 11:38:00.892082,0 days 00:00:06.138125,AdamW,0.49111110902514993,,,2.2537307587918316e-05,,,,11,,,0.00315595034506902,,PRUNED
872,872,33.333333333333336,2025-05-25 11:38:00.935154,2025-05-25 11:38:07.096882,0 days 00:00:06.161728,AdamW,0.4966812714625847,,,3.1860399583444596e-05,,,,0,,,0.0034251540426052467,,PRUNED
873,873,33.333333333333336,2025-05-25 11:38:07.141719,2025-05-25 11:38:13.250724,0 days 00:00:06.109005,Adam,0.48449074076940174,,0.0022099313754116727,,,,,1,,89.87548012383104,,,PRUNED
874,874,35.416666666666664,2025-05-25 11:38:13.294894,2025-05-25 11:38:19.477855,0 days 00:00:06.182961,AdamW,0.4769049410729139,,,1.1638775413892063e-05,,,,0,,,0.002887358596149289,,PRUNED
875,875,35.416666666666664,2025-05-25 11:38:19.521116,2025-05-25 11:38:25.708574,0 days 00:00:06.187458,AdamW,0.45150605674550753,,,1.669374418707634e-05,,,,4,,,0.0027761922290452843,,PRUNED
876,876,33.333333333333336,2025-05-25 11:38:25.752127,2025-05-25 11:38:31.901859,0 days 00:00:06.149732,Adadelta,0.43034180221832635,89.75940091039028,,,,,,6,0.019434844281719103,,,,PRUNED
877,877,33.333333333333336,2025-05-25 11:38:31.945849,2025-05-25 11:38:38.036501,0 days 00:00:06.090652,AdamW,0.47390362256004803,,,1.0002099597712373e-05,,,,11,,,0.0037252600284204142,,PRUNED
878,878,31.25,2025-05-25 11:38:38.079757,2025-05-25 11:38:44.244019,0 days 00:00:06.164262,AdamW,0.4605436187049101,,,0.00033632472580552987,,,,9,,,0.0030502587858594597,,PRUNED
879,879,31.25,2025-05-25 11:38:44.287090,2025-05-25 11:38:50.418550,0 days 00:00:06.131460,AdamW,0.4971594870933585,,,1.5064614601620577e-05,,,,10,,,0.003393766797751042,,PRUNED
880,880,,2025-05-25 11:38:50.463410,2025-05-25 11:38:55.946765,0 days 00:00:05.483355,SGD,0.491319452827195,,,,0.00016842309807577364,81.58921284452916,True,1,,,,1.4034900713614462,PRUNED
881,881,39.583333333333336,2025-05-25 11:38:55.991124,2025-05-25 11:39:01.192181,0 days 00:00:05.201057,AdamW,0.4863953024117503,,,2.0033312914717947e-05,,,,0,,,0.004195497874818624,,PRUNED
882,882,35.416666666666664,2025-05-25 11:39:01.230653,2025-05-25 11:39:04.908550,0 days 00:00:03.677897,AdamW,0.007962687907280719,,,3.937242473713628e-05,,,,8,,,0.0027367400238674983,,PRUNED
883,883,33.333333333333336,2025-05-25 11:39:04.938495,2025-05-25 11:39:07.884365,0 days 00:00:02.945870,Adam,0.4742258417331246,,0.030113707556806934,,,,,1,,0.5375656236230187,,,PRUNED
884,884,45.833333333333336,2025-05-25 11:39:07.916462,2025-05-25 11:39:12.836327,0 days 00:00:04.919865,AdamW,0.46607190802166343,,,2.996982115694799e-05,,,,0,,,0.0025760537440222353,,PRUNED
885,885,31.25,2025-05-25 11:39:12.879686,2025-05-25 11:39:19.030278,0 days 00:00:06.150592,AdamW,0.05388429698160671,,,0.00020824841859572806,,,,2,,,0.0061605922841983345,,PRUNED
886,886,33.333333333333336,2025-05-25 11:39:19.073761,2025-05-25 11:39:25.281059,0 days 00:00:06.207298,AdamW,0.0161726534619673,,,6.51982831312324e-05,,,,3,,,0.004809214145991883,,PRUNED
887,887,35.416666666666664,2025-05-25 11:39:25.327779,2025-05-25 11:39:30.191234,0 days 00:00:04.863455,AdamW,0.48380507316624627,,,2.3733848194002405e-05,,,,0,,,0.00392983815112964,,PRUNED
888,888,45.833333333333336,2025-05-25 11:39:30.231711,2025-05-25 11:39:32.658912,0 days 00:00:02.427201,AdamW,0.45682635665165305,,,5.0706051925413444e-05,,,,5,,,0.005364682807809614,,PRUNED
889,889,41.666666666666664,2025-05-25 11:39:32.700154,2025-05-25 11:39:36.206607,0 days 00:00:03.506453,AdamW,0.3561646419709293,,,3.5142965160906285e-05,,,,1,,,0.0032572486277998324,,PRUNED
890,890,35.416666666666664,2025-05-25 11:39:36.249418,2025-05-25 11:39:42.336203,0 days 00:00:06.086785,AdamW,0.49152455124874217,,,9.24354427100767e-05,,,,4,,,0.002976159605425549,,PRUNED
891,891,35.416666666666664,2025-05-25 11:39:42.380744,2025-05-25 11:39:48.600534,0 days 00:00:06.219790,AdamW,0.18790149417405677,,,1.8251324106667806e-05,,,,7,,,0.002478555082390437,,PRUNED
892,892,25.0,2025-05-25 11:39:48.644861,2025-05-25 11:39:54.901935,0 days 00:00:06.257074,Adam,0.4692297755873872,,3.7888999325541514e-05,,,,,0,,29.31609654390746,,,PRUNED
893,893,22.916666666666668,2025-05-25 11:39:54.945680,2025-05-25 11:40:01.066635,0 days 00:00:06.120955,AdamW,0.03361460463483447,,,2.573001655273321e-05,,,,6,,,0.004615538472547834,,PRUNED
894,894,33.333333333333336,2025-05-25 11:40:01.112476,2025-05-25 11:40:07.216896,0 days 00:00:06.104420,AdamW,0.2195548313880635,,,1.2416079131389527e-05,,,,11,,,0.003530523360466596,,PRUNED
895,895,31.25,2025-05-25 11:40:07.261528,2025-05-25 11:40:13.427642,0 days 00:00:06.166114,AdamW,0.23888065122454638,,,1.5023558890992612e-05,,,,1,,,0.0027602656730944665,,PRUNED
896,896,33.333333333333336,2025-05-25 11:40:13.471717,2025-05-25 11:40:19.643430,0 days 00:00:06.171713,AdamW,0.0888162215114291,,,4.286476145023723e-05,,,,0,,,0.007980085089533046,,PRUNED
897,897,33.333333333333336,2025-05-25 11:40:19.686943,2025-05-25 11:40:25.854341,0 days 00:00:06.167398,AdamW,0.4976614470708337,,,2.0595097422848843e-05,,,,10,,,0.0016595731849164237,,PRUNED
898,898,33.333333333333336,2025-05-25 11:40:25.899447,2025-05-25 11:40:32.003764,0 days 00:00:06.104317,Adadelta,0.3952541155784363,9.853681302611491,,,,,,12,0.15636589288845695,,,,PRUNED
899,899,37.5,2025-05-25 11:40:32.048697,2025-05-25 11:40:38.193968,0 days 00:00:06.145271,AdamW,0.317883584449245,,,2.847348084412164e-05,,,,9,,,0.002253915552458582,,PRUNED
900,900,35.416666666666664,2025-05-25 11:40:38.239001,2025-05-25 11:40:44.439574,0 days 00:00:06.200573,AdamW,0.006025753737307196,,,6.321027218533234e-05,,,,2,,,0.0013023088808277441,,PRUNED
901,901,31.25,2025-05-25 11:40:44.484972,2025-05-25 11:40:50.608420,0 days 00:00:06.123448,Adam,0.47935606512320894,,2.1861315036254824e-05,,,,,0,,1.839600723965123,,,PRUNED
902,902,33.333333333333336,2025-05-25 11:40:50.652376,2025-05-25 11:40:56.813600,0 days 00:00:06.161224,AdamW,0.4129947218567443,,,3.538512355731152e-05,,,,11,,,0.002015142799657964,,PRUNED
903,903,33.333333333333336,2025-05-25 11:40:56.857056,2025-05-25 11:41:03.044976,0 days 00:00:06.187920,AdamW,0.15564212445047282,,,1.3887068647753102e-05,,,,4,,,0.005868779779482587,,PRUNED
904,904,43.75,2025-05-25 11:41:03.111680,2025-05-25 11:41:09.280561,0 days 00:00:06.168881,AdamW,0.44372512156361626,,,1.750080878351756e-05,,,,5,,,0.0011645724707345516,,PRUNED
905,905,,2025-05-25 11:41:09.325825,2025-05-25 11:41:14.751152,0 days 00:00:05.425327,SGD,0.2471642641673156,,,,0.0014715823252064053,94.60114639262032,False,1,,,,0.3433550421921026,PRUNED
906,906,54.166666666666664,2025-05-25 11:41:14.793249,2025-05-25 11:41:26.301238,0 days 00:00:11.507989,AdamW,0.042927231734482325,,,5.1116986444239826e-05,,,,0,,,0.004228133889972962,,COMPLETE
907,907,41.666666666666664,2025-05-25 11:41:26.364997,2025-05-25 11:41:32.518616,0 days 00:00:06.153619,AdamW,0.32881334806556634,,,2.5773569565380386e-05,,,,0,,,0.0025604633701377857,,PRUNED
908,908,41.666666666666664,2025-05-25 11:41:32.562395,2025-05-25 11:41:38.701235,0 days 00:00:06.138840,AdamW,0.3704206975032777,,,7.565675184043329e-05,,,,1,,,0.00509591207773469,,PRUNED
909,909,39.583333333333336,2025-05-25 11:41:38.746237,2025-05-25 11:41:44.902669,0 days 00:00:06.156432,AdamW,0.3086052175667052,,,2.260919737201217e-05,,,,6,,,0.00034175213622621734,,PRUNED
910,910,45.833333333333336,2025-05-25 11:41:44.947022,2025-05-25 11:41:51.131095,0 days 00:00:06.184073,AdamW,0.025212773490167942,,,4.28526825372062e-05,,,,3,,,0.0017662771946705782,,PRUNED
911,911,37.5,2025-05-25 11:41:51.174933,2025-05-25 11:41:57.360612,0 days 00:00:06.185679,Adam,0.23529878000438184,,7.117284339524377e-05,,,,,4,,0.28540750676404986,,,PRUNED
912,912,45.833333333333336,2025-05-25 11:41:57.404688,2025-05-25 11:42:03.550503,0 days 00:00:06.145815,AdamW,0.2558825768769437,,,3.37976189636877e-05,,,,0,,,0.0037576031300639904,,PRUNED
913,913,33.333333333333336,2025-05-25 11:42:03.596214,2025-05-25 11:42:09.759732,0 days 00:00:06.163518,AdamW,0.06517605371089472,,,1.2304025186150679e-05,,,,1,,,0.007079645063889705,,PRUNED
914,914,22.916666666666668,2025-05-25 11:42:09.803629,2025-05-25 11:42:15.964061,0 days 00:00:06.160432,AdamW,0.30333826690726023,,,1.671351552585455e-05,,,,11,,,0.0029766223018106138,,PRUNED
915,915,39.583333333333336,2025-05-25 11:42:16.007761,2025-05-25 11:42:22.204221,0 days 00:00:06.196460,AdamW,0.3442451750580337,,,2.9651257515437828e-05,,,,10,,,0.002189870777813878,,PRUNED
916,916,31.25,2025-05-25 11:42:22.251030,2025-05-25 11:42:28.402233,0 days 00:00:06.151203,AdamW,0.29359686306638283,,,1.9808565969441927e-05,,,,0,,,0.005651727798160898,,PRUNED
917,917,31.25,2025-05-25 11:42:28.447211,2025-05-25 11:42:34.566239,0 days 00:00:06.119028,AdamW,0.46504520390900633,,,0.00024290266068911396,,,,4,,,0.0019154207415647074,,PRUNED
918,918,35.416666666666664,2025-05-25 11:42:34.610821,2025-05-25 11:42:40.777338,0 days 00:00:06.166517,AdamW,0.07594161238867754,,,5.790441530057294e-05,,,,6,,,0.003236400880212659,,PRUNED
919,919,33.333333333333336,2025-05-25 11:42:40.821697,2025-05-25 11:42:46.959785,0 days 00:00:06.138088,Adam,0.28875727920943495,,0.00043639686740984184,,,,,0,,0.018690488456008642,,,PRUNED
920,920,35.416666666666664,2025-05-25 11:42:47.005585,2025-05-25 11:42:53.192988,0 days 00:00:06.187403,AdamW,0.2044311794736118,,,4.179042156097757e-05,,,,7,,,0.0026782100614766782,,PRUNED
921,921,41.666666666666664,2025-05-25 11:42:53.237203,2025-05-25 11:42:59.391477,0 days 00:00:06.154274,AdamW,0.10752586778340575,,,1.3984931560648123e-05,,,,9,,,0.0023773643848922126,,PRUNED
922,922,41.666666666666664,2025-05-25 11:42:59.436841,2025-05-25 11:43:05.647345,0 days 00:00:06.210504,AdamW,0.01627428646336998,,,2.2514740758835654e-05,,,,1,,,0.006559245317590526,,PRUNED
923,923,39.583333333333336,2025-05-25 11:43:05.692694,2025-05-25 11:43:11.849334,0 days 00:00:06.156640,AdamW,0.2601040656616091,,,2.9261684783581094e-05,,,,0,,,0.0020593728729832957,,PRUNED
