,number,value,datetime_start,datetime_complete,duration,params_algorithm,params_dropout_rate,params_lr_Adadelta,params_lr_Adam,params_lr_AdamW,params_lr_SGD,params_momentum_SGD,params_nesterov_SGD,params_suggested_freeze,params_weight_decay_Adadelta,params_weight_decay_Adam,params_weight_decay_AdamW,params_weight_decay_SGD,state
0,0,39.583333333333336,2025-05-24 19:49:36.438117,2025-05-24 19:49:49.086781,0 days 00:00:12.648664,Adadelta,0.4753571532049581,0.017073967431528128,,,,,,5,29.154431891537552,,,,COMPLETE
1,1,45.833333333333336,2025-05-24 19:49:49.145172,2025-05-24 19:50:00.491198,0 days 00:00:11.346026,Adam,0.35403628889802274,,5.3370327626039544e-05,,,,,8,,0.05415244119402541,,,COMPLETE
2,2,50.0,2025-05-24 19:50:00.530083,2025-05-24 19:50:05.438590,0 days 00:00:04.908507,AdamW,0.2623782158161189,,,0.00014742753159914678,,,,4,,,0.0005404103854647331,,COMPLETE
3,3,35.416666666666664,2025-05-24 19:50:05.487666,2025-05-24 19:50:11.736081,0 days 00:00:06.248415,AdamW,0.3925879806965068,,,0.0026926469100861782,,,,6,,,0.00021930485556643703,,COMPLETE
4,4,33.333333333333336,2025-05-24 19:50:11.779910,2025-05-24 19:50:16.864545,0 days 00:00:05.084635,Adadelta,0.4744427686266666,5.456725485601478,,,,,,0,0.5762487216478605,,,,COMPLETE
5,5,35.416666666666664,2025-05-24 19:50:16.906507,2025-05-24 19:50:23.343175,0 days 00:00:06.436668,Adam,0.2475884550556351,,0.00017654048052495074,,,,,1,,1.2030178871154673,,,PRUNED
6,6,33.333333333333336,2025-05-24 19:50:23.378505,2025-05-24 19:50:33.106650,0 days 00:00:09.728145,Adadelta,0.09242722776276352,2.463768595899747,,,,,,7,48.696409415209004,,,,PRUNED
7,7,33.333333333333336,2025-05-24 19:50:33.141645,2025-05-24 19:50:39.750782,0 days 00:00:06.609137,AdamW,0.0979914312095726,,,0.02065142557895925,,,,1,,,0.0005170191786366995,,PRUNED
8,8,33.333333333333336,2025-05-24 19:50:39.778623,2025-05-24 19:50:46.382084,0 days 00:00:06.603461,SGD,0.27134804157912423,,,,0.012273800987852962,0.5621564911890039,True,3,,,,0.06235377135673159,PRUNED
9,9,,2025-05-24 19:50:46.418650,2025-05-24 19:50:52.309245,0 days 00:00:05.890595,SGD,0.38563517334297287,,,,0.0031130959561221226,6.365199445099503,False,10,,,,0.2106648601704221,PRUNED
10,10,29.166666666666668,2025-05-24 19:50:52.342968,2025-05-24 19:50:58.301089,0 days 00:00:05.958121,AdamW,0.0029985914779085965,,,1.1799062523159256e-05,,,,13,,,0.006630907782559361,,PRUNED
11,11,50.0,2025-05-24 19:50:58.335413,2025-05-24 19:51:09.559156,0 days 00:00:11.223743,Adam,0.2687772072034616,,1.4185357673699857e-05,,,,,9,,0.011200687440843897,,,COMPLETE
12,12,33.333333333333336,2025-05-24 19:51:09.609588,2025-05-24 19:51:16.586494,0 days 00:00:06.976906,Adam,0.2280781684174102,,0.05695066179412926,,,,,10,,0.013299972137426787,,,PRUNED
13,13,43.75,2025-05-24 19:51:16.621728,2025-05-24 19:51:27.913671,0 days 00:00:11.291943,Adam,0.3035921370166128,,1.0741110384103409e-05,,,,,4,,37.639965874722925,,,COMPLETE
14,14,58.333333333333336,2025-05-24 19:51:27.964363,2025-05-24 19:51:39.079456,0 days 00:00:11.115093,AdamW,0.17296373138830565,,,5.107684925222934e-05,,,,9,,,0.0025253710106474536,,COMPLETE
15,15,52.083333333333336,2025-05-24 19:51:39.130687,2025-05-24 19:51:50.330547,0 days 00:00:11.199860,AdamW,0.17754810485613656,,,4.839668264505077e-05,,,,12,,,0.0021601863672613586,,COMPLETE
16,16,27.083333333333332,2025-05-24 19:51:50.380953,2025-05-24 19:51:56.140582,0 days 00:00:05.759629,AdamW,0.1459747215084099,,,3.091592599668577e-05,,,,13,,,0.003944479816467623,,PRUNED
17,17,41.666666666666664,2025-05-24 19:51:56.176587,2025-05-24 19:52:07.280926,0 days 00:00:11.104339,AdamW,0.17584078186962945,,,0.0003230170128868152,,,,11,,,0.002192593935913539,,COMPLETE
18,18,27.083333333333332,2025-05-24 19:52:07.331956,2025-05-24 19:52:13.272151,0 days 00:00:05.940195,AdamW,0.18175996362964889,,,5.6861741806643255e-05,,,,11,,,0.002117035515125565,,PRUNED
19,19,33.333333333333336,2025-05-24 19:52:13.307882,2025-05-24 19:52:21.309783,0 days 00:00:08.001901,AdamW,0.022825095691918512,,,0.0007748755752908133,,,,12,,,0.0013068856378153323,,PRUNED
20,20,,2025-05-24 19:52:21.345541,2025-05-24 19:52:26.765699,0 days 00:00:05.420158,SGD,0.078573412033039,,,,2.025934909325147e-05,88.37749112170019,True,8,,,,71.38393633927497,PRUNED
21,21,56.25,2025-05-24 19:52:26.799690,2025-05-24 19:52:37.867176,0 days 00:00:11.067486,AdamW,0.1980486521024058,,,0.0001268109621185728,,,,3,,,0.0005991538986340598,,COMPLETE
22,22,50.0,2025-05-24 19:52:37.919048,2025-05-24 19:52:49.187824,0 days 00:00:11.268776,AdamW,0.19673125713674994,,,7.996399635023725e-05,,,,7,,,0.0007937809032528464,,COMPLETE
23,23,29.166666666666668,2025-05-24 19:52:49.239859,2025-05-24 19:52:56.319370,0 days 00:00:07.079511,AdamW,0.1417614020856031,,,1.3970734935405238e-05,,,,9,,,0.0032684513852963546,,PRUNED
24,24,33.333333333333336,2025-05-24 19:52:56.355832,2025-05-24 19:53:03.404967,0 days 00:00:07.049135,AdamW,0.13203518323118493,,,0.0002671873415336471,,,,2,,,0.00023045254190652765,,PRUNED
25,25,31.25,2025-05-24 19:53:03.440646,2025-05-24 19:53:09.434513,0 days 00:00:05.993867,AdamW,0.2123355928938542,,,5.5127940720008106e-05,,,,12,,,0.0012514130679968053,,PRUNED
26,26,33.333333333333336,2025-05-24 19:53:09.470818,2025-05-24 19:53:16.492195,0 days 00:00:07.021377,AdamW,0.3008765472653754,,,0.0011849046509545083,,,,6,,,0.009719434820847597,,PRUNED
27,27,35.416666666666664,2025-05-24 19:53:16.528602,2025-05-24 19:53:24.594274,0 days 00:00:08.065672,AdamW,0.04765709148154493,,,2.7345819886074583e-05,,,,11,,,0.00044611675659237467,,PRUNED
28,28,33.333333333333336,2025-05-24 19:53:24.631994,2025-05-24 19:53:30.970005,0 days 00:00:06.338011,Adadelta,0.162668315042697,71.09750733359516,,,,,,9,0.016987592312017272,,,,PRUNED
29,29,,2025-05-24 19:53:31.006507,2025-05-24 19:53:35.735980,0 days 00:00:04.729473,SGD,0.1137270160167497,,,,1.4839113238339737e-05,95.86041307333699,False,5,,,,18.395730677410548,PRUNED
30,30,37.5,2025-05-24 19:53:35.770761,2025-05-24 19:53:43.832927,0 days 00:00:08.062166,Adadelta,0.054851986160220925,0.012327990271406086,,,,,,5,0.017620822291138413,,,,PRUNED
31,31,31.25,2025-05-24 19:53:43.868993,2025-05-24 19:53:50.552797,0 days 00:00:06.683804,AdamW,0.21774582834198764,,,0.00015556922393711108,,,,3,,,0.0005100138646315249,,PRUNED
32,32,52.083333333333336,2025-05-24 19:53:50.587220,2025-05-24 19:53:57.644153,0 days 00:00:07.056933,AdamW,0.3106452018417596,,,0.00013372501428914556,,,,4,,,0.0008042229918427985,,COMPLETE
33,33,56.25,2025-05-24 19:53:57.694786,2025-05-24 19:54:07.897485,0 days 00:00:10.202699,AdamW,0.32959691156802884,,,0.00010496983073271401,,,,4,,,0.001787102514683261,,COMPLETE
34,34,33.333333333333336,2025-05-24 19:54:07.947443,2025-05-24 19:54:13.456224,0 days 00:00:05.508781,AdamW,0.3532705233244291,,,3.296333301498253e-05,,,,2,,,0.0021120470565226396,,PRUNED
35,35,33.333333333333336,2025-05-24 19:54:13.487645,2025-05-24 19:54:17.343830,0 days 00:00:03.856185,AdamW,0.4410211800025302,,,0.0002715578954121179,,,,3,,,0.003418611760359166,,PRUNED
36,36,33.333333333333336,2025-05-24 19:54:17.377927,2025-05-24 19:54:20.992368,0 days 00:00:03.614441,AdamW,0.32920145344560325,,,0.0008763688657250155,,,,5,,,0.0014107494655111635,,PRUNED
37,37,60.416666666666664,2025-05-24 19:54:21.031816,2025-05-24 19:54:32.227556,0 days 00:00:11.195740,AdamW,0.24213163638377078,,,9.116651935597241e-05,,,,8,,,0.004876306660680413,,COMPLETE
38,38,33.333333333333336,2025-05-24 19:54:32.279838,2025-05-24 19:54:40.407473,0 days 00:00:08.127635,Adadelta,0.23611299890701373,0.18442731888593034,,,,,,8,0.8870445015199778,,,,PRUNED
39,39,31.25,2025-05-24 19:54:40.442522,2025-05-24 19:54:46.429465,0 days 00:00:05.986943,AdamW,0.4005357975967133,,,0.00011630395895252416,,,,6,,,0.005554228917001491,,PRUNED
40,40,33.333333333333336,2025-05-24 19:54:46.465140,2025-05-24 19:54:52.497773,0 days 00:00:06.032633,Adam,0.27441874376716974,,0.009009164563119645,,,,,0,,75.11710625573838,,,PRUNED
41,41,37.5,2025-05-24 19:54:52.534116,2025-05-24 19:55:00.669344,0 days 00:00:08.135228,AdamW,0.24911770870499278,,,5.2586051747649115e-05,,,,7,,,0.0026086594861319916,,PRUNED
42,42,35.416666666666664,2025-05-24 19:55:00.706560,2025-05-24 19:55:06.712221,0 days 00:00:06.005661,AdamW,0.2007543087755224,,,2.1676179921181497e-05,,,,2,,,0.005268354234447596,,PRUNED
43,43,35.416666666666664,2025-05-24 19:55:06.749278,2025-05-24 19:55:12.713913,0 days 00:00:05.964635,AdamW,0.1679724557667166,,,0.000439359220702604,,,,10,,,0.0015910401294010291,,PRUNED
44,44,33.333333333333336,2025-05-24 19:55:12.750164,2025-05-24 19:55:18.733962,0 days 00:00:05.983798,AdamW,0.11851620321400862,,,8.77020008134892e-05,,,,8,,,0.00010488101410479334,,PRUNED
45,45,,2025-05-24 19:55:18.768505,2025-05-24 19:55:24.038601,0 days 00:00:05.270096,SGD,0.2754488689948754,,,,0.07697336416909212,50.556122432111465,False,4,,,,2.1442082563972504,PRUNED
46,46,45.833333333333336,2025-05-24 19:55:24.071995,2025-05-24 19:55:35.137857,0 days 00:00:11.065862,AdamW,0.35990452203068085,,,5.603738692950398e-05,,,,12,,,0.004231801826948771,,PRUNED
47,47,33.333333333333336,2025-05-24 19:55:35.173477,2025-05-24 19:55:41.206992,0 days 00:00:06.033515,AdamW,0.2511633521140649,,,0.09843155468624189,,,,7,,,0.0028227021115732717,,PRUNED
48,48,33.333333333333336,2025-05-24 19:55:41.242583,2025-05-24 19:55:47.308638,0 days 00:00:06.066055,Adam,0.18827870499266822,,0.0015235798237262308,,,,,9,,2.3260636558383525,,,PRUNED
49,49,33.333333333333336,2025-05-24 19:55:47.345518,2025-05-24 19:55:53.389283,0 days 00:00:06.043765,Adadelta,0.22525340894582718,95.61311598960178,,,,,,6,5.561402383017114,,,,PRUNED
50,50,33.333333333333336,2025-05-24 19:55:53.425566,2025-05-24 19:55:59.436368,0 days 00:00:06.010802,AdamW,0.2911452764676224,,,0.00017453865616887576,,,,1,,,0.0009060729113368414,,PRUNED
51,51,33.333333333333336,2025-05-24 19:55:59.474504,2025-05-24 19:56:07.776247,0 days 00:00:08.301743,AdamW,0.3311519005395291,,,0.00012144455675193774,,,,4,,,0.0007659224061154596,,PRUNED
52,52,31.25,2025-05-24 19:56:07.813793,2025-05-24 19:56:13.801781,0 days 00:00:05.987988,AdamW,0.32326871572089244,,,0.00018620050219880145,,,,4,,,0.0006689005879530547,,PRUNED
53,53,58.333333333333336,2025-05-24 19:56:13.838618,2025-05-24 19:56:25.224973,0 days 00:00:11.386355,AdamW,0.41542512410705235,,,8.086623607481011e-05,,,,3,,,0.001722027385775748,,COMPLETE
54,54,31.25,2025-05-24 19:56:25.275536,2025-05-24 19:56:31.334911,0 days 00:00:06.059375,AdamW,0.4602139565981005,,,0.004451391950315021,,,,3,,,0.0017706701573627684,,PRUNED
55,55,27.083333333333332,2025-05-24 19:56:31.373516,2025-05-24 19:56:37.369502,0 days 00:00:05.995986,AdamW,0.4236056295165567,,,4.07683100108799e-05,,,,10,,,0.001136756765468184,,PRUNED
56,56,,2025-05-24 19:56:37.405926,2025-05-24 19:56:42.719896,0 days 00:00:05.313970,SGD,0.15995606418950817,,,,0.0002436806705604994,51.4427435384869,True,1,,,,0.010401039998830923,PRUNED
57,57,37.5,2025-05-24 19:56:42.753552,2025-05-24 19:56:48.783577,0 days 00:00:06.030025,AdamW,0.40795523730949457,,,1.930184666120463e-05,,,,2,,,0.00038221118378717816,,PRUNED
58,58,33.333333333333336,2025-05-24 19:56:48.820730,2025-05-24 19:56:54.827570,0 days 00:00:06.006840,Adam,0.35213134526623113,,0.0015270736956748707,,,,,13,,0.21618806217490086,,,PRUNED
59,59,33.333333333333336,2025-05-24 19:56:54.862974,2025-05-24 19:57:00.821245,0 days 00:00:05.958271,AdamW,0.4893820790996507,,,8.910000686260778e-05,,,,11,,,0.001758656196870896,,PRUNED
60,60,33.333333333333336,2025-05-24 19:57:00.858221,2025-05-24 19:57:06.845401,0 days 00:00:05.987180,AdamW,0.3737441370571805,,,7.452548687909543e-05,,,,9,,,0.004359572359234106,,PRUNED
61,61,37.5,2025-05-24 19:57:06.882456,2025-05-24 19:57:12.869064,0 days 00:00:05.986608,AdamW,0.20335574279200214,,,0.0001309654084424426,,,,5,,,0.0010505816491398069,,PRUNED
62,62,37.5,2025-05-24 19:57:12.903975,2025-05-24 19:57:18.837866,0 days 00:00:05.933891,AdamW,0.3148192248290307,,,4.188879496896556e-05,,,,3,,,0.007688552472195635,,PRUNED
63,63,47.916666666666664,2025-05-24 19:57:18.872645,2025-05-24 19:57:28.516354,0 days 00:00:09.643709,AdamW,0.292188270209624,,,1.0266284717003374e-05,,,,4,,,0.002283585584741134,,COMPLETE
64,64,33.333333333333336,2025-05-24 19:57:28.555612,2025-05-24 19:57:31.357058,0 days 00:00:02.801446,AdamW,0.23799265072531817,,,0.0004562583303845409,,,,5,,,0.0006290819614735919,,PRUNED
65,65,33.333333333333336,2025-05-24 19:57:31.384723,2025-05-24 19:57:35.134739,0 days 00:00:03.750016,AdamW,0.15509171553993126,,,0.00021726853548362235,,,,8,,,0.0029557722624278626,,PRUNED
66,66,37.5,2025-05-24 19:57:35.168875,2025-05-24 19:57:41.207139,0 days 00:00:06.038264,AdamW,0.2588983987530342,,,8.041452713908357e-05,,,,2,,,0.0009650010615929333,,PRUNED
67,67,33.333333333333336,2025-05-24 19:57:41.243909,2025-05-24 19:57:45.141688,0 days 00:00:03.897779,Adadelta,0.18230044611977442,0.13093926836268646,,,,,,3,0.10277249009041292,,,,PRUNED
68,68,,2025-05-24 19:57:45.171657,2025-05-24 19:57:46.835860,0 days 00:00:01.664203,SGD,0.21014696045760245,,,,0.00021766855810388612,22.767518884788462,True,6,,,,2.6855659464132664,PRUNED
69,69,33.333333333333336,2025-05-24 19:57:46.861695,2025-05-24 19:57:49.287729,0 days 00:00:02.426034,AdamW,0.12889086219731988,,,0.00039317720477880544,,,,3,,,0.0019087814645634285,,PRUNED
70,70,54.166666666666664,2025-05-24 19:57:49.321154,2025-05-24 19:57:56.442279,0 days 00:00:07.121125,AdamW,0.37431013024781123,,,2.0298239494735077e-05,,,,4,,,0.0014459989322901958,,COMPLETE
71,71,35.416666666666664,2025-05-24 19:57:56.493888,2025-05-24 19:58:02.471557,0 days 00:00:05.977669,AdamW,0.41772147683953187,,,2.1963272233896463e-05,,,,4,,,0.0013284875118206667,,PRUNED
72,72,41.666666666666664,2025-05-24 19:58:02.506621,2025-05-24 19:58:11.641422,0 days 00:00:09.134801,AdamW,0.3888140838551167,,,1.6495323554000484e-05,,,,5,,,0.0003416403070420567,,PRUNED
73,73,35.416666666666664,2025-05-24 19:58:11.679585,2025-05-24 19:58:17.640395,0 days 00:00:05.960810,AdamW,0.377061475106325,,,3.5254628788027896e-05,,,,4,,,0.0024185148951338608,,PRUNED
74,74,52.083333333333336,2025-05-24 19:58:17.675933,2025-05-24 19:58:28.744622,0 days 00:00:11.068689,AdamW,0.3423358380433698,,,6.380920305279994e-05,,,,12,,,0.0015960294880468782,,COMPLETE
75,75,33.333333333333336,2025-05-24 19:58:28.796871,2025-05-24 19:58:34.812961,0 days 00:00:06.016090,AdamW,0.45074470378061904,,,0.00010308808116444612,,,,2,,,0.003407374706367784,,PRUNED
76,76,35.416666666666664,2025-05-24 19:58:34.850135,2025-05-24 19:58:40.853094,0 days 00:00:06.002959,AdamW,0.3708739027207495,,,2.624564237085177e-05,,,,3,,,0.0014741009973611489,,PRUNED
77,77,33.333333333333336,2025-05-24 19:58:40.887998,2025-05-24 19:58:46.897951,0 days 00:00:06.009953,Adam,0.3125569408725894,,0.044288101353167963,,,,,0,,6.246000718224719,,,PRUNED
78,78,54.166666666666664,2025-05-24 19:58:46.934370,2025-05-24 19:58:58.217490,0 days 00:00:11.283120,AdamW,0.09080614307431534,,,4.7986601458352426e-05,,,,4,,,0.0008195197011113351,,COMPLETE
79,79,47.916666666666664,2025-05-24 19:58:58.269770,2025-05-24 19:59:09.439465,0 days 00:00:11.169695,AdamW,0.10190524050276431,,,4.026065400130926e-05,,,,7,,,0.00197733957191057,,PRUNED
80,80,31.25,2025-05-24 19:59:09.474767,2025-05-24 19:59:15.489976,0 days 00:00:06.015209,AdamW,0.06289864376301914,,,1.5749901944231393e-05,,,,8,,,0.0011930467188000285,,PRUNED
81,81,35.416666666666664,2025-05-24 19:59:15.525391,2025-05-24 19:59:21.551435,0 days 00:00:06.026044,AdamW,0.0840596843874565,,,5.665074739561499e-05,,,,5,,,0.0007318575265778144,,PRUNED
82,82,35.416666666666664,2025-05-24 19:59:21.598133,2025-05-24 19:59:27.646928,0 days 00:00:06.048795,AdamW,0.14454577591469786,,,0.00012358833754412063,,,,4,,,0.000550824232380838,,PRUNED
83,83,35.416666666666664,2025-05-24 19:59:27.683558,2025-05-24 19:59:33.654482,0 days 00:00:05.970924,AdamW,0.2842894759305138,,,0.0026726104455146995,,,,5,,,0.0005887636906880836,,PRUNED
84,84,35.416666666666664,2025-05-24 19:59:33.691086,2025-05-24 19:59:40.732270,0 days 00:00:07.041184,AdamW,0.1902683604466584,,,3.159392499351728e-05,,,,10,,,0.0009118649958411237,,PRUNED
85,85,33.333333333333336,2025-05-24 19:59:40.769441,2025-05-24 19:59:46.769411,0 days 00:00:05.999970,Adadelta,0.03616983497318759,11.909419283350534,,,,,,3,5.908324666385159,,,,PRUNED
86,86,37.5,2025-05-24 19:59:46.806004,2025-05-24 19:59:52.837638,0 days 00:00:06.031634,AdamW,0.21885266150981716,,,5.042680473426033e-05,,,,4,,,0.0004736403926646603,,PRUNED
87,87,,2025-05-24 19:59:52.875105,2025-05-24 19:59:58.260794,0 days 00:00:05.385689,SGD,0.3433946927525694,,,,0.08464184854537554,71.91471893329434,False,4,,,,0.21320605984942156,PRUNED
88,88,33.333333333333336,2025-05-24 19:59:58.294684,2025-05-24 20:00:04.321480,0 days 00:00:06.026796,AdamW,0.004066731873564197,,,0.0002195879747261175,,,,3,,,0.001293896830507943,,PRUNED
89,89,37.5,2025-05-24 20:00:04.361762,2025-05-24 20:00:10.301484,0 days 00:00:05.939722,AdamW,0.23295332693573417,,,7.268896869385712e-05,,,,1,,,0.0024550683310631824,,PRUNED
90,90,33.333333333333336,2025-05-24 20:00:10.336769,2025-05-24 20:00:16.298313,0 days 00:00:05.961544,AdamW,0.40139446899455716,,,0.00014563666678779188,,,,6,,,0.0008042552818723432,,PRUNED
91,91,33.333333333333336,2025-05-24 20:00:16.336143,2025-05-24 20:00:24.461168,0 days 00:00:08.125025,AdamW,0.34354589927936235,,,7.119336015426827e-05,,,,12,,,0.001600568003988666,,PRUNED
92,92,37.5,2025-05-24 20:00:24.498707,2025-05-24 20:00:30.484376,0 days 00:00:05.985669,AdamW,0.1714060811636612,,,5.783348061754551e-05,,,,13,,,0.0016037460619128658,,PRUNED
93,93,37.5,2025-05-24 20:00:30.521752,2025-05-24 20:00:36.539817,0 days 00:00:06.018065,AdamW,0.4324446563413654,,,9.547576363283308e-05,,,,11,,,0.0020100613759860757,,PRUNED
94,94,33.333333333333336,2025-05-24 20:00:36.577664,2025-05-24 20:00:42.395846,0 days 00:00:05.818182,AdamW,0.3629532248858379,,,4.334790321357052e-05,,,,12,,,0.0014509254135725714,,PRUNED
95,95,43.75,2025-05-24 20:00:42.421863,2025-05-24 20:00:46.389377,0 days 00:00:03.967514,AdamW,0.3335615918188006,,,2.7636671486134932e-05,,,,13,,,0.0010386642850991584,,PRUNED
96,96,33.333333333333336,2025-05-24 20:00:46.422792,2025-05-24 20:00:50.043326,0 days 00:00:03.620534,AdamW,0.3144685332682216,,,6.67885665248927e-05,,,,11,,,0.0018056576947643862,,PRUNED
97,97,33.333333333333336,2025-05-24 20:00:50.075568,2025-05-24 20:00:53.250545,0 days 00:00:03.174977,Adam,0.25619044576546796,,0.007862719062172046,,,,,12,,0.24630286628533862,,,PRUNED
98,98,35.416666666666664,2025-05-24 20:00:53.284661,2025-05-24 20:00:55.666960,0 days 00:00:02.382299,AdamW,0.2958999283627059,,,0.00010942699330827566,,,,9,,,0.002940204372382586,,PRUNED
99,99,35.416666666666664,2025-05-24 20:00:55.693516,2025-05-24 20:00:57.922454,0 days 00:00:02.228938,AdamW,0.24437083493488615,,,0.00028552572160355487,,,,2,,,0.0008324371025214948,,PRUNED
100,100,33.333333333333336,2025-05-24 20:00:57.951577,2025-05-24 20:01:00.245280,0 days 00:00:02.293703,Adadelta,0.27789762241492194,0.5785561813586017,,,,,,3,0.170569028932019,,,,PRUNED
101,101,43.75,2025-05-24 20:01:00.274168,2025-05-24 20:01:05.071095,0 days 00:00:04.796927,AdamW,0.3462239286043203,,,0.0001575116596612948,,,,4,,,0.00036506558344818286,,PRUNED
102,102,37.5,2025-05-24 20:01:05.106992,2025-05-24 20:01:10.834978,0 days 00:00:05.727986,AdamW,0.26183116500443665,,,0.00019415687463972156,,,,4,,,0.0006630008638292655,,PRUNED
103,103,27.083333333333332,2025-05-24 20:01:10.867181,2025-05-24 20:01:16.141054,0 days 00:00:05.273873,AdamW,0.26844470792767106,,,0.0001035141821561403,,,,5,,,0.007437531831894442,,PRUNED
104,104,31.25,2025-05-24 20:01:16.174679,2025-05-24 20:01:19.032809,0 days 00:00:02.858130,AdamW,0.3835836086431606,,,4.893112313700427e-05,,,,4,,,0.00043519659045872466,,PRUNED
105,105,43.75,2025-05-24 20:01:19.059817,2025-05-24 20:01:24.550611,0 days 00:00:05.490794,AdamW,0.30617065153437373,,,7.273425136299234e-05,,,,3,,,0.005030708967671564,,PRUNED
106,106,,2025-05-24 20:01:24.577883,2025-05-24 20:01:29.358835,0 days 00:00:04.780952,SGD,0.2251025207313621,,,,0.0006093209830952394,31.497336632695855,True,11,,,,16.36612230682761,PRUNED
107,107,33.333333333333336,2025-05-24 20:01:29.392349,2025-05-24 20:01:35.457279,0 days 00:00:06.064930,AdamW,0.324628621597124,,,0.0006550301858220947,,,,2,,,0.0036724950558846767,,PRUNED
108,108,33.333333333333336,2025-05-24 20:01:35.494061,2025-05-24 20:01:41.561873,0 days 00:00:06.067812,AdamW,0.20343286024967122,,,1.2523686473392118e-05,,,,10,,,0.002207580257457782,,PRUNED
109,109,35.416666666666664,2025-05-24 20:01:41.599025,2025-05-24 20:01:47.639468,0 days 00:00:06.040443,AdamW,0.13342376190243116,,,0.00014368504309712345,,,,5,,,0.0011798290923702287,,PRUNED
110,110,31.25,2025-05-24 20:01:47.675487,2025-05-24 20:01:53.699760,0 days 00:00:06.024273,AdamW,0.3610153121737441,,,2.483055847389819e-05,,,,7,,,0.009502071426163593,,PRUNED
111,111,33.333333333333336,2025-05-24 20:01:53.739071,2025-05-24 20:01:59.766158,0 days 00:00:06.027087,Adam,0.2424323433670837,,1.3709496447855126e-05,,,,,9,,0.010184203867138874,,,PRUNED
112,112,37.5,2025-05-24 20:01:59.801097,2025-05-24 20:02:05.497866,0 days 00:00:05.696769,Adam,0.1556400950608067,,0.00012692542209658363,,,,,8,,0.10717844955193602,,,PRUNED
113,113,31.25,2025-05-24 20:02:05.533359,2025-05-24 20:02:11.592052,0 days 00:00:06.058693,Adam,0.30501151789366293,,0.0003659796449966681,,,,,9,,9.583244767732156,,,PRUNED
114,114,45.833333333333336,2025-05-24 20:02:11.628160,2025-05-24 20:02:22.672522,0 days 00:00:11.044362,Adam,0.18091191600673856,,4.171304674724379e-05,,,,,4,,0.04008460369329712,,,PRUNED
