,number,value,datetime_start,datetime_complete,duration,params_algorithm,params_dropout_rate,params_lr_Adadelta,params_lr_Adam,params_lr_AdamW,params_lr_SGD,params_momentum_SGD,params_nesterov_SGD,params_suggested_freeze,params_weight_decay_Adadelta,params_weight_decay_Adam,params_weight_decay_AdamW,params_weight_decay_SGD,state
462,462,,2025-05-25 10:55:36.977740,2025-05-25 10:55:42.292938,0 days 00:00:05.315198,SGD,0.057693599707865556,,,,0.03063344551864346,16.230205081898596,True,8,,,,2.1355280251871243,PRUNED
463,463,50.0,2025-05-25 10:55:42.331598,2025-05-25 10:55:53.764544,0 days 00:00:11.432946,AdamW,0.01872447002880659,,,1.2137105573581438e-05,,,,5,,,0.001990580924908973,,COMPLETE
464,464,33.333333333333336,2025-05-25 10:55:53.819877,2025-05-25 10:55:59.842662,0 days 00:00:06.022785,AdamW,0.36696892999822617,,,4.314839839244385e-05,,,,7,,,0.0029013695634296723,,PRUNED
465,465,35.416666666666664,2025-05-25 10:55:59.883246,2025-05-25 10:56:05.946012,0 days 00:00:06.062766,AdamW,0.13848903811504154,,,2.3849671794777937e-05,,,,0,,,0.0023059071941380453,,PRUNED
466,466,33.333333333333336,2025-05-25 10:56:05.984989,2025-05-25 10:56:11.351455,0 days 00:00:05.366466,Adam,0.2925888315759601,,0.0007377847855121725,,,,,1,,0.6118007890233759,,,PRUNED
467,467,37.5,2025-05-25 10:56:11.378577,2025-05-25 10:56:14.606855,0 days 00:00:03.228278,AdamW,0.2770264493796539,,,1.4915533492582522e-05,,,,3,,,0.002605168034086636,,PRUNED
468,468,39.583333333333336,2025-05-25 10:56:14.645623,2025-05-25 10:56:20.661859,0 days 00:00:06.016236,AdamW,0.04893720706002218,,,3.145585239411966e-05,,,,11,,,0.005667732252856174,,PRUNED
469,469,31.25,2025-05-25 10:56:20.702218,2025-05-25 10:56:26.792684,0 days 00:00:06.090466,AdamW,0.15784478191588253,,,6.559875806380596e-05,,,,4,,,0.0021390864827447154,,PRUNED
470,470,35.416666666666664,2025-05-25 10:56:26.834150,2025-05-25 10:56:32.530492,0 days 00:00:05.696342,AdamW,0.2616348016152595,,,1.9425303114935517e-05,,,,1,,,0.008881519287462895,,PRUNED
471,471,33.333333333333336,2025-05-25 10:56:32.566999,2025-05-25 10:56:36.589517,0 days 00:00:04.022518,AdamW,0.10926324681844635,,,1.2023989096048827e-05,,,,12,,,0.0034367637506151527,,PRUNED
472,472,35.416666666666664,2025-05-25 10:56:36.616946,2025-05-25 10:56:42.197895,0 days 00:00:05.580949,Adam,0.23462365038036967,,1.4179864741774568e-05,,,,,2,,0.032784696746735516,,,PRUNED
473,473,35.416666666666664,2025-05-25 10:56:42.235891,2025-05-25 10:56:48.272373,0 days 00:00:06.036482,AdamW,0.39147958273151534,,,8.178668595859385e-05,,,,9,,,0.007764199004429498,,PRUNED
474,474,33.333333333333336,2025-05-25 10:56:48.311450,2025-05-25 10:56:54.417452,0 days 00:00:06.106002,AdamW,0.06964079699297729,,,2.385558648379524e-05,,,,7,,,0.0011592637253763467,,PRUNED
475,475,33.333333333333336,2025-05-25 10:56:54.456533,2025-05-25 10:57:00.537905,0 days 00:00:06.081372,AdamW,0.010257737534158689,,,1.468638194854071e-05,,,,6,,,0.0018395604847607795,,PRUNED
476,476,43.75,2025-05-25 10:57:00.577184,2025-05-25 10:57:06.629859,0 days 00:00:06.052675,AdamW,0.17356341947471127,,,5.4365506131256804e-05,,,,0,,,0.001674074131678333,,PRUNED
477,477,37.5,2025-05-25 10:57:06.671224,2025-05-25 10:57:12.707610,0 days 00:00:06.036386,AdamW,0.2522299330423088,,,1.62781887963117e-05,,,,5,,,0.005005648889908244,,PRUNED
478,478,37.5,2025-05-25 10:57:12.747756,2025-05-25 10:57:18.808118,0 days 00:00:06.060362,AdamW,0.30108723107776536,,,2.608563863535692e-05,,,,1,,,0.002354781691578587,,PRUNED
479,479,33.333333333333336,2025-05-25 10:57:18.848615,2025-05-25 10:57:25.012365,0 days 00:00:06.163750,Adam,0.025553602405000056,,0.0012188059626180936,,,,,8,,11.053478446988352,,,PRUNED
480,480,33.333333333333336,2025-05-25 10:57:25.053879,2025-05-25 10:57:31.095529,0 days 00:00:06.041650,Adadelta,0.03781213330693751,3.4117270446162964,,,,,,6,0.39011025952372963,,,,PRUNED
481,481,50.0,2025-05-25 10:57:31.134741,2025-05-25 10:57:42.424330,0 days 00:00:11.289589,AdamW,0.3506741439881859,,,3.951839475959413e-05,,,,4,,,0.003932797059690285,,PRUNED
482,482,33.333333333333336,2025-05-25 10:57:42.463815,2025-05-25 10:57:48.528705,0 days 00:00:06.064890,AdamW,0.26646654709519724,,,0.05152322930937913,,,,9,,,0.00992624612117341,,PRUNED
483,483,39.583333333333336,2025-05-25 10:57:48.567211,2025-05-25 10:57:54.664149,0 days 00:00:06.096938,AdamW,0.3348364580815067,,,1.8477841270934015e-05,,,,0,,,0.004369238212568646,,PRUNED
484,484,35.416666666666664,2025-05-25 10:57:54.704856,2025-05-25 10:58:00.736983,0 days 00:00:06.032127,AdamW,0.2790340834145332,,,1.190819414802217e-05,,,,5,,,0.002814497003376747,,PRUNED
485,485,43.75,2025-05-25 10:58:00.777361,2025-05-25 10:58:06.957412,0 days 00:00:06.180051,AdamW,0.008438003884015239,,,0.00037832823043362735,,,,11,,,0.001960012846651201,,PRUNED
486,486,,2025-05-25 10:58:06.997354,2025-05-25 10:58:12.395475,0 days 00:00:05.398121,SGD,0.24374088951409012,,,,0.00011355001258170079,71.84324860046738,False,6,,,,0.12829501560100495,PRUNED
487,487,52.083333333333336,2025-05-25 10:58:12.435053,2025-05-25 10:58:23.685099,0 days 00:00:11.250046,Adam,0.20054139962285794,,0.0001480408434461791,,,,,10,,0.05462854729678636,,,COMPLETE
488,488,33.333333333333336,2025-05-25 10:58:23.741278,2025-05-25 10:58:29.778991,0 days 00:00:06.037713,Adam,0.20534530065201606,,0.0012004636265859614,,,,,10,,4.854411230963512,,,PRUNED
489,489,31.25,2025-05-25 10:58:29.821803,2025-05-25 10:58:35.838427,0 days 00:00:06.016624,AdamW,0.18253082144288982,,,1.0053397013083004e-05,,,,11,,,0.0009043032178250094,,PRUNED
490,490,52.083333333333336,2025-05-25 10:58:35.878239,2025-05-25 10:58:47.113200,0 days 00:00:11.234961,AdamW,0.23626018467070345,,,2.953524126340896e-05,,,,10,,,0.0014926933438563056,,COMPLETE
491,491,33.333333333333336,2025-05-25 10:58:47.169967,2025-05-25 10:58:53.263099,0 days 00:00:06.093132,AdamW,0.25019981928269247,,,0.00012013734732870042,,,,10,,,0.0068134298358587635,,PRUNED
492,492,31.25,2025-05-25 10:58:53.303632,2025-05-25 10:58:59.328465,0 days 00:00:06.024833,AdamW,0.19696946778702235,,,2.140271685619453e-05,,,,10,,,0.0031902733920283247,,PRUNED
493,493,20.833333333333332,2025-05-25 10:58:59.369901,2025-05-25 10:59:05.486586,0 days 00:00:06.116685,AdamW,0.16957857860002992,,,1.3949075925538034e-05,,,,3,,,0.0021542751142511023,,PRUNED
494,494,39.583333333333336,2025-05-25 10:59:05.524803,2025-05-25 10:59:11.598574,0 days 00:00:06.073771,AdamW,0.21186686082152115,,,1.699703499551177e-05,,,,2,,,0.0024751722839338264,,PRUNED
495,495,35.416666666666664,2025-05-25 10:59:11.637352,2025-05-25 10:59:17.677942,0 days 00:00:06.040590,Adam,0.22103081294714813,,0.0001897345856050457,,,,,1,,0.014041628912785863,,,PRUNED
496,496,33.333333333333336,2025-05-25 10:59:17.717186,2025-05-25 10:59:23.835236,0 days 00:00:06.118050,AdamW,0.2617481875030701,,,4.7473406538325666e-05,,,,0,,,0.0059529299098473615,,PRUNED
497,497,35.416666666666664,2025-05-25 10:59:23.874375,2025-05-25 10:59:29.919953,0 days 00:00:06.045578,AdamW,0.28512655287401595,,,3.569657771166538e-05,,,,11,,,0.004586032486549096,,PRUNED
498,498,43.75,2025-05-25 10:59:29.960665,2025-05-25 10:59:36.031862,0 days 00:00:06.071197,AdamW,0.22958345780536488,,,2.0611353598267426e-05,,,,11,,,0.0018330847200678166,,PRUNED
499,499,35.416666666666664,2025-05-25 10:59:36.072656,2025-05-25 10:59:42.124251,0 days 00:00:06.051595,AdamW,0.023152226066994536,,,2.8052619063067036e-05,,,,1,,,0.00867411482610726,,PRUNED
500,500,31.25,2025-05-25 10:59:42.165179,2025-05-25 10:59:48.231870,0 days 00:00:06.066691,AdamW,0.2933568750673807,,,1.394621921333256e-05,,,,10,,,0.007386416319754133,,PRUNED
501,501,33.333333333333336,2025-05-25 10:59:48.272260,2025-05-25 10:59:54.433445,0 days 00:00:06.161185,Adam,0.09958239244012701,,0.008685254879596893,,,,,5,,0.057666487706901144,,,PRUNED
502,502,33.333333333333336,2025-05-25 10:59:54.475420,2025-05-25 11:00:00.524384,0 days 00:00:06.048964,AdamW,0.1270175520327514,,,2.3028374026293045e-05,,,,4,,,0.002263042450397022,,PRUNED
503,503,35.416666666666664,2025-05-25 11:00:00.562907,2025-05-25 11:00:06.582236,0 days 00:00:06.019329,AdamW,0.19396618036821833,,,7.076432765258779e-05,,,,12,,,0.005128804592941436,,PRUNED
504,504,33.333333333333336,2025-05-25 11:00:06.623481,2025-05-25 11:00:12.677255,0 days 00:00:06.053774,AdamW,0.27379040309128266,,,0.003778681240796649,,,,0,,,0.0008072011171786887,,PRUNED
505,505,33.333333333333336,2025-05-25 11:00:12.717188,2025-05-25 11:00:18.815278,0 days 00:00:06.098090,AdamW,0.30776764752260444,,,0.0010148342977582688,,,,0,,,0.002700644611813021,,PRUNED
506,506,35.416666666666664,2025-05-25 11:00:18.855875,2025-05-25 11:00:24.991724,0 days 00:00:06.135849,AdamW,0.2577444259590648,,,1.6719761667274242e-05,,,,4,,,0.003602774444825339,,PRUNED
507,507,33.333333333333336,2025-05-25 11:00:25.031218,2025-05-25 11:00:31.094468,0 days 00:00:06.063250,Adam,0.24406519792251924,,0.00035524516980775625,,,,,3,,0.020719352527557057,,,PRUNED
508,508,41.666666666666664,2025-05-25 11:00:31.133374,2025-05-25 11:00:37.199005,0 days 00:00:06.065631,AdamW,0.01203358478343437,,,1.1993307814685931e-05,,,,9,,,0.001986515695138889,,PRUNED
509,509,35.416666666666664,2025-05-25 11:00:37.238546,2025-05-25 11:00:43.362163,0 days 00:00:06.123617,AdamW,0.4849781106602641,,,4.187478016493593e-05,,,,1,,,0.001702937463258713,,PRUNED
510,510,,2025-05-25 11:00:43.444420,2025-05-25 11:00:48.978711,0 days 00:00:05.534291,SGD,0.000621414914183948,,,,1.775659012511882e-05,56.88934608272585,True,11,,,,29.458595180637133,PRUNED
511,511,39.583333333333336,2025-05-25 11:00:49.015811,2025-05-25 11:00:55.149611,0 days 00:00:06.133800,Adadelta,0.2260104044502572,0.03342470107521774,,,,,,5,1.9190831103205455,,,,PRUNED
512,512,37.5,2025-05-25 11:00:55.190961,2025-05-25 11:01:01.301994,0 days 00:00:06.111033,AdamW,0.15272727611775733,,,1.9611348536451544e-05,,,,6,,,0.0024037350363204325,,PRUNED
513,513,33.333333333333336,2025-05-25 11:01:01.342185,2025-05-25 11:01:07.394542,0 days 00:00:06.052357,AdamW,0.03080290260669103,,,0.0018745234567196097,,,,0,,,0.0020520566010597758,,PRUNED
514,514,33.333333333333336,2025-05-25 11:01:07.434405,2025-05-25 11:01:13.478480,0 days 00:00:06.044075,AdamW,0.08338308566713284,,,3.274609340701349e-05,,,,4,,,0.0007017452864576479,,PRUNED
515,515,33.333333333333336,2025-05-25 11:01:13.565686,2025-05-25 11:01:19.632125,0 days 00:00:06.066439,AdamW,0.04443867155701883,,,5.5297250865364095e-05,,,,10,,,0.005475421121560907,,PRUNED
516,516,31.25,2025-05-25 11:01:19.673988,2025-05-25 11:01:25.787093,0 days 00:00:06.113105,Adam,0.2929341674003348,,0.00012790825880571604,,,,,6,,0.17338469590892508,,,PRUNED
517,517,31.25,2025-05-25 11:01:25.829694,2025-05-25 11:01:31.367450,0 days 00:00:05.537756,AdamW,0.26827474338345436,,,2.4897073655933114e-05,,,,2,,,0.009209404924070885,,PRUNED
518,518,33.333333333333336,2025-05-25 11:01:31.404869,2025-05-25 11:01:34.767645,0 days 00:00:03.362776,AdamW,0.4466984922073709,,,9.200102311142769e-05,,,,0,,,0.0029497695206708906,,PRUNED
519,519,35.416666666666664,2025-05-25 11:01:34.806807,2025-05-25 11:01:40.833541,0 days 00:00:06.026734,AdamW,0.016222720800511813,,,1.682251064006407e-05,,,,9,,,0.003937097651452755,,PRUNED
520,520,31.25,2025-05-25 11:01:40.871973,2025-05-25 11:01:46.914143,0 days 00:00:06.042170,AdamW,0.2793005420224801,,,1.299098726565435e-05,,,,6,,,0.0012644885129580261,,PRUNED
521,521,39.583333333333336,2025-05-25 11:01:46.954428,2025-05-25 11:01:52.916464,0 days 00:00:05.962036,AdamW,0.061325902576047885,,,2.8412205479951446e-05,,,,4,,,0.007981828664248495,,PRUNED
522,522,35.416666666666664,2025-05-25 11:01:52.954404,2025-05-25 11:01:56.753442,0 days 00:00:03.799038,Adam,0.2539811643234454,,5.361232760176696e-05,,,,,11,,0.31553565021763624,,,PRUNED
523,523,43.75,2025-05-25 11:01:56.781421,2025-05-25 11:02:01.310537,0 days 00:00:04.529116,AdamW,0.3158004214599649,,,2.203362953876767e-05,,,,0,,,0.0015813901230942002,,PRUNED
524,524,39.583333333333336,2025-05-25 11:02:01.338786,2025-05-25 11:02:03.795180,0 days 00:00:02.456394,AdamW,0.07495973013293565,,,1.4965889326960364e-05,,,,12,,,0.006390417667197844,,PRUNED
525,525,33.333333333333336,2025-05-25 11:02:03.833219,2025-05-25 11:02:09.904896,0 days 00:00:06.071677,AdamW,0.11727203327193722,,,0.0012755142965287423,,,,5,,,0.00330659639360058,,PRUNED
526,526,33.333333333333336,2025-05-25 11:02:09.944985,2025-05-25 11:02:16.033686,0 days 00:00:06.088701,AdamW,0.3019513464138992,,,3.8400444462841916e-05,,,,1,,,0.002231634514519006,,PRUNED
527,527,41.666666666666664,2025-05-25 11:02:16.073372,2025-05-25 11:02:22.223118,0 days 00:00:06.149746,AdamW,0.21069672712250176,,,1.010129888417937e-05,,,,3,,,0.004259976656220429,,PRUNED
528,528,33.333333333333336,2025-05-25 11:02:22.262961,2025-05-25 11:02:28.358196,0 days 00:00:06.095235,AdamW,0.2349392638396146,,,1.7829582058529628e-05,,,,1,,,0.00027193012595011533,,PRUNED
529,529,43.75,2025-05-25 11:02:28.396872,2025-05-25 11:02:34.438017,0 days 00:00:06.041145,Adam,0.008205599533252665,,1.9894909116638124e-05,,,,,2,,1.0253291547384247,,,PRUNED
530,530,33.333333333333336,2025-05-25 11:02:34.476679,2025-05-25 11:02:40.541461,0 days 00:00:06.064782,Adadelta,0.0002471203446672704,32.83736714161535,,,,,,6,22.637455143283084,,,,PRUNED
531,531,54.166666666666664,2025-05-25 11:02:40.580512,2025-05-25 11:02:52.040231,0 days 00:00:11.459719,AdamW,0.27003213782295377,,,4.599853432562369e-05,,,,0,,,0.002613097037827625,,COMPLETE
532,532,33.333333333333336,2025-05-25 11:02:52.097737,2025-05-25 11:02:58.162477,0 days 00:00:06.064740,AdamW,0.2712363534452347,,,4.94164550801451e-05,,,,0,,,0.0024824844458228973,,PRUNED
533,533,35.416666666666664,2025-05-25 11:02:58.202528,2025-05-25 11:03:04.298916,0 days 00:00:06.096388,AdamW,0.28179597902176584,,,7.124032677637717e-05,,,,0,,,0.002644370475330147,,PRUNED
534,534,37.5,2025-05-25 11:03:04.337254,2025-05-25 11:03:10.484602,0 days 00:00:06.147348,AdamW,0.28466388112949575,,,5.563921415998079e-05,,,,0,,,0.0025713125238702953,,PRUNED
535,535,35.416666666666664,2025-05-25 11:03:10.524412,2025-05-25 11:03:16.588335,0 days 00:00:06.063923,AdamW,0.2603962975599193,,,6.194896818974236e-05,,,,0,,,0.002256966793483057,,PRUNED
536,536,45.833333333333336,2025-05-25 11:03:16.628416,2025-05-25 11:03:24.842726,0 days 00:00:08.214310,AdamW,0.26767564129236365,,,4.074878518874135e-05,,,,0,,,0.0028789410856660067,,PRUNED
537,537,35.416666666666664,2025-05-25 11:03:24.881920,2025-05-25 11:03:30.972185,0 days 00:00:06.090265,AdamW,0.2906038136522704,,,4.7739782783051565e-05,,,,0,,,0.0020465814887870347,,PRUNED
538,538,54.166666666666664,2025-05-25 11:03:31.012621,2025-05-25 11:03:42.315491,0 days 00:00:11.302870,AdamW,0.27714210015544527,,,3.4094662379433945e-05,,,,1,,,0.0023428159256466356,,COMPLETE
539,539,39.583333333333336,2025-05-25 11:03:42.372940,2025-05-25 11:03:48.434044,0 days 00:00:06.061104,AdamW,0.2715855348366925,,,3.4699739899326684e-05,,,,1,,,0.0024421591931464235,,PRUNED
540,540,39.583333333333336,2025-05-25 11:03:48.473398,2025-05-25 11:03:54.603225,0 days 00:00:06.129827,AdamW,0.2963499176033182,,,4.440883477932397e-05,,,,1,,,0.0018921581522415647,,PRUNED
541,541,39.583333333333336,2025-05-25 11:03:54.643911,2025-05-25 11:04:00.789068,0 days 00:00:06.145157,AdamW,0.2799013231512812,,,3.3637092392204676e-05,,,,1,,,0.00310890561334417,,PRUNED
542,542,43.75,2025-05-25 11:04:00.831674,2025-05-25 11:04:06.924742,0 days 00:00:06.093068,AdamW,0.26180130216158415,,,2.9699381304499624e-05,,,,1,,,0.00216143281535251,,PRUNED
543,543,33.333333333333336,2025-05-25 11:04:06.966045,2025-05-25 11:04:13.047392,0 days 00:00:06.081347,AdamW,0.2771660594946326,,,8.042540357999278e-05,,,,1,,,0.0028005407692924156,,PRUNED
544,544,31.25,2025-05-25 11:04:13.086547,2025-05-25 11:04:19.157748,0 days 00:00:06.071201,AdamW,0.2890418059195916,,,3.874693381460952e-05,,,,0,,,0.002512520006657497,,PRUNED
545,545,41.666666666666664,2025-05-25 11:04:19.199256,2025-05-25 11:04:25.477108,0 days 00:00:06.277852,AdamW,0.3101049624544063,,,5.8938905119952035e-05,,,,1,,,0.0022325574286110247,,PRUNED
546,546,,2025-05-25 11:04:25.517603,2025-05-25 11:04:30.791872,0 days 00:00:05.274269,SGD,0.4049704722750362,,,,0.00046123242439295335,88.19731977758542,True,1,,,,6.771875126344055,PRUNED
547,547,39.583333333333336,2025-05-25 11:04:30.831231,2025-05-25 11:04:36.885664,0 days 00:00:06.054433,AdamW,0.26705251785326056,,,4.5921926587515967e-05,,,,0,,,0.0020109920381971343,,PRUNED
548,548,39.583333333333336,2025-05-25 11:04:36.924169,2025-05-25 11:04:43.056170,0 days 00:00:06.132001,AdamW,0.255440338872,,,2.5858668711719847e-05,,,,1,,,0.004739609671453486,,PRUNED
549,549,31.25,2025-05-25 11:04:43.095823,2025-05-25 11:04:49.197052,0 days 00:00:06.101229,AdamW,0.2754170420368057,,,1.3091534066261308e-05,,,,2,,,0.0010249526793722013,,PRUNED
550,550,58.333333333333336,2025-05-25 11:04:49.238500,2025-05-25 11:05:00.658206,0 days 00:00:11.419706,AdamW,0.46635450655934163,,,3.1055644189425436e-05,,,,0,,,0.002699245981692816,,COMPLETE
551,551,27.083333333333332,2025-05-25 11:05:00.714956,2025-05-25 11:05:06.844255,0 days 00:00:06.129299,AdamW,0.4868300811402308,,,3.607521587614693e-05,,,,0,,,0.0031329237561545536,,PRUNED
552,552,41.666666666666664,2025-05-25 11:05:06.885291,2025-05-25 11:05:15.078939,0 days 00:00:08.193648,AdamW,0.4680152891187605,,,3.137462154463442e-05,,,,0,,,0.00284931702085315,,PRUNED
553,553,33.333333333333336,2025-05-25 11:05:15.120091,2025-05-25 11:05:21.211964,0 days 00:00:06.091873,AdamW,0.4866507667740059,,,2.8826017560997322e-05,,,,0,,,0.003439477994911048,,PRUNED
554,554,35.416666666666664,2025-05-25 11:05:21.253309,2025-05-25 11:05:27.382245,0 days 00:00:06.128936,AdamW,0.2454281594695345,,,4.214227954898408e-05,,,,0,,,0.0026545652364360567,,PRUNED
555,555,33.333333333333336,2025-05-25 11:05:27.422256,2025-05-25 11:05:33.526143,0 days 00:00:06.103887,AdamW,0.4986821448520289,,,5.313457398061867e-05,,,,0,,,0.0024616511082696355,,PRUNED
556,556,25.0,2025-05-25 11:05:33.580322,2025-05-25 11:05:39.655195,0 days 00:00:06.074873,AdamW,0.4707139272916494,,,2.4682932596704392e-05,,,,0,,,0.0029453458427402706,,PRUNED
557,557,39.583333333333336,2025-05-25 11:05:39.694164,2025-05-25 11:05:45.774409,0 days 00:00:06.080245,AdamW,0.30077068971052184,,,0.00010722419087412216,,,,0,,,0.003721780142600681,,PRUNED
558,558,33.333333333333336,2025-05-25 11:05:45.815794,2025-05-25 11:05:51.968240,0 days 00:00:06.152446,AdamW,0.47621843313001155,,,3.39834120849939e-05,,,,0,,,0.0007545102687787161,,PRUNED
559,559,35.416666666666664,2025-05-25 11:05:52.007423,2025-05-25 11:05:58.117171,0 days 00:00:06.109748,AdamW,0.4792643443795382,,,2.8280773210087266e-05,,,,1,,,0.0023412161825015973,,PRUNED
560,560,43.75,2025-05-25 11:05:58.157383,2025-05-25 11:06:04.263741,0 days 00:00:06.106358,AdamW,0.2847209215155726,,,3.785282217478642e-05,,,,1,,,0.0017861920149383384,,PRUNED
561,561,54.166666666666664,2025-05-25 11:06:04.306567,2025-05-25 11:06:15.655085,0 days 00:00:11.348518,AdamW,0.264854249059873,,,6.679312454010442e-05,,,,0,,,0.0008816520347046648,,COMPLETE
562,562,56.25,2025-05-25 11:06:15.711690,2025-05-25 11:06:27.120409,0 days 00:00:11.408719,AdamW,0.27264628951523423,,,6.38677048956998e-05,,,,0,,,0.0010806118829060662,,COMPLETE
563,563,41.666666666666664,2025-05-25 11:06:27.176467,2025-05-25 11:06:33.236698,0 days 00:00:06.060231,AdamW,0.2645055985853193,,,6.547668899555505e-05,,,,0,,,0.0011519464896285133,,PRUNED
564,564,33.333333333333336,2025-05-25 11:06:33.277012,2025-05-25 11:06:39.386773,0 days 00:00:06.109761,Adadelta,0.25458457644448823,0.1257063464163817,,,,,,0,7.1808680246404615,,,,PRUNED
565,565,37.5,2025-05-25 11:06:39.427028,2025-05-25 11:06:45.447206,0 days 00:00:06.020178,AdamW,0.27332200280284485,,,5.0550416856015434e-05,,,,0,,,0.0010916497883908607,,PRUNED
566,566,37.5,2025-05-25 11:06:45.491609,2025-05-25 11:06:51.607096,0 days 00:00:06.115487,AdamW,0.2668114951570378,,,6.931921732110141e-05,,,,0,,,0.0013971523524782862,,PRUNED
567,567,35.416666666666664,2025-05-25 11:06:51.643773,2025-05-25 11:06:56.271928,0 days 00:00:04.628155,AdamW,0.2760406905221485,,,5.694120973354153e-05,,,,0,,,0.001260289146491895,,PRUNED
568,568,33.333333333333336,2025-05-25 11:06:56.313629,2025-05-25 11:07:02.421963,0 days 00:00:06.108334,AdamW,0.25651249203610665,,,8.490330985359098e-05,,,,0,,,0.0009249793918721444,,PRUNED
569,569,35.416666666666664,2025-05-25 11:07:02.462977,2025-05-25 11:07:08.532055,0 days 00:00:06.069078,AdamW,0.28349405309810805,,,4.7374139059900406e-05,,,,0,,,0.002617450308224085,,PRUNED
570,570,41.666666666666664,2025-05-25 11:07:08.572335,2025-05-25 11:07:14.648794,0 days 00:00:06.076459,AdamW,0.24866151475812373,,,6.355262153408375e-05,,,,0,,,0.005348247303182832,,PRUNED
571,571,41.666666666666664,2025-05-25 11:07:14.689272,2025-05-25 11:07:20.455721,0 days 00:00:05.766449,AdamW,0.29365553308440695,,,4.580313931266579e-05,,,,0,,,0.0033299209217322436,,PRUNED
572,572,,2025-05-25 11:07:20.483891,2025-05-25 11:07:22.502035,0 days 00:00:02.018144,SGD,0.268783815143463,,,,0.001634811575949039,44.435081765534704,False,0,,,,0.025529544421508486,PRUNED
573,573,33.333333333333336,2025-05-25 11:07:22.529852,2025-05-25 11:07:25.134641,0 days 00:00:02.604789,AdamW,0.2856468696670589,,,0.0004778231874655917,,,,0,,,0.0020986460313434656,,PRUNED
574,574,43.75,2025-05-25 11:07:25.173113,2025-05-25 11:07:31.259067,0 days 00:00:06.085954,AdamW,0.2617215535347508,,,5.645620859956587e-05,,,,0,,,0.0017139548527791962,,PRUNED
575,575,52.083333333333336,2025-05-25 11:07:31.299350,2025-05-25 11:07:42.665817,0 days 00:00:11.366467,AdamW,0.27546775032375165,,,8.129502998809999e-05,,,,0,,,0.0010360200249355644,,COMPLETE
576,576,33.333333333333336,2025-05-25 11:07:42.722986,2025-05-25 11:07:48.788688,0 days 00:00:06.065702,AdamW,0.24377887091167225,,,0.0008017192896405448,,,,0,,,0.0014693610300333805,,PRUNED
