,number,value,datetime_start,datetime_complete,duration,params_algorithm,params_dropout_rate,params_lr_Adadelta,params_lr_Adam,params_lr_AdamW,params_lr_SGD,params_momentum_SGD,params_nesterov_SGD,params_suggested_freeze,params_weight_decay_Adadelta,params_weight_decay_Adam,params_weight_decay_AdamW,params_weight_decay_SGD,state
577,577,43.75,2025-05-25 11:07:48.829938,2025-05-25 11:07:54.951927,0 days 00:00:06.121989,AdamW,0.2967895278805822,,,4.185925562173565e-05,,,,0,,,0.004165091479283278,,PRUNED
578,578,43.75,2025-05-25 11:07:54.992787,2025-05-25 11:08:03.164452,0 days 00:00:08.171665,AdamW,0.2614213755091407,,,2.009083588696865e-05,,,,1,,,0.0027457228615956155,,PRUNED
579,579,37.5,2025-05-25 11:08:03.205561,2025-05-25 11:08:11.400131,0 days 00:00:08.194570,AdamW,0.2776559529970151,,,7.214205875245763e-05,,,,0,,,0.0018928248499437757,,PRUNED
580,580,39.583333333333336,2025-05-25 11:08:11.441635,2025-05-25 11:08:17.542076,0 days 00:00:06.100441,AdamW,0.3070834182876436,,,2.3098024615562926e-05,,,,0,,,0.002306737398202235,,PRUNED
581,581,41.666666666666664,2025-05-25 11:08:17.583779,2025-05-25 11:08:23.750057,0 days 00:00:06.166278,AdamW,0.324149588274937,,,3.549721384842911e-05,,,,0,,,0.002390898027622872,,PRUNED
582,582,31.25,2025-05-25 11:08:23.792038,2025-05-25 11:08:29.849408,0 days 00:00:06.057370,AdamW,0.2529530292214403,,,1.5994472410198054e-05,,,,1,,,0.002982107964405024,,PRUNED
583,583,43.75,2025-05-25 11:08:29.890048,2025-05-25 11:08:35.957713,0 days 00:00:06.067665,AdamW,0.2660538659404134,,,5.061411017868859e-05,,,,0,,,0.0021046175286490157,,PRUNED
584,584,35.416666666666664,2025-05-25 11:08:35.998727,2025-05-25 11:08:42.071256,0 days 00:00:06.072529,AdamW,0.2884018519955566,,,1.9737374477731736e-05,,,,0,,,0.004616113812741968,,PRUNED
585,585,37.5,2025-05-25 11:08:42.112382,2025-05-25 11:08:48.183888,0 days 00:00:06.071506,AdamW,0.27535785013073405,,,3.02240388593104e-05,,,,1,,,0.005992425328991068,,PRUNED
586,586,33.333333333333336,2025-05-25 11:08:48.225334,2025-05-25 11:08:54.346692,0 days 00:00:06.121358,Adadelta,0.2859721029336011,1.2706314248368569,,,,,,1,0.8446634146686873,,,,PRUNED
587,587,41.666666666666664,2025-05-25 11:08:54.387133,2025-05-25 11:09:00.481630,0 days 00:00:06.094497,AdamW,0.24158468837579847,,,5.991730739675412e-05,,,,0,,,0.002691905976894538,,PRUNED
588,588,33.333333333333336,2025-05-25 11:09:00.521670,2025-05-25 11:09:06.574606,0 days 00:00:06.052936,AdamW,0.25609220287766127,,,1.1690607722779076e-05,,,,11,,,0.0018954799789983464,,PRUNED
589,589,31.25,2025-05-25 11:09:06.615071,2025-05-25 11:09:12.727988,0 days 00:00:06.112917,AdamW,0.30298907177011564,,,2.4086693309225303e-05,,,,0,,,0.003651715652556463,,PRUNED
590,590,33.333333333333336,2025-05-25 11:09:12.769199,2025-05-25 11:09:18.807473,0 days 00:00:06.038274,AdamW,0.26979518506496414,,,1.4673666827371817e-05,,,,11,,,0.003178815639226352,,PRUNED
591,591,,2025-05-25 11:09:18.847081,2025-05-25 11:09:24.345463,0 days 00:00:05.498382,SGD,0.2901581091104623,,,,0.012729978162325954,1.1499895551299986,True,1,,,,0.07909512500181418,PRUNED
592,592,39.583333333333336,2025-05-25 11:09:24.385025,2025-05-25 11:09:30.522714,0 days 00:00:06.137689,AdamW,0.27954993434893805,,,4.133420529050083e-05,,,,4,,,0.004966953666134513,,PRUNED
593,593,43.75,2025-05-25 11:09:30.563726,2025-05-25 11:09:36.663152,0 days 00:00:06.099426,AdamW,0.31569381799103297,,,1.8026344205744544e-05,,,,0,,,0.0016091985991677717,,PRUNED
594,594,39.583333333333336,2025-05-25 11:09:36.704516,2025-05-25 11:09:42.772636,0 days 00:00:06.068120,AdamW,0.26147566767241603,,,3.5013124901789444e-05,,,,0,,,0.0021652621803809596,,PRUNED
595,595,43.75,2025-05-25 11:09:42.813421,2025-05-25 11:09:48.873721,0 days 00:00:06.060300,AdamW,0.29684271331513984,,,2.135271628762055e-05,,,,12,,,0.004018567441138182,,PRUNED
596,596,33.333333333333336,2025-05-25 11:09:48.913630,2025-05-25 11:09:55.084690,0 days 00:00:06.171060,AdamW,0.4305174562569479,,,9.659828869478069e-05,,,,1,,,0.00252730029825694,,PRUNED
597,597,35.416666666666664,2025-05-25 11:09:55.126187,2025-05-25 11:10:01.193033,0 days 00:00:06.066846,AdamW,0.24471909335667932,,,1.2821135724597578e-05,,,,0,,,0.005354123346439349,,PRUNED
598,598,31.25,2025-05-25 11:10:01.234483,2025-05-25 11:10:07.373453,0 days 00:00:06.138970,AdamW,0.26570170600731113,,,2.6813856502976303e-05,,,,4,,,0.002322213657582602,,PRUNED
599,599,25.0,2025-05-25 11:10:07.414481,2025-05-25 11:10:13.485969,0 days 00:00:06.071488,AdamW,0.3796456913840517,,,1.5883904939850082e-05,,,,0,,,0.0013342381383394375,,PRUNED
600,600,35.416666666666664,2025-05-25 11:10:13.528163,2025-05-25 11:10:19.609563,0 days 00:00:06.081400,AdamW,0.27723068286755365,,,5.0633082745044386e-05,,,,1,,,0.0020612123329607694,,PRUNED
601,601,39.583333333333336,2025-05-25 11:10:19.650600,2025-05-25 11:10:25.773946,0 days 00:00:06.123346,AdamW,0.25504516253202375,,,7.105663618406821e-05,,,,11,,,0.0018151347532716672,,PRUNED
602,602,33.333333333333336,2025-05-25 11:10:25.813701,2025-05-25 11:10:31.942744,0 days 00:00:06.129043,AdamW,0.2848153406216686,,,0.01060763745712749,,,,0,,,0.004370578337681649,,PRUNED
603,603,37.5,2025-05-25 11:10:31.984966,2025-05-25 11:10:38.079217,0 days 00:00:06.094251,AdamW,0.3275948013264562,,,3.0430226957631906e-05,,,,1,,,0.0034694686316374254,,PRUNED
604,604,33.333333333333336,2025-05-25 11:10:38.120223,2025-05-25 11:10:44.228050,0 days 00:00:06.107827,AdamW,0.2688563541195444,,,4.2367823728882186e-05,,,,0,,,0.0029822720839215483,,PRUNED
605,605,33.333333333333336,2025-05-25 11:10:44.268805,2025-05-25 11:10:50.335016,0 days 00:00:06.066211,AdamW,0.2361199194525931,,,1.8547782856087407e-05,,,,0,,,0.0008729273667285549,,PRUNED
606,606,35.416666666666664,2025-05-25 11:10:50.375462,2025-05-25 11:10:56.515788,0 days 00:00:06.140326,AdamW,0.3080404189952904,,,1.1502746483970121e-05,,,,11,,,0.0025925284103398244,,PRUNED
607,607,37.5,2025-05-25 11:10:56.557187,2025-05-25 11:11:02.627278,0 days 00:00:06.070091,AdamW,0.29711361609526205,,,2.349002050428886e-05,,,,0,,,0.001959006198088142,,PRUNED
608,608,43.75,2025-05-25 11:11:02.668829,2025-05-25 11:11:08.774243,0 days 00:00:06.105414,AdamW,0.25373800654308915,,,1.3528324031985897e-05,,,,3,,,0.005778847621026088,,PRUNED
609,609,33.333333333333336,2025-05-25 11:11:08.816167,2025-05-25 11:11:14.891558,0 days 00:00:06.075391,AdamW,0.2736283840324588,,,0.0306596614348069,,,,4,,,0.002221457197092521,,PRUNED
610,610,37.5,2025-05-25 11:11:14.932217,2025-05-25 11:11:21.020835,0 days 00:00:06.088618,Adadelta,0.28657471860822864,0.010200058148515231,,,,,,1,0.21494956766187484,,,,PRUNED
611,611,37.5,2025-05-25 11:11:21.062240,2025-05-25 11:11:27.198259,0 days 00:00:06.136019,AdamW,0.24725928107531658,,,3.786142113826794e-05,,,,0,,,0.0015707750601837097,,PRUNED
612,612,33.333333333333336,2025-05-25 11:11:27.238980,2025-05-25 11:11:33.301201,0 days 00:00:06.062221,AdamW,0.3387903773324703,,,0.08577929359423592,,,,4,,,0.002437429029230523,,PRUNED
613,613,33.333333333333336,2025-05-25 11:11:33.342398,2025-05-25 11:11:39.455181,0 days 00:00:06.112783,AdamW,0.2651864103716345,,,5.6603116740264374e-05,,,,0,,,0.004817703069267829,,PRUNED
614,614,,2025-05-25 11:11:39.495913,2025-05-25 11:11:44.789230,0 days 00:00:05.293317,SGD,0.31859702149233393,,,,0.007281699055035833,35.23655335810288,False,1,,,,49.4130575244936,PRUNED
615,615,33.333333333333336,2025-05-25 11:11:44.827451,2025-05-25 11:11:50.901227,0 days 00:00:06.073776,AdamW,0.131483669823247,,,1.551245170030526e-05,,,,0,,,0.0009746275460663886,,PRUNED
616,616,41.666666666666664,2025-05-25 11:11:50.944046,2025-05-25 11:11:57.126477,0 days 00:00:06.182431,AdamW,0.27494537052926526,,,3.13368706661103e-05,,,,12,,,0.0016942411762335934,,PRUNED
617,617,35.416666666666664,2025-05-25 11:11:57.166334,2025-05-25 11:12:03.259701,0 days 00:00:06.093367,AdamW,0.2918594839335237,,,2.0621435802708494e-05,,,,10,,,0.0027448740662095747,,PRUNED
618,618,33.333333333333336,2025-05-25 11:12:03.301432,2025-05-25 11:12:09.128419,0 days 00:00:05.826987,AdamW,0.10393460153337142,,,2.534311057373642e-05,,,,1,,,0.0011496987598860393,,PRUNED
619,619,50.0,2025-05-25 11:12:09.165068,2025-05-25 11:12:16.966324,0 days 00:00:07.801256,AdamW,0.4156332876985033,,,6.705041263304845e-05,,,,11,,,0.0022992059227569055,,COMPLETE
620,620,35.416666666666664,2025-05-25 11:12:17.024755,2025-05-25 11:12:20.869237,0 days 00:00:03.844482,AdamW,0.2318117554314611,,,1.726370051323252e-05,,,,4,,,0.00043710198132184905,,PRUNED
621,621,31.25,2025-05-25 11:12:20.909613,2025-05-25 11:12:27.082069,0 days 00:00:06.172456,AdamW,0.28217819475944084,,,1.0237537669445962e-05,,,,0,,,0.0037585490292404576,,PRUNED
622,622,35.416666666666664,2025-05-25 11:12:27.123931,2025-05-25 11:12:33.229083,0 days 00:00:06.105152,AdamW,0.2598416829927281,,,5.0583860941974064e-05,,,,0,,,0.0020098395344590857,,PRUNED
623,623,33.333333333333336,2025-05-25 11:12:33.277748,2025-05-25 11:12:39.388880,0 days 00:00:06.111132,Adam,0.3041059751179649,,0.003911700780042504,,,,,2,,56.18448382149584,,,PRUNED
624,624,37.5,2025-05-25 11:12:39.430673,2025-05-25 11:12:44.928582,0 days 00:00:05.497909,AdamW,0.035938539709357335,,,8.217406097256957e-05,,,,11,,,0.006746440161336718,,PRUNED
625,625,37.5,2025-05-25 11:12:44.957009,2025-05-25 11:12:48.813703,0 days 00:00:03.856694,AdamW,0.2688770508772952,,,4.160618833787245e-05,,,,9,,,0.003342670795727532,,PRUNED
626,626,29.166666666666668,2025-05-25 11:12:48.854712,2025-05-25 11:12:54.987115,0 days 00:00:06.132403,AdamW,0.25131661372707786,,,3.3119327410143586e-05,,,,0,,,0.002839173915191032,,PRUNED
627,627,33.333333333333336,2025-05-25 11:12:55.027746,2025-05-25 11:13:01.111191,0 days 00:00:06.083445,AdamW,0.2809895850743633,,,1.4276188709550489e-05,,,,1,,,0.001795346180400345,,PRUNED
628,628,50.0,2025-05-25 11:13:01.151668,2025-05-25 11:13:12.517694,0 days 00:00:11.366026,AdamW,0.145372988045679,,,2.5130087782148038e-05,,,,3,,,0.0024928118301583376,,COMPLETE
629,629,39.583333333333336,2025-05-25 11:13:12.577970,2025-05-25 11:13:18.659875,0 days 00:00:06.081905,AdamW,0.3600453945487984,,,2.129110033071803e-05,,,,10,,,0.002167233964773733,,PRUNED
630,630,35.416666666666664,2025-05-25 11:13:18.701853,2025-05-25 11:13:24.825542,0 days 00:00:06.123689,AdamW,0.2944486701353802,,,1.769243414638253e-05,,,,1,,,0.004649238297789272,,PRUNED
631,631,33.333333333333336,2025-05-25 11:13:24.866960,2025-05-25 11:13:30.991035,0 days 00:00:06.124075,Adadelta,0.2739649535262563,6.978017194836371,,,,,,11,38.76494353026186,,,,PRUNED
632,632,33.333333333333336,2025-05-25 11:13:31.031943,2025-05-25 11:13:37.088414,0 days 00:00:06.056471,Adam,0.2630443329038242,,0.002610568162031503,,,,,4,,14.565408298861362,,,PRUNED
633,633,35.416666666666664,2025-05-25 11:13:37.129925,2025-05-25 11:13:43.211206,0 days 00:00:06.081281,AdamW,0.34469105935509414,,,1.1753315216104223e-05,,,,0,,,0.004227595016138446,,PRUNED
634,634,39.583333333333336,2025-05-25 11:13:43.253093,2025-05-25 11:13:49.354037,0 days 00:00:06.100944,AdamW,0.457875725626282,,,3.030816287229664e-05,,,,0,,,0.0030733437525619287,,PRUNED
635,635,37.5,2025-05-25 11:13:49.396640,2025-05-25 11:13:55.574216,0 days 00:00:06.177576,AdamW,0.2478629436703541,,,4.606438212190883e-05,,,,0,,,0.0019555248145583996,,PRUNED
636,636,33.333333333333336,2025-05-25 11:13:55.614975,2025-05-25 11:14:01.685450,0 days 00:00:06.070475,AdamW,0.22084523371153153,,,0.0003216493323990308,,,,1,,,0.006065132409658171,,PRUNED
637,637,,2025-05-25 11:14:01.727675,2025-05-25 11:14:07.027667,0 days 00:00:05.299992,SGD,0.04755702938499792,,,,0.03540155796329005,18.241351342611708,True,5,,,,0.43233368619836066,PRUNED
638,638,35.416666666666664,2025-05-25 11:14:07.066271,2025-05-25 11:14:13.206929,0 days 00:00:06.140658,AdamW,0.3932271210980601,,,1.4188239743637686e-05,,,,0,,,0.0024138288042277237,,PRUNED
639,639,43.75,2025-05-25 11:14:13.247508,2025-05-25 11:14:19.356343,0 days 00:00:06.108835,AdamW,0.3097746818568581,,,5.9304414046263e-05,,,,4,,,0.00013922582041026472,,PRUNED
640,640,27.083333333333332,2025-05-25 11:14:19.397891,2025-05-25 11:14:25.520370,0 days 00:00:06.122479,AdamW,0.29143986614468775,,,1.9005557903480103e-05,,,,13,,,0.002731359532464826,,PRUNED
641,641,33.333333333333336,2025-05-25 11:14:25.561938,2025-05-25 11:14:31.626624,0 days 00:00:06.064686,Adam,0.3330294565204391,,0.011848522004556212,,,,,0,,39.93813989414292,,,PRUNED
642,642,41.666666666666664,2025-05-25 11:14:31.698254,2025-05-25 11:14:37.844634,0 days 00:00:06.146380,AdamW,0.28229157163705665,,,0.00010353008432519683,,,,9,,,0.005399568600519641,,PRUNED
643,643,29.166666666666668,2025-05-25 11:14:37.886575,2025-05-25 11:14:43.973074,0 days 00:00:06.086499,AdamW,0.26049881172074574,,,3.773239772986672e-05,,,,12,,,0.001452307460661781,,PRUNED
644,644,43.75,2025-05-25 11:14:44.013626,2025-05-25 11:14:50.107008,0 days 00:00:06.093382,AdamW,0.0910505868292747,,,2.5886012119704883e-05,,,,2,,,0.009940941215833976,,PRUNED
645,645,33.333333333333336,2025-05-25 11:14:50.148854,2025-05-25 11:14:56.275127,0 days 00:00:06.126273,AdamW,0.2388753732077965,,,1.5822917049748133e-05,,,,3,,,0.002116330729670892,,PRUNED
646,646,25.0,2025-05-25 11:14:56.316413,2025-05-25 11:15:02.451412,0 days 00:00:06.134999,AdamW,0.2727227709395754,,,2.0914868213853848e-05,,,,1,,,0.002286470105660549,,PRUNED
647,647,35.416666666666664,2025-05-25 11:15:02.493482,2025-05-25 11:15:08.588079,0 days 00:00:06.094597,AdamW,0.3723059063203185,,,0.00012942251106724548,,,,5,,,0.0018861209536946695,,PRUNED
648,648,35.416666666666664,2025-05-25 11:15:08.628766,2025-05-25 11:15:14.703644,0 days 00:00:06.074878,AdamW,0.3223750869640048,,,1.275786865617494e-05,,,,0,,,0.007172005491766009,,PRUNED
649,649,35.416666666666664,2025-05-25 11:15:14.744425,2025-05-25 11:15:20.824715,0 days 00:00:06.080290,AdamW,0.027103968345098782,,,3.440248727897792e-05,,,,10,,,0.004078444700089947,,PRUNED
650,650,33.333333333333336,2025-05-25 11:15:20.865186,2025-05-25 11:15:27.026726,0 days 00:00:06.161540,Adam,0.29818532349442556,,2.904996779495379e-05,,,,,0,,1.7891879872042367,,,PRUNED
651,651,41.666666666666664,2025-05-25 11:15:27.068608,2025-05-25 11:15:33.126697,0 days 00:00:06.058089,AdamW,0.2558196361797595,,,7.166368362647583e-05,,,,11,,,0.004912616669191884,,PRUNED
652,652,33.333333333333336,2025-05-25 11:15:33.168588,2025-05-25 11:15:39.239985,0 days 00:00:06.071397,AdamW,0.28168140132871333,,,2.7901415207886837e-05,,,,1,,,0.002604028801683022,,PRUNED
653,653,37.5,2025-05-25 11:15:39.282569,2025-05-25 11:15:45.399395,0 days 00:00:06.116826,AdamW,0.2703314408615973,,,5.002022013181348e-05,,,,4,,,0.0032264334243858085,,PRUNED
654,654,27.083333333333332,2025-05-25 11:15:45.440104,2025-05-25 11:15:51.608908,0 days 00:00:06.168804,AdamW,0.28950879406666835,,,2.2742359849807297e-05,,,,5,,,0.0017124627596466107,,PRUNED
655,655,52.083333333333336,2025-05-25 11:15:51.650148,2025-05-25 11:16:03.121388,0 days 00:00:11.471240,Adadelta,0.03793693255991601,0.022889374116826025,,,,,,0,0.019973890931364556,,,,COMPLETE
656,656,39.583333333333336,2025-05-25 11:16:03.178752,2025-05-25 11:16:09.260583,0 days 00:00:06.081831,AdamW,0.3047560339342819,,,1.714974790390857e-05,,,,0,,,0.0036592137375150093,,PRUNED
657,657,37.5,2025-05-25 11:16:09.302906,2025-05-25 11:16:15.396731,0 days 00:00:06.093825,AdamW,0.25924688307328975,,,4.3988491717283223e-05,,,,1,,,0.0012824557766193787,,PRUNED
658,658,41.666666666666664,2025-05-25 11:16:15.438207,2025-05-25 11:16:21.559809,0 days 00:00:06.121602,AdamW,0.11283721000239044,,,1.0915865857546904e-05,,,,11,,,0.0020492817077416878,,PRUNED
659,659,33.333333333333336,2025-05-25 11:16:21.615851,2025-05-25 11:16:27.684085,0 days 00:00:06.068234,Adam,0.020056871594753188,,0.01951980141202971,,,,,0,,3.1945500730833345,,,PRUNED
660,660,33.333333333333336,2025-05-25 11:16:27.723488,2025-05-25 11:16:33.840503,0 days 00:00:06.117015,AdamW,0.2293382953984039,,,1.3911508774005593e-05,,,,2,,,0.0010415132633773555,,PRUNED
661,661,,2025-05-25 11:16:33.882269,2025-05-25 11:16:39.304523,0 days 00:00:05.422254,SGD,0.24505620795010905,,,,2.3572184658264747e-05,78.90757523770934,False,4,,,,11.977316401872333,PRUNED
662,662,39.583333333333336,2025-05-25 11:16:39.344558,2025-05-25 11:16:45.419255,0 days 00:00:06.074697,AdamW,0.16412705494571622,,,6.0637548191366225e-05,,,,1,,,0.002280030164127497,,PRUNED
663,663,35.416666666666664,2025-05-25 11:16:45.460338,2025-05-25 11:16:51.600238,0 days 00:00:06.139900,AdamW,0.27035635945260234,,,2.987436387616911e-05,,,,10,,,0.009008275191838238,,PRUNED
664,664,37.5,2025-05-25 11:16:51.642775,2025-05-25 11:16:57.807354,0 days 00:00:06.164579,AdamW,0.0553830057404896,,,1.9115856244813424e-05,,,,0,,,0.0008507468603810826,,PRUNED
665,665,37.5,2025-05-25 11:16:57.848110,2025-05-25 11:17:03.986448,0 days 00:00:06.138338,AdamW,0.3527405423139248,,,3.900914491069642e-05,,,,0,,,0.002962721243045075,,PRUNED
666,666,33.333333333333336,2025-05-25 11:17:04.027987,2025-05-25 11:17:10.080641,0 days 00:00:06.052654,AdamW,0.284098881064504,,,2.4421570071309103e-05,,,,9,,,0.002496863848577663,,PRUNED
667,667,33.333333333333336,2025-05-25 11:17:10.121550,2025-05-25 11:17:16.194508,0 days 00:00:06.072958,AdamW,0.29449470299234687,,,8.378447098913751e-05,,,,1,,,0.0015848161867983155,,PRUNED
668,668,60.416666666666664,2025-05-25 11:17:16.235052,2025-05-25 11:17:27.535747,0 days 00:00:11.300695,AdamW,0.3852267669944421,,,0.00019278585241489817,,,,11,,,0.005659814790793686,,COMPLETE
669,669,31.25,2025-05-25 11:17:27.593079,2025-05-25 11:17:33.671012,0 days 00:00:06.077933,AdamW,0.40649769314571593,,,6.818740368933141e-05,,,,3,,,0.004963295921061688,,PRUNED
670,670,35.416666666666664,2025-05-25 11:17:33.711641,2025-05-25 11:17:38.637739,0 days 00:00:04.926098,Adam,0.373138242250724,,0.0005162892256797772,,,,,0,,0.04100479599256967,,,PRUNED
671,671,33.333333333333336,2025-05-25 11:17:38.674760,2025-05-25 11:17:44.268983,0 days 00:00:05.594223,AdamW,0.3852733180530367,,,0.00010232891713864152,,,,2,,,0.005646755435371015,,PRUNED
672,672,43.75,2025-05-25 11:17:44.310565,2025-05-25 11:17:50.402655,0 days 00:00:06.092090,AdamW,0.26186600247077807,,,8.979796649976784e-05,,,,4,,,0.006731919344305221,,PRUNED
673,673,39.583333333333336,2025-05-25 11:17:50.444050,2025-05-25 11:17:56.656373,0 days 00:00:06.212323,AdamW,0.3988401059138961,,,0.0001318810091243201,,,,0,,,0.00606253480630009,,PRUNED
674,674,43.75,2025-05-25 11:17:56.697114,2025-05-25 11:18:01.727405,0 days 00:00:05.030291,AdamW,0.3836990900686397,,,5.2925932972734244e-05,,,,1,,,0.005340891994412055,,PRUNED
675,675,33.333333333333336,2025-05-25 11:18:01.763772,2025-05-25 11:18:04.074554,0 days 00:00:02.310782,AdamW,0.42281511486703993,,,3.474808729617631e-05,,,,11,,,0.004471101848561224,,PRUNED
676,676,50.0,2025-05-25 11:18:04.104696,2025-05-25 11:18:11.908046,0 days 00:00:07.803350,AdamW,0.36581791348435977,,,0.00018380852792584945,,,,10,,,0.005885874819545379,,COMPLETE
677,677,33.333333333333336,2025-05-25 11:18:11.968096,2025-05-25 11:18:18.095830,0 days 00:00:06.127734,AdamW,0.27675649884990394,,,0.0005197673228033294,,,,0,,,0.005121301966777654,,PRUNED
678,678,33.333333333333336,2025-05-25 11:18:18.138332,2025-05-25 11:18:24.274941,0 days 00:00:06.136609,Adam,0.12508064529431834,,1.2034111983613751e-05,,,,,4,,0.1155200249821533,,,PRUNED
679,679,35.416666666666664,2025-05-25 11:18:24.319801,2025-05-25 11:18:30.408281,0 days 00:00:06.088480,AdamW,0.2659811143607266,,,0.0002179708215184062,,,,1,,,0.003956481419561007,,PRUNED
680,680,33.333333333333336,2025-05-25 11:18:30.450818,2025-05-25 11:18:36.580124,0 days 00:00:06.129306,Adadelta,0.2498312552732268,0.1294504666493766,,,,,,0,0.07335540911937376,,,,PRUNED
681,681,41.666666666666664,2025-05-25 11:18:36.622567,2025-05-25 11:18:42.747852,0 days 00:00:06.125285,AdamW,0.024758608608226852,,,4.4065326593028946e-05,,,,7,,,0.0021335077890972725,,PRUNED
682,682,43.75,2025-05-25 11:18:42.790734,2025-05-25 11:18:48.863060,0 days 00:00:06.072326,AdamW,0.23696759634517423,,,6.179682033219833e-05,,,,5,,,0.006221297735035091,,PRUNED
683,683,37.5,2025-05-25 11:18:48.905761,2025-05-25 11:18:55.020644,0 days 00:00:06.114883,AdamW,0.2878087001524419,,,7.738364016721743e-05,,,,11,,,0.004547185411355974,,PRUNED
684,684,31.25,2025-05-25 11:18:55.063789,2025-05-25 11:19:01.186993,0 days 00:00:06.123204,AdamW,0.4393195567296867,,,0.00024638626423175943,,,,0,,,0.00186146988957498,,PRUNED
685,685,33.333333333333336,2025-05-25 11:19:01.231235,2025-05-25 11:19:07.329224,0 days 00:00:06.097989,AdamW,0.27573896409499304,,,5.018628117924755e-05,,,,12,,,0.0056348752423804474,,PRUNED
686,686,,2025-05-25 11:19:07.371475,2025-05-25 11:19:12.797072,0 days 00:00:05.425597,SGD,0.29946426402224363,,,,4.773649473809595e-05,92.80717142782129,True,1,,,,1.985199334907853,PRUNED
687,687,33.333333333333336,2025-05-25 11:19:12.836221,2025-05-25 11:19:18.988401,0 days 00:00:06.152180,AdamW,0.2554939236151353,,,0.0006552423939783767,,,,0,,,0.00276577337110312,,PRUNED
688,688,43.75,2025-05-25 11:19:19.030548,2025-05-25 11:19:25.188343,0 days 00:00:06.157795,AdamW,0.03375366918285918,,,3.563785928612678e-05,,,,9,,,0.0034380912018911088,,PRUNED
689,689,33.333333333333336,2025-05-25 11:19:25.229691,2025-05-25 11:19:31.311641,0 days 00:00:06.081950,Adam,0.06653968579735528,,0.0011841085736557363,,,,,4,,1.42361223545881,,,PRUNED
690,690,39.583333333333336,2025-05-25 11:19:31.352947,2025-05-25 11:19:37.462623,0 days 00:00:06.109676,AdamW,0.014883853395335883,,,0.00015831874311985898,,,,6,,,0.001200925448680546,,PRUNED
691,691,31.25,2025-05-25 11:19:37.503427,2025-05-25 11:19:43.633774,0 days 00:00:06.130347,AdamW,0.44729280551086553,,,2.7625289089143754e-05,,,,0,,,0.0025905659780847226,,PRUNED
692,692,37.5,2025-05-25 11:19:43.674869,2025-05-25 11:19:49.818389,0 days 00:00:06.143520,AdamW,0.314871904367589,,,4.2087545701827556e-05,,,,5,,,0.0023364684407904185,,PRUNED
