,number,value,datetime_start,datetime_complete,duration,params_algorithm,params_dropout_rate,params_lr_Adadelta,params_lr_Adam,params_lr_AdamW,params_lr_SGD,params_momentum_SGD,params_nesterov_SGD,params_suggested_freeze,params_weight_decay_Adadelta,params_weight_decay_Adam,params_weight_decay_AdamW,params_weight_decay_SGD,state
458,458,66.66666666666667,2025-05-24 23:34:55.184410,2025-05-24 23:35:26.709997,0 days 00:00:31.525587,AdamW,0.30823851900727295,,,0.00011653499219795175,,,,2,,,0.0018192974296496868,,COMPLETE
459,459,33.333333333333336,2025-05-24 23:35:26.766147,2025-05-24 23:35:46.728101,0 days 00:00:19.961954,AdamW,0.2801517010762259,,,0.00015026556786218624,,,,2,,,0.0018200475825962323,,PRUNED
460,460,33.333333333333336,2025-05-24 23:35:46.767273,2025-05-24 23:36:06.236195,0 days 00:00:19.468922,AdamW,0.040511032058952866,,,0.00010433605106738308,,,,2,,,0.0016515910601497925,,PRUNED
461,461,43.75,2025-05-24 23:36:06.274940,2025-05-24 23:36:23.557375,0 days 00:00:17.282435,AdamW,0.3081714571680033,,,1.3128792174425467e-05,,,,2,,,0.002035891570882577,,PRUNED
462,462,33.333333333333336,2025-05-24 23:36:23.596216,2025-05-24 23:36:40.421843,0 days 00:00:16.825627,AdamW,0.3276892275802659,,,0.00012851276861048662,,,,2,,,0.0014908340219043077,,PRUNED
463,463,37.5,2025-05-24 23:36:40.460660,2025-05-24 23:37:00.661595,0 days 00:00:20.200935,Adadelta,0.06576947912909738,0.13001619517507557,,,,,,2,1.468803900733934,,,,PRUNED
464,464,41.666666666666664,2025-05-24 23:37:00.700325,2025-05-24 23:37:22.619965,0 days 00:00:21.919640,AdamW,0.34351127523624037,,,0.00011284149097282156,,,,0,,,0.0010795885716120967,,PRUNED
465,465,39.583333333333336,2025-05-24 23:37:22.671255,2025-05-24 23:37:42.295134,0 days 00:00:19.623879,AdamW,0.39108281311490456,,,3.7589376396871965e-05,,,,2,,,0.001871013890748505,,PRUNED
466,466,33.333333333333336,2025-05-24 23:37:42.345060,2025-05-24 23:38:02.372001,0 days 00:00:20.026941,AdamW,0.33572698515886357,,,8.913128894828297e-05,,,,2,,,0.000641265016039931,,PRUNED
467,467,39.583333333333336,2025-05-24 23:38:02.412617,2025-05-24 23:38:23.174581,0 days 00:00:20.761964,AdamW,0.02064599790812485,,,0.00013001257968470902,,,,0,,,0.002539718303247934,,PRUNED
468,468,31.25,2025-05-24 23:38:23.203779,2025-05-24 23:38:32.071903,0 days 00:00:08.868124,AdamW,0.02951375310944737,,,5.725230536131283e-05,,,,2,,,0.0022327390268196763,,PRUNED
469,469,45.833333333333336,2025-05-24 23:38:32.110688,2025-05-24 23:38:52.625709,0 days 00:00:20.515021,AdamW,0.31147461741749044,,,1.6287208425979843e-05,,,,2,,,0.001696664744737221,,PRUNED
470,470,43.75,2025-05-24 23:38:52.665681,2025-05-24 23:39:12.289681,0 days 00:00:19.624000,AdamW,0.2967011831865821,,,2.1002217039076767e-05,,,,0,,,0.0013825981584512574,,PRUNED
471,471,37.5,2025-05-24 23:39:12.329452,2025-05-24 23:39:32.473929,0 days 00:00:20.144477,AdamW,0.2628816178366033,,,3.051796534354086e-05,,,,2,,,0.0012017903166816049,,PRUNED
472,472,,2025-05-24 23:39:32.512083,2025-05-24 23:39:50.734172,0 days 00:00:18.222089,SGD,0.055862980994519876,,,,0.03493762672642708,87.26197507276619,True,1,,,,38.004474757635144,PRUNED
473,473,43.75,2025-05-24 23:39:50.781089,2025-05-24 23:40:09.940277,0 days 00:00:19.159188,AdamW,0.2434401659117359,,,4.450929816481179e-05,,,,0,,,0.0009313051792598113,,PRUNED
474,474,33.333333333333336,2025-05-24 23:40:09.980705,2025-05-24 23:40:29.781755,0 days 00:00:19.801050,AdamW,0.044541591382756346,,,9.361295281053372e-05,,,,2,,,0.002054554282344375,,PRUNED
475,475,33.333333333333336,2025-05-24 23:40:29.820911,2025-05-24 23:40:49.767831,0 days 00:00:19.946920,AdamW,0.07562354183633788,,,6.310536828888738e-05,,,,1,,,0.0015065523601146369,,PRUNED
476,476,41.666666666666664,2025-05-24 23:40:49.806983,2025-05-24 23:41:08.522878,0 days 00:00:18.715895,AdamW,0.36325957381147916,,,5.0729081372108936e-05,,,,2,,,0.0018446009016512693,,PRUNED
477,477,33.333333333333336,2025-05-24 23:41:08.574250,2025-05-24 23:41:28.527716,0 days 00:00:19.953466,AdamW,0.02583625794976717,,,0.00016922150407211388,,,,1,,,0.0016420355998884885,,PRUNED
478,478,33.333333333333336,2025-05-24 23:41:28.583400,2025-05-24 23:41:47.436559,0 days 00:00:18.853159,Adam,0.03940414799841912,,0.02391550876839348,,,,,1,,2.100511249413327,,,PRUNED
479,479,47.916666666666664,2025-05-24 23:41:47.486153,2025-05-24 23:42:11.061057,0 days 00:00:23.574904,AdamW,0.376753014393428,,,7.653906280632235e-05,,,,2,,,0.002124377823784337,,PRUNED
480,480,60.416666666666664,2025-05-24 23:42:11.111814,2025-05-24 23:42:34.292358,0 days 00:00:23.180544,AdamW,0.015404961571035113,,,3.658086553134883e-05,,,,0,,,0.0013208290633004557,,PRUNED
481,481,33.333333333333336,2025-05-24 23:42:34.327149,2025-05-24 23:42:43.234848,0 days 00:00:08.907699,AdamW,0.05794723318506373,,,0.00011189615614842926,,,,2,,,0.0005317844168330891,,PRUNED
482,482,35.416666666666664,2025-05-24 23:42:43.273554,2025-05-24 23:43:03.322350,0 days 00:00:20.048796,AdamW,0.04676507235559848,,,2.4111712323398207e-05,,,,1,,,0.002380183962431096,,PRUNED
483,483,75.0,2025-05-24 23:43:03.361257,2025-05-24 23:43:35.512665,0 days 00:00:32.151408,AdamW,0.06594909858701867,,,4.296391041820652e-05,,,,1,,,0.0017651685156174926,,COMPLETE
484,484,31.25,2025-05-24 23:43:35.570044,2025-05-24 23:43:55.809227,0 days 00:00:20.239183,AdamW,0.07010639890295474,,,4.092988158434621e-05,,,,0,,,0.0017605548715548948,,PRUNED
485,485,33.333333333333336,2025-05-24 23:43:55.848433,2025-05-24 23:44:15.730257,0 days 00:00:19.881824,AdamW,0.0760926239265687,,,3.146765388680775e-05,,,,2,,,0.0019302165714681734,,PRUNED
486,486,33.333333333333336,2025-05-24 23:44:15.768500,2025-05-24 23:44:35.019620,0 days 00:00:19.251120,AdamW,0.08595417398177764,,,4.3122836043278855e-05,,,,6,,,0.001596420816457722,,PRUNED
487,487,31.25,2025-05-24 23:44:35.064097,2025-05-24 23:44:55.164373,0 days 00:00:20.100276,AdamW,0.0652449639276601,,,3.639645078207453e-05,,,,1,,,0.0027738761545586643,,PRUNED
488,488,33.333333333333336,2025-05-24 23:44:55.203270,2025-05-24 23:45:15.489369,0 days 00:00:20.286099,Adadelta,0.06137933000149936,2.0440023478151046,,,,,,1,0.04114686807739037,,,,PRUNED
489,489,35.416666666666664,2025-05-24 23:45:15.539714,2025-05-24 23:45:35.447392,0 days 00:00:19.907678,AdamW,0.10137106767098324,,,5.554934767355585e-05,,,,2,,,0.0017963829663121722,,PRUNED
490,490,31.25,2025-05-24 23:45:35.496708,2025-05-24 23:45:52.025404,0 days 00:00:16.528696,AdamW,0.05238732503341451,,,2.725702898655516e-05,,,,1,,,0.002013122317235473,,PRUNED
491,491,52.083333333333336,2025-05-24 23:45:52.077286,2025-05-24 23:46:07.551281,0 days 00:00:15.473995,AdamW,0.06730894270429623,,,4.852934139122606e-05,,,,2,,,0.001507969654399061,,PRUNED
492,492,41.666666666666664,2025-05-24 23:46:07.585922,2025-05-24 23:46:14.467015,0 days 00:00:06.881093,AdamW,0.08331052347381357,,,3.234465116619452e-05,,,,5,,,0.002234199048740026,,PRUNED
493,493,37.5,2025-05-24 23:46:14.501659,2025-05-24 23:46:30.967359,0 days 00:00:16.465700,AdamW,0.051598770026512246,,,4.601250268353084e-05,,,,1,,,0.0017132612569207685,,PRUNED
494,494,,2025-05-24 23:46:31.015465,2025-05-24 23:46:43.633754,0 days 00:00:12.618289,SGD,0.06057366494685254,,,,0.007342492716243825,62.77541937636265,True,0,,,,1.4249612171209676,PRUNED
495,495,35.416666666666664,2025-05-24 23:46:43.682453,2025-05-24 23:47:03.789231,0 days 00:00:20.106778,AdamW,0.03773210119902903,,,6.389271205249642e-05,,,,1,,,0.001919478547664309,,PRUNED
496,496,33.333333333333336,2025-05-24 23:47:03.841070,2025-05-24 23:47:23.817839,0 days 00:00:19.976769,AdamW,0.07650884153040802,,,0.0006952219154099442,,,,2,,,0.001629627220710778,,PRUNED
497,497,33.333333333333336,2025-05-24 23:47:23.868252,2025-05-24 23:47:43.778591,0 days 00:00:19.910339,AdamW,0.046047394950250106,,,3.916907930976541e-05,,,,1,,,0.002112416391272593,,PRUNED
498,498,31.25,2025-05-24 23:47:43.831479,2025-05-24 23:48:03.787703,0 days 00:00:19.956224,AdamW,0.09326343357593907,,,1.587838648166426e-05,,,,0,,,0.0018184103312339312,,PRUNED
499,499,29.166666666666668,2025-05-24 23:48:03.839409,2025-05-24 23:48:23.757343,0 days 00:00:19.917934,AdamW,0.055711274611314865,,,1.2871516273299808e-05,,,,1,,,0.0013934883145611107,,PRUNED
500,500,33.333333333333336,2025-05-24 23:48:23.800277,2025-05-24 23:48:43.866974,0 days 00:00:20.066697,AdamW,0.11102438239573886,,,5.768528935448174e-05,,,,1,,,0.0015629589614690243,,PRUNED
501,501,68.75,2025-05-24 23:48:43.918967,2025-05-24 23:49:15.683893,0 days 00:00:31.764926,AdamW,0.1476296326492702,,,4.751939777998116e-05,,,,2,,,0.0024747428022060735,,COMPLETE
502,502,35.416666666666664,2025-05-24 23:49:15.741317,2025-05-24 23:49:35.291813,0 days 00:00:19.550496,AdamW,0.1330689837745768,,,5.175890888963623e-05,,,,2,,,0.0028031794172972244,,PRUNED
503,503,37.5,2025-05-24 23:49:35.341016,2025-05-24 23:49:54.565126,0 days 00:00:19.224110,Adam,0.15154989183402778,,0.0001454455633835522,,,,,2,,7.866955740906926,,,PRUNED
504,504,25.0,2025-05-24 23:49:54.618076,2025-05-24 23:50:02.780528,0 days 00:00:08.162452,AdamW,0.14421173045405428,,,1.980879274043981e-05,,,,2,,,0.00264473953984324,,PRUNED
505,505,35.416666666666664,2025-05-24 23:50:02.820023,2025-05-24 23:50:18.412350,0 days 00:00:15.592327,AdamW,0.1519935368602761,,,8.641957689205342e-05,,,,2,,,0.0032952823106696173,,PRUNED
506,506,43.75,2025-05-24 23:50:18.448292,2025-05-24 23:50:25.928840,0 days 00:00:07.480548,AdamW,0.16512702542974833,,,6.57921950311578e-05,,,,2,,,0.0025191380484288627,,PRUNED
507,507,31.25,2025-05-24 23:50:25.966606,2025-05-24 23:50:36.562884,0 days 00:00:10.596278,AdamW,0.14356571470908974,,,5.08994063027885e-05,,,,2,,,0.0023676484839375606,,PRUNED
508,508,33.333333333333336,2025-05-24 23:50:36.595894,2025-05-24 23:50:42.769651,0 days 00:00:06.173757,AdamW,0.1300728935123971,,,3.905921861480787e-05,,,,2,,,0.00037586556646597755,,PRUNED
509,509,41.666666666666664,2025-05-24 23:50:42.803610,2025-05-24 23:50:49.317749,0 days 00:00:06.514139,AdamW,0.1562416207472637,,,0.00010085658825293327,,,,2,,,0.00027844812097871705,,PRUNED
510,510,33.333333333333336,2025-05-24 23:50:49.352119,2025-05-24 23:50:56.914516,0 days 00:00:07.562397,AdamW,0.12429641620256755,,,7.404015545564398e-05,,,,2,,,0.00010088142372608838,,PRUNED
511,511,33.333333333333336,2025-05-24 23:50:56.948828,2025-05-24 23:51:06.333492,0 days 00:00:09.384664,AdamW,0.13860501251827037,,,2.65149078005181e-05,,,,2,,,0.002336409969148883,,PRUNED
512,512,39.583333333333336,2025-05-24 23:51:06.367192,2025-05-24 23:51:12.579891,0 days 00:00:06.212699,AdamW,0.15785937757947632,,,0.00012725981697448905,,,,2,,,0.002138749471444607,,PRUNED
513,513,33.333333333333336,2025-05-24 23:51:12.612938,2025-05-24 23:51:18.977765,0 days 00:00:06.364827,AdamW,0.1451274652932103,,,6.0638137012083344e-05,,,,3,,,0.0014654712966538875,,PRUNED
514,514,33.333333333333336,2025-05-24 23:51:19.006053,2025-05-24 23:51:25.624192,0 days 00:00:06.618139,Adadelta,0.11864981053692411,0.37990948234675415,,,,,,2,0.22189384250244848,,,,PRUNED
515,515,33.333333333333336,2025-05-24 23:51:25.664091,2025-05-24 23:51:36.577690,0 days 00:00:10.913599,AdamW,0.033310525580430295,,,4.6925724706667624e-05,,,,0,,,0.0019755987820231254,,PRUNED
516,516,35.416666666666664,2025-05-24 23:51:36.611327,2025-05-24 23:51:42.931501,0 days 00:00:06.320174,AdamW,0.009612773419777109,,,1.1738688610950125e-05,,,,2,,,0.0025519342227795718,,PRUNED
517,517,45.833333333333336,2025-05-24 23:51:42.967710,2025-05-24 23:51:50.514985,0 days 00:00:07.547275,AdamW,0.126748350648272,,,8.643327339137741e-05,,,,2,,,0.0017263239479426127,,PRUNED
518,518,37.5,2025-05-24 23:51:50.545182,2025-05-24 23:51:58.408020,0 days 00:00:07.862838,AdamW,0.13613305211501878,,,3.409922354278806e-05,,,,2,,,0.002237942469636109,,PRUNED
519,519,,2025-05-24 23:51:58.436078,2025-05-24 23:52:04.029953,0 days 00:00:05.593875,SGD,0.07046377740715332,,,,0.0007174885603290147,30.904950561797648,False,0,,,,0.46544165622776296,PRUNED
520,520,33.333333333333336,2025-05-24 23:52:04.067237,2025-05-24 23:52:11.600989,0 days 00:00:07.533752,AdamW,0.03272626704246404,,,5.710924031061448e-05,,,,4,,,0.0030315834839883438,,PRUNED
521,521,37.5,2025-05-24 23:52:11.629145,2025-05-24 23:52:18.342565,0 days 00:00:06.713420,AdamW,0.15193368813813637,,,4.360309403529226e-05,,,,2,,,0.0019515933591754686,,PRUNED
522,522,43.75,2025-05-24 23:52:18.377410,2025-05-24 23:52:24.808377,0 days 00:00:06.430967,AdamW,0.16583613755136775,,,7.001032518391795e-05,,,,0,,,0.000458503836709214,,PRUNED
523,523,33.333333333333336,2025-05-24 23:52:24.842076,2025-05-24 23:52:34.204515,0 days 00:00:09.362439,AdamW,0.0244222178977474,,,9.030450509929889e-05,,,,1,,,0.0015682709572376638,,PRUNED
524,524,33.333333333333336,2025-05-24 23:52:34.238024,2025-05-24 23:52:40.666859,0 days 00:00:06.428835,AdamW,0.0658812599689261,,,0.00020299800514860108,,,,1,,,0.0013835936535642626,,PRUNED
525,525,31.25,2025-05-24 23:52:40.701579,2025-05-24 23:52:47.735101,0 days 00:00:07.033522,AdamW,0.11006933344292005,,,3.16992458657435e-05,,,,2,,,0.0006977493482859093,,PRUNED
526,526,33.333333333333336,2025-05-24 23:52:47.768796,2025-05-24 23:52:54.063704,0 days 00:00:06.294908,AdamW,0.08240217451253623,,,5.241228536619984e-05,,,,1,,,0.0017909789958380292,,PRUNED
527,527,43.75,2025-05-24 23:52:54.097178,2025-05-24 23:53:02.408870,0 days 00:00:08.311692,AdamW,0.21747883398544604,,,4.186183148662804e-05,,,,2,,,0.002112254195212918,,PRUNED
528,528,31.25,2025-05-24 23:53:02.442607,2025-05-24 23:53:08.718162,0 days 00:00:06.275555,AdamW,0.04804845342103362,,,2.2714279490239867e-05,,,,1,,,0.0017258340362746557,,PRUNED
529,529,37.5,2025-05-24 23:53:08.751161,2025-05-24 23:53:16.200758,0 days 00:00:07.449597,Adam,0.14333998962743355,,0.00043203921274530624,,,,,2,,0.02544062555735758,,,PRUNED
530,530,81.25,2025-05-24 23:53:16.233749,2025-05-24 23:53:30.023175,0 days 00:00:13.789426,AdamW,0.018964599130576302,,,0.00015002304979325402,,,,3,,,0.00125423180263007,,COMPLETE
531,531,41.666666666666664,2025-05-24 23:53:30.079107,2025-05-24 23:53:37.483274,0 days 00:00:07.404167,AdamW,0.26666876821711394,,,8.872366028720748e-05,,,,3,,,0.0012864177219604836,,PRUNED
532,532,33.333333333333336,2025-05-24 23:53:37.515993,2025-05-24 23:53:44.180713,0 days 00:00:06.664720,AdamW,0.11958865563417602,,,0.0001080964984357452,,,,3,,,0.002280914313828598,,PRUNED
533,533,39.583333333333336,2025-05-24 23:53:44.214230,2025-05-24 23:53:50.488556,0 days 00:00:06.274326,AdamW,0.059394877018789385,,,0.00013476230042570853,,,,3,,,0.0019822812340636784,,PRUNED
534,534,43.75,2025-05-24 23:53:50.521224,2025-05-24 23:53:56.758040,0 days 00:00:06.236816,AdamW,0.03808592519484666,,,0.00014230888646662535,,,,1,,,0.0015861618875087874,,PRUNED
535,535,35.416666666666664,2025-05-24 23:53:56.793020,2025-05-24 23:54:03.224857,0 days 00:00:06.431837,AdamW,0.0162407529912161,,,0.00011231135497019618,,,,3,,,0.0018820078437456827,,PRUNED
536,536,33.333333333333336,2025-05-24 23:54:03.257965,2025-05-24 23:54:09.451462,0 days 00:00:06.193497,AdamW,0.32524886185404367,,,0.00016654953027836405,,,,0,,,0.000598331726034684,,PRUNED
537,537,41.666666666666664,2025-05-24 23:54:09.484622,2025-05-24 23:54:15.593525,0 days 00:00:06.108903,AdamW,0.2994572640128435,,,0.00011522823126363386,,,,4,,,0.0024794922380188245,,PRUNED
538,538,33.333333333333336,2025-05-24 23:54:15.620362,2025-05-24 23:54:22.032697,0 days 00:00:06.412335,Adadelta,0.42343962887318504,7.594255451368653,,,,,,1,10.743213236081226,,,,PRUNED
539,539,37.5,2025-05-24 23:54:22.065415,2025-05-24 23:54:28.345642,0 days 00:00:06.280227,AdamW,0.026916555022395525,,,7.44850304736848e-05,,,,4,,,0.0014570410491085322,,PRUNED
540,540,33.333333333333336,2025-05-24 23:54:28.378758,2025-05-24 23:54:34.559171,0 days 00:00:06.180413,AdamW,0.17394741242963463,,,0.00015681107374874068,,,,1,,,0.0012201850898548952,,PRUNED
541,541,35.416666666666664,2025-05-24 23:54:34.592347,2025-05-24 23:54:40.808517,0 days 00:00:06.216170,AdamW,0.13251340455963972,,,9.771708223943945e-05,,,,1,,,0.0016567291181909275,,PRUNED
542,542,33.333333333333336,2025-05-24 23:54:40.836100,2025-05-24 23:54:47.128804,0 days 00:00:06.292704,AdamW,0.045291648543643676,,,7.799369780652517e-05,,,,3,,,0.0021100601439111304,,PRUNED
543,543,33.333333333333336,2025-05-24 23:54:47.161511,2025-05-24 23:54:53.655627,0 days 00:00:06.494116,AdamW,0.09776021448211678,,,1.501809392369617e-05,,,,3,,,0.0018683501698627037,,PRUNED
544,544,,2025-05-24 23:54:53.689150,2025-05-24 23:54:59.919790,0 days 00:00:06.230640,SGD,0.004708051852399579,,,,0.00020333929783492081,75.75335323426472,False,0,,,,0.029465704267853984,PRUNED
545,545,47.916666666666664,2025-05-24 23:54:59.952144,2025-05-24 23:55:07.482808,0 days 00:00:07.530664,AdamW,0.07580986508461346,,,6.393660900138761e-05,,,,1,,,0.0026829855790466085,,PRUNED
546,546,33.333333333333336,2025-05-24 23:55:07.511250,2025-05-24 23:55:13.793513,0 days 00:00:06.282263,AdamW,0.05525863961181293,,,0.00012087815958116898,,,,1,,,0.0017190253745557357,,PRUNED
547,547,33.333333333333336,2025-05-24 23:55:13.827435,2025-05-24 23:55:20.032087,0 days 00:00:06.204652,AdamW,0.06593114059870686,,,0.00023819914600981578,,,,0,,,0.0022792986649237293,,PRUNED
548,548,64.58333333333333,2025-05-24 23:55:20.066386,2025-05-24 23:55:32.805739,0 days 00:00:12.739353,AdamW,0.03590326463672017,,,9.317240658904571e-05,,,,2,,,0.0020270096598177753,,COMPLETE
549,549,37.5,2025-05-24 23:55:32.846807,2025-05-24 23:55:39.259842,0 days 00:00:06.413035,AdamW,0.15284207737461464,,,6.316663102863132e-05,,,,1,,,0.0014536209584093919,,PRUNED
550,550,33.333333333333336,2025-05-24 23:55:39.293977,2025-05-24 23:55:45.992282,0 days 00:00:06.698305,AdamW,0.12250098832284177,,,7.85184830230625e-05,,,,5,,,0.001302740124843441,,PRUNED
551,551,33.333333333333336,2025-05-24 23:55:46.194208,2025-05-24 23:55:52.510181,0 days 00:00:06.315973,AdamW,0.1403533880773696,,,5.219446158081983e-05,,,,1,,,0.0018098829513428125,,PRUNED
552,552,39.583333333333336,2025-05-24 23:55:52.543999,2025-05-24 23:55:58.895479,0 days 00:00:06.351480,AdamW,0.02151881972237874,,,6.805144583162657e-05,,,,2,,,0.0016247122794720837,,PRUNED
553,553,43.75,2025-05-24 23:55:58.930192,2025-05-24 23:56:05.179446,0 days 00:00:06.249254,Adam,0.04967136077398425,,6.326830634622835e-05,,,,,1,,0.13182308472151658,,,PRUNED
554,554,33.333333333333336,2025-05-24 23:56:05.212646,2025-05-24 23:56:11.458109,0 days 00:00:06.245463,AdamW,0.03092478501699651,,,1.8157924330646687e-05,,,,2,,,0.0008041248453400613,,PRUNED
555,555,33.333333333333336,2025-05-24 23:56:11.491186,2025-05-24 23:56:17.750754,0 days 00:00:06.259568,AdamW,0.011379540219903575,,,0.00010467591948547278,,,,1,,,0.0004838259301103322,,PRUNED
556,556,33.333333333333336,2025-05-24 23:56:17.778227,2025-05-24 23:56:24.034209,0 days 00:00:06.255982,AdamW,0.2353324128854871,,,1.0378664557573503e-05,,,,1,,,0.001988303352102988,,PRUNED
557,557,33.333333333333336,2025-05-24 23:56:24.066777,2025-05-24 23:56:30.417960,0 days 00:00:06.351183,AdamW,0.08594335630627821,,,5.862440116499587e-05,,,,4,,,0.0023978011438309786,,PRUNED
558,558,33.333333333333336,2025-05-24 23:56:30.450964,2025-05-24 23:56:36.259407,0 days 00:00:05.808443,AdamW,0.05878776294179171,,,0.00013939078649797043,,,,7,,,0.0015223194318413947,,PRUNED
559,559,31.25,2025-05-24 23:56:36.290068,2025-05-24 23:56:42.491522,0 days 00:00:06.201454,AdamW,0.04204803241120611,,,4.6874362428314166e-05,,,,0,,,0.001140008293713815,,PRUNED
560,560,37.5,2025-05-24 23:56:42.526037,2025-05-24 23:56:48.758460,0 days 00:00:06.232423,AdamW,0.13288572628853385,,,3.714103394569899e-05,,,,2,,,0.0028758144886755935,,PRUNED
561,561,33.333333333333336,2025-05-24 23:56:48.791402,2025-05-24 23:56:55.022469,0 days 00:00:06.231067,AdamW,0.0695214275020922,,,8.257107314597653e-05,,,,1,,,0.0021097632094285628,,PRUNED
562,562,47.916666666666664,2025-05-24 23:56:55.055360,2025-05-24 23:57:04.213839,0 days 00:00:09.158479,AdamW,0.1439041064375962,,,5.366751623219695e-05,,,,2,,,0.0018487622665520056,,PRUNED
563,563,33.333333333333336,2025-05-24 23:57:04.242121,2025-05-24 23:57:10.502276,0 days 00:00:06.260155,Adadelta,0.15897039346291345,45.41091594674727,,,,,,0,44.95150733957722,,,,PRUNED
564,564,39.583333333333336,2025-05-24 23:57:10.538420,2025-05-24 23:57:18.062526,0 days 00:00:07.524106,AdamW,0.10906286415558727,,,7.221037475114899e-05,,,,1,,,0.0016814243053882524,,PRUNED
565,565,41.666666666666664,2025-05-24 23:57:18.092995,2025-05-24 23:57:24.322755,0 days 00:00:06.229760,AdamW,0.02615059253710304,,,9.182320918984517e-05,,,,2,,,0.0006506489823813311,,PRUNED
566,566,31.25,2025-05-24 23:57:24.356109,2025-05-24 23:57:30.945147,0 days 00:00:06.589038,AdamW,0.25438815866745723,,,2.634302542854176e-05,,,,1,,,0.0013899200271361943,,PRUNED
567,567,31.25,2025-05-24 23:57:30.980773,2025-05-24 23:57:37.218309,0 days 00:00:06.237536,AdamW,0.04274035183956672,,,4.539397541831627e-05,,,,2,,,0.0022603772623516587,,PRUNED
568,568,,2025-05-24 23:57:37.251378,2025-05-24 23:57:42.911081,0 days 00:00:05.659703,SGD,0.12832579633392963,,,,0.0022384528881148748,11.28303510620551,True,0,,,,0.1774304234820432,PRUNED
569,569,41.666666666666664,2025-05-24 23:57:42.943576,2025-05-24 23:57:49.112552,0 days 00:00:06.168976,AdamW,0.05379951847618459,,,6.27459153376399e-05,,,,2,,,0.0015360782388339346,,PRUNED
570,570,41.666666666666664,2025-05-24 23:57:49.140810,2025-05-24 23:57:55.383569,0 days 00:00:06.242759,AdamW,0.015675948799602414,,,3.536419704920203e-05,,,,1,,,0.0019420500488641086,,PRUNED
571,571,33.333333333333336,2025-05-24 23:57:55.416856,2025-05-24 23:58:01.968160,0 days 00:00:06.551304,AdamW,0.034608466566640926,,,0.00112408306687976,,,,1,,,0.001735442601573526,,PRUNED
572,572,39.583333333333336,2025-05-24 23:58:02.002739,2025-05-24 23:58:09.426503,0 days 00:00:07.423764,AdamW,0.07401778217313643,,,5.373122519303443e-05,,,,2,,,0.0025371468989331585,,PRUNED
