,number,value,datetime_start,datetime_complete,duration,params_algorithm,params_dropout_rate,params_lr_Adadelta,params_lr_Adam,params_lr_AdamW,params_lr_SGD,params_momentum_SGD,params_nesterov_SGD,params_suggested_freeze,params_weight_decay_Adadelta,params_weight_decay_Adam,params_weight_decay_AdamW,params_weight_decay_SGD,state
573,573,33.333333333333336,2025-05-24 23:58:09.459947,2025-05-24 23:58:15.662905,0 days 00:00:06.202958,AdamW,0.11995459921952051,,,0.00010098151271121841,,,,1,,,0.0021687196970982315,,PRUNED
574,574,35.416666666666664,2025-05-24 23:58:15.869067,2025-05-24 23:58:22.074189,0 days 00:00:06.205122,AdamW,0.28476988275454945,,,0.00018904795062314432,,,,2,,,0.0013624709089947935,,PRUNED
575,575,62.5,2025-05-24 23:58:22.107266,2025-05-24 23:58:35.022131,0 days 00:00:12.914865,AdamW,0.0004791961194101149,,,3.90535099638608e-05,,,,0,,,0.0019133968917852745,,COMPLETE
576,576,33.333333333333336,2025-05-24 23:58:35.063469,2025-05-24 23:58:41.300029,0 days 00:00:06.236560,AdamW,0.16298406326517315,,,0.00012174453745476135,,,,1,,,0.0015384182840927855,,PRUNED
577,577,33.333333333333336,2025-05-24 23:58:41.336209,2025-05-24 23:58:47.518561,0 days 00:00:06.182352,Adam,0.04763124203740009,,0.0020493576116094266,,,,,3,,14.136626820937066,,,PRUNED
578,578,39.583333333333336,2025-05-24 23:58:47.555529,2025-05-24 23:58:53.805102,0 days 00:00:06.249573,AdamW,0.06350700749049143,,,1.435478431178074e-05,,,,1,,,0.0009947919018658531,,PRUNED
579,579,41.666666666666664,2025-05-24 23:58:53.839872,2025-05-24 23:59:00.304003,0 days 00:00:06.464131,AdamW,0.09148198745817221,,,7.769062711377754e-05,,,,5,,,0.0012119573042647328,,PRUNED
580,580,31.25,2025-05-24 23:59:00.338519,2025-05-24 23:59:06.535825,0 days 00:00:06.197306,AdamW,0.14928325032671053,,,2.9426447900228414e-05,,,,2,,,0.0005229454883699002,,PRUNED
581,581,33.333333333333336,2025-05-24 23:59:06.569557,2025-05-24 23:59:12.817815,0 days 00:00:06.248258,AdamW,0.02408712116602581,,,6.258760764658251e-05,,,,1,,,0.0017495417401822472,,PRUNED
582,582,37.5,2025-05-24 23:59:12.852351,2025-05-24 23:59:19.037571,0 days 00:00:06.185220,AdamW,0.13536405344792798,,,4.6292986336539784e-05,,,,3,,,0.002061587168473311,,PRUNED
583,583,41.666666666666664,2025-05-24 23:59:19.066392,2025-05-24 23:59:25.324046,0 days 00:00:06.257654,AdamW,0.034662317033698674,,,2.130788901279113e-05,,,,1,,,0.0016204091972980223,,PRUNED
584,584,31.25,2025-05-24 23:59:25.359114,2025-05-24 23:59:31.840323,0 days 00:00:06.481209,AdamW,0.05505749907810848,,,6.966676358539398e-05,,,,2,,,0.0005657125693916882,,PRUNED
585,585,33.333333333333336,2025-05-24 23:59:31.873950,2025-05-24 23:59:38.273483,0 days 00:00:06.399533,AdamW,0.11496087543807536,,,8.616654344266558e-05,,,,0,,,0.0023944411187785323,,PRUNED
586,586,41.666666666666664,2025-05-24 23:59:38.308797,2025-05-24 23:59:44.567631,0 days 00:00:06.258834,AdamW,0.07838606273850819,,,5.266321520187156e-05,,,,1,,,0.0018610381951672122,,PRUNED
587,587,20.833333333333332,2025-05-24 23:59:44.602524,2025-05-24 23:59:50.780521,0 days 00:00:06.177997,Adadelta,0.01652381712823135,0.016493473810973814,,,,,,2,24.816587964729223,,,,PRUNED
588,588,37.5,2025-05-24 23:59:50.814251,2025-05-24 23:59:57.076479,0 days 00:00:06.262228,AdamW,0.10055102757417839,,,4.1071403481618844e-05,,,,1,,,0.0014290663926713868,,PRUNED
589,589,35.416666666666664,2025-05-24 23:59:57.111041,2025-05-25 00:00:03.674402,0 days 00:00:06.563361,AdamW,0.17126531043911683,,,0.00010279577144787849,,,,0,,,0.0021376066601357505,,PRUNED
590,590,39.583333333333336,2025-05-25 00:00:03.710377,2025-05-25 00:00:09.879049,0 days 00:00:06.168672,AdamW,0.040310241710594635,,,3.170991742382597e-05,,,,1,,,0.0016488403156745743,,PRUNED
591,591,33.333333333333336,2025-05-25 00:00:09.915582,2025-05-25 00:00:16.024048,0 days 00:00:06.108466,AdamW,0.06550386856284691,,,0.00014470929203201294,,,,4,,,0.001298188906906176,,PRUNED
592,592,22.916666666666668,2025-05-25 00:00:16.059324,2025-05-25 00:00:21.881825,0 days 00:00:05.822501,SGD,0.14776898336263491,,,,0.009320984935416794,79.64188236745245,True,8,,,,0.0741512373913877,PRUNED
593,593,43.75,2025-05-25 00:00:21.913190,2025-05-25 00:00:28.308626,0 days 00:00:06.395436,AdamW,0.027553964283273214,,,6.314375980697675e-05,,,,2,,,0.0010805313437741576,,PRUNED
594,594,35.416666666666664,2025-05-25 00:00:28.342200,2025-05-25 00:00:34.541634,0 days 00:00:06.199434,AdamW,0.04936813563805677,,,1.200477311303941e-05,,,,1,,,0.0017992926517520185,,PRUNED
595,595,58.333333333333336,2025-05-25 00:00:34.576460,2025-05-25 00:00:44.556615,0 days 00:00:09.980155,AdamW,0.13566811516028357,,,4.980357079977557e-05,,,,2,,,0.001943571697317495,,PRUNED
596,596,33.333333333333336,2025-05-25 00:00:44.590538,2025-05-25 00:00:51.555146,0 days 00:00:06.964608,AdamW,0.06093264360501984,,,8.159692330857179e-05,,,,1,,,0.0022955174346025956,,PRUNED
597,597,33.333333333333336,2025-05-25 00:00:51.596574,2025-05-25 00:00:58.804046,0 days 00:00:07.207472,AdamW,0.12435046107058402,,,0.0037095503158105984,,,,2,,,0.0015300855138601372,,PRUNED
598,598,41.666666666666664,2025-05-25 00:00:58.854607,2025-05-25 00:01:07.634667,0 days 00:00:08.780060,AdamW,0.009913224758634237,,,1.784959088992109e-05,,,,1,,,0.00266737135657902,,PRUNED
599,599,64.58333333333333,2025-05-25 00:01:07.669209,2025-05-25 00:01:20.672699,0 days 00:00:13.003490,AdamW,0.033563837775476994,,,3.954880928752757e-05,,,,2,,,0.001731001800526168,,COMPLETE
600,600,37.5,2025-05-25 00:01:20.713637,2025-05-25 00:01:28.216373,0 days 00:00:07.502736,AdamW,0.047301522863457166,,,5.750286816154606e-05,,,,0,,,0.003219395400569872,,PRUNED
601,601,33.333333333333336,2025-05-25 00:01:28.267388,2025-05-25 00:01:37.568434,0 days 00:00:09.301046,Adam,0.02384725991193779,,0.01900615632369197,,,,,2,,38.17514881991841,,,PRUNED
602,602,33.333333333333336,2025-05-25 00:01:37.607404,2025-05-25 00:01:45.183694,0 days 00:00:07.576290,AdamW,0.08016374063069741,,,0.0001208093540395869,,,,1,,,0.0021209676244912435,,PRUNED
603,603,31.25,2025-05-25 00:01:45.229613,2025-05-25 00:01:51.723786,0 days 00:00:06.494173,AdamW,0.15701072028538696,,,0.0018685423404587586,,,,6,,,0.001935621560238018,,PRUNED
604,604,33.333333333333336,2025-05-25 00:01:51.755764,2025-05-25 00:01:59.164589,0 days 00:00:07.408825,AdamW,0.14092061589480778,,,7.653015068210392e-05,,,,1,,,0.0012703219065162683,,PRUNED
605,605,37.5,2025-05-25 00:01:59.215262,2025-05-25 00:02:07.290168,0 days 00:00:08.074906,AdamW,0.11047095968325689,,,4.545932172928471e-05,,,,2,,,0.0015987153872904834,,PRUNED
606,606,35.416666666666664,2025-05-25 00:02:07.324132,2025-05-25 00:02:13.689074,0 days 00:00:06.364942,AdamW,0.03666912519907458,,,9.55243561634933e-05,,,,0,,,0.0014575467249384395,,PRUNED
607,607,35.416666666666664,2025-05-25 00:02:13.723748,2025-05-25 00:02:20.342451,0 days 00:00:06.618703,AdamW,0.0707037474124858,,,6.673979694813018e-05,,,,1,,,0.0008243549469965119,,PRUNED
608,608,31.25,2025-05-25 00:02:20.564923,2025-05-25 00:02:27.854754,0 days 00:00:07.289831,AdamW,0.05504942062601801,,,3.440760338330371e-05,,,,3,,,0.0007173418564992593,,PRUNED
609,609,33.333333333333336,2025-05-25 00:02:27.905607,2025-05-25 00:02:37.254597,0 days 00:00:09.348990,AdamW,0.12409171650086957,,,0.0306596614348069,,,,1,,,0.0017907892511285848,,PRUNED
610,610,33.333333333333336,2025-05-25 00:02:37.284463,2025-05-25 00:02:43.736925,0 days 00:00:06.452462,AdamW,0.02046792580838455,,,2.3776677503101883e-05,,,,1,,,0.0021795869233156946,,PRUNED
611,611,77.08333333333333,2025-05-25 00:02:43.772212,2025-05-25 00:02:58.046804,0 days 00:00:14.274592,AdamW,0.042572339168866824,,,5.459179463985264e-05,,,,2,,,0.0024270011365179257,,COMPLETE
612,612,37.5,2025-05-25 00:02:58.106749,2025-05-25 00:03:07.169208,0 days 00:00:09.062459,AdamW,0.036298791886049744,,,0.0003584141783828332,,,,2,,,0.0024608358345133566,,PRUNED
613,613,41.666666666666664,2025-05-25 00:03:07.211105,2025-05-25 00:03:16.258503,0 days 00:00:09.047398,AdamW,0.04448417979075069,,,5.826179169788e-05,,,,2,,,0.0026070016272275475,,PRUNED
614,614,33.333333333333336,2025-05-25 00:03:16.298833,2025-05-25 00:03:24.007933,0 days 00:00:07.709100,AdamW,0.056582254031881773,,,7.340604550660271e-05,,,,2,,,0.0002987128438323407,,PRUNED
615,615,33.333333333333336,2025-05-25 00:03:24.042753,2025-05-25 00:03:33.383542,0 days 00:00:09.340789,Adadelta,0.04124134908770452,1.2013754424138063,,,,,,2,74.87097473488438,,,,PRUNED
616,616,31.25,2025-05-25 00:03:33.429170,2025-05-25 00:03:40.044923,0 days 00:00:06.615753,AdamW,0.04845422503498978,,,5.602232577578905e-05,,,,2,,,0.002868084072869909,,PRUNED
617,617,,2025-05-25 00:03:40.079388,2025-05-25 00:03:45.845272,0 days 00:00:05.765884,SGD,0.007685781768491346,,,,7.758207869430738e-05,44.77234210838924,False,2,,,,5.286728281004939,PRUNED
618,618,33.333333333333336,2025-05-25 00:03:45.885962,2025-05-25 00:03:53.417688,0 days 00:00:07.531726,AdamW,0.03151015805646555,,,4.487890406376972e-05,,,,2,,,0.002448363820254267,,PRUNED
619,619,33.333333333333336,2025-05-25 00:03:53.455383,2025-05-25 00:04:03.030080,0 days 00:00:09.574697,AdamW,0.05957348505996307,,,6.757369817989472e-05,,,,2,,,0.002343878991410316,,PRUNED
620,620,33.333333333333336,2025-05-25 00:04:03.076844,2025-05-25 00:04:10.606592,0 days 00:00:07.529748,AdamW,0.02504590669247997,,,9.095154185677279e-05,,,,2,,,0.0028399793194945518,,PRUNED
621,621,43.75,2025-05-25 00:04:10.641620,2025-05-25 00:04:17.583238,0 days 00:00:06.941618,AdamW,0.01520562614539758,,,5.158482268143052e-05,,,,2,,,0.00023364477789885362,,PRUNED
622,622,33.333333333333336,2025-05-25 00:04:17.621941,2025-05-25 00:04:24.147882,0 days 00:00:06.525941,AdamW,0.06698692720818233,,,0.00011743207549933046,,,,2,,,0.002072881402435709,,PRUNED
623,623,33.333333333333336,2025-05-25 00:04:24.182153,2025-05-25 00:04:31.256354,0 days 00:00:07.074201,AdamW,0.04545204696328807,,,0.0005450469402102217,,,,2,,,0.00014186243322129836,,PRUNED
624,624,41.666666666666664,2025-05-25 00:04:31.289345,2025-05-25 00:04:38.581202,0 days 00:00:07.291857,AdamW,0.030752370101225862,,,7.668434280825541e-05,,,,0,,,0.0019337424014730837,,PRUNED
625,625,39.583333333333336,2025-05-25 00:04:38.626426,2025-05-25 00:04:46.096201,0 days 00:00:07.469775,AdamW,0.054386174379248524,,,0.0001654868073150232,,,,1,,,0.0021944121087874406,,PRUNED
626,626,35.416666666666664,2025-05-25 00:04:46.131011,2025-05-25 00:04:53.043492,0 days 00:00:06.912481,Adam,0.08635978415006045,,9.468610822178553e-05,,,,,1,,0.7873307409616623,,,PRUNED
627,627,33.333333333333336,2025-05-25 00:04:53.079994,2025-05-25 00:05:01.174269,0 days 00:00:08.094275,AdamW,0.04566767013572541,,,5.7535309645655895e-05,,,,3,,,0.0017097557378452782,,PRUNED
628,628,47.916666666666664,2025-05-25 00:05:01.223893,2025-05-25 00:05:09.030070,0 days 00:00:07.806177,AdamW,0.06786878995125865,,,4.416772423971781e-05,,,,2,,,0.002573459561924013,,PRUNED
629,629,33.333333333333336,2025-05-25 00:05:09.064132,2025-05-25 00:05:15.512458,0 days 00:00:06.448326,AdamW,0.03860150139706579,,,9.015432745897758e-05,,,,0,,,0.0014001396373878143,,PRUNED
630,630,37.5,2025-05-25 00:05:15.549760,2025-05-25 00:05:22.388458,0 days 00:00:06.838698,AdamW,0.021498316851578256,,,6.592179328696386e-05,,,,1,,,0.0019519579069855486,,PRUNED
631,631,41.666666666666664,2025-05-25 00:05:22.422207,2025-05-25 00:05:29.862960,0 days 00:00:07.440753,AdamW,0.054879150533740054,,,4.967555121154985e-05,,,,2,,,0.0022864065378524197,,PRUNED
632,632,43.75,2025-05-25 00:05:29.912778,2025-05-25 00:05:37.183517,0 days 00:00:07.270739,AdamW,0.35861426155752346,,,3.845542968860436e-05,,,,2,,,0.0011698152088234328,,PRUNED
633,633,33.333333333333336,2025-05-25 00:05:37.218357,2025-05-25 00:05:43.954721,0 days 00:00:06.736364,AdamW,0.37155072932457206,,,0.010118722177973787,,,,1,,,0.001597016171537107,,PRUNED
634,634,33.333333333333336,2025-05-25 00:05:43.989608,2025-05-25 00:05:51.172361,0 days 00:00:07.182753,AdamW,0.029749871003057843,,,0.00010941260113209643,,,,1,,,0.0018631638445010005,,PRUNED
635,635,37.5,2025-05-25 00:05:51.207853,2025-05-25 00:05:57.706974,0 days 00:00:06.499121,AdamW,0.07908324698361632,,,8.31571873915408e-05,,,,2,,,0.002086503757372019,,PRUNED
636,636,75.0,2025-05-25 00:05:57.757554,2025-05-25 00:06:13.197773,0 days 00:00:15.440219,AdamW,0.321715560574394,,,0.0001302723345232164,,,,2,,,0.0017288481801952134,,COMPLETE
637,637,33.333333333333336,2025-05-25 00:06:13.240746,2025-05-25 00:06:19.721360,0 days 00:00:06.480614,AdamW,0.32210781359769064,,,0.00017983032071410023,,,,2,,,0.002793894710519866,,PRUNED
638,638,45.833333333333336,2025-05-25 00:06:19.755320,2025-05-25 00:06:27.867542,0 days 00:00:08.112222,Adadelta,0.328380689791097,0.010422945411620513,,,,,,2,0.5726627357404896,,,,PRUNED
639,639,39.583333333333336,2025-05-25 00:06:27.900588,2025-05-25 00:06:34.174284,0 days 00:00:06.273696,AdamW,0.33203106795215853,,,0.0001351383490179997,,,,2,,,0.0025487395528408763,,PRUNED
640,640,33.333333333333336,2025-05-25 00:06:34.208597,2025-05-25 00:06:40.835745,0 days 00:00:06.627148,AdamW,0.3151868212502401,,,0.0001299815053988297,,,,2,,,0.002312685594341206,,PRUNED
641,641,35.416666666666664,2025-05-25 00:06:40.868332,2025-05-25 00:06:47.367492,0 days 00:00:06.499160,AdamW,0.32053443632489137,,,0.000149843703753987,,,,2,,,0.003050405529927269,,PRUNED
642,642,37.5,2025-05-25 00:06:47.402088,2025-05-25 00:06:53.826599,0 days 00:00:06.424511,AdamW,0.29813762515333425,,,0.00010858042770428809,,,,2,,,0.0017359557074523382,,PRUNED
643,643,33.333333333333336,2025-05-25 00:06:53.859941,2025-05-25 00:07:00.249648,0 days 00:00:06.389707,SGD,0.31377337882038814,,,,0.004100032662285118,2.929296304868295,True,2,,,,50.814424508863205,PRUNED
644,644,29.166666666666668,2025-05-25 00:07:00.282711,2025-05-25 00:07:06.416818,0 days 00:00:06.134107,AdamW,0.3324454198895634,,,0.00010320416276822664,,,,2,,,0.0015270237281732495,,PRUNED
645,645,41.666666666666664,2025-05-25 00:07:06.450150,2025-05-25 00:07:12.601174,0 days 00:00:06.151024,AdamW,0.013061106958284968,,,0.00021250159106532164,,,,2,,,0.0020352203797757537,,PRUNED
646,646,33.333333333333336,2025-05-25 00:07:12.635116,2025-05-25 00:07:18.787443,0 days 00:00:06.152327,AdamW,0.06424075718199412,,,6.82805660082626e-05,,,,2,,,0.0017897023063456865,,PRUNED
647,647,33.333333333333336,2025-05-25 00:07:18.820453,2025-05-25 00:07:24.995356,0 days 00:00:06.174903,AdamW,0.03494057392943041,,,0.0001352384252762471,,,,3,,,0.0016155197663560849,,PRUNED
648,648,33.333333333333336,2025-05-25 00:07:25.029411,2025-05-25 00:07:31.509538,0 days 00:00:06.480127,AdamW,0.002069291220775652,,,0.000304743142352118,,,,1,,,0.002386170884329254,,PRUNED
649,649,33.333333333333336,2025-05-25 00:07:31.544895,2025-05-25 00:07:37.677656,0 days 00:00:06.132761,AdamW,0.29157214037795043,,,0.00015820583839615992,,,,2,,,0.002037761258857246,,PRUNED
650,650,37.5,2025-05-25 00:07:37.711968,2025-05-25 00:07:43.937550,0 days 00:00:06.225582,AdamW,0.04353076704085623,,,9.13185822589471e-05,,,,1,,,0.0014256944481297494,,PRUNED
651,651,35.416666666666664,2025-05-25 00:07:43.971757,2025-05-25 00:07:50.093268,0 days 00:00:06.121511,AdamW,0.4069333768036405,,,5.349180606148791e-05,,,,2,,,0.0018558675765040316,,PRUNED
652,652,33.333333333333336,2025-05-25 00:07:50.129798,2025-05-25 00:07:56.389756,0 days 00:00:06.259958,Adam,0.023867991300493226,,0.006628237647740027,,,,,1,,1.4997464008833021,,,PRUNED
653,653,39.583333333333336,2025-05-25 00:07:56.423289,2025-05-25 00:08:02.863479,0 days 00:00:06.440190,AdamW,0.3020590250837746,,,7.856945031958613e-05,,,,2,,,0.0022124388956902942,,PRUNED
654,654,33.333333333333336,2025-05-25 00:08:02.899097,2025-05-25 00:08:09.113880,0 days 00:00:06.214783,AdamW,0.051714773013045785,,,0.00011623561362536999,,,,1,,,0.00269987278422759,,PRUNED
655,655,35.416666666666664,2025-05-25 00:08:09.148704,2025-05-25 00:08:15.458559,0 days 00:00:06.309855,AdamW,0.180154705138884,,,6.059845482781883e-05,,,,2,,,0.0016517228675627402,,PRUNED
656,656,60.416666666666664,2025-05-25 00:08:15.493448,2025-05-25 00:08:28.151473,0 days 00:00:12.658025,AdamW,0.34401208554991236,,,4.1126685789770457e-05,,,,2,,,0.0013040284580784441,,COMPLETE
657,657,58.333333333333336,2025-05-25 00:08:28.193718,2025-05-25 00:08:40.651155,0 days 00:00:12.457437,AdamW,0.3083161541324495,,,9.435902347956688e-05,,,,3,,,0.0018113753041852287,,PRUNED
658,658,33.333333333333336,2025-05-25 00:08:40.686332,2025-05-25 00:08:46.844858,0 days 00:00:06.158526,AdamW,0.07118888129754623,,,4.826300754593667e-05,,,,1,,,0.0020336997739906605,,PRUNED
659,659,31.25,2025-05-25 00:08:46.878826,2025-05-25 00:08:53.094531,0 days 00:00:06.215705,AdamW,0.038659159057439677,,,7.000556151598081e-05,,,,1,,,0.002481258642974948,,PRUNED
660,660,39.583333333333336,2025-05-25 00:08:53.128204,2025-05-25 00:08:59.421612,0 days 00:00:06.293408,AdamW,0.01627684914749677,,,3.468133133727844e-05,,,,1,,,0.0015326545000026977,,PRUNED
661,661,39.583333333333336,2025-05-25 00:08:59.456809,2025-05-25 00:09:05.602207,0 days 00:00:06.145398,AdamW,0.05983660465428777,,,5.579841757000739e-05,,,,2,,,0.0017039905916885112,,PRUNED
662,662,33.333333333333336,2025-05-25 00:09:05.637734,2025-05-25 00:09:11.820176,0 days 00:00:06.182442,Adadelta,0.3426639868097043,5.075479071935356,,,,,,1,1.2209528965799474,,,,PRUNED
663,663,39.583333333333336,2025-05-25 00:09:11.854770,2025-05-25 00:09:17.990554,0 days 00:00:06.135784,AdamW,0.02486375561404944,,,8.128963817564835e-05,,,,2,,,0.00018618925254982783,,PRUNED
664,664,43.75,2025-05-25 00:09:18.023838,2025-05-25 00:09:24.231544,0 days 00:00:06.207706,AdamW,0.1679806332384436,,,4.594924423072764e-05,,,,2,,,0.0022586686656250157,,PRUNED
665,665,29.166666666666668,2025-05-25 00:09:24.269170,2025-05-25 00:09:30.714882,0 days 00:00:06.445712,AdamW,0.4784358420299814,,,6.352971585801548e-05,,,,1,,,0.001860802919681566,,PRUNED
666,666,33.333333333333336,2025-05-25 00:09:30.752987,2025-05-25 00:09:37.073389,0 days 00:00:06.320402,AdamW,0.045426945265986014,,,4.1357824209333464e-05,,,,2,,,0.001472325086978671,,PRUNED
667,667,33.333333333333336,2025-05-25 00:09:37.108141,2025-05-25 00:09:43.234850,0 days 00:00:06.126709,SGD,0.353884816823125,,,,0.04014204627861101,1.6846256915352242,False,1,,,,0.03922027373862664,PRUNED
668,668,35.416666666666664,2025-05-25 00:09:43.268132,2025-05-25 00:09:49.435289,0 days 00:00:06.167157,AdamW,0.029997153959828365,,,0.00011074094950810281,,,,1,,,0.002066015999222784,,PRUNED
669,669,33.333333333333336,2025-05-25 00:09:49.469152,2025-05-25 00:09:55.637673,0 days 00:00:06.168521,AdamW,0.058414307314507155,,,0.0001827210217602275,,,,2,,,0.0013376431046797609,,PRUNED
670,670,27.083333333333332,2025-05-25 00:09:55.672018,2025-05-25 00:10:02.151240,0 days 00:00:06.479222,AdamW,0.0730429009028174,,,5.352072477076467e-05,,,,1,,,0.0016481860078332048,,PRUNED
671,671,37.5,2025-05-25 00:10:02.185567,2025-05-25 00:10:08.324168,0 days 00:00:06.138601,AdamW,0.3369358404551772,,,7.78151065820709e-05,,,,3,,,0.0019335100456645666,,PRUNED
672,672,35.416666666666664,2025-05-25 00:10:08.358175,2025-05-25 00:10:17.176708,0 days 00:00:08.818533,AdamW,0.03782754488061048,,,0.00012968121064939022,,,,2,,,0.0022401046413105742,,PRUNED
673,673,35.416666666666664,2025-05-25 00:10:17.211188,2025-05-25 00:10:23.607179,0 days 00:00:06.395991,AdamW,0.05146556099535613,,,3.154971930819654e-05,,,,1,,,0.002481628687172327,,PRUNED
674,674,29.166666666666668,2025-05-25 00:10:23.641128,2025-05-25 00:10:30.566025,0 days 00:00:06.924897,AdamW,0.011035282720075135,,,6.247838867337706e-05,,,,2,,,0.0017791677772517375,,PRUNED
675,675,37.5,2025-05-25 00:10:30.601109,2025-05-25 00:10:37.369967,0 days 00:00:06.768858,AdamW,0.09129154103016127,,,9.379098744785095e-05,,,,1,,,0.0012199659662645642,,PRUNED
676,676,31.25,2025-05-25 00:10:37.404038,2025-05-25 00:10:43.755573,0 days 00:00:06.351535,Adam,0.020232673080392616,,0.00023906775440667125,,,,,2,,3.1645471219988432,,,PRUNED
677,677,33.333333333333336,2025-05-25 00:10:43.789863,2025-05-25 00:10:50.211137,0 days 00:00:06.421274,AdamW,0.0396125852302399,,,4.6780309044660064e-05,,,,1,,,0.0015516026897041302,,PRUNED
678,678,35.416666666666664,2025-05-25 00:10:50.244809,2025-05-25 00:10:56.528855,0 days 00:00:06.284046,AdamW,0.06161632555034724,,,3.837253862782391e-05,,,,1,,,0.0027412312735729085,,PRUNED
679,679,33.333333333333336,2025-05-25 00:10:56.569024,2025-05-25 00:11:03.071955,0 days 00:00:06.502931,AdamW,0.027752802748752053,,,7.017003123701016e-05,,,,2,,,0.002097805109515404,,PRUNED
680,680,33.333333333333336,2025-05-25 00:11:03.105595,2025-05-25 00:11:09.604513,0 days 00:00:06.498918,AdamW,0.04782583968840223,,,0.00010117496932560362,,,,2,,,0.0019115149455957638,,PRUNED
681,681,35.416666666666664,2025-05-25 00:11:09.640153,2025-05-25 00:11:16.068970,0 days 00:00:06.428817,AdamW,0.07782700919025284,,,5.6268703804679484e-05,,,,1,,,0.0014001094767175828,,PRUNED
682,682,41.666666666666664,2025-05-25 00:11:16.105227,2025-05-25 00:11:22.716040,0 days 00:00:06.610813,AdamW,0.0088517131655872,,,0.0001531362499616941,,,,2,,,0.0016852102180010859,,PRUNED
683,683,33.333333333333336,2025-05-25 00:11:22.750588,2025-05-25 00:11:29.241640,0 days 00:00:06.491052,AdamW,0.031008955524891024,,,7.814680870790561e-05,,,,1,,,0.0021717536715300384,,PRUNED
684,684,33.333333333333336,2025-05-25 00:11:29.326136,2025-05-25 00:11:35.643811,0 days 00:00:06.317675,AdamW,0.3194651719174918,,,4.862657442513495e-05,,,,2,,,0.001802860911215039,,PRUNED
685,685,39.583333333333336,2025-05-25 00:11:35.677684,2025-05-25 00:11:41.888024,0 days 00:00:06.210340,AdamW,0.052981917352401806,,,6.598820674083893e-05,,,,3,,,0.002453057757403639,,PRUNED
686,686,33.333333333333336,2025-05-25 00:11:41.922027,2025-05-25 00:11:48.288535,0 days 00:00:06.366508,Adadelta,0.27833396510784925,30.431249096960002,,,,,,1,0.02811195524018723,,,,PRUNED
687,687,37.5,2025-05-25 00:11:48.322292,2025-05-25 00:11:54.772677,0 days 00:00:06.450385,AdamW,0.17451337176631523,,,0.00011685316007289224,,,,2,,,0.002945993080865572,,PRUNED
