,number,value,datetime_start,datetime_complete,duration,params_algorithm,params_dropout_rate,params_lr_Adadelta,params_lr_Adam,params_lr_AdamW,params_lr_SGD,params_momentum_SGD,params_nesterov_SGD,params_suggested_freeze,params_weight_decay_Adadelta,params_weight_decay_Adam,params_weight_decay_AdamW,params_weight_decay_SGD,state
688,688,43.75,2025-05-25 00:11:54.807230,2025-05-25 00:12:01.487267,0 days 00:00:06.680037,AdamW,0.00014289323766036172,,,3.4941590780849307e-05,,,,1,,,0.0015806870576512292,,PRUNED
689,689,39.583333333333336,2025-05-25 00:12:01.521549,2025-05-25 00:12:07.790759,0 days 00:00:06.269210,AdamW,0.06847646793823851,,,8.650487762249602e-05,,,,2,,,0.0019612142672853538,,PRUNED
690,690,41.666666666666664,2025-05-25 00:12:07.824926,2025-05-25 00:12:14.419877,0 days 00:00:06.594951,AdamW,0.16455437044046894,,,5.601902901129842e-05,,,,2,,,0.00037108296184459134,,PRUNED
691,691,,2025-05-25 00:12:14.496883,2025-05-25 00:12:20.052154,0 days 00:00:05.555271,SGD,0.03779614279565747,,,,2.512783461864642e-05,92.05153308810765,True,1,,,,0.11674651890666388,PRUNED
692,692,31.25,2025-05-25 00:12:20.085373,2025-05-25 00:12:26.378679,0 days 00:00:06.293306,AdamW,0.21173769963703742,,,4.05505430774887e-05,,,,2,,,0.0010929889652599263,,PRUNED
693,693,39.583333333333336,2025-05-25 00:12:26.412229,2025-05-25 00:12:33.129796,0 days 00:00:06.717567,AdamW,0.017110959788751396,,,2.842873711810411e-05,,,,1,,,0.0014267427053530019,,PRUNED
694,694,33.333333333333336,2025-05-25 00:12:33.163777,2025-05-25 00:12:39.599120,0 days 00:00:06.435343,AdamW,0.15340980911620075,,,0.07498213572893714,,,,3,,,0.0016636398541159613,,PRUNED
695,695,37.5,2025-05-25 00:12:39.635218,2025-05-25 00:12:45.951668,0 days 00:00:06.316450,AdamW,0.04893342606902262,,,4.6974109597299045e-05,,,,2,,,0.002329127572725888,,PRUNED
696,696,35.416666666666664,2025-05-25 00:12:45.986316,2025-05-25 00:12:52.300587,0 days 00:00:06.314271,AdamW,0.0566108254597124,,,0.00010386064924839986,,,,1,,,0.0019143905135190656,,PRUNED
697,697,33.333333333333336,2025-05-25 00:12:52.337219,2025-05-25 00:12:58.885690,0 days 00:00:06.548471,AdamW,0.23321427012851295,,,0.0009000570488120232,,,,2,,,0.001278127697979716,,PRUNED
698,698,33.333333333333336,2025-05-25 00:12:58.921340,2025-05-25 00:13:05.409803,0 days 00:00:06.488463,AdamW,0.0805134449050686,,,7.09447065989021e-05,,,,1,,,0.001766203947680329,,PRUNED
699,699,68.75,2025-05-25 00:13:05.444448,2025-05-25 00:13:18.558754,0 days 00:00:13.114306,AdamW,0.03259400027485447,,,8.685125432515408e-05,,,,1,,,0.0020786021296186237,,COMPLETE
700,700,35.416666666666664,2025-05-25 00:13:18.601374,2025-05-25 00:13:25.224031,0 days 00:00:06.622657,AdamW,0.027938270605790606,,,9.183843401160625e-05,,,,1,,,0.0020631311489676934,,PRUNED
701,701,29.166666666666668,2025-05-25 00:13:25.259174,2025-05-25 00:13:34.738811,0 days 00:00:09.479637,Adam,0.03594137919569047,,2.669625019622422e-05,,,,,2,,21.767227658908144,,,PRUNED
702,702,43.75,2025-05-25 00:13:34.837701,2025-05-25 00:13:41.482134,0 days 00:00:06.644433,AdamW,0.024137963537807807,,,0.00012210083148581693,,,,1,,,0.0019866299640521113,,PRUNED
703,703,75.0,2025-05-25 00:13:41.516793,2025-05-25 00:13:54.473401,0 days 00:00:12.956608,AdamW,0.019212177396446338,,,8.547431030200312e-05,,,,2,,,0.0017897570846150761,,COMPLETE
704,704,39.583333333333336,2025-05-25 00:13:54.516919,2025-05-25 00:14:04.026379,0 days 00:00:09.509460,AdamW,0.014635285630974892,,,8.081515113062305e-05,,,,2,,,0.0015886627844427755,,PRUNED
705,705,43.75,2025-05-25 00:14:04.061082,2025-05-25 00:14:11.802338,0 days 00:00:07.741256,AdamW,0.013918545646207158,,,8.542973087328416e-05,,,,2,,,0.0014563003404346497,,PRUNED
706,706,33.333333333333336,2025-05-25 00:14:11.837991,2025-05-25 00:14:18.556008,0 days 00:00:06.718017,AdamW,0.02836936079305242,,,7.245229315912446e-05,,,,1,,,0.002177813830591997,,PRUNED
707,707,37.5,2025-05-25 00:14:18.592364,2025-05-25 00:14:27.319202,0 days 00:00:08.726838,AdamW,0.00011232765898437982,,,9.818845983289575e-05,,,,1,,,0.0017416194286402926,,PRUNED
708,708,43.75,2025-05-25 00:14:27.365836,2025-05-25 00:14:47.266730,0 days 00:00:19.900894,AdamW,0.019646501738918985,,,6.007133213732355e-05,,,,3,,,0.0018891839242867884,,PRUNED
709,709,33.333333333333336,2025-05-25 00:14:47.320714,2025-05-25 00:15:07.565129,0 days 00:00:20.244415,AdamW,0.0377078695215291,,,7.807864641233161e-05,,,,1,,,0.001538681411073162,,PRUNED
710,710,39.583333333333336,2025-05-25 00:15:07.617586,2025-05-25 00:15:27.758910,0 days 00:00:20.141324,AdamW,0.020297010544912078,,,6.65342695448048e-05,,,,2,,,0.0011882755734605821,,PRUNED
711,711,33.333333333333336,2025-05-25 00:15:27.878815,2025-05-25 00:15:44.388221,0 days 00:00:16.509406,Adadelta,0.008319147386728863,0.5692347999249288,,,,,,2,2.9271340320013626,,,,PRUNED
712,712,33.333333333333336,2025-05-25 00:15:44.435155,2025-05-25 00:15:59.605040,0 days 00:00:15.169885,AdamW,0.0420519555403791,,,0.00010065477253011295,,,,1,,,0.001713622647842714,,PRUNED
713,713,72.91666666666667,2025-05-25 00:15:59.660185,2025-05-25 00:16:27.216834,0 days 00:00:27.556649,AdamW,0.029615289403138637,,,8.520903861759319e-05,,,,1,,,0.002045928379720815,,COMPLETE
714,714,31.25,2025-05-25 00:16:27.275608,2025-05-25 00:16:45.926108,0 days 00:00:18.650500,AdamW,0.027939764575830098,,,8.834084366067056e-05,,,,1,,,0.0021090635698559107,,PRUNED
715,715,58.333333333333336,2025-05-25 00:16:45.978698,2025-05-25 00:17:17.532928,0 days 00:00:31.554230,AdamW,0.012475285290572652,,,8.216197088830061e-05,,,,1,,,0.0022569362249912493,,COMPLETE
716,716,39.583333333333336,2025-05-25 00:17:17.592078,2025-05-25 00:17:37.898025,0 days 00:00:20.305947,AdamW,0.029034830358242086,,,0.00010456215130173612,,,,1,,,0.0020279119968290163,,PRUNED
717,717,33.333333333333336,2025-05-25 00:17:37.949884,2025-05-25 00:17:57.057917,0 days 00:00:19.108033,AdamW,0.02300114814079343,,,0.00013523216275330605,,,,1,,,0.001918653003535115,,PRUNED
718,718,50.0,2025-05-25 00:17:57.109862,2025-05-25 00:18:21.940787,0 days 00:00:24.830925,AdamW,0.033596933042098875,,,7.571016643007807e-05,,,,1,,,0.002271543261976025,,PRUNED
719,719,45.833333333333336,2025-05-25 00:18:22.010044,2025-05-25 00:18:41.934312,0 days 00:00:19.924268,AdamW,0.011154012484024322,,,0.00010034704054742313,,,,1,,,0.002460341269842707,,PRUNED
720,720,,2025-05-25 00:18:41.987239,2025-05-25 00:19:00.706562,0 days 00:00:18.719323,SGD,0.019541535737474483,,,,0.09729173742836005,22.365465760728686,False,1,,,,17.862248971050388,PRUNED
721,721,45.833333333333336,2025-05-25 00:19:00.757501,2025-05-25 00:19:19.408714,0 days 00:00:18.651213,AdamW,0.04208577165661109,,,7.525801379850366e-05,,,,1,,,0.002024791703988056,,PRUNED
722,722,39.583333333333336,2025-05-25 00:19:19.460123,2025-05-25 00:19:39.577502,0 days 00:00:20.117379,AdamW,0.03223764914131892,,,6.3891746634274e-05,,,,1,,,0.002132871634880618,,PRUNED
723,723,45.833333333333336,2025-05-25 00:19:39.628838,2025-05-25 00:19:54.828669,0 days 00:00:15.199831,AdamW,0.021365273464745062,,,0.00011676051479374961,,,,1,,,0.0018103836390117596,,PRUNED
724,724,33.333333333333336,2025-05-25 00:19:54.864458,2025-05-25 00:20:03.811755,0 days 00:00:08.947297,AdamW,0.041531610633168375,,,8.407608171191866e-05,,,,2,,,0.0009279826744901932,,PRUNED
725,725,33.333333333333336,2025-05-25 00:20:03.862096,2025-05-25 00:20:22.609919,0 days 00:00:18.747823,AdamW,0.010822804488139565,,,0.00027015001733546356,,,,1,,,0.002263142181038634,,PRUNED
726,726,33.333333333333336,2025-05-25 00:20:22.646825,2025-05-25 00:20:29.519790,0 days 00:00:06.872965,Adam,0.24667260669834196,,0.04124842029841489,,,,,1,,0.04116164041626379,,,PRUNED
727,727,33.333333333333336,2025-05-25 00:20:29.553573,2025-05-25 00:20:35.917135,0 days 00:00:06.363562,AdamW,0.027704706295189473,,,0.0004538639361523518,,,,2,,,0.001960584933809275,,PRUNED
728,728,41.666666666666664,2025-05-25 00:20:35.970154,2025-05-25 00:20:48.918032,0 days 00:00:12.947878,AdamW,0.0352795634485885,,,6.090138442435254e-05,,,,2,,,0.0018655257154920092,,PRUNED
729,729,41.666666666666664,2025-05-25 00:20:48.970345,2025-05-25 00:21:08.866663,0 days 00:00:19.896318,AdamW,0.04765403130770529,,,9.242619994685952e-05,,,,1,,,0.002435310590330549,,PRUNED
730,730,33.333333333333336,2025-05-25 00:21:08.918843,2025-05-25 00:21:29.392683,0 days 00:00:20.473840,AdamW,0.3839369820190337,,,0.00014821472516243948,,,,1,,,0.0017071044224712712,,PRUNED
731,731,33.333333333333336,2025-05-25 00:21:29.444349,2025-05-25 00:21:49.402556,0 days 00:00:19.958207,AdamW,0.023607202042366156,,,6.830080081988989e-05,,,,2,,,0.002178440149402029,,PRUNED
732,732,35.416666666666664,2025-05-25 00:21:49.453414,2025-05-25 00:22:09.128963,0 days 00:00:19.675549,AdamW,0.0395533843838337,,,5.712707148780995e-05,,,,1,,,0.0019707800030998937,,PRUNED
733,733,33.333333333333336,2025-05-25 00:22:09.174594,2025-05-25 00:22:25.971849,0 days 00:00:16.797255,AdamW,0.004920910756412277,,,0.00011053715681135482,,,,2,,,0.0025877725795157625,,PRUNED
734,734,37.5,2025-05-25 00:22:26.022394,2025-05-25 00:22:45.859650,0 days 00:00:19.837256,AdamW,0.016184576817219253,,,8.874964550927018e-05,,,,1,,,0.0017685132307613215,,PRUNED
735,735,33.333333333333336,2025-05-25 00:22:45.913376,2025-05-25 00:23:05.775490,0 days 00:00:19.862114,AdamW,0.04988609760937033,,,7.264074163815792e-05,,,,3,,,0.0020552524120756106,,PRUNED
736,736,37.5,2025-05-25 00:23:05.824009,2025-05-25 00:23:26.073053,0 days 00:00:20.249044,AdamW,0.03333662839086824,,,5.316552807020954e-05,,,,2,,,0.0016277099520370334,,PRUNED
737,737,37.5,2025-05-25 00:23:26.125121,2025-05-25 00:23:42.870177,0 days 00:00:16.745056,Adadelta,0.43343746257263355,0.18241578577596657,,,,,,1,33.08205532471403,,,,PRUNED
738,738,41.666666666666664,2025-05-25 00:23:42.922198,2025-05-25 00:24:03.791321,0 days 00:00:20.869123,AdamW,0.030041145070295518,,,9.29067445001632e-05,,,,2,,,0.0022787484404468974,,PRUNED
739,739,43.75,2025-05-25 00:24:03.850748,2025-05-25 00:24:22.061205,0 days 00:00:18.210457,AdamW,0.044907672044597134,,,0.0001211083024728233,,,,1,,,0.0018719302940422644,,PRUNED
740,740,37.5,2025-05-25 00:24:22.095577,2025-05-25 00:24:39.907813,0 days 00:00:17.812236,AdamW,0.017905706414347702,,,6.556369692646562e-05,,,,2,,,0.0010744800422202614,,PRUNED
741,741,,2025-05-25 00:24:39.959567,2025-05-25 00:24:54.517732,0 days 00:00:14.558165,SGD,0.006098643286240258,,,,0.00011968939450548236,35.23358699740021,True,1,,,,0.4110513553241975,PRUNED
742,742,33.333333333333336,2025-05-25 00:24:54.568011,2025-05-25 00:25:07.446405,0 days 00:00:12.878394,AdamW,0.04139552454331836,,,5.221673117531352e-05,,,,2,,,0.002092807020533616,,PRUNED
743,743,33.333333333333336,2025-05-25 00:25:07.497927,2025-05-25 00:25:23.279791,0 days 00:00:15.781864,AdamW,0.052279055132814056,,,8.023211640663718e-05,,,,1,,,0.001688379735276832,,PRUNED
744,744,35.416666666666664,2025-05-25 00:25:23.315266,2025-05-25 00:25:37.641845,0 days 00:00:14.326579,AdamW,0.022740747892415022,,,6.183245049611026e-05,,,,2,,,0.0026852175362354447,,PRUNED
745,745,39.583333333333336,2025-05-25 00:25:37.692860,2025-05-25 00:25:56.778136,0 days 00:00:19.085276,AdamW,0.03513511531241086,,,0.0001333345120846713,,,,1,,,0.0018108527832377992,,PRUNED
746,746,37.5,2025-05-25 00:25:56.831538,2025-05-25 00:26:09.997330,0 days 00:00:13.165792,AdamW,0.06035801267762262,,,0.00010070615592340238,,,,2,,,0.00232303132517457,,PRUNED
747,747,33.333333333333336,2025-05-25 00:26:10.040323,2025-05-25 00:26:24.307100,0 days 00:00:14.266777,AdamW,0.027142335741344073,,,7.286416961378887e-05,,,,1,,,0.0015951121947817162,,PRUNED
748,748,37.5,2025-05-25 00:26:24.573699,2025-05-25 00:26:36.135090,0 days 00:00:11.561391,AdamW,0.04521719274957522,,,5.163052968897363e-05,,,,2,,,0.0018841399163110582,,PRUNED
749,749,31.25,2025-05-25 00:26:36.170178,2025-05-25 00:26:43.305261,0 days 00:00:07.135083,AdamW,0.008834169344979284,,,0.0002058770291162591,,,,3,,,0.001298289346932885,,PRUNED
750,750,35.416666666666664,2025-05-25 00:26:43.339471,2025-05-25 00:26:51.188825,0 days 00:00:07.849354,Adam,0.03236281802779489,,1.0188180877612302e-05,,,,,1,,52.37168021631242,,,PRUNED
751,751,52.083333333333336,2025-05-25 00:26:51.243199,2025-05-25 00:27:15.338025,0 days 00:00:24.094826,AdamW,0.017570292967547006,,,8.977454352568809e-05,,,,2,,,0.0020419623721168487,,PRUNED
752,752,43.75,2025-05-25 00:27:15.389824,2025-05-25 00:27:35.428522,0 days 00:00:20.038698,AdamW,0.0539219848366302,,,4.60058320064409e-05,,,,1,,,0.001443506352402081,,PRUNED
753,753,33.333333333333336,2025-05-25 00:27:35.480412,2025-05-25 00:27:55.347184,0 days 00:00:19.866772,AdamW,0.10742978563909573,,,5.939231171076118e-05,,,,1,,,0.0021738702270664733,,PRUNED
754,754,33.333333333333336,2025-05-25 00:27:55.401112,2025-05-25 00:28:15.324742,0 days 00:00:19.923630,AdamW,0.09469213382212555,,,7.060653903069864e-05,,,,2,,,0.002506309530690294,,PRUNED
755,755,33.333333333333336,2025-05-25 00:28:15.376556,2025-05-25 00:28:31.356788,0 days 00:00:15.980232,AdamW,0.040605237230159706,,,3.79410626556756e-05,,,,2,,,0.0017056545561586847,,PRUNED
756,756,33.333333333333336,2025-05-25 00:28:31.408179,2025-05-25 00:28:50.633907,0 days 00:00:19.225728,AdamW,0.06535584468652918,,,0.00011069460464925716,,,,1,,,0.0019055126533679705,,PRUNED
757,757,33.333333333333336,2025-05-25 00:28:50.686822,2025-05-25 00:29:08.741008,0 days 00:00:18.054186,AdamW,0.00047631106572361415,,,0.00015028444175481094,,,,1,,,0.001574948312085082,,PRUNED
758,758,39.583333333333336,2025-05-25 00:29:08.788489,2025-05-25 00:29:27.999831,0 days 00:00:19.211342,AdamW,0.021613064732018315,,,8.017732302890824e-05,,,,2,,,0.001016228516844667,,PRUNED
759,759,37.5,2025-05-25 00:29:28.048662,2025-05-25 00:29:45.619674,0 days 00:00:17.571012,AdamW,0.05256145607861145,,,5.251601748297905e-05,,,,2,,,0.002005235004833059,,PRUNED
760,760,33.333333333333336,2025-05-25 00:29:45.674058,2025-05-25 00:29:53.918281,0 days 00:00:08.244223,Adadelta,0.0320990316075112,2.915772764309958,,,,,,1,0.06924876254252235,,,,PRUNED
761,761,33.333333333333336,2025-05-25 00:29:53.961422,2025-05-25 00:30:11.785987,0 days 00:00:17.824565,AdamW,0.4017946268511442,,,6.431704719411156e-05,,,,2,,,0.001778604727011177,,PRUNED
762,762,45.833333333333336,2025-05-25 00:30:11.837568,2025-05-25 00:30:22.434325,0 days 00:00:10.596757,AdamW,0.012595264298795327,,,9.65671045493276e-05,,,,2,,,0.0013498519409595648,,PRUNED
763,763,33.333333333333336,2025-05-25 00:30:22.487629,2025-05-25 00:30:41.846480,0 days 00:00:19.358851,AdamW,0.04514093326011037,,,4.2245169339511034e-05,,,,3,,,0.002356176048008242,,PRUNED
764,764,33.333333333333336,2025-05-25 00:30:41.897364,2025-05-25 00:30:59.793209,0 days 00:00:17.895845,AdamW,0.2192005276167811,,,0.00011945722497264015,,,,1,,,0.002214144596718015,,PRUNED
765,765,33.333333333333336,2025-05-25 00:30:59.845768,2025-05-25 00:31:18.860901,0 days 00:00:19.015133,AdamW,0.030289814346471947,,,0.002210504620641711,,,,1,,,0.0014957385684052137,,PRUNED
766,766,33.333333333333336,2025-05-25 00:31:18.917636,2025-05-25 00:31:39.118984,0 days 00:00:20.201348,AdamW,0.062064150301506464,,,3.1470660465487966e-05,,,,1,,,0.0016594634609526232,,PRUNED
767,767,33.333333333333336,2025-05-25 00:31:39.182818,2025-05-25 00:31:59.256784,0 days 00:00:20.073966,AdamW,0.04159736045196068,,,7.874763815912825e-05,,,,2,,,0.0018478667978598597,,PRUNED
768,768,66.66666666666667,2025-05-25 00:31:59.321519,2025-05-25 00:32:26.922387,0 days 00:00:27.600868,AdamW,0.022693889583140565,,,5.9705125042775456e-05,,,,3,,,0.0011434429919970962,,COMPLETE
769,769,,2025-05-25 00:32:26.964934,2025-05-25 00:32:33.327017,0 days 00:00:06.362083,SGD,0.07410020771449602,,,,0.0020923819091780123,10.044526928750926,False,2,,,,1.5711436865857933,PRUNED
770,770,37.5,2025-05-25 00:32:33.359505,2025-05-25 00:32:40.555836,0 days 00:00:07.196331,AdamW,0.05257353484692075,,,4.7419129073736035e-05,,,,1,,,0.0020302291887715268,,PRUNED
771,771,33.333333333333336,2025-05-25 00:32:40.608832,2025-05-25 00:33:00.429044,0 days 00:00:19.820212,AdamW,0.03653746862530574,,,8.543709354239052e-05,,,,1,,,0.0026145154548202413,,PRUNED
772,772,33.333333333333336,2025-05-25 00:33:00.480614,2025-05-25 00:33:09.240954,0 days 00:00:08.760340,AdamW,0.014107975532254353,,,6.795371858651751e-05,,,,2,,,0.0021752784200034015,,PRUNED
773,773,33.333333333333336,2025-05-25 00:33:09.277581,2025-05-25 00:33:17.466400,0 days 00:00:08.188819,AdamW,0.02735988540715202,,,0.00010132558309657741,,,,1,,,0.0017591330678154325,,PRUNED
774,774,35.416666666666664,2025-05-25 00:33:17.516600,2025-05-25 00:33:37.332476,0 days 00:00:19.815876,Adam,0.44593171221574657,,0.00010587090561747664,,,,,2,,1.1730726502948878,,,PRUNED
775,775,33.333333333333336,2025-05-25 00:33:37.383651,2025-05-25 00:33:57.543596,0 days 00:00:20.159945,AdamW,0.0856052470153552,,,0.0001665057089136188,,,,1,,,0.0015201548787472613,,PRUNED
776,776,33.333333333333336,2025-05-25 00:33:57.596558,2025-05-25 00:34:17.370242,0 days 00:00:19.773684,AdamW,0.0618803081956386,,,5.0520079081920365e-05,,,,2,,,0.002405894433558998,,PRUNED
777,777,31.25,2025-05-25 00:34:17.422688,2025-05-25 00:34:36.164128,0 days 00:00:18.741440,AdamW,0.09736892643641346,,,3.3725100280285676e-05,,,,8,,,0.0019194714495722792,,PRUNED
778,778,33.333333333333336,2025-05-25 00:34:36.210088,2025-05-25 00:34:56.061411,0 days 00:00:19.851323,AdamW,0.11746528911376056,,,0.00012956947510765564,,,,1,,,0.0012637974154697342,,PRUNED
779,779,31.25,2025-05-25 00:34:56.113315,2025-05-25 00:35:14.083658,0 days 00:00:17.970343,AdamW,0.047120534333372495,,,4.138432697682041e-05,,,,2,,,0.0016275778993868895,,PRUNED
780,780,37.5,2025-05-25 00:35:14.135767,2025-05-25 00:35:33.466110,0 days 00:00:19.330343,AdamW,0.039661233517743304,,,7.291665834889246e-05,,,,2,,,0.00011580853133013501,,PRUNED
781,781,39.583333333333336,2025-05-25 00:35:33.520140,2025-05-25 00:35:52.498244,0 days 00:00:18.978104,AdamW,0.01737242408854326,,,5.9641091387809396e-05,,,,1,,,0.0030298505625206305,,PRUNED
782,782,43.75,2025-05-25 00:35:52.534469,2025-05-25 00:36:03.760436,0 days 00:00:11.225967,AdamW,0.06969096573673152,,,9.192750100658986e-05,,,,1,,,0.0013919917982294122,,PRUNED
783,783,29.166666666666668,2025-05-25 00:36:03.813612,2025-05-25 00:36:20.518060,0 days 00:00:16.704448,AdamW,0.13253651691326326,,,5.455254825914336e-05,,,,4,,,0.0021035078925504777,,PRUNED
784,784,33.333333333333336,2025-05-25 00:36:20.556059,2025-05-25 00:36:35.274805,0 days 00:00:14.718746,AdamW,0.032456510226611744,,,2.721214999482249e-05,,,,1,,,0.001851423822119582,,PRUNED
785,785,35.416666666666664,2025-05-25 00:36:35.327216,2025-05-25 00:36:47.641559,0 days 00:00:12.314343,AdamW,0.2696227166305505,,,0.00010763312388720638,,,,2,,,0.0017141682121290438,,PRUNED
786,786,37.5,2025-05-25 00:36:47.676852,2025-05-25 00:36:59.754732,0 days 00:00:12.077880,AdamW,0.05855289798961286,,,8.088527134691013e-05,,,,1,,,0.002354310318965209,,PRUNED
787,787,45.833333333333336,2025-05-25 00:36:59.807353,2025-05-25 00:37:19.504177,0 days 00:00:19.696824,AdamW,0.008652370098382114,,,4.1451874192605986e-05,,,,2,,,0.0019282124925721483,,PRUNED
788,788,37.5,2025-05-25 00:37:19.559005,2025-05-25 00:37:39.501273,0 days 00:00:19.942268,Adadelta,0.023467625268581566,0.07380719345951964,,,,,,1,0.1932953303128712,,,,PRUNED
789,789,33.333333333333336,2025-05-25 00:37:39.553815,2025-05-25 00:37:59.467347,0 days 00:00:19.913532,AdamW,0.0468161552494581,,,0.005395132428804024,,,,2,,,0.0015125901914297027,,PRUNED
790,790,33.333333333333336,2025-05-25 00:37:59.519063,2025-05-25 00:38:19.407723,0 days 00:00:19.888660,AdamW,0.10334468342009946,,,6.410871875188223e-05,,,,2,,,0.0026753793089912313,,PRUNED
791,791,29.166666666666668,2025-05-25 00:38:19.459792,2025-05-25 00:38:39.600969,0 days 00:00:20.141177,AdamW,0.040374402561833264,,,4.944998193813894e-05,,,,3,,,0.002084925612963064,,PRUNED
792,792,,2025-05-25 00:38:39.652144,2025-05-25 00:38:55.089703,0 days 00:00:15.437559,SGD,0.055001320961845554,,,,0.0007947254958405786,48.861109048316784,True,1,,,,0.010780761015547388,PRUNED
793,793,33.333333333333336,2025-05-25 00:38:55.135338,2025-05-25 00:39:08.582019,0 days 00:00:13.446681,AdamW,0.029170965616824994,,,7.149059411864753e-05,,,,2,,,0.0016898966033414872,,PRUNED
794,794,33.333333333333336,2025-05-25 00:39:08.635682,2025-05-25 00:39:26.835961,0 days 00:00:18.200279,AdamW,0.20346817500104827,,,3.458027590035942e-05,,,,2,,,0.0022091999658944844,,PRUNED
795,795,33.333333333333336,2025-05-25 00:39:26.872136,2025-05-25 00:39:33.635994,0 days 00:00:06.763858,AdamW,0.07057323107478071,,,0.00013104804347087377,,,,1,,,0.0011757872262250428,,PRUNED
796,796,39.583333333333336,2025-05-25 00:39:33.671953,2025-05-25 00:39:43.388733,0 days 00:00:09.716780,AdamW,0.022457481920797516,,,8.874212999493189e-05,,,,1,,,0.0004138458633545461,,PRUNED
797,797,43.75,2025-05-25 00:39:43.440870,2025-05-25 00:40:03.612286,0 days 00:00:20.171416,AdamW,0.007570036269239069,,,5.869019958075872e-05,,,,2,,,0.0013927875006316504,,PRUNED
798,798,33.333333333333336,2025-05-25 00:40:03.664710,2025-05-25 00:40:23.599179,0 days 00:00:19.934469,Adam,0.03384933427055931,,0.013804659348254766,,,,,1,,0.34917906788449793,,,PRUNED
799,799,33.333333333333336,2025-05-25 00:40:23.651438,2025-05-25 00:40:43.560984,0 days 00:00:19.909546,AdamW,0.12583985210934537,,,0.00011267772124083328,,,,1,,,0.0019848110108103474,,PRUNED
800,800,39.583333333333336,2025-05-25 00:40:43.614161,2025-05-25 00:41:02.483971,0 days 00:00:18.869810,AdamW,0.04982812226581722,,,7.543061463961136e-05,,,,2,,,0.0018108365229771376,,PRUNED
801,801,33.333333333333336,2025-05-25 00:41:02.541551,2025-05-25 00:41:22.489212,0 days 00:00:19.947661,AdamW,0.018018929512751268,,,0.0011903993141312186,,,,2,,,0.001600615161444162,,PRUNED
802,802,43.75,2025-05-25 00:41:22.540263,2025-05-25 00:41:42.312387,0 days 00:00:19.772124,AdamW,0.08040032269747327,,,4.7989851816180835e-05,,,,1,,,0.0020045962668932098,,PRUNED
