,number,value,datetime_start,datetime_complete,duration,params_algorithm,params_dropout_rate,params_lr_Adadelta,params_lr_Adam,params_lr_AdamW,params_lr_SGD,params_momentum_SGD,params_nesterov_SGD,params_suggested_freeze,params_weight_decay_Adadelta,params_weight_decay_Adam,params_weight_decay_AdamW,params_weight_decay_SGD,state
0,0,43.75,2025-05-24 21:22:55.931702,2025-05-24 21:23:32.629902,0 days 00:00:36.698200,Adadelta,0.4753571532049581,0.017073967431528128,,,,,,3,29.154431891537552,,,,COMPLETE
1,1,47.916666666666664,2025-05-24 21:23:32.687722,2025-05-24 21:24:03.885872,0 days 00:00:31.198150,Adam,0.35403628889802274,,5.3370327626039544e-05,,,,,5,,0.05415244119402541,,,COMPLETE
2,2,52.083333333333336,2025-05-24 21:24:03.935078,2025-05-24 21:24:36.056702,0 days 00:00:32.121624,AdamW,0.2623782158161189,,,0.00014742753159914678,,,,2,,,0.0005404103854647331,,COMPLETE
3,3,33.333333333333336,2025-05-24 21:24:36.115266,2025-05-24 21:25:07.370055,0 days 00:00:31.254789,AdamW,0.3925879806965068,,,0.0026926469100861782,,,,4,,,0.00021930485556643703,,COMPLETE
4,4,33.333333333333336,2025-05-24 21:25:07.419598,2025-05-24 21:25:40.085126,0 days 00:00:32.665528,Adadelta,0.4744427686266666,5.456725485601478,,,,,,0,0.5762487216478605,,,,COMPLETE
5,5,52.083333333333336,2025-05-24 21:25:40.135567,2025-05-24 21:26:05.421235,0 days 00:00:25.285668,Adam,0.2475884550556351,,0.00017654048052495074,,,,,1,,1.2030178871154673,,,COMPLETE
6,6,33.333333333333336,2025-05-24 21:26:05.461026,2025-05-24 21:26:23.201407,0 days 00:00:17.740381,Adadelta,0.09242722776276352,2.463768595899747,,,,,,4,48.696409415209004,,,,PRUNED
7,7,33.333333333333336,2025-05-24 21:26:23.236070,2025-05-24 21:26:41.326330,0 days 00:00:18.090260,AdamW,0.0979914312095726,,,0.02065142557895925,,,,0,,,0.0005170191786366995,,PRUNED
8,8,33.333333333333336,2025-05-24 21:26:41.360836,2025-05-24 21:26:53.734904,0 days 00:00:12.374068,SGD,0.27134804157912423,,,,0.012273800987852962,0.5621564911890039,True,2,,,,0.06235377135673159,PRUNED
9,9,33.333333333333336,2025-05-24 21:26:53.770606,2025-05-24 21:27:10.254615,0 days 00:00:16.484009,SGD,0.38563517334297287,,,,0.0031130959561221226,6.365199445099503,False,6,,,,0.2106648601704221,PRUNED
10,10,27.083333333333332,2025-05-24 21:27:10.291238,2025-05-24 21:27:36.855789,0 days 00:00:26.564551,AdamW,0.0029985914779085965,,,1.1799062523159256e-05,,,,8,,,0.006630907782559361,,PRUNED
11,11,33.333333333333336,2025-05-24 21:27:36.895892,2025-05-24 21:28:01.254833,0 days 00:00:24.358941,Adam,0.21137566250973713,,0.009520145760425397,,,,,2,,18.077272553134513,,,PRUNED
12,12,31.25,2025-05-24 21:28:01.289698,2025-05-24 21:28:20.981151,0 days 00:00:19.691453,Adam,0.2280781684174102,,0.000145806698847743,,,,,1,,1.407703659199024,,,PRUNED
13,13,33.333333333333336,2025-05-24 21:28:21.015216,2025-05-24 21:28:45.069176,0 days 00:00:24.053960,Adam,0.28664548882561447,,0.002223892167260502,,,,,2,,0.35512137719444403,,,PRUNED
14,14,64.58333333333333,2025-05-24 21:28:45.113516,2025-05-24 21:29:16.613506,0 days 00:00:31.499990,AdamW,0.16257126696618518,,,5.107684925222934e-05,,,,1,,,0.0025253710106474536,,COMPLETE
15,15,58.333333333333336,2025-05-24 21:29:16.664563,2025-05-24 21:29:47.418475,0 days 00:00:30.753912,AdamW,0.14808317204514113,,,4.839668264505077e-05,,,,3,,,0.0021601863672613586,,COMPLETE
16,16,47.916666666666664,2025-05-24 21:29:47.468924,2025-05-24 21:30:14.832755,0 days 00:00:27.363831,AdamW,0.1399954876351523,,,3.091592599668577e-05,,,,6,,,0.003944479816467623,,PRUNED
17,17,33.333333333333336,2025-05-24 21:30:14.876522,2025-05-24 21:30:39.119083,0 days 00:00:24.242561,AdamW,0.16288708884746878,,,0.0003230170128868152,,,,3,,,0.002192593935913539,,PRUNED
18,18,56.25,2025-05-24 21:30:39.154000,2025-05-24 21:31:10.850672,0 days 00:00:31.696672,AdamW,0.01811884405994857,,,5.6861741806643255e-05,,,,1,,,0.002117035515125565,,COMPLETE
19,19,33.333333333333336,2025-05-24 21:31:10.900803,2025-05-24 21:31:33.731789,0 days 00:00:22.830986,AdamW,0.17225925216346163,,,0.0007748755752908133,,,,4,,,0.0013068856378153323,,PRUNED
20,20,31.25,2025-05-24 21:31:33.761012,2025-05-24 21:31:40.665918,0 days 00:00:06.904906,SGD,0.06335423743148177,,,,2.025934909325147e-05,88.37749112170019,True,8,,,,71.38393633927497,PRUNED
21,21,52.083333333333336,2025-05-24 21:31:40.693733,2025-05-24 21:31:54.552696,0 days 00:00:13.858963,AdamW,0.00479789600916028,,,5.999198528595586e-05,,,,1,,,0.00231748617337115,,COMPLETE
22,22,58.333333333333336,2025-05-24 21:31:54.602056,2025-05-24 21:32:23.108897,0 days 00:00:28.506841,AdamW,0.052459346547832145,,,5.288713490956668e-05,,,,0,,,0.002259368050220076,,COMPLETE
23,23,64.58333333333333,2025-05-24 21:32:23.147850,2025-05-24 21:32:41.640414,0 days 00:00:18.492564,AdamW,0.12110791015365835,,,1.3970734935405238e-05,,,,0,,,0.009723232795371139,,COMPLETE
24,24,33.333333333333336,2025-05-24 21:32:41.690655,2025-05-24 21:33:01.400226,0 days 00:00:19.709571,AdamW,0.13115647705244074,,,1.0039855794080832e-05,,,,3,,,0.00738424928402442,,PRUNED
25,25,33.333333333333336,2025-05-24 21:33:01.436042,2025-05-24 21:33:23.831186,0 days 00:00:22.395144,AdamW,0.19503905784610515,,,0.00015771930997381022,,,,0,,,0.009240781600976638,,PRUNED
26,26,33.333333333333336,2025-05-24 21:33:23.865881,2025-05-24 21:33:43.515088,0 days 00:00:19.649207,AdamW,0.10961999850084118,,,2.1989892035842425e-05,,,,1,,,0.004339805572962155,,PRUNED
27,27,33.333333333333336,2025-05-24 21:33:43.550123,2025-05-24 21:34:03.162630,0 days 00:00:19.612507,AdamW,0.3133332305410652,,,0.003206785905409232,,,,3,,,0.0008688133453199681,,PRUNED
28,28,33.333333333333336,2025-05-24 21:34:03.197445,2025-05-24 21:34:22.870353,0 days 00:00:19.672908,Adadelta,0.18046136468130622,71.09750733359516,,,,,,0,0.016987592312017272,,,,PRUNED
29,29,,2025-05-24 21:34:22.916935,2025-05-24 21:34:40.790866,0 days 00:00:17.873931,SGD,0.058541176587596,,,,1.4839113238339737e-05,95.86041307333699,False,3,,,,18.395730677410548,PRUNED
30,30,33.333333333333336,2025-05-24 21:34:40.834931,2025-05-24 21:34:59.833194,0 days 00:00:18.998263,Adadelta,0.15289783147275088,0.012327990271406086,,,,,,2,0.017620822291138413,,,,PRUNED
31,31,33.333333333333336,2025-05-24 21:34:59.876995,2025-05-24 21:35:19.324405,0 days 00:00:19.447410,AdamW,0.05258179542949669,,,5.667811878383137e-05,,,,0,,,0.003265973675646259,,PRUNED
32,32,33.333333333333336,2025-05-24 21:35:19.359255,2025-05-24 21:35:38.995381,0 days 00:00:19.636126,AdamW,0.11619551771652195,,,0.00013372501428914556,,,,0,,,0.0012717363465108442,,PRUNED
33,33,41.666666666666664,2025-05-24 21:35:39.030024,2025-05-24 21:36:05.934108,0 days 00:00:26.904084,AdamW,0.07654653822174869,,,2.7981036942194653e-05,,,,1,,,0.0017841218227286392,,PRUNED
34,34,33.333333333333336,2025-05-24 21:36:05.969920,2025-05-24 21:36:25.776626,0 days 00:00:19.806706,AdamW,0.037258891670282165,,,0.09946126450457445,,,,1,,,0.004828771810726373,,PRUNED
35,35,64.58333333333333,2025-05-24 21:36:25.811576,2025-05-24 21:36:56.424020,0 days 00:00:30.612444,AdamW,0.13366166541885696,,,2.2594550368435305e-05,,,,5,,,0.0007171366308231369,,COMPLETE
36,36,33.333333333333336,2025-05-24 21:36:56.476756,2025-05-24 21:37:15.985236,0 days 00:00:19.508480,AdamW,0.20994456138766326,,,1.9236515742174086e-05,,,,5,,,0.0005041470618034521,,PRUNED
37,37,33.333333333333336,2025-05-24 21:37:16.020317,2025-05-24 21:37:26.819444,0 days 00:00:10.799127,AdamW,0.1348175510117301,,,0.00033764033372634896,,,,5,,,0.0008152093698025733,,PRUNED
38,38,33.333333333333336,2025-05-24 21:37:26.853032,2025-05-24 21:37:45.238114,0 days 00:00:18.385082,Adadelta,0.2371061284748421,0.18442731888593034,,,,,,6,0.8870445015199778,,,,PRUNED
39,39,33.333333333333336,2025-05-24 21:37:45.264049,2025-05-24 21:37:52.234244,0 days 00:00:06.970195,AdamW,0.4717961754249553,,,1.2888374142421435e-05,,,,5,,,0.00026091747168219227,,PRUNED
40,40,33.333333333333336,2025-05-24 21:37:52.260624,2025-05-24 21:37:59.117487,0 days 00:00:06.856863,Adam,0.18705200176289077,,0.04553662854131712,,,,,4,,75.11710625573838,,,PRUNED
41,41,29.166666666666668,2025-05-24 21:37:59.144681,2025-05-24 21:38:11.321081,0 days 00:00:12.176400,AdamW,0.08138065971699036,,,4.5262708504391835e-05,,,,7,,,0.00010704401996178635,,PRUNED
42,42,33.333333333333336,2025-05-24 21:38:11.355281,2025-05-24 21:38:31.029955,0 days 00:00:19.674674,AdamW,0.10910330379566494,,,8.768640681435251e-05,,,,0,,,0.002654841325501559,,PRUNED
43,43,56.25,2025-05-24 21:38:31.064690,2025-05-24 21:39:02.702800,0 days 00:00:31.638110,AdamW,0.03741407783570083,,,3.05736417981137e-05,,,,0,,,0.0011253636029077113,,COMPLETE
44,44,35.416666666666664,2025-05-24 21:39:02.754276,2025-05-24 21:39:22.276217,0 days 00:00:19.521941,AdamW,0.09464115196973139,,,2.026038840906185e-05,,,,2,,,0.0015804343531595694,,PRUNED
45,45,,2025-05-24 21:39:22.310418,2025-05-24 21:39:40.344333,0 days 00:00:18.033915,SGD,0.14586652867964037,,,,0.07697336416909212,50.556122432111465,False,5,,,,2.1442082563972504,PRUNED
46,46,35.416666666666664,2025-05-24 21:39:40.390178,2025-05-24 21:39:59.387281,0 days 00:00:18.997103,AdamW,0.1284185137212447,,,9.460680820902994e-05,,,,2,,,0.0031935649516396116,,PRUNED
47,47,31.25,2025-05-24 21:39:59.421823,2025-05-24 21:40:17.878625,0 days 00:00:18.456802,AdamW,0.21177656686114352,,,3.748172795114231e-05,,,,7,,,0.005282521933850156,,PRUNED
48,48,33.333333333333336,2025-05-24 21:40:17.912198,2025-05-24 21:40:37.027630,0 days 00:00:19.115432,Adam,0.15982730899199543,,1.6532915747157256e-05,,,,,0,,0.012028053718166665,,,PRUNED
49,49,33.333333333333336,2025-05-24 21:40:37.062606,2025-05-24 21:40:56.283868,0 days 00:00:19.221262,Adadelta,0.08062057431363899,95.61311598960178,,,,,,4,5.561402383017114,,,,PRUNED
50,50,33.333333333333336,2025-05-24 21:40:56.318065,2025-05-24 21:41:15.432249,0 days 00:00:19.114184,AdamW,0.29000767040211445,,,0.00017749305880502937,,,,1,,,0.0006878514639672287,,PRUNED
51,51,33.333333333333336,2025-05-24 21:41:15.466254,2025-05-24 21:41:35.197123,0 days 00:00:19.730869,AdamW,0.017813823758750666,,,6.236039920397243e-05,,,,1,,,0.0018904078648513075,,PRUNED
52,52,35.416666666666664,2025-05-24 21:41:35.231195,2025-05-24 21:41:54.954730,0 days 00:00:19.723535,AdamW,0.050191051504060336,,,1.7421095740398267e-05,,,,1,,,0.0028011752886792796,,PRUNED
53,53,62.5,2025-05-24 21:41:54.991636,2025-05-24 21:42:26.690842,0 days 00:00:31.699206,AdamW,0.0376723239753725,,,4.512831791777765e-05,,,,2,,,0.0014723408271638985,,COMPLETE
54,54,33.333333333333336,2025-05-24 21:42:26.742235,2025-05-24 21:42:46.872724,0 days 00:00:20.130489,AdamW,0.10302305892459568,,,0.00010185006199950447,,,,2,,,0.0003330464283505215,,PRUNED
55,55,33.333333333333336,2025-05-24 21:42:46.907163,2025-05-24 21:42:59.178809,0 days 00:00:12.271646,AdamW,0.025856157472260107,,,0.00028555044535330857,,,,3,,,0.0013791093197244395,,PRUNED
56,56,,2025-05-24 21:42:59.212897,2025-05-24 21:43:16.817244,0 days 00:00:17.604347,SGD,0.07095297538858407,,,,0.0002436806705604994,51.4427435384869,True,3,,,,0.010401039998830923,PRUNED
57,57,35.416666666666664,2025-05-24 21:43:16.860453,2025-05-24 21:43:33.030015,0 days 00:00:16.169562,AdamW,0.1243232251293865,,,1.0229211604572777e-05,,,,2,,,0.0006159140966966798,,PRUNED
58,58,33.333333333333336,2025-05-24 21:43:33.064539,2025-05-24 21:43:52.511080,0 days 00:00:19.446541,Adam,0.25776964597980945,,0.06584146226862728,,,,,0,,10.475147952425473,,,PRUNED
59,59,35.416666666666664,2025-05-24 21:43:52.546357,2025-05-24 21:44:12.386227,0 days 00:00:19.839870,AdamW,0.16423382932781658,,,3.460504942053007e-05,,,,1,,,0.0008981155888647946,,PRUNED
60,60,33.333333333333336,2025-05-24 21:44:12.431896,2025-05-24 21:44:32.203491,0 days 00:00:19.771595,AdamW,0.09288619792424009,,,0.007410785953495469,,,,4,,,0.001712124970546016,,PRUNED
61,61,58.333333333333336,2025-05-24 21:44:32.237933,2025-05-24 21:45:04.094105,0 days 00:00:31.856172,AdamW,0.016525542214998967,,,5.397525729141721e-05,,,,1,,,0.0022048287793411557,,COMPLETE
62,62,58.333333333333336,2025-05-24 21:45:04.145053,2025-05-24 21:45:35.864597,0 days 00:00:31.719544,AdamW,0.0385177515383044,,,4.188879496896556e-05,,,,1,,,0.003409819425973793,,COMPLETE
63,63,70.83333333333333,2025-05-24 21:45:35.918520,2025-05-24 21:46:07.104343,0 days 00:00:31.185823,AdamW,0.021936266705574265,,,7.414979222147891e-05,,,,2,,,0.00224014106953968,,COMPLETE
64,64,43.75,2025-05-24 21:46:07.154713,2025-05-24 21:46:38.302581,0 days 00:00:31.147868,AdamW,0.05105216869412713,,,1.5539246404028235e-05,,,,2,,,0.00041758009769540225,,COMPLETE
65,65,54.166666666666664,2025-05-24 21:46:38.352681,2025-05-24 21:47:09.628226,0 days 00:00:31.275545,AdamW,0.0033501859251188273,,,2.5213836769129515e-05,,,,2,,,0.0010576447122442087,,COMPLETE
66,66,33.333333333333336,2025-05-24 21:47:09.683938,2025-05-24 21:47:31.526140,0 days 00:00:21.842202,AdamW,0.06634201952531744,,,8.041452713908357e-05,,,,3,,,0.002539440509260565,,PRUNED
67,67,35.416666666666664,2025-05-24 21:47:31.560543,2025-05-24 21:47:51.197839,0 days 00:00:19.637296,Adadelta,0.14245886060433297,0.13093926836268646,,,,,,0,0.10277249009041292,,,,PRUNED
68,68,,2025-05-24 21:47:51.244136,2025-05-24 21:48:09.554731,0 days 00:00:18.310595,SGD,0.11447050523140734,,,,0.00021766855810388612,22.767518884788462,True,3,,,,2.6855659464132664,PRUNED
69,69,33.333333333333336,2025-05-24 21:48:09.588278,2025-05-24 21:48:27.654734,0 days 00:00:18.066456,AdamW,0.20514999504617198,,,0.0010702902205814433,,,,0,,,0.006337195602685571,,PRUNED
70,70,60.416666666666664,2025-05-24 21:48:27.687946,2025-05-24 21:48:49.660959,0 days 00:00:21.973013,AdamW,0.02582492707627035,,,0.00023208092939181396,,,,2,,,0.0014459989322901958,,COMPLETE
71,71,35.416666666666664,2025-05-24 21:48:49.712109,2025-05-24 21:49:04.412998,0 days 00:00:14.700889,AdamW,0.030815197514239202,,,0.0001362229213263964,,,,2,,,0.0014448103467224022,,PRUNED
72,72,33.333333333333336,2025-05-24 21:49:04.439353,2025-05-24 21:49:11.037166,0 days 00:00:06.597813,AdamW,0.0020990328315344843,,,0.00023132020804604933,,,,3,,,0.001976439358482875,,PRUNED
73,73,33.333333333333336,2025-05-24 21:49:11.066096,2025-05-24 21:49:30.125467,0 days 00:00:19.059371,AdamW,0.0842912264712688,,,0.00041258043629243914,,,,1,,,0.009043109951285962,,PRUNED
74,74,33.333333333333336,2025-05-24 21:49:30.159731,2025-05-24 21:49:49.783049,0 days 00:00:19.623318,AdamW,0.17581545915267383,,,0.00059419144478383,,,,4,,,0.003808549992312709,,PRUNED
75,75,81.25,2025-05-24 21:49:49.818047,2025-05-24 21:50:21.605729,0 days 00:00:31.787682,AdamW,0.048784223208060556,,,6.0893242672069005e-05,,,,2,,,0.0012171307256175067,,COMPLETE
76,76,33.333333333333336,2025-05-24 21:50:21.654997,2025-05-24 21:50:39.805059,0 days 00:00:18.150062,AdamW,0.04363533020063532,,,6.570429614851637e-05,,,,2,,,0.0012128143754703967,,PRUNED
77,77,33.333333333333336,2025-05-24 21:50:39.839911,2025-05-24 21:50:57.491907,0 days 00:00:17.651996,Adam,0.01629032086202445,,0.0011607253714622846,,,,,2,,0.1921473791788387,,,PRUNED
78,78,41.666666666666664,2025-05-24 21:50:57.526506,2025-05-24 21:51:18.359659,0 days 00:00:20.833153,AdamW,0.06679130743655673,,,2.6445448172952988e-05,,,,2,,,0.0007307795508900119,,PRUNED
79,79,33.333333333333336,2025-05-24 21:51:18.394409,2025-05-24 21:51:37.982742,0 days 00:00:19.588333,AdamW,0.44804507706442454,,,0.00012084792837967955,,,,3,,,0.0009728953132847242,,PRUNED
80,80,33.333333333333336,2025-05-24 21:51:38.017559,2025-05-24 21:51:56.953985,0 days 00:00:18.936426,AdamW,0.19118302927828565,,,3.962048904972554e-05,,,,6,,,0.0014552676501939934,,PRUNED
81,81,33.333333333333336,2025-05-24 21:51:56.993692,2025-05-24 21:52:16.637752,0 days 00:00:19.644060,AdamW,0.3504441474286223,,,6.296778258589894e-05,,,,2,,,0.002048640349448933,,PRUNED
82,82,68.75,2025-05-24 21:52:16.672220,2025-05-24 21:52:48.216756,0 days 00:00:31.544536,AdamW,0.062158640084234454,,,1.3648937389142515e-05,,,,1,,,0.001638903950399513,,COMPLETE
83,83,37.5,2025-05-24 21:52:48.268024,2025-05-24 21:53:07.868209,0 days 00:00:19.600185,AdamW,0.05933798207744123,,,1.8659083382616775e-05,,,,1,,,0.0015571368422739487,,PRUNED
84,84,60.416666666666664,2025-05-24 21:53:07.902316,2025-05-24 21:53:39.482158,0 days 00:00:31.579842,AdamW,0.029983591916817723,,,1.359960687573194e-05,,,,2,,,0.0011778252391392722,,COMPLETE
85,85,37.5,2025-05-24 21:53:39.536213,2025-05-24 21:53:58.711599,0 days 00:00:19.175386,AdamW,0.02657400173609826,,,1.1875480517731283e-05,,,,2,,,0.0010278834237330617,,PRUNED
86,86,33.333333333333336,2025-05-24 21:53:58.746249,2025-05-24 21:54:15.305773,0 days 00:00:16.559524,Adadelta,0.041781889465021045,12.261814444251515,,,,,,2,5.4754717922017635,,,,PRUNED
87,87,31.25,2025-05-24 21:54:15.337258,2025-05-24 21:54:23.061919,0 days 00:00:07.724661,AdamW,0.013306856574464877,,,1.4311265245236913e-05,,,,1,,,0.001270233760052114,,PRUNED
88,88,33.333333333333336,2025-05-24 21:54:23.088131,2025-05-24 21:54:29.292916,0 days 00:00:06.204785,AdamW,0.09224249606008478,,,2.3094899992290653e-05,,,,5,,,0.0017068805264081038,,PRUNED
89,89,,2025-05-24 21:54:29.318098,2025-05-24 21:54:35.993686,0 days 00:00:06.675588,SGD,0.0303178560178158,,,,0.0004738107204065892,69.35801902453011,False,1,,,,0.34740101427990533,PRUNED
90,90,31.25,2025-05-24 21:54:36.025493,2025-05-24 21:54:55.106288,0 days 00:00:19.080795,AdamW,0.0765498723582563,,,1.4560013287325155e-05,,,,1,,,0.0007928967190877614,,PRUNED
91,91,33.333333333333336,2025-05-24 21:54:55.140472,2025-05-24 21:55:07.442487,0 days 00:00:12.302015,AdamW,0.12416177685790372,,,3.202439596160131e-05,,,,3,,,0.0011975764506194297,,PRUNED
92,92,39.583333333333336,2025-05-24 21:55:07.469292,2025-05-24 21:55:24.302463,0 days 00:00:16.833171,AdamW,0.054002696726257536,,,2.2826205703266725e-05,,,,2,,,0.0023701221526146762,,PRUNED
93,93,33.333333333333336,2025-05-24 21:55:24.337607,2025-05-24 21:55:44.027328,0 days 00:00:19.689721,AdamW,0.10369271982219383,,,4.574994505174373e-05,,,,3,,,0.0029669132831557634,,PRUNED
94,94,58.333333333333336,2025-05-24 21:55:44.062318,2025-05-24 21:56:15.136441,0 days 00:00:31.074123,AdamW,0.02654452617532486,,,7.670890630555269e-05,,,,2,,,0.0018318953209519834,,COMPLETE
95,95,35.416666666666664,2025-05-24 21:56:15.188479,2025-05-24 21:56:34.700272,0 days 00:00:19.511793,AdamW,0.22493343275743635,,,3.037651616234459e-05,,,,2,,,0.000499153354585563,,PRUNED
96,96,29.166666666666668,2025-05-24 21:56:34.735770,2025-05-24 21:56:53.776937,0 days 00:00:19.041167,AdamW,0.1471173733067655,,,1.012619161353807e-05,,,,6,,,0.0009290453059226994,,PRUNED
97,97,33.333333333333336,2025-05-24 21:56:53.812236,2025-05-24 21:57:14.873626,0 days 00:00:21.061390,Adam,0.1575309056889767,,0.007862719062172046,,,,,3,,0.011378582702722056,,,PRUNED
98,98,37.5,2025-05-24 21:57:14.918357,2025-05-24 21:57:34.750773,0 days 00:00:19.832416,AdamW,0.04538277027859112,,,0.00018975195183881165,,,,2,,,0.0006239155564578051,,PRUNED
99,99,37.5,2025-05-24 21:57:34.786113,2025-05-24 21:57:57.316819,0 days 00:00:22.530706,AdamW,0.008937294688531855,,,1.719101589156362e-05,,,,1,,,0.0015791704469810275,,PRUNED
100,100,35.416666666666664,2025-05-24 21:57:57.351998,2025-05-24 21:58:16.994978,0 days 00:00:19.642980,AdamW,0.16915155210790933,,,4.490371393919886e-05,,,,2,,,0.0011298659092913443,,PRUNED
101,101,75.0,2025-05-24 21:58:17.030608,2025-05-24 21:58:48.880094,0 days 00:00:31.849486,AdamW,0.05972187056315591,,,5.2069975761495826e-05,,,,1,,,0.0022625667631474286,,COMPLETE
102,102,77.08333333333333,2025-05-24 21:58:48.931575,2025-05-24 21:59:20.852810,0 days 00:00:31.921235,AdamW,0.06009847667953449,,,0.0001075367335925174,,,,1,,,0.002188787246793746,,COMPLETE
103,103,37.5,2025-05-24 21:59:20.904970,2025-05-24 21:59:40.940122,0 days 00:00:20.035152,AdamW,0.061427058092934465,,,0.00010791413013127431,,,,0,,,0.0025057317495092387,,PRUNED
104,104,39.583333333333336,2025-05-24 21:59:40.975957,2025-05-24 21:59:58.961209,0 days 00:00:17.985252,AdamW,0.0896890151870089,,,7.984892958562557e-05,,,,1,,,0.0014093323349449358,,PRUNED
105,105,33.333333333333336,2025-05-24 21:59:58.994779,2025-05-24 22:00:15.654730,0 days 00:00:16.659951,AdamW,0.034886641309254285,,,0.0014503094052056773,,,,0,,,0.0020088488695742136,,PRUNED
106,106,39.583333333333336,2025-05-24 22:00:15.690602,2025-05-24 22:00:27.751608,0 days 00:00:12.061006,AdamW,0.06600505865402968,,,5.092760949840877e-05,,,,1,,,0.0016755058435249598,,PRUNED
107,107,33.333333333333336,2025-05-24 22:00:27.778881,2025-05-24 22:00:34.297007,0 days 00:00:06.518126,Adadelta,0.07217413844492644,0.36382577227907337,,,,,,1,0.123336688924944,,,,PRUNED
108,108,33.333333333333336,2025-05-24 22:00:34.328973,2025-05-24 22:00:41.618742,0 days 00:00:07.289769,AdamW,0.04717630807817971,,,3.3065267747705717e-05,,,,1,,,0.0036607361968936155,,PRUNED
109,109,37.5,2025-05-24 22:00:41.646560,2025-05-24 22:01:00.932278,0 days 00:00:19.285718,AdamW,0.023553029451905242,,,0.00015527460354735766,,,,0,,,0.0028512748054579195,,PRUNED
110,110,,2025-05-24 22:01:00.969090,2025-05-24 22:01:19.318601,0 days 00:00:18.349511,SGD,0.11637926907924194,,,,0.06988406214006979,28.85459412973262,False,1,,,,12.166113516953434,PRUNED
111,111,33.333333333333336,2025-05-24 22:01:19.362154,2025-05-24 22:01:38.919216,0 days 00:00:19.557062,AdamW,0.13283955018712715,,,6.36332730349577e-05,,,,2,,,0.0022519506748576693,,PRUNED
112,112,31.25,2025-05-24 22:01:38.956700,2025-05-24 22:01:58.215383,0 days 00:00:19.258683,AdamW,0.1016509241826483,,,2.023022842469648e-05,,,,4,,,0.00449956348236249,,PRUNED
113,113,85.41666666666667,2025-05-24 22:01:58.250976,2025-05-24 22:02:29.401902,0 days 00:00:31.150926,AdamW,0.0792093523119217,,,8.588408461176659e-05,,,,2,,,0.0018374590026966455,,COMPLETE
