,number,value,datetime_start,datetime_complete,duration,params_algorithm,params_dropout_rate,params_lr_Adadelta,params_lr_Adam,params_lr_AdamW,params_lr_SGD,params_momentum_SGD,params_nesterov_SGD,params_suggested_freeze,params_weight_decay_Adadelta,params_weight_decay_Adam,params_weight_decay_AdamW,params_weight_decay_SGD,state
461,461,,2025-05-25 22:44:43.419484,2025-05-25 22:44:50.609951,0 days 00:00:07.190467,SGD,0.20328358500231505,,,,9.392500618213244e-05,61.553815746561945,False,0,,,,38.52003001975109,PRUNED
462,462,33.333333333333336,2025-05-25 22:44:50.643970,2025-05-25 22:44:59.826288,0 days 00:00:09.182318,AdamW,0.26626799523947337,,,0.00013002681846842234,,,,1,,,0.0013671948479867684,,PRUNED
463,463,41.666666666666664,2025-05-25 22:44:59.867758,2025-05-25 22:45:09.903392,0 days 00:00:10.035634,Adam,0.15455418646494676,,1.0300954190578992e-05,,,,,1,,6.098531526841005,,,PRUNED
464,464,66.66666666666667,2025-05-25 22:45:09.964830,2025-05-25 22:45:43.730755,0 days 00:00:33.765925,AdamW,0.23760924375034964,,,0.00038729943220163404,,,,1,,,0.000793004473119406,,COMPLETE
465,465,37.5,2025-05-25 22:45:43.784932,2025-05-25 22:45:57.155475,0 days 00:00:13.370543,AdamW,0.23884848304975131,,,0.0005041076957376393,,,,1,,,0.000768860856948811,,PRUNED
466,466,39.583333333333336,2025-05-25 22:45:57.217154,2025-05-25 22:46:10.272405,0 days 00:00:13.055251,AdamW,0.25106158542587403,,,0.00037261449685629304,,,,2,,,0.0007028511788726263,,PRUNED
467,467,43.75,2025-05-25 22:46:10.334966,2025-05-25 22:46:23.489732,0 days 00:00:13.154766,AdamW,0.24139580735144292,,,0.00044273941030593836,,,,1,,,0.0007845060927384602,,PRUNED
468,468,37.5,2025-05-25 22:46:23.551572,2025-05-25 22:46:36.861739,0 days 00:00:13.310167,AdamW,0.22945581889076336,,,0.00032355782057856173,,,,1,,,0.0008587869497839436,,PRUNED
469,469,37.5,2025-05-25 22:46:36.924369,2025-05-25 22:46:50.153640,0 days 00:00:13.229271,AdamW,0.25651145187413316,,,0.000554458650031195,,,,1,,,0.0007031917092094491,,PRUNED
470,470,33.333333333333336,2025-05-25 22:46:50.191661,2025-05-25 22:47:03.265090,0 days 00:00:13.073429,AdamW,0.24198729217985918,,,0.0003784465920913931,,,,0,,,0.0006384019502361286,,PRUNED
471,471,41.666666666666664,2025-05-25 22:47:03.327168,2025-05-25 22:47:16.535792,0 days 00:00:13.208624,AdamW,0.4048797687044798,,,0.00028420442915565495,,,,3,,,0.0004969725416899738,,PRUNED
472,472,33.333333333333336,2025-05-25 22:47:16.596065,2025-05-25 22:47:29.730078,0 days 00:00:13.134013,AdamW,0.25749201123561843,,,0.00043213026350170713,,,,2,,,0.0008280314187801597,,PRUNED
473,473,33.333333333333336,2025-05-25 22:47:29.801330,2025-05-25 22:47:43.384923,0 days 00:00:13.583593,AdamW,0.2629008757318891,,,0.0006764304901133666,,,,1,,,0.0009219428041887842,,PRUNED
474,474,37.5,2025-05-25 22:47:43.447239,2025-05-25 22:47:56.686838,0 days 00:00:13.239599,AdamW,0.23164238057960326,,,0.00024464726394171643,,,,1,,,0.0002923080653497861,,PRUNED
475,475,39.583333333333336,2025-05-25 22:47:56.726354,2025-05-25 22:48:10.082933,0 days 00:00:13.356579,AdamW,0.27286318225715633,,,0.0004970484745320992,,,,1,,,0.0005742471096789745,,PRUNED
476,476,45.833333333333336,2025-05-25 22:48:10.145483,2025-05-25 22:48:23.350504,0 days 00:00:13.205021,AdamW,0.444167694806558,,,0.00036327287853928325,,,,1,,,0.0016315475252722058,,PRUNED
477,477,33.333333333333336,2025-05-25 22:48:23.413727,2025-05-25 22:48:36.622951,0 days 00:00:13.209224,Adam,0.17104813710221128,,0.012735006940857519,,,,,2,,2.7688499627603442,,,PRUNED
478,478,41.666666666666664,2025-05-25 22:48:36.691970,2025-05-25 22:48:49.931529,0 days 00:00:13.239559,AdamW,0.22122862523543513,,,0.0003071255483119228,,,,3,,,0.0007391310369862873,,PRUNED
479,479,33.333333333333336,2025-05-25 22:48:49.993558,2025-05-25 22:49:03.281373,0 days 00:00:13.287815,AdamW,0.14896064768371034,,,0.0006378955500264418,,,,1,,,0.0010062273347189975,,PRUNED
480,480,31.25,2025-05-25 22:49:03.344516,2025-05-25 22:49:16.439287,0 days 00:00:13.094771,AdamW,0.24914666062329438,,,0.0004190979256412681,,,,1,,,0.001251711398292764,,PRUNED
481,481,33.333333333333336,2025-05-25 22:49:16.500363,2025-05-25 22:49:29.653757,0 days 00:00:13.153394,Adadelta,0.13431115326671036,34.3402707464717,,,,,,1,0.30733061607944895,,,,PRUNED
482,482,45.833333333333336,2025-05-25 22:49:29.713026,2025-05-25 22:49:43.122603,0 days 00:00:13.409577,AdamW,0.1643197199734658,,,0.00016863266968978826,,,,0,,,0.0008446203040735226,,PRUNED
483,483,41.666666666666664,2025-05-25 22:49:43.184284,2025-05-25 22:49:56.514797,0 days 00:00:13.330513,AdamW,0.28278097819536585,,,0.00023486937032770735,,,,1,,,0.0006779399606668806,,PRUNED
484,484,31.25,2025-05-25 22:49:56.576548,2025-05-25 22:50:09.592567,0 days 00:00:13.016019,AdamW,0.15571034942751552,,,0.00032552663903426694,,,,2,,,0.0014438170470300025,,PRUNED
485,485,31.25,2025-05-25 22:50:09.653507,2025-05-25 22:50:22.511149,0 days 00:00:12.857642,AdamW,0.17927047157633985,,,0.0005417699934119365,,,,1,,,0.0009340862410129934,,PRUNED
486,486,33.333333333333336,2025-05-25 22:50:22.550494,2025-05-25 22:50:35.884845,0 days 00:00:13.334351,AdamW,0.19069837730502576,,,0.00038199178683925877,,,,1,,,0.0011397956158850644,,PRUNED
487,487,37.5,2025-05-25 22:50:35.950924,2025-05-25 22:50:48.989432,0 days 00:00:13.038508,AdamW,0.23309830940521153,,,0.00019524595926580517,,,,2,,,0.0008226186141742391,,PRUNED
488,488,62.5,2025-05-25 22:50:49.050015,2025-05-25 22:51:21.906259,0 days 00:00:32.856244,AdamW,0.07067891517312119,,,0.0002763114386141644,,,,1,,,0.009090194284468058,,COMPLETE
489,489,45.833333333333336,2025-05-25 22:51:21.960478,2025-05-25 22:51:35.574727,0 days 00:00:13.614249,AdamW,0.09697294489314032,,,7.908167556513963e-05,,,,1,,,0.007265996442796189,,PRUNED
490,490,35.416666666666664,2025-05-25 22:51:35.636220,2025-05-25 22:51:48.728766,0 days 00:00:13.092546,AdamW,0.08587573118793893,,,0.00029366898528647504,,,,0,,,0.008702192564422284,,PRUNED
491,491,27.083333333333332,2025-05-25 22:51:48.768397,2025-05-25 22:52:01.962356,0 days 00:00:13.193959,Adam,0.021238801922262962,,3.8392371924332804e-05,,,,,4,,1.4334618847779113,,,PRUNED
492,492,,2025-05-25 22:52:02.023169,2025-05-25 22:52:13.487197,0 days 00:00:11.464028,SGD,0.2519821918221375,,,,0.0013860695116646878,51.73648829437042,False,1,,,,7.136929155409544,PRUNED
493,493,45.833333333333336,2025-05-25 22:52:13.527932,2025-05-25 22:52:26.947697,0 days 00:00:13.419765,AdamW,0.27049039697997845,,,0.00045677129789580814,,,,1,,,0.009332441802353982,,PRUNED
494,494,33.333333333333336,2025-05-25 22:52:27.009278,2025-05-25 22:52:40.063594,0 days 00:00:13.054316,AdamW,0.06436810049245598,,,0.00037263504627973066,,,,1,,,0.0005369476992272093,,PRUNED
495,495,41.666666666666664,2025-05-25 22:52:40.128860,2025-05-25 22:52:53.355997,0 days 00:00:13.227137,AdamW,0.24046178335126533,,,0.0008580173192819066,,,,2,,,0.00769415208984943,,PRUNED
496,496,75.0,2025-05-25 22:52:53.419019,2025-05-25 22:53:27.267708,0 days 00:00:33.848689,AdamW,0.0656930206494005,,,0.0002590923671777168,,,,1,,,0.00046239111067186256,,COMPLETE
497,497,31.25,2025-05-25 22:53:27.322508,2025-05-25 22:53:40.975003,0 days 00:00:13.652495,AdamW,0.056921124292482854,,,0.00026499474276638204,,,,1,,,0.008452521083274213,,PRUNED
498,498,33.333333333333336,2025-05-25 22:53:41.037333,2025-05-25 22:53:54.302885,0 days 00:00:13.265552,AdamW,0.06324982387781385,,,0.0005859586380649606,,,,2,,,0.000435614386791961,,PRUNED
499,499,54.166666666666664,2025-05-25 22:53:54.366148,2025-05-25 22:54:28.057873,0 days 00:00:33.691725,AdamW,0.11084962060422437,,,0.0004480105053214745,,,,1,,,0.0004892663520791186,,PRUNED
500,500,43.75,2025-05-25 22:54:28.190260,2025-05-25 22:54:41.305253,0 days 00:00:13.114993,AdamW,0.043676466856491854,,,0.00034637620044890153,,,,1,,,0.0003768993294002747,,PRUNED
501,501,33.333333333333336,2025-05-25 22:54:41.368560,2025-05-25 22:54:54.497868,0 days 00:00:13.129308,AdamW,0.08021188843179607,,,0.00011320672970202697,,,,1,,,0.0004523309509530582,,PRUNED
502,502,29.166666666666668,2025-05-25 22:54:54.560120,2025-05-25 22:55:07.902978,0 days 00:00:13.342858,AdamW,0.2609190171665435,,,0.0002710561596557727,,,,0,,,0.00047142264547732744,,PRUNED
503,503,56.25,2025-05-25 22:55:07.966527,2025-05-25 22:55:41.837724,0 days 00:00:33.871197,AdamW,0.08482675499552103,,,0.0005029729725645304,,,,1,,,0.006717869331803567,,COMPLETE
504,504,33.333333333333336,2025-05-25 22:55:41.907060,2025-05-25 22:55:55.016058,0 days 00:00:13.108998,AdamW,0.422730711874018,,,0.0002160999636342022,,,,2,,,0.0092150119745143,,PRUNED
505,505,45.833333333333336,2025-05-25 22:55:55.077718,2025-05-25 22:56:08.250479,0 days 00:00:13.172761,Adam,0.059833196078896186,,9.948170274289458e-05,,,,,2,,0.1633462489078539,,,PRUNED
506,506,39.583333333333336,2025-05-25 22:56:08.312004,2025-05-25 22:56:21.685373,0 days 00:00:13.373369,AdamW,0.22374080462898616,,,0.00031266925496344224,,,,3,,,0.0005687035226877412,,PRUNED
507,507,33.333333333333336,2025-05-25 22:56:21.747040,2025-05-25 22:56:34.667389,0 days 00:00:12.920349,Adadelta,0.2811307364505381,0.5075607996206037,,,,,,1,0.05597135029118426,,,,PRUNED
508,508,31.25,2025-05-25 22:56:34.727173,2025-05-25 22:56:48.025997,0 days 00:00:13.298824,AdamW,0.09231323079477485,,,2.5091095930513913e-05,,,,1,,,0.007947345468962343,,PRUNED
509,509,33.333333333333336,2025-05-25 22:56:48.087735,2025-05-25 22:57:01.234368,0 days 00:00:13.146633,AdamW,0.07757985333515165,,,0.0004075680069828444,,,,1,,,0.0005160712340287135,,PRUNED
510,510,35.416666666666664,2025-05-25 22:57:01.312137,2025-05-25 22:57:14.599537,0 days 00:00:13.287400,AdamW,0.24618177997739343,,,0.000743337433978987,,,,1,,,0.005801346406405468,,PRUNED
511,511,43.75,2025-05-25 22:57:14.662199,2025-05-25 22:57:27.746859,0 days 00:00:13.084660,AdamW,0.0018203192453752487,,,0.00014970055022408237,,,,2,,,0.00043612783670006624,,PRUNED
512,512,47.916666666666664,2025-05-25 22:57:27.808574,2025-05-25 22:57:40.986861,0 days 00:00:13.178287,AdamW,0.041590947268209257,,,0.0002424991506624007,,,,1,,,0.0004129747041159913,,PRUNED
513,513,,2025-05-25 22:57:41.049278,2025-05-25 22:57:53.988571,0 days 00:00:12.939293,SGD,0.21353015226630634,,,,2.6667639140993423e-05,77.62650664888747,False,0,,,,0.4962354312464315,PRUNED
514,514,37.5,2025-05-25 22:57:54.026612,2025-05-25 22:58:07.377094,0 days 00:00:13.350482,AdamW,0.0418401627724546,,,0.0003320189742199825,,,,1,,,0.0006198509076568423,,PRUNED
515,515,41.666666666666664,2025-05-25 22:58:07.438696,2025-05-25 22:58:20.559049,0 days 00:00:13.120353,AdamW,0.01396053363524652,,,0.0005968086560426321,,,,1,,,0.0003167705604207057,,PRUNED
516,516,37.5,2025-05-25 22:58:20.621265,2025-05-25 22:58:33.709279,0 days 00:00:13.088014,AdamW,0.0716052488391553,,,0.00039995072476280163,,,,1,,,0.0012084360142197396,,PRUNED
517,517,41.666666666666664,2025-05-25 22:58:33.774115,2025-05-25 22:58:47.111905,0 days 00:00:13.337790,AdamW,0.14276247011546286,,,0.0005068990059016422,,,,2,,,0.0012704309248316235,,PRUNED
518,518,33.333333333333336,2025-05-25 22:58:47.174600,2025-05-25 22:59:00.350132,0 days 00:00:13.175532,AdamW,0.0723169576378298,,,0.04930812567247221,,,,0,,,0.004984671811278698,,PRUNED
519,519,50.0,2025-05-25 22:59:00.391674,2025-05-25 22:59:13.480416,0 days 00:00:13.088742,AdamW,0.045662155283515,,,0.00018036822522368216,,,,1,,,0.009674230220287443,,PRUNED
520,520,45.833333333333336,2025-05-25 22:59:13.542061,2025-05-25 22:59:26.901080,0 days 00:00:13.359019,AdamW,0.15955341897769115,,,0.00028901670840077035,,,,1,,,0.001403854054092105,,PRUNED
521,521,39.583333333333336,2025-05-25 22:59:26.963092,2025-05-25 22:59:40.197959,0 days 00:00:13.234867,Adam,0.26588310905903517,,0.00016558783542872837,,,,,1,,60.10590248267288,,,PRUNED
522,522,33.333333333333336,2025-05-25 22:59:40.261074,2025-05-25 22:59:53.486328,0 days 00:00:13.225254,AdamW,0.20803227051862955,,,0.002050487520039719,,,,1,,,0.009975260843114082,,PRUNED
523,523,39.583333333333336,2025-05-25 22:59:53.548994,2025-05-25 23:00:06.598768,0 days 00:00:13.049774,AdamW,0.16922429196539035,,,0.00043835093285852144,,,,2,,,0.001709008575137364,,PRUNED
524,524,37.5,2025-05-25 23:00:06.637008,2025-05-25 23:00:20.026702,0 days 00:00:13.389694,AdamW,0.14957814328530356,,,0.00034963014840718804,,,,1,,,0.001529502537189345,,PRUNED
525,525,33.333333333333336,2025-05-25 23:00:20.089123,2025-05-25 23:00:33.231768,0 days 00:00:13.142645,AdamW,0.23438970999822933,,,0.0002121632724613751,,,,1,,,0.0010541606435815344,,PRUNED
526,526,35.416666666666664,2025-05-25 23:00:33.293490,2025-05-25 23:00:46.578436,0 days 00:00:13.284946,AdamW,0.2563545952127435,,,0.00013656246681250988,,,,3,,,0.0006692224988012548,,PRUNED
527,527,33.333333333333336,2025-05-25 23:00:46.639876,2025-05-25 23:00:59.817890,0 days 00:00:13.178014,AdamW,0.04822154832867466,,,0.0002703884112769801,,,,0,,,0.000552012486889843,,PRUNED
528,528,31.25,2025-05-25 23:00:59.881055,2025-05-25 23:01:13.176041,0 days 00:00:13.294986,AdamW,0.1996475964570526,,,0.0006514669143103564,,,,2,,,0.0007415431692306027,,PRUNED
529,529,33.333333333333336,2025-05-25 23:01:13.238112,2025-05-25 23:01:26.588444,0 days 00:00:13.350332,AdamW,0.12593319329643582,,,0.0005214893611484218,,,,1,,,0.006903486391613578,,PRUNED
530,530,33.333333333333336,2025-05-25 23:01:26.649784,2025-05-25 23:01:39.156661,0 days 00:00:12.506877,Adadelta,0.07187146013868109,2.041634211368062,,,,,,1,85.22723204227243,,,,PRUNED
531,531,43.75,2025-05-25 23:01:39.216989,2025-05-25 23:01:52.265220,0 days 00:00:13.048231,AdamW,0.06120214531957213,,,0.00038567658952368144,,,,4,,,0.008612002258193651,,PRUNED
532,532,43.75,2025-05-25 23:01:52.325878,2025-05-25 23:02:04.568471,0 days 00:00:12.242593,AdamW,0.0537291582993642,,,0.0003246818010963426,,,,2,,,0.001308937785726227,,PRUNED
533,533,35.416666666666664,2025-05-25 23:02:04.631149,2025-05-25 23:02:17.796392,0 days 00:00:13.165243,Adam,0.026723311099614455,,1.656966262811317e-05,,,,,1,,0.34202787348147856,,,PRUNED
534,534,43.75,2025-05-25 23:02:17.859217,2025-05-25 23:02:31.008396,0 days 00:00:13.149179,AdamW,0.10287112189741127,,,0.0001772396124610571,,,,1,,,0.0011382032324809732,,PRUNED
535,535,37.5,2025-05-25 23:02:31.069949,2025-05-25 23:02:44.172352,0 days 00:00:13.102403,AdamW,0.3757542076477127,,,0.00045664926310821067,,,,1,,,0.0004810031880441098,,PRUNED
536,536,37.5,2025-05-25 23:02:44.235682,2025-05-25 23:02:57.607537,0 days 00:00:13.371855,AdamW,0.1628257447358331,,,0.0010167762316579893,,,,3,,,0.0010060535225370514,,PRUNED
537,537,35.416666666666664,2025-05-25 23:02:57.668257,2025-05-25 23:03:10.730290,0 days 00:00:13.062033,AdamW,0.22310365284275152,,,0.00023580139454718317,,,,2,,,0.004172120922521357,,PRUNED
538,538,,2025-05-25 23:03:10.793415,2025-05-25 23:03:23.730034,0 days 00:00:12.936619,SGD,0.3030394071760951,,,,1.4863204416977223e-05,91.72085687368838,False,0,,,,0.03509001141086652,PRUNED
539,539,33.333333333333336,2025-05-25 23:03:23.786383,2025-05-25 23:03:36.850475,0 days 00:00:13.064092,AdamW,0.2943610184130205,,,9.339593345842012e-05,,,,1,,,0.006071116927038509,,PRUNED
540,540,45.833333333333336,2025-05-25 23:03:36.912440,2025-05-25 23:03:50.389193,0 days 00:00:13.476753,AdamW,0.24394530932306807,,,0.00029333855865412413,,,,1,,,0.0006136714443188096,,PRUNED
541,541,35.416666666666664,2025-05-25 23:03:50.451701,2025-05-25 23:04:03.682722,0 days 00:00:13.231021,AdamW,0.18053436610652457,,,0.0003771467286345681,,,,1,,,0.0008939541623473014,,PRUNED
542,542,41.666666666666664,2025-05-25 23:04:03.753898,2025-05-25 23:04:17.074426,0 days 00:00:13.320528,AdamW,0.15223655170270797,,,0.00025173754537927785,,,,1,,,0.0007782222351902349,,PRUNED
543,543,35.416666666666664,2025-05-25 23:04:17.136698,2025-05-25 23:04:30.273311,0 days 00:00:13.136613,AdamW,0.27080545574604065,,,0.00059122508950668,,,,1,,,0.0011723383423931067,,PRUNED
544,544,50.0,2025-05-25 23:04:30.337369,2025-05-25 23:04:43.658840,0 days 00:00:13.321471,AdamW,0.13650372933074334,,,0.0004667556573207827,,,,1,,,0.0026522958453106134,,PRUNED
545,545,39.583333333333336,2025-05-25 23:04:43.721702,2025-05-25 23:04:57.115798,0 days 00:00:13.394096,AdamW,0.19015891287925088,,,0.00019981569040239617,,,,2,,,0.0013562592919037332,,PRUNED
546,546,33.333333333333336,2025-05-25 23:04:57.177565,2025-05-25 23:05:10.460459,0 days 00:00:13.282894,Adam,0.17214929485541663,,0.001210587734949134,,,,,1,,10.446789143652918,,,PRUNED
547,547,35.416666666666664,2025-05-25 23:05:10.523745,2025-05-25 23:05:23.828940,0 days 00:00:13.305195,AdamW,0.2529257075085533,,,0.0003343913437450828,,,,2,,,0.0009945223237690123,,PRUNED
548,548,37.5,2025-05-25 23:05:23.867794,2025-05-25 23:05:37.060242,0 days 00:00:13.192448,AdamW,0.2130592993247522,,,0.00015889193759954787,,,,5,,,0.0005172779482500025,,PRUNED
549,549,33.333333333333336,2025-05-25 23:05:37.119481,2025-05-25 23:05:50.280992,0 days 00:00:13.161511,AdamW,0.16158167944907545,,,0.00041631684461642017,,,,0,,,0.0004100390858534451,,PRUNED
550,550,31.25,2025-05-25 23:05:50.344903,2025-05-25 23:06:03.514473,0 days 00:00:13.169570,AdamW,0.07173610535519959,,,0.0002818180486063461,,,,1,,,0.0006752844568149984,,PRUNED
551,551,35.416666666666664,2025-05-25 23:06:03.576712,2025-05-25 23:06:16.815325,0 days 00:00:13.238613,AdamW,0.174959654512314,,,0.0007374291799417991,,,,3,,,0.0015077924372262446,,PRUNED
552,552,47.916666666666664,2025-05-25 23:06:16.896261,2025-05-25 23:06:30.123997,0 days 00:00:13.227736,AdamW,0.28088051402728087,,,0.00011676117513911315,,,,1,,,0.000251802954443511,,PRUNED
553,553,33.333333333333336,2025-05-25 23:06:30.186722,2025-05-25 23:06:41.725374,0 days 00:00:11.538652,AdamW,0.1462563840658244,,,0.0004996407863343237,,,,8,,,0.0010854322368667613,,PRUNED
554,554,45.833333333333336,2025-05-25 23:06:41.775973,2025-05-25 23:06:54.978166,0 days 00:00:13.202193,AdamW,0.20134577351363772,,,0.000370195828355573,,,,1,,,0.003304640101221376,,PRUNED
555,555,33.333333333333336,2025-05-25 23:06:55.039720,2025-05-25 23:07:05.206178,0 days 00:00:10.166458,Adadelta,0.2611496719657165,0.03275596514918205,,,,,,1,0.8864897960685431,,,,PRUNED
556,556,41.666666666666664,2025-05-25 23:07:05.266941,2025-05-25 23:07:18.285761,0 days 00:00:13.018820,AdamW,0.23412574366003094,,,0.00022535480193098568,,,,2,,,0.000843133773072921,,PRUNED
557,557,35.416666666666664,2025-05-25 23:07:18.347917,2025-05-25 23:07:31.424184,0 days 00:00:13.076267,AdamW,0.1887717432820031,,,0.0003162015471483543,,,,1,,,0.0005752000071093265,,PRUNED
558,558,37.5,2025-05-25 23:07:31.486363,2025-05-25 23:08:04.966365,0 days 00:00:33.480002,AdamW,0.15285565852029973,,,0.000559502089333818,,,,0,,,0.0009591666727011498,,PRUNED
559,559,37.5,2025-05-25 23:08:05.030459,2025-05-25 23:08:18.423322,0 days 00:00:13.392863,AdamW,0.11992485091998822,,,0.00041976160075096535,,,,1,,,0.0019246362332685837,,PRUNED
560,560,33.333333333333336,2025-05-25 23:08:18.486911,2025-05-25 23:08:31.699774,0 days 00:00:13.212863,Adam,0.16639544927977684,,0.047655714390963354,,,,,2,,0.6731421899696841,,,PRUNED
561,561,47.916666666666664,2025-05-25 23:08:31.762011,2025-05-25 23:08:44.836971,0 days 00:00:13.074960,AdamW,0.17889238294991094,,,0.00025977006508116435,,,,1,,,0.0007183153740397558,,PRUNED
562,562,43.75,2025-05-25 23:08:44.899923,2025-05-25 23:08:58.232702,0 days 00:00:13.332779,AdamW,0.22136996581289398,,,0.0001922252762021941,,,,1,,,0.0007863909352278129,,PRUNED
563,563,,2025-05-25 23:08:58.295585,2025-05-25 23:09:09.186372,0 days 00:00:10.890787,SGD,0.4851724737014891,,,,0.09990596985804434,48.227867831625964,True,3,,,,1.8806384003338532,PRUNED
564,564,33.333333333333336,2025-05-25 23:09:09.224370,2025-05-25 23:09:22.404457,0 days 00:00:13.180087,AdamW,0.14259160032565768,,,0.0003413661604130099,,,,1,,,0.0012586475751334176,,PRUNED
565,565,33.333333333333336,2025-05-25 23:09:22.471597,2025-05-25 23:09:35.817225,0 days 00:00:13.345628,AdamW,0.03517736233905944,,,0.00015322840767987244,,,,2,,,0.0016328484528039912,,PRUNED
566,566,47.916666666666664,2025-05-25 23:09:35.879796,2025-05-25 23:09:49.008225,0 days 00:00:13.128429,AdamW,0.2721726496659029,,,0.000669799344983935,,,,1,,,0.0009109916564892797,,PRUNED
567,567,50.0,2025-05-25 23:09:49.070511,2025-05-25 23:10:02.175117,0 days 00:00:13.104606,AdamW,0.245851283917284,,,0.0004837085583926536,,,,0,,,0.0010608935695406929,,PRUNED
568,568,33.333333333333336,2025-05-25 23:10:02.238035,2025-05-25 23:10:15.373431,0 days 00:00:13.135396,AdamW,0.20787798254441403,,,0.00029553857394897605,,,,1,,,0.008207714417057295,,PRUNED
569,569,43.75,2025-05-25 23:10:15.435670,2025-05-25 23:10:28.784791,0 days 00:00:13.349121,AdamW,0.15815294938130217,,,0.0003974808387071266,,,,1,,,0.0006314837776246359,,PRUNED
570,570,33.333333333333336,2025-05-25 23:10:28.851018,2025-05-25 23:10:42.032642,0 days 00:00:13.181624,AdamW,0.19558834252988339,,,0.0002121775575871547,,,,1,,,0.005306318348926514,,PRUNED
571,571,45.833333333333336,2025-05-25 23:10:42.096544,2025-05-25 23:10:55.198469,0 days 00:00:13.101925,AdamW,0.18435667754825735,,,0.00024487945259869586,,,,2,,,0.00045831766525034333,,PRUNED
572,572,43.75,2025-05-25 23:10:55.260643,2025-05-25 23:11:28.805489,0 days 00:00:33.544846,AdamW,0.3282481014776891,,,0.0005481355768400968,,,,1,,,0.0003872758151228698,,PRUNED
573,573,33.333333333333336,2025-05-25 23:11:28.870978,2025-05-25 23:11:42.608839,0 days 00:00:13.737861,Adam,0.08845764928272291,,0.09554992844656465,,,,,0,,27.399323665436413,,,PRUNED
574,574,35.416666666666664,2025-05-25 23:11:42.671806,2025-05-25 23:11:56.360597,0 days 00:00:13.688791,AdamW,0.45239668270234157,,,0.0001312622340937124,,,,1,,,0.0011954554985996804,,PRUNED
575,575,43.75,2025-05-25 23:11:56.430748,2025-05-25 23:12:09.545933,0 days 00:00:13.115185,AdamW,0.13406253137568427,,,0.0003408643270122039,,,,2,,,0.0013988870594547902,,PRUNED
576,576,33.333333333333336,2025-05-25 23:12:09.611663,2025-05-25 23:12:22.993268,0 days 00:00:13.381605,AdamW,0.16836764677687216,,,0.012556500314677576,,,,1,,,0.0008536570641669537,,PRUNED
