,number,value,datetime_start,datetime_complete,duration,params_algorithm,params_dropout_rate,params_lr_Adadelta,params_lr_Adam,params_lr_AdamW,params_lr_SGD,params_momentum_SGD,params_nesterov_SGD,params_suggested_freeze,params_weight_decay_Adadelta,params_weight_decay_Adam,params_weight_decay_AdamW,params_weight_decay_SGD,state
575,575,41.666666666666664,2025-05-25 03:38:53.017694,2025-05-25 03:39:05.877270,0 days 00:00:12.859576,AdamW,0.18405032757481568,,,0.00011148687154785123,,,,1,,,0.0024672535091572597,,PRUNED
576,576,33.333333333333336,2025-05-25 03:39:05.940654,2025-05-25 03:39:13.026772,0 days 00:00:07.086118,AdamW,0.009390105863759766,,,0.0006356997155498949,,,,6,,,0.004619586038235907,,PRUNED
577,577,29.166666666666668,2025-05-25 03:39:13.064421,2025-05-25 03:39:18.464140,0 days 00:00:05.399719,AdamW,0.018424708289055642,,,0.00024764059219101403,,,,1,,,0.0027216473122294166,,PRUNED
578,578,41.666666666666664,2025-05-25 03:39:18.505676,2025-05-25 03:39:23.909322,0 days 00:00:05.403646,AdamW,0.08477942950005886,,,0.00017577904030454606,,,,2,,,0.0031374970711763816,,PRUNED
579,579,39.583333333333336,2025-05-25 03:39:23.952281,2025-05-25 03:39:29.708405,0 days 00:00:05.756124,AdamW,0.041627429422543945,,,0.0003547384129232789,,,,4,,,0.0016953630042979948,,PRUNED
580,580,39.583333333333336,2025-05-25 03:39:29.749042,2025-05-25 03:39:41.215360,0 days 00:00:11.466318,AdamW,0.15720436704722454,,,0.0002994534907152926,,,,7,,,0.005832877826198167,,PRUNED
581,581,41.666666666666664,2025-05-25 03:39:41.267244,2025-05-25 03:39:52.579398,0 days 00:00:11.312154,AdamW,0.07190521034593628,,,0.0004538708245009186,,,,2,,,0.0011689978871270185,,PRUNED
582,582,39.583333333333336,2025-05-25 03:39:52.619135,2025-05-25 03:39:58.165578,0 days 00:00:05.546443,AdamW,0.32470915734227035,,,0.00020635604892689768,,,,5,,,0.0021012491376624144,,PRUNED
583,583,31.25,2025-05-25 03:39:58.217355,2025-05-25 03:40:05.142803,0 days 00:00:06.925448,AdamW,0.2658719977285559,,,0.0002630324998583825,,,,2,,,0.001354832038244977,,PRUNED
584,584,33.333333333333336,2025-05-25 03:40:05.206879,2025-05-25 03:40:17.874447,0 days 00:00:12.667568,Adadelta,0.02550988397683992,0.3938956960883123,,,,,,6,10.65817607484453,,,,PRUNED
585,585,35.416666666666664,2025-05-25 03:40:17.933315,2025-05-25 03:40:31.453131,0 days 00:00:13.519816,AdamW,0.0360546753731328,,,0.00013887644954678575,,,,1,,,0.001542511438289918,,PRUNED
586,586,41.666666666666664,2025-05-25 03:40:31.517173,2025-05-25 03:40:45.110054,0 days 00:00:13.592881,AdamW,0.055546419378316746,,,0.00019997177031059636,,,,3,,,0.0010189270124648562,,PRUNED
587,587,33.333333333333336,2025-05-25 03:40:45.174897,2025-05-25 03:40:58.564118,0 days 00:00:13.389221,AdamW,0.06472989051462771,,,0.0003735887759507045,,,,1,,,0.0024774435293554485,,PRUNED
588,588,,2025-05-25 03:40:58.626815,2025-05-25 03:41:11.804844,0 days 00:00:13.178029,SGD,0.09377517315832228,,,,0.014052770426000361,16.559387546854133,True,4,,,,0.02966989626864088,PRUNED
589,589,35.416666666666664,2025-05-25 03:41:11.863013,2025-05-25 03:41:24.986916,0 days 00:00:13.123903,AdamW,0.015773796938223297,,,0.0001630366045855374,,,,5,,,0.0018436024742138585,,PRUNED
590,590,33.333333333333336,2025-05-25 03:41:25.046839,2025-05-25 03:41:38.616661,0 days 00:00:13.569822,AdamW,0.0545224741447881,,,0.0005246935133210934,,,,3,,,0.0028275015569702135,,PRUNED
591,591,43.75,2025-05-25 03:41:38.678949,2025-05-25 03:41:52.158540,0 days 00:00:13.479591,AdamW,0.0422094076755338,,,9.386244260836763e-05,,,,2,,,0.005149500606490477,,PRUNED
592,592,35.416666666666664,2025-05-25 03:41:52.221591,2025-05-25 03:42:05.669395,0 days 00:00:13.447804,AdamW,0.3541885216853977,,,0.0002512882945767287,,,,1,,,0.0022465966010693527,,PRUNED
593,593,39.583333333333336,2025-05-25 03:42:05.725838,2025-05-25 03:42:19.115815,0 days 00:00:13.389977,AdamW,0.027471530609285442,,,0.000297294388251319,,,,4,,,0.0019645181049908612,,PRUNED
594,594,33.333333333333336,2025-05-25 03:42:19.178423,2025-05-25 03:42:32.591960,0 days 00:00:13.413537,AdamW,0.21385675766467233,,,0.0001283007238884267,,,,3,,,0.002589973448711684,,PRUNED
595,595,39.583333333333336,2025-05-25 03:42:32.655349,2025-05-25 03:42:46.083922,0 days 00:00:13.428573,AdamW,0.07812452419152156,,,0.00021869725159999405,,,,2,,,0.003282224995885311,,PRUNED
596,596,33.333333333333336,2025-05-25 03:42:46.153541,2025-05-25 03:42:58.294913,0 days 00:00:12.141372,AdamW,0.01240591381605875,,,0.00037748181847580345,,,,3,,,0.0021612290343598103,,PRUNED
597,597,33.333333333333336,2025-05-25 03:42:58.357479,2025-05-25 03:43:11.952904,0 days 00:00:13.595425,Adam,0.03445107820688073,,0.03861300050170774,,,,,0,,1.1340844196001945,,,PRUNED
598,598,33.333333333333336,2025-05-25 03:43:12.024157,2025-05-25 03:43:25.148248,0 days 00:00:13.124091,AdamW,0.05017981185710774,,,0.00017437951066421434,,,,5,,,0.0014757899372313096,,PRUNED
599,599,33.333333333333336,2025-05-25 03:43:25.210019,2025-05-25 03:43:38.477727,0 days 00:00:13.267708,AdamW,0.14494147876613972,,,0.002144533125824699,,,,4,,,0.0016808169342220258,,PRUNED
600,600,35.416666666666664,2025-05-25 03:43:38.539827,2025-05-25 03:43:51.429936,0 days 00:00:12.890109,AdamW,0.022944390052155428,,,0.0003085857695390686,,,,6,,,0.0035741635859924473,,PRUNED
601,601,52.083333333333336,2025-05-25 03:43:51.503135,2025-05-25 03:44:24.852939,0 days 00:00:33.349804,AdamW,0.4742847497051345,,,0.0002306953113420188,,,,1,,,0.0029034586174466457,,COMPLETE
602,602,37.5,2025-05-25 03:44:24.909754,2025-05-25 03:44:38.372489,0 days 00:00:13.462735,AdamW,0.00023041741385678577,,,0.00045743009964488456,,,,2,,,0.002430418819853624,,PRUNED
603,603,35.416666666666664,2025-05-25 03:44:38.435103,2025-05-25 03:44:50.709556,0 days 00:00:12.274453,AdamW,0.06240365171521114,,,0.00010889333723957161,,,,2,,,0.005573508839431877,,PRUNED
604,604,31.25,2025-05-25 03:44:50.748864,2025-05-25 03:45:04.622571,0 days 00:00:13.873707,AdamW,0.04128035497448715,,,3.8194050909635645e-05,,,,4,,,0.0009218476392601028,,PRUNED
605,605,47.916666666666664,2025-05-25 03:45:04.684902,2025-05-25 03:45:34.161382,0 days 00:00:29.476480,AdamW,0.029405543572035113,,,0.0002843540109812825,,,,1,,,0.0018358074061884412,,COMPLETE
606,606,31.25,2025-05-25 03:45:34.201670,2025-05-25 03:45:40.187986,0 days 00:00:05.986316,AdamW,0.08515359677405777,,,0.00019332325235256944,,,,7,,,0.002046865781764769,,PRUNED
607,607,52.083333333333336,2025-05-25 03:45:40.225042,2025-05-25 03:46:04.243512,0 days 00:00:24.018470,AdamW,0.10356406841953744,,,0.00035501412018806,,,,3,,,0.0005217852909433705,,COMPLETE
608,608,29.166666666666668,2025-05-25 03:46:04.302594,2025-05-25 03:46:15.733485,0 days 00:00:11.430891,AdamW,0.013292834550315272,,,1.2880146538629598e-05,,,,1,,,0.001267178603526585,,PRUNED
609,609,31.25,2025-05-25 03:46:15.774175,2025-05-25 03:46:21.417979,0 days 00:00:05.643804,AdamW,0.06770426649627556,,,0.00015629187919238315,,,,5,,,0.0022937900728999903,,PRUNED
610,610,56.25,2025-05-25 03:46:21.471475,2025-05-25 03:46:49.520599,0 days 00:00:28.049124,Adadelta,0.045456434235180185,0.10300129287087002,,,,,,6,0.02713107972923731,,,,COMPLETE
611,611,52.083333333333336,2025-05-25 03:46:49.579040,2025-05-25 03:47:18.915405,0 days 00:00:29.336365,Adadelta,0.022344907529591725,0.10239720283648027,,,,,,6,0.026745115093728254,,,,COMPLETE
612,612,33.333333333333336,2025-05-25 03:47:18.972922,2025-05-25 03:47:31.816457,0 days 00:00:12.843535,Adadelta,0.033926377837824914,0.028258084280899272,,,,,,6,0.06889121125468672,,,,PRUNED
613,613,35.416666666666664,2025-05-25 03:47:31.873408,2025-05-25 03:47:44.597471,0 days 00:00:12.724063,Adam,0.03899884601102854,,1.9649660240872775e-05,,,,,6,,0.010353747743398,,,PRUNED
614,614,33.333333333333336,2025-05-25 03:47:44.653625,2025-05-25 03:47:57.281291,0 days 00:00:12.627666,Adadelta,0.1319682036275835,3.690304090471262,,,,,,6,0.016278705493863226,,,,PRUNED
615,615,39.583333333333336,2025-05-25 03:47:57.337574,2025-05-25 03:48:09.034709,0 days 00:00:11.697135,Adadelta,0.048673234835750555,0.035923737257383535,,,,,,6,0.2344738285008447,,,,PRUNED
616,616,33.333333333333336,2025-05-25 03:48:09.091401,2025-05-25 03:48:20.943924,0 days 00:00:11.852523,Adadelta,0.01747181225867361,1.8606941994259063,,,,,,6,0.010727497382487605,,,,PRUNED
617,617,31.25,2025-05-25 03:48:20.981835,2025-05-25 03:48:25.903988,0 days 00:00:04.922153,Adadelta,0.007794253114537995,0.016248674763226695,,,,,,6,0.5143972522866747,,,,PRUNED
618,618,33.333333333333336,2025-05-25 03:48:25.941831,2025-05-25 03:48:31.611575,0 days 00:00:05.669744,Adadelta,0.028348829172607767,0.4375333429126237,,,,,,6,0.11547728299208733,,,,PRUNED
619,619,33.333333333333336,2025-05-25 03:48:31.669434,2025-05-25 03:48:37.502984,0 days 00:00:05.833550,Adadelta,0.043701562037922866,0.1033649837231776,,,,,,6,0.04964932771944341,,,,PRUNED
620,620,45.833333333333336,2025-05-25 03:48:37.551799,2025-05-25 03:49:01.080442,0 days 00:00:23.528643,Adadelta,0.200432471708911,0.011266505874578567,,,,,,6,0.9143116216635208,,,,PRUNED
621,621,35.416666666666664,2025-05-25 03:49:01.118659,2025-05-25 03:49:06.984936,0 days 00:00:05.866277,Adadelta,0.021178467910138856,0.2703630903164991,,,,,,6,0.018061314187799892,,,,PRUNED
622,622,31.25,2025-05-25 03:49:07.041715,2025-05-25 03:49:18.483556,0 days 00:00:11.441841,Adadelta,0.032232647684364464,0.17086848884281544,,,,,,7,0.11098388736936045,,,,PRUNED
623,623,,2025-05-25 03:49:18.538133,2025-05-25 03:49:26.524387,0 days 00:00:07.986254,SGD,0.047466341686421186,,,,0.011270110926118031,90.9479125606974,False,7,,,,1.6316124565799728,PRUNED
624,624,33.333333333333336,2025-05-25 03:49:26.561934,2025-05-25 03:49:32.990893,0 days 00:00:06.428959,Adadelta,0.08795968065562143,95.94694398459542,,,,,,4,1.8655271637774689,,,,PRUNED
625,625,35.416666666666664,2025-05-25 03:49:33.030682,2025-05-25 03:49:39.422944,0 days 00:00:06.392262,AdamW,0.16727409116457065,,,0.000598278206243724,,,,4,,,0.004189645558799522,,PRUNED
626,626,37.5,2025-05-25 03:49:39.484980,2025-05-25 03:49:52.891524,0 days 00:00:13.406544,AdamW,0.11632463246713771,,,0.0004145634925559366,,,,5,,,0.0030602988204608294,,PRUNED
627,627,37.5,2025-05-25 03:49:52.955814,2025-05-25 03:50:00.293551,0 days 00:00:07.337737,AdamW,0.0071870328043154765,,,0.00048098242475174216,,,,3,,,0.0007993507113790618,,PRUNED
628,628,43.75,2025-05-25 03:50:00.335084,2025-05-25 03:50:09.159633,0 days 00:00:08.824549,AdamW,0.4135442862812826,,,6.332583929777213e-05,,,,0,,,0.002699595108420228,,PRUNED
629,629,39.583333333333336,2025-05-25 03:50:09.222645,2025-05-25 03:50:22.607350,0 days 00:00:13.384705,AdamW,0.057054320687779464,,,7.439504698465898e-05,,,,5,,,0.0035144686106145244,,PRUNED
630,630,39.583333333333336,2025-05-25 03:50:22.667173,2025-05-25 03:50:36.106154,0 days 00:00:13.438981,AdamW,0.07475643171411787,,,0.00031995482212860874,,,,1,,,0.00480005747327462,,PRUNED
631,631,37.5,2025-05-25 03:50:36.169232,2025-05-25 03:50:48.311047,0 days 00:00:12.141815,AdamW,0.03672282621975399,,,0.0007733368115355935,,,,4,,,0.001086251942555908,,PRUNED
632,632,33.333333333333336,2025-05-25 03:50:48.373516,2025-05-25 03:51:00.926327,0 days 00:00:12.552811,AdamW,0.022665074974417686,,,4.3432737363400895e-05,,,,6,,,0.006327828551663583,,PRUNED
633,633,29.166666666666668,2025-05-25 03:51:00.979026,2025-05-25 03:51:13.024621,0 days 00:00:12.045595,AdamW,0.3118170702099996,,,9.29437507365257e-05,,,,6,,,0.004023459357990931,,PRUNED
634,634,43.75,2025-05-25 03:51:13.085596,2025-05-25 03:51:43.587888,0 days 00:00:30.502292,AdamW,0.18396122872191253,,,0.0002547271312513817,,,,4,,,0.002866974502487294,,COMPLETE
635,635,29.166666666666668,2025-05-25 03:51:43.628134,2025-05-25 03:51:48.249791,0 days 00:00:04.621657,AdamW,0.09669697107558739,,,5.5335116079044087e-05,,,,8,,,0.002532203214942034,,PRUNED
636,636,47.916666666666664,2025-05-25 03:51:48.284126,2025-05-25 03:52:19.393282,0 days 00:00:31.109156,AdamW,0.045967799718576646,,,0.0005508376010501394,,,,1,,,0.0023754485232277806,,COMPLETE
637,637,,2025-05-25 03:52:19.452415,2025-05-25 03:52:28.355163,0 days 00:00:08.902748,SGD,0.013895540313372281,,,,1.111739731930823e-05,6.968148827341828,True,7,,,,0.43233368619836066,PRUNED
638,638,33.333333333333336,2025-05-25 03:52:28.389130,2025-05-25 03:52:33.747940,0 days 00:00:05.358810,AdamW,0.03308435192824474,,,0.00038937668129130916,,,,1,,,0.0037707577579357324,,PRUNED
639,639,47.916666666666664,2025-05-25 03:52:33.789973,2025-05-25 03:52:53.083507,0 days 00:00:19.293534,AdamW,0.15269553541616143,,,0.00031805182874121646,,,,3,,,0.0031327555228695867,,COMPLETE
640,640,33.333333333333336,2025-05-25 03:52:53.124629,2025-05-25 03:53:02.452141,0 days 00:00:09.327512,Adadelta,0.05843300079703888,5.528286305894311,,,,,,5,5.341502941034822,,,,PRUNED
641,641,35.416666666666664,2025-05-25 03:53:02.510738,2025-05-25 03:53:15.403087,0 days 00:00:12.892349,AdamW,0.025499920824011174,,,0.0002593070296501082,,,,3,,,0.00518526453141461,,PRUNED
642,642,33.333333333333336,2025-05-25 03:53:15.443099,2025-05-25 03:53:22.029330,0 days 00:00:06.586231,AdamW,0.07255087922958874,,,0.0010934200723446404,,,,1,,,0.002705510028157031,,PRUNED
643,643,35.416666666666664,2025-05-25 03:53:22.073651,2025-05-25 03:53:28.715695,0 days 00:00:06.642044,AdamW,0.17498298293474424,,,0.0006812742130092094,,,,3,,,0.00023924262309081088,,PRUNED
644,644,31.25,2025-05-25 03:53:28.779602,2025-05-25 03:53:42.240756,0 days 00:00:13.461154,AdamW,0.012188290082266387,,,0.0001286860742541591,,,,4,,,0.0002898311296017255,,PRUNED
645,645,35.416666666666664,2025-05-25 03:53:42.302720,2025-05-25 03:53:55.066524,0 days 00:00:12.763804,AdamW,0.048875511899161346,,,1.9622031398635956e-05,,,,6,,,0.007086944447590351,,PRUNED
646,646,33.333333333333336,2025-05-25 03:53:55.123714,2025-05-25 03:54:08.667550,0 days 00:00:13.543836,Adam,0.0003943815976091506,,5.9701409840651105e-05,,,,,1,,2.036357152923625,,,PRUNED
647,647,41.666666666666664,2025-05-25 03:54:08.732647,2025-05-25 03:54:22.126096,0 days 00:00:13.393449,AdamW,0.036609488367436,,,0.0003472190735662279,,,,5,,,0.001559232287107181,,PRUNED
648,648,31.25,2025-05-25 03:54:22.212869,2025-05-25 03:54:35.505821,0 days 00:00:13.292952,AdamW,0.02136313826131092,,,0.00021451899300286786,,,,4,,,0.0013979620565823896,,PRUNED
649,649,33.333333333333336,2025-05-25 03:54:35.567840,2025-05-25 03:54:48.443209,0 days 00:00:12.875369,AdamW,0.08434364650364264,,,0.0002732600565210446,,,,0,,,0.00020643164339941998,,PRUNED
650,650,39.583333333333336,2025-05-25 03:54:48.509918,2025-05-25 03:55:01.893943,0 days 00:00:13.384025,AdamW,0.10501022878341859,,,0.0004804787374624173,,,,4,,,0.0044789097699460345,,PRUNED
651,651,39.583333333333336,2025-05-25 03:55:01.956435,2025-05-25 03:55:15.766074,0 days 00:00:13.809639,AdamW,0.04146371586045898,,,8.527500205176613e-05,,,,1,,,0.002185725992260085,,PRUNED
652,652,50.0,2025-05-25 03:55:15.829844,2025-05-25 03:55:49.138024,0 days 00:00:33.308180,AdamW,0.0597598935786878,,,0.00041533228480800143,,,,3,,,0.001710226772002231,,COMPLETE
653,653,35.416666666666664,2025-05-25 03:55:49.195092,2025-05-25 03:56:01.823445,0 days 00:00:12.628353,AdamW,0.02839803469293581,,,0.00011320106374629996,,,,5,,,0.0011669982838759805,,PRUNED
654,654,33.333333333333336,2025-05-25 03:56:01.883985,2025-05-25 03:56:15.589537,0 days 00:00:13.705552,Adadelta,0.239691169616216,45.03934697392788,,,,,,1,0.438990014686653,,,,PRUNED
655,655,35.416666666666664,2025-05-25 03:56:15.650556,2025-05-25 03:56:28.293571,0 days 00:00:12.643015,AdamW,0.01692442243395465,,,0.00022689960952658944,,,,6,,,0.0057123358379443,,PRUNED
656,656,29.166666666666668,2025-05-25 03:56:28.350442,2025-05-25 03:56:40.973864,0 days 00:00:12.623422,AdamW,0.07117020815639925,,,0.00016719570010912082,,,,3,,,0.0032626090089502785,,PRUNED
657,657,39.583333333333336,2025-05-25 03:56:41.040619,2025-05-25 03:56:53.175857,0 days 00:00:12.135238,AdamW,0.0500442906074484,,,0.0003120276287649111,,,,4,,,0.002569302480586644,,PRUNED
658,658,35.416666666666664,2025-05-25 03:56:53.217037,2025-05-25 03:57:04.570540,0 days 00:00:11.353503,AdamW,0.03346584708813305,,,0.00019117527148532676,,,,1,,,0.002386579705949637,,PRUNED
659,659,37.5,2025-05-25 03:57:04.633611,2025-05-25 03:57:32.826622,0 days 00:00:28.193011,AdamW,0.09017274540011022,,,0.0002693313704225604,,,,6,,,0.0019500871343072004,,COMPLETE
660,660,33.333333333333336,2025-05-25 03:57:32.880399,2025-05-25 03:57:45.427283,0 days 00:00:12.546884,AdamW,0.008821104084166342,,,0.0003594139488527741,,,,5,,,0.0029157875993597905,,PRUNED
661,661,,2025-05-25 03:57:45.488406,2025-05-25 03:57:58.184954,0 days 00:00:12.696548,SGD,0.0655290532063642,,,,0.002050461780296698,4.403484174771755,False,2,,,,47.577556949949916,PRUNED
662,662,33.333333333333336,2025-05-25 03:57:58.242661,2025-05-25 03:58:11.707541,0 days 00:00:13.464880,AdamW,0.16094921797127695,,,0.005084302964770962,,,,4,,,0.002152622403024848,,PRUNED
663,663,31.25,2025-05-25 03:58:11.770453,2025-05-25 03:58:19.285783,0 days 00:00:07.515330,AdamW,0.02710770660621392,,,0.0001276579865219661,,,,7,,,0.0027024247356854264,,PRUNED
664,664,43.75,2025-05-25 03:58:19.338571,2025-05-25 03:58:32.236764,0 days 00:00:12.898193,AdamW,0.040939559743173384,,,0.00022813500575444247,,,,3,,,0.0009638629882356276,,PRUNED
665,665,37.5,2025-05-25 03:58:32.278075,2025-05-25 03:58:40.224228,0 days 00:00:07.946153,AdamW,0.05455118238574201,,,0.0001586322151085314,,,,4,,,0.004875892093814165,,PRUNED
666,666,43.75,2025-05-25 03:58:40.285632,2025-05-25 03:59:01.466671,0 days 00:00:21.181039,AdamW,0.017059913772578778,,,0.00042834708416230694,,,,1,,,0.0006908928536320275,,COMPLETE
667,667,37.5,2025-05-25 03:59:01.506803,2025-05-25 03:59:06.965038,0 days 00:00:05.458235,Adadelta,0.07796130892499505,0.6646089025939272,,,,,,6,0.0443300062853159,,,,PRUNED
668,668,33.333333333333336,2025-05-25 03:59:07.021314,2025-05-25 03:59:20.352922,0 days 00:00:13.331608,AdamW,0.03788985030638944,,,0.00029742923330844503,,,,3,,,0.0034185646095294267,,PRUNED
669,669,33.333333333333336,2025-05-25 03:59:20.416328,2025-05-25 03:59:29.311447,0 days 00:00:08.895119,AdamW,0.023515033991326754,,,0.0005794914015110714,,,,1,,,0.0018225696915011623,,PRUNED
670,670,43.75,2025-05-25 03:59:29.352172,2025-05-25 03:59:34.810529,0 days 00:00:05.458357,Adam,0.12418694376170902,,0.0003252792471220227,,,,,2,,0.017744461807098967,,,PRUNED
671,671,33.333333333333336,2025-05-25 03:59:34.850748,2025-05-25 03:59:40.455607,0 days 00:00:05.604859,AdamW,0.19011295023133756,,,0.00020137225543198224,,,,3,,,0.001485840247755143,,PRUNED
672,672,33.333333333333336,2025-05-25 03:59:40.496290,2025-05-25 03:59:48.410694,0 days 00:00:07.914404,AdamW,0.007342503348295407,,,0.0002538337150156994,,,,8,,,0.0012368587068481718,,PRUNED
673,673,33.333333333333336,2025-05-25 03:59:48.501005,2025-05-25 04:00:01.266533,0 days 00:00:12.765528,AdamW,0.14449781415394464,,,0.00034234338281767805,,,,6,,,0.0023152657762992163,,PRUNED
674,674,33.333333333333336,2025-05-25 04:00:01.325194,2025-05-25 04:00:14.762389,0 days 00:00:13.437195,AdamW,0.048698396941110556,,,9.861834815341644e-05,,,,2,,,0.0030410568981239666,,PRUNED
675,675,33.333333333333336,2025-05-25 04:00:14.826322,2025-05-25 04:00:27.944770,0 days 00:00:13.118448,AdamW,0.06061285117193448,,,7.107156486623884e-05,,,,5,,,0.002022752360417808,,PRUNED
676,676,25.0,2025-05-25 04:00:28.005815,2025-05-25 04:00:41.502355,0 days 00:00:13.496540,AdamW,0.10915882908634947,,,0.00014098486479851728,,,,4,,,0.0013288867926429023,,PRUNED
677,677,31.25,2025-05-25 04:00:41.567270,2025-05-25 04:00:55.111502,0 days 00:00:13.544232,AdamW,0.02905581811665098,,,0.00018027962646594565,,,,1,,,0.0008785211152245073,,PRUNED
678,678,33.333333333333336,2025-05-25 04:00:55.174720,2025-05-25 04:01:08.546219,0 days 00:00:13.371499,AdamW,0.09657141881436708,,,0.00047228232193280623,,,,3,,,0.0016346471369446793,,PRUNED
679,679,41.666666666666664,2025-05-25 04:01:08.609446,2025-05-25 04:01:22.099798,0 days 00:00:13.490352,AdamW,0.07927187385118242,,,0.00023731429660903442,,,,2,,,0.0026203454952807266,,PRUNED
680,680,31.25,2025-05-25 04:01:22.162908,2025-05-25 04:01:35.791592,0 days 00:00:13.628684,AdamW,0.01712645767631194,,,0.0003758727610203182,,,,2,,,0.002352500181865623,,PRUNED
681,681,33.333333333333336,2025-05-25 04:01:35.854801,2025-05-25 04:01:49.458550,0 days 00:00:13.603749,Adadelta,0.04209247799469934,18.47177146719938,,,,,,0,1.1937055884534507,,,,PRUNED
682,682,43.75,2025-05-25 04:01:49.520617,2025-05-25 04:02:03.059411,0 days 00:00:13.538794,AdamW,0.028035345284005385,,,0.00028845000177759065,,,,4,,,0.0028863840837459733,,PRUNED
683,683,29.166666666666668,2025-05-25 04:02:03.121661,2025-05-25 04:02:15.756610,0 days 00:00:12.634949,AdamW,0.06890138562177357,,,0.00020985133891715825,,,,6,,,0.0001759161962843039,,PRUNED
684,684,41.666666666666664,2025-05-25 04:02:15.814158,2025-05-25 04:02:28.709651,0 days 00:00:12.895493,AdamW,0.05425802867801548,,,2.828775423002795e-05,,,,6,,,0.0018397437277303994,,PRUNED
685,685,37.5,2025-05-25 04:02:28.766906,2025-05-25 04:02:40.811870,0 days 00:00:12.044964,SGD,0.00857408758354115,,,,0.00012671371195974355,0.9157240206642143,False,7,,,,6.0734247218302055,PRUNED
686,686,43.75,2025-05-25 04:02:40.865420,2025-05-25 04:02:54.079266,0 days 00:00:13.213846,AdamW,0.04348399079548385,,,0.00011036203748120369,,,,5,,,0.005414748336149397,,PRUNED
687,687,39.583333333333336,2025-05-25 04:02:54.140678,2025-05-25 04:03:07.911250,0 days 00:00:13.770572,AdamW,0.09133674170973677,,,0.00016123197473585075,,,,1,,,0.004538927743111406,,PRUNED
688,688,33.333333333333336,2025-05-25 04:03:07.974927,2025-05-25 04:03:21.274465,0 days 00:00:13.299538,AdamW,0.03303737729075379,,,0.00032271352773063683,,,,4,,,0.0020293167512272377,,PRUNED
689,689,33.333333333333336,2025-05-25 04:03:21.339705,2025-05-25 04:03:34.875001,0 days 00:00:13.535296,AdamW,0.02143958168917954,,,0.0009317627098464563,,,,1,,,0.002473145414169032,,PRUNED
