,number,value,datetime_start,datetime_complete,duration,params_algorithm,params_dropout_rate,params_lr_Adadelta,params_lr_Adam,params_lr_AdamW,params_lr_SGD,params_momentum_SGD,params_nesterov_SGD,params_suggested_freeze,params_weight_decay_Adadelta,params_weight_decay_Adam,params_weight_decay_AdamW,params_weight_decay_SGD,state
923,923,39.583333333333336,2025-05-26 00:36:30.584350,2025-05-26 00:36:43.703500,0 days 00:00:13.119150,AdamW,0.08987649355985876,,,0.00012584084265861517,,,,0,,,0.0012865540982363289,,PRUNED
924,924,33.333333333333336,2025-05-26 00:36:43.769273,2025-05-26 00:36:57.022613,0 days 00:00:13.253340,AdamW,0.1627572623256113,,,0.00039660491893481035,,,,1,,,0.00848315744608107,,PRUNED
925,925,43.75,2025-05-26 00:36:57.088780,2025-05-26 00:37:10.261727,0 days 00:00:13.172947,AdamW,0.18523146085010322,,,0.0003043670902446146,,,,2,,,0.0010433447500153136,,PRUNED
926,926,37.5,2025-05-26 00:37:10.327843,2025-05-26 00:37:23.707261,0 days 00:00:13.379418,AdamW,0.2624812756968162,,,0.0005476710679004746,,,,1,,,0.009908195839067947,,PRUNED
927,927,33.333333333333336,2025-05-26 00:37:23.772709,2025-05-26 00:37:36.677556,0 days 00:00:12.904847,AdamW,0.0698368977209394,,,0.0006822531501436887,,,,1,,,0.0007117892520616937,,PRUNED
928,928,54.166666666666664,2025-05-26 00:37:36.744038,2025-05-26 00:38:09.757678,0 days 00:00:33.013640,AdamW,0.042948328147508694,,,0.00017572710280249157,,,,1,,,0.000916488521280634,,COMPLETE
929,929,35.416666666666664,2025-05-26 00:38:09.817571,2025-05-26 00:38:23.126550,0 days 00:00:13.308979,SGD,0.1423580363132499,,,,0.010618235721840024,0.41672479080218494,True,2,,,,0.5485509998562215,PRUNED
930,930,50.0,2025-05-26 00:38:23.190651,2025-05-26 00:38:36.530885,0 days 00:00:13.340234,AdamW,0.15331720403310528,,,0.0002225550865261636,,,,0,,,0.0016050161691443768,,PRUNED
931,931,39.583333333333336,2025-05-26 00:38:36.597050,2025-05-26 00:38:50.046807,0 days 00:00:13.449757,AdamW,0.12270135748462997,,,0.00034841444186365397,,,,1,,,0.0014521988448852876,,PRUNED
932,932,47.916666666666664,2025-05-26 00:38:50.113656,2025-05-26 00:39:24.021796,0 days 00:00:33.908140,AdamW,0.1825530057351271,,,0.0004782139209212166,,,,1,,,0.0006210647551617134,,COMPLETE
933,933,37.5,2025-05-26 00:39:24.081903,2025-05-26 00:39:37.242780,0 days 00:00:13.160877,AdamW,0.10240304839929082,,,0.00025920235736709446,,,,3,,,0.0023200455677562727,,PRUNED
934,934,43.75,2025-05-26 00:39:37.315685,2025-05-26 00:39:50.584483,0 days 00:00:13.268798,AdamW,0.16557893093539366,,,0.00010429543037885288,,,,1,,,0.001173501648782327,,PRUNED
935,935,35.416666666666664,2025-05-26 00:39:50.651211,2025-05-26 00:40:03.998945,0 days 00:00:13.347734,Adam,0.25238022395181403,,4.395922208422007e-05,,,,,2,,4.573177822647809,,,PRUNED
936,936,31.25,2025-05-26 00:40:04.065666,2025-05-26 00:40:17.478453,0 days 00:00:13.412787,AdamW,0.17177689626727774,,,0.0020676859502645356,,,,1,,,0.000821983000572963,,PRUNED
937,937,66.66666666666667,2025-05-26 00:40:17.544764,2025-05-26 00:40:51.196446,0 days 00:00:33.651682,AdamW,0.2769587323544193,,,0.0004088862034321019,,,,1,,,0.0009972725812597905,,COMPLETE
938,938,33.333333333333336,2025-05-26 00:40:51.256624,2025-05-26 00:41:04.436961,0 days 00:00:13.180337,AdamW,0.30183900027790045,,,0.0005801582238702265,,,,1,,,0.0010131623736114972,,PRUNED
939,939,35.416666666666664,2025-05-26 00:41:04.502854,2025-05-26 00:41:17.984006,0 days 00:00:13.481152,AdamW,0.2881580109048191,,,0.0004414567707649514,,,,1,,,0.0010882713545310742,,PRUNED
940,940,45.833333333333336,2025-05-26 00:41:18.050893,2025-05-26 00:41:31.265731,0 days 00:00:13.214838,AdamW,0.29558362523591714,,,0.00040693362528728604,,,,1,,,0.0010242143063735277,,PRUNED
941,941,37.5,2025-05-26 00:41:31.342622,2025-05-26 00:41:42.893196,0 days 00:00:11.550574,AdamW,0.26197095475073245,,,0.0005320593746337611,,,,8,,,0.0011147918129253646,,PRUNED
942,942,33.333333333333336,2025-05-26 00:41:42.948318,2025-05-26 00:41:56.407857,0 days 00:00:13.459539,AdamW,0.2742482939027453,,,0.0008899302013420236,,,,2,,,0.0009848175859827866,,PRUNED
943,943,33.333333333333336,2025-05-26 00:41:56.474911,2025-05-26 00:42:09.662800,0 days 00:00:13.187889,AdamW,0.2719173124969961,,,0.000692149901315674,,,,0,,,0.0009033066609299386,,PRUNED
944,944,39.583333333333336,2025-05-26 00:42:09.738995,2025-05-26 00:42:22.945348,0 days 00:00:13.206353,AdamW,0.28520746197483215,,,0.0004701718440972244,,,,1,,,0.007134840565397396,,PRUNED
945,945,35.416666666666664,2025-05-26 00:42:23.017676,2025-05-26 00:42:36.152549,0 days 00:00:13.134873,AdamW,0.30646015259365356,,,0.00040245498608058395,,,,1,,,0.0012134979540438593,,PRUNED
946,946,33.333333333333336,2025-05-26 00:42:36.220626,2025-05-26 00:42:49.593542,0 days 00:00:13.372916,AdamW,0.2743744659362601,,,0.0005785195867343831,,,,2,,,0.0009407477104287827,,PRUNED
947,947,52.083333333333336,2025-05-26 00:42:49.659479,2025-05-26 00:43:22.699330,0 days 00:00:33.039851,AdamW,0.29172248506056025,,,0.000357351915897799,,,,1,,,0.0011439075727697364,,COMPLETE
948,948,33.333333333333336,2025-05-26 00:43:22.760799,2025-05-26 00:43:34.844739,0 days 00:00:12.083940,Adadelta,0.2648408404048868,82.18407870182338,,,,,,1,0.1461344371844598,,,,PRUNED
949,949,47.916666666666664,2025-05-26 00:43:34.914171,2025-05-26 00:44:00.989362,0 days 00:00:26.075191,AdamW,0.24135894639305147,,,0.0005014209697171806,,,,2,,,0.0013188850782444876,,COMPLETE
950,950,37.5,2025-05-26 00:44:01.049663,2025-05-26 00:44:13.572148,0 days 00:00:12.522485,AdamW,0.2822480021555829,,,0.0003212856559133942,,,,1,,,0.0008924891331834391,,PRUNED
951,951,45.833333333333336,2025-05-26 00:44:13.638617,2025-05-26 00:44:26.774778,0 days 00:00:13.136161,AdamW,0.2620538099950685,,,0.0004338533557411956,,,,4,,,0.0010838718823528283,,PRUNED
952,952,35.416666666666664,2025-05-26 00:44:26.840728,2025-05-26 00:44:40.033335,0 days 00:00:13.192607,AdamW,0.28533891802469885,,,0.00036716408810364933,,,,1,,,0.00100562454512192,,PRUNED
953,953,45.833333333333336,2025-05-26 00:44:40.099687,2025-05-26 00:44:53.463826,0 days 00:00:13.364139,AdamW,0.2738530766922425,,,0.0006025247185359751,,,,1,,,0.0011870407615919517,,PRUNED
954,954,,2025-05-26 00:44:53.532034,2025-05-26 00:45:04.493400,0 days 00:00:10.961366,SGD,0.2744483500834572,,,,0.05510990463771851,65.9962362727873,False,0,,,,14.597986267883797,PRUNED
955,955,31.25,2025-05-26 00:45:04.558928,2025-05-26 00:45:17.471925,0 days 00:00:12.912997,AdamW,0.25186255486791953,,,0.00030871608309861605,,,,1,,,0.000353723044120924,,PRUNED
956,956,39.583333333333336,2025-05-26 00:45:17.531002,2025-05-26 00:45:26.455580,0 days 00:00:08.924578,AdamW,0.2604647541410783,,,0.0004483629623674248,,,,1,,,0.0013906690813760784,,PRUNED
957,957,52.083333333333336,2025-05-26 00:45:26.518415,2025-05-26 00:45:54.077249,0 days 00:00:27.558834,AdamW,0.24961700997244296,,,0.0003689454223756115,,,,1,,,0.0004598654989373363,,COMPLETE
958,958,41.666666666666664,2025-05-26 00:45:54.134480,2025-05-26 00:46:03.448074,0 days 00:00:09.313594,AdamW,0.3855697854163414,,,0.0007680556774466927,,,,3,,,0.0008929284031972446,,PRUNED
959,959,31.25,2025-05-26 00:46:03.504419,2025-05-26 00:46:12.869171,0 days 00:00:09.364752,Adam,0.07763614303885215,,0.0006419063913057223,,,,,2,,1.841220164942838,,,PRUNED
960,960,35.416666666666664,2025-05-26 00:46:12.929075,2025-05-26 00:46:21.373663,0 days 00:00:08.444588,AdamW,0.29146297856348147,,,0.000538489652632871,,,,0,,,0.000989256382148413,,PRUNED
961,961,45.833333333333336,2025-05-26 00:46:21.433638,2025-05-26 00:46:30.725948,0 days 00:00:09.292310,AdamW,0.02420536453574229,,,0.0001489700663109658,,,,1,,,0.0008085004166691006,,PRUNED
962,962,50.0,2025-05-26 00:46:30.783458,2025-05-26 00:46:40.144668,0 days 00:00:09.361210,AdamW,0.19844355401653424,,,0.0002939144747940737,,,,2,,,0.0013168606934464016,,PRUNED
963,963,52.083333333333336,2025-05-26 00:46:40.197883,2025-05-26 00:47:06.738189,0 days 00:00:26.540306,AdamW,0.05386970397369297,,,0.00042699397769479207,,,,1,,,0.00014639574140125567,,COMPLETE
964,964,33.333333333333336,2025-05-26 00:47:06.790568,2025-05-26 00:47:15.340669,0 days 00:00:08.550101,AdamW,0.19134352904206003,,,0.000660429250857338,,,,1,,,0.0008584405421498409,,PRUNED
965,965,60.416666666666664,2025-05-26 00:47:15.401319,2025-05-26 00:47:41.815740,0 days 00:00:26.414421,AdamW,0.26609481838886356,,,0.0004991551154689854,,,,1,,,0.001532743562634246,,COMPLETE
966,966,31.25,2025-05-26 00:47:41.871412,2025-05-26 00:47:51.317484,0 days 00:00:09.446072,AdamW,0.266064677384612,,,0.0006126499247410147,,,,1,,,0.00121792931430317,,PRUNED
967,967,33.333333333333336,2025-05-26 00:47:51.375168,2025-05-26 00:48:00.712601,0 days 00:00:09.337433,AdamW,0.11289827211401676,,,0.0009879615158561417,,,,1,,,0.0018743090237282284,,PRUNED
968,968,37.5,2025-05-26 00:48:00.769618,2025-05-26 00:48:09.764352,0 days 00:00:08.994734,AdamW,0.24129468243416072,,,0.0007454287894089726,,,,1,,,0.0016553784772533897,,PRUNED
969,969,33.333333333333336,2025-05-26 00:48:09.824354,2025-05-26 00:48:18.420416,0 days 00:00:08.596062,AdamW,0.2604713243419653,,,0.0004720259517222178,,,,0,,,0.001693957488811969,,PRUNED
970,970,39.583333333333336,2025-05-26 00:48:18.480137,2025-05-26 00:48:27.976411,0 days 00:00:09.496274,AdamW,0.2539708704360059,,,0.0005543998900926966,,,,2,,,0.0014402092044764505,,PRUNED
971,971,33.333333333333336,2025-05-26 00:48:28.034436,2025-05-26 00:48:37.192198,0 days 00:00:09.157762,AdamW,0.23584455251832992,,,0.0005486767865889012,,,,1,,,0.0015839369048372797,,PRUNED
972,972,31.25,2025-05-26 00:48:37.246018,2025-05-26 00:48:46.052530,0 days 00:00:08.806512,Adadelta,0.24574422496744774,0.01773902024633831,,,,,,3,1.7086767797114835,,,,PRUNED
973,973,39.583333333333336,2025-05-26 00:48:46.111619,2025-05-26 00:48:54.990216,0 days 00:00:08.878597,AdamW,0.27731049754032366,,,0.0004963952602783065,,,,2,,,0.001514165874549482,,PRUNED
974,974,29.166666666666668,2025-05-26 00:48:55.050098,2025-05-26 00:49:05.331658,0 days 00:00:10.281560,AdamW,0.12828809653510262,,,0.0006638202138165329,,,,1,,,0.0015014708274477954,,PRUNED
975,975,47.916666666666664,2025-05-26 00:49:05.389627,2025-05-26 00:49:14.511163,0 days 00:00:09.121536,AdamW,0.19001050255164417,,,0.00041077299115075343,,,,5,,,0.001773415790457125,,PRUNED
976,976,50.0,2025-05-26 00:49:14.564593,2025-05-26 00:49:41.130636,0 days 00:00:26.566043,AdamW,0.1846845852909672,,,0.000496774203983505,,,,1,,,0.0014924771740010088,,COMPLETE
977,977,33.333333333333336,2025-05-26 00:49:41.184942,2025-05-26 00:49:50.242415,0 days 00:00:09.057473,AdamW,0.1318809190384387,,,0.03473422116577573,,,,2,,,0.0018740012160057987,,PRUNED
978,978,33.333333333333336,2025-05-26 00:49:50.303953,2025-05-26 00:49:58.723714,0 days 00:00:08.419761,AdamW,0.2706947169692659,,,0.0007569271827254972,,,,1,,,0.0012725352944791923,,PRUNED
979,979,68.75,2025-05-26 00:49:58.784093,2025-05-26 00:50:25.374234,0 days 00:00:26.590141,AdamW,0.19565239113779648,,,0.00038766038206124333,,,,1,,,0.006250319485931633,,COMPLETE
980,980,35.416666666666664,2025-05-26 00:50:25.430313,2025-05-26 00:50:34.893427,0 days 00:00:09.463114,AdamW,0.20446069610751677,,,0.00035608766935776604,,,,1,,,0.007274857152897657,,PRUNED
981,981,,2025-05-26 00:50:34.951233,2025-05-26 00:50:44.066831,0 days 00:00:09.115598,SGD,0.1938628469494513,,,,5.946147442751813e-05,44.83727897533031,True,1,,,,0.052731590647566565,PRUNED
982,982,37.5,2025-05-26 00:50:44.119181,2025-05-26 00:50:53.063868,0 days 00:00:08.944687,AdamW,0.20859137960408192,,,0.000367547757066151,,,,1,,,0.007425978980879118,,PRUNED
983,983,41.666666666666664,2025-05-26 00:50:53.123790,2025-05-26 00:51:01.745539,0 days 00:00:08.621749,AdamW,0.19962766954255906,,,0.0004099993744818191,,,,1,,,0.00600695466976207,,PRUNED
984,984,45.833333333333336,2025-05-26 00:51:01.805363,2025-05-26 00:51:10.884152,0 days 00:00:09.078789,AdamW,0.1850790719915159,,,0.00012404705004246088,,,,1,,,0.00543425417782638,,PRUNED
985,985,66.66666666666667,2025-05-26 00:51:10.940865,2025-05-26 00:51:37.305528,0 days 00:00:26.364663,AdamW,0.22299091599168147,,,0.00031402164177836,,,,1,,,0.007769518698402953,,COMPLETE
986,986,33.333333333333336,2025-05-26 00:51:37.360620,2025-05-26 00:51:46.468437,0 days 00:00:09.107817,Adam,0.21581681114647897,,0.004799672694599944,,,,,1,,0.051059099541320166,,,PRUNED
987,987,41.666666666666664,2025-05-26 00:51:46.527021,2025-05-26 00:51:55.675468,0 days 00:00:09.148447,AdamW,0.23541811372342503,,,0.0002937204161574753,,,,1,,,0.006434323645617831,,PRUNED
988,988,41.666666666666664,2025-05-26 00:51:55.737211,2025-05-26 00:52:21.729545,0 days 00:00:25.992334,AdamW,0.22458746357724363,,,0.00025173178312045725,,,,1,,,0.006549939443357568,,COMPLETE
989,989,39.583333333333336,2025-05-26 00:52:21.785889,2025-05-26 00:52:30.376341,0 days 00:00:08.590452,AdamW,0.2203224692521774,,,0.00032015437850561234,,,,1,,,0.008569210784164076,,PRUNED
990,990,33.333333333333336,2025-05-26 00:52:30.437030,2025-05-26 00:52:39.979129,0 days 00:00:09.542099,AdamW,0.22473778170001213,,,0.00020688839855430194,,,,1,,,0.007948996404366936,,PRUNED
991,991,41.666666666666664,2025-05-26 00:52:40.036598,2025-05-26 00:52:49.284464,0 days 00:00:09.247866,AdamW,0.21946969493396076,,,0.00027109821747875354,,,,1,,,0.0077406734649786025,,PRUNED
992,992,37.5,2025-05-26 00:52:49.337647,2025-05-26 00:52:58.228212,0 days 00:00:08.890565,AdamW,0.20655926702626515,,,0.0003380120410165132,,,,1,,,0.007548758023808537,,PRUNED
993,993,43.75,2025-05-26 00:52:58.288094,2025-05-26 00:53:06.852325,0 days 00:00:08.564231,AdamW,0.23249417803360872,,,0.00017767383149680234,,,,1,,,0.007595355086018933,,PRUNED
994,994,37.5,2025-05-26 00:53:06.912690,2025-05-26 00:53:16.318560,0 days 00:00:09.405870,AdamW,0.2001163122685866,,,0.0003288034641421373,,,,1,,,0.00803177719205213,,PRUNED
995,995,43.75,2025-05-26 00:53:16.377664,2025-05-26 00:53:25.552972,0 days 00:00:09.175308,AdamW,0.2056361818175269,,,0.00026256815099095224,,,,1,,,0.008126648702515782,,PRUNED
996,996,45.833333333333336,2025-05-26 00:53:25.606748,2025-05-26 00:53:34.346008,0 days 00:00:08.739260,AdamW,0.2255420652358386,,,0.00029596673683545245,,,,1,,,0.006212682837281927,,PRUNED
997,997,43.75,2025-05-26 00:53:34.406421,2025-05-26 00:53:43.288363,0 days 00:00:08.881942,AdamW,0.2006992579227939,,,0.0002215664930313497,,,,1,,,0.008335351850139403,,PRUNED
998,998,33.333333333333336,2025-05-26 00:53:43.348634,2025-05-26 00:53:52.622655,0 days 00:00:09.274021,Adadelta,0.21777265656288225,0.2362609939205396,,,,,,4,45.782772029813664,,,,PRUNED
999,999,37.5,2025-05-26 00:53:52.678905,2025-05-26 00:54:01.835343,0 days 00:00:09.156438,AdamW,0.21183602715853173,,,0.00038320501103860565,,,,1,,,0.00689379440139523,,PRUNED
