,number,value,datetime_start,datetime_complete,duration,params_algorithm,params_dropout_rate,params_lr_Adadelta,params_lr_Adam,params_lr_AdamW,params_lr_SGD,params_momentum_SGD,params_nesterov_SGD,params_suggested_freeze,params_weight_decay_Adadelta,params_weight_decay_Adam,params_weight_decay_AdamW,params_weight_decay_SGD,state
345,345,37.5,2025-05-25 22:25:12.149229,2025-05-25 22:25:21.011462,0 days 00:00:08.862233,AdamW,0.17011359567344186,,,0.0006133932373670521,,,,2,,,0.001081622105671754,,PRUNED
346,346,43.75,2025-05-25 22:25:21.067168,2025-05-25 22:25:29.851564,0 days 00:00:08.784396,AdamW,0.19131853196787776,,,0.00037508792159754933,,,,1,,,0.0005256469120306523,,PRUNED
347,347,37.5,2025-05-25 22:25:29.907992,2025-05-25 22:25:39.113831,0 days 00:00:09.205839,AdamW,0.2809618092772543,,,0.00019506194248752293,,,,1,,,0.0013355143027229035,,PRUNED
348,348,33.333333333333336,2025-05-25 22:25:39.166874,2025-05-25 22:25:48.203426,0 days 00:00:09.036552,AdamW,0.41084250023529034,,,0.000767216175910462,,,,1,,,0.0009575332069699338,,PRUNED
349,349,31.25,2025-05-25 22:25:48.259476,2025-05-25 22:25:56.818582,0 days 00:00:08.559106,AdamW,0.1291794433603515,,,0.000536543395734972,,,,2,,,0.0016979204677841355,,PRUNED
350,350,35.416666666666664,2025-05-25 22:25:56.852906,2025-05-25 22:26:05.850868,0 days 00:00:08.997962,AdamW,0.16434297332320383,,,0.0002812514787400555,,,,0,,,0.0007666507310604878,,PRUNED
351,351,37.5,2025-05-25 22:26:05.905252,2025-05-25 22:26:14.233256,0 days 00:00:08.328004,AdamW,0.18322826756124072,,,0.0004426690043826396,,,,6,,,0.0004796664556187138,,PRUNED
352,352,41.666666666666664,2025-05-25 22:26:14.279512,2025-05-25 22:26:22.569609,0 days 00:00:08.290097,AdamW,0.20429695482720334,,,0.0002466825010046238,,,,1,,,0.0006364646998559863,,PRUNED
353,353,39.583333333333336,2025-05-25 22:26:22.624717,2025-05-25 22:26:31.633727,0 days 00:00:09.009010,AdamW,0.19608023520996795,,,0.00034813694882079784,,,,1,,,0.0010534656740068006,,PRUNED
354,354,37.5,2025-05-25 22:26:31.690795,2025-05-25 22:26:40.716063,0 days 00:00:09.025268,AdamW,0.1473391501669801,,,0.00015825770883049145,,,,1,,,0.00087640438043922,,PRUNED
355,355,35.416666666666664,2025-05-25 22:26:40.750196,2025-05-25 22:26:49.600254,0 days 00:00:08.850058,AdamW,0.16187027667427806,,,0.0002177694873964943,,,,1,,,0.0005652571892728345,,PRUNED
356,356,39.583333333333336,2025-05-25 22:26:49.655579,2025-05-25 22:26:58.055610,0 days 00:00:08.400031,AdamW,0.26272946377193823,,,0.0005203593683223802,,,,1,,,0.0030266103363535846,,PRUNED
357,357,47.916666666666664,2025-05-25 22:26:58.110837,2025-05-25 22:27:07.426982,0 days 00:00:09.316145,AdamW,0.17520328940269247,,,0.00030358578119874007,,,,1,,,0.0012225949137419467,,PRUNED
358,358,45.833333333333336,2025-05-25 22:27:07.480448,2025-05-25 22:27:16.587200,0 days 00:00:09.106752,AdamW,0.13438656728658868,,,0.0003934954035591591,,,,0,,,0.0008125096014714526,,PRUNED
359,359,41.666666666666664,2025-05-25 22:27:16.637156,2025-05-25 22:27:24.984242,0 days 00:00:08.347086,AdamW,0.18427848509853173,,,0.0002624319951200735,,,,2,,,0.0009695179799557131,,PRUNED
360,360,33.333333333333336,2025-05-25 22:27:25.018988,2025-05-25 22:27:34.116909,0 days 00:00:09.097921,Adadelta,0.20856385008852812,42.5115610540811,,,,,,1,12.252510435319419,,,,PRUNED
361,361,33.333333333333336,2025-05-25 22:27:34.152068,2025-05-25 22:27:43.215543,0 days 00:00:09.063475,AdamW,0.12326254763312863,,,0.0004662541971689884,,,,1,,,0.0010997448122224364,,PRUNED
362,362,37.5,2025-05-25 22:27:43.269000,2025-05-25 22:27:51.962156,0 days 00:00:08.693156,AdamW,0.4596817587369985,,,0.00011558843215407794,,,,2,,,0.001428660514712742,,PRUNED
363,363,41.666666666666664,2025-05-25 22:27:52.016486,2025-05-25 22:28:00.439173,0 days 00:00:08.422687,AdamW,0.15610352820742956,,,0.00034486169905834443,,,,1,,,0.0006817594077897607,,PRUNED
364,364,35.416666666666664,2025-05-25 22:28:00.494795,2025-05-25 22:28:09.803940,0 days 00:00:09.309145,AdamW,0.1720386602009802,,,0.00020394158767213496,,,,2,,,0.0007663055555150883,,PRUNED
365,365,33.333333333333336,2025-05-25 22:28:09.857182,2025-05-25 22:28:18.982902,0 days 00:00:09.125720,AdamW,0.27650672620062294,,,0.0006532470480948573,,,,1,,,0.0009349799879604034,,PRUNED
366,366,37.5,2025-05-25 22:28:19.033729,2025-05-25 22:28:27.717806,0 days 00:00:08.684077,AdamW,0.2942928577441454,,,0.00014850915789563598,,,,1,,,0.0012806952247332159,,PRUNED
367,367,41.666666666666664,2025-05-25 22:28:27.773854,2025-05-25 22:28:36.665122,0 days 00:00:08.891268,AdamW,0.14273207804744434,,,0.0004084041047048097,,,,1,,,0.0003542119127981324,,PRUNED
368,368,47.916666666666664,2025-05-25 22:28:36.721310,2025-05-25 22:28:45.807483,0 days 00:00:09.086173,AdamW,0.24837434081986104,,,0.0002920248407280414,,,,0,,,0.0011533398419341446,,PRUNED
369,369,31.25,2025-05-25 22:28:45.859104,2025-05-25 22:28:54.740877,0 days 00:00:08.881773,AdamW,0.19490503332364176,,,0.00048790065950557655,,,,2,,,0.0008432407861752707,,PRUNED
370,370,22.916666666666668,2025-05-25 22:28:54.803356,2025-05-25 22:29:02.965037,0 days 00:00:08.161681,AdamW,0.16357504655087754,,,1.3474582839900119e-05,,,,1,,,0.0015791548084798197,,PRUNED
371,371,33.333333333333336,2025-05-25 22:29:03.021048,2025-05-25 22:29:12.162153,0 days 00:00:09.141105,AdamW,0.1790076524861886,,,0.0011118347540805713,,,,1,,,0.0009974751529486083,,PRUNED
372,372,33.333333333333336,2025-05-25 22:29:12.196104,2025-05-25 22:29:21.641710,0 days 00:00:09.445606,AdamW,0.1519688015382934,,,0.007344751477097251,,,,1,,,0.0007340166909058061,,PRUNED
373,373,39.583333333333336,2025-05-25 22:29:21.692258,2025-05-25 22:29:29.940410,0 days 00:00:08.248152,AdamW,0.19163613787675013,,,0.00018187561253929467,,,,5,,,0.0005797983748056871,,PRUNED
374,374,43.75,2025-05-25 22:29:29.975592,2025-05-25 22:29:39.011339,0 days 00:00:09.035747,AdamW,0.25867104581641653,,,0.0003596479361507858,,,,1,,,0.0008841273201511284,,PRUNED
375,375,31.25,2025-05-25 22:29:39.040677,2025-05-25 22:29:48.414063,0 days 00:00:09.373386,AdamW,0.22257264699073506,,,6.129255875038496e-05,,,,1,,,0.0010349211696147403,,PRUNED
376,376,41.666666666666664,2025-05-25 22:29:48.468196,2025-05-25 22:29:57.309543,0 days 00:00:08.841347,AdamW,0.11561381843147858,,,0.00024403260193413162,,,,0,,,0.0006431776995841712,,PRUNED
377,377,39.583333333333336,2025-05-25 22:29:57.365738,2025-05-25 22:30:05.910345,0 days 00:00:08.544607,AdamW,0.16513909678547822,,,0.0005528624719285138,,,,2,,,0.0011831853959367365,,PRUNED
378,378,39.583333333333336,2025-05-25 22:30:05.951596,2025-05-25 22:30:15.239244,0 days 00:00:09.287648,AdamW,0.21196297592091198,,,9.381368031670647e-05,,,,1,,,0.0057017669136233615,,PRUNED
379,379,33.333333333333336,2025-05-25 22:30:15.272715,2025-05-25 22:30:24.759934,0 days 00:00:09.487219,AdamW,0.49411115700649355,,,0.00030653205485793464,,,,1,,,0.0018417453632683875,,PRUNED
380,380,43.75,2025-05-25 22:30:24.815920,2025-05-25 22:30:33.160431,0 days 00:00:08.344511,AdamW,0.2671536486051585,,,0.0007678047899614104,,,,1,,,0.0013072507464946099,,PRUNED
381,381,33.333333333333336,2025-05-25 22:30:33.216221,2025-05-25 22:30:42.697090,0 days 00:00:09.480869,Adadelta,0.17453741801705447,0.8966719710785276,,,,,,1,0.3574784718207711,,,,PRUNED
382,382,33.333333333333336,2025-05-25 22:30:42.749959,2025-05-25 22:30:52.183286,0 days 00:00:09.433327,AdamW,0.3585163703759502,,,0.00042357673827944273,,,,2,,,0.0008100773831422039,,PRUNED
383,383,33.333333333333336,2025-05-25 22:30:52.215328,2025-05-25 22:31:00.673751,0 days 00:00:08.458423,Adam,0.13566559014170324,,0.03499929600938238,,,,,1,,17.482330717522764,,,PRUNED
384,384,37.5,2025-05-25 22:31:00.730089,2025-05-25 22:31:09.664926,0 days 00:00:08.934837,AdamW,0.3175165300665807,,,0.00023623905514599716,,,,0,,,0.0009390253429459968,,PRUNED
385,385,33.333333333333336,2025-05-25 22:31:09.704172,2025-05-25 22:31:19.312967,0 days 00:00:09.608795,AdamW,0.1863860291101656,,,0.02013354128303172,,,,1,,,0.0010895872617588168,,PRUNED
386,386,29.166666666666668,2025-05-25 22:31:19.367624,2025-05-25 22:31:27.808817,0 days 00:00:08.441193,AdamW,0.14541419394225388,,,0.00018677933452896639,,,,1,,,0.0007052960659270158,,PRUNED
387,387,45.833333333333336,2025-05-25 22:31:27.866450,2025-05-25 22:31:36.046754,0 days 00:00:08.180304,AdamW,0.15448586311996806,,,0.0003556369796700687,,,,2,,,0.0014301754516181581,,PRUNED
388,388,39.583333333333336,2025-05-25 22:31:36.100224,2025-05-25 22:31:44.381184,0 days 00:00:08.280960,AdamW,0.16856526602701336,,,0.0001273962150473703,,,,2,,,0.0008710961893780125,,PRUNED
389,389,33.333333333333336,2025-05-25 22:31:44.438123,2025-05-25 22:31:52.957649,0 days 00:00:08.519526,AdamW,0.2000355613752312,,,0.0006370675951032587,,,,4,,,0.001024874456319571,,PRUNED
390,390,31.25,2025-05-25 22:31:53.011037,2025-05-25 22:32:01.426666,0 days 00:00:08.415629,AdamW,0.23787032091150975,,,0.0002859134666629506,,,,1,,,0.0007489610321044942,,PRUNED
391,391,43.75,2025-05-25 22:32:01.480562,2025-05-25 22:32:27.437748,0 days 00:00:25.957186,AdamW,0.25291581822879994,,,0.00047663744730618105,,,,1,,,0.0005089857063562925,,COMPLETE
392,392,33.333333333333336,2025-05-25 22:32:27.489165,2025-05-25 22:32:36.183489,0 days 00:00:08.694324,AdamW,0.1816717526128429,,,0.0003891296135189136,,,,1,,,0.0004382488916842971,,PRUNED
393,393,41.666666666666664,2025-05-25 22:32:36.217601,2025-05-25 22:32:44.771704,0 days 00:00:08.554103,AdamW,0.157576976877339,,,0.00021687000084453346,,,,0,,,0.0011901479878843272,,PRUNED
394,394,33.333333333333336,2025-05-25 22:32:44.825339,2025-05-25 22:32:53.441468,0 days 00:00:08.616129,Adam,0.27130400759553075,,0.005484412765081209,,,,,1,,46.50538070785785,,,PRUNED
395,395,45.833333333333336,2025-05-25 22:32:53.492141,2025-05-25 22:33:01.618920,0 days 00:00:08.126779,AdamW,0.2879573773261687,,,0.00032403709682212345,,,,1,,,0.0009175442840608441,,PRUNED
396,396,43.75,2025-05-25 22:33:01.673527,2025-05-25 22:33:10.216939,0 days 00:00:08.543412,AdamW,0.12849004044653325,,,0.00014976984824310923,,,,1,,,0.00107070647958138,,PRUNED
397,397,56.25,2025-05-25 22:33:10.252429,2025-05-25 22:33:35.640680,0 days 00:00:25.388251,AdamW,0.17235854242856613,,,0.00026672758917215873,,,,2,,,0.0008129676987815859,,COMPLETE
398,398,37.5,2025-05-25 22:33:35.689284,2025-05-25 22:33:44.134116,0 days 00:00:08.444832,AdamW,0.19235455750729602,,,0.0005454821418297736,,,,1,,,0.000642294130498835,,PRUNED
399,399,37.5,2025-05-25 22:33:44.191638,2025-05-25 22:33:53.144364,0 days 00:00:08.952726,AdamW,0.20932577068563857,,,0.0004473458822454349,,,,1,,,0.001344478873169978,,PRUNED
400,400,41.666666666666664,2025-05-25 22:33:53.188010,2025-05-25 22:34:01.750674,0 days 00:00:08.562664,AdamW,0.1441910319866621,,,0.00018728044405323354,,,,2,,,0.0009646730025198708,,PRUNED
401,401,37.5,2025-05-25 22:34:01.784133,2025-05-25 22:34:10.233730,0 days 00:00:08.449597,AdamW,0.17949876360710745,,,0.0003523800053975377,,,,0,,,0.0005804160220125662,,PRUNED
402,402,68.75,2025-05-25 22:34:10.284847,2025-05-25 22:34:35.850940,0 days 00:00:25.566093,AdamW,0.16233441799239098,,,0.0002557193559538277,,,,1,,,0.003988493481109817,,COMPLETE
403,403,50.0,2025-05-25 22:34:35.900480,2025-05-25 22:35:01.792128,0 days 00:00:25.891648,AdamW,0.15678626279083577,,,0.00023924501716484495,,,,1,,,0.006277670428231822,,PRUNED
404,404,33.333333333333336,2025-05-25 22:35:01.835663,2025-05-25 22:35:08.939989,0 days 00:00:07.104326,AdamW,0.1655671500700876,,,0.00027887420304135654,,,,9,,,0.005408518688376603,,PRUNED
405,405,33.333333333333336,2025-05-25 22:35:08.987758,2025-05-25 22:35:17.397921,0 days 00:00:08.410163,Adadelta,0.165220096348341,0.011456742077306712,,,,,,1,0.032414492604492404,,,,PRUNED
406,406,45.833333333333336,2025-05-25 22:35:17.447891,2025-05-25 22:35:25.906775,0 days 00:00:08.458884,AdamW,0.17804333611061424,,,0.00019469126928866795,,,,1,,,0.0022282261781145065,,PRUNED
407,407,45.833333333333336,2025-05-25 22:35:25.960054,2025-05-25 22:35:34.349289,0 days 00:00:08.389235,AdamW,0.19923431238336958,,,0.00022955830066841845,,,,2,,,0.0044092748185995375,,PRUNED
408,408,43.75,2025-05-25 22:35:34.403292,2025-05-25 22:35:42.836018,0 days 00:00:08.432726,AdamW,0.18545008062729174,,,0.00015505529218004846,,,,1,,,0.0038852949283458478,,PRUNED
409,409,29.166666666666668,2025-05-25 22:35:42.884338,2025-05-25 22:35:51.434490,0 days 00:00:08.550152,Adam,0.15173002501886154,,1.74579028964292e-05,,,,,1,,13.76473304020688,,,PRUNED
410,410,33.333333333333336,2025-05-25 22:35:51.488222,2025-05-25 22:35:59.973502,0 days 00:00:08.485280,AdamW,0.1674290149979027,,,0.0003141052577714554,,,,0,,,0.0015670779964639815,,PRUNED
411,411,33.333333333333336,2025-05-25 22:36:00.028692,2025-05-25 22:36:08.514114,0 days 00:00:08.485422,AdamW,0.22116669132158737,,,0.0002539630125976762,,,,1,,,0.0038394619818789585,,PRUNED
412,412,,2025-05-25 22:36:08.565289,2025-05-25 22:36:15.184433,0 days 00:00:06.619144,SGD,0.30151484267056555,,,,3.819549281359784e-05,86.62241997194496,False,2,,,,36.582481529019475,PRUNED
413,413,33.333333333333336,2025-05-25 22:36:15.217935,2025-05-25 22:36:23.642073,0 days 00:00:08.424138,AdamW,0.18864907173409418,,,0.0003856925230660341,,,,1,,,0.0007481967100223869,,PRUNED
414,414,39.583333333333336,2025-05-25 22:36:23.694962,2025-05-25 22:36:32.296550,0 days 00:00:08.601588,AdamW,0.2476873535276749,,,0.00030263599311583896,,,,1,,,0.0008541967078774291,,PRUNED
415,415,37.5,2025-05-25 22:36:32.350716,2025-05-25 22:36:40.803864,0 days 00:00:08.453148,AdamW,0.15924956864568598,,,0.0001759098073413229,,,,1,,,0.0004622755505746536,,PRUNED
416,416,41.666666666666664,2025-05-25 22:36:40.855551,2025-05-25 22:36:49.361913,0 days 00:00:08.506362,AdamW,0.25997300773539617,,,0.00011757045562704948,,,,2,,,0.0006665958495103851,,PRUNED
417,417,43.75,2025-05-25 22:36:49.416157,2025-05-25 22:36:57.814470,0 days 00:00:08.398313,AdamW,0.17451603034398394,,,0.00021500244391131382,,,,1,,,0.001154846918203985,,PRUNED
418,418,64.58333333333333,2025-05-25 22:36:57.867946,2025-05-25 22:37:23.547760,0 days 00:00:25.679814,AdamW,0.20248223557657488,,,0.0003664751830452586,,,,1,,,0.007329117794304648,,COMPLETE
419,419,35.416666666666664,2025-05-25 22:37:23.597905,2025-05-25 22:37:32.868015,0 days 00:00:09.270110,AdamW,0.21025428449520586,,,0.0009296091336934736,,,,1,,,0.00016220678834117912,,PRUNED
420,420,35.416666666666664,2025-05-25 22:37:32.925662,2025-05-25 22:37:42.143662,0 days 00:00:09.218000,AdamW,0.20266338816836799,,,0.0004220670304276809,,,,1,,,0.008504961070725677,,PRUNED
421,421,33.333333333333336,2025-05-25 22:37:42.197417,2025-05-25 22:37:51.505779,0 days 00:00:09.308362,AdamW,0.23482659305848602,,,0.0005978539770487372,,,,0,,,0.009541766253366798,,PRUNED
422,422,33.333333333333336,2025-05-25 22:37:51.538429,2025-05-25 22:37:59.815020,0 days 00:00:08.276591,Adam,0.1973049466429811,,0.0018732958603730676,,,,,2,,4.012816250249315,,,PRUNED
423,423,39.583333333333336,2025-05-25 22:37:59.870959,2025-05-25 22:38:22.689971,0 days 00:00:22.819012,AdamW,0.27949504715220636,,,0.0003624062660953966,,,,1,,,0.00808790811667865,,PRUNED
424,424,37.5,2025-05-25 22:38:22.725993,2025-05-25 22:38:31.954476,0 days 00:00:09.228483,AdamW,0.21665356350998266,,,0.0004921106783884675,,,,4,,,0.005314502715749544,,PRUNED
425,425,33.333333333333336,2025-05-25 22:38:32.007324,2025-05-25 22:38:40.865895,0 days 00:00:08.858571,AdamW,0.20571587505105726,,,0.0003282317575844882,,,,2,,,0.0046610264864626804,,PRUNED
426,426,39.583333333333336,2025-05-25 22:38:40.900959,2025-05-25 22:38:49.385901,0 days 00:00:08.484942,AdamW,0.22728822888729563,,,4.2768873437235666e-05,,,,1,,,0.0035903543293381323,,PRUNED
427,427,45.833333333333336,2025-05-25 22:38:49.441718,2025-05-25 22:38:58.324634,0 days 00:00:08.882916,AdamW,0.1408677057279008,,,0.0004533121133116449,,,,1,,,0.006954171480670723,,PRUNED
428,428,41.666666666666664,2025-05-25 22:38:58.378605,2025-05-25 22:39:07.946568,0 days 00:00:09.567963,AdamW,0.19404447201777808,,,0.0002813965864948335,,,,1,,,0.001269274296497142,,PRUNED
429,429,33.333333333333336,2025-05-25 22:39:08.000103,2025-05-25 22:39:16.913498,0 days 00:00:08.913395,AdamW,0.18806617793088834,,,0.00040258628031418844,,,,1,,,0.00040459720823549675,,PRUNED
430,430,33.333333333333336,2025-05-25 22:39:16.969623,2025-05-25 22:39:24.603567,0 days 00:00:07.633944,Adadelta,0.38491658140807594,5.254714198531209,,,,,,6,18.79431451771608,,,,PRUNED
431,431,33.333333333333336,2025-05-25 22:39:24.653600,2025-05-25 22:39:34.133647,0 days 00:00:09.480047,AdamW,0.24278155185543457,,,0.0006403088297009305,,,,1,,,0.0058086709784774294,,PRUNED
432,432,50.0,2025-05-25 22:39:34.187659,2025-05-25 22:40:00.588287,0 days 00:00:26.400628,AdamW,0.14806917512983947,,,0.00036170219498360764,,,,2,,,0.001463242656670289,,PRUNED
433,433,39.583333333333336,2025-05-25 22:40:00.646492,2025-05-25 22:40:10.100205,0 days 00:00:09.453713,AdamW,0.27274063462631903,,,0.00013679437385728978,,,,0,,,0.007358150915757927,,PRUNED
434,434,35.416666666666664,2025-05-25 22:40:10.154438,2025-05-25 22:40:19.393497,0 days 00:00:09.239059,AdamW,0.15799542371099862,,,0.00025167284062354043,,,,1,,,0.005111349607780543,,PRUNED
435,435,45.833333333333336,2025-05-25 22:40:19.444705,2025-05-25 22:40:27.933347,0 days 00:00:08.488642,AdamW,0.17645836090090328,,,0.0005340135239208361,,,,1,,,0.001124755196016991,,PRUNED
436,436,33.333333333333336,2025-05-25 22:40:27.990335,2025-05-25 22:40:36.810814,0 days 00:00:08.820479,Adam,0.25556638645945234,,0.0030378023805530075,,,,,3,,0.5082773113676522,,,PRUNED
437,437,37.5,2025-05-25 22:40:36.869946,2025-05-25 22:40:45.841449,0 days 00:00:08.971503,AdamW,0.2187797375483984,,,0.0003181760774143729,,,,1,,,0.0009538959975573159,,PRUNED
438,438,,2025-05-25 22:40:45.896097,2025-05-25 22:40:53.385073,0 days 00:00:07.488976,SGD,0.1843627283824603,,,,0.0004329619707086882,85.46428287815365,False,2,,,,4.360490871163026,PRUNED
439,439,33.333333333333336,2025-05-25 22:40:53.419894,2025-05-25 22:41:01.891266,0 days 00:00:08.471372,AdamW,0.196019976660746,,,0.0047902753782370884,,,,1,,,0.0013299132206599114,,PRUNED
440,440,31.25,2025-05-25 22:41:01.947134,2025-05-25 22:41:10.944033,0 days 00:00:08.996899,AdamW,0.1683681943724433,,,0.0002093198389290359,,,,1,,,0.0005349047325952005,,PRUNED
441,441,31.25,2025-05-25 22:41:10.998159,2025-05-25 22:41:19.973565,0 days 00:00:08.975406,AdamW,0.20803107729058992,,,0.0007767864470085645,,,,0,,,0.0010509365955343696,,PRUNED
442,442,45.833333333333336,2025-05-25 22:41:20.024926,2025-05-25 22:41:28.916701,0 days 00:00:08.891775,AdamW,0.14550443280934972,,,0.0001768881592960475,,,,1,,,0.0028926478891112255,,PRUNED
443,443,45.833333333333336,2025-05-25 22:41:28.972232,2025-05-25 22:41:37.343177,0 days 00:00:08.370945,AdamW,0.13527234575521668,,,0.00043801892779998455,,,,2,,,0.004279265274301102,,PRUNED
444,444,41.666666666666664,2025-05-25 22:41:37.398363,2025-05-25 22:41:46.351481,0 days 00:00:08.953118,AdamW,0.26570074797380927,,,0.0001008457222209735,,,,1,,,0.0008816438818758479,,PRUNED
445,445,45.833333333333336,2025-05-25 22:41:46.405429,2025-05-25 22:41:55.324902,0 days 00:00:08.919473,AdamW,0.1793254002052764,,,0.0002701070742494898,,,,3,,,0.0012048580886603857,,PRUNED
446,446,33.333333333333336,2025-05-25 22:41:55.378050,2025-05-25 22:42:04.305019,0 days 00:00:08.926969,AdamW,0.1891543478063418,,,0.0005217878904427122,,,,1,,,0.0003609276082560522,,PRUNED
447,447,45.833333333333336,2025-05-25 22:42:04.361583,2025-05-25 22:42:30.269991,0 days 00:00:25.908408,AdamW,0.16360404346872426,,,0.0003728725522080833,,,,1,,,0.0024670831235836773,,PRUNED
448,448,41.666666666666664,2025-05-25 22:42:30.304924,2025-05-25 22:42:38.572573,0 days 00:00:08.267649,AdamW,0.029380942846874092,,,0.0003132884457809991,,,,4,,,0.0017538480870459997,,PRUNED
449,449,33.333333333333336,2025-05-25 22:42:38.625856,2025-05-25 22:42:47.835290,0 days 00:00:09.209434,Adam,0.47075619579897887,,0.008851964047736693,,,,,0,,29.161091149125156,,,PRUNED
450,450,43.75,2025-05-25 22:42:47.891969,2025-05-25 22:42:56.550514,0 days 00:00:08.658545,AdamW,0.15168359367976314,,,0.0002288952086503546,,,,5,,,0.0008010308826768455,,PRUNED
451,451,31.25,2025-05-25 22:42:56.601593,2025-05-25 22:43:05.323842,0 days 00:00:08.722249,AdamW,0.2872076489941615,,,0.0013482958422598686,,,,1,,,0.003251633377932364,,PRUNED
452,452,31.25,2025-05-25 22:43:05.437626,2025-05-25 22:43:13.675111,0 days 00:00:08.237485,AdamW,0.1995047728973466,,,0.00015367316746550758,,,,2,,,0.0009857320976394462,,PRUNED
453,453,39.583333333333336,2025-05-25 22:43:13.709441,2025-05-25 22:43:22.852525,0 days 00:00:09.143084,AdamW,0.17185775714533888,,,0.00041395391302653914,,,,1,,,0.001531498565648905,,PRUNED
454,454,33.333333333333336,2025-05-25 22:43:22.909934,2025-05-25 22:43:32.090241,0 days 00:00:09.180307,AdamW,0.22768886737461555,,,0.0005850983689151087,,,,1,,,0.001971008809265449,,PRUNED
455,455,33.333333333333336,2025-05-25 22:43:32.123796,2025-05-25 22:43:41.245150,0 days 00:00:09.121354,Adadelta,0.24857771609005166,0.11958267055430558,,,,,,2,2.2843976548733664,,,,PRUNED
456,456,41.666666666666664,2025-05-25 22:43:41.294435,2025-05-25 22:43:49.700938,0 days 00:00:08.406503,AdamW,0.16086220957349234,,,0.00027159554786876524,,,,1,,,0.007581421744552936,,PRUNED
457,457,33.333333333333336,2025-05-25 22:43:49.756262,2025-05-25 22:43:58.671375,0 days 00:00:08.915113,AdamW,0.1815670365923778,,,0.0007167530022458764,,,,1,,,0.0009124826824876311,,PRUNED
458,458,56.25,2025-05-25 22:43:58.728121,2025-05-25 22:44:25.422362,0 days 00:00:26.694241,AdamW,0.3456620678795934,,,0.0003400101272196807,,,,1,,,0.0006090156081262019,,COMPLETE
459,459,47.916666666666664,2025-05-25 22:44:25.473514,2025-05-25 22:44:34.755757,0 days 00:00:09.282243,AdamW,0.21459686546288478,,,0.00020321558748618386,,,,2,,,0.006408963808949034,,PRUNED
460,460,35.416666666666664,2025-05-25 22:44:34.810786,2025-05-25 22:44:43.377090,0 days 00:00:08.566304,AdamW,0.14012661612426267,,,0.00047018642343411333,,,,7,,,0.0010970868607956404,,PRUNED
