,number,value,datetime_start,datetime_complete,duration,params_algorithm,params_dropout_rate,params_lr_Adadelta,params_lr_Adam,params_lr_AdamW,params_lr_SGD,params_momentum_SGD,params_nesterov_SGD,params_suggested_freeze,params_weight_decay_Adadelta,params_weight_decay_Adam,params_weight_decay_AdamW,params_weight_decay_SGD,state
690,690,37.5,2025-05-25 04:03:34.940543,2025-05-25 04:03:48.454259,0 days 00:00:13.513716,AdamW,0.06401249284709606,,,0.0002826820869464632,,,,3,,,0.003794035740909351,,PRUNED
691,691,41.666666666666664,2025-05-25 04:03:48.518962,2025-05-25 04:04:02.219743,0 days 00:00:13.700781,AdamW,0.03446325183885528,,,0.0002427610379008692,,,,3,,,0.0021359371680350035,,PRUNED
692,692,35.416666666666664,2025-05-25 04:04:02.282841,2025-05-25 04:04:15.555817,0 days 00:00:13.272976,AdamW,0.015127982420124206,,,0.00038023260902231493,,,,4,,,0.006350483228328196,,PRUNED
693,693,37.5,2025-05-25 04:04:15.620418,2025-05-25 04:04:28.235046,0 days 00:00:12.614628,AdamW,0.0012654645048102917,,,0.00013994671278171162,,,,5,,,0.002633598940064288,,PRUNED
694,694,33.333333333333336,2025-05-25 04:04:28.295392,2025-05-25 04:04:38.670313,0 days 00:00:10.374921,Adam,0.08113304069383638,,0.05520362309386875,,,,,2,,56.916445238208134,,,PRUNED
695,695,33.333333333333336,2025-05-25 04:04:38.901598,2025-05-25 04:04:44.868228,0 days 00:00:05.966630,Adadelta,0.17347284049567233,8.946190506052924,,,,,,1,0.18360564018989717,,,,PRUNED
696,696,43.75,2025-05-25 04:04:44.929577,2025-05-25 04:04:58.257438,0 days 00:00:13.327861,AdamW,0.0515045207928774,,,0.0005253748324161404,,,,4,,,0.003171650153952864,,PRUNED
697,697,33.333333333333336,2025-05-25 04:04:58.319846,2025-05-25 04:05:08.351468,0 days 00:00:10.031622,AdamW,0.024357955368712936,,,0.0001975431134938341,,,,6,,,0.0016862206703655588,,PRUNED
698,698,35.416666666666664,2025-05-25 04:05:08.389103,2025-05-25 04:05:15.178356,0 days 00:00:06.789253,AdamW,0.03958002458290419,,,0.00044074037687877966,,,,2,,,0.0010935669080529235,,PRUNED
699,699,33.333333333333336,2025-05-25 04:05:15.219373,2025-05-25 04:05:22.689459,0 days 00:00:07.470086,AdamW,0.012371953307601075,,,0.00024418316464961586,,,,1,,,0.0022389424682547053,,PRUNED
700,700,31.25,2025-05-25 04:05:22.753448,2025-05-25 04:05:36.167406,0 days 00:00:13.413958,AdamW,0.05967425608101054,,,0.0003340471153404467,,,,3,,,0.0014932832007313707,,PRUNED
701,701,37.5,2025-05-25 04:05:36.231498,2025-05-25 04:05:49.668899,0 days 00:00:13.437401,AdamW,0.04553734794469472,,,8.206165847701263e-05,,,,2,,,0.0028141979905136607,,PRUNED
702,702,39.583333333333336,2025-05-25 04:05:49.733739,2025-05-25 04:06:03.080935,0 days 00:00:13.347196,AdamW,0.0720066983824365,,,0.00016798783738354773,,,,5,,,0.00012601131196486075,,PRUNED
703,703,33.333333333333336,2025-05-25 04:06:03.141834,2025-05-25 04:06:15.730067,0 days 00:00:12.588233,AdamW,0.20895424642208507,,,0.0001223342488016199,,,,6,,,0.0019054846808771815,,PRUNED
704,704,33.333333333333336,2025-05-25 04:06:15.788585,2025-05-25 04:06:27.753732,0 days 00:00:11.965147,AdamW,0.03138900282944404,,,0.0006655656224218829,,,,9,,,0.00034450458096251305,,PRUNED
705,705,39.583333333333336,2025-05-25 04:06:27.807197,2025-05-25 04:06:41.388546,0 days 00:00:13.581349,AdamW,0.02114717931615322,,,0.00027803802335413453,,,,1,,,0.005906161491726052,,PRUNED
706,706,31.25,2025-05-25 04:06:41.453064,2025-05-25 04:06:53.764672,0 days 00:00:12.311608,AdamW,0.22820324375890175,,,0.00020150471032189367,,,,7,,,0.0034493229223158117,,PRUNED
707,707,33.333333333333336,2025-05-25 04:06:53.818723,2025-05-25 04:07:07.334160,0 days 00:00:13.515437,Adadelta,0.34228387921818604,0.2745115284000014,,,,,,2,43.25347787519101,,,,PRUNED
708,708,39.583333333333336,2025-05-25 04:07:07.396856,2025-05-25 04:07:19.081669,0 days 00:00:11.684813,AdamW,0.13855664595279435,,,0.0003267139936021619,,,,0,,,0.00248252711185412,,PRUNED
709,709,35.416666666666664,2025-05-25 04:07:19.145846,2025-05-25 04:07:32.854878,0 days 00:00:13.709032,AdamW,0.380947460832508,,,0.0004145074240045855,,,,4,,,0.0017579027756393756,,PRUNED
710,710,,2025-05-25 04:07:32.918935,2025-05-25 04:07:44.422674,0 days 00:00:11.503739,SGD,0.1018808590406511,,,,2.504451574184874e-05,77.27272412471976,True,3,,,,57.14620480405895,PRUNED
711,711,41.666666666666664,2025-05-25 04:07:44.488667,2025-05-25 04:07:57.971709,0 days 00:00:13.483042,AdamW,0.08418692919318965,,,0.00023046871871280715,,,,2,,,0.004081286847287042,,PRUNED
712,712,22.916666666666668,2025-05-25 04:07:58.036360,2025-05-25 04:08:11.508964,0 days 00:00:13.472604,AdamW,0.0006822526362371996,,,0.00010703689923422694,,,,1,,,0.0022298972414787565,,PRUNED
713,713,33.333333333333336,2025-05-25 04:08:11.577424,2025-05-25 04:08:25.164199,0 days 00:00:13.586775,AdamW,0.03532294970263606,,,0.0001452622768296718,,,,4,,,0.0030703967433542627,,PRUNED
714,714,41.666666666666664,2025-05-25 04:08:25.228566,2025-05-25 04:08:38.305331,0 days 00:00:13.076765,AdamW,0.154410769094058,,,0.00018545112031848702,,,,5,,,0.004897815263154337,,PRUNED
715,715,41.666666666666664,2025-05-25 04:08:38.366827,2025-05-25 04:09:11.756656,0 days 00:00:33.389829,AdamW,0.051862885396252556,,,0.0002749365963834427,,,,3,,,0.0019635426214080504,,COMPLETE
716,716,33.333333333333336,2025-05-25 04:09:11.816957,2025-05-25 04:09:25.562506,0 days 00:00:13.745549,AdamW,0.015806073917841622,,,0.0003875245896244599,,,,1,,,0.0013978251395117434,,PRUNED
717,717,33.333333333333336,2025-05-25 04:09:25.627373,2025-05-25 04:09:38.784396,0 days 00:00:13.157023,AdamW,0.026426807813039566,,,0.00022449640045946363,,,,6,,,0.0015692380044397423,,PRUNED
718,718,33.333333333333336,2025-05-25 04:09:38.844066,2025-05-25 04:09:52.353942,0 days 00:00:13.509876,AdamW,0.1193309006492741,,,0.0004900736773726334,,,,5,,,0.007480963687167692,,PRUNED
719,719,45.833333333333336,2025-05-25 04:09:52.416561,2025-05-25 04:10:17.507595,0 days 00:00:25.091034,Adam,0.041799108255360255,,0.00018733553754089497,,,,,2,,0.0710466442943176,,,COMPLETE
720,720,41.666666666666664,2025-05-25 04:10:17.548819,2025-05-25 04:10:25.396535,0 days 00:00:07.847716,AdamW,0.06181511816427514,,,5.3211904734014624e-05,,,,4,,,0.0026830676150733216,,PRUNED
721,721,35.416666666666664,2025-05-25 04:10:25.460759,2025-05-25 04:10:38.212033,0 days 00:00:12.751274,AdamW,0.07155820310940386,,,0.00031378854813079624,,,,3,,,0.002390281904048001,,PRUNED
722,722,43.75,2025-05-25 04:10:38.252345,2025-05-25 04:10:43.832581,0 days 00:00:05.580236,Adadelta,0.08951654045866451,0.0767489801120232,,,,,,2,0.019941056474552656,,,,PRUNED
723,723,37.5,2025-05-25 04:10:43.873086,2025-05-25 04:10:49.083624,0 days 00:00:05.210538,AdamW,0.2931244881006019,,,0.00018140048210900047,,,,6,,,0.002864457405140596,,PRUNED
724,724,33.333333333333336,2025-05-25 04:10:49.121738,2025-05-25 04:10:54.915692,0 days 00:00:05.793954,AdamW,0.010259246287270589,,,0.0002635300927702526,,,,8,,,0.0053892799553994074,,PRUNED
725,725,35.416666666666664,2025-05-25 04:10:54.969418,2025-05-25 04:11:08.279118,0 days 00:00:13.309700,AdamW,0.03107169168265288,,,8.654262664238407e-05,,,,4,,,0.002013928499198938,,PRUNED
726,726,54.166666666666664,2025-05-25 04:11:08.343041,2025-05-25 04:11:42.309228,0 days 00:00:33.966187,AdamW,0.0440235247869045,,,0.00013024013413111024,,,,1,,,0.0010094205858242956,,COMPLETE
727,727,33.333333333333336,2025-05-25 04:11:42.367902,2025-05-25 04:11:56.280348,0 days 00:00:13.912446,AdamW,0.04519593983911163,,,0.00011647220544805612,,,,1,,,0.0009657298824868464,,PRUNED
728,728,33.333333333333336,2025-05-25 04:11:56.396992,2025-05-25 04:12:10.021056,0 days 00:00:13.624064,AdamW,0.3623428555700998,,,9.920550363354086e-05,,,,1,,,0.0008124648652600623,,PRUNED
729,729,37.5,2025-05-25 04:12:10.086312,2025-05-25 04:12:23.721382,0 days 00:00:13.635070,AdamW,0.03933029799919856,,,0.00012984631531932057,,,,1,,,0.0010782140607491488,,PRUNED
730,730,25.0,2025-05-25 04:12:23.786221,2025-05-25 04:12:37.405001,0 days 00:00:13.618780,AdamW,0.05377192669008398,,,6.882049746704996e-05,,,,1,,,0.001026677956232999,,PRUNED
731,731,35.416666666666664,2025-05-25 04:12:37.470129,2025-05-25 04:12:51.172607,0 days 00:00:13.702478,AdamW,0.4852909254163276,,,0.0001460097557876811,,,,1,,,0.0011422572959046303,,PRUNED
732,732,33.333333333333336,2025-05-25 04:12:51.241180,2025-05-25 04:13:04.823697,0 days 00:00:13.582517,AdamW,0.025726298021050444,,,0.023333165169462104,,,,1,,,0.0011973526100964615,,PRUNED
733,733,35.416666666666664,2025-05-25 04:13:04.893423,2025-05-25 04:13:18.360875,0 days 00:00:13.467452,AdamW,0.04952832728985661,,,0.00013041061640749974,,,,1,,,0.0008743226455139666,,PRUNED
734,734,,2025-05-25 04:13:18.425505,2025-05-25 04:13:30.305091,0 days 00:00:11.879586,SGD,0.03290570974924948,,,,0.0007035296740355901,48.74379950629677,True,1,,,,21.40017219693311,PRUNED
735,735,41.666666666666664,2025-05-25 04:13:30.345513,2025-05-25 04:13:43.790705,0 days 00:00:13.445192,AdamW,0.042884169849036834,,,0.00016577701511975604,,,,1,,,0.0009397597212158588,,PRUNED
736,736,39.583333333333336,2025-05-25 04:13:43.855172,2025-05-25 04:13:57.577987,0 days 00:00:13.722815,Adadelta,0.01779394162847351,0.03661909078091047,,,,,,1,0.09970051305741513,,,,PRUNED
737,737,33.333333333333336,2025-05-25 04:13:57.640787,2025-05-25 04:14:11.139015,0 days 00:00:13.498228,AdamW,0.03518651533531987,,,0.00010264439169524342,,,,1,,,0.0010108148607141608,,PRUNED
738,738,33.333333333333336,2025-05-25 04:14:11.209410,2025-05-25 04:14:24.976645,0 days 00:00:13.767235,AdamW,0.05841184056719307,,,0.00015648661781597558,,,,0,,,0.0012382554963546847,,PRUNED
739,739,35.416666666666664,2025-05-25 04:14:25.041801,2025-05-25 04:14:36.899621,0 days 00:00:11.857820,AdamW,0.021784569246502537,,,0.00011895063592371336,,,,7,,,0.0007740090019955971,,PRUNED
740,740,39.583333333333336,2025-05-25 04:14:37.000580,2025-05-25 04:14:50.420747,0 days 00:00:13.420167,AdamW,0.009786556434115832,,,0.00018922246474263485,,,,1,,,0.0012928075907412545,,PRUNED
741,741,31.25,2025-05-25 04:14:50.486714,2025-05-25 04:15:04.072803,0 days 00:00:13.586089,AdamW,0.0466451847770966,,,9.642277203703653e-05,,,,4,,,0.0008701926233384724,,PRUNED
742,742,29.166666666666668,2025-05-25 04:15:04.137582,2025-05-25 04:15:16.724177,0 days 00:00:12.586595,AdamW,0.03106835447620249,,,3.4828622700820194e-05,,,,1,,,0.0017979150459612554,,PRUNED
743,743,33.333333333333336,2025-05-25 04:15:16.789192,2025-05-25 04:15:30.046949,0 days 00:00:13.257757,Adam,0.02409841714949268,,0.0999098170890615,,,,,0,,5.598784586502053,,,PRUNED
744,744,33.333333333333336,2025-05-25 04:15:30.113151,2025-05-25 04:15:42.932218,0 days 00:00:12.819067,AdamW,0.0539871144867579,,,0.0583451544564939,,,,6,,,0.0023076449227582745,,PRUNED
745,745,54.166666666666664,2025-05-25 04:15:42.995342,2025-05-25 04:16:01.971144,0 days 00:00:18.975802,AdamW,0.04174709271333513,,,0.00014686291771745974,,,,4,,,0.0010157773415008153,,COMPLETE
746,746,37.5,2025-05-25 04:16:02.012744,2025-05-25 04:16:10.684725,0 days 00:00:08.671981,AdamW,0.04050423045577556,,,0.00013233166513796206,,,,4,,,0.001036729217086623,,PRUNED
747,747,29.166666666666668,2025-05-25 04:16:10.747912,2025-05-25 04:16:24.032063,0 days 00:00:13.284151,AdamW,0.044838765731365214,,,8.444411053010215e-05,,,,4,,,0.0009094244817399753,,PRUNED
748,748,35.416666666666664,2025-05-25 04:16:24.095207,2025-05-25 04:16:32.460100,0 days 00:00:08.364893,AdamW,0.06106372541885678,,,0.000148847730431105,,,,4,,,0.0010904274058187982,,PRUNED
749,749,39.583333333333336,2025-05-25 04:16:32.502106,2025-05-25 04:16:39.873899,0 days 00:00:07.371793,AdamW,0.03631348490292413,,,0.00012676157095799193,,,,4,,,0.000976597449771218,,PRUNED
750,750,33.333333333333336,2025-05-25 04:16:39.937313,2025-05-25 04:16:53.410647,0 days 00:00:13.473334,Adadelta,0.2602561979245426,2.254929159546381,,,,,,4,7.245696553001958,,,,PRUNED
751,751,39.583333333333336,2025-05-25 04:16:53.472669,2025-05-25 04:17:06.734422,0 days 00:00:13.261753,AdamW,0.05118265744672142,,,0.00010759772371304456,,,,4,,,0.0011138026281457332,,PRUNED
752,752,29.166666666666668,2025-05-25 04:17:06.802510,2025-05-25 04:17:20.396212,0 days 00:00:13.593702,AdamW,0.021213373253595208,,,0.00016613419677524062,,,,4,,,0.0008547334731689472,,PRUNED
753,753,39.583333333333336,2025-05-25 04:17:20.461170,2025-05-25 04:17:33.814321,0 days 00:00:13.353151,AdamW,0.03383860344117832,,,0.00018001860835258242,,,,4,,,0.0010021229118950521,,PRUNED
754,754,39.583333333333336,2025-05-25 04:17:33.877909,2025-05-25 04:17:45.920693,0 days 00:00:12.042784,AdamW,0.046108177377558304,,,0.00021015822692993738,,,,3,,,0.001280607625061943,,PRUNED
755,755,37.5,2025-05-25 04:17:45.985355,2025-05-25 04:17:59.570023,0 days 00:00:13.584668,AdamW,0.000350682561172053,,,0.0001562764269330061,,,,4,,,0.0011082706081329884,,PRUNED
756,756,35.416666666666664,2025-05-25 04:17:59.634983,2025-05-25 04:18:11.564114,0 days 00:00:11.929131,AdamW,0.061213057134535134,,,0.00011383330005035378,,,,3,,,0.0009356027648605489,,PRUNED
757,757,39.583333333333336,2025-05-25 04:18:11.628080,2025-05-25 04:18:24.988571,0 days 00:00:13.360491,AdamW,0.029959649678826316,,,8.865469901099403e-05,,,,4,,,0.0011996726490059828,,PRUNED
758,758,33.333333333333336,2025-05-25 04:18:25.052656,2025-05-25 04:18:38.550156,0 days 00:00:13.497500,AdamW,0.014572767582193003,,,0.0002043650673041163,,,,1,,,0.0013694653965047215,,PRUNED
759,759,,2025-05-25 04:18:38.622653,2025-05-25 04:18:48.999877,0 days 00:00:10.377224,SGD,0.040214141745210666,,,,0.06896913756589709,37.28961565964042,False,3,,,,0.11447055197804686,PRUNED
760,760,37.5,2025-05-25 04:18:49.058575,2025-05-25 04:19:02.437208,0 days 00:00:13.378633,AdamW,0.0661936634222643,,,0.0001432141188085024,,,,4,,,0.0015236415602809617,,PRUNED
761,761,37.5,2025-05-25 04:19:02.501153,2025-05-25 04:19:16.002242,0 days 00:00:13.501089,AdamW,0.027179833235308436,,,0.00022676331327155724,,,,1,,,0.0021341874000752638,,PRUNED
762,762,41.666666666666664,2025-05-25 04:19:16.066706,2025-05-25 04:19:29.717423,0 days 00:00:13.650717,AdamW,0.05423004122237407,,,0.00013141600356736638,,,,3,,,0.0016576854646022767,,PRUNED
763,763,52.083333333333336,2025-05-25 04:19:29.782561,2025-05-25 04:20:03.733630,0 days 00:00:33.951069,AdamW,0.015564173183687316,,,0.0001771414682274502,,,,1,,,0.00043686788452908986,,COMPLETE
764,764,33.333333333333336,2025-05-25 04:20:03.793644,2025-05-25 04:20:17.116735,0 days 00:00:13.323091,Adadelta,0.2769557509572448,1.2641290278010227,,,,,,4,3.1699608102901355,,,,PRUNED
765,765,35.416666666666664,2025-05-25 04:20:17.179378,2025-05-25 04:20:30.620781,0 days 00:00:13.441403,AdamW,0.035194749651081006,,,0.00010454433189383869,,,,3,,,0.0010143181350637251,,PRUNED
766,766,35.416666666666664,2025-05-25 04:20:30.686091,2025-05-25 04:20:44.361193,0 days 00:00:13.675102,AdamW,0.043195434551234965,,,0.00025031916035175524,,,,1,,,0.0018619087979894265,,PRUNED
767,767,33.333333333333336,2025-05-25 04:20:44.426450,2025-05-25 04:20:57.699010,0 days 00:00:13.272560,AdamW,0.009657771684148952,,,0.0007696429751246075,,,,4,,,0.0020795445142577557,,PRUNED
768,768,35.416666666666664,2025-05-25 04:20:57.762107,2025-05-25 04:21:11.179064,0 days 00:00:13.416957,AdamW,0.025129456874328368,,,7.46437886158837e-05,,,,1,,,0.0017345340653947877,,PRUNED
769,769,39.583333333333336,2025-05-25 04:21:11.243835,2025-05-25 04:21:31.566660,0 days 00:00:20.322825,AdamW,0.05443433590847895,,,0.0002165649359589721,,,,7,,,0.001171933268454453,,PRUNED
770,770,35.416666666666664,2025-05-25 04:21:31.622463,2025-05-25 04:21:42.478507,0 days 00:00:10.856044,Adam,0.06886397099754746,,1.868047040479272e-05,,,,,3,,43.06095284776378,,,PRUNED
771,771,37.5,2025-05-25 04:21:42.520426,2025-05-25 04:21:47.942405,0 days 00:00:05.421979,AdamW,0.020830791412366566,,,0.00014592881955927486,,,,6,,,0.0024933131775441326,,PRUNED
772,772,35.416666666666664,2025-05-25 04:21:47.981107,2025-05-25 04:21:55.540121,0 days 00:00:07.559014,AdamW,0.03790256423311583,,,0.00018655215590459602,,,,4,,,0.0008942905569771578,,PRUNED
773,773,33.333333333333336,2025-05-25 04:21:55.603666,2025-05-25 04:22:08.392705,0 days 00:00:12.789039,AdamW,0.0492726590844485,,,0.00029787746522149424,,,,6,,,0.0014641408165694467,,PRUNED
774,774,39.583333333333336,2025-05-25 04:22:08.452361,2025-05-25 04:22:18.304845,0 days 00:00:09.852484,AdamW,0.44593171221574657,,,0.0002755475083636119,,,,4,,,0.0020231659394557536,,PRUNED
775,775,37.5,2025-05-25 04:22:18.345862,2025-05-25 04:22:24.534199,0 days 00:00:06.188337,AdamW,0.24535579809285313,,,0.00016212153596250456,,,,1,,,0.0006759365615795302,,PRUNED
776,776,27.083333333333332,2025-05-25 04:22:24.578021,2025-05-25 04:22:37.949712,0 days 00:00:13.371691,Adadelta,0.3031777329198705,0.16285343806764208,,,,,,1,0.3575769607040243,,,,PRUNED
777,777,35.416666666666664,2025-05-25 04:22:38.012882,2025-05-25 04:22:51.328907,0 days 00:00:13.316025,AdamW,0.029780874872784836,,,0.00011733750911951173,,,,4,,,0.002274610557461025,,PRUNED
778,778,41.666666666666664,2025-05-25 04:22:51.393202,2025-05-25 04:23:04.933075,0 days 00:00:13.539873,AdamW,0.009725726462159828,,,0.00023355721126232235,,,,3,,,0.0016714982836805658,,PRUNED
779,779,52.083333333333336,2025-05-25 04:23:04.998553,2025-05-25 04:23:39.011413,0 days 00:00:34.012860,AdamW,0.07594460420753096,,,0.0003568971551066253,,,,0,,,0.0007538835682340178,,COMPLETE
780,780,29.166666666666668,2025-05-25 04:23:39.070610,2025-05-25 04:23:53.009312,0 days 00:00:13.938702,AdamW,0.020887787790154214,,,9.202000313421395e-05,,,,1,,,0.0018308467064805855,,PRUNED
781,781,33.333333333333336,2025-05-25 04:23:53.074344,2025-05-25 04:24:05.912702,0 days 00:00:12.838358,AdamW,0.04391928266136355,,,0.000571619143672423,,,,6,,,0.0025521087755183826,,PRUNED
782,782,33.333333333333336,2025-05-25 04:24:05.971990,2025-05-25 04:24:16.729153,0 days 00:00:10.757163,AdamW,0.059467282412167005,,,0.00019573632653522294,,,,4,,,0.0021276169332163975,,PRUNED
783,783,33.333333333333336,2025-05-25 04:24:16.792967,2025-05-25 04:24:29.140049,0 days 00:00:12.347082,AdamW,0.031571743712336814,,,0.001896796461617837,,,,7,,,0.001039599962534551,,PRUNED
784,784,,2025-05-25 04:24:29.195218,2025-05-25 04:24:40.833163,0 days 00:00:11.637945,SGD,0.04867815292799599,,,,0.04349528297856594,59.97090996072296,True,1,,,,0.01085412906688945,PRUNED
785,785,35.416666666666664,2025-05-25 04:24:40.874793,2025-05-25 04:24:54.344870,0 days 00:00:13.470077,AdamW,0.006040709880687431,,,0.00025716155691497686,,,,3,,,0.001955178128431498,,PRUNED
786,786,29.166666666666668,2025-05-25 04:24:54.447532,2025-05-25 04:25:07.058402,0 days 00:00:12.610870,AdamW,0.03750308801884173,,,0.0004021210694290403,,,,6,,,0.0023349275684115523,,PRUNED
787,787,29.166666666666668,2025-05-25 04:25:07.116978,2025-05-25 04:25:20.697909,0 days 00:00:13.580931,AdamW,0.46315162383573527,,,0.00014050853568012446,,,,3,,,0.0026715492129930733,,PRUNED
788,788,39.583333333333336,2025-05-25 04:25:20.763273,2025-05-25 04:25:34.057328,0 days 00:00:13.294055,AdamW,0.022710664406104256,,,0.0003173026144451899,,,,1,,,0.0012807906856144398,,PRUNED
789,789,31.25,2025-05-25 04:25:34.111368,2025-05-25 04:25:47.302039,0 days 00:00:13.190671,Adadelta,0.06543784209554718,0.0178626867530679,,,,,,4,30.653474762568848,,,,PRUNED
790,790,35.416666666666664,2025-05-25 04:25:47.365056,2025-05-25 04:25:57.733699,0 days 00:00:10.368643,AdamW,0.014424741236661025,,,0.00021278037699498986,,,,0,,,0.001563048597825167,,PRUNED
791,791,37.5,2025-05-25 04:25:57.799276,2025-05-25 04:26:11.372332,0 days 00:00:13.573056,AdamW,0.22134480350726338,,,0.00016367541286642674,,,,3,,,0.001383420291912221,,PRUNED
792,792,35.416666666666664,2025-05-25 04:26:11.436314,2025-05-25 04:26:24.874528,0 days 00:00:13.438214,AdamW,0.05557654262965165,,,0.0004708590030553477,,,,3,,,0.0031843376291483746,,PRUNED
793,793,35.416666666666664,2025-05-25 04:26:24.938561,2025-05-25 04:26:37.985123,0 days 00:00:13.046562,AdamW,0.03734611734111108,,,0.00011926002803685995,,,,1,,,0.0021599972285735757,,PRUNED
794,794,58.333333333333336,2025-05-25 04:26:38.055825,2025-05-25 04:27:07.180890,0 days 00:00:29.125065,AdamW,0.02743861008187528,,,0.0002578288919032312,,,,6,,,0.0008071981162176634,,COMPLETE
795,795,33.333333333333336,2025-05-25 04:27:07.240607,2025-05-25 04:27:20.301495,0 days 00:00:13.060888,Adam,0.007460939160969596,,0.007027806302102513,,,,,6,,0.2990092816853321,,,PRUNED
796,796,33.333333333333336,2025-05-25 04:27:20.360913,2025-05-25 04:27:32.206238,0 days 00:00:11.845325,AdamW,0.020994861820711995,,,0.00024373389538218077,,,,6,,,0.0009434102147038938,,PRUNED
797,797,31.25,2025-05-25 04:27:32.259562,2025-05-25 04:27:41.546103,0 days 00:00:09.286541,AdamW,0.02358271027275472,,,0.0001904902718049562,,,,6,,,0.0006005875123715925,,PRUNED
798,798,33.333333333333336,2025-05-25 04:27:41.584599,2025-05-25 04:27:46.623120,0 days 00:00:05.038521,AdamW,0.03051382909246935,,,0.00022113189759093152,,,,6,,,0.0004667584437135136,,PRUNED
799,799,31.25,2025-05-25 04:27:46.661247,2025-05-25 04:27:53.639249,0 days 00:00:06.978002,AdamW,0.014826889461760327,,,0.0002669318914613125,,,,6,,,0.001083889846426488,,PRUNED
800,800,35.416666666666664,2025-05-25 04:27:53.699223,2025-05-25 04:28:06.345852,0 days 00:00:12.646629,AdamW,0.07741354849719513,,,0.00017405794745110702,,,,6,,,0.00019387513912489548,,PRUNED
801,801,45.833333333333336,2025-05-25 04:28:06.405349,2025-05-25 04:28:22.454845,0 days 00:00:16.049496,AdamW,0.02878410404456144,,,0.00014666611320162854,,,,6,,,0.00023333408078350366,,COMPLETE
802,802,39.583333333333336,2025-05-25 04:28:22.497102,2025-05-25 04:28:33.098668,0 days 00:00:10.601566,AdamW,0.0004616440909754535,,,0.0002116165577808599,,,,6,,,0.0015939483591312573,,PRUNED
803,803,33.333333333333336,2025-05-25 04:28:33.158118,2025-05-25 04:28:45.786734,0 days 00:00:12.628616,AdamW,0.016477776557130085,,,0.0002655739502151915,,,,6,,,0.001190290778588461,,PRUNED
