,number,value,datetime_start,datetime_complete,duration,params_algorithm,params_dropout_rate,params_lr_Adadelta,params_lr_Adam,params_lr_AdamW,params_lr_SGD,params_momentum_SGD,params_nesterov_SGD,params_suggested_freeze,params_weight_decay_Adadelta,params_weight_decay_Adam,params_weight_decay_AdamW,params_weight_decay_SGD,state
808,808,,2025-05-26 00:08:11.278774,2025-05-26 00:08:22.325641,0 days 00:00:11.046867,SGD,0.018024401778165444,,,,0.004273139566123339,80.00877587659765,True,2,,,,1.36749138840076,PRUNED
809,809,33.333333333333336,2025-05-26 00:08:22.400289,2025-05-26 00:08:35.491529,0 days 00:00:13.091240,AdamW,0.08094220573858885,,,0.00012929739048485545,,,,1,,,0.007358183532184628,,PRUNED
810,810,37.5,2025-05-26 00:08:35.560882,2025-05-26 00:08:48.640121,0 days 00:00:13.079239,AdamW,0.19977112604672467,,,0.0003736687906146644,,,,1,,,0.0009367462610480324,,PRUNED
811,811,33.333333333333336,2025-05-26 00:08:48.705870,2025-05-26 00:09:02.010641,0 days 00:00:13.304771,AdamW,0.23117701764504317,,,0.0005995781554127606,,,,1,,,0.0007059163593445835,,PRUNED
812,812,33.333333333333336,2025-05-26 00:09:02.075470,2025-05-26 00:09:14.658487,0 days 00:00:12.583017,Adam,0.25665924297007037,,0.01640523766743662,,,,,1,,0.07441969061762607,,,PRUNED
813,813,45.833333333333336,2025-05-26 00:09:14.723326,2025-05-26 00:09:48.151337,0 days 00:00:33.428011,AdamW,0.17737832436944795,,,0.0004983078025223009,,,,1,,,0.0017976209101649026,,COMPLETE
814,814,33.333333333333336,2025-05-26 00:09:48.211701,2025-05-26 00:10:00.934407,0 days 00:00:12.722706,AdamW,0.1458423207314271,,,0.0002265880636000767,,,,5,,,0.0005880163634462902,,PRUNED
815,815,39.583333333333336,2025-05-26 00:10:01.212488,2025-05-26 00:10:14.263072,0 days 00:00:13.050584,AdamW,0.13377993998362403,,,0.00031152553759111317,,,,2,,,0.0010427894959251904,,PRUNED
816,816,33.333333333333336,2025-05-26 00:10:14.327691,2025-05-26 00:10:27.535933,0 days 00:00:13.208242,AdamW,0.15571158271601995,,,0.00042502020804414416,,,,1,,,0.00041645553456319783,,PRUNED
817,817,33.333333333333336,2025-05-26 00:10:27.601172,2025-05-26 00:10:40.769047,0 days 00:00:13.167875,AdamW,0.19070450711919498,,,0.005696827316447177,,,,0,,,0.0008506988063384356,,PRUNED
818,818,33.333333333333336,2025-05-26 00:10:40.838258,2025-05-26 00:10:54.187227,0 days 00:00:13.348969,AdamW,0.12011282653141579,,,0.0010430297850312752,,,,1,,,0.001377216814952449,,PRUNED
819,819,45.833333333333336,2025-05-26 00:10:54.252624,2025-05-26 00:11:07.315238,0 days 00:00:13.062614,AdamW,0.17089834850064442,,,0.0002532148506567942,,,,2,,,0.0012011317807548785,,PRUNED
820,820,43.75,2025-05-26 00:11:07.380920,2025-05-26 00:11:20.531361,0 days 00:00:13.150441,AdamW,0.2693462868272082,,,0.00019965959997973425,,,,1,,,0.0005283424126151065,,PRUNED
821,821,50.0,2025-05-26 00:11:20.596265,2025-05-26 00:11:33.684355,0 days 00:00:13.088090,AdamW,0.21687571670415973,,,0.0004708650733281709,,,,3,,,0.0007692029263862973,,PRUNED
822,822,35.416666666666664,2025-05-26 00:11:33.748760,2025-05-26 00:11:47.091753,0 days 00:00:13.342993,AdamW,0.0962122872663923,,,0.00036582797189253086,,,,1,,,0.0006305739779025502,,PRUNED
823,823,35.416666666666664,2025-05-26 00:11:47.164666,2025-05-26 00:12:00.337775,0 days 00:00:13.173109,AdamW,0.16067905290898107,,,0.0005795353157613739,,,,1,,,0.000969750113607696,,PRUNED
824,824,50.0,2025-05-26 00:12:00.402764,2025-05-26 00:12:33.863693,0 days 00:00:33.460929,AdamW,0.1971309382996769,,,0.0003108580369309673,,,,1,,,0.00844641203071332,,PRUNED
825,825,33.333333333333336,2025-05-26 00:12:33.930420,2025-05-26 00:12:47.497570,0 days 00:00:13.567150,Adadelta,0.24016328385292474,64.42550171419556,,,,,,2,0.09560452389074323,,,,PRUNED
826,826,41.666666666666664,2025-05-26 00:12:47.560668,2025-05-26 00:12:59.666939,0 days 00:00:12.106271,AdamW,0.046914053678135545,,,0.00038228655976735694,,,,7,,,0.0015519265312465044,,PRUNED
827,827,41.666666666666664,2025-05-26 00:12:59.722270,2025-05-26 00:13:12.960647,0 days 00:00:13.238377,AdamW,0.14370099826247226,,,0.00014244661337508113,,,,2,,,0.00068862356628714,,PRUNED
828,828,47.916666666666664,2025-05-26 00:13:13.025530,2025-05-26 00:13:26.254692,0 days 00:00:13.229162,AdamW,0.17795837208030657,,,9.86314142870574e-05,,,,4,,,0.0008913867765734816,,PRUNED
829,829,47.916666666666664,2025-05-26 00:13:26.321255,2025-05-26 00:13:39.405660,0 days 00:00:13.084405,AdamW,0.2856930896663889,,,0.00017608314558041535,,,,1,,,0.0010837236467472337,,PRUNED
830,830,37.5,2025-05-26 00:13:39.470359,2025-05-26 00:13:52.607477,0 days 00:00:13.137118,AdamW,0.20976816255395028,,,0.0002589560314094031,,,,0,,,0.0005023427177607954,,PRUNED
831,831,47.916666666666664,2025-05-26 00:13:52.675205,2025-05-26 00:14:06.108560,0 days 00:00:13.433355,AdamW,0.129393779192445,,,0.0004665637702565258,,,,1,,,0.001317824421371334,,PRUNED
832,832,,2025-05-26 00:14:06.174281,2025-05-26 00:14:17.929566,0 days 00:00:11.755285,SGD,0.15521250829505057,,,,0.00021280376875563892,59.13453899381784,False,3,,,,23.178552330093947,PRUNED
833,833,35.416666666666664,2025-05-26 00:14:17.971248,2025-05-26 00:14:31.198126,0 days 00:00:13.226878,AdamW,0.25219457332856177,,,0.0007191951063857679,,,,1,,,0.0008335339730291836,,PRUNED
834,834,33.333333333333336,2025-05-26 00:14:31.262981,2025-05-26 00:14:44.314925,0 days 00:00:13.051944,AdamW,0.18328402538923375,,,0.00034944865595710773,,,,1,,,0.0007440818975821707,,PRUNED
835,835,37.5,2025-05-26 00:14:44.380834,2025-05-26 00:14:57.611733,0 days 00:00:13.230899,AdamW,0.4504512926761391,,,0.00026190281727827327,,,,0,,,0.0011358002055605713,,PRUNED
836,836,33.333333333333336,2025-05-26 00:14:57.676578,2025-05-26 00:15:10.901046,0 days 00:00:13.224468,Adam,0.16534492947151735,,0.06163264545644677,,,,,2,,0.03261445782192768,,,PRUNED
837,837,39.583333333333336,2025-05-26 00:15:10.966503,2025-05-26 00:15:24.053726,0 days 00:00:13.087223,AdamW,0.13988153263067443,,,0.0004937340262282805,,,,1,,,0.0005916602852282136,,PRUNED
838,838,35.416666666666664,2025-05-26 00:15:24.112653,2025-05-26 00:15:35.887780,0 days 00:00:11.775127,AdamW,0.0621271690596584,,,0.00021222232366087596,,,,1,,,0.0009209546351367394,,PRUNED
839,839,33.333333333333336,2025-05-26 00:15:35.953427,2025-05-26 00:15:49.342716,0 days 00:00:13.389289,AdamW,0.22732080846567945,,,0.0002990294234000935,,,,1,,,0.009857045077072333,,PRUNED
840,840,41.666666666666664,2025-05-26 00:15:49.409580,2025-05-26 00:16:02.546317,0 days 00:00:13.136737,AdamW,0.43058321931957444,,,0.000580421325653193,,,,2,,,0.0010017779155465356,,PRUNED
841,841,35.416666666666664,2025-05-26 00:16:02.613131,2025-05-26 00:16:15.704450,0 days 00:00:13.091319,AdamW,0.20554624225203863,,,0.0004000099467285947,,,,1,,,0.0029664564628246516,,PRUNED
842,842,47.916666666666664,2025-05-26 00:16:15.769165,2025-05-26 00:16:29.140801,0 days 00:00:13.371636,AdamW,0.006819408127148777,,,0.00016610667326485775,,,,1,,,0.0045193303053675995,,PRUNED
843,843,39.583333333333336,2025-05-26 00:16:29.206611,2025-05-26 00:16:42.306149,0 days 00:00:13.099538,AdamW,0.1954663666450711,,,0.0003042925514388049,,,,1,,,0.0006865033100621471,,PRUNED
844,844,37.5,2025-05-26 00:16:42.373530,2025-05-26 00:16:55.615980,0 days 00:00:13.242450,AdamW,0.17290551719976802,,,0.00042509104515125773,,,,0,,,0.0012325783397806225,,PRUNED
845,845,41.666666666666664,2025-05-26 00:16:55.681078,2025-05-26 00:17:08.800955,0 days 00:00:13.119877,AdamW,0.10539036100748336,,,0.0008295811868064338,,,,1,,,0.0016777700677292257,,PRUNED
846,846,39.583333333333336,2025-05-26 00:17:08.870200,2025-05-26 00:17:22.243694,0 days 00:00:13.373494,AdamW,0.3998878527130899,,,0.00023346536199363128,,,,1,,,0.000245288253417107,,PRUNED
847,847,37.5,2025-05-26 00:17:22.309727,2025-05-26 00:17:35.376533,0 days 00:00:13.066806,AdamW,0.14918512239818257,,,0.0003459660110688752,,,,2,,,0.00047578393890226786,,PRUNED
848,848,47.916666666666664,2025-05-26 00:17:35.443827,2025-05-26 00:17:48.559731,0 days 00:00:13.115904,AdamW,0.2611100454465935,,,0.0006332367747764705,,,,1,,,0.0007865421970185513,,PRUNED
849,849,37.5,2025-05-26 00:17:48.626650,2025-05-26 00:18:02.121116,0 days 00:00:13.494466,Adadelta,0.18711302089408732,0.010179026439721985,,,,,,1,0.010782485780884608,,,,PRUNED
850,850,39.583333333333336,2025-05-26 00:18:02.185727,2025-05-26 00:18:15.266650,0 days 00:00:13.080923,AdamW,0.30689907154321344,,,0.00019466023583252442,,,,2,,,0.0005496360614869682,,PRUNED
851,851,33.333333333333336,2025-05-26 00:18:15.332752,2025-05-26 00:18:28.427139,0 days 00:00:13.094387,AdamW,0.15622042719037552,,,0.0005147656345106111,,,,3,,,0.0014638731532161406,,PRUNED
852,852,37.5,2025-05-26 00:18:28.491472,2025-05-26 00:18:41.597875,0 days 00:00:13.106403,AdamW,0.12232619874341435,,,0.00013050060515818886,,,,1,,,0.00043053169025262757,,PRUNED
853,853,45.833333333333336,2025-05-26 00:18:41.663017,2025-05-26 00:18:55.105255,0 days 00:00:13.442238,AdamW,0.13659278536261088,,,0.00026582064848757803,,,,1,,,0.0003790033297469972,,PRUNED
854,854,33.333333333333336,2025-05-26 00:18:55.171383,2025-05-26 00:19:08.329230,0 days 00:00:13.157847,AdamW,0.08654720181618566,,,0.00037453385048938126,,,,0,,,0.0006484800808551804,,PRUNED
855,855,33.333333333333336,2025-05-26 00:19:08.396641,2025-05-26 00:19:21.542419,0 days 00:00:13.145778,AdamW,0.21818368587377895,,,0.00043250616148633676,,,,1,,,0.0011102297385455402,,PRUNED
856,856,58.333333333333336,2025-05-26 00:19:21.608155,2025-05-26 00:19:55.494068,0 days 00:00:33.885913,AdamW,0.17032645502400492,,,0.0003175570888868761,,,,1,,,0.0008853719116691325,,COMPLETE
857,857,35.416666666666664,2025-05-26 00:19:55.553673,2025-05-26 00:20:08.802076,0 days 00:00:13.248403,AdamW,0.1802620956433322,,,0.0005172738506019786,,,,2,,,0.0009928562313365507,,PRUNED
858,858,,2025-05-26 00:20:08.867369,2025-05-26 00:20:20.907705,0 days 00:00:12.040336,SGD,0.2456772572444539,,,,0.00010252726377259941,71.93576466889253,True,1,,,,0.03301400467155382,PRUNED
859,859,54.166666666666664,2025-05-26 00:20:20.949048,2025-05-26 00:20:54.512752,0 days 00:00:33.563704,AdamW,0.2714786934700431,,,0.00024323479995889881,,,,1,,,0.0007488453506494776,,COMPLETE
860,860,33.333333333333336,2025-05-26 00:20:54.571679,2025-05-26 00:21:07.407607,0 days 00:00:12.835928,Adam,0.2020207515674295,,0.02554386340146606,,,,,2,,63.460495769787045,,,PRUNED
861,861,33.333333333333336,2025-05-26 00:21:07.473458,2025-05-26 00:21:20.639048,0 days 00:00:13.165590,AdamW,0.18989630374495833,,,0.00019545244735560458,,,,1,,,0.0013702549802492928,,PRUNED
862,862,39.583333333333336,2025-05-26 00:21:20.704122,2025-05-26 00:21:33.844936,0 days 00:00:13.140814,AdamW,0.1647201426943818,,,0.0003400863032785375,,,,1,,,0.0012354295276825675,,PRUNED
863,863,41.666666666666664,2025-05-26 00:21:33.911166,2025-05-26 00:21:47.284764,0 days 00:00:13.373598,AdamW,0.14635402317209031,,,0.0006442415151518951,,,,1,,,0.00255395764793746,,PRUNED
864,864,41.666666666666664,2025-05-26 00:21:47.352085,2025-05-26 00:22:00.706062,0 days 00:00:13.353977,AdamW,0.03492722086113875,,,0.0001469687644080467,,,,2,,,0.0008608053388143563,,PRUNED
865,865,47.916666666666664,2025-05-26 00:22:00.771200,2025-05-26 00:22:13.800035,0 days 00:00:13.028835,AdamW,0.1150592392378269,,,0.00042991018900450723,,,,3,,,0.006762559959087127,,PRUNED
866,866,43.75,2025-05-26 00:22:13.867923,2025-05-26 00:22:47.701551,0 days 00:00:33.833628,AdamW,0.1295478475747984,,,0.00027880620276940385,,,,0,,,0.0006065342344733143,,COMPLETE
867,867,50.0,2025-05-26 00:22:47.762009,2025-05-26 00:23:00.997801,0 days 00:00:13.235792,AdamW,0.15557235686024318,,,0.0003653594474658243,,,,1,,,0.0007104915224981865,,PRUNED
868,868,33.333333333333336,2025-05-26 00:23:01.064251,2025-05-26 00:23:14.190387,0 days 00:00:13.126136,AdamW,0.48479332203262726,,,0.020909073978619564,,,,1,,,0.0008127402031278955,,PRUNED
869,869,31.25,2025-05-26 00:23:14.255821,2025-05-26 00:23:25.930280,0 days 00:00:11.674459,AdamW,0.29266954226663655,,,0.0005297825457816891,,,,9,,,0.0010799366132124698,,PRUNED
870,870,39.583333333333336,2025-05-26 00:23:25.985101,2025-05-26 00:23:39.358348,0 days 00:00:13.373247,AdamW,0.3520849733544216,,,0.00022706927240796198,,,,2,,,0.009052920491865709,,PRUNED
871,871,29.166666666666668,2025-05-26 00:23:39.424114,2025-05-26 00:23:52.466928,0 days 00:00:13.042814,AdamW,0.17766344829643493,,,0.00011249477517760168,,,,4,,,0.0005144861504487567,,PRUNED
872,872,39.583333333333336,2025-05-26 00:23:52.532281,2025-05-26 00:24:05.643340,0 days 00:00:13.111059,AdamW,0.21216484267658292,,,0.000446940336078195,,,,1,,,0.0009966360429428996,,PRUNED
873,873,31.25,2025-05-26 00:24:05.708735,2025-05-26 00:24:18.945787,0 days 00:00:13.237052,Adadelta,0.23323973695430655,0.18684186811141915,,,,,,0,63.202112515447375,,,,PRUNED
874,874,39.583333333333336,2025-05-26 00:24:19.010030,2025-05-26 00:24:32.494790,0 days 00:00:13.484760,AdamW,0.13936675068403515,,,0.00017330152069684052,,,,1,,,0.0005714089732994429,,PRUNED
875,875,50.0,2025-05-26 00:24:32.560435,2025-05-26 00:24:45.710537,0 days 00:00:13.150102,AdamW,0.19080414929835587,,,0.0003076098663745892,,,,1,,,0.0006432522643998514,,PRUNED
876,876,33.333333333333336,2025-05-26 00:24:45.782284,2025-05-26 00:24:58.971059,0 days 00:00:13.188775,AdamW,0.1654991117900301,,,0.0007131244596610213,,,,1,,,0.0004622785986891629,,PRUNED
877,877,43.75,2025-05-26 00:24:59.036474,2025-05-26 00:25:12.363389,0 days 00:00:13.326915,AdamW,0.07131148498366441,,,0.00038070549962153496,,,,1,,,0.0007569099195997939,,PRUNED
878,878,43.75,2025-05-26 00:25:12.429465,2025-05-26 00:25:25.236151,0 days 00:00:12.806686,AdamW,0.1515554320375735,,,0.0002609477588764759,,,,5,,,0.0012370237203832974,,PRUNED
879,879,33.333333333333336,2025-05-26 00:25:25.298854,2025-05-26 00:25:37.614070,0 days 00:00:12.315216,AdamW,0.056411371415250336,,,0.0005631256354156419,,,,6,,,0.0015969048353573134,,PRUNED
880,880,62.5,2025-05-26 00:25:37.673503,2025-05-26 00:26:11.351414,0 days 00:00:33.677911,AdamW,0.27777691378267066,,,0.00020890021233649434,,,,1,,,0.0009119013666132887,,COMPLETE
881,881,35.416666666666664,2025-05-26 00:26:11.409623,2025-05-26 00:26:24.560313,0 days 00:00:13.150690,AdamW,0.28286835677091404,,,0.00030706666007206855,,,,2,,,0.000946523092953459,,PRUNED
882,882,,2025-05-26 00:26:24.626068,2025-05-26 00:26:37.758791,0 days 00:00:13.132723,SGD,0.26915483471873347,,,,2.4615920407071784e-05,36.68300481026564,False,2,,,,56.34728675079412,PRUNED
883,883,50.0,2025-05-26 00:26:37.807640,2025-05-26 00:26:50.476719,0 days 00:00:12.669079,AdamW,0.30103119407144696,,,0.0004182786085013038,,,,1,,,0.0011548033779319367,,PRUNED
884,884,33.333333333333336,2025-05-26 00:26:50.543406,2025-05-26 00:27:03.923871,0 days 00:00:13.380465,AdamW,0.2816612159915841,,,0.000902416674536906,,,,1,,,0.001027838333054436,,PRUNED
885,885,33.333333333333336,2025-05-26 00:27:03.990742,2025-05-26 00:27:17.252832,0 days 00:00:13.262090,Adam,0.2773947033898917,,0.00347312805216716,,,,,0,,0.11197447551403511,,,PRUNED
886,886,35.416666666666664,2025-05-26 00:27:17.322094,2025-05-26 00:27:30.494535,0 days 00:00:13.172441,AdamW,0.27530192412099375,,,0.00021812995673566488,,,,1,,,0.0009449009873273184,,PRUNED
887,887,33.333333333333336,2025-05-26 00:27:30.562181,2025-05-26 00:27:43.698093,0 days 00:00:13.135912,AdamW,0.29552616565398326,,,0.0003550867981134163,,,,1,,,0.0077732964673721495,,PRUNED
888,888,50.0,2025-05-26 00:27:43.764212,2025-05-26 00:27:57.121131,0 days 00:00:13.356919,AdamW,0.28753534562361155,,,0.0002681275740636828,,,,2,,,0.005038604873238181,,PRUNED
889,889,43.75,2025-05-26 00:27:57.186684,2025-05-26 00:28:10.426380,0 days 00:00:13.239696,AdamW,0.2572727720193811,,,0.0001995760946272756,,,,1,,,0.0013443636858141577,,PRUNED
890,890,33.333333333333336,2025-05-26 00:28:10.492504,2025-05-26 00:28:23.769205,0 days 00:00:13.276701,AdamW,0.26506196001877647,,,0.0004569369813158066,,,,1,,,0.001077197984047312,,PRUNED
891,891,41.666666666666664,2025-05-26 00:28:23.835411,2025-05-26 00:28:37.165663,0 days 00:00:13.330252,AdamW,0.26018735992858844,,,0.0005491634107732689,,,,1,,,0.0008858427241630184,,PRUNED
892,892,31.25,2025-05-26 00:28:37.231313,2025-05-26 00:28:50.387162,0 days 00:00:13.155849,AdamW,0.2749385547611814,,,3.1833505421044486e-05,,,,1,,,0.003931305292974347,,PRUNED
893,893,37.5,2025-05-26 00:28:50.452905,2025-05-26 00:29:03.565032,0 days 00:00:13.112127,AdamW,0.28606568844838093,,,0.0003204710505914469,,,,3,,,0.0011623823047354853,,PRUNED
894,894,33.333333333333336,2025-05-26 00:29:03.630174,2025-05-26 00:29:16.845772,0 days 00:00:13.215598,AdamW,0.27250742811013196,,,0.00024688366765565644,,,,1,,,0.0008441342074585714,,PRUNED
895,895,35.416666666666664,2025-05-26 00:29:16.918926,2025-05-26 00:29:30.275536,0 days 00:00:13.356610,AdamW,0.2520622252498067,,,0.00038048441871727114,,,,2,,,0.003220857974748913,,PRUNED
896,896,58.333333333333336,2025-05-26 00:29:30.341423,2025-05-26 00:30:03.988566,0 days 00:00:33.647143,AdamW,0.16607219960162317,,,0.0004488262059850489,,,,0,,,0.0005410301418173853,,COMPLETE
897,897,33.333333333333336,2025-05-26 00:30:04.048979,2025-05-26 00:30:17.392150,0 days 00:00:13.343171,AdamW,0.2594273218324611,,,0.000621251366303646,,,,1,,,0.0004328106056935298,,PRUNED
898,898,33.333333333333336,2025-05-26 00:30:17.457883,2025-05-26 00:30:30.928717,0 days 00:00:13.470834,Adadelta,0.14645502445262745,0.09742252951419113,,,,,,1,4.284508768963073,,,,PRUNED
899,899,35.416666666666664,2025-05-26 00:30:30.992580,2025-05-26 00:30:44.100575,0 days 00:00:13.107995,AdamW,0.1333537189202162,,,0.0002896207508593382,,,,3,,,0.001374478029433033,,PRUNED
900,900,41.666666666666664,2025-05-26 00:30:44.166674,2025-05-26 00:30:57.381415,0 days 00:00:13.214741,AdamW,0.26687121350394544,,,0.0005021480547419472,,,,2,,,0.0010754679912140068,,PRUNED
901,901,35.416666666666664,2025-05-26 00:30:57.448697,2025-05-26 00:31:10.618347,0 days 00:00:13.169650,AdamW,0.3174130649634678,,,0.0003469141882776225,,,,1,,,0.00147647489613587,,PRUNED
902,902,37.5,2025-05-26 00:31:10.684191,2025-05-26 00:31:24.080588,0 days 00:00:13.396397,AdamW,0.15750210438987264,,,0.00016682190054307823,,,,1,,,0.0009195963175041085,,PRUNED
903,903,45.833333333333336,2025-05-26 00:31:24.146692,2025-05-26 00:31:37.300311,0 days 00:00:13.153619,AdamW,0.17135049778604944,,,0.00022039876082182472,,,,2,,,0.0006917997470458338,,PRUNED
904,904,35.416666666666664,2025-05-26 00:31:37.366116,2025-05-26 00:31:50.277366,0 days 00:00:12.911250,AdamW,0.2870250265802312,,,7.653319996002217e-05,,,,4,,,0.000602982314106128,,PRUNED
905,905,39.583333333333336,2025-05-26 00:31:50.344129,2025-05-26 00:32:03.668698,0 days 00:00:13.324569,AdamW,0.12170393663822918,,,0.0007663202996923856,,,,1,,,0.0012443449668118227,,PRUNED
906,906,,2025-05-26 00:32:03.735552,2025-05-26 00:32:16.639191,0 days 00:00:12.903639,SGD,0.46581330635280277,,,,1.456488174204212e-05,48.53728008058893,True,0,,,,0.01569568741457065,PRUNED
907,907,39.583333333333336,2025-05-26 00:32:16.696317,2025-05-26 00:32:28.797723,0 days 00:00:12.101406,AdamW,0.13909658902570676,,,0.0002772596631835844,,,,1,,,0.0010056091359441964,,PRUNED
908,908,43.75,2025-05-26 00:32:28.863424,2025-05-26 00:32:42.133393,0 days 00:00:13.269969,AdamW,0.2980395337037612,,,0.0003777387141924347,,,,1,,,0.005831901894049833,,PRUNED
909,909,33.333333333333336,2025-05-26 00:32:42.199291,2025-05-26 00:32:55.851867,0 days 00:00:13.652576,Adam,0.15826876242916565,,0.0015903370088149761,,,,,2,,0.01980363410709274,,,PRUNED
910,910,47.916666666666664,2025-05-26 00:32:55.918953,2025-05-26 00:33:09.149472,0 days 00:00:13.230519,AdamW,0.1690631439571767,,,0.0004484101132561961,,,,1,,,0.002010418843808106,,PRUNED
911,911,33.333333333333336,2025-05-26 00:33:09.215124,2025-05-26 00:33:22.580087,0 days 00:00:13.364963,AdamW,0.1490108802427166,,,0.00014773246528749405,,,,1,,,0.00047965093810647063,,PRUNED
912,912,37.5,2025-05-26 00:33:22.647094,2025-05-26 00:33:36.051541,0 days 00:00:13.404447,AdamW,0.2682665638460663,,,0.00031073878905079195,,,,0,,,0.0008548699067098526,,PRUNED
913,913,31.25,2025-05-26 00:33:36.118402,2025-05-26 00:33:49.476727,0 days 00:00:13.358325,AdamW,0.2789351255149501,,,0.0006338923291890587,,,,1,,,0.0007760576947077586,,PRUNED
914,914,33.333333333333336,2025-05-26 00:33:49.543618,2025-05-26 00:34:02.707577,0 days 00:00:13.163959,AdamW,0.11018463522443322,,,0.00021051946603728973,,,,2,,,0.0011425527992620095,,PRUNED
915,915,47.916666666666664,2025-05-26 00:34:02.787497,2025-05-26 00:34:36.558489,0 days 00:00:33.770992,AdamW,0.1764796419413347,,,0.0005253901285779053,,,,1,,,0.000397392238208703,,COMPLETE
916,916,39.583333333333336,2025-05-26 00:34:36.896499,2025-05-26 00:34:50.254543,0 days 00:00:13.358044,AdamW,0.24938596817221692,,,0.00025876636603118676,,,,1,,,0.0006478363087269388,,PRUNED
917,917,37.5,2025-05-26 00:34:50.321167,2025-05-26 00:35:03.533385,0 days 00:00:13.212218,AdamW,0.1304399235382758,,,0.00039400366936994204,,,,1,,,0.000555413951117423,,PRUNED
918,918,47.916666666666664,2025-05-26 00:35:03.599108,2025-05-26 00:35:37.043728,0 days 00:00:33.444620,AdamW,0.3345365046439154,,,0.00018698805126386855,,,,2,,,0.0009569836328972228,,COMPLETE
919,919,47.916666666666664,2025-05-26 00:35:37.103614,2025-05-26 00:35:50.587366,0 days 00:00:13.483752,AdamW,0.1586414020231312,,,0.0003385447679703538,,,,1,,,0.00179243386322346,,PRUNED
920,920,37.5,2025-05-26 00:35:50.655247,2025-05-26 00:36:03.874245,0 days 00:00:13.218998,AdamW,0.14050961591509412,,,0.00046146914896127734,,,,1,,,0.0005022194156706292,,PRUNED
921,921,50.0,2025-05-26 00:36:03.942203,2025-05-26 00:36:16.993571,0 days 00:00:13.051368,AdamW,0.17768465520698917,,,0.0002472888725734799,,,,3,,,0.0007920836410475488,,PRUNED
922,922,33.333333333333336,2025-05-26 00:36:17.060150,2025-05-26 00:36:30.515421,0 days 00:00:13.455271,Adadelta,0.14952878097182373,21.712648857283657,,,,,,1,7.458027556021748,,,,PRUNED
