,number,value,datetime_start,datetime_complete,duration,params_algorithm,params_dropout_rate,params_lr_Adadelta,params_lr_Adam,params_lr_AdamW,params_lr_SGD,params_momentum_SGD,params_nesterov_SGD,params_suggested_freeze,params_weight_decay_Adadelta,params_weight_decay_Adam,params_weight_decay_AdamW,params_weight_decay_SGD,state
0,0,31.25,2025-05-25 01:32:34.063148,2025-05-25 01:33:05.487250,0 days 00:00:31.424102,Adadelta,0.4753571532049581,0.017073967431528128,,,,,,3,29.154431891537552,,,,COMPLETE
1,1,43.75,2025-05-25 01:33:05.545872,2025-05-25 01:33:34.749689,0 days 00:00:29.203817,Adam,0.35403628889802274,,5.3370327626039544e-05,,,,,6,,0.05415244119402541,,,COMPLETE
2,2,43.75,2025-05-25 01:33:34.799110,2025-05-25 01:34:07.787909,0 days 00:00:32.988799,AdamW,0.2623782158161189,,,0.00014742753159914678,,,,3,,,0.0005404103854647331,,COMPLETE
3,3,33.333333333333336,2025-05-25 01:34:07.838561,2025-05-25 01:34:36.676482,0 days 00:00:28.837921,AdamW,0.3925879806965068,,,0.0026926469100861782,,,,4,,,0.00021930485556643703,,COMPLETE
4,4,33.333333333333336,2025-05-25 01:34:36.726028,2025-05-25 01:35:06.516229,0 days 00:00:29.790201,Adadelta,0.4744427686266666,5.456725485601478,,,,,,0,0.5762487216478605,,,,COMPLETE
5,5,41.666666666666664,2025-05-25 01:35:06.567385,2025-05-25 01:35:35.264783,0 days 00:00:28.697398,Adam,0.2475884550556351,,0.00017654048052495074,,,,,1,,1.2030178871154673,,,COMPLETE
6,6,33.333333333333336,2025-05-25 01:35:35.314821,2025-05-25 01:35:49.093762,0 days 00:00:13.778941,Adadelta,0.09242722776276352,2.463768595899747,,,,,,5,48.696409415209004,,,,PRUNED
7,7,33.333333333333336,2025-05-25 01:35:49.119962,2025-05-25 01:36:00.612656,0 days 00:00:11.492694,AdamW,0.0979914312095726,,,0.02065142557895925,,,,0,,,0.0005170191786366995,,PRUNED
8,8,27.083333333333332,2025-05-25 01:36:00.670074,2025-05-25 01:36:12.789181,0 days 00:00:12.119107,SGD,0.27134804157912423,,,,0.012273800987852962,0.5621564911890039,True,2,,,,0.06235377135673159,PRUNED
9,9,,2025-05-25 01:36:12.825616,2025-05-25 01:36:18.876617,0 days 00:00:06.051001,SGD,0.38563517334297287,,,,0.0031130959561221226,6.365199445099503,False,7,,,,0.2106648601704221,PRUNED
10,10,27.083333333333332,2025-05-25 01:36:18.910421,2025-05-25 01:36:30.737040,0 days 00:00:11.826619,Adam,0.0029985914779085965,,1.1799062523159256e-05,,,,,9,,0.011627478296224469,,,PRUNED
11,11,33.333333333333336,2025-05-25 01:36:30.784158,2025-05-25 01:36:40.377164,0 days 00:00:09.593006,Adam,0.2687772072034616,,0.06135465318705142,,,,,6,,0.020123694972889298,,,PRUNED
12,12,31.25,2025-05-25 01:36:40.404355,2025-05-25 01:37:03.809760,0 days 00:00:23.405405,AdamW,0.33917540003066937,,,2.031973943675742e-05,,,,8,,,0.008383621437420495,,COMPLETE
13,13,31.25,2025-05-25 01:37:03.860502,2025-05-25 01:37:36.004041,0 days 00:00:32.143539,Adam,0.21355615281666585,,0.00026931176066398395,,,,,5,,37.639965874722925,,,COMPLETE
14,14,50.0,2025-05-25 01:37:36.053862,2025-05-25 01:38:09.455345,0 days 00:00:33.401483,AdamW,0.17284687262413326,,,5.107684925222934e-05,,,,3,,,0.0025253710106474536,,COMPLETE
15,15,31.25,2025-05-25 01:38:09.504343,2025-05-25 01:38:21.835578,0 days 00:00:12.331235,Adam,0.17063866647878068,,2.0599161373346178e-05,,,,,6,,0.17249016594984704,,,PRUNED
16,16,27.083333333333332,2025-05-25 01:38:21.869506,2025-05-25 01:38:34.527974,0 days 00:00:12.658468,AdamW,0.1425088832102691,,,1.4334964182147694e-05,,,,4,,,0.004160617933755995,,PRUNED
17,17,,2025-05-25 01:38:34.568517,2025-05-25 01:38:40.864767,0 days 00:00:06.296250,SGD,0.328611178889576,,,,1.533653919754068e-05,99.82036515505162,False,7,,,,96.3979853269096,PRUNED
18,18,33.333333333333336,2025-05-25 01:38:40.890856,2025-05-25 01:38:46.334242,0 days 00:00:05.443386,Adam,0.4131716726663137,,0.0056524001870437044,,,,,2,,0.4768669286986543,,,PRUNED
19,19,50.0,2025-05-25 01:38:46.373631,2025-05-25 01:39:04.912157,0 days 00:00:18.538526,AdamW,0.005494594621885562,,,0.00029761496078765904,,,,6,,,0.0020263445300494625,,COMPLETE
20,20,54.166666666666664,2025-05-25 01:39:04.963126,2025-05-25 01:39:31.017835,0 days 00:00:26.054709,AdamW,0.026432108424850703,,,0.0003570618178271882,,,,3,,,0.002002695421017901,,COMPLETE
21,21,43.75,2025-05-25 01:39:31.060429,2025-05-25 01:39:58.127319,0 days 00:00:27.066890,AdamW,0.0011838698041700775,,,0.0003543373724332759,,,,3,,,0.0021947986413837564,,COMPLETE
22,22,31.25,2025-05-25 01:39:58.177390,2025-05-25 01:40:11.629252,0 days 00:00:13.451862,AdamW,0.05663207576530692,,,0.00015007087917377423,,,,2,,,0.0018437181180018408,,PRUNED
23,23,33.333333333333336,2025-05-25 01:40:11.686982,2025-05-25 01:40:25.293197,0 days 00:00:13.606215,AdamW,0.049755245288971434,,,0.001523820517595914,,,,4,,,0.0017293242888142125,,PRUNED
24,24,47.916666666666664,2025-05-25 01:40:25.328521,2025-05-25 01:40:56.844023,0 days 00:00:31.515502,AdamW,0.14281820714462504,,,7.504642116813735e-05,,,,5,,,0.003639324958787431,,COMPLETE
25,25,29.166666666666668,2025-05-25 01:40:56.895877,2025-05-25 01:41:10.342773,0 days 00:00:13.446896,AdamW,0.046088232499824605,,,0.0005958053804449612,,,,1,,,0.0009760269856156882,,PRUNED
26,26,33.333333333333336,2025-05-25 01:41:10.400470,2025-05-25 01:41:20.458744,0 days 00:00:10.058274,AdamW,0.10029368280809103,,,5.1777354675925276e-05,,,,3,,,0.004602273066689471,,PRUNED
27,27,33.333333333333336,2025-05-25 01:41:20.517014,2025-05-25 01:41:31.648799,0 days 00:00:11.131785,AdamW,0.19429588925935704,,,0.003206785905409232,,,,4,,,0.0010855123662302558,,PRUNED
28,28,52.083333333333336,2025-05-25 01:41:31.706337,2025-05-25 01:41:55.273020,0 days 00:00:23.566683,AdamW,0.037929074471544866,,,0.0003895852682376518,,,,7,,,0.0024899652149944543,,COMPLETE
29,29,31.25,2025-05-25 01:41:55.324653,2025-05-25 01:42:05.531112,0 days 00:00:10.206459,Adadelta,0.1276540657650679,64.45644666931992,,,,,,9,0.01286892803974938,,,,PRUNED
30,30,33.333333333333336,2025-05-25 01:42:05.575477,2025-05-25 01:42:16.886734,0 days 00:00:11.311257,AdamW,0.07612539035883709,,,0.008288075176264155,,,,8,,,0.008351302863963867,,PRUNED
31,31,35.416666666666664,2025-05-25 01:42:16.934512,2025-05-25 01:42:27.658553,0 days 00:00:10.724041,AdamW,0.025289820886582756,,,0.0003748197271882666,,,,7,,,0.00242229207155408,,PRUNED
32,32,33.333333333333336,2025-05-25 01:42:27.705171,2025-05-25 01:42:40.262075,0 days 00:00:12.556904,AdamW,0.02647018781809024,,,0.09769656942728046,,,,6,,,0.0014340077228554215,,PRUNED
33,33,29.166666666666668,2025-05-25 01:42:40.297328,2025-05-25 01:42:51.128589,0 days 00:00:10.831261,AdamW,0.1222166254387317,,,0.00019658307266057166,,,,3,,,0.0031107173952576355,,PRUNED
34,34,35.416666666666664,2025-05-25 01:42:51.163223,2025-05-25 01:43:02.999736,0 days 00:00:11.836513,AdamW,0.06907755829431447,,,4.4792132635954846e-05,,,,8,,,0.0008403991127384979,,PRUNED
35,35,37.5,2025-05-25 01:43:03.048278,2025-05-25 01:43:14.269617,0 days 00:00:11.221339,Adadelta,0.033178648478509744,0.019088210580947403,,,,,,6,0.013380939940168727,,,,PRUNED
36,36,35.416666666666664,2025-05-25 01:43:14.304612,2025-05-25 01:43:26.350516,0 days 00:00:12.045904,AdamW,0.16527512402557187,,,0.0008963844736755385,,,,5,,,0.004675329111589604,,PRUNED
37,37,,2025-05-25 01:43:26.377285,2025-05-25 01:43:34.881407,0 days 00:00:08.504122,SGD,0.2250672399871337,,,,2.3338934350649964e-05,77.338643178308,True,1,,,,14.688686511696513,PRUNED
38,38,35.416666666666664,2025-05-25 01:43:34.914802,2025-05-25 01:43:46.195914,0 days 00:00:11.281112,AdamW,0.00013105615235636803,,,0.00023237835620144433,,,,7,,,0.002731203355965227,,PRUNED
39,39,33.333333333333336,2025-05-25 01:43:46.229366,2025-05-25 01:43:58.414718,0 days 00:00:12.185352,Adadelta,0.09146490511452943,0.2697998746826366,,,,,,2,1.2731205051110535,,,,PRUNED
40,40,29.166666666666668,2025-05-25 01:43:58.470820,2025-05-25 01:44:10.365822,0 days 00:00:11.895002,AdamW,0.31070675839922435,,,8.598151750442189e-05,,,,4,,,0.001361491677919836,,PRUNED
41,41,52.083333333333336,2025-05-25 01:44:10.424278,2025-05-25 01:44:41.294784,0 days 00:00:30.870506,AdamW,0.1673961578856933,,,4.296820711291829e-05,,,,5,,,0.0028304939385853673,,COMPLETE
42,42,37.5,2025-05-25 01:44:41.344968,2025-05-25 01:44:51.462720,0 days 00:00:10.117752,AdamW,0.1912836053054484,,,2.849791199773055e-05,,,,5,,,0.002466951547232025,,PRUNED
43,43,35.416666666666664,2025-05-25 01:44:51.571189,2025-05-25 01:45:03.978853,0 days 00:00:12.407664,AdamW,0.2913530412993829,,,1.1025569398052585e-05,,,,5,,,0.0064750774319615595,,PRUNED
44,44,45.833333333333336,2025-05-25 01:45:04.017067,2025-05-25 01:45:19.939164,0 days 00:00:15.922097,AdamW,0.11407501300159556,,,0.0006505889108961461,,,,6,,,0.001814658704564396,,COMPLETE
45,45,,2025-05-25 01:45:19.977103,2025-05-25 01:45:24.374925,0 days 00:00:04.397822,SGD,0.07787081843952093,,,,0.07697336416909212,42.12679479091756,True,4,,,,0.014941059416646479,PRUNED
46,46,58.333333333333336,2025-05-25 01:45:24.401889,2025-05-25 01:45:47.391664,0 days 00:00:22.989775,AdamW,0.024301855879648917,,,8.747289227219845e-05,,,,2,,,0.0032799345155396877,,COMPLETE
47,47,25.0,2025-05-25 01:45:47.442326,2025-05-25 01:45:59.024045,0 days 00:00:11.581719,AdamW,0.15715806514818823,,,3.399211687187677e-05,,,,2,,,0.005715574971435298,,PRUNED
48,48,35.416666666666664,2025-05-25 01:45:59.063529,2025-05-25 01:46:04.470462,0 days 00:00:05.406933,AdamW,0.2477528131142287,,,0.00011725769036003972,,,,3,,,0.0033126856282810224,,PRUNED
49,49,33.333333333333336,2025-05-25 01:46:04.514349,2025-05-25 01:46:11.240758,0 days 00:00:06.726409,Adadelta,0.03769385316269885,95.61311598960178,,,,,,0,0.5053832131184154,,,,PRUNED
50,50,,2025-05-25 01:46:11.279261,2025-05-25 01:46:19.751243,0 days 00:00:08.471982,SGD,0.21760061337028574,,,,0.00019617051137421125,42.03591090791143,False,3,,,,2.7110278397957037,PRUNED
51,51,54.166666666666664,2025-05-25 01:46:19.784908,2025-05-25 01:46:48.545907,0 days 00:00:28.760999,AdamW,0.013991983471051225,,,0.00038089523017488796,,,,6,,,0.0030106892761195283,,COMPLETE
52,52,37.5,2025-05-25 01:46:48.595913,2025-05-25 01:47:02.428206,0 days 00:00:13.832293,AdamW,0.05983399850197091,,,7.41761119111983e-05,,,,1,,,0.0029692629447345947,,PRUNED
53,53,31.25,2025-05-25 01:47:02.462436,2025-05-25 01:47:14.266452,0 days 00:00:11.804016,AdamW,0.02125634490545661,,,0.00014272409591552175,,,,7,,,0.003587364418819281,,PRUNED
54,54,33.333333333333336,2025-05-25 01:47:14.301082,2025-05-25 01:47:24.060707,0 days 00:00:09.759625,Adam,0.459534053117081,,0.003286921444548942,,,,,2,,79.51003155964935,,,PRUNED
55,55,60.416666666666664,2025-05-25 01:47:24.099190,2025-05-25 01:47:49.364424,0 days 00:00:25.265234,AdamW,0.08330998314709871,,,0.0005531834246987923,,,,3,,,0.00014301571442349302,,COMPLETE
56,56,33.333333333333336,2025-05-25 01:47:49.415198,2025-05-25 01:48:02.777200,0 days 00:00:13.362002,AdamW,0.07932784003227297,,,0.0014925059828925227,,,,4,,,0.0002693837986560611,,PRUNED
57,57,39.583333333333336,2025-05-25 01:48:02.834400,2025-05-25 01:48:22.995666,0 days 00:00:20.161266,AdamW,0.1027253955957508,,,0.0005047502831505297,,,,5,,,0.00010004368951167413,,PRUNED
58,58,33.333333333333336,2025-05-25 01:48:23.056208,2025-05-25 01:48:34.079529,0 days 00:00:11.023321,AdamW,0.016911464020833513,,,0.0027003696156245034,,,,7,,,0.0006002116442824279,,PRUNED
59,59,33.333333333333336,2025-05-25 01:48:34.113425,2025-05-25 01:48:46.739220,0 days 00:00:12.625795,Adam,0.04623517709623626,,0.0866438695660128,,,,,6,,6.763840093094753,,,PRUNED
60,60,35.416666666666664,2025-05-25 01:48:46.773959,2025-05-25 01:48:58.641840,0 days 00:00:11.867881,AdamW,0.059596743709088684,,,0.0010534791020581481,,,,2,,,0.00011012742632583101,,PRUNED
61,61,35.416666666666664,2025-05-25 01:48:58.701252,2025-05-25 01:49:11.857509,0 days 00:00:13.156257,AdamW,0.014756965231060829,,,2.259817125392968e-05,,,,3,,,0.00018505991224164567,,PRUNED
62,62,33.333333333333336,2025-05-25 01:49:11.896929,2025-05-25 01:49:24.617674,0 days 00:00:12.720745,AdamW,0.1409346233758523,,,0.0002598183359496321,,,,3,,,0.0014392447355863446,,PRUNED
63,63,45.833333333333336,2025-05-25 01:49:24.675280,2025-05-25 01:49:57.830939,0 days 00:00:33.155659,AdamW,0.035604206408168276,,,0.0004312967905437668,,,,4,,,0.002355207212170709,,COMPLETE
64,64,58.333333333333336,2025-05-25 01:49:57.881225,2025-05-25 01:50:31.213661,0 days 00:00:33.332436,AdamW,0.0837200657671373,,,0.0001090692311756341,,,,3,,,0.0052475135263636416,,COMPLETE
65,65,35.416666666666664,2025-05-25 01:50:31.263628,2025-05-25 01:50:43.364505,0 days 00:00:12.100877,AdamW,0.09095263216171211,,,0.00010684399350853723,,,,8,,,0.0060073734604508934,,PRUNED
66,66,31.25,2025-05-25 01:50:43.411211,2025-05-25 01:50:56.845774,0 days 00:00:13.434563,AdamW,0.06479399686056769,,,0.00017918710700512956,,,,3,,,0.004098104033856728,,PRUNED
67,67,52.083333333333336,2025-05-25 01:50:56.907777,2025-05-25 01:51:30.301078,0 days 00:00:33.393301,AdamW,0.1097189645123414,,,0.0003142520301211927,,,,2,,,0.00526073265542585,,COMPLETE
68,68,33.333333333333336,2025-05-25 01:51:30.353689,2025-05-25 01:51:40.758411,0 days 00:00:10.404722,AdamW,0.04651865777200481,,,5.779134862220899e-05,,,,4,,,0.007767612051602567,,PRUNED
69,69,33.333333333333336,2025-05-25 01:51:40.798017,2025-05-25 01:51:46.739327,0 days 00:00:05.941310,Adadelta,0.08217305060064782,0.24925247345003218,,,,,,1,8.396148259479292,,,,PRUNED
70,70,,2025-05-25 01:51:46.778746,2025-05-25 01:51:51.058162,0 days 00:00:04.279416,SGD,0.015035435743385901,,,,0.00036058949372141876,66.46390702129571,True,5,,,,1.1072077330342096,PRUNED
71,71,50.0,2025-05-25 01:51:51.096268,2025-05-25 01:52:20.291442,0 days 00:00:29.195174,AdamW,0.10508184674125792,,,0.0002960236166015448,,,,2,,,0.00564702733703509,,COMPLETE
72,72,33.333333333333336,2025-05-25 01:52:20.341560,2025-05-25 01:52:26.849199,0 days 00:00:06.507639,AdamW,0.11208357092677647,,,0.0008707254487408019,,,,1,,,0.004772579492906935,,PRUNED
73,73,45.833333333333336,2025-05-25 01:52:26.900619,2025-05-25 01:52:58.821545,0 days 00:00:31.920926,AdamW,0.1322319422889527,,,0.0005040919531156404,,,,2,,,0.0036780158159685056,,COMPLETE
74,74,33.333333333333336,2025-05-25 01:52:58.871895,2025-05-25 01:53:12.510609,0 days 00:00:13.638714,AdamW,0.03537610289318981,,,0.00017001550862565535,,,,3,,,0.001958625434028588,,PRUNED
75,75,35.416666666666664,2025-05-25 01:53:12.546778,2025-05-25 01:53:25.903799,0 days 00:00:13.357021,AdamW,0.05943693291455827,,,0.0003101457439357481,,,,3,,,0.0028383635727915663,,PRUNED
76,76,37.5,2025-05-25 01:53:25.961792,2025-05-25 01:53:39.254160,0 days 00:00:13.292368,AdamW,0.07159530317014293,,,0.00011468234947911403,,,,2,,,0.009781983493461658,,PRUNED
77,77,33.333333333333336,2025-05-25 01:53:39.315976,2025-05-25 01:53:52.710290,0 days 00:00:13.394314,Adam,0.08816115383830826,,0.013358063538315845,,,,,1,,3.7206057312420078,,,PRUNED
78,78,35.416666666666664,2025-05-25 01:53:52.769095,2025-05-25 01:54:01.431263,0 days 00:00:08.662168,AdamW,0.1882633751273323,,,0.0007124678822574464,,,,6,,,0.004203891712126864,,PRUNED
79,79,33.333333333333336,2025-05-25 01:54:01.457913,2025-05-25 01:54:14.242680,0 days 00:00:12.784767,AdamW,0.12225566047011874,,,0.0013292246415098324,,,,2,,,0.00032575681646200983,,PRUNED
80,80,39.583333333333336,2025-05-25 01:54:14.305870,2025-05-25 01:54:24.434504,0 days 00:00:10.128634,AdamW,0.00323166599931575,,,0.00035108350127814174,,,,6,,,0.002130677548366645,,PRUNED
81,81,35.416666666666664,2025-05-25 01:54:24.468090,2025-05-25 01:54:37.896474,0 days 00:00:13.428384,AdamW,0.1561574061124813,,,5.867354725777095e-05,,,,3,,,0.0025743356037418656,,PRUNED
82,82,35.416666666666664,2025-05-25 01:54:37.955896,2025-05-25 01:54:46.730238,0 days 00:00:08.774342,AdamW,0.18414345116744668,,,3.879845426208635e-05,,,,4,,,0.0032521335809932443,,PRUNED
83,83,31.25,2025-05-25 01:54:46.787900,2025-05-25 01:54:59.971598,0 days 00:00:13.183698,AdamW,0.0267291756133146,,,1.9932240494939814e-05,,,,2,,,0.0015785386164767355,,PRUNED
84,84,29.166666666666668,2025-05-25 01:55:00.032092,2025-05-25 01:55:07.177858,0 days 00:00:07.145766,AdamW,0.05168613836362802,,,7.822350429270548e-05,,,,3,,,0.004823795427371311,,PRUNED
85,85,33.333333333333336,2025-05-25 01:55:07.234665,2025-05-25 01:55:13.845116,0 days 00:00:06.610451,AdamW,0.039814930855279304,,,0.00022772036214247174,,,,3,,,0.0012319127006560982,,PRUNED
86,86,47.916666666666664,2025-05-25 01:55:13.903050,2025-05-25 01:55:43.991499,0 days 00:00:30.088449,AdamW,0.2335612802753742,,,0.000571355363881283,,,,5,,,0.007151948619557859,,COMPLETE
87,87,33.333333333333336,2025-05-25 01:55:44.042388,2025-05-25 01:55:54.295394,0 days 00:00:10.253006,Adadelta,0.20586867424354088,6.8772042266264055,,,,,,7,0.13032471921302038,,,,PRUNED
88,88,,2025-05-25 01:55:54.321686,2025-05-25 01:56:00.333894,0 days 00:00:06.012208,SGD,0.14678481897974216,,,,0.03822927253823338,24.025286178740576,False,4,,,,11.685504752514538,PRUNED
89,89,27.083333333333332,2025-05-25 01:56:00.387193,2025-05-25 01:56:13.374027,0 days 00:00:12.986834,AdamW,0.07119410586900868,,,0.00014299524444119687,,,,0,,,0.002055834039760318,,PRUNED
90,90,33.333333333333336,2025-05-25 01:56:13.433346,2025-05-25 01:56:22.573542,0 days 00:00:09.140196,AdamW,0.26508319076117637,,,0.00039133173035551665,,,,2,,,0.003968322688446919,,PRUNED
91,91,33.333333333333336,2025-05-25 01:56:22.613043,2025-05-25 01:56:29.983910,0 days 00:00:07.370867,AdamW,0.01095532445925158,,,0.00028496410505631994,,,,7,,,0.0027867391281901806,,PRUNED
92,92,50.0,2025-05-25 01:56:30.019258,2025-05-25 01:56:52.747242,0 days 00:00:22.727984,AdamW,0.02632021297844439,,,0.00020196867239849576,,,,6,,,0.0017318764005697814,,COMPLETE
93,93,35.416666666666664,2025-05-25 01:56:52.799145,2025-05-25 01:57:06.637017,0 days 00:00:13.837872,AdamW,0.009550661032278876,,,9.163854005563818e-05,,,,5,,,0.0022072319573482194,,PRUNED
94,94,35.416666666666664,2025-05-25 01:57:06.693422,2025-05-25 01:57:15.302335,0 days 00:00:08.608913,AdamW,0.0002584741973099096,,,6.16054636671158e-05,,,,8,,,0.0030680300723049457,,PRUNED
95,95,31.25,2025-05-25 01:57:15.336207,2025-05-25 01:57:22.157957,0 days 00:00:06.821750,AdamW,0.17301027727828347,,,4.764330069154491e-05,,,,6,,,0.0009743129589971761,,PRUNED
96,96,33.333333333333336,2025-05-25 01:57:22.192279,2025-05-25 01:57:35.459942,0 days 00:00:13.267663,AdamW,0.04987288215978258,,,0.0007528500949033196,,,,4,,,0.0052367656698758345,,PRUNED
97,97,33.333333333333336,2025-05-25 01:57:35.495033,2025-05-25 01:57:42.816172,0 days 00:00:07.321139,Adam,0.09685802878952797,,0.0009749536913735565,,,,,3,,11.766630382687485,,,PRUNED
98,98,25.0,2025-05-25 01:57:42.855728,2025-05-25 01:57:49.603894,0 days 00:00:06.748166,AdamW,0.3610097304899344,,,3.268663034892938e-05,,,,5,,,0.0006688142230560195,,PRUNED
99,99,33.333333333333336,2025-05-25 01:57:49.659372,2025-05-25 01:58:01.689004,0 days 00:00:12.029632,AdamW,0.11435535976392858,,,0.002019961575716164,,,,7,,,0.002458063706350803,,PRUNED
100,100,33.333333333333336,2025-05-25 01:58:01.723698,2025-05-25 01:58:09.383530,0 days 00:00:07.659832,AdamW,0.045352024589014966,,,0.08844241319717973,,,,6,,,0.0017016905831808973,,PRUNED
101,101,33.333333333333336,2025-05-25 01:58:09.409926,2025-05-25 01:58:22.153702,0 days 00:00:12.743776,AdamW,0.1359720918558173,,,0.0002922647620517536,,,,2,,,0.006466693748276032,,PRUNED
102,102,33.333333333333336,2025-05-25 01:58:22.212685,2025-05-25 01:58:34.010063,0 days 00:00:11.797378,AdamW,0.10481786066027533,,,0.00041912318512727503,,,,1,,,0.003496744335759516,,PRUNED
103,103,37.5,2025-05-25 01:58:34.068221,2025-05-25 01:58:47.339903,0 days 00:00:13.271682,AdamW,0.030735206430889214,,,0.00023823405844260116,,,,2,,,0.004261482375788233,,PRUNED
104,104,35.416666666666664,2025-05-25 01:58:47.398765,2025-05-25 01:58:56.716519,0 days 00:00:09.317754,AdamW,0.08440197983114012,,,0.0004976556913461123,,,,3,,,0.0059079823863732155,,PRUNED
105,105,33.333333333333336,2025-05-25 01:58:56.757412,2025-05-25 01:59:07.116901,0 days 00:00:10.359489,AdamW,0.01892333028768512,,,0.001100291689454669,,,,2,,,0.0025825159269930193,,PRUNED
106,106,33.333333333333336,2025-05-25 01:59:07.174678,2025-05-25 01:59:16.457276,0 days 00:00:09.282598,Adadelta,0.11062488204654529,0.17781381448921865,,,,,,1,5.195242491255168,,,,PRUNED
107,107,,2025-05-25 01:59:16.513241,2025-05-25 01:59:21.667846,0 days 00:00:05.154605,SGD,0.06474249615120986,,,,0.0013553554091796818,98.83607832678976,False,2,,,,0.18830460191938755,PRUNED
108,108,33.333333333333336,2025-05-25 01:59:21.693290,2025-05-25 01:59:27.728156,0 days 00:00:06.034866,AdamW,0.07494669325232273,,,0.0001349202402541968,,,,3,,,0.00042134394390144536,,PRUNED
109,109,33.333333333333336,2025-05-25 01:59:27.778714,2025-05-25 01:59:34.198726,0 days 00:00:06.420012,AdamW,0.12455422961177433,,,0.00036970744739744357,,,,2,,,0.002995401186529894,,PRUNED
110,110,50.0,2025-05-25 01:59:34.238320,2025-05-25 01:59:59.848922,0 days 00:00:25.610602,AdamW,0.053013412856929884,,,0.00019410604999302525,,,,3,,,0.005209544371440121,,COMPLETE
111,111,39.583333333333336,2025-05-25 01:59:59.896399,2025-05-25 02:00:05.719058,0 days 00:00:05.822659,AdamW,0.023258850844712665,,,0.0002091384857152189,,,,6,,,0.001815181642171356,,PRUNED
112,112,33.333333333333336,2025-05-25 02:00:05.745970,2025-05-25 02:00:12.157488,0 days 00:00:06.411518,AdamW,0.03820513073217905,,,0.00010448652870387139,,,,6,,,0.0016270619162654834,,PRUNED
113,113,31.25,2025-05-25 02:00:12.189341,2025-05-25 02:00:23.599668,0 days 00:00:11.410327,AdamW,0.007784765494475019,,,0.0002859201660886925,,,,9,,,0.00014933839832519303,,PRUNED
