,number,value,datetime_start,datetime_complete,duration,params_algorithm,params_dropout_rate,params_lr_Adadelta,params_lr_Adam,params_lr_AdamW,params_lr_SGD,params_momentum_SGD,params_nesterov_SGD,params_suggested_freeze,params_weight_decay_Adadelta,params_weight_decay_Adam,params_weight_decay_AdamW,params_weight_decay_SGD,state
460,460,39.583333333333336,2025-05-25 03:14:20.128979,2025-05-25 03:14:33.407803,0 days 00:00:13.278824,AdamW,0.04150322882418752,,,0.00014070488203912247,,,,5,,,0.003474442095577493,,PRUNED
461,461,33.333333333333336,2025-05-25 03:14:33.466226,2025-05-25 03:14:46.886517,0 days 00:00:13.420291,AdamW,0.2600249803500694,,,2.1720119753020402e-05,,,,1,,,0.0027309916471215624,,PRUNED
462,462,33.333333333333336,2025-05-25 03:14:46.947814,2025-05-25 03:14:59.531760,0 days 00:00:12.583946,AdamW,0.1432878148080752,,,0.00011525348394567878,,,,3,,,0.00233328167202549,,PRUNED
463,463,33.333333333333336,2025-05-25 03:14:59.586747,2025-05-25 03:15:12.532684,0 days 00:00:12.945937,Adadelta,0.07976443957875554,0.5275938150855026,,,,,,1,0.03290557551099478,,,,PRUNED
464,464,43.75,2025-05-25 03:15:12.570449,2025-05-25 03:15:39.597333,0 days 00:00:27.026884,AdamW,0.002057380246843172,,,0.00018208423732286297,,,,2,,,0.006244399856147314,,COMPLETE
465,465,47.916666666666664,2025-05-25 03:15:39.653590,2025-05-25 03:16:08.045513,0 days 00:00:28.391923,AdamW,0.02202276603456945,,,0.0003199408521941706,,,,3,,,0.0019289018714121428,,COMPLETE
466,466,,2025-05-25 03:16:08.100186,2025-05-25 03:16:12.892002,0 days 00:00:04.791816,SGD,0.059647512254929425,,,,0.001466756971681371,53.61073107344276,False,6,,,,0.46656143030507663,PRUNED
467,467,43.75,2025-05-25 03:16:12.926788,2025-05-25 03:16:19.224535,0 days 00:00:06.297747,AdamW,0.013705943148478353,,,0.0007289683921645407,,,,1,,,0.0009300330445700868,,PRUNED
468,468,33.333333333333336,2025-05-25 03:16:19.265929,2025-05-25 03:16:25.584466,0 days 00:00:06.318537,AdamW,0.08951865554275876,,,0.00022962039382834834,,,,7,,,0.0030434718219348187,,PRUNED
469,469,29.166666666666668,2025-05-25 03:16:25.634751,2025-05-25 03:16:38.755645,0 days 00:00:13.120894,AdamW,0.04026992506903837,,,8.161554707856117e-05,,,,5,,,0.0017116793700502828,,PRUNED
470,470,35.416666666666664,2025-05-25 03:16:38.815932,2025-05-25 03:16:45.282041,0 days 00:00:06.466109,AdamW,0.029255859947841214,,,0.0003855597579145332,,,,2,,,0.0015534882378731598,,PRUNED
471,471,29.166666666666668,2025-05-25 03:16:45.348819,2025-05-25 03:16:51.147075,0 days 00:00:05.798256,AdamW,0.05152632191298481,,,0.00027271926114961814,,,,4,,,0.0024593296256460884,,PRUNED
472,472,31.25,2025-05-25 03:16:51.187823,2025-05-25 03:17:02.242974,0 days 00:00:11.055151,AdamW,0.10630686512967025,,,0.0005749138182761977,,,,3,,,0.0021169386213361983,,PRUNED
473,473,37.5,2025-05-25 03:17:02.304189,2025-05-25 03:17:13.614848,0 days 00:00:11.310659,AdamW,0.18760325620263527,,,0.00015689324942550872,,,,2,,,0.004822953589284823,,PRUNED
474,474,33.333333333333336,2025-05-25 03:17:13.678184,2025-05-25 03:17:26.279390,0 days 00:00:12.601206,AdamW,0.06710777462456036,,,0.00019738724532728785,,,,1,,,0.003983008126544528,,PRUNED
475,475,33.333333333333336,2025-05-25 03:17:26.340677,2025-05-25 03:17:37.573000,0 days 00:00:11.232323,AdamW,0.019552255949008487,,,0.0011229521312833553,,,,4,,,0.002773888215883718,,PRUNED
476,476,29.166666666666668,2025-05-25 03:17:37.612786,2025-05-25 03:17:45.252640,0 days 00:00:07.639854,AdamW,0.03544539659113797,,,5.1593346613747434e-05,,,,1,,,0.0018299703366104357,,PRUNED
477,477,29.166666666666668,2025-05-25 03:17:45.314393,2025-05-25 03:17:57.970456,0 days 00:00:12.656063,AdamW,0.007315272594321944,,,0.0002924269058656688,,,,6,,,0.0022662554152693575,,PRUNED
478,478,31.25,2025-05-25 03:17:58.026973,2025-05-25 03:18:07.285313,0 days 00:00:09.258340,Adam,0.16725023774866876,,0.0015942024833222846,,,,,3,,0.019235548272491666,,,PRUNED
479,479,31.25,2025-05-25 03:18:07.346365,2025-05-25 03:18:20.935735,0 days 00:00:13.589370,AdamW,0.12048648512702242,,,0.00021312337296433553,,,,2,,,0.00020357666695160437,,PRUNED
480,480,33.333333333333336,2025-05-25 03:18:20.997219,2025-05-25 03:18:30.853285,0 days 00:00:09.856066,AdamW,0.05179770751101789,,,0.000372633593658148,,,,5,,,0.002573217670206291,,PRUNED
481,481,41.666666666666664,2025-05-25 03:18:30.915550,2025-05-25 03:18:44.293458,0 days 00:00:13.377908,AdamW,0.07783777087979077,,,0.0002407982669042876,,,,2,,,0.0013695945221123896,,PRUNED
482,482,37.5,2025-05-25 03:18:44.355321,2025-05-25 03:18:51.730496,0 days 00:00:07.375175,AdamW,0.02624075984759958,,,0.00012103263677583939,,,,1,,,0.0020340925814544253,,PRUNED
483,483,35.416666666666664,2025-05-25 03:18:51.771972,2025-05-25 03:18:59.635684,0 days 00:00:07.863712,AdamW,0.03574438902408113,,,0.0004897830032629631,,,,3,,,0.0052249598288891756,,PRUNED
484,484,31.25,2025-05-25 03:18:59.699373,2025-05-25 03:19:07.152847,0 days 00:00:07.453474,AdamW,0.012592843537699733,,,0.0001654332552500634,,,,4,,,0.00283793489117765,,PRUNED
485,485,27.083333333333332,2025-05-25 03:19:07.215546,2025-05-25 03:19:12.726815,0 days 00:00:05.511269,AdamW,0.06088520682697421,,,0.0003244184059114869,,,,0,,,0.0033209115980877097,,PRUNED
486,486,52.083333333333336,2025-05-25 03:19:12.755270,2025-05-25 03:19:33.557666,0 days 00:00:20.802396,AdamW,0.30031460621366823,,,0.0002543507270772541,,,,5,,,0.0015527059511839824,,COMPLETE
487,487,33.333333333333336,2025-05-25 03:19:33.608691,2025-05-25 03:19:46.570902,0 days 00:00:12.962211,Adadelta,0.04513651165624899,36.17678874340175,,,,,,1,0.7345958651148681,,,,PRUNED
488,488,39.583333333333336,2025-05-25 03:19:46.632903,2025-05-25 03:19:57.302952,0 days 00:00:10.670049,AdamW,0.08756042553244198,,,0.00013571323544213186,,,,6,,,0.005542273172633774,,PRUNED
489,489,41.666666666666664,2025-05-25 03:19:57.353264,2025-05-25 03:20:08.118314,0 days 00:00:10.765050,AdamW,0.0708873232832843,,,0.00020106441654549863,,,,2,,,0.0024541120006366414,,PRUNED
490,490,39.583333333333336,2025-05-25 03:20:08.148033,2025-05-25 03:20:16.382198,0 days 00:00:08.234165,AdamW,0.023099867090061673,,,0.00044504494946713465,,,,7,,,0.0011197966137075166,,PRUNED
491,491,,2025-05-25 03:20:16.420414,2025-05-25 03:20:29.769155,0 days 00:00:13.348741,SGD,0.03497092877397843,,,,0.023049151015567756,11.986162441953525,True,2,,,,0.08252544606135943,PRUNED
492,492,31.25,2025-05-25 03:20:29.807036,2025-05-25 03:20:43.172964,0 days 00:00:13.365928,AdamW,0.00048286951784498773,,,0.00010027687122539237,,,,4,,,0.0017372393230028552,,PRUNED
493,493,20.833333333333332,2025-05-25 03:20:43.235149,2025-05-25 03:20:55.147117,0 days 00:00:11.911968,AdamW,0.051881666725205146,,,0.0002891089377806447,,,,8,,,0.002175498404623914,,PRUNED
494,494,33.333333333333336,2025-05-25 03:20:55.202387,2025-05-25 03:21:08.723355,0 days 00:00:13.520968,AdamW,0.01769651154177229,,,0.00016772647300502405,,,,3,,,0.001944488577437658,,PRUNED
495,495,33.333333333333336,2025-05-25 03:21:08.785103,2025-05-25 03:21:22.252258,0 days 00:00:13.467155,AdamW,0.09962973815162576,,,0.00038480726410831235,,,,2,,,0.0035947389875571494,,PRUNED
496,496,35.416666666666664,2025-05-25 03:21:22.313942,2025-05-25 03:21:35.450449,0 days 00:00:13.136507,AdamW,0.030384430725513802,,,7.044737103203273e-05,,,,1,,,0.004431120070600052,,PRUNED
497,497,33.333333333333336,2025-05-25 03:21:35.509904,2025-05-25 03:21:45.451849,0 days 00:00:09.941945,AdamW,0.2327327523874314,,,0.09951281491545229,,,,7,,,0.0006351418466981463,,PRUNED
498,498,43.75,2025-05-25 03:21:45.504272,2025-05-25 03:21:59.031749,0 days 00:00:13.527477,AdamW,0.039541670540436405,,,0.00023041205336568689,,,,4,,,0.003067449772524035,,PRUNED
499,499,41.666666666666664,2025-05-25 03:21:59.092507,2025-05-25 03:22:11.654441,0 days 00:00:12.561934,AdamW,0.13198295281844916,,,0.00030825666353898187,,,,6,,,0.0026468107830402033,,PRUNED
500,500,33.333333333333336,2025-05-25 03:22:11.709741,2025-05-25 03:22:25.167344,0 days 00:00:13.457603,Adam,0.07926607250561345,,0.005450043659524359,,,,,2,,0.09855455102596225,,,PRUNED
501,501,27.083333333333332,2025-05-25 03:22:25.222712,2025-05-25 03:22:38.272655,0 days 00:00:13.049943,AdamW,0.060378710524824325,,,3.4757111914523296e-05,,,,3,,,0.0023161034477814303,,PRUNED
502,502,39.583333333333336,2025-05-25 03:22:38.334999,2025-05-25 03:22:50.718994,0 days 00:00:12.383995,AdamW,0.011191715315462293,,,0.00018815654372943334,,,,1,,,0.001831235050700937,,PRUNED
503,503,37.5,2025-05-25 03:22:50.760099,2025-05-25 03:22:57.681996,0 days 00:00:06.921897,AdamW,0.047832354606108754,,,0.0009178321259711765,,,,5,,,0.002447897386230342,,PRUNED
504,504,35.416666666666664,2025-05-25 03:22:57.742978,2025-05-25 03:23:10.900691,0 days 00:00:13.157713,AdamW,0.025008040338126543,,,0.0002683755620650452,,,,4,,,0.0012252019044227582,,PRUNED
505,505,37.5,2025-05-25 03:23:10.959796,2025-05-25 03:23:22.776240,0 days 00:00:11.816444,AdamW,0.06758157738531465,,,0.00014280327227255286,,,,2,,,0.006877560841433027,,PRUNED
506,506,39.583333333333336,2025-05-25 03:23:22.842791,2025-05-25 03:23:30.472153,0 days 00:00:07.629362,AdamW,0.20487887032139973,,,0.0002210114150217423,,,,6,,,0.005916225376591851,,PRUNED
507,507,37.5,2025-05-25 03:23:30.523208,2025-05-25 03:23:42.392599,0 days 00:00:11.869391,AdamW,0.09269309859233847,,,0.00036044962569705866,,,,3,,,0.002064719868586704,,PRUNED
508,508,41.666666666666664,2025-05-25 03:23:42.448738,2025-05-25 03:23:51.607291,0 days 00:00:09.158553,AdamW,0.019471084541306895,,,0.0004574778919370042,,,,8,,,0.0015957765285576676,,PRUNED
509,509,31.25,2025-05-25 03:23:51.642935,2025-05-25 03:24:02.502558,0 days 00:00:10.859623,AdamW,0.039642417096244414,,,0.0006351236799825182,,,,4,,,0.000158401691690821,,PRUNED
510,510,31.25,2025-05-25 03:24:02.560796,2025-05-25 03:24:09.769005,0 days 00:00:07.208209,AdamW,0.054074487895487806,,,0.00011232565948369902,,,,2,,,0.00010088142372608838,,PRUNED
511,511,45.833333333333336,2025-05-25 03:24:09.810251,2025-05-25 03:24:35.504766,0 days 00:00:25.694515,AdamW,0.028162051353734813,,,0.0002586930008428298,,,,0,,,0.0028540270289573945,,COMPLETE
512,512,33.333333333333336,2025-05-25 03:24:35.555886,2025-05-25 03:24:45.829603,0 days 00:00:10.273717,Adadelta,0.007070471131252757,1.5052811927387884,,,,,,5,2.47596677179637,,,,PRUNED
513,513,35.416666666666664,2025-05-25 03:24:45.868333,2025-05-25 03:24:59.610424,0 days 00:00:13.742091,AdamW,0.15111562074039708,,,0.00032738197491470264,,,,1,,,0.002185633594458194,,PRUNED
514,514,35.416666666666664,2025-05-25 03:24:59.673221,2025-05-25 03:25:13.103266,0 days 00:00:13.430045,AdamW,0.07566691771396097,,,8.40813446098787e-05,,,,1,,,0.0014025507876795455,,PRUNED
515,515,,2025-05-25 03:25:13.166419,2025-05-25 03:25:24.987658,0 days 00:00:11.821239,SGD,0.38812134537897525,,,,0.0002476160257530052,45.43015105046108,False,2,,,,5.273427146616624,PRUNED
516,516,41.666666666666664,2025-05-25 03:25:25.025387,2025-05-25 03:25:38.546933,0 days 00:00:13.521546,AdamW,0.04482143125042609,,,0.00017623991913881843,,,,3,,,0.002569791238316642,,PRUNED
517,517,45.833333333333336,2025-05-25 03:25:38.588169,2025-05-25 03:26:11.734232,0 days 00:00:33.146063,AdamW,0.03424505429114379,,,0.00020833434440407653,,,,4,,,0.00312236267536423,,COMPLETE
518,518,37.5,2025-05-25 03:26:11.789941,2025-05-25 03:26:23.433053,0 days 00:00:11.643112,AdamW,0.021565728766021572,,,0.0001441464459101998,,,,1,,,0.004997788478341573,,PRUNED
519,519,33.333333333333336,2025-05-25 03:26:23.473103,2025-05-25 03:26:29.626067,0 days 00:00:06.152964,AdamW,0.08839353957751722,,,0.0032476847648297493,,,,2,,,0.0018243658378195643,,PRUNED
520,520,35.416666666666664,2025-05-25 03:26:29.666983,2025-05-25 03:26:36.088279,0 days 00:00:06.421296,AdamW,0.012064912345975011,,,0.0002940770019366971,,,,4,,,0.0009722728713453644,,PRUNED
521,521,31.25,2025-05-25 03:26:36.149017,2025-05-25 03:26:49.335718,0 days 00:00:13.186701,AdamW,0.06241055075321958,,,0.0005577298498472689,,,,5,,,0.001956862583973569,,PRUNED
522,522,43.75,2025-05-25 03:26:49.400886,2025-05-25 03:27:00.102411,0 days 00:00:10.701525,AdamW,0.10933905765066773,,,0.0003521398991659978,,,,3,,,0.0023114996304952197,,PRUNED
523,523,43.75,2025-05-25 03:27:00.144190,2025-05-25 03:27:20.355687,0 days 00:00:20.211497,AdamW,0.0003187859127262785,,,0.0002166203932087434,,,,1,,,0.0020745239667360692,,PRUNED
524,524,33.333333333333336,2025-05-25 03:27:20.418678,2025-05-25 03:27:30.316956,0 days 00:00:09.898278,Adam,0.17774182469881605,,3.9221916218050284e-05,,,,,5,,22.29344554030327,,,PRUNED
525,525,33.333333333333336,2025-05-25 03:27:30.376593,2025-05-25 03:27:42.843775,0 days 00:00:12.467182,AdamW,0.04821849147763084,,,0.00025021275850788154,,,,6,,,0.0027173562902313214,,PRUNED
526,526,33.333333333333336,2025-05-25 03:27:42.900128,2025-05-25 03:27:56.412594,0 days 00:00:13.512466,AdamW,0.032534349485855596,,,0.0001664351780146904,,,,2,,,0.004140080517624495,,PRUNED
527,527,33.333333333333336,2025-05-25 03:27:56.451459,2025-05-25 03:28:09.373942,0 days 00:00:12.922483,AdamW,0.0715690932857722,,,2.6399156652028706e-05,,,,2,,,0.0030027274256410217,,PRUNED
528,528,33.333333333333336,2025-05-25 03:28:09.438435,2025-05-25 03:28:23.084270,0 days 00:00:13.645835,AdamW,0.017719525537758005,,,0.0004141230390046958,,,,3,,,0.00027193012595011533,,PRUNED
529,529,50.0,2025-05-25 03:28:23.147577,2025-05-25 03:28:55.798624,0 days 00:00:32.651047,AdamW,0.16363854221865137,,,0.00029523246791847717,,,,4,,,0.001506757596011845,,COMPLETE
530,530,37.5,2025-05-25 03:28:55.854422,2025-05-25 03:29:09.358141,0 days 00:00:13.503719,AdamW,0.05762563040137993,,,0.00018973410791514565,,,,1,,,0.0016444531759996044,,PRUNED
531,531,35.416666666666664,2025-05-25 03:29:09.420530,2025-05-25 03:29:21.986334,0 days 00:00:12.565804,AdamW,0.0244982621852431,,,0.00011941036994616556,,,,1,,,0.002451831349999348,,PRUNED
532,532,52.083333333333336,2025-05-25 03:29:22.050905,2025-05-25 03:29:53.741607,0 days 00:00:31.690702,AdamW,0.4998769962595618,,,0.00024157354711209386,,,,2,,,0.003682607859274671,,COMPLETE
533,533,35.416666666666664,2025-05-25 03:29:53.781568,2025-05-25 03:30:03.091102,0 days 00:00:09.309534,AdamW,0.03739552493022272,,,9.250690084984514e-05,,,,6,,,0.004684520709037776,,PRUNED
534,534,35.416666666666664,2025-05-25 03:30:03.148434,2025-05-25 03:30:16.097726,0 days 00:00:12.949292,AdamW,0.43282458045276534,,,0.0003551712977836448,,,,4,,,0.0017039824710952274,,PRUNED
535,535,43.75,2025-05-25 03:30:16.137482,2025-05-25 03:30:27.664939,0 days 00:00:11.527457,AdamW,0.08433871820565512,,,0.00014573514179515784,,,,3,,,0.00196679676890882,,PRUNED
536,536,29.166666666666668,2025-05-25 03:30:27.726532,2025-05-25 03:30:37.010476,0 days 00:00:09.283944,AdamW,0.19448673801517902,,,0.00048688654477841987,,,,9,,,0.0022272180384175187,,PRUNED
537,537,35.416666666666664,2025-05-25 03:30:37.060432,2025-05-25 03:30:50.524020,0 days 00:00:13.463588,Adadelta,0.04732879467313872,0.026360637171115725,,,,,,1,0.2838786766379649,,,,PRUNED
538,538,37.5,2025-05-25 03:30:50.562870,2025-05-25 03:31:00.976186,0 days 00:00:10.413316,AdamW,0.10320535233375186,,,0.0002739536200904223,,,,3,,,0.005508795985176249,,PRUNED
539,539,,2025-05-25 03:31:01.038159,2025-05-25 03:31:14.276219,0 days 00:00:13.238060,SGD,0.011108758378642086,,,,1.5612377814608147e-05,62.984466556674626,True,2,,,,0.02031789635228989,PRUNED
540,540,41.666666666666664,2025-05-25 03:31:14.333852,2025-05-25 03:31:22.159745,0 days 00:00:07.825893,AdamW,0.13845749419543948,,,0.0002054168219257845,,,,0,,,0.0010767857432115735,,PRUNED
541,541,33.333333333333336,2025-05-25 03:31:22.222391,2025-05-25 03:31:35.046813,0 days 00:00:12.824422,AdamW,0.028855020553410615,,,0.00039647510990100765,,,,4,,,0.0033550700622520004,,PRUNED
542,542,33.333333333333336,2025-05-25 03:31:35.073593,2025-05-25 03:31:44.422271,0 days 00:00:09.348678,AdamW,0.07074416680276749,,,0.06671600214622544,,,,7,,,0.002665465845552708,,PRUNED
543,543,35.416666666666664,2025-05-25 03:31:44.461595,2025-05-25 03:31:56.686810,0 days 00:00:12.225215,AdamW,0.0545831067982345,,,0.00016936410069620257,,,,5,,,0.0012800565407277732,,PRUNED
544,544,35.416666666666664,2025-05-25 03:31:56.751111,2025-05-25 03:32:10.152489,0 days 00:00:13.401378,AdamW,0.04377229723088557,,,4.745623031701976e-05,,,,2,,,0.001761369978806554,,PRUNED
545,545,33.333333333333336,2025-05-25 03:32:10.216476,2025-05-25 03:32:19.024932,0 days 00:00:08.808456,AdamW,0.022297774632273518,,,0.00023442967795413988,,,,3,,,0.0023348511021982986,,PRUNED
546,546,31.25,2025-05-25 03:32:19.087350,2025-05-25 03:32:32.662200,0 days 00:00:13.574850,AdamW,0.09433933893575973,,,0.000306321566002169,,,,1,,,0.0008387928491895872,,PRUNED
547,547,33.333333333333336,2025-05-25 03:32:32.729553,2025-05-25 03:32:38.561760,0 days 00:00:05.832207,AdamW,0.3723682353111062,,,0.00012368256574741968,,,,4,,,0.0029679859546212026,,PRUNED
548,548,52.083333333333336,2025-05-25 03:32:38.602403,2025-05-25 03:32:58.132750,0 days 00:00:19.530347,AdamW,0.03637058893591402,,,0.00018944347763220727,,,,2,,,0.006102296963418957,,COMPLETE
549,549,33.333333333333336,2025-05-25 03:32:58.188275,2025-05-25 03:33:10.871104,0 days 00:00:12.682829,AdamW,0.01281472527417656,,,0.0002520508506415695,,,,6,,,0.0025547482208297073,,PRUNED
550,550,37.5,2025-05-25 03:33:10.936646,2025-05-25 03:33:20.427872,0 days 00:00:09.491226,Adam,0.22409699523628027,,0.00010855164162692908,,,,,8,,0.03932539143393146,,,PRUNED
551,551,33.333333333333336,2025-05-25 03:33:20.473484,2025-05-25 03:33:27.009412,0 days 00:00:06.535928,AdamW,0.0820942739086057,,,0.0003362204397252836,,,,1,,,0.0020782914537655723,,PRUNED
552,552,35.416666666666664,2025-05-25 03:33:27.050112,2025-05-25 03:33:35.111373,0 days 00:00:08.061261,AdamW,0.12210021212887841,,,0.0005372702955266719,,,,3,,,0.0019051321778335156,,PRUNED
553,553,39.583333333333336,2025-05-25 03:33:35.172836,2025-05-25 03:33:48.179772,0 days 00:00:13.006936,AdamW,0.02890202273607235,,,0.00010141346375928209,,,,5,,,0.00038201795715267934,,PRUNED
554,554,41.666666666666664,2025-05-25 03:33:48.235466,2025-05-25 03:34:01.510462,0 days 00:00:13.274996,AdamW,0.06612151449952297,,,0.00015445558616075588,,,,1,,,0.00012597236247593048,,PRUNED
555,555,39.583333333333336,2025-05-25 03:34:01.573895,2025-05-25 03:34:14.255430,0 days 00:00:12.681535,AdamW,0.056386887213746864,,,0.0002286661091976289,,,,4,,,0.0014288686479634282,,PRUNED
556,556,31.25,2025-05-25 03:34:14.317255,2025-05-25 03:34:27.669821,0 days 00:00:13.352566,AdamW,0.03973551612303675,,,0.0014543172418128472,,,,2,,,0.0022861695333796176,,PRUNED
557,557,33.333333333333336,2025-05-25 03:34:27.735656,2025-05-25 03:34:40.285178,0 days 00:00:12.549522,AdamW,0.016677352947715964,,,0.0004288859620293266,,,,6,,,0.0027388869654376446,,PRUNED
558,558,41.666666666666664,2025-05-25 03:34:40.340915,2025-05-25 03:34:53.953607,0 days 00:00:13.612692,AdamW,0.029790476118984346,,,0.00028921933161786686,,,,3,,,0.003303460878260422,,PRUNED
559,559,29.166666666666668,2025-05-25 03:34:54.017976,2025-05-25 03:35:05.265714,0 days 00:00:11.247738,AdamW,0.4562447689558395,,,6.288500478398718e-05,,,,7,,,0.005144189290160291,,PRUNED
560,560,27.083333333333332,2025-05-25 03:35:05.320158,2025-05-25 03:35:18.636631,0 days 00:00:13.316473,AdamW,0.2847209215155726,,,0.00020390040142698862,,,,4,,,0.0020997276903290496,,PRUNED
561,561,43.75,2025-05-25 03:35:18.698602,2025-05-25 03:35:32.404808,0 days 00:00:13.706206,AdamW,0.00656146631150187,,,0.00013391355639964849,,,,3,,,0.004281686693570485,,PRUNED
562,562,29.166666666666668,2025-05-25 03:35:32.468018,2025-05-25 03:35:45.331560,0 days 00:00:12.863542,AdamW,4.6620662307768346e-06,,,0.0003497597659431037,,,,5,,,0.0018016732023578672,,PRUNED
563,563,33.333333333333336,2025-05-25 03:35:45.388759,2025-05-25 03:35:53.436756,0 days 00:00:08.047997,Adadelta,0.045818992717000254,9.560700150390863,,,,,,1,44.95150733957722,,,,PRUNED
564,564,,2025-05-25 03:35:53.497627,2025-05-25 03:36:05.759637,0 days 00:00:12.262010,SGD,0.39912540537402164,,,,0.004517591654115684,30.579452437964967,False,2,,,,0.11379192717819296,PRUNED
565,565,33.333333333333336,2025-05-25 03:36:05.801336,2025-05-25 03:36:16.378797,0 days 00:00:10.577461,AdamW,0.1707965490916012,,,0.000798214738180834,,,,2,,,0.002905777998388855,,PRUNED
566,566,45.833333333333336,2025-05-25 03:36:16.443872,2025-05-25 03:36:48.029563,0 days 00:00:31.585691,AdamW,0.06314209572243668,,,0.0002678244202867091,,,,2,,,0.002486011075487772,,COMPLETE
567,567,33.333333333333336,2025-05-25 03:36:48.086645,2025-05-25 03:37:00.914963,0 days 00:00:12.828318,AdamW,0.020457330383820745,,,0.00018046510294679824,,,,6,,,0.0015976873962815588,,PRUNED
568,568,47.916666666666664,2025-05-25 03:37:00.971047,2025-05-25 03:37:28.252261,0 days 00:00:27.281214,AdamW,0.03624663939772561,,,0.0002251912455411898,,,,1,,,0.009815708960498423,,COMPLETE
569,569,45.833333333333336,2025-05-25 03:37:28.294865,2025-05-25 03:37:56.333995,0 days 00:00:28.039130,AdamW,0.2477036787945635,,,0.0004117340975344599,,,,3,,,0.0038437341894379255,,COMPLETE
570,570,39.583333333333336,2025-05-25 03:37:56.390075,2025-05-25 03:38:09.573069,0 days 00:00:13.182994,AdamW,0.07715334718140412,,,0.0003105488912166239,,,,3,,,0.0022405632563557926,,PRUNED
571,571,39.583333333333336,2025-05-25 03:38:09.631161,2025-05-25 03:38:23.402247,0 days 00:00:13.771086,AdamW,0.05034302616447554,,,0.00014948176178818082,,,,4,,,0.006618890745843969,,PRUNED
572,572,29.166666666666668,2025-05-25 03:38:23.463925,2025-05-25 03:38:31.205837,0 days 00:00:07.741912,AdamW,0.028186403964318027,,,7.839194353989085e-05,,,,5,,,0.008220136400041999,,PRUNED
573,573,35.416666666666664,2025-05-25 03:38:31.245019,2025-05-25 03:38:42.804020,0 days 00:00:11.559001,Adam,0.09990099199775697,,0.00018898726751161017,,,,,4,,8.98487427983182,,,PRUNED
574,574,33.333333333333336,2025-05-25 03:38:42.865839,2025-05-25 03:38:52.977109,0 days 00:00:10.111270,AdamW,0.11415913529363607,,,0.013571972054090232,,,,2,,,0.0019545811345872185,,PRUNED
