,number,value,datetime_start,datetime_complete,duration,params_algorithm,params_dropout_rate,params_lr_Adadelta,params_lr_Adam,params_lr_AdamW,params_lr_SGD,params_momentum_SGD,params_nesterov_SGD,params_suggested_freeze,params_weight_decay_Adadelta,params_weight_decay_Adam,params_weight_decay_AdamW,params_weight_decay_SGD,state
577,577,33.333333333333336,2025-05-25 23:12:23.056410,2025-05-25 23:12:35.829473,0 days 00:00:12.773063,AdamW,0.26173804119730837,,,0.000848776884854671,,,,1,,,0.000993820169794953,,PRUNED
578,578,47.916666666666664,2025-05-25 23:12:35.877744,2025-05-25 23:13:06.782533,0 days 00:00:30.904789,AdamW,0.23119425821925596,,,0.00042959202767493755,,,,4,,,0.0007457067557335746,,COMPLETE
579,579,39.583333333333336,2025-05-25 23:13:06.836051,2025-05-25 23:13:20.097332,0 days 00:00:13.261281,AdamW,0.1546463577551268,,,0.0002858907990068447,,,,1,,,0.0011121186664319735,,PRUNED
580,580,37.5,2025-05-25 23:13:20.162258,2025-05-25 23:13:31.793178,0 days 00:00:11.630920,AdamW,0.2521172372021497,,,0.0001749270245464446,,,,7,,,0.004661122080410676,,PRUNED
581,581,43.75,2025-05-25 23:13:31.846364,2025-05-25 23:13:44.926868,0 days 00:00:13.080504,AdamW,0.17160910747162356,,,0.0003838851130694744,,,,1,,,0.0009202825148049338,,PRUNED
582,582,60.416666666666664,2025-05-25 23:13:44.989671,2025-05-25 23:14:18.492884,0 days 00:00:33.503213,AdamW,0.19652541710655677,,,0.0005001002444958056,,,,1,,,0.0006912291896498558,,COMPLETE
583,583,33.333333333333336,2025-05-25 23:14:18.548849,2025-05-25 23:14:31.995161,0 days 00:00:13.446312,AdamW,0.19539609303702266,,,0.0005797687111073706,,,,1,,,0.0006598250591446273,,PRUNED
584,584,47.916666666666664,2025-05-25 23:14:32.057364,2025-05-25 23:14:45.335202,0 days 00:00:13.277838,AdamW,0.2076048418405167,,,0.0004974019915784004,,,,2,,,0.0006816095581688094,,PRUNED
585,585,33.333333333333336,2025-05-25 23:14:45.398392,2025-05-25 23:14:58.599528,0 days 00:00:13.201136,AdamW,0.18741327869875712,,,0.00046717959631480187,,,,1,,,0.0005906731759150265,,PRUNED
586,586,37.5,2025-05-25 23:14:58.680495,2025-05-25 23:15:11.728046,0 days 00:00:13.047551,AdamW,0.19632691662656188,,,0.0006299858690255484,,,,2,,,0.0007665079372016458,,PRUNED
587,587,33.333333333333336,2025-05-25 23:15:12.009038,2025-05-25 23:15:25.139221,0 days 00:00:13.130183,AdamW,0.1832405591180021,,,0.00038002632572361485,,,,0,,,0.0005502364633573329,,PRUNED
588,588,41.666666666666664,2025-05-25 23:15:25.201791,2025-05-25 23:15:38.217650,0 days 00:00:13.015859,AdamW,0.20979670979990334,,,0.0003162334156512734,,,,3,,,0.00010616594290949508,,PRUNED
589,589,41.666666666666664,2025-05-25 23:15:38.280079,2025-05-25 23:15:51.537265,0 days 00:00:13.257186,AdamW,0.19975388970599037,,,0.0004528391546146781,,,,1,,,0.0007967312845261742,,PRUNED
590,590,33.333333333333336,2025-05-25 23:15:51.602529,2025-05-25 23:16:05.417122,0 days 00:00:13.814593,Adadelta,0.18295178783678498,0.024424526222839308,,,,,,1,38.60893552474061,,,,PRUNED
591,591,47.916666666666664,2025-05-25 23:16:05.484989,2025-05-25 23:16:18.591653,0 days 00:00:13.106664,AdamW,0.17174901827782726,,,0.00037371165434964255,,,,1,,,0.0007049946706049976,,PRUNED
592,592,50.0,2025-05-25 23:16:18.664608,2025-05-25 23:16:31.821499,0 days 00:00:13.156891,AdamW,0.21443025018159265,,,0.0005535048823023913,,,,1,,,0.0004898784423605173,,PRUNED
593,593,39.583333333333336,2025-05-25 23:16:31.883735,2025-05-25 23:16:45.089086,0 days 00:00:13.205351,AdamW,0.14585332482872135,,,0.00026584653793816166,,,,1,,,0.0006425456229540899,,PRUNED
594,594,35.416666666666664,2025-05-25 23:16:45.152654,2025-05-25 23:16:58.573959,0 days 00:00:13.421305,AdamW,0.19255691236913197,,,0.00042599226033596165,,,,2,,,0.0008200223480666999,,PRUNED
595,595,33.333333333333336,2025-05-25 23:16:58.639888,2025-05-25 23:17:11.739889,0 days 00:00:13.100001,AdamW,0.16258161377736355,,,0.0007086412174860571,,,,0,,,0.0013105313320579098,,PRUNED
596,596,54.166666666666664,2025-05-25 23:17:11.803859,2025-05-25 23:17:44.918543,0 days 00:00:33.114684,AdamW,0.3946038335578417,,,0.00032463718802861445,,,,3,,,0.006510991040551855,,COMPLETE
597,597,,2025-05-25 23:17:44.976087,2025-05-25 23:17:58.308441,0 days 00:00:13.332354,SGD,0.17621131560832792,,,,0.002782218026832444,12.437461183839176,False,1,,,,17.136160215651188,PRUNED
598,598,33.333333333333336,2025-05-25 23:17:58.368684,2025-05-25 23:18:11.409129,0 days 00:00:13.040445,AdamW,0.20356313556843558,,,0.00021423838723339648,,,,1,,,0.0008906731328144508,,PRUNED
599,599,62.5,2025-05-25 23:18:11.480231,2025-05-25 23:18:42.420547,0 days 00:00:30.940316,AdamW,0.12725685211638116,,,0.0005073033754747506,,,,1,,,0.0007229410637106812,,COMPLETE
600,600,29.166666666666668,2025-05-25 23:18:42.478334,2025-05-25 23:18:55.755932,0 days 00:00:13.277598,AdamW,0.12563668853479829,,,0.0005227920471234069,,,,2,,,0.000718234896779984,,PRUNED
601,601,33.333333333333336,2025-05-25 23:18:55.818130,2025-05-25 23:19:09.360382,0 days 00:00:13.542252,AdamW,0.12194060116968974,,,0.0008133958584600386,,,,1,,,0.000610345524222178,,PRUNED
602,602,33.333333333333336,2025-05-25 23:19:09.424161,2025-05-25 23:19:22.952656,0 days 00:00:13.528495,AdamW,0.1265883883750672,,,0.0006048445683833596,,,,1,,,0.0007214377763210972,,PRUNED
603,603,43.75,2025-05-25 23:19:23.015363,2025-05-25 23:19:35.953764,0 days 00:00:12.938401,AdamW,0.11755595564640799,,,0.0004746570311294345,,,,4,,,0.0007773977686650523,,PRUNED
604,604,35.416666666666664,2025-05-25 23:19:36.016222,2025-05-25 23:19:49.266008,0 days 00:00:13.249786,AdamW,0.10657005374640557,,,0.0006689322071678342,,,,1,,,0.0008468172217936727,,PRUNED
605,605,60.416666666666664,2025-05-25 23:19:49.337353,2025-05-25 23:20:23.212657,0 days 00:00:33.875304,AdamW,0.13377547052177707,,,0.000255592499003031,,,,1,,,0.0005366817281144079,,COMPLETE
606,606,35.416666666666664,2025-05-25 23:20:23.269339,2025-05-25 23:20:36.585941,0 days 00:00:13.316602,AdamW,0.13189559197185358,,,0.00018343672081316394,,,,2,,,0.0005358032245567582,,PRUNED
607,607,43.75,2025-05-25 23:20:36.650772,2025-05-25 23:20:49.843662,0 days 00:00:13.192890,AdamW,0.14094291314304963,,,0.00024078880769410862,,,,0,,,0.0005943835065374762,,PRUNED
608,608,33.333333333333336,2025-05-25 23:20:49.907802,2025-05-25 23:21:03.269346,0 days 00:00:13.361544,AdamW,0.13361719463425964,,,0.00016763810127342883,,,,1,,,0.0004432015343910445,,PRUNED
609,609,39.583333333333336,2025-05-25 23:21:03.332565,2025-05-25 23:21:16.533129,0 days 00:00:13.200564,AdamW,0.0979145725286239,,,0.0002179506265015036,,,,1,,,0.0006278402977426442,,PRUNED
610,610,41.666666666666664,2025-05-25 23:21:16.597204,2025-05-25 23:21:29.931975,0 days 00:00:13.334771,AdamW,0.11120277619734417,,,0.00013005637745222104,,,,1,,,0.0005446522313629203,,PRUNED
611,611,37.5,2025-05-25 23:21:29.994913,2025-05-25 23:21:43.095707,0 days 00:00:13.100794,AdamW,0.13778947984495848,,,0.00027703614032318345,,,,2,,,0.00047859100967412137,,PRUNED
612,612,43.75,2025-05-25 23:21:43.160776,2025-05-25 23:21:56.522980,0 days 00:00:13.362204,AdamW,0.1240326013962787,,,0.00010577659660002864,,,,1,,,0.0005166942012318991,,PRUNED
613,613,37.5,2025-05-25 23:21:56.586015,2025-05-25 23:22:09.744733,0 days 00:00:13.158718,AdamW,0.14841380549135,,,0.00026231728554605623,,,,1,,,0.0006693500061558089,,PRUNED
614,614,43.75,2025-05-25 23:22:09.807530,2025-05-25 23:22:23.123412,0 days 00:00:13.315882,AdamW,0.134533322417927,,,0.0003421512294513008,,,,2,,,0.0005831736963970372,,PRUNED
615,615,41.666666666666664,2025-05-25 23:22:23.186421,2025-05-25 23:22:36.635764,0 days 00:00:13.449343,AdamW,0.05315118990543557,,,0.00021596499900784102,,,,1,,,0.0004118283611081821,,PRUNED
616,616,37.5,2025-05-25 23:22:36.698826,2025-05-25 23:22:49.951684,0 days 00:00:13.252858,AdamW,0.14250379943942593,,,0.0001548288639649709,,,,1,,,0.0005002808849769178,,PRUNED
617,617,33.333333333333336,2025-05-25 23:22:50.016759,2025-05-25 23:23:03.240701,0 days 00:00:13.223942,Adadelta,0.11729113412779177,7.913954522181184,,,,,,0,0.017303699892501922,,,,PRUNED
618,618,47.916666666666664,2025-05-25 23:23:03.301943,2025-05-25 23:23:16.392830,0 days 00:00:13.090887,AdamW,0.14910695271806582,,,0.0003092901034142062,,,,1,,,0.00072384315790505,,PRUNED
619,619,33.333333333333336,2025-05-25 23:23:16.456111,2025-05-25 23:23:29.847556,0 days 00:00:13.391445,AdamW,0.06487153556891337,,,0.0004225748094921828,,,,2,,,0.002428161590794932,,PRUNED
620,620,35.416666666666664,2025-05-25 23:23:29.912217,2025-05-25 23:23:43.288644,0 days 00:00:13.376427,AdamW,0.132928016135646,,,0.00019012078736172815,,,,1,,,0.0006379147585111283,,PRUNED
621,621,,2025-05-25 23:23:43.351351,2025-05-25 23:23:55.391551,0 days 00:00:12.040200,SGD,0.1576580666869931,,,,1.0571241857312785e-05,76.41617605425436,False,6,,,,4.856117489323494,PRUNED
622,622,41.666666666666664,2025-05-25 23:23:55.448077,2025-05-25 23:24:07.886479,0 days 00:00:12.438402,AdamW,0.14146605481161412,,,0.00026366964743038286,,,,1,,,0.0005618407129754765,,PRUNED
623,623,33.333333333333336,2025-05-25 23:24:07.950708,2025-05-25 23:24:21.345595,0 days 00:00:13.394887,AdamW,0.14945219397488094,,,0.0005679353549171371,,,,1,,,0.0015110508114939108,,PRUNED
624,624,37.5,2025-05-25 23:24:21.409154,2025-05-25 23:24:34.306802,0 days 00:00:12.897648,AdamW,0.11017984505138784,,,0.00034412315988026175,,,,1,,,0.0012090855802866978,,PRUNED
625,625,39.583333333333336,2025-05-25 23:24:34.371287,2025-05-25 23:24:47.545405,0 days 00:00:13.174118,AdamW,0.12946641320252217,,,0.00047782909253476553,,,,3,,,0.0006695067653810907,,PRUNED
626,626,47.916666666666664,2025-05-25 23:24:47.607964,2025-05-25 23:25:01.207803,0 days 00:00:13.599839,AdamW,0.08072405850374796,,,0.00024369507390356238,,,,2,,,0.0017549590891102135,,PRUNED
627,627,41.666666666666664,2025-05-25 23:25:01.271004,2025-05-25 23:25:14.470365,0 days 00:00:13.199361,AdamW,0.1574955322526332,,,0.00039653953574325977,,,,0,,,0.0013900681003665765,,PRUNED
628,628,33.333333333333336,2025-05-25 23:25:14.533038,2025-05-25 23:25:27.954353,0 days 00:00:13.421315,AdamW,0.21789843020409294,,,0.00029989925633483667,,,,1,,,0.0007456455276949774,,PRUNED
629,629,25.0,2025-05-25 23:25:28.017135,2025-05-25 23:25:41.164404,0 days 00:00:13.147269,AdamW,0.3676376453844017,,,0.0006848472272405202,,,,1,,,0.0010584627293294777,,PRUNED
630,630,41.666666666666664,2025-05-25 23:25:41.229282,2025-05-25 23:25:54.623609,0 days 00:00:13.394327,AdamW,0.012308391757703263,,,0.00019220344350444937,,,,2,,,0.000808770317424986,,PRUNED
631,631,35.416666666666664,2025-05-25 23:25:54.685874,2025-05-25 23:26:07.748316,0 days 00:00:13.062442,AdamW,0.2024006637966376,,,0.0005055701785164272,,,,1,,,0.0004756202780871875,,PRUNED
632,632,45.833333333333336,2025-05-25 23:26:07.812867,2025-05-25 23:26:41.572433,0 days 00:00:33.759566,AdamW,0.18949705595102467,,,0.00035528615789713115,,,,1,,,0.0006094132829548819,,COMPLETE
633,633,39.583333333333336,2025-05-25 23:26:41.629510,2025-05-25 23:26:55.215053,0 days 00:00:13.585543,AdamW,0.4293130332023062,,,0.00014609736759539727,,,,1,,,0.0021358222843897113,,PRUNED
634,634,33.333333333333336,2025-05-25 23:26:55.278325,2025-05-25 23:27:08.563552,0 days 00:00:13.285227,AdamW,0.1393752931749573,,,0.0012452971047007188,,,,2,,,0.001278951990951747,,PRUNED
635,635,39.583333333333336,2025-05-25 23:27:08.627648,2025-05-25 23:27:21.798717,0 days 00:00:13.171069,AdamW,0.16163581104888763,,,0.0003091300165755178,,,,1,,,0.00034183242271338234,,PRUNED
636,636,43.75,2025-05-25 23:27:21.861973,2025-05-25 23:27:34.847264,0 days 00:00:12.985291,AdamW,0.1482178070977903,,,0.00024320498136015938,,,,3,,,0.0005510713067691851,,PRUNED
637,637,33.333333333333336,2025-05-25 23:27:34.910675,2025-05-25 23:27:48.355207,0 days 00:00:13.444532,Adadelta,0.2941409290276146,3.1727166785420486,,,,,,1,8.432036394778194,,,,PRUNED
638,638,50.0,2025-05-25 23:27:48.416324,2025-05-25 23:28:01.732538,0 days 00:00:13.316214,AdamW,0.15602310772997374,,,0.0004178077591384611,,,,0,,,0.0009634713409198822,,PRUNED
639,639,33.333333333333336,2025-05-25 23:28:01.796340,2025-05-25 23:28:14.923350,0 days 00:00:13.127010,AdamW,0.1673899693204562,,,0.0009479964118105424,,,,1,,,0.0006979114040138691,,PRUNED
640,640,45.833333333333336,2025-05-25 23:28:14.989274,2025-05-25 23:28:28.353782,0 days 00:00:13.364508,AdamW,0.3156507000416529,,,0.0005253127116877977,,,,2,,,0.00044058408627504234,,PRUNED
641,641,45.833333333333336,2025-05-25 23:28:28.417036,2025-05-25 23:28:41.523184,0 days 00:00:13.106148,AdamW,0.17953228689155393,,,0.0002226010497972624,,,,1,,,0.0008646530891059243,,PRUNED
642,642,41.666666666666664,2025-05-25 23:28:41.586858,2025-05-25 23:28:55.164148,0 days 00:00:13.577290,AdamW,0.12110548921421238,,,0.0002843891275953443,,,,1,,,0.0011454738497734178,,PRUNED
643,643,45.833333333333336,2025-05-25 23:28:55.228248,2025-05-25 23:29:08.001343,0 days 00:00:12.773095,AdamW,0.1942627418896295,,,0.00036610225875507795,,,,5,,,0.003082254473791748,,PRUNED
644,644,43.75,2025-05-25 23:29:08.067203,2025-05-25 23:29:21.493586,0 days 00:00:13.426383,AdamW,0.09146930453932683,,,0.0006139039042238652,,,,0,,,0.0007706210053843348,,PRUNED
645,645,,2025-05-25 23:29:21.558229,2025-05-25 23:29:32.475280,0 days 00:00:10.917051,SGD,0.21111403608670007,,,,0.04044090069431958,67.46112674518872,True,1,,,,0.21157897520690921,PRUNED
646,646,33.333333333333336,2025-05-25 23:29:32.513425,2025-05-25 23:29:44.731047,0 days 00:00:12.217622,AdamW,0.12995662752042753,,,0.0004449642880252553,,,,1,,,0.0036228883973540684,,PRUNED
647,647,45.833333333333336,2025-05-25 23:29:44.793785,2025-05-25 23:29:58.127155,0 days 00:00:13.333370,AdamW,0.14339686523585607,,,0.0001260372273767886,,,,3,,,0.0005212803027493121,,PRUNED
648,648,33.333333333333336,2025-05-25 23:29:58.190242,2025-05-25 23:30:11.025779,0 days 00:00:12.835537,AdamW,0.2026429812443748,,,0.00019031794483394645,,,,2,,,0.0010321554425694024,,PRUNED
649,649,37.5,2025-05-25 23:30:11.089277,2025-05-25 23:30:24.227730,0 days 00:00:13.138453,AdamW,0.06778256680400199,,,0.0003162852607473858,,,,1,,,0.0016126713542384805,,PRUNED
650,650,39.583333333333336,2025-05-25 23:30:24.291678,2025-05-25 23:30:37.371289,0 days 00:00:13.079611,AdamW,0.18592039798589452,,,0.0007623202500260051,,,,1,,,0.0006794468490150013,,PRUNED
651,651,47.916666666666664,2025-05-25 23:30:37.434662,2025-05-25 23:30:50.657607,0 days 00:00:13.222945,AdamW,0.33887400595552464,,,0.00015969991075929748,,,,4,,,0.0009257102645555831,,PRUNED
652,652,41.666666666666664,2025-05-25 23:30:50.720438,2025-05-25 23:31:03.865539,0 days 00:00:13.145101,AdamW,0.16741878692395917,,,8.796915253314044e-05,,,,1,,,0.0014664688070950475,,PRUNED
653,653,33.333333333333336,2025-05-25 23:31:03.928527,2025-05-25 23:31:16.994266,0 days 00:00:13.065739,AdamW,0.10474568714036668,,,0.00041829755286649817,,,,1,,,0.0006086927557511868,,PRUNED
654,654,33.333333333333336,2025-05-25 23:31:17.060388,2025-05-25 23:31:30.561001,0 days 00:00:13.500613,AdamW,0.2836014700016785,,,0.0002472134093309618,,,,2,,,0.001251459825486282,,PRUNED
655,655,35.416666666666664,2025-05-25 23:31:30.625575,2025-05-25 23:31:43.733283,0 days 00:00:13.107708,AdamW,0.1407210878043646,,,0.0004972734385118844,,,,0,,,0.001120234567709633,,PRUNED
656,656,39.583333333333336,2025-05-25 23:31:43.797841,2025-05-25 23:31:55.474985,0 days 00:00:11.677144,AdamW,0.15322297569131882,,,0.00035364498348009263,,,,9,,,0.0008242898219893943,,PRUNED
657,657,33.333333333333336,2025-05-25 23:31:55.526930,2025-05-25 23:32:08.617113,0 days 00:00:13.090183,AdamW,0.16466750622105503,,,0.0029808697979997784,,,,1,,,0.0007451151185065774,,PRUNED
658,658,35.416666666666664,2025-05-25 23:32:08.691072,2025-05-25 23:32:22.061225,0 days 00:00:13.370153,AdamW,0.49970245614966075,,,0.0006007492542382832,,,,1,,,0.0003875587858298005,,PRUNED
659,659,33.333333333333336,2025-05-25 23:32:22.124756,2025-05-25 23:32:33.753705,0 days 00:00:11.628949,AdamW,0.2201678702092525,,,0.0002776367126124486,,,,8,,,0.000998886463162153,,PRUNED
660,660,33.333333333333336,2025-05-25 23:32:33.805958,2025-05-25 23:32:47.039249,0 days 00:00:13.233291,AdamW,0.17547518765854656,,,0.0002116559752062779,,,,1,,,0.0013948638061097227,,PRUNED
661,661,33.333333333333336,2025-05-25 23:32:47.102759,2025-05-25 23:33:00.398718,0 days 00:00:13.295959,Adadelta,0.18771367232745137,1.2209528965799474,,,,,,1,27.759852829023284,,,,PRUNED
662,662,39.583333333333336,2025-05-25 23:33:00.460774,2025-05-25 23:33:13.806319,0 days 00:00:13.345545,AdamW,0.1994276490638242,,,0.0004241974873186483,,,,2,,,0.000504504809239849,,PRUNED
663,663,45.833333333333336,2025-05-25 23:33:13.874934,2025-05-25 23:33:47.891111,0 days 00:00:34.016177,AdamW,0.12314172025352049,,,0.000322932026734015,,,,1,,,0.000878254782242638,,COMPLETE
664,664,47.916666666666664,2025-05-25 23:33:47.950274,2025-05-25 23:34:01.535520,0 days 00:00:13.585246,AdamW,0.4621556976505333,,,0.0005098042675606541,,,,0,,,0.0006645209814148069,,PRUNED
665,665,39.583333333333336,2025-05-25 23:34:01.598326,2025-05-25 23:34:15.031597,0 days 00:00:13.433271,AdamW,0.14989514588869005,,,0.0003835129670409925,,,,2,,,0.00915589292787345,,PRUNED
666,666,37.5,2025-05-25 23:34:15.104165,2025-05-25 23:34:28.333998,0 days 00:00:13.229833,AdamW,0.05347482187125062,,,0.0001064579297798763,,,,2,,,0.0011700143028268353,,PRUNED
667,667,,2025-05-25 23:34:28.397381,2025-05-25 23:34:39.916475,0 days 00:00:11.519094,SGD,0.1349257889264382,,,,0.0001637972462665289,33.52516233956777,True,1,,,,39.885221804604626,PRUNED
668,668,45.833333333333336,2025-05-25 23:34:39.968087,2025-05-25 23:34:53.138284,0 days 00:00:13.170197,AdamW,0.18005740710076595,,,0.00016513099001841963,,,,1,,,0.0005926491859916764,,PRUNED
669,669,37.5,2025-05-25 23:34:53.202054,2025-05-25 23:35:06.523743,0 days 00:00:13.321689,AdamW,0.1149660286339696,,,0.00029478698129159096,,,,1,,,0.0007811944222495086,,PRUNED
670,670,33.333333333333336,2025-05-25 23:35:06.593960,2025-05-25 23:35:19.324640,0 days 00:00:12.730680,AdamW,0.07654220663933758,,,0.00024000968268582488,,,,1,,,0.0009540800578691327,,PRUNED
671,671,33.333333333333336,2025-05-25 23:35:19.390119,2025-05-25 23:35:32.514979,0 days 00:00:13.124860,AdamW,0.3545182743997399,,,0.00152981946070613,,,,1,,,0.0013054398469261918,,PRUNED
672,672,33.333333333333336,2025-05-25 23:35:32.577895,2025-05-25 23:35:45.523016,0 days 00:00:12.945121,AdamW,0.2767509521820011,,,0.00036856915126690776,,,,1,,,0.0004538434063253198,,PRUNED
673,673,39.583333333333336,2025-05-25 23:35:45.587177,2025-05-25 23:35:58.716631,0 days 00:00:13.129454,AdamW,0.1599951820722414,,,0.0005829905768117811,,,,3,,,0.007669427967862565,,PRUNED
674,674,33.333333333333336,2025-05-25 23:35:58.779332,2025-05-25 23:36:11.871664,0 days 00:00:13.092332,AdamW,0.20424075857583854,,,0.028599871165548522,,,,2,,,0.0006909443240743126,,PRUNED
675,675,47.916666666666664,2025-05-25 23:36:11.934929,2025-05-25 23:36:25.130029,0 days 00:00:13.195100,AdamW,0.1753438163312182,,,0.0004692532498538875,,,,1,,,0.0005466164250590149,,PRUNED
676,676,31.25,2025-05-25 23:36:25.194267,2025-05-25 23:36:38.525061,0 days 00:00:13.330794,AdamW,0.21361728112491465,,,0.00019554078254252342,,,,1,,,0.00016370330819433034,,PRUNED
677,677,33.333333333333336,2025-05-25 23:36:38.593210,2025-05-25 23:36:51.721513,0 days 00:00:13.128303,AdamW,0.19249069639426727,,,0.0007120449118541385,,,,1,,,0.0008707493742534974,,PRUNED
678,678,41.666666666666664,2025-05-25 23:36:51.785329,2025-05-25 23:37:04.878934,0 days 00:00:13.093605,AdamW,0.15342102116538453,,,0.0001387356750802859,,,,0,,,0.0010602878085238586,,PRUNED
679,679,29.166666666666668,2025-05-25 23:37:04.942214,2025-05-25 23:37:18.100229,0 days 00:00:13.158015,AdamW,0.035448030893912186,,,7.002554038148493e-05,,,,1,,,0.0007858712104886578,,PRUNED
680,680,37.5,2025-05-25 23:37:18.164676,2025-05-25 23:37:31.608652,0 days 00:00:13.443976,AdamW,0.13120987257595704,,,0.0002664176970866744,,,,2,,,0.0011408748525837341,,PRUNED
681,681,35.416666666666664,2025-05-25 23:37:31.672963,2025-05-25 23:37:44.722760,0 days 00:00:13.049797,AdamW,0.1654167473563865,,,0.0003198627323199544,,,,1,,,0.0006147148935659333,,PRUNED
682,682,18.75,2025-05-25 23:37:44.787536,2025-05-25 23:37:57.907322,0 days 00:00:13.119786,AdamW,0.14686979656915508,,,0.0004001231491430691,,,,1,,,0.0009563991036810244,,PRUNED
683,683,47.916666666666664,2025-05-25 23:37:57.971244,2025-05-25 23:38:11.316518,0 days 00:00:13.345274,AdamW,0.18615846758275295,,,0.0002193357179095007,,,,1,,,0.00042053360468607173,,PRUNED
684,684,39.583333333333336,2025-05-25 23:38:11.380571,2025-05-25 23:38:25.131329,0 days 00:00:13.750758,Adadelta,0.171911908442276,0.13328182439092187,,,,,,2,0.07323180587736701,,,,PRUNED
685,685,35.416666666666664,2025-05-25 23:38:25.192192,2025-05-25 23:38:38.571101,0 days 00:00:13.378909,AdamW,0.19463099799638095,,,0.0008861898544456152,,,,0,,,0.00992343590375367,,PRUNED
686,686,47.916666666666664,2025-05-25 23:38:38.641745,2025-05-25 23:38:51.626465,0 days 00:00:12.984720,AdamW,0.22684715559744695,,,0.0004719183224166255,,,,4,,,0.0007237692601622801,,PRUNED
687,687,33.333333333333336,2025-05-25 23:38:51.688239,2025-05-25 23:39:05.075479,0 days 00:00:13.387240,AdamW,0.13967508857636826,,,0.0005626974550025982,,,,1,,,0.0015463484357456738,,PRUNED
688,688,33.333333333333336,2025-05-25 23:39:05.140038,2025-05-25 23:39:18.258415,0 days 00:00:13.118377,AdamW,0.20476886759962165,,,0.0002818481189566057,,,,3,,,0.001248314848179439,,PRUNED
689,689,33.333333333333336,2025-05-25 23:39:18.321179,2025-05-25 23:39:31.590669,0 days 00:00:13.269490,AdamW,0.15564707675040296,,,0.0003634337901301262,,,,1,,,0.0008515722940697033,,PRUNED
690,690,41.666666666666664,2025-05-25 23:39:31.654419,2025-05-25 23:39:44.965491,0 days 00:00:13.311072,AdamW,0.10012774800477783,,,0.00018219555055876428,,,,2,,,0.0010367065679215103,,PRUNED
691,691,,2025-05-25 23:39:45.029616,2025-05-25 23:39:56.584672,0 days 00:00:11.555056,SGD,0.2913883162382549,,,,0.007212960573752808,44.02042267266414,False,1,,,,0.010599197373880317,PRUNED
