,number,value,datetime_start,datetime_complete,duration,params_algorithm,params_dropout_rate,params_lr_Adadelta,params_lr_Adam,params_lr_AdamW,params_lr_SGD,params_momentum_SGD,params_nesterov_SGD,params_suggested_freeze,params_weight_decay_Adadelta,params_weight_decay_Adam,params_weight_decay_AdamW,params_weight_decay_SGD,state
692,692,39.583333333333336,2025-05-25 23:39:56.624022,2025-05-25 23:40:09.716786,0 days 00:00:13.092764,AdamW,0.1810158187618727,,,0.00023547912183987939,,,,1,,,0.0004931830441039277,,PRUNED
693,693,35.416666666666664,2025-05-25 23:40:09.780390,2025-05-25 23:40:23.008513,0 days 00:00:13.228123,AdamW,0.2176916037200822,,,0.0004161626815606657,,,,0,,,0.0013776607520190453,,PRUNED
694,694,47.916666666666664,2025-05-25 23:40:23.072465,2025-05-25 23:40:36.389515,0 days 00:00:13.317050,AdamW,0.16268915042989804,,,0.00031257767483994583,,,,2,,,0.0005675580592480895,,PRUNED
695,695,50.0,2025-05-25 23:40:36.456201,2025-05-25 23:40:49.492903,0 days 00:00:13.036702,AdamW,0.12870102926642607,,,0.000675005360192831,,,,1,,,0.0006523331461665502,,PRUNED
696,696,54.166666666666664,2025-05-25 23:40:49.556545,2025-05-25 23:41:22.182572,0 days 00:00:32.626027,AdamW,0.2735406183037746,,,0.0004988692220758901,,,,3,,,0.000736474942526885,,COMPLETE
697,697,37.5,2025-05-25 23:41:22.236319,2025-05-25 23:41:34.889091,0 days 00:00:12.652772,AdamW,0.1950580260035269,,,0.0001661846178386292,,,,1,,,0.0008213029557166339,,PRUNED
698,698,37.5,2025-05-25 23:41:34.952771,2025-05-25 23:41:48.169335,0 days 00:00:13.216564,AdamW,0.14558045372245432,,,0.0003518907676358837,,,,1,,,0.000918972679800546,,PRUNED
699,699,43.75,2025-05-25 23:41:48.232989,2025-05-25 23:42:21.862668,0 days 00:00:33.629679,AdamW,0.11585618253746235,,,0.00027757623630517457,,,,1,,,0.0018310375607109553,,COMPLETE
700,700,33.333333333333336,2025-05-25 23:42:21.920480,2025-05-25 23:42:35.590964,0 days 00:00:13.670484,AdamW,0.16098483165717828,,,0.0004424796559515989,,,,1,,,0.001101925397067387,,PRUNED
701,701,31.25,2025-05-25 23:42:35.655398,2025-05-25 23:42:48.992225,0 days 00:00:13.336827,AdamW,0.4081070442869165,,,0.00012860486017603299,,,,2,,,0.0012141877165682533,,PRUNED
702,702,41.666666666666664,2025-05-25 23:42:49.060490,2025-05-25 23:43:02.191318,0 days 00:00:13.130828,AdamW,0.47570752000847916,,,0.00021838852921939782,,,,1,,,0.0006479360816159058,,PRUNED
703,703,35.416666666666664,2025-05-25 23:43:02.255574,2025-05-25 23:43:15.328742,0 days 00:00:13.073168,AdamW,0.17247091359461889,,,0.0005812227194023125,,,,1,,,0.0005219602798130304,,PRUNED
704,704,50.0,2025-05-25 23:43:15.393232,2025-05-25 23:43:28.398011,0 days 00:00:13.004779,AdamW,0.18421340331909997,,,0.00034286007687699143,,,,5,,,0.008968132263811603,,PRUNED
705,705,41.666666666666664,2025-05-25 23:43:28.459424,2025-05-25 23:43:41.591825,0 days 00:00:13.132401,AdamW,0.20470690921089257,,,0.0002652413525053376,,,,2,,,0.00046436896816167707,,PRUNED
706,706,39.583333333333336,2025-05-25 23:43:41.661392,2025-05-25 23:43:54.809190,0 days 00:00:13.147798,AdamW,0.14050818963535214,,,0.0004133264039700913,,,,0,,,0.0014006619374518764,,PRUNED
707,707,33.333333333333336,2025-05-25 23:43:54.874851,2025-05-25 23:44:08.257175,0 days 00:00:13.382324,Adadelta,0.15384472029539173,10.623983798990137,,,,,,1,0.022402401146654292,,,,PRUNED
708,708,39.583333333333336,2025-05-25 23:44:08.320125,2025-05-25 23:44:21.469790,0 days 00:00:13.149665,AdamW,0.26737038365588894,,,0.00047423342117971574,,,,1,,,0.0009984410061216827,,PRUNED
709,709,50.0,2025-05-25 23:44:21.534313,2025-05-25 23:44:34.711981,0 days 00:00:13.177668,AdamW,0.2250248577970483,,,0.0002011159609837262,,,,1,,,0.0016449297453814803,,PRUNED
710,710,37.5,2025-05-25 23:44:34.776564,2025-05-25 23:44:47.918377,0 days 00:00:13.141813,AdamW,0.08695496768553612,,,0.000322913953716377,,,,2,,,0.0007891899855426137,,PRUNED
711,711,43.75,2025-05-25 23:44:47.986109,2025-05-25 23:45:01.625845,0 days 00:00:13.639736,AdamW,0.06546091419330904,,,0.0002453279632118128,,,,1,,,0.000896207173050231,,PRUNED
712,712,52.083333333333336,2025-05-25 23:45:01.699886,2025-05-25 23:45:35.584130,0 days 00:00:33.884244,AdamW,0.1688780891592306,,,0.0005381401946509649,,,,0,,,0.0007194068171527823,,COMPLETE
713,713,37.5,2025-05-25 23:45:35.645072,2025-05-25 23:45:48.896653,0 days 00:00:13.251581,AdamW,0.212112176336427,,,0.00015805439518858056,,,,1,,,0.0005789181366000944,,PRUNED
714,714,33.333333333333336,2025-05-25 23:45:48.960567,2025-05-25 23:46:01.208586,0 days 00:00:12.248019,AdamW,0.19086609964538412,,,0.0007760610202066545,,,,6,,,0.004059315767993422,,PRUNED
715,715,,2025-05-25 23:46:01.266799,2025-05-25 23:46:12.202789,0 days 00:00:10.935990,SGD,0.3101153517296296,,,,0.02295626264260214,16.033911776043908,True,1,,,,88.96623737875666,PRUNED
716,716,43.75,2025-05-25 23:46:12.242481,2025-05-25 23:46:25.332582,0 days 00:00:13.090101,AdamW,0.12643158295173143,,,0.0003742059477496313,,,,1,,,0.0010783965250095457,,PRUNED
717,717,33.333333333333336,2025-05-25 23:46:25.388369,2025-05-25 23:46:37.855369,0 days 00:00:12.467000,AdamW,0.1744819065945287,,,0.0006455130462623414,,,,2,,,0.0071345754617589035,,PRUNED
718,718,39.583333333333336,2025-05-25 23:46:37.919837,2025-05-25 23:46:51.255160,0 days 00:00:13.335323,AdamW,0.3862136843136805,,,0.000299029731665921,,,,1,,,0.001214504650724787,,PRUNED
719,719,35.416666666666664,2025-05-25 23:46:51.320728,2025-05-25 23:47:04.111928,0 days 00:00:12.791200,AdamW,0.14791959407360092,,,0.00010832745658562194,,,,1,,,0.0009618731301873579,,PRUNED
720,720,37.5,2025-05-25 23:47:04.176366,2025-05-25 23:47:17.159160,0 days 00:00:12.982794,AdamW,0.18094076516720609,,,0.00040903957241383474,,,,3,,,0.0008428745913682692,,PRUNED
721,721,43.75,2025-05-25 23:47:17.222533,2025-05-25 23:47:30.413274,0 days 00:00:13.190741,AdamW,0.158889911924119,,,0.00023418768782611227,,,,1,,,0.0006828614292194875,,PRUNED
722,722,37.5,2025-05-25 23:47:30.477475,2025-05-25 23:47:43.763140,0 days 00:00:13.285665,AdamW,0.13684048134252733,,,0.0005156336058239361,,,,4,,,0.0014928840608819374,,PRUNED
723,723,50.0,2025-05-25 23:47:43.825886,2025-05-25 23:47:57.180660,0 days 00:00:13.354774,AdamW,0.28250538410017817,,,0.0003295107073249523,,,,1,,,0.000612462033097524,,PRUNED
724,724,31.25,2025-05-25 23:47:57.244276,2025-05-25 23:48:10.360387,0 days 00:00:13.116111,AdamW,0.23511961542420912,,,0.0001953755556171367,,,,0,,,0.0004229571238292432,,PRUNED
725,725,41.666666666666664,2025-05-25 23:48:10.426370,2025-05-25 23:48:23.541931,0 days 00:00:13.115561,AdamW,0.198840002031193,,,0.0004486899387751879,,,,2,,,0.0013058268053307016,,PRUNED
726,726,33.333333333333336,2025-05-25 23:48:23.606041,2025-05-25 23:48:36.904046,0 days 00:00:13.298005,AdamW,0.16576847117962382,,,0.00029397330038109456,,,,1,,,0.008239511243548806,,PRUNED
727,727,45.833333333333336,2025-05-25 23:48:36.968269,2025-05-25 23:48:50.177105,0 days 00:00:13.208836,AdamW,0.05650213296447987,,,0.0001366651755225716,,,,2,,,0.00037749304508692265,,PRUNED
728,728,33.333333333333336,2025-05-25 23:48:50.241314,2025-05-25 23:49:03.496389,0 days 00:00:13.255075,AdamW,0.21140776138339978,,,0.00037344368154982867,,,,1,,,0.000756308582764618,,PRUNED
729,729,35.416666666666664,2025-05-25 23:49:03.569576,2025-05-25 23:49:16.872649,0 days 00:00:13.303073,AdamW,0.18973047613925018,,,0.0011083163113838068,,,,1,,,0.0011210178395961014,,PRUNED
730,730,33.333333333333336,2025-05-25 23:49:16.937633,2025-05-25 23:49:30.108036,0 days 00:00:13.170403,Adadelta,0.15395819794281104,34.62954718258283,,,,,,2,0.4724686050705553,,,,PRUNED
731,731,37.5,2025-05-25 23:49:30.169892,2025-05-25 23:49:43.327629,0 days 00:00:13.157737,AdamW,0.26271051577821275,,,0.00025732036423500344,,,,1,,,0.0005299517098633203,,PRUNED
732,732,50.0,2025-05-25 23:49:43.393020,2025-05-25 23:49:56.671641,0 days 00:00:13.278621,AdamW,0.1360548968236165,,,0.0005936489224729701,,,,1,,,0.0009097809644798033,,PRUNED
733,733,33.333333333333336,2025-05-25 23:49:56.735728,2025-05-25 23:50:10.135426,0 days 00:00:13.399698,AdamW,0.0779563529111072,,,0.00045098447860263087,,,,1,,,0.0008201273217024372,,PRUNED
734,734,41.666666666666664,2025-05-25 23:50:10.202933,2025-05-25 23:50:23.389761,0 days 00:00:13.186828,AdamW,0.17920271934947915,,,0.00017398225447009207,,,,0,,,0.0004743325481972155,,PRUNED
735,735,39.583333333333336,2025-05-25 23:50:23.454786,2025-05-25 23:50:36.561336,0 days 00:00:13.106550,AdamW,0.44122483388913236,,,0.0003484922159478013,,,,1,,,0.002295228580558605,,PRUNED
736,736,33.333333333333336,2025-05-25 23:50:36.625176,2025-05-25 23:50:50.025570,0 days 00:00:13.400394,AdamW,0.12504299594395168,,,0.009985236116545086,,,,1,,,0.000692192791671296,,PRUNED
737,737,,2025-05-25 23:50:50.090855,2025-05-25 23:51:03.077947,0 days 00:00:12.987092,SGD,0.10957083481952806,,,,0.0003945089570306056,8.088265398596747,False,2,,,,0.39150801085325876,PRUNED
738,738,33.333333333333336,2025-05-25 23:51:03.138124,2025-05-25 23:51:16.366352,0 days 00:00:13.228228,AdamW,0.19727354671800415,,,0.00022744157755164493,,,,1,,,0.0009854158314249605,,PRUNED
739,739,43.75,2025-05-25 23:51:16.432314,2025-05-25 23:51:29.797979,0 days 00:00:13.365665,AdamW,0.1657614907601114,,,0.0002732447339877186,,,,3,,,0.0027874288807040503,,PRUNED
740,740,41.666666666666664,2025-05-25 23:51:29.861681,2025-05-25 23:51:43.022776,0 days 00:00:13.161095,AdamW,0.14788221589515038,,,0.000546468432232897,,,,1,,,0.0006370450021814169,,PRUNED
741,741,45.833333333333336,2025-05-25 23:51:43.088086,2025-05-25 23:52:16.638343,0 days 00:00:33.550257,AdamW,0.18413014088655377,,,0.00039123986833050097,,,,1,,,0.0005820446912943505,,COMPLETE
742,742,47.916666666666664,2025-05-25 23:52:16.696820,2025-05-25 23:52:30.025597,0 days 00:00:13.328777,AdamW,0.21920716966732387,,,0.00047656512335799084,,,,1,,,0.0010485360416597864,,PRUNED
743,743,41.666666666666664,2025-05-25 23:52:30.089551,2025-05-25 23:52:43.387140,0 days 00:00:13.297589,AdamW,0.2730997429722702,,,0.000310588163615477,,,,2,,,0.000753283785722208,,PRUNED
744,744,43.75,2025-05-25 23:52:43.450951,2025-05-25 23:52:56.342082,0 days 00:00:12.891131,AdamW,0.17382066267301888,,,0.00039470035493685063,,,,0,,,0.0013281946070175005,,PRUNED
745,745,43.75,2025-05-25 23:52:56.408131,2025-05-25 23:53:09.509649,0 days 00:00:13.101518,AdamW,0.25403891032596915,,,0.0007015936337635501,,,,1,,,0.000871600174597092,,PRUNED
746,746,41.666666666666664,2025-05-25 23:53:09.573422,2025-05-25 23:53:23.036574,0 days 00:00:13.463152,AdamW,0.04859099994213424,,,0.00015287602801062263,,,,1,,,0.0005058301148949681,,PRUNED
747,747,43.75,2025-05-25 23:53:23.100692,2025-05-25 23:53:36.002475,0 days 00:00:12.901783,AdamW,0.20664595265826013,,,0.00027958536968432753,,,,4,,,0.0011773372178258193,,PRUNED
748,748,37.5,2025-05-25 23:53:36.072079,2025-05-25 23:53:49.175961,0 days 00:00:13.103882,AdamW,0.14363294101832613,,,0.00019591856465856175,,,,2,,,0.0007962204649715579,,PRUNED
749,749,47.916666666666664,2025-05-25 23:53:49.240210,2025-05-25 23:54:02.507676,0 days 00:00:13.267466,AdamW,0.15906711751060937,,,0.000864688134183692,,,,1,,,0.0009398693518726452,,PRUNED
750,750,39.583333333333336,2025-05-25 23:54:02.571867,2025-05-25 23:54:15.655987,0 days 00:00:13.084120,AdamW,0.1912028978109181,,,0.0002280370907345338,,,,3,,,0.0014224053668049903,,PRUNED
751,751,37.5,2025-05-25 23:54:15.719496,2025-05-25 23:54:28.917405,0 days 00:00:13.197909,AdamW,0.2381028242560134,,,0.0005395828143031241,,,,0,,,0.0017045813451221775,,PRUNED
752,752,29.166666666666668,2025-05-25 23:54:28.989858,2025-05-25 23:54:42.395576,0 days 00:00:13.405718,AdamW,0.13276315908301486,,,1.0343829544712411e-05,,,,1,,,0.000705997673627419,,PRUNED
753,753,43.75,2025-05-25 23:54:42.478215,2025-05-25 23:54:55.691286,0 days 00:00:13.213071,AdamW,0.16927452887726008,,,0.0003421674123193749,,,,2,,,0.0020222933168240202,,PRUNED
754,754,33.333333333333336,2025-05-25 23:54:55.756232,2025-05-25 23:55:08.901520,0 days 00:00:13.145288,Adadelta,0.15135023323828278,0.34601776662516437,,,,,,1,0.8436310884649671,,,,PRUNED
755,755,33.333333333333336,2025-05-25 23:55:08.964702,2025-05-25 23:55:22.173223,0 days 00:00:13.208521,AdamW,0.2288198063474424,,,0.0004149484187230637,,,,1,,,0.0005696071630271811,,PRUNED
756,756,33.333333333333336,2025-05-25 23:55:22.238356,2025-05-25 23:55:35.570838,0 days 00:00:13.332482,AdamW,0.09565215629263607,,,0.00012003738473134878,,,,1,,,0.0011946153531092558,,PRUNED
757,757,41.666666666666664,2025-05-25 23:55:35.636074,2025-05-25 23:55:48.708727,0 days 00:00:13.072653,AdamW,0.1177001301753861,,,0.00017656589196843442,,,,1,,,0.0010121412439347657,,PRUNED
758,758,33.333333333333336,2025-05-25 23:55:48.775509,2025-05-25 23:56:01.926029,0 days 00:00:13.150520,AdamW,0.20228337292076512,,,0.0006466717544662504,,,,2,,,0.0008489416837771693,,PRUNED
759,759,33.333333333333336,2025-05-25 23:56:01.990914,2025-05-25 23:56:15.436538,0 days 00:00:13.445624,AdamW,0.2647968924733984,,,0.07472129274816942,,,,1,,,0.0004402731873851629,,PRUNED
760,760,,2025-05-25 23:56:15.500722,2025-05-25 23:56:26.852463,0 days 00:00:11.351741,SGD,0.18273032775335263,,,,0.0018316992082544562,95.33982644814034,True,1,,,,0.13019260281521897,PRUNED
761,761,47.916666666666664,2025-05-25 23:56:26.892171,2025-05-25 23:56:40.025264,0 days 00:00:13.133093,AdamW,0.15832821393246427,,,0.0003075732690292858,,,,1,,,0.0006247540544337897,,PRUNED
762,762,41.666666666666664,2025-05-25 23:56:40.089862,2025-05-25 23:56:53.209915,0 days 00:00:13.120053,AdamW,0.17203598069457685,,,0.0004746288664239307,,,,2,,,0.0010700393537351202,,PRUNED
763,763,33.333333333333336,2025-05-25 23:56:53.274085,2025-05-25 23:57:06.582553,0 days 00:00:13.308468,AdamW,0.29834776717500405,,,0.0002477573063216434,,,,0,,,0.0007322876463314557,,PRUNED
764,764,35.416666666666664,2025-05-25 23:57:06.651234,2025-05-25 23:57:19.854824,0 days 00:00:13.203590,AdamW,0.13629949734992902,,,0.000353726489907937,,,,1,,,0.0009092789383000892,,PRUNED
765,765,33.333333333333336,2025-05-25 23:57:19.919590,2025-05-25 23:57:33.037654,0 days 00:00:13.118064,AdamW,0.4190036222819487,,,0.004307612440953556,,,,1,,,0.001290302377538945,,PRUNED
766,766,43.75,2025-05-25 23:57:33.103494,2025-05-25 23:57:46.161199,0 days 00:00:13.057705,AdamW,0.21022860927814185,,,0.00020828954278223724,,,,1,,,0.000318004918000074,,PRUNED
767,767,25.0,2025-05-25 23:57:46.225270,2025-05-25 23:57:59.236453,0 days 00:00:13.011183,AdamW,0.2878766566296264,,,8.783888233820546e-05,,,,1,,,0.00012201894308008828,,PRUNED
768,768,33.333333333333336,2025-05-25 23:57:59.301117,2025-05-25 23:58:12.532805,0 days 00:00:13.231688,AdamW,0.19453338509914606,,,0.00043546165263054113,,,,1,,,0.0015687679333655164,,PRUNED
769,769,35.416666666666664,2025-05-25 23:58:12.596871,2025-05-25 23:58:25.442602,0 days 00:00:12.845731,AdamW,0.2462009672953225,,,0.00028164684647931837,,,,2,,,0.007869696626565911,,PRUNED
770,770,50.0,2025-05-25 23:58:25.506851,2025-05-25 23:58:38.629323,0 days 00:00:13.122472,AdamW,0.1442246035557608,,,0.0005575900090179975,,,,0,,,0.0006509855894736979,,PRUNED
771,771,52.083333333333336,2025-05-25 23:58:38.693553,2025-05-25 23:59:12.188998,0 days 00:00:33.495445,AdamW,0.1799110781643785,,,0.00034432869366260064,,,,1,,,0.0004703059413057464,,COMPLETE
772,772,35.416666666666664,2025-05-25 23:59:12.247223,2025-05-25 23:59:25.358997,0 days 00:00:13.111774,AdamW,0.15673026954590522,,,0.00014831018414328067,,,,3,,,0.0007855310382976257,,PRUNED
773,773,37.5,2025-05-25 23:59:25.423346,2025-05-25 23:59:38.603377,0 days 00:00:13.180031,AdamW,0.218958498103263,,,0.0003992967865507824,,,,1,,,0.0011832580712202935,,PRUNED
774,774,45.833333333333336,2025-05-25 23:59:38.668444,2025-05-25 23:59:52.996584,0 days 00:00:14.328140,AdamW,0.12695233302016373,,,0.00023852277913461825,,,,1,,,0.0005404583710500931,,PRUNED
775,775,33.333333333333336,2025-05-25 23:59:53.068960,2025-05-26 00:00:06.109183,0 days 00:00:13.040223,AdamW,0.06338181943394168,,,0.0004871066468666261,,,,2,,,0.0003993507690835396,,PRUNED
776,776,39.583333333333336,2025-05-26 00:00:06.174130,2025-05-26 00:00:19.305079,0 days 00:00:13.130949,AdamW,0.16585947221820382,,,0.0006566305599186377,,,,1,,,0.0010320756022429948,,PRUNED
777,777,45.833333333333336,2025-05-26 00:00:19.371949,2025-05-26 00:00:32.696344,0 days 00:00:13.324395,AdamW,0.2560996723478942,,,0.00030496325376410175,,,,2,,,0.003554366000262947,,PRUNED
778,778,31.25,2025-05-26 00:00:32.760457,2025-05-26 00:00:45.932315,0 days 00:00:13.171858,AdamW,0.27777305224187726,,,0.00018140943936065227,,,,1,,,0.0007014193359612544,,PRUNED
779,779,33.333333333333336,2025-05-26 00:00:45.997413,2025-05-26 00:00:59.180457,0 days 00:00:13.183044,Adadelta,0.1884131570648163,3.1180777296905338,,,,,,1,0.2444173330725012,,,,PRUNED
780,780,35.416666666666664,2025-05-26 00:00:59.252370,2025-05-26 00:01:12.342633,0 days 00:00:13.090263,AdamW,0.14726263448716662,,,0.00038988941187611734,,,,0,,,0.0008327789616731166,,PRUNED
781,781,33.333333333333336,2025-05-26 00:01:12.409267,2025-05-26 00:01:25.774813,0 days 00:00:13.365546,AdamW,0.20121992855045834,,,0.0007915196105647765,,,,1,,,0.001495186432601568,,PRUNED
782,782,50.0,2025-05-26 00:01:25.840137,2025-05-26 00:01:59.227934,0 days 00:00:33.387797,AdamW,0.17454584943691562,,,0.000257957869344127,,,,2,,,0.008932362134183823,,COMPLETE
783,783,,2025-05-26 00:01:59.303676,2025-05-26 00:02:12.530897,0 days 00:00:13.227221,SGD,0.029855769446035275,,,,0.0008715381451464663,27.705209172011013,False,1,,,,3.5237940573993827,PRUNED
784,784,33.333333333333336,2025-05-26 00:02:12.591643,2025-05-26 00:02:26.186960,0 days 00:00:13.595317,AdamW,0.10783103116830003,,,0.0004729071147556798,,,,3,,,0.0009530174526130067,,PRUNED
785,785,35.416666666666664,2025-05-26 00:02:26.250914,2025-05-26 00:02:39.457776,0 days 00:00:13.206862,AdamW,0.13807652218010824,,,0.00033023480960643733,,,,1,,,0.0013055933925846441,,PRUNED
786,786,39.583333333333336,2025-05-26 00:02:39.522712,2025-05-26 00:02:52.643530,0 days 00:00:13.120818,AdamW,0.16439986777198481,,,0.000614247789145112,,,,2,,,0.005653453813996136,,PRUNED
787,787,47.916666666666664,2025-05-26 00:02:52.708723,2025-05-26 00:03:06.076080,0 days 00:00:13.367357,AdamW,0.11851605827472975,,,0.0001961505963969241,,,,0,,,0.0007769719665518394,,PRUNED
788,788,33.333333333333336,2025-05-26 00:03:06.143750,2025-05-26 00:03:19.399553,0 days 00:00:13.255803,Adam,0.3680283698178951,,0.007558841648906279,,,,,1,,0.013241078242904498,,,PRUNED
789,789,33.333333333333336,2025-05-26 00:03:19.464438,2025-05-26 00:03:32.401893,0 days 00:00:12.937455,AdamW,0.15306409753516015,,,0.00027810531369861933,,,,1,,,0.0005914921585060986,,PRUNED
790,790,39.583333333333336,2025-05-26 00:03:32.466749,2025-05-26 00:03:44.888320,0 days 00:00:12.421571,AdamW,0.07282484347234791,,,0.00011370834738524428,,,,1,,,0.0011175995888650092,,PRUNED
791,791,39.583333333333336,2025-05-26 00:03:44.953213,2025-05-26 00:03:58.270644,0 days 00:00:13.317431,AdamW,0.1880285593506698,,,0.0003914772554594368,,,,1,,,0.0005081998676935122,,PRUNED
792,792,50.0,2025-05-26 00:03:58.337322,2025-05-26 00:04:10.943612,0 days 00:00:12.606290,AdamW,0.2430987198023289,,,0.0005207959426670086,,,,2,,,0.0006607723191880168,,PRUNED
793,793,50.0,2025-05-26 00:04:11.008659,2025-05-26 00:04:44.704263,0 days 00:00:33.695604,AdamW,0.21217987440574504,,,0.00015210858129241682,,,,1,,,0.000912400212232262,,PRUNED
794,794,35.416666666666664,2025-05-26 00:04:44.774324,2025-05-26 00:04:58.239701,0 days 00:00:13.465377,AdamW,0.26545755828916895,,,0.00022236650919935252,,,,1,,,0.0007417069273005445,,PRUNED
795,795,35.416666666666664,2025-05-26 00:04:58.305999,2025-05-26 00:05:11.389134,0 days 00:00:13.083135,AdamW,0.19781367154769708,,,0.0003435353171310232,,,,1,,,0.001432586219298466,,PRUNED
796,796,33.333333333333336,2025-05-26 00:05:11.453983,2025-05-26 00:05:24.578014,0 days 00:00:13.124031,AdamW,0.2240521914111063,,,0.00042359569325891466,,,,1,,,0.006346356119151543,,PRUNED
797,797,39.583333333333336,2025-05-26 00:05:24.644325,2025-05-26 00:05:37.806086,0 days 00:00:13.161761,AdamW,0.1735089120478015,,,0.0002741630589215455,,,,4,,,0.0008531413811699263,,PRUNED
798,798,43.75,2025-05-26 00:05:37.869402,2025-05-26 00:06:11.307814,0 days 00:00:33.438412,AdamW,0.14296988147874537,,,0.0005401590508157661,,,,2,,,0.0010212270288095051,,COMPLETE
799,799,37.5,2025-05-26 00:06:11.366385,2025-05-26 00:06:24.699050,0 days 00:00:13.332665,AdamW,0.16200081591736387,,,0.0003311704152047753,,,,0,,,0.0005484532456543021,,PRUNED
800,800,33.333333333333336,2025-05-26 00:06:24.763667,2025-05-26 00:06:37.821532,0 days 00:00:13.057865,AdamW,0.12969082853712466,,,5.44447932550824e-05,,,,3,,,0.0011381066173865291,,PRUNED
801,801,31.25,2025-05-26 00:06:37.889646,2025-05-26 00:06:51.368579,0 days 00:00:13.478933,Adadelta,0.18006003326708409,0.03115860054162692,,,,,,1,3.0656268969920126,,,,PRUNED
802,802,41.666666666666664,2025-05-26 00:06:51.432106,2025-05-26 00:07:04.591969,0 days 00:00:13.159863,AdamW,0.15169246489226118,,,0.00022180724377856407,,,,1,,,0.00035114097841338563,,PRUNED
803,803,33.333333333333336,2025-05-26 00:07:04.657603,2025-05-26 00:07:17.858352,0 days 00:00:13.200749,AdamW,0.32451134908019813,,,0.0004356144176538271,,,,1,,,0.0006482749727325199,,PRUNED
804,804,37.5,2025-05-26 00:07:17.923221,2025-05-26 00:07:31.329648,0 days 00:00:13.406427,AdamW,0.20751210671067524,,,0.00017111555346774874,,,,0,,,0.0012715698000732277,,PRUNED
805,805,29.166666666666668,2025-05-26 00:07:31.399529,2025-05-26 00:07:44.471550,0 days 00:00:13.072021,AdamW,0.18738263023580617,,,1.805690591963845e-05,,,,2,,,0.000197827593376394,,PRUNED
806,806,33.333333333333336,2025-05-26 00:07:44.544083,2025-05-26 00:07:57.794022,0 days 00:00:13.249939,AdamW,0.16359903810062443,,,0.000729199694068365,,,,1,,,0.0007980128210311413,,PRUNED
807,807,33.333333333333336,2025-05-26 00:07:57.859317,2025-05-26 00:08:11.212927,0 days 00:00:13.353610,AdamW,0.278457279255737,,,0.00028951109117170284,,,,1,,,0.00046399744544117706,,PRUNED
