,number,value,datetime_start,datetime_complete,duration,params_algorithm,params_dropout_rate,params_lr_Adadelta,params_lr_Adam,params_lr_AdamW,params_lr_SGD,params_momentum_SGD,params_nesterov_SGD,params_suggested_freeze,params_weight_decay_Adadelta,params_weight_decay_Adam,params_weight_decay_AdamW,params_weight_decay_SGD,state
804,804,31.25,2025-05-25 04:28:45.846885,2025-05-25 04:28:58.630631,0 days 00:00:12.783746,AdamW,0.04557993504285502,,,0.00010641286232895467,,,,6,,,0.0007264679083521019,,PRUNED
805,805,50.0,2025-05-25 04:28:58.690768,2025-05-25 04:29:27.913135,0 days 00:00:29.222367,Adadelta,0.03425072397929691,0.050993283725815186,,,,,,6,0.6887391394513762,,,,COMPLETE
806,806,43.75,2025-05-25 04:29:27.974369,2025-05-25 04:29:40.840338,0 days 00:00:12.865969,AdamW,0.4233430091860724,,,0.0001783281233877593,,,,6,,,0.00013437598713921504,,PRUNED
807,807,39.583333333333336,2025-05-25 04:29:40.898932,2025-05-25 04:29:53.576992,0 days 00:00:12.678060,AdamW,0.00801469186252229,,,0.00031045564851911694,,,,6,,,0.0008743455574957954,,PRUNED
808,808,33.333333333333336,2025-05-25 04:29:53.637917,2025-05-25 04:30:06.404536,0 days 00:00:12.766619,AdamW,0.026273124215070397,,,0.00022808504111737613,,,,6,,,0.0001511777245118401,,PRUNED
809,809,,2025-05-25 04:30:06.463514,2025-05-25 04:30:17.872291,0 days 00:00:11.408777,SGD,0.04091001349755527,,,,0.003618519731067937,99.84320243565378,False,6,,,,1.6629120471572094,PRUNED
810,810,35.416666666666664,2025-05-25 04:30:17.930254,2025-05-25 04:30:30.536361,0 days 00:00:12.606107,AdamW,0.0657292053119099,,,0.0001324603641361473,,,,6,,,0.0003732962724398688,,PRUNED
811,811,33.333333333333336,2025-05-25 04:30:30.594584,2025-05-25 04:30:41.770720,0 days 00:00:11.176136,AdamW,0.01648659252834822,,,0.0002883484503650238,,,,1,,,0.0017919269363634068,,PRUNED
812,812,35.416666666666664,2025-05-25 04:30:41.836594,2025-05-25 04:30:54.361180,0 days 00:00:12.524586,AdamW,0.05478335981230001,,,8.080501578916516e-05,,,,6,,,0.0008094400885611691,,PRUNED
813,813,35.416666666666664,2025-05-25 04:30:54.424383,2025-05-25 04:31:07.740800,0 days 00:00:13.316417,AdamW,0.0824868186745117,,,0.0002004673012759792,,,,4,,,0.00031127582692721005,,PRUNED
814,814,56.25,2025-05-25 04:31:07.806003,2025-05-25 04:31:41.071466,0 days 00:00:33.265463,AdamW,0.037079718046260035,,,0.00016044827318291197,,,,1,,,0.0036774537220660825,,COMPLETE
815,815,37.5,2025-05-25 04:31:41.131342,2025-05-25 04:31:53.857982,0 days 00:00:12.726640,AdamW,0.0275887062811496,,,0.00034961160442641956,,,,1,,,0.004435166525453324,,PRUNED
816,816,37.5,2025-05-25 04:31:53.923428,2025-05-25 04:32:06.967596,0 days 00:00:13.044168,AdamW,0.0178040075616362,,,0.00024228504100847652,,,,1,,,0.0036764520927590164,,PRUNED
817,817,50.0,2025-05-25 04:32:07.031961,2025-05-25 04:32:36.040429,0 days 00:00:29.008468,AdamW,0.03305916617836247,,,0.0001755679739704574,,,,1,,,0.004253245548973187,,COMPLETE
818,818,43.75,2025-05-25 04:32:36.100118,2025-05-25 04:33:05.581153,0 days 00:00:29.481035,AdamW,0.009242038713584526,,,0.0002728929919616561,,,,1,,,0.003856149053012046,,PRUNED
819,819,33.333333333333336,2025-05-25 04:33:05.647023,2025-05-25 04:33:19.315053,0 days 00:00:13.668030,Adadelta,0.32087354426594616,4.341784182329174,,,,,,1,69.78889848457281,,,,PRUNED
820,820,37.5,2025-05-25 04:33:19.378936,2025-05-25 04:33:28.429927,0 days 00:00:09.050991,AdamW,0.05043604795463147,,,0.00020709519076435147,,,,1,,,0.0037970238004883905,,PRUNED
821,821,39.583333333333336,2025-05-25 04:33:28.472206,2025-05-25 04:33:33.826086,0 days 00:00:05.353880,AdamW,0.023659111464393968,,,0.00016866712241428707,,,,1,,,0.0036359919026502287,,PRUNED
822,822,60.416666666666664,2025-05-25 04:33:33.867121,2025-05-25 04:33:54.800190,0 days 00:00:20.933069,AdamW,0.036534546987616656,,,0.00033685448180559356,,,,1,,,0.00347408906994057,,COMPLETE
823,823,43.75,2025-05-25 04:33:54.860113,2025-05-25 04:34:24.258007,0 days 00:00:29.397894,AdamW,0.016566601043114526,,,0.00035724124113186567,,,,1,,,0.003462430107750487,,COMPLETE
824,824,33.333333333333336,2025-05-25 04:34:24.317228,2025-05-25 04:34:38.296118,0 days 00:00:13.978890,Adam,0.03010856732249169,,0.0007109225681902829,,,,,0,,0.6881790276945166,,,PRUNED
825,825,33.333333333333336,2025-05-25 04:34:38.362954,2025-05-25 04:34:52.032882,0 days 00:00:13.669928,AdamW,0.00901880368550646,,,0.00033343307790557723,,,,1,,,0.003430620819153247,,PRUNED
826,826,41.666666666666664,2025-05-25 04:34:52.101753,2025-05-25 04:35:05.356131,0 days 00:00:13.254378,AdamW,0.03660176444338805,,,0.0003061077253535445,,,,1,,,0.0034679721202189686,,PRUNED
827,827,37.5,2025-05-25 04:35:05.422012,2025-05-25 04:35:19.097533,0 days 00:00:13.675521,AdamW,0.021571049542366764,,,0.00041851764212665136,,,,2,,,0.004342434832250537,,PRUNED
828,828,35.416666666666664,2025-05-25 04:35:19.163279,2025-05-25 04:35:32.744604,0 days 00:00:13.581325,AdamW,0.0011395828601927054,,,0.0003789743927471359,,,,1,,,0.004048017147540195,,PRUNED
829,829,35.416666666666664,2025-05-25 04:35:32.810053,2025-05-25 04:35:46.411656,0 days 00:00:13.601603,AdamW,0.02824238013973286,,,0.0002623779674195039,,,,2,,,0.0030514676973081196,,PRUNED
830,830,33.333333333333336,2025-05-25 04:35:46.478093,2025-05-25 04:36:00.303624,0 days 00:00:13.825531,Adadelta,0.09236209644007276,0.8732978706027511,,,,,,1,0.1692102235132324,,,,PRUNED
831,831,33.333333333333336,2025-05-25 04:36:00.366980,2025-05-25 04:36:13.853201,0 days 00:00:13.486221,AdamW,0.07612367595610096,,,0.0003088268467781093,,,,1,,,0.0034979561965839388,,PRUNED
832,832,37.5,2025-05-25 04:36:13.930914,2025-05-25 04:36:27.457687,0 days 00:00:13.526773,AdamW,0.03752350205746863,,,0.000523035395474765,,,,2,,,0.003245402012727865,,PRUNED
833,833,,2025-05-25 04:36:27.523776,2025-05-25 04:36:39.121418,0 days 00:00:11.597642,SGD,0.0149747335778606,,,,0.00031659851112465396,73.0227646191907,True,2,,,,8.71604029884028,PRUNED
834,834,43.75,2025-05-25 04:36:39.162809,2025-05-25 04:36:52.977573,0 days 00:00:13.814764,AdamW,0.026657416547794573,,,0.0002367934703425795,,,,1,,,0.003960557400345413,,PRUNED
835,835,50.0,2025-05-25 04:36:53.043186,2025-05-25 04:37:22.014035,0 days 00:00:28.970849,AdamW,0.048214312389382306,,,0.0004241288018858657,,,,6,,,0.0037834586473385503,,COMPLETE
836,836,35.416666666666664,2025-05-25 04:37:22.073722,2025-05-25 04:37:35.598234,0 days 00:00:13.524512,AdamW,0.06969863198249411,,,0.000296911838656597,,,,0,,,0.003084891682082791,,PRUNED
837,837,60.416666666666664,2025-05-25 04:37:35.664778,2025-05-25 04:38:04.803982,0 days 00:00:29.139204,AdamW,0.03659785712333394,,,0.00024376459597771818,,,,6,,,0.004132878015187115,,COMPLETE
838,838,41.666666666666664,2025-05-25 04:38:04.863963,2025-05-25 04:38:17.689628,0 days 00:00:12.825665,AdamW,0.04039978567633254,,,0.00023287157722506088,,,,6,,,0.004146402497034135,,PRUNED
839,839,33.333333333333336,2025-05-25 04:38:17.754225,2025-05-25 04:38:30.570853,0 days 00:00:12.816628,AdamW,0.031806403916201376,,,0.00020573415566303553,,,,6,,,0.00011176784784255451,,PRUNED
840,840,31.25,2025-05-25 04:38:30.634819,2025-05-25 04:38:43.275293,0 days 00:00:12.640474,AdamW,0.05383925900762709,,,0.0002515769413882366,,,,6,,,0.004658572579444297,,PRUNED
841,841,41.666666666666664,2025-05-25 04:38:43.335124,2025-05-25 04:38:56.261374,0 days 00:00:12.926250,AdamW,0.02106025468990634,,,0.00020109700637072723,,,,6,,,0.003871090034564848,,PRUNED
842,842,41.666666666666664,2025-05-25 04:38:56.322001,2025-05-25 04:39:13.262873,0 days 00:00:16.940872,AdamW,0.04119572885963608,,,0.00034173461317544456,,,,6,,,0.003994343653142042,,PRUNED
843,843,31.25,2025-05-25 04:39:13.301264,2025-05-25 04:39:19.710214,0 days 00:00:06.408950,AdamW,0.03311122838991251,,,0.00025434374640520563,,,,6,,,0.004766543413410644,,PRUNED
844,844,33.333333333333336,2025-05-25 04:39:19.769244,2025-05-25 04:39:32.565827,0 days 00:00:12.796583,Adam,0.016009894689112656,,0.0013835042053099713,,,,,6,,0.03743207908783432,,,PRUNED
845,845,43.75,2025-05-25 04:39:32.629438,2025-05-25 04:39:40.754682,0 days 00:00:08.125244,AdamW,0.06159115294294111,,,0.0006238553291663755,,,,6,,,0.004365811701378254,,PRUNED
846,846,33.333333333333336,2025-05-25 04:39:40.793070,2025-05-25 04:39:46.001639,0 days 00:00:05.208569,Adadelta,0.00015249315692780416,0.332514828952362,,,,,,6,0.0396935433336181,,,,PRUNED
847,847,39.583333333333336,2025-05-25 04:39:46.040166,2025-05-25 04:39:51.272937,0 days 00:00:05.232771,AdamW,0.04574965512620191,,,0.0013115693719045582,,,,6,,,0.0035332396509198147,,PRUNED
848,848,27.083333333333332,2025-05-25 04:39:51.311419,2025-05-25 04:39:59.923112,0 days 00:00:08.611693,AdamW,0.02565677304532023,,,0.00018697248684679686,,,,6,,,0.003626764551228479,,PRUNED
849,849,35.416666666666664,2025-05-25 04:39:59.982777,2025-05-25 04:40:12.762108,0 days 00:00:12.779331,AdamW,0.03717284458860221,,,0.000224488827008351,,,,6,,,0.00454763472422904,,PRUNED
850,850,33.333333333333336,2025-05-25 04:40:12.822361,2025-05-25 04:40:25.945115,0 days 00:00:13.122754,AdamW,0.010094760485634229,,,0.00027580534855039564,,,,6,,,0.0034707060087038424,,PRUNED
851,851,33.333333333333336,2025-05-25 04:40:26.007676,2025-05-25 04:40:39.550783,0 days 00:00:13.543107,AdamW,0.056366894999035216,,,0.0003462074796949712,,,,1,,,0.0050962569437486855,,PRUNED
852,852,29.166666666666668,2025-05-25 04:40:39.616087,2025-05-25 04:40:53.257845,0 days 00:00:13.641758,AdamW,0.02451244875768837,,,0.00017032036782774454,,,,1,,,0.0041754545518661,,PRUNED
853,853,41.666666666666664,2025-05-25 04:40:53.324169,2025-05-25 04:41:07.071665,0 days 00:00:13.747496,AdamW,0.04688151361784314,,,0.0003000862628554443,,,,2,,,0.00026252634504147143,,PRUNED
854,854,33.333333333333336,2025-05-25 04:41:07.136935,2025-05-25 04:41:20.618265,0 days 00:00:13.481330,AdamW,0.03340427234691055,,,0.00045098117679027457,,,,2,,,0.004084077962572922,,PRUNED
855,855,33.333333333333336,2025-05-25 04:41:20.683603,2025-05-25 04:41:33.445129,0 days 00:00:12.761526,AdamW,0.017634190314587933,,,0.00023336717672566904,,,,6,,,0.0032262944471164144,,PRUNED
856,856,39.583333333333336,2025-05-25 04:41:33.504719,2025-05-25 04:41:46.139571,0 days 00:00:12.634852,AdamW,0.036217470968619256,,,0.0003728510665270559,,,,6,,,0.004664318507538662,,PRUNED
857,857,,2025-05-25 04:41:46.199079,2025-05-25 04:41:59.312264,0 days 00:00:13.113185,SGD,0.04752525270823808,,,,5.396768021108468e-05,16.60460772636594,False,1,,,,0.2521052892441605,PRUNED
858,858,37.5,2025-05-25 04:41:59.375437,2025-05-25 04:42:12.674333,0 days 00:00:13.298896,AdamW,0.010293168428444542,,,0.00018865489255071824,,,,3,,,0.004243942657615013,,PRUNED
859,859,33.333333333333336,2025-05-25 04:42:12.739070,2025-05-25 04:42:26.323553,0 days 00:00:13.584483,Adadelta,0.025325769244584947,54.71135257824043,,,,,,1,0.08204439213220693,,,,PRUNED
860,860,33.333333333333336,2025-05-25 04:42:26.387186,2025-05-25 04:42:32.856626,0 days 00:00:06.469440,AdamW,0.06692440532462732,,,0.0002833521354002968,,,,6,,,0.0037993570220579845,,PRUNED
861,861,31.25,2025-05-25 04:42:32.914485,2025-05-25 04:42:46.193568,0 days 00:00:13.279083,AdamW,0.05837948200762602,,,0.00016123883147128678,,,,3,,,0.0033028160021980457,,PRUNED
862,862,58.333333333333336,2025-05-25 04:42:46.258697,2025-05-25 04:43:15.466175,0 days 00:00:29.207478,AdamW,0.03139723994407369,,,0.00021731863265374337,,,,1,,,0.0049971292212156555,,COMPLETE
863,863,33.333333333333336,2025-05-25 04:43:15.526963,2025-05-25 04:43:22.725669,0 days 00:00:07.198706,AdamW,0.03807960680205137,,,0.0001879524835847105,,,,1,,,0.004629446051861319,,PRUNED
864,864,35.416666666666664,2025-05-25 04:43:22.798746,2025-05-25 04:43:36.450433,0 days 00:00:13.651687,AdamW,0.4086050327717121,,,0.0002367262457500078,,,,1,,,0.005577438747356839,,PRUNED
865,865,31.25,2025-05-25 04:43:36.516979,2025-05-25 04:43:45.755585,0 days 00:00:09.238606,AdamW,0.3947693312272016,,,0.00014878372868233595,,,,1,,,0.00600285719718976,,PRUNED
866,866,33.333333333333336,2025-05-25 04:43:45.821343,2025-05-25 04:43:59.397156,0 days 00:00:13.575813,AdamW,0.047149808124741004,,,0.0006977102405680226,,,,1,,,0.0049222590426796125,,PRUNED
867,867,43.75,2025-05-25 04:43:59.463163,2025-05-25 04:44:08.170475,0 days 00:00:08.707312,AdamW,0.02029630894978893,,,0.0002694081950141209,,,,1,,,0.0047622673810344815,,PRUNED
868,868,35.416666666666664,2025-05-25 04:44:08.236980,2025-05-25 04:44:21.612616,0 days 00:00:13.375636,AdamW,0.08019524505652839,,,0.0005136163462400667,,,,0,,,0.005186550036824547,,PRUNED
869,869,54.166666666666664,2025-05-25 04:44:21.655708,2025-05-25 04:44:47.911178,0 days 00:00:26.255470,AdamW,0.03191732793997468,,,0.00038369435152529327,,,,1,,,0.005348788177014103,,COMPLETE
870,870,56.25,2025-05-25 04:44:47.954218,2025-05-25 04:45:14.507319,0 days 00:00:26.553101,AdamW,0.054050745560475184,,,0.0002076427758905229,,,,1,,,0.0035562830577346356,,COMPLETE
871,871,33.333333333333336,2025-05-25 04:45:14.548246,2025-05-25 04:45:22.508593,0 days 00:00:07.960347,AdamW,0.05180009648816958,,,0.00012346709392838654,,,,1,,,0.0033263532086158275,,PRUNED
872,872,33.333333333333336,2025-05-25 04:45:22.574967,2025-05-25 04:45:36.319795,0 days 00:00:13.744828,Adam,0.043386974692226354,,0.017707013532406977,,,,,1,,21.225366707172547,,,PRUNED
873,873,31.25,2025-05-25 04:45:36.388440,2025-05-25 04:45:43.192249,0 days 00:00:06.803809,AdamW,0.05325672710725378,,,0.00019123327185155965,,,,1,,,0.0038052782490057124,,PRUNED
874,874,33.333333333333336,2025-05-25 04:45:43.233895,2025-05-25 04:45:50.800505,0 days 00:00:07.566610,Adadelta,0.040145654015917374,23.35319228639672,,,,,,1,18.203069436687283,,,,PRUNED
875,875,33.333333333333336,2025-05-25 04:45:50.845618,2025-05-25 04:45:56.248288,0 days 00:00:05.402670,AdamW,0.05801650127975867,,,0.00015323615462970364,,,,1,,,0.0005533314729758809,,PRUNED
876,876,33.333333333333336,2025-05-25 04:45:56.289203,2025-05-25 04:46:05.328556,0 days 00:00:09.039353,AdamW,0.028349565205253818,,,0.007020013357293128,,,,1,,,0.00359000168399478,,PRUNED
877,877,31.25,2025-05-25 04:46:05.370410,2025-05-25 04:46:16.264943,0 days 00:00:10.894533,AdamW,0.04303575689384273,,,9.380486370108874e-05,,,,1,,,0.003157242611760915,,PRUNED
878,878,47.916666666666664,2025-05-25 04:46:16.330372,2025-05-25 04:46:36.864891,0 days 00:00:20.534519,AdamW,0.00037067199727517167,,,0.00020867010180741747,,,,1,,,0.00016639294264645055,,PRUNED
879,879,52.083333333333336,2025-05-25 04:46:36.930846,2025-05-25 04:47:04.348309,0 days 00:00:27.417463,AdamW,0.033987512036276736,,,0.00016684332218867796,,,,1,,,0.003743523161782768,,COMPLETE
880,880,35.416666666666664,2025-05-25 04:47:04.409675,2025-05-25 04:47:18.294525,0 days 00:00:13.884850,AdamW,0.018245426020102734,,,0.00010906379123881974,,,,1,,,0.003294984767250465,,PRUNED
881,881,33.333333333333336,2025-05-25 04:47:18.359710,2025-05-25 04:47:32.024902,0 days 00:00:13.665192,AdamW,0.05112192371695417,,,0.0002224408602316297,,,,1,,,0.0028776118198200356,,PRUNED
882,882,35.416666666666664,2025-05-25 04:47:32.090451,2025-05-25 04:47:45.541752,0 days 00:00:13.451301,AdamW,0.011173980975351681,,,7.062622620114923e-05,,,,1,,,0.0030619922733117907,,PRUNED
883,883,,2025-05-25 04:47:45.607740,2025-05-25 04:47:57.410421,0 days 00:00:11.802681,SGD,0.025993890145854105,,,,0.001133622078082932,93.77244803309733,False,0,,,,18.534474883102146,PRUNED
884,884,31.25,2025-05-25 04:47:57.452424,2025-05-25 04:48:10.962539,0 days 00:00:13.510115,AdamW,0.06258556470700337,,,0.0009444311351377558,,,,1,,,0.004245965728617977,,PRUNED
885,885,54.166666666666664,2025-05-25 04:48:11.028509,2025-05-25 04:48:43.922992,0 days 00:00:32.894483,AdamW,0.03869552487416831,,,0.00032041062630330086,,,,2,,,0.0037911373840892357,,COMPLETE
886,886,35.416666666666664,2025-05-25 04:48:43.985682,2025-05-25 04:48:57.539857,0 days 00:00:13.554175,AdamW,0.053366169392645935,,,0.00014663197282064778,,,,1,,,0.003368990450364235,,PRUNED
887,887,33.333333333333336,2025-05-25 04:48:57.605597,2025-05-25 04:49:09.994787,0 days 00:00:12.389190,Adadelta,0.028681776720408916,0.682410195007337,,,,,,2,0.022424618072545352,,,,PRUNED
888,888,37.5,2025-05-25 04:49:10.058560,2025-05-25 04:49:23.465658,0 days 00:00:13.407098,AdamW,0.016296749156567925,,,0.0002617931566627546,,,,1,,,0.0029237853133289187,,PRUNED
889,889,50.0,2025-05-25 04:49:23.507526,2025-05-25 04:49:52.896893,0 days 00:00:29.389367,AdamW,0.04442213610507811,,,0.00020212690906019378,,,,1,,,0.0016736522695781596,,COMPLETE
890,890,35.416666666666664,2025-05-25 04:49:52.957791,2025-05-25 04:50:06.049712,0 days 00:00:13.091921,AdamW,0.43513476906682647,,,0.0004231917069093492,,,,1,,,0.0014429678853305672,,PRUNED
891,891,39.583333333333336,2025-05-25 04:50:06.115826,2025-05-25 04:50:19.633053,0 days 00:00:13.517227,AdamW,0.034696866459569146,,,0.00031604012997811265,,,,0,,,0.004008185423204674,,PRUNED
892,892,31.25,2025-05-25 04:50:19.704369,2025-05-25 04:50:31.000842,0 days 00:00:11.296473,AdamW,0.06169499560588207,,,0.00017042182994057715,,,,1,,,0.0034569257035178404,,PRUNED
893,893,39.583333333333336,2025-05-25 04:50:31.066918,2025-05-25 04:50:44.429207,0 days 00:00:13.362289,AdamW,0.009823377965030841,,,0.00012514396539374986,,,,1,,,0.0030690484320568642,,PRUNED
894,894,43.75,2025-05-25 04:50:44.494649,2025-05-25 04:50:58.201327,0 days 00:00:13.706678,AdamW,0.023393870437705286,,,0.00023952934254884415,,,,2,,,0.006801244925163682,,PRUNED
895,895,33.333333333333336,2025-05-25 04:50:58.267908,2025-05-25 04:51:10.669435,0 days 00:00:12.401527,Adam,0.04738994624688151,,0.003306005393939618,,,,,2,,3.1854335270009204,,,PRUNED
896,896,41.666666666666664,2025-05-25 04:51:10.739878,2025-05-25 04:51:23.513816,0 days 00:00:12.773938,AdamW,0.032772686256614565,,,0.0005795613371372582,,,,1,,,0.0017023742722610126,,PRUNED
897,897,27.083333333333332,2025-05-25 04:51:23.573421,2025-05-25 04:51:37.010466,0 days 00:00:13.437045,AdamW,0.0180936360965094,,,0.00028805948057453764,,,,2,,,0.003676935172823766,,PRUNED
898,898,35.416666666666664,2025-05-25 04:51:37.077433,2025-05-25 04:51:47.615664,0 days 00:00:10.538231,AdamW,0.04156492535626262,,,0.00020161201803425973,,,,1,,,0.0042926561551979115,,PRUNED
899,899,41.666666666666664,2025-05-25 04:51:47.682334,2025-05-25 04:52:00.355981,0 days 00:00:12.673647,AdamW,0.0691426536684902,,,0.00014252109342400898,,,,6,,,0.0018144931968502324,,PRUNED
900,900,33.333333333333336,2025-05-25 04:52:00.415900,2025-05-25 04:52:08.872540,0 days 00:00:08.456640,Adadelta,0.025461859068209747,9.998875527973647,,,,,,1,3.9562284896350985,,,,PRUNED
901,901,39.583333333333336,2025-05-25 04:52:08.913552,2025-05-25 04:52:14.545419,0 days 00:00:05.631867,AdamW,0.007298712498756601,,,0.00034836962755191393,,,,2,,,0.0031983421483652527,,PRUNED
902,902,35.416666666666664,2025-05-25 04:52:14.744864,2025-05-25 04:52:20.067349,0 days 00:00:05.322485,AdamW,0.0563104126246163,,,9.062925400027484e-05,,,,0,,,0.0014878811351879784,,PRUNED
903,903,56.25,2025-05-25 04:52:20.110122,2025-05-25 04:52:42.635202,0 days 00:00:22.525080,AdamW,0.03719387271869262,,,0.00023901019028921806,,,,6,,,0.003566331864197229,,COMPLETE
904,904,33.333333333333336,2025-05-25 04:52:42.688002,2025-05-25 04:52:47.698849,0 days 00:00:05.010847,AdamW,0.049618042983752234,,,0.0002284751044167512,,,,6,,,0.0038940099065052037,,PRUNED
905,905,35.416666666666664,2025-05-25 04:52:47.737432,2025-05-25 04:52:53.244698,0 days 00:00:05.507266,AdamW,0.0405843912774019,,,0.000173382701861311,,,,1,,,0.0042855362920203284,,PRUNED
906,906,35.416666666666664,2025-05-25 04:52:53.287727,2025-05-25 04:53:15.912935,0 days 00:00:22.625208,AdamW,0.05926833549264763,,,0.00022289021155854163,,,,6,,,0.004959992368077977,,COMPLETE
907,907,33.333333333333336,2025-05-25 04:53:15.974535,2025-05-25 04:53:29.739431,0 days 00:00:13.764896,AdamW,0.04878756131846063,,,0.00018858611462792217,,,,1,,,0.003640300901417754,,PRUNED
908,908,33.333333333333336,2025-05-25 04:53:29.808882,2025-05-25 04:53:43.409138,0 days 00:00:13.600256,AdamW,0.03754332270826071,,,0.011428270567094879,,,,2,,,0.004160989740181859,,PRUNED
909,909,,2025-05-25 04:53:43.475855,2025-05-25 04:53:55.721751,0 days 00:00:12.245896,SGD,0.06602736039218216,,,,0.09730546990708852,27.778525397408707,True,1,,,,0.030157417738035642,PRUNED
910,910,33.333333333333336,2025-05-25 04:53:55.764869,2025-05-25 04:54:09.276949,0 days 00:00:13.512080,AdamW,0.047264872700102656,,,0.0002555089061456554,,,,1,,,0.003504840708626824,,PRUNED
911,911,31.25,2025-05-25 04:54:09.343820,2025-05-25 04:54:22.082214,0 days 00:00:12.738394,AdamW,0.0327280178262985,,,0.0001962440176823268,,,,6,,,0.0015703588606369397,,PRUNED
912,912,33.333333333333336,2025-05-25 04:54:22.143040,2025-05-25 04:54:35.883708,0 days 00:00:13.740668,AdamW,0.05696116492884924,,,0.00015381435253300854,,,,2,,,0.005802090788426765,,PRUNED
913,913,41.666666666666664,2025-05-25 04:54:35.950581,2025-05-25 04:54:49.458618,0 days 00:00:13.508037,AdamW,0.04001215377881845,,,0.00012158283096343584,,,,1,,,0.004391532942478254,,PRUNED
914,914,39.583333333333336,2025-05-25 04:54:49.526364,2025-05-25 04:55:02.063239,0 days 00:00:12.536875,Adadelta,0.032393208964562575,2.8065029688657117,,,,,,6,0.01118888602217345,,,,PRUNED
915,915,35.416666666666664,2025-05-25 04:55:02.122777,2025-05-25 04:55:15.326010,0 days 00:00:13.203233,AdamW,0.04988135353669746,,,0.0002586963302014491,,,,1,,,0.0036330661612148114,,PRUNED
916,916,31.25,2025-05-25 04:55:15.392790,2025-05-25 04:55:28.914215,0 days 00:00:13.521425,AdamW,0.06783932393493158,,,0.00021475707438246087,,,,2,,,0.001896160964236497,,PRUNED
917,917,37.5,2025-05-25 04:55:28.973496,2025-05-25 04:55:41.026503,0 days 00:00:12.053007,AdamW,0.04019300709906129,,,0.00015698930967779888,,,,6,,,0.005166247877375306,,PRUNED
918,918,33.333333333333336,2025-05-25 04:55:41.087071,2025-05-25 04:55:53.903895,0 days 00:00:12.816824,AdamW,0.027740470709037457,,,0.00010619414345861586,,,,1,,,0.004005689265098724,,PRUNED
